Contenido,IR,Fecha,Dispositivo,Likes,Retweets,Entidad,Hora,Foto
"#AltaVerapaz | #EjércitoGT a través de la Sexta Brigada de Infantería realiza monitoreo de los ríos San Simón II, e… https://t.co/B8922L9C2p",https://twitter.com/i/web/status/1289733476971720704,01/08/2020 19:23:17,Twitter for Android,19,4,Ejército Guatemala,19:23:17,http://pbs.twimg.com/profile_images/1254217220038766592/viO6of2l.jpg
Recuerda utilizar de forma correcta la mascarilla - Tzet Txolilal Chi Jut Ko Q'anon Smaquil Ko Ti' (Idioma Q’anjob’… https://t.co/FoYlC6fNmy,https://twitter.com/i/web/status/1289735429042737152,01/08/2020 19:31:03,Twitter Web App,11,5,Gobierno Guatemala,19:31:03,http://pbs.twimg.com/profile_images/1220379425516195840/KwahSLS-.png
El proyecto de #PresupuestoAbierto2021 y su capítulo de #ReactivaciónEconómica es importante para la recuperación d… https://t.co/tTKkNYZfWX,https://twitter.com/i/web/status/1289735934963933184,01/08/2020 19:33:03,Twitter for Android,7,3,Minfin Guatemala,19:33:03,http://pbs.twimg.com/profile_images/1219297807565230081/1USnYWKO.png
RT @GuatemalaGob: Recuerda utilizar de forma correcta la mascarilla - Tzet Txolilal Chi Jut Ko Q'anon Smaquil Ko Ti' (Idioma Q’anjob’al) #Y…,https://twitter.com/i/web/status/1289738450619576320,01/08/2020 19:43:03,Twitter for Android,0,5,Ministerio de Salud Pública,19:43:03,http://pbs.twimg.com/profile_images/1219336233689780224/jXtTZnsi.jpg
El Ministerio de Gobernación hace la cordial invitación a todas las mujeres guatemaltecas al #CyberWomenChallenge… https://t.co/HVCTnxteGv,https://twitter.com/i/web/status/1289742716885069825,01/08/2020 20:00:00,TweetDeck,5,2,MinGob,20:00:00,http://pbs.twimg.com/profile_images/1219274761961951237/aSdvPUzB.jpg
"Recuerda utilizar de forma correcta la mascarilla - Tza'n T-Ten Tu'n Tajb'en, B'oq'al Tzi'yj (Idioma Mam)… https://t.co/wNHX9Ppg2J",https://twitter.com/i/web/status/1289742715941294080,01/08/2020 20:00:00,Twitter Web App,14,6,Gobierno Guatemala,20:00:00,http://pbs.twimg.com/profile_images/1220379425516195840/KwahSLS-.png
"Primera Brigada de Infantería ""Mariscal Zavala"".

""Nacidos para vencer"" https://t.co/sBbyuYaZsu",https://twitter.com/i/web/status/1289750572015349761,01/08/2020 20:31:13,Twitter for Android,10,3,Ejército Guatemala,20:31:13,http://pbs.twimg.com/profile_images/1254217220038766592/viO6of2l.jpg
"Como parte de las medidas de prevención, contención y respuesta al COVID-19, el #EjércitoGT a través del Comando Na… https://t.co/UxdmyKcBkM",https://twitter.com/i/web/status/1289755882054496256,01/08/2020 20:52:19,Twitter for Android,6,3,Ejército Guatemala,20:52:19,http://pbs.twimg.com/profile_images/1254217220038766592/viO6of2l.jpg
"#EjércitoGT a través de la Brigada de Infantería de Marina continúa brindando apoyo al personal del @MinSaludGuate,… https://t.co/zIXPZ4G3vf",https://twitter.com/i/web/status/1289756132639010816,01/08/2020 20:53:19,Twitter for Android,8,4,Ejército Guatemala,20:53:19,http://pbs.twimg.com/profile_images/1254217220038766592/viO6of2l.jpg
"El Subdirector General de Prevención del Delito, Erick Daniel Tórtola, supervisó las sedes policiales de la zona 12… https://t.co/q2WdZypu1p",https://twitter.com/i/web/status/1289768360180355077,01/08/2020 21:41:54,Twitter for iPhone,3,0,MinGob,21:41:54,http://pbs.twimg.com/profile_images/1219274761961951237/aSdvPUzB.jpg
"#EjércitoGT apoyó operaciones en coordinación con @PNCdeGuatemala y #PMT, en cumplimiento a las disposiciones Presi… https://t.co/gLFKLALv2s",https://twitter.com/i/web/status/1289768532230586368,01/08/2020 21:42:35,Twitter for Android,6,3,Ejército Guatemala,21:42:35,http://pbs.twimg.com/profile_images/1254217220038766592/viO6of2l.jpg
"#EjércitoGT apoyó operaciones en coordinación con @PNCdeGuatemala y #PMT, en cumplimiento a las disposiciones Presi… https://t.co/fhaajEidfu",https://twitter.com/i/web/status/1289768751097774081,01/08/2020 21:43:27,Twitter for Android,9,4,Ejército Guatemala,21:43:27,http://pbs.twimg.com/profile_images/1254217220038766592/viO6of2l.jpg
"RT @GuatemalaGob: El Presidente de la República @DrGiammattei y el Gobierno de Guatemala, expresan sus más sentidas condolencias a las auto…",https://twitter.com/i/web/status/1289769907861635072,01/08/2020 21:48:03,Twitter for Android,0,12,MINEX Guatemala 🇬🇹,21:48:03,http://pbs.twimg.com/profile_images/1220460259074105355/flDmdBSG.jpg
