Contenido,IR,Fecha,Dispositivo,Likes,Retweets,Entidad,Hora,Foto
"RT @rpsp_pajph: Plan de seguro de salud: factor que más contribuye a las desigualdades en la mortalidad por #COVID19  en 🇨🇴 Colombia

👇🏽 Aq…",https://twitter.com/i/web/status/1562113628031041537,23/08/2022 10:24:46,Twitter for iPhone,0,1,OPS/OMS,10:24:46,http://pbs.twimg.com/profile_images/1096094749902028801/ijbQWupW.png
"RT @rpsp_pajph: Acceso a la atención del #cáncer en los grupos vulnerables de 🇨🇱 Chile durante la pandemia de 😷 #COVID19 
➡️ https://t.co/6…",https://twitter.com/i/web/status/1562113653318590464,23/08/2022 10:24:52,Twitter for iPhone,0,5,OPS/OMS,10:24:52,http://pbs.twimg.com/profile_images/1096094749902028801/ijbQWupW.png
"¿Sabías que puedes vacunarte contra la #COVID19 🦠 si estás embarazada 🤰🏻?

➡️ La evidencia disponible hasta ahora s… https://t.co/e3KCCrtYRn",https://twitter.com/i/web/status/1562122496047980545,23/08/2022 11:00:00,Twitter Media Studio,10,9,OPS/OMS,11:00:00,http://pbs.twimg.com/profile_images/1096094749902028801/ijbQWupW.png
"#GestiónMinfin | Las Alianzas Público-Privadas impulsan la construcción de vivienda social, indicó el Ministro de F… https://t.co/xa4nI222iE",https://twitter.com/i/web/status/1562251704522907648,23/08/2022 19:33:26,Twitter for Android,7,1,Ministerio de Finanzas de Guatemala,19:33:26,http://pbs.twimg.com/profile_images/1471837102618853383/4xfotDwN.jpg
"RT @GuatemalaGob: #InformeNacional | 23 de agosto de 2022.

✔️ Presidente @DrGiammattei entrega más de 600 #BecasMINECO de Atención Integra…",https://twitter.com/i/web/status/1562292126406287360,23/08/2022 22:14:03,Twitter for Android,0,15,Ministerio de Finanzas de Guatemala,22:14:03,http://pbs.twimg.com/profile_images/1471837102618853383/4xfotDwN.jpg
"RT @PAHOemergencies: ¿Eres personal de emergencias en salud?  

Aprende cómo implementar la metodología de la Célula de Información y Coord…",https://twitter.com/i/web/status/1562444028531970049,24/08/2022 08:17:39,Twitter for iPhone,0,3,OPS/OMS,08:17:39,http://pbs.twimg.com/profile_images/1096094749902028801/ijbQWupW.png
"RT @panaftosa_inf: 🔴EN VIVO | Presentación de Richard Bradhurst de la Universidad de Melbourne, Australia: Aplicación de herramientas de mo…",https://twitter.com/i/web/status/1562444128301895681,24/08/2022 08:18:03,Twitter for iPhone,0,4,OPS/OMS,08:18:03,http://pbs.twimg.com/profile_images/1096094749902028801/ijbQWupW.png
"RT @OPSOMS_Honduras: Trabajamos de la mano con @saludgobhn  y contamos con el apoyo financiero del pueblo y gobierno de Canadá, a fin de ll…",https://twitter.com/i/web/status/1562444591651258368,24/08/2022 08:19:54,Twitter for iPhone,0,1,OPS/OMS,08:19:54,http://pbs.twimg.com/profile_images/1096094749902028801/ijbQWupW.png
La vacuna contra la #COVID19 🦠 es segura y se recomienda 👍🏽 para las mujeres que están planeando un embarazo 🤰🏻.… https://t.co/mLpNDwUbeC,https://twitter.com/i/web/status/1562454698438733828,24/08/2022 09:00:03,Twitter Media Studio,11,5,OPS/OMS,09:00:03,http://pbs.twimg.com/profile_images/1096094749902028801/ijbQWupW.png
#GestiónMinfin | En el #Minfin brindamos asistencia técnica y financiera a las municipalidades del país para promov… https://t.co/XLdeQoY2Fn,https://twitter.com/i/web/status/1562468687902572550,24/08/2022 09:55:39,Twitter Web App,5,0,Ministerio de Finanzas de Guatemala,09:55:39,http://pbs.twimg.com/profile_images/1471837102618853383/4xfotDwN.jpg
"En lo que va del año, hemos hecho más de 320 publicaciones sobre los temas de salud pública más apremiantes en la R… https://t.co/DCc0mVZd4F",https://twitter.com/i/web/status/1562484887432712192,24/08/2022 11:00:01,Twitter Media Studio,12,7,OPS/OMS,11:00:01,http://pbs.twimg.com/profile_images/1096094749902028801/ijbQWupW.png
"Lo que debes saber de la #ViruelaSímica, también conocida como viruela del mono. 

ℹ️ https://t.co/KKU1NOfXz4 https://t.co/q2jNuMGIsj",https://twitter.com/i/web/status/1562486451748896769,24/08/2022 11:06:14,Twitter Web App,19,14,OPS/OMS,11:06:14,http://pbs.twimg.com/profile_images/1096094749902028801/ijbQWupW.png
"@WCiga Buenas tardes, por este medio puede realizar sus consultas.",https://twitter.com/i/web/status/1562510294588747776,24/08/2022 12:40:58,Twitter Web App,0,0,Migración Guatemala,12:40:58,http://pbs.twimg.com/profile_images/1547564049247809538/lN_77kRk.jpg
"#Pasaportes | En todos los servicios que brindamos tenemos atención especializada, para personas de la tercera edad. https://t.co/c30SdUTDnR",https://twitter.com/i/web/status/1562514904719888385,24/08/2022 12:59:18,Twitter for Android,3,0,Migración Guatemala,12:59:18,http://pbs.twimg.com/profile_images/1547564049247809538/lN_77kRk.jpg
"@jsechino Buenas tardes, le recomendamos hacer lo indicado vía Direct.",https://twitter.com/i/web/status/1562521148239519746,24/08/2022 13:24:06,Twitter for iPhone,0,0,Migración Guatemala,13:24:06,http://pbs.twimg.com/profile_images/1547564049247809538/lN_77kRk.jpg
"El @GuatemalaGob, a través del @ConsGuateNY, asiste en la repatriación de un connacional, que lamentablemente fue a… https://t.co/CLtNITSe3S",https://twitter.com/i/web/status/1562544194463248384,24/08/2022 14:55:41,Twitter Web App,4,4,MINEX Guatemala 🇬🇹,14:55:41,http://pbs.twimg.com/profile_images/1471828089491574785/eD5OEVK6.jpg
#ServiciosMinfin | La Dirección de Contabilidad del Estado recuerda a los 𝗽𝗲𝗻𝘀𝗶𝗼𝗻𝗮𝗱𝗼𝘀 𝗹𝗮 𝗶𝗺𝗽𝗼𝗿𝘁𝗮𝗻𝗰𝗶𝗮 𝗱𝗲 𝘀𝘂𝘀𝗽𝗲𝗻𝗱𝗲𝗿 𝘀… https://t.co/AGYi3v06cJ,https://twitter.com/i/web/status/1562544999279230977,24/08/2022 14:58:53,Twitter Web App,6,2,Ministerio de Finanzas de Guatemala,14:58:53,http://pbs.twimg.com/profile_images/1471837102618853383/4xfotDwN.jpg
"#GuatemalaModerna| Muy pronto el futuro te sorprenderá.
No te pierdas el Lanzamiento de #MarcaPaís Guatemala.
🕕18:0… https://t.co/alt95D5Ajz",https://twitter.com/i/web/status/1562546544892854274,24/08/2022 15:05:01,Twitter Web App,48,49,MINEX Guatemala 🇬🇹,15:05:01,http://pbs.twimg.com/profile_images/1471828089491574785/eD5OEVK6.jpg
#ServicioSocial | Se necesita localizar a familiares o conocidos de posible guatemalteco en situación de vulnerabil… https://t.co/1FgJfH8Rop,https://twitter.com/i/web/status/1562567631692918785,24/08/2022 16:28:49,Twitter Web App,3,4,MINEX Guatemala 🇬🇹,16:28:49,http://pbs.twimg.com/profile_images/1471828089491574785/eD5OEVK6.jpg
#ViceCancillerGT #GeovaniCastillo presidió Reuniones del Comité de Redacción para trabajar el Proyecto de Declaraci… https://t.co/zbiSPSGvH9,https://twitter.com/i/web/status/1562568741380313096,24/08/2022 16:33:13,Twitter Web App,14,3,MINEX Guatemala 🇬🇹,16:33:13,http://pbs.twimg.com/profile_images/1471828089491574785/eD5OEVK6.jpg
#Retornados | Este día se brindó atención especializada a 23 NNANA que retornaron a nuestro país. La recepción de r… https://t.co/kivakntMSV,https://twitter.com/i/web/status/1562577222552420352,24/08/2022 17:06:55,Twitter for Android,2,0,Migración Guatemala,17:06:55,http://pbs.twimg.com/profile_images/1547564049247809538/lN_77kRk.jpg
El @MinexGt participó en la reunión de la Mesa Técnica de la Coordinadora Nacional del Sistema de Alerta Alba-Kenet… https://t.co/mMCqFFsdP8,https://twitter.com/i/web/status/1562584071682674689,24/08/2022 17:34:08,Twitter for Android,6,3,MINEX Guatemala 🇬🇹,17:34:08,http://pbs.twimg.com/profile_images/1471828089491574785/eD5OEVK6.jpg
#EnDirecto | Lanzamiento de #MarcaPaísGuatemala. https://t.co/x5Ha01mkNn,https://twitter.com/i/web/status/1562593043223523329,24/08/2022 18:09:47,Twitter for Android,21,21,MINEX Guatemala 🇬🇹,18:09:47,http://pbs.twimg.com/profile_images/1471828089491574785/eD5OEVK6.jpg
"Como parte del lanzamiento #MarcaPaísGuatemala, el #Minfin y otras entidades del @GuatemalaGob iluminan sus institu… https://t.co/1FZwkcsXO1",https://twitter.com/i/web/status/1562611183026245634,24/08/2022 19:21:52,Twitter Web App,34,7,Ministerio de Finanzas de Guatemala,19:21:52,http://pbs.twimg.com/profile_images/1471837102618853383/4xfotDwN.jpg
"Primera Brigada de Infantería ""Mariscal Zavala"" del #EjércitoGT apoyó a la @ConredGuatemala en la descarga de víver… https://t.co/4eQlAAN5wH",https://twitter.com/i/web/status/1562614686109290499,24/08/2022 19:35:47,Twitter for Android,3,3,Ejército Guatemala,19:35:47,http://pbs.twimg.com/profile_images/1471838829430640640/0yNoNrwr.jpg
#Arraigos | ¿Vas a salir del país? Es importante que consultes tu estatus migratorio. En el enlace podrás conocer s… https://t.co/BgNC3OO6j6,https://twitter.com/i/web/status/1562622537494036480,24/08/2022 20:06:59,Twitter for iPhone,1,1,Migración Guatemala,20:06:59,http://pbs.twimg.com/profile_images/1547564049247809538/lN_77kRk.jpg
RT @GuatemalaGob: #EnDirecto | El presidente @DrGiammattei participa en el lanzamiento de #MarcaPaísGuatemala. https://t.co/VYsuhPFqIe,https://twitter.com/i/web/status/1562622707967356929,24/08/2022 20:07:40,Twitter Web App,0,64,Ministerio de Finanzas de Guatemala,20:07:40,http://pbs.twimg.com/profile_images/1471837102618853383/4xfotDwN.jpg
@GuatemalaGob @InguatPrensa @AGN_noticias @TGWdigital @DiariodeCA @SCSPGT En la firma del convenio interinstitucion… https://t.co/L0vlmxkqHF,https://twitter.com/i/web/status/1562631772277714945,24/08/2022 20:43:41,Twitter Web App,6,1,Ministerio de Finanzas de Guatemala,20:43:41,http://pbs.twimg.com/profile_images/1471837102618853383/4xfotDwN.jpg
La #MarcaPaísGuatemala es una estrategia del @GuatemalaGob que busca posicionar e identificar positivamente a… https://t.co/Xpm1zfacxf,https://twitter.com/i/web/status/1562631950510489600,24/08/2022 20:44:23,Twitter Web App,3,0,Ministerio de Finanzas de Guatemala,20:44:23,http://pbs.twimg.com/profile_images/1471837102618853383/4xfotDwN.jpg
"El #CancillerGT @MarioBucaroGT expresó en el lanzamiento de #MarcaPaísGuatemala: ""Hoy somos testigos de un símbolo… https://t.co/RvokUBoydP",https://twitter.com/i/web/status/1562635703246557187,24/08/2022 20:59:18,Twitter for Android,46,21,MINEX Guatemala 🇬🇹,20:59:18,http://pbs.twimg.com/profile_images/1471828089491574785/eD5OEVK6.jpg
"Ministerio de la Defensa Nacional y Tribuna Militar del #EjércitoGT fueron iluminados esta noche, en el marco de la… https://t.co/TiZXUwUWVl",https://twitter.com/i/web/status/1562656898574598149,24/08/2022 22:23:32,Twitter for Android,6,5,Ejército Guatemala,22:23:32,http://pbs.twimg.com/profile_images/1471838829430640640/0yNoNrwr.jpg
"""A pesar de la pandemia y las vicisitudes, Guatemala ha salido adelante, eso demuestra no solo la resilencia de nue… https://t.co/aTtaKY4nVQ",https://twitter.com/i/web/status/1562660309017366528,24/08/2022 22:37:05,Twitter for iPhone,15,8,Gobierno Guatemala,22:37:05,http://pbs.twimg.com/profile_images/1479793855331459074/NqurElHC.jpg
"""Esta #MarcaPaísGT nos posicionará estratégicamente como amigos y aliados en todo el plano internacional. No tengo… https://t.co/PQZZbIcqjs",https://twitter.com/i/web/status/1562661161606467584,24/08/2022 22:40:28,Twitter for iPhone,30,18,Gobierno Guatemala,22:40:28,http://pbs.twimg.com/profile_images/1479793855331459074/NqurElHC.jpg
"""En el @InguatPrensa estamos comprometidos con impulsar a Guatemala a través de su nueva #MarcaPaísGT. La pondremos… https://t.co/w8X0LJZeBP",https://twitter.com/i/web/status/1562663932887588865,24/08/2022 22:51:29,Twitter for iPhone,15,11,Gobierno Guatemala,22:51:29,http://pbs.twimg.com/profile_images/1479793855331459074/NqurElHC.jpg
"RT @DrGiammattei: Nos reunimos en La Antigua Guatemala para presentar nuestra #MarcaPaísGuatemala, distinción que representa un proyecto es…",https://twitter.com/i/web/status/1562669420870508552,24/08/2022 23:13:17,Twitter for iPhone,0,20,Gobierno Guatemala,23:13:17,http://pbs.twimg.com/profile_images/1479793855331459074/NqurElHC.jpg
"RT @GuatemalaGob: ""Esta #MarcaPaísGT nos posicionará estratégicamente como amigos y aliados en todo el plano internacional. No tengo la men…",https://twitter.com/i/web/status/1562692275901464576,25/08/2022 00:44:06,Twitter for Android,0,18,MINEX Guatemala 🇬🇹,00:44:06,http://pbs.twimg.com/profile_images/1471828089491574785/eD5OEVK6.jpg
"RT @DrGiammattei: La #MarcaPaísGuatemala materializa la visión de un futuro más sostenible, incluyente y próspero, de oportunidad para los…",https://twitter.com/i/web/status/1562763589521289216,25/08/2022 05:27:29,Twitter for iPhone,0,16,Gobierno Guatemala,05:27:29,http://pbs.twimg.com/profile_images/1479793855331459074/NqurElHC.jpg
"¡Buenos días Guatemala! 🇬🇹

Soldados de la Primera Brigada de Infantería ""Mariscal Zavala"" del #EjércitoGT |… https://t.co/EiD5Nwxsoh",https://twitter.com/i/web/status/1562774624089165824,25/08/2022 06:11:19,Twitter for Android,22,3,Ejército Guatemala,06:11:19,http://pbs.twimg.com/profile_images/1471838829430640640/0yNoNrwr.jpg
#Extranjería | En Guatemala se tiene registro de 15 mil 539 Residentes Permanentes y 5 mil 280 residentes temporale… https://t.co/10GjjM9aoq,https://twitter.com/i/web/status/1562787395065352192,25/08/2022 07:02:04,Twitter for iPhone,3,2,Migración Guatemala,07:02:04,http://pbs.twimg.com/profile_images/1547564049247809538/lN_77kRk.jpg
Soldado caído en el cumplimiento del deber. https://t.co/FOye4WZljm,https://twitter.com/i/web/status/1562797365936787457,25/08/2022 07:41:42,Twitter for Android,4,2,Ejército Guatemala,07:41:42,http://pbs.twimg.com/profile_images/1471838829430640640/0yNoNrwr.jpg
Presunto extorsionista capturado en Alta Verapaz https://t.co/2FPr7EoPPZ,https://twitter.com/i/web/status/1562802381934727169,25/08/2022 08:01:37,"<a href=""http://publicize.wp.com/"" rel=""nofollow"">WordPress.com",4,1,MinGob,08:01:37,http://pbs.twimg.com/profile_images/1471828174598246407/Y1Lm5nFE.jpg
Remiten al Instituto Guatemalteco de Migración a 98 extranjeros https://t.co/aaCJlIgZNW,https://twitter.com/i/web/status/1562802575950626817,25/08/2022 08:02:24,"<a href=""http://publicize.wp.com/"" rel=""nofollow"">WordPress.com",3,2,MinGob,08:02:24,http://pbs.twimg.com/profile_images/1471828174598246407/Y1Lm5nFE.jpg
PNC captura a presuntos extorsionistas https://t.co/UC3ywmZPYv,https://twitter.com/i/web/status/1562802748042936321,25/08/2022 08:03:05,"<a href=""http://publicize.wp.com/"" rel=""nofollow"">WordPress.com",3,2,MinGob,08:03:05,http://pbs.twimg.com/profile_images/1471828174598246407/Y1Lm5nFE.jpg
Ejecutan allanamientos en contra del narcotráfico https://t.co/06jipzHkLa,https://twitter.com/i/web/status/1562802987793149952,25/08/2022 08:04:02,"<a href=""http://publicize.wp.com/"" rel=""nofollow"">WordPress.com",5,2,MinGob,08:04:02,http://pbs.twimg.com/profile_images/1471828174598246407/Y1Lm5nFE.jpg
Brigada de Operaciones para Montaña del #EjércitoGT | #MINDEF apoya al @MinSaludGuate y al #IGSS en la organización… https://t.co/faK1doil5w,https://twitter.com/i/web/status/1562805912808525827,25/08/2022 08:15:39,Twitter for Android,5,3,Ejército Guatemala,08:15:39,http://pbs.twimg.com/profile_images/1471838829430640640/0yNoNrwr.jpg
"#TransparenciaGT 🔎 | Chatío, el asistente virtual de #Guatecompras, resuelve dudas de los proveedores y usuarios so… https://t.co/g1AMOzWCTN",https://twitter.com/i/web/status/1562809281581264898,25/08/2022 08:29:02,Twitter for Android,1,0,Ministerio de Finanzas de Guatemala,08:29:02,http://pbs.twimg.com/profile_images/1471837102618853383/4xfotDwN.jpg
#InformeNacional | 24 de agosto de 2022. https://t.co/dl5rWpweyh,https://twitter.com/i/web/status/1562809765012443136,25/08/2022 08:30:58,Twitter for iPhone,17,14,Gobierno Guatemala,08:30:58,http://pbs.twimg.com/profile_images/1479793855331459074/NqurElHC.jpg
"@Carmanywoos Buenos días, por este medio puede realizar sus consultas.",https://twitter.com/i/web/status/1562814095681695744,25/08/2022 08:48:10,Twitter for iPhone,1,0,Migración Guatemala,08:48:10,http://pbs.twimg.com/profile_images/1547564049247809538/lN_77kRk.jpg
"¿Sabías que si estás amamantando 🤱 puedes vacunarte contra la #COVID19?

➡ Además, la evidencia hasta ahora sugiere… https://t.co/8qTrTzALft",https://twitter.com/i/web/status/1562817080478638080,25/08/2022 09:00:02,Twitter Media Studio,5,4,OPS/OMS,09:00:02,http://pbs.twimg.com/profile_images/1096094749902028801/ijbQWupW.png
La Comisión Departamental de Salud y de Seguridad Alimentaria Nutricional realizó el taller “Mochila Azul” con enfo… https://t.co/6HcccAKYW1,https://twitter.com/i/web/status/1562817421123387394,25/08/2022 09:01:23,Twitter Web App,1,1,Ministerio de Salud Pública,09:01:23,http://pbs.twimg.com/profile_images/1471842908043190279/bu1LHFWL.jpg
así como sociedad civil y se ejecutó con la finalidad de intensificar el trabajo en la localidad por la nutrición.,https://twitter.com/i/web/status/1562817424084566019,25/08/2022 09:01:24,Twitter Web App,0,0,Ministerio de Salud Pública,09:01:24,http://pbs.twimg.com/profile_images/1471842908043190279/bu1LHFWL.jpg
"#EnDirectoMSPAS | Conozca los esfuerzos del personal de salud de San Felipe, #Retalhuleu, para acercar la vacuna co… https://t.co/8q0Oyocv96",https://twitter.com/i/web/status/1562817464475725825,25/08/2022 09:01:33,"<a href=""https://www.socialgest.net"" rel=""nofollow"">SocialGest",0,0,Ministerio de Salud Pública,09:01:33,http://pbs.twimg.com/profile_images/1471842908043190279/bu1LHFWL.jpg
"La Directora de Área de Salud de Sololá socializó en  intercambio de experiencia de la CODESAN, los  logros obtenid… https://t.co/YbGDJNPabI",https://twitter.com/i/web/status/1562817624014065664,25/08/2022 09:02:11,Twitter Web App,0,0,Ministerio de Salud Pública,09:02:11,http://pbs.twimg.com/profile_images/1471842908043190279/bu1LHFWL.jpg
"Con el apoyo de SESAN, Chiquimula realizó una capacitación dirigida a la Comisión Comunitaria de Salud de la Aldea… https://t.co/n6LLNbe7g1",https://twitter.com/i/web/status/1562817910841962496,25/08/2022 09:03:20,Twitter Web App,3,1,Ministerio de Salud Pública,09:03:20,http://pbs.twimg.com/profile_images/1471842908043190279/bu1LHFWL.jpg
así como las 10 acciones de la Ventana de los Mil Días para la prevención de la desnutrición.,https://twitter.com/i/web/status/1562817914121490432,25/08/2022 09:03:21,Twitter Web App,0,0,Ministerio de Salud Pública,09:03:21,http://pbs.twimg.com/profile_images/1471842908043190279/bu1LHFWL.jpg
"En el marco de la salud reproductiva, el personal del Distrito Municipal de Salud Santiago Atitlán, Sololá; abordó… https://t.co/TMVnKda2Ax",https://twitter.com/i/web/status/1562818033248129026,25/08/2022 09:03:49,Twitter Web App,0,0,Ministerio de Salud Pública,09:03:49,http://pbs.twimg.com/profile_images/1471842908043190279/bu1LHFWL.jpg
#EnDirecto | #ConferenciaDePrensaGT sobre #MarcaPaísGuatemala. https://t.co/Fom5s5xhAf,https://twitter.com/i/web/status/1562818804853665794,25/08/2022 09:06:53,"<a href=""https://periscope.tv"" rel=""nofollow"">Periscope",17,14,Gobierno Guatemala,09:06:53,http://pbs.twimg.com/profile_images/1479793855331459074/NqurElHC.jpg
#Pasaportes | ¡Atención! Ahora podrás tramitar tu pasaporte con vigencia de 10 años. El pasaporte de 10 años no apl… https://t.co/IQNN3UR919,https://twitter.com/i/web/status/1562818940975271937,25/08/2022 09:07:25,Hootsuite Inc.,5,0,Migración Guatemala,09:07:25,http://pbs.twimg.com/profile_images/1547564049247809538/lN_77kRk.jpg
#EnDirecto | #ConferenciaDePrensaGT sobre #MarcaPaísGuatemala. https://t.co/3WHNvgQjPZ,https://twitter.com/i/web/status/1562819268663656448,25/08/2022 09:08:44,Twitter for Android,11,17,MINEX Guatemala 🇬🇹,09:08:44,http://pbs.twimg.com/profile_images/1471828089491574785/eD5OEVK6.jpg
RT @GuatemalaGob: #InformeNacional | 24 de agosto de 2022. https://t.co/dl5rWpweyh,https://twitter.com/i/web/status/1562822444460564480,25/08/2022 09:21:21,Twitter Web App,0,14,MinGob,09:21:21,http://pbs.twimg.com/profile_images/1471828174598246407/Y1Lm5nFE.jpg
RT @GuatemalaGob: #InformeNacional | 24 de agosto de 2022. https://t.co/dl5rWpweyh,https://twitter.com/i/web/status/1562825563488030721,25/08/2022 09:33:44,Twitter for Android,0,14,Ministerio de Finanzas de Guatemala,09:33:44,http://pbs.twimg.com/profile_images/1471837102618853383/4xfotDwN.jpg
#Información | Se dan a conocer las obligaciones y responsabilidades de las Empresas y Extranjeros Domiciliados ant… https://t.co/Gn5ZvYvera,https://twitter.com/i/web/status/1562832406532329472,25/08/2022 10:00:56,Hootsuite Inc.,0,0,Migración Guatemala,10:00:56,http://pbs.twimg.com/profile_images/1547564049247809538/lN_77kRk.jpg
"Tercera Brigada de Infantería del #EjércitoGT apoya al @MinSaludGuate, en la organización y funcionamiento de jorna… https://t.co/jLwcK4o9nO",https://twitter.com/i/web/status/1562834239166750729,25/08/2022 10:08:13,Twitter for Android,4,3,Ejército Guatemala,10:08:13,http://pbs.twimg.com/profile_images/1471838829430640640/0yNoNrwr.jpg
Tercera Brigada de Infantería del #EjércitoGT efectuó operaciones de seguridad en el Límite Político Internacional… https://t.co/GjrV5lXF2Q,https://twitter.com/i/web/status/1562838783011131392,25/08/2022 10:26:16,Twitter for Android,5,4,Ejército Guatemala,10:26:16,http://pbs.twimg.com/profile_images/1471838829430640640/0yNoNrwr.jpg
"#ElDialogoEsElCamino
La mejor forma de prevenir la violencia es el diálogo.

#AccionesQueTransforman #AltoAlFuego… https://t.co/QGj2Pet7Fa",https://twitter.com/i/web/status/1562838978856108032,25/08/2022 10:27:03,Twitter for iPhone,1,1,MinGob,10:27:03,http://pbs.twimg.com/profile_images/1471828174598246407/Y1Lm5nFE.jpg
"#GuateAvanza | Ayer se llevó a cabo el lanzamiento de #MarcaPaisGT, una estrategia que busca potenciar a Guatemala… https://t.co/ZW09eXBWW6",https://twitter.com/i/web/status/1562839720547188736,25/08/2022 10:30:00,Twitter Web App,4,6,Gobierno Guatemala,10:30:00,http://pbs.twimg.com/profile_images/1479793855331459074/NqurElHC.jpg
"#EnDirectoMSPAS | Conozca más sobre la Jornada Integral de Salud y Nutrición en Oratorio, #SantaRosa. https://t.co/aAstgPrBay",https://twitter.com/i/web/status/1562840093173305344,25/08/2022 10:31:29,"<a href=""https://www.socialgest.net"" rel=""nofollow"">SocialGest",1,0,Ministerio de Salud Pública,10:31:29,http://pbs.twimg.com/profile_images/1471842908043190279/bu1LHFWL.jpg
"#ComunicadoOficial | Guatemala da a conocer al mundo su #MarcaPaísGT. #AsombrosaEImparable
https://t.co/AXT0yEJoXP https://t.co/yi9opwx8uN",https://twitter.com/i/web/status/1562840435155877888,25/08/2022 10:32:50,Twitter Web App,3,6,Gobierno Guatemala,10:32:50,http://pbs.twimg.com/profile_images/1479793855331459074/NqurElHC.jpg
"#Guatemala | Primera Brigada de Infantería ""Mariscal Zavala"" del #EjércitoGT apoya al @MinSaludGuate, en la organiz… https://t.co/Y2MuWnXsIU",https://twitter.com/i/web/status/1562842992331083778,25/08/2022 10:43:00,Twitter for Android,4,2,Ejército Guatemala,10:43:00,http://pbs.twimg.com/profile_images/1471838829430640640/0yNoNrwr.jpg
El MSPAS invita a la población en general a conocer sobre los beneficios de la lactancia materna en el seminario “I… https://t.co/9lRQTkZZQV,https://twitter.com/i/web/status/1562844486602231810,25/08/2022 10:48:56,"<a href=""https://www.socialgest.net"" rel=""nofollow"">SocialGest",2,1,Ministerio de Salud Pública,10:48:56,http://pbs.twimg.com/profile_images/1471842908043190279/bu1LHFWL.jpg
"El @GuatemalaGob presentó la estrategia #MarcaPaísGuatemala, estrategia para capitalizar la imagen positiva del paí… https://t.co/EBofNkayfI",https://twitter.com/i/web/status/1562848894387515392,25/08/2022 11:06:27,Twitter Web App,3,2,MINEX Guatemala 🇬🇹,11:06:27,http://pbs.twimg.com/profile_images/1471828089491574785/eD5OEVK6.jpg
"Capacitan líderes comunitarios en Puerto Barrios, Izabal https://t.co/RV46jzV4NU",https://twitter.com/i/web/status/1562850165584969728,25/08/2022 11:11:30,"<a href=""http://publicize.wp.com/"" rel=""nofollow"">WordPress.com",2,2,MinGob,11:11:30,http://pbs.twimg.com/profile_images/1471828174598246407/Y1Lm5nFE.jpg
Sib’alaj tajin uq’atexik ri narcotráfico pa Iximulew ri’ https://t.co/17OpraGa98,https://twitter.com/i/web/status/1562851705762762753,25/08/2022 11:17:37,"<a href=""http://publicize.wp.com/"" rel=""nofollow"">WordPress.com",1,0,MinGob,11:17:37,http://pbs.twimg.com/profile_images/1471828174598246407/Y1Lm5nFE.jpg
Xya’taj uchuq’ab’ nab’ejsab’al q’atenik k’ax xuquje’ ri ch’ijom k’axchak xuquje’ ri k’ax chi ke ri ak’alab’ https://t.co/s24aoKyM9z,https://twitter.com/i/web/status/1562851842069254147,25/08/2022 11:18:10,"<a href=""http://publicize.wp.com/"" rel=""nofollow"">WordPress.com",1,0,MinGob,11:18:10,http://pbs.twimg.com/profile_images/1471828174598246407/Y1Lm5nFE.jpg
RT @MINECOGT: 🔍Conoce las diferentes actividades de la #RutadelEmprendedorGT del @VICEMIPYME del 22 al 26 de agosto ⬇️ https://t.co/D4ngWOz…,https://twitter.com/i/web/status/1562851854286917632,25/08/2022 11:18:13,Twitter Web App,0,3,Gobierno Guatemala,11:18:13,http://pbs.twimg.com/profile_images/1479793855331459074/NqurElHC.jpg
Eri nuk’chomab’al rech kub’an utzil chi ke ri nan kuk’ ri kal pache’ tojb’al mak ri’ https://t.co/AbdnatOKCB,https://twitter.com/i/web/status/1562851966018940928,25/08/2022 11:18:39,"<a href=""http://publicize.wp.com/"" rel=""nofollow"">WordPress.com",0,0,MinGob,11:18:39,http://pbs.twimg.com/profile_images/1471828174598246407/Y1Lm5nFE.jpg
"#MSPAS | Acude a tu puesto de vacunación contra COVID-19  más cercano. Recuerda que la vacuna es gratis, segura y p… https://t.co/6ENHEGxwfT",https://twitter.com/i/web/status/1562852565682835457,25/08/2022 11:21:02,"<a href=""https://www.socialgest.net"" rel=""nofollow"">SocialGest",0,0,Ministerio de Salud Pública,11:21:02,http://pbs.twimg.com/profile_images/1471842908043190279/bu1LHFWL.jpg
