Contenido,IR,Fecha,Dispositivo,Likes,Retweets,Entidad,Hora,Foto
"#GestiónMinfin | Tras la aprobación de la Ley de Emergencia para la Atención de la Pandemia COVID-19, el Ministro i… https://t.co/uWLVyUmdXc",https://twitter.com/i/web/status/1437575071388815361,13/09/2021 18:33:00,Twitter Web App,3,2,Ministerio de Finanzas Guatemala,18:33:00,http://pbs.twimg.com/profile_images/1292831294796320768/6Q8j5vtW.jpg
"El Ministro de Finanzas Públicas, @alvarogricci, concede una entrevista al Canal 9 del @CongresoGuate para hablar s… https://t.co/Z66LAo3tAF",https://twitter.com/i/web/status/1437791605382172684,14/09/2021 08:53:26,Twitter Web App,7,3,Ministerio de Finanzas Guatemala,08:53:26,http://pbs.twimg.com/profile_images/1292831294796320768/6Q8j5vtW.jpg
El Ministro indica que el gasto público obedece a las necesidades de la población y confía en que la Comisión de Fi… https://t.co/3WIGB7scsT,https://twitter.com/i/web/status/1437792761625907201,14/09/2021 08:58:01,Twitter Web App,0,0,Ministerio de Finanzas Guatemala,08:58:01,http://pbs.twimg.com/profile_images/1292831294796320768/6Q8j5vtW.jpg
"Durante la entrevista, el Ministro asegura que el #Presupuesto2022 es una herramienta para fortalecer la transparen… https://t.co/0MPYo77A5B",https://twitter.com/i/web/status/1437794005320884227,14/09/2021 09:02:58,Twitter Web App,0,0,Ministerio de Finanzas Guatemala,09:02:58,http://pbs.twimg.com/profile_images/1292831294796320768/6Q8j5vtW.jpg
"El Titular del #MinfinGT confirma que el Presupuesto del @MinSaludGuate se está fortaleciendo en un 50%, porque es… https://t.co/WW6mtT2Gtb",https://twitter.com/i/web/status/1437797310625374221,14/09/2021 09:16:06,Twitter Web App,0,0,Ministerio de Finanzas Guatemala,09:16:06,http://pbs.twimg.com/profile_images/1292831294796320768/6Q8j5vtW.jpg
"También menciona que el #Presupuesto2022 está priorizando al @MPguatemala y el trabajo de sus 340 Fiscalías, al… https://t.co/evL7idmWeO",https://twitter.com/i/web/status/1437797751065137156,14/09/2021 09:17:51,Twitter Web App,1,0,Ministerio de Finanzas Guatemala,09:17:51,http://pbs.twimg.com/profile_images/1292831294796320768/6Q8j5vtW.jpg
"¡Ojalá que remonte su vuelo, más que el cóndor y el águila real y en sus alas levante hasta el cielo, Guatemala tu… https://t.co/vsaNaHIJ0p",https://twitter.com/i/web/status/1437894196334153730,14/09/2021 15:41:05,Twitter Web App,71,27,Gobierno Guatemala,15:41:05,http://pbs.twimg.com/profile_images/1371488309743120384/QqlgsWUm.jpg
"RT @DrGiammattei: Mi llamado en esta fecha histórica es a la unidad para dar paso al compromiso de reconstruir a nuestro país, desde lo más…",https://twitter.com/i/web/status/1437914024323305472,14/09/2021 16:59:53,Twitter Web App,0,26,Gobierno Guatemala,16:59:53,http://pbs.twimg.com/profile_images/1371488309743120384/QqlgsWUm.jpg
El presidente @DrGiammattei y Gobierno de Guatemala lamentan el sensible fallecimiento del señor Byron Alexander Pa… https://t.co/caeWwPDV1a,https://twitter.com/i/web/status/1437915341087252483,14/09/2021 17:05:07,Twitter Web App,8,4,Gobierno Guatemala,17:05:07,http://pbs.twimg.com/profile_images/1371488309743120384/QqlgsWUm.jpg
#EnDirecto | Presidente @DrGiammattei participa en los actos conmemorativos del Bicentenario de independencia de la… https://t.co/0DNba2CpCG,https://twitter.com/i/web/status/1437916898188955651,14/09/2021 17:11:18,"<a href=""https://periscope.tv"" rel=""nofollow"">Periscope",68,38,Gobierno Guatemala,17:11:18,http://pbs.twimg.com/profile_images/1371488309743120384/QqlgsWUm.jpg
#InformeNacional | Presidente @DrGiammattei llama a la unidad en conmemoración del bicentenario. https://t.co/xkGixGStqY,https://twitter.com/i/web/status/1437979659703095296,14/09/2021 21:20:41,Twitter Media Studio,39,15,Gobierno Guatemala,21:20:41,http://pbs.twimg.com/profile_images/1371488309743120384/QqlgsWUm.jpg
"RT @DrGiammattei: Conmemoramos este Bicentenario que, a pesar de su desarrollo y origen, permitió que hoy existamos como un país libre, sob…",https://twitter.com/i/web/status/1438002864186662921,14/09/2021 22:52:54,Twitter Web App,0,48,Gobierno Guatemala,22:52:54,http://pbs.twimg.com/profile_images/1371488309743120384/QqlgsWUm.jpg
"Celebremos con fervor patrio a #Guatemala y el orgullo de pertenecer a nuestro hermoso país. 
#200años🇬🇹… https://t.co/ojcpcARZCJ",https://twitter.com/i/web/status/1438125553152843783,15/09/2021 07:00:25,Twitter for Android,4,2,Ministerio de Finanzas Guatemala,07:00:25,http://pbs.twimg.com/profile_images/1292831294796320768/6Q8j5vtW.jpg
Oficinas municipales articularan esfuerzos para prevenir violencia https://t.co/kdCos6TmQf,https://twitter.com/i/web/status/1438130053666295814,15/09/2021 07:18:18,"<a href=""http://publicize.wp.com/"" rel=""nofollow"">WordPress.com",7,3,MinGob,07:18:18,http://pbs.twimg.com/profile_images/1371480777330941958/_81AGCXa.jpg
¡Guatemala tu nombre inmortal! #200AñosBicentenario 🇬🇹 https://t.co/iTuOyswUXz,https://twitter.com/i/web/status/1438132999074242562,15/09/2021 07:30:00,Twitter Media Studio,137,37,Gobierno Guatemala,07:30:00,http://pbs.twimg.com/profile_images/1371488309743120384/QqlgsWUm.jpg
"*Libre al viento tu hermosa bandera” 🇬🇹

#200AñosBicentenario https://t.co/hQ78wzT9e0",https://twitter.com/i/web/status/1438144321967071237,15/09/2021 08:15:00,Twitter Media Studio,33,6,MinGob,08:15:00,http://pbs.twimg.com/profile_images/1371480777330941958/_81AGCXa.jpg
"El Ministro de Gobernación, Gendri Rocael Reyes en seguimiento al compromiso de la seguridad ciudadana, se une a la… https://t.co/oJYzLpeJ4h",https://twitter.com/i/web/status/1438159576273141767,15/09/2021 09:15:37,Twitter Media Studio,26,15,MinGob,09:15:37,http://pbs.twimg.com/profile_images/1371480777330941958/_81AGCXa.jpg
Autoridades de Gobernación destacan logros en el SP https://t.co/bUQlNzFMtS,https://twitter.com/i/web/status/1438166193593102336,15/09/2021 09:41:55,"<a href=""http://publicize.wp.com/"" rel=""nofollow"">WordPress.com",6,2,MinGob,09:41:55,http://pbs.twimg.com/profile_images/1371480777330941958/_81AGCXa.jpg
"RT @MESICIC: NOW I 🇬🇹GUATEMALA presents various portals for greater transparency and to facilitate complaint mechanisms.

📌https://t.co/uTX…",https://twitter.com/i/web/status/1438166698754985999,15/09/2021 09:43:55,Twitter for Android,0,2,Ministerio de Finanzas Guatemala,09:43:55,http://pbs.twimg.com/profile_images/1292831294796320768/6Q8j5vtW.jpg
"En el Ministerio de Finanzas Públicas nos sentimos orgullosos de ser guatemaltecos. 

¡Guatemala tu nombre inmortal… https://t.co/vTizMFL9nh",https://twitter.com/i/web/status/1438168980187930630,15/09/2021 09:52:59,Twitter for Android,4,1,Ministerio de Finanzas Guatemala,09:52:59,http://pbs.twimg.com/profile_images/1292831294796320768/6Q8j5vtW.jpg
"🌎 Hoy en día, los niños/as y adolescentes de nuestra región corren el riesgo de convertirse en la generación que pe… https://t.co/oBsXJwqsWp",https://twitter.com/i/web/status/1438171070528475136,15/09/2021 10:01:17,Twitter Web App,20,13,OPS/OMS,10:01:17,http://pbs.twimg.com/profile_images/1096094749902028801/ijbQWupW.png
"🌎 Los países deben actuar urgentemente ahora para restaurar la salud, la educación y los servicios sociales para mi… https://t.co/5WdnLR1dWs",https://twitter.com/i/web/status/1438171245611212807,15/09/2021 10:01:59,Twitter Web App,9,7,OPS/OMS,10:01:59,http://pbs.twimg.com/profile_images/1096094749902028801/ijbQWupW.png
"¿Sabías que, en los últimos 20 años, la mortalidad de personas de más de 65 años 👵🏿🧓🏻 por causa del calor 🌡 ha subi… https://t.co/7EXcRuWjdQ",https://twitter.com/i/web/status/1438178297364434952,15/09/2021 10:30:00,Twitter Web App,8,5,OPS/OMS,10:30:00,http://pbs.twimg.com/profile_images/1096094749902028801/ijbQWupW.png
"#NoticiasMinfin 📰

Conoce algunas de las acciones más importantes que  realiza el Ministerio de Finanzas Públicas p… https://t.co/BC6VekLpka",https://twitter.com/i/web/status/1438189597062832129,15/09/2021 11:14:54,Twitter for Android,4,0,Ministerio de Finanzas Guatemala,11:14:54,http://pbs.twimg.com/profile_images/1292831294796320768/6Q8j5vtW.jpg
"""Ave indiana que vive en tu escudo” 🟢

#200AñosBicentenario https://t.co/o11OrZU2dv",https://twitter.com/i/web/status/1438189619552546817,15/09/2021 11:15:00,Twitter Media Studio,24,4,MinGob,11:15:00,http://pbs.twimg.com/profile_images/1371480777330941958/_81AGCXa.jpg
"RT @OPSOMS_Col: El diálogo con la medicina tradicional es una de la claves para entender el estado de salud de los pueblos indígenas. 

Hoy…",https://twitter.com/i/web/status/1438214116569722880,15/09/2021 12:52:20,Twitter for iPhone,0,7,OPS/OMS,12:52:20,http://pbs.twimg.com/profile_images/1096094749902028801/ijbQWupW.png
"RT @OPSOMS_Col: “Nos preparamos para recibir la #COVID19, la soportamos, la resistimos y después la dejamos ir. La vacuna complementó la fo…",https://twitter.com/i/web/status/1438214240612110338,15/09/2021 12:52:50,Twitter for iPhone,0,3,OPS/OMS,12:52:50,http://pbs.twimg.com/profile_images/1096094749902028801/ijbQWupW.png
RT @OPSOMS_Col: 📌 En la Semana del Bienestar queremos compartirles esta historia que muestra el espíritu solidario de los pueblos indígenas…,https://twitter.com/i/web/status/1438214288305496065,15/09/2021 12:53:01,Twitter for iPhone,0,3,OPS/OMS,12:53:01,http://pbs.twimg.com/profile_images/1096094749902028801/ijbQWupW.png
"El Puesto de vacunación ubicado en la Aldea Boca del Monte, Villa Canales, jurisdicción del Área de Salud Guatemala… https://t.co/T9gZSrO1Si",https://twitter.com/i/web/status/1438231032478801929,15/09/2021 13:59:33,Twitter for Android,36,4,Ministerio de Salud Pública,13:59:33,http://pbs.twimg.com/profile_images/1311755159027015685/QQcxgYd1.jpg
"Esto contribuye significativamente al avance del Plan Nacional, diseñado para la distribución del biológico contra… https://t.co/QUntyrO6jK",https://twitter.com/i/web/status/1438231044080214020,15/09/2021 13:59:36,Twitter for Android,7,1,Ministerio de Salud Pública,13:59:36,http://pbs.twimg.com/profile_images/1311755159027015685/QQcxgYd1.jpg
"“Cimbra marimba, tu canto melodías de cristal” 🎵

#200AñosBicentenario https://t.co/rsGeqkrCmA",https://twitter.com/i/web/status/1438234917935009793,15/09/2021 14:15:00,Twitter Media Studio,3,1,MinGob,14:15:00,http://pbs.twimg.com/profile_images/1371480777330941958/_81AGCXa.jpg
"Demuestra tu amor por Guatemala 🇬🇹
Limpiando frecuentemente tus manos 🤲🏻💧

¡Cuidarnos es responsabilidad de todos!… https://t.co/9SWhNT1xwQ",https://twitter.com/i/web/status/1438238694356525056,15/09/2021 14:30:00,Twitter Web App,6,1,Ministerio de Salud Pública,14:30:00,http://pbs.twimg.com/profile_images/1311755159027015685/QQcxgYd1.jpg
RT @MINECOGT: #200años🇬🇹 En este bicentenario queremos recordar que el servicio público es una expresión de amor al país y toda la labor qu…,https://twitter.com/i/web/status/1438239968854487041,15/09/2021 14:35:04,Twitter for Android,0,6,Gobierno Guatemala,14:35:04,http://pbs.twimg.com/profile_images/1371488309743120384/QqlgsWUm.jpg
"Acompáñanos en este seminario de la OMS, coordinado por Programa Regional de Bioética de la OPS.

🗓 Sept. 17, 2021… https://t.co/llMfwOtwDa",https://twitter.com/i/web/status/1438243602031910912,15/09/2021 14:49:30,Twitter Web App,11,9,OPS/OMS,14:49:30,http://pbs.twimg.com/profile_images/1096094749902028801/ijbQWupW.png
#ExtensiónVigencia | ⚠️ Las personas que no podrán optar a esta alternativa son quienes cuentan con los siguientes… https://t.co/bngrqSCGXP,https://twitter.com/i/web/status/1438246289041416193,15/09/2021 15:00:11,Hootsuite Inc.,0,0,Migración Guatemala,15:00:11,http://pbs.twimg.com/profile_images/1346129009051054081/v9JUwo36.jpg
"El año pasado se registraron más de 1,5 millones de casos de #COVID19 en niños, niñas y adolescentes en la región 🌎… https://t.co/0QPsOZ87Zw",https://twitter.com/i/web/status/1438253529299357698,15/09/2021 15:28:57,Twitter Web App,55,49,OPS/OMS,15:28:57,http://pbs.twimg.com/profile_images/1096094749902028801/ijbQWupW.png
"Juntos construimos una mejor Guatemala, el Ministerio de Gobernación se une a la conmemoración de los… https://t.co/khXzte0cMS",https://twitter.com/i/web/status/1438254876761460744,15/09/2021 15:34:18,Twitter Media Studio,7,1,MinGob,15:34:18,http://pbs.twimg.com/profile_images/1371480777330941958/_81AGCXa.jpg
"Demuestra tu amor por Guatemala 🇬🇹
Vacunándote cuando sea tu momento 💉

¡Cuidarnos es responsabilidad de todos!… https://t.co/6rWm6jNBkJ",https://twitter.com/i/web/status/1438261348035559425,15/09/2021 16:00:01,Twitter Web App,4,1,Ministerio de Salud Pública,16:00:01,http://pbs.twimg.com/profile_images/1311755159027015685/QQcxgYd1.jpg
#ControlMigratorio |  Puedes descargar nuestros formularios de forma gratuita en https://t.co/h9drWvrvgu https://t.co/8yGKPlEVte,https://twitter.com/i/web/status/1438261416478261254,15/09/2021 16:00:17,Hootsuite Inc.,1,0,Migración Guatemala,16:00:17,http://pbs.twimg.com/profile_images/1346129009051054081/v9JUwo36.jpg
"Gracias al apoyo interinstitucional, el Centro de Salud y la Municipalidad de San Juan Sacatepequez, se inaugura un… https://t.co/uAxG7nMeqt",https://twitter.com/i/web/status/1438262477851172884,15/09/2021 16:04:31,Twitter for Android,4,1,Ministerio de Salud Pública,16:04:31,http://pbs.twimg.com/profile_images/1311755159027015685/QQcxgYd1.jpg
"Con este nuevo espacio para la administración del biológico contra COVID-19, se pretende beneficiar a más de 500 pe… https://t.co/JQVSUCVlC2",https://twitter.com/i/web/status/1438262486311055365,15/09/2021 16:04:33,Twitter for Android,3,0,Ministerio de Salud Pública,16:04:33,http://pbs.twimg.com/profile_images/1311755159027015685/QQcxgYd1.jpg
"💉💉💉 ""Nos alienta que más del 30% de las personas en América Latina y el Caribe hayan sido vacunadas contra la… https://t.co/S7YJxDY4ZY",https://twitter.com/i/web/status/1438266667373666307,15/09/2021 16:21:09,Twitter Media Studio,46,16,OPS/OMS,16:21:09,http://pbs.twimg.com/profile_images/1096094749902028801/ijbQWupW.png
Las vacunas COVID-19🦠 son el resultado de investigación científica de décadas ✅ y son monitoreadas continuamente pa… https://t.co/eAugQjq6rT,https://twitter.com/i/web/status/1438268892523241478,15/09/2021 16:30:00,Twitter Web App,37,19,OPS/OMS,16:30:00,http://pbs.twimg.com/profile_images/1096094749902028801/ijbQWupW.png
RT @Catalonia_MX: 🎉La Delegación @Catalonia_MX en México y #Centroamérica felicita al gobierno y al pueblo de #Guatemala en la conmemoració…,https://twitter.com/i/web/status/1438271053021827072,15/09/2021 16:38:35,Twitter Web App,0,6,MINEX Guatemala 🇬🇹,16:38:35,http://pbs.twimg.com/profile_images/1292832595093475329/6LQbTy36.jpg
@SwedeninGT @samuelgalicia_ @CRcancilleria @CancilleriaHN @cancilleriasv Gracias @SwedeninGT  por su fraternal salu… https://t.co/9SOwr3wAYt,https://twitter.com/i/web/status/1438272037215260677,15/09/2021 16:42:30,Twitter Web App,0,0,MINEX Guatemala 🇬🇹,16:42:30,http://pbs.twimg.com/profile_images/1292832595093475329/6LQbTy36.jpg
"#DiplomaciaCulturalGT | Con motivo de la conmemoración de los #200AñosBicentenario Independencia de Guatemala, la A… https://t.co/9g12lIhkhS",https://twitter.com/i/web/status/1438274194723250179,15/09/2021 16:51:04,Twitter Web App,8,3,MINEX Guatemala 🇬🇹,16:51:04,http://pbs.twimg.com/profile_images/1292832595093475329/6LQbTy36.jpg
"#ControlMigratorio | Nuestros formularios no tienen costo, puedes descargarlos en el siguiente enlace… https://t.co/V7auEMPWJJ",https://twitter.com/i/web/status/1438276494745341956,15/09/2021 17:00:12,Hootsuite Inc.,0,0,Migración Guatemala,17:00:12,http://pbs.twimg.com/profile_images/1346129009051054081/v9JUwo36.jpg
Viceministro Rodas supervisa entrenamiento de aspirantes a COAN https://t.co/Ra7vk8vp0U,https://twitter.com/i/web/status/1438279366212005889,15/09/2021 17:11:37,"<a href=""http://publicize.wp.com/"" rel=""nofollow"">WordPress.com",16,4,MinGob,17:11:37,http://pbs.twimg.com/profile_images/1371480777330941958/_81AGCXa.jpg
"“Tu hermosura cautiva a propios y extraños” ⚪

#200AñosBicentenario https://t.co/ytC27Si8rD",https://twitter.com/i/web/status/1438280216523141120,15/09/2021 17:15:00,Twitter Media Studio,8,1,MinGob,17:15:00,http://pbs.twimg.com/profile_images/1371480777330941958/_81AGCXa.jpg
#EnDirecto | Solemne arriada del Pabellón Nacional de Guatemala https://t.co/hkkHZk8AqR,https://twitter.com/i/web/status/1438286680046260225,15/09/2021 17:40:41,"<a href=""https://periscope.tv"" rel=""nofollow"">Periscope",74,32,Gobierno Guatemala,17:40:41,http://pbs.twimg.com/profile_images/1371488309743120384/QqlgsWUm.jpg
"Demuestra tu amor por Guatemala 🇬🇹
Guardando el distanciamiento físico entre personas ↔️

¡Cuidarnos es responsabil… https://t.co/QDZ6O1eUs7",https://twitter.com/i/web/status/1438287766392123394,15/09/2021 17:45:00,Twitter Web App,18,2,Ministerio de Salud Pública,17:45:00,http://pbs.twimg.com/profile_images/1311755159027015685/QQcxgYd1.jpg
Continuamos con el Plan Nacional de Vacunación contra COVID-19. El personal del Distrito de Salud San Francisco Pet… https://t.co/6mwXc3BhbJ,https://twitter.com/i/web/status/1438287772595458049,15/09/2021 17:45:01,Twitter for Android,4,0,Ministerio de Salud Pública,17:45:01,http://pbs.twimg.com/profile_images/1311755159027015685/QQcxgYd1.jpg
RT @GuatemalaGob: #EnDirecto | Solemne arriada del Pabellón Nacional de Guatemala https://t.co/hkkHZk8AqR,https://twitter.com/i/web/status/1438288533882609671,15/09/2021 17:48:03,Twitter for iPhone,0,32,MinGob,17:48:03,http://pbs.twimg.com/profile_images/1371480777330941958/_81AGCXa.jpg
#ExtensiónVigencia | 🎥 Conoce el proceso para realizar el trámite de Extensión de Pasaportes. https://t.co/r2nrTpzh3K,https://twitter.com/i/web/status/1438291578146205696,15/09/2021 18:00:09,Hootsuite Inc.,0,0,Migración Guatemala,18:00:09,http://pbs.twimg.com/profile_images/1346129009051054081/v9JUwo36.jpg
"RT @EmbaguateCorea: La noche del 15 de septiembre de 2021, la Torre Namsan, el segundo punto más alto de Seúl, se iluminó de blanco y azul,…",https://twitter.com/i/web/status/1438302432002547715,15/09/2021 18:43:16,Twitter Web App,0,106,MINEX Guatemala 🇬🇹,18:43:16,http://pbs.twimg.com/profile_images/1292832595093475329/6LQbTy36.jpg
"RT @DiplomaciacGT: #DiplomaciaCulturalGT | Conmemoremos las fiestas patrias de Guatemala🇬🇹, acompañados por la Marimba Femenina de Conciert…",https://twitter.com/i/web/status/1438303504167211009,15/09/2021 18:47:32,Twitter Web App,0,3,MINEX Guatemala 🇬🇹,18:47:32,http://pbs.twimg.com/profile_images/1292832595093475329/6LQbTy36.jpg
"Demuestra tu amor por Guatemala 🇬🇹
Vacunándote cuando sea tu momento  💉

¡Cuidarnos es responsabilidad de todos!… https://t.co/4rcha9yrgd",https://twitter.com/i/web/status/1438306641255047173,15/09/2021 19:00:00,Twitter Web App,8,1,Ministerio de Salud Pública,19:00:00,http://pbs.twimg.com/profile_images/1311755159027015685/QQcxgYd1.jpg
#ControlMigratorio | Descarga nuestros formularios de forma gratuita y sencilla https://t.co/h9drWvrvgu https://t.co/iBLcz4mTZH,https://twitter.com/i/web/status/1438306672531935232,15/09/2021 19:00:07,Hootsuite Inc.,2,0,Migración Guatemala,19:00:07,http://pbs.twimg.com/profile_images/1346129009051054081/v9JUwo36.jpg
"RT @DiplomaciacGT: #200AñosBicentenario | No se pierda la Iluminación de Las Cataratas del Niágara con los colores de Guatemala 🇬🇹

🗓️ Miér…",https://twitter.com/i/web/status/1438313616328044549,15/09/2021 19:27:43,Twitter Web App,0,5,MINEX Guatemala 🇬🇹,19:27:43,http://pbs.twimg.com/profile_images/1292832595093475329/6LQbTy36.jpg
"RT @EmbaGuateTaiwan: El rascacielos Taipie 101,  uno de los más altos del mundo, rindió homenaje a la conmemoración del #BicentenarioGt con…",https://twitter.com/i/web/status/1438314958853451782,15/09/2021 19:33:03,Twitter Web App,0,28,MINEX Guatemala 🇬🇹,19:33:03,http://pbs.twimg.com/profile_images/1292832595093475329/6LQbTy36.jpg
"#Australia ilumina Torre Telstra en Canberra, en ocasión del Bicentenario de Independencia de Guatemala #200años🇬🇹… https://t.co/KtvjURuqSV",https://twitter.com/i/web/status/1438316964817014784,15/09/2021 19:41:01,Twitter Web App,14,3,MINEX Guatemala 🇬🇹,19:41:01,http://pbs.twimg.com/profile_images/1292832595093475329/6LQbTy36.jpg
RT @EmbaGuateCanada: La @EmbaGuateCanada engalana la conmemoración del #BicentenarioGuatemala en las Cataratas del Niagara de Canadá con la…,https://twitter.com/i/web/status/1438317432435843074,15/09/2021 19:42:53,Twitter Web App,0,7,MINEX Guatemala 🇬🇹,19:42:53,http://pbs.twimg.com/profile_images/1292832595093475329/6LQbTy36.jpg
¡Guatemala tu nombre inmortal! https://t.co/AlEPRJvCa9,https://twitter.com/i/web/status/1438320478674894852,15/09/2021 19:54:59,Twitter for Android,71,22,Ejército Guatemala,19:54:59,http://pbs.twimg.com/profile_images/1400165461548048384/3Vbvt8E2.jpg
#ExtensiónVigencia | ¿Te urge viajar y no puedes esperar la fecha de tu cita? Ahora podrás extender la vigencia eme… https://t.co/mMxbxpJsOG,https://twitter.com/i/web/status/1438321744620789762,15/09/2021 20:00:01,Hootsuite Inc.,0,0,Migración Guatemala,20:00:01,http://pbs.twimg.com/profile_images/1346129009051054081/v9JUwo36.jpg
#EjércitoGT | #MINDEF apoyó con seguridad a familias migrantes desde la frontera El Ceibo hasta la frontera Cinchad… https://t.co/UWP2HQD3bc,https://twitter.com/i/web/status/1438327029452136454,15/09/2021 20:21:01,Twitter for Android,10,3,Ejército Guatemala,20:21:01,http://pbs.twimg.com/profile_images/1400165461548048384/3Vbvt8E2.jpg
#Aviso | Compartimos la nueva ubicación del Departamento de Reconocimiento de Estatus de Refugiado. https://t.co/3S7NZyOhgD,https://twitter.com/i/web/status/1438336857516003330,15/09/2021 21:00:04,Hootsuite Inc.,2,0,Migración Guatemala,21:00:04,http://pbs.twimg.com/profile_images/1346129009051054081/v9JUwo36.jpg
"@focusoble Buenas noches, le comentamos que el Instituto Guatemalteco de Migración atiende casos de
 emergencia, si… https://t.co/Nsr4Yo2ws3",https://twitter.com/i/web/status/1438339790219448321,15/09/2021 21:11:43,Twitter for iPhone,0,0,Migración Guatemala,21:11:43,http://pbs.twimg.com/profile_images/1346129009051054081/v9JUwo36.jpg
"Ejército del Bicentenario 🇬🇹💂‍♂️
#365DíasAlServicioDeMiPatria https://t.co/iP9mFqLVfS",https://twitter.com/i/web/status/1438339821408333828,15/09/2021 21:11:51,Twitter for Android,21,3,Ejército Guatemala,21:11:51,http://pbs.twimg.com/profile_images/1400165461548048384/3Vbvt8E2.jpg
"#NotaDeDuelo | Lamentamos el fallecimiento de Fredy Crocker, esposo de la Dra. Delia Fuentes, Directora del Centro… https://t.co/2fPksLAau1",https://twitter.com/i/web/status/1438340096307105795,15/09/2021 21:12:56,Twitter for Android,10,0,Ministerio de Salud Pública,21:12:56,http://pbs.twimg.com/profile_images/1311755159027015685/QQcxgYd1.jpg
"Brigada de Infantería de Marina del #EjércitoGT | #MINDEF participó en acto de Arriada de la Bandera Nacional, en e… https://t.co/MPGUITOvVy",https://twitter.com/i/web/status/1438340852665946113,15/09/2021 21:15:57,Twitter for Android,11,0,Ejército Guatemala,21:15:57,http://pbs.twimg.com/profile_images/1400165461548048384/3Vbvt8E2.jpg
"Quinta Brigada de Infantería del #EjércitoGT | #MINDEF participó en acto de Arriada de la Bandera Nacional, en el d… https://t.co/hFvBN5vg4o",https://twitter.com/i/web/status/1438342567586844673,15/09/2021 21:22:45,Twitter for Android,16,1,Ejército Guatemala,21:22:45,http://pbs.twimg.com/profile_images/1400165461548048384/3Vbvt8E2.jpg
"Brigada de Operaciones para Montaña del #EjércitoGT | #MINDEF participó en acto de Arriada de la Bandera Nacional,… https://t.co/buFwnGPCJC",https://twitter.com/i/web/status/1438344419044954112,15/09/2021 21:30:07,Twitter for Android,10,1,Ejército Guatemala,21:30:07,http://pbs.twimg.com/profile_images/1400165461548048384/3Vbvt8E2.jpg
"Primera Brigada de Policía Militar ""Guardia de Honor"" del #EjércitoGT | #MINDEF participó en acto de Arriada de la… https://t.co/HwUvdlQ3SE",https://twitter.com/i/web/status/1438344835786813441,15/09/2021 21:31:46,Twitter for Android,18,3,Ejército Guatemala,21:31:46,http://pbs.twimg.com/profile_images/1400165461548048384/3Vbvt8E2.jpg
"Brigada de Fuerzas Especiales del #EjércitoGT | #MINDEF participó en acto de Arriada de la Bandera Nacional, en el… https://t.co/ByTDdVFOHC",https://twitter.com/i/web/status/1438345315116011525,15/09/2021 21:33:40,Twitter for Android,20,2,Ejército Guatemala,21:33:40,http://pbs.twimg.com/profile_images/1400165461548048384/3Vbvt8E2.jpg
RT @DrGiammattei: Histórica arriada de nuestro Pabellón Nacional en conmemoración del Bicentenario de Independencia. Vivimos con mucho ferv…,https://twitter.com/i/web/status/1438349061191618561,15/09/2021 21:48:34,Twitter for iPhone,0,15,Gobierno Guatemala,21:48:34,http://pbs.twimg.com/profile_images/1371488309743120384/QqlgsWUm.jpg
#ControlMigratorio| Pasos para descargar formularios de Control Migratorio.👇 https://t.co/YKcSuyVqCO,https://twitter.com/i/web/status/1438351978514554881,15/09/2021 22:00:09,Hootsuite Inc.,3,1,Migración Guatemala,22:00:09,http://pbs.twimg.com/profile_images/1346129009051054081/v9JUwo36.jpg
"La Brigada Móvil de vacunación contra el COVID-19, visita cada casa del municipio de Palencia, #Guatemala, con la f… https://t.co/M3VNXRgjoP",https://twitter.com/i/web/status/1438354147598872579,15/09/2021 22:08:46,Twitter for Android,9,1,Ejército Guatemala,22:08:46,http://pbs.twimg.com/profile_images/1400165461548048384/3Vbvt8E2.jpg
