Contenido,IR,Fecha,Dispositivo,Likes,Retweets,Entidad,Hora,Foto
"#Transparencia I ¿Eres un ciudadano interesado en conocer en qué se invierten los recursos públicos?
Te facilitamos… https://t.co/AZ2QCeAeGU",https://twitter.com/i/web/status/1371240861762224129,14/03/2021 17:24:32,Twitter for Android,7,2,Minfin Guatemala,17:24:32,http://pbs.twimg.com/profile_images/1292831294796320768/6Q8j5vtW.jpg
#FinanzasPersonales | Ahorrar te dará soporte para enfrentar emergencias económicas y te permitirá realizar tus sue… https://t.co/3C8cFgYNjQ,https://twitter.com/i/web/status/1371550509031645184,15/03/2021 13:54:58,Twitter Web App,2,1,Minfin Guatemala,13:54:58,http://pbs.twimg.com/profile_images/1292831294796320768/6Q8j5vtW.jpg
"#TransparenciaGT  |  El portal del Índice Consolidado #FinancieroMunicipal, es un instrumento de análisis, monitore… https://t.co/5P0DQu409N",https://twitter.com/i/web/status/1371601246130470912,15/03/2021 17:16:34,Twitter Web App,4,4,Minfin Guatemala,17:16:34,http://pbs.twimg.com/profile_images/1292831294796320768/6Q8j5vtW.jpg
"#GestiónMinfin  | El Embajador de la @usembassyguate, William W. Popp, reconoció las gestiones del Ministro… https://t.co/nepYfuisfM",https://twitter.com/i/web/status/1371867573680283652,16/03/2021 10:54:52,Twitter Web App,17,4,Minfin Guatemala,10:54:52,http://pbs.twimg.com/profile_images/1292831294796320768/6Q8j5vtW.jpg
El objetivo del programa #UmbralGuatemala es apoyar las reformas impulsadas por el @GuatemalaGob para mejorar la ca… https://t.co/9e9xiKkZwn,https://twitter.com/i/web/status/1371879618261745664,16/03/2021 11:42:43,Twitter Web App,4,1,Minfin Guatemala,11:42:43,http://pbs.twimg.com/profile_images/1292831294796320768/6Q8j5vtW.jpg
"El proyecto beneficiará a 13 establecimientos educativos del ciclo diversificado que cuentan con peritos técnicos,… https://t.co/KX8j7YrX4P",https://twitter.com/i/web/status/1371879619394146305,16/03/2021 11:42:44,Twitter Web App,4,1,Minfin Guatemala,11:42:44,http://pbs.twimg.com/profile_images/1292831294796320768/6Q8j5vtW.jpg
"#ReactivaciónEconómica  |  Guatemala destaca como uno de los países con mejor desempeño económico en la región, gra… https://t.co/jhf4p8UCp2",https://twitter.com/i/web/status/1371957687852875782,16/03/2021 16:52:57,Twitter for Android,3,1,Minfin Guatemala,16:52:57,http://pbs.twimg.com/profile_images/1292831294796320768/6Q8j5vtW.jpg
#FinanzasPersonales | La tarjeta de crédito es un instrumento de utilidad cuando la administras de forma correcta.… https://t.co/1Htf44D2v9,https://twitter.com/i/web/status/1371982953178353664,16/03/2021 18:33:20,Twitter for Android,4,2,Minfin Guatemala,18:33:20,http://pbs.twimg.com/profile_images/1292831294796320768/6Q8j5vtW.jpg
"RT @conamigua1: Con la finalidad de fortalecer la coordinación interinstitucional, brindar atención integral y proteger a #migrantes guatem…",https://twitter.com/i/web/status/1372037683711721472,16/03/2021 22:10:49,Twitter for Android,0,3,Migración Guatemala,22:10:49,http://pbs.twimg.com/profile_images/1346129009051054081/v9JUwo36.jpg
"#VisitaOficialCorea | #CancillerGt @PedroBroloGT se reunió con el Presidente de Corea, @moonriver365, junto al Canc… https://t.co/TNsMUYtigs",https://twitter.com/i/web/status/1372042926763749377,16/03/2021 22:31:39,Twitter Web App,13,1,MINEX Guatemala 🇬🇹,22:31:39,http://pbs.twimg.com/profile_images/1292832595093475329/6LQbTy36.jpg
Durante la reunión destacaron la voluntad de avanzar para que Guatemala forme parte del #TLC ya vigente entre Corea… https://t.co/raeSKWJptZ,https://twitter.com/i/web/status/1372043169651638274,16/03/2021 22:32:37,Twitter Web App,5,0,MINEX Guatemala 🇬🇹,22:32:37,http://pbs.twimg.com/profile_images/1292832595093475329/6LQbTy36.jpg
"En el marco de la #VisitaOficialACorea, el #CancillerGT @PedroBroloGT y la delegación que le acompaña se reunieron… https://t.co/E3wJLZNfeT",https://twitter.com/i/web/status/1372046888267091973,16/03/2021 22:47:24,Twitter Web App,13,0,MINEX Guatemala 🇬🇹,22:47:24,http://pbs.twimg.com/profile_images/1292832595093475329/6LQbTy36.jpg
"...De las tendencias de comercio en el exterior y las características del sector textil guatemalteco, con el fin de… https://t.co/cRbAfeNrNG",https://twitter.com/i/web/status/1372047524987613187,16/03/2021 22:49:56,Twitter Web App,5,0,MINEX Guatemala 🇬🇹,22:49:56,http://pbs.twimg.com/profile_images/1292832595093475329/6LQbTy36.jpg
El #CancillerGt @PedroBroloGT se reunió con el Presidente de @gggi_hq Ban Ki-moon para conversar sobre… https://t.co/waNjqRVi6S,https://twitter.com/i/web/status/1372084351077335042,17/03/2021 01:16:16,Twitter for iPhone,16,2,MINEX Guatemala 🇬🇹,01:16:16,http://pbs.twimg.com/profile_images/1292832595093475329/6LQbTy36.jpg
El Canciller @PedroBroloGT hizo mención de que el 2021 es un año vital para la reconstrucción y… https://t.co/IcCHhL2USu,https://twitter.com/i/web/status/1372084353874923524,17/03/2021 01:16:16,Twitter for iPhone,1,0,MINEX Guatemala 🇬🇹,01:16:16,http://pbs.twimg.com/profile_images/1292832595093475329/6LQbTy36.jpg
@PedroBroloGT remarcó la preocupación por la vulnerabilidad de países como Guatemala al #CambioClimatico y la neces… https://t.co/Z8ROHP5c4d,https://twitter.com/i/web/status/1372085905972924428,17/03/2021 01:22:26,Twitter for iPhone,4,0,MINEX Guatemala 🇬🇹,01:22:26,http://pbs.twimg.com/profile_images/1292832595093475329/6LQbTy36.jpg
#VisitaOficialCorea Ban Ki-moon se refirió a la necesidad de los países de establecer estrategias y políticas de ad… https://t.co/wXUp4obkbx,https://twitter.com/i/web/status/1372087416496984066,17/03/2021 01:28:26,Twitter for iPhone,11,0,MINEX Guatemala 🇬🇹,01:28:26,http://pbs.twimg.com/profile_images/1292832595093475329/6LQbTy36.jpg
2/2 la cooperación bilateral y la participación activa en organizaciones internacionales multilaterales enfocadas e… https://t.co/f78LX8qxDN,https://twitter.com/i/web/status/1372087418757771268,17/03/2021 01:28:27,Twitter for iPhone,1,0,MINEX Guatemala 🇬🇹,01:28:27,http://pbs.twimg.com/profile_images/1292832595093475329/6LQbTy36.jpg
"#IGM | ¡Migración Segura! Promovemos una migración regular y ordenada, respetando las leyes migratorias vigentes en… https://t.co/zUZ3EO5Arn",https://twitter.com/i/web/status/1372171148654489611,17/03/2021 07:01:10,Hootsuite Inc.,3,0,Migración Guatemala,07:01:10,http://pbs.twimg.com/profile_images/1346129009051054081/v9JUwo36.jpg
#Pasaportes | ¡Buenas noticias! Se estarán programando hasta 500 citas diarias para emisión de pasaportes. https://t.co/pk2CT5o5Jw,https://twitter.com/i/web/status/1372186147955310593,17/03/2021 08:00:46,Hootsuite Inc.,0,0,Migración Guatemala,08:00:46,http://pbs.twimg.com/profile_images/1346129009051054081/v9JUwo36.jpg
#Arraigos | En el siguiente enlace encuentras los requisitos para solicitar información de arraigos ➡️… https://t.co/fW25rwbR1L,https://twitter.com/i/web/status/1372202344234897413,17/03/2021 09:05:07,Hootsuite Inc.,0,0,Migración Guatemala,09:05:07,http://pbs.twimg.com/profile_images/1346129009051054081/v9JUwo36.jpg
#Pasaportes | ¡La cita para el pasaporte No tiene costo! Se realiza en https://t.co/4Gtec7fyKe https://t.co/tObwGU4xfK,https://twitter.com/i/web/status/1372216397837795336,17/03/2021 10:00:58,Hootsuite Inc.,1,0,Migración Guatemala,10:00:58,http://pbs.twimg.com/profile_images/1346129009051054081/v9JUwo36.jpg
"#GestiónMinfin⎪Miles de familias guatemaltecas, afectadas por la pandemia del #COVID19, fueron beneficiadas con los… https://t.co/OnHpG7bgWV",https://twitter.com/i/web/status/1372227795640844290,17/03/2021 10:46:15,Twitter Web App,3,1,Minfin Guatemala,10:46:15,http://pbs.twimg.com/profile_images/1292831294796320768/6Q8j5vtW.jpg
#Arraigos | Compartimos requisitos para solicitar información de arraigos a través de un abogado: 👇 https://t.co/46MrkxKYVw,https://twitter.com/i/web/status/1372231465304535045,17/03/2021 11:00:50,Hootsuite Inc.,0,0,Migración Guatemala,11:00:50,http://pbs.twimg.com/profile_images/1346129009051054081/v9JUwo36.jpg
"El principal objetivo de la vacuna contra el #COVID19 es prevenir la enfermedad, disminuir su gravedad y mortalidad… https://t.co/VunLl0oDUt",https://twitter.com/i/web/status/1372234244597166085,17/03/2021 11:11:53,Twitter Web App,4,3,Ministerio de Salud Pública,11:11:53,http://pbs.twimg.com/profile_images/1311755159027015685/QQcxgYd1.jpg
"RT @DrGiammattei: Tuve el gusto de participar en la primera Convención Nacional de Líderes Cristianos, se abordaron temas como la libertad…",https://twitter.com/i/web/status/1372236377157480454,17/03/2021 11:20:21,Twitter Web App,0,66,Gobierno Guatemala,11:20:21,http://pbs.twimg.com/profile_images/1371488309743120384/QqlgsWUm.jpg
"El Gobierno del presidente @DrGiammattei, expresa su profunda gratitud al pueblo y Gobierno de Brasil por el apoyo… https://t.co/7uNm3RzPHB",https://twitter.com/i/web/status/1372237689903329280,17/03/2021 11:25:34,Twitter Web App,59,16,Gobierno Guatemala,11:25:34,http://pbs.twimg.com/profile_images/1371488309743120384/QqlgsWUm.jpg
"RT @CpccOficial: Las alertas de corrupción se reciben con datos personales o de forma anónima, por medio de formulario en https://t.co/9Ogs…",https://twitter.com/i/web/status/1372238018556354561,17/03/2021 11:26:53,Twitter Web App,0,2,Gobierno Guatemala,11:26:53,http://pbs.twimg.com/profile_images/1371488309743120384/QqlgsWUm.jpg
"El presidente @DrGiammattei participó en la primera Convención Nacional de Líderes Cristianos #Conalic, cuyo objeti… https://t.co/qlXnmQPrVt",https://twitter.com/i/web/status/1372241856629735433,17/03/2021 11:42:08,Twitter Web App,29,7,Gobierno Guatemala,11:42:08,http://pbs.twimg.com/profile_images/1371488309743120384/QqlgsWUm.jpg
El #MSPAS te comparte algunas recomendaciones de actividad física para adultos mayores 🏃‍♂️🏋️‍♂️🤸‍♀️… https://t.co/2DmD734XAH,https://twitter.com/i/web/status/1372246416878354439,17/03/2021 12:00:15,Twitter Web App,0,0,Ministerio de Salud Pública,12:00:15,http://pbs.twimg.com/profile_images/1311755159027015685/QQcxgYd1.jpg
"#Pasaportes | La demanda para el trámite de pasaporte es alta, por lo que recomendamos que realicen la cita con suf… https://t.co/XZ4IjdRfrW",https://twitter.com/i/web/status/1372246555063943174,17/03/2021 12:00:48,Hootsuite Inc.,3,0,Migración Guatemala,12:00:48,http://pbs.twimg.com/profile_images/1346129009051054081/v9JUwo36.jpg
"#VacunaCOVID19 | Conoce los efectos secundarios de la vacuna contra el COVID-19 💉

El Consejo Nacional de Prácticas… https://t.co/4w9RkFFjRA",https://twitter.com/i/web/status/1372261590855192581,17/03/2021 13:00:33,Twitter Web App,2,1,Ministerio de Salud Pública,13:00:33,http://pbs.twimg.com/profile_images/1311755159027015685/QQcxgYd1.jpg
#Arraigos | Compartimos requisitos para solicitar información de arraigos a terceras personas: 👇 https://t.co/ooH4o65BK5,https://twitter.com/i/web/status/1372261630986358785,17/03/2021 13:00:42,Hootsuite Inc.,1,0,Migración Guatemala,13:00:42,http://pbs.twimg.com/profile_images/1346129009051054081/v9JUwo36.jpg
⚠️ En el tablero COVID-19 los fallecidos reportados el día anterior se visualizan por la fecha de defunción. Estos… https://t.co/6JBAW9l1WB,https://twitter.com/i/web/status/1372272087717584901,17/03/2021 13:42:15,Twitter for Android,2,1,Ministerio de Salud Pública,13:42:15,http://pbs.twimg.com/profile_images/1311755159027015685/QQcxgYd1.jpg
#Actualización| #MSPAS informa este 17 de marzo de 2021 los casos confirmados por laboratorio en el tablero Situaci… https://t.co/C6SXkvepBO,https://twitter.com/i/web/status/1372272085704278019,17/03/2021 13:42:15,Twitter for Android,6,2,Ministerio de Salud Pública,13:42:15,http://pbs.twimg.com/profile_images/1311755159027015685/QQcxgYd1.jpg
El #MSPAS informa la cantidad de personas que han recibido la primera dosis de la vacuna contra el #COVID19. Contin… https://t.co/LOsYzKAB10,https://twitter.com/i/web/status/1372272640354889737,17/03/2021 13:44:27,Twitter for Android,3,0,Ministerio de Salud Pública,13:44:27,http://pbs.twimg.com/profile_images/1311755159027015685/QQcxgYd1.jpg
"RT @cepal_onu: Subsecretaria @marthadelgado en #ForoALC2030: Reafirmamos la importancia de la coordinación multilateral entre los Estados,…",https://twitter.com/i/web/status/1372277424730349577,17/03/2021 14:03:28,Twitter for iPhone,0,12,OPS/OMS,14:03:28,http://pbs.twimg.com/profile_images/1096094749902028801/ijbQWupW.png
"RT @cepal_onu: .@daniInnerarity de @globernanceIGD, en el #ForoALC2030: La crisis confirmó que tenemos sistemas políticos con una cortedad…",https://twitter.com/i/web/status/1372277508058591233,17/03/2021 14:03:48,Twitter for iPhone,0,8,OPS/OMS,14:03:48,http://pbs.twimg.com/profile_images/1096094749902028801/ijbQWupW.png
"RT @cepal_onu: Sin salud, no hay economía. Y si la salud se agrava al punto en que hemos visto en algunas olas de esta pandemia del #COVID1…",https://twitter.com/i/web/status/1372277517197971464,17/03/2021 14:03:50,Twitter for iPhone,0,13,OPS/OMS,14:03:50,http://pbs.twimg.com/profile_images/1096094749902028801/ijbQWupW.png
"RT @cepal_onu: Los países ricos acapararon 3/4 partes del total de vacunas producidas hasta ahora, generando mayor desigualdad con los país…",https://twitter.com/i/web/status/1372277544200851456,17/03/2021 14:03:56,Twitter for iPhone,0,17,OPS/OMS,14:03:56,http://pbs.twimg.com/profile_images/1096094749902028801/ijbQWupW.png
RT @cepal_onu: En 2020 apoyamos a más de 20 países de #ALC por un monto de alrededor de 60 mil millones de dólares. En 2021 estamos dispues…,https://twitter.com/i/web/status/1372277645568843777,17/03/2021 14:04:21,Twitter for iPhone,0,3,OPS/OMS,14:04:21,http://pbs.twimg.com/profile_images/1096094749902028801/ijbQWupW.png
"RT @cepal_onu: .@DrJoyStJohn, Directora Ejecutiva del Organismo de Salud Pública del #Caribe, destacó en el #ForoALC2030 la sólida gobernan…",https://twitter.com/i/web/status/1372277670260654090,17/03/2021 14:04:26,Twitter for iPhone,0,4,OPS/OMS,14:04:26,http://pbs.twimg.com/profile_images/1096094749902028801/ijbQWupW.png
RT @cepal_onu: .@DirOPSPAHO en #ForoALC2030: La crisis social y económica actual ha sido generada por una crisis sanitaria. Las estrategias…,https://twitter.com/i/web/status/1372277684894568461,17/03/2021 14:04:30,Twitter for iPhone,0,12,OPS/OMS,14:04:30,http://pbs.twimg.com/profile_images/1096094749902028801/ijbQWupW.png
"RT @cepal_onu: La vida, la salud y el bienestar constituyen pre-requisitos para la recuperación sostenible. Se requieren acciones urgentes…",https://twitter.com/i/web/status/1372277729819832329,17/03/2021 14:04:41,Twitter for iPhone,0,5,OPS/OMS,14:04:41,http://pbs.twimg.com/profile_images/1096094749902028801/ijbQWupW.png
RT @cepal_onu: Sin transformar los sistemas alimentarios de #ALC no tenemos posibilidad de cumplir los ODS 1 y 2: poner fin a la #pobreza y…,https://twitter.com/i/web/status/1372277765018427395,17/03/2021 14:04:49,Twitter for iPhone,0,41,OPS/OMS,14:04:49,http://pbs.twimg.com/profile_images/1096094749902028801/ijbQWupW.png
"Hoy podemos decir que el incendio forestal en el Volcán 🌋 de Atitlán ya se encuentra controlado al 100%. 

Agradece… https://t.co/QuPcba1TSV",https://twitter.com/i/web/status/1372281751150731264,17/03/2021 14:20:39,Twitter Web App,20,8,MINEX Guatemala 🇬🇹,14:20:39,http://pbs.twimg.com/profile_images/1292832595093475329/6LQbTy36.jpg
"Durante las operaciones de erradicación de plantaciones de ilícitos en Las Cruces, #Petén, unidades militares del… https://t.co/cNzA1MIHlX",https://twitter.com/i/web/status/1372282393663574028,17/03/2021 14:23:13,Twitter for Android,16,6,Ejército Guatemala,14:23:13,http://pbs.twimg.com/profile_images/1371454438775398402/KrPRUXA_.jpg
"El soldado ya está recibiendo la atención médica especializada.
#365DíasAlServicioDeMiPatria https://t.co/7uySnW8Ufl",https://twitter.com/i/web/status/1372282408700088321,17/03/2021 14:23:16,Twitter for Android,11,3,Ejército Guatemala,14:23:16,http://pbs.twimg.com/profile_images/1371454438775398402/KrPRUXA_.jpg
"Comando Naval del Caribe del #EjércitoGT | #MINDEF finalizó capacitación sobre ""Injerto de Rambután y Cacao"", la cu… https://t.co/ohMhOPWRmT",https://twitter.com/i/web/status/1372284754045833221,17/03/2021 14:32:35,Twitter for Android,6,1,Ejército Guatemala,14:32:35,http://pbs.twimg.com/profile_images/1371454438775398402/KrPRUXA_.jpg
"RT @Segeplan: #PilaresDelDesarrollo | Pilar Economía, competitividad y prosperidad. La Política General de Gobierno (PGG) 2020-2024 reconoc…",https://twitter.com/i/web/status/1372285978296135694,17/03/2021 14:37:27,Twitter Web App,0,5,Gobierno Guatemala,14:37:27,http://pbs.twimg.com/profile_images/1371488309743120384/QqlgsWUm.jpg
"Reservas Militares de #Chimaltenango del #EjércitoGT participó en reunión interinstitucional de coordinación, sobre… https://t.co/mRePVEftBS",https://twitter.com/i/web/status/1372287692956897281,17/03/2021 14:44:16,Twitter for Android,3,1,Ejército Guatemala,14:44:16,http://pbs.twimg.com/profile_images/1371454438775398402/KrPRUXA_.jpg
"#NoticiasMSPAS | Avanza campaña de vacunación contra el COVID-19

Estudiantes de ciencias de la salud y afines que… https://t.co/LzdrFcDbfR",https://twitter.com/i/web/status/1372287876143009792,17/03/2021 14:45:00,Twitter Web App,4,2,Ministerio de Salud Pública,14:45:00,http://pbs.twimg.com/profile_images/1311755159027015685/QQcxgYd1.jpg
#Arraigos | Compartimos  requisitos para obtener una certificación de carencia de arraigos: 👇 https://t.co/2GPEy67x4G,https://twitter.com/i/web/status/1372291788438872064,17/03/2021 15:00:32,Hootsuite Inc.,1,0,Migración Guatemala,15:00:32,http://pbs.twimg.com/profile_images/1346129009051054081/v9JUwo36.jpg
➡️ El Fondo Rotatorio de la OPS entregará alrededor de 728 mil vacunas #COVID19 adquiridas mediante COVAX a 5️⃣ paí… https://t.co/5TIzOIMm4B,https://twitter.com/i/web/status/1372292724993445892,17/03/2021 15:04:16,"<a href=""https://ads-api.twitter.com"" rel=""nofollow"">Twitter for Advertisers (legacy)",14,4,OPS/OMS,15:04:16,http://pbs.twimg.com/profile_images/1096094749902028801/ijbQWupW.png
"Mediante la inversión en Defensa para  el 2021 se prevé, el equipamiento de soldados, adquisición de armamento para… https://t.co/obA2NKVN61",https://twitter.com/i/web/status/1372293937424183296,17/03/2021 15:09:05,Twitter for Android,4,1,Ejército Guatemala,15:09:05,http://pbs.twimg.com/profile_images/1371454438775398402/KrPRUXA_.jpg
#EnDirecto | Presidente @DrGiammattei participa en la entrega de alimentos por parte del @midesgt en el departament… https://t.co/q80uQ7GMoc,https://twitter.com/i/web/status/1372294708244873216,17/03/2021 15:12:09,"<a href=""https://periscope.tv"" rel=""nofollow"">Periscope",21,11,Gobierno Guatemala,15:12:09,http://pbs.twimg.com/profile_images/1371488309743120384/QqlgsWUm.jpg
"#VacunaCOVID19 💉
FASE 1| Subfase 1C. Estudiantes de ciencias de la salud y afines que realizan practicas en estable… https://t.co/eN2OciF3f5",https://twitter.com/i/web/status/1372299203850821635,17/03/2021 15:30:00,Twitter Web App,8,1,Ministerio de Salud Pública,15:30:00,http://pbs.twimg.com/profile_images/1311755159027015685/QQcxgYd1.jpg
"Luis Gonzalo Gutiérrez, alias “Licenciado”, se convirtió en el capturado No. 27 con fines de extradición en… https://t.co/me6ukTPwrh",https://twitter.com/i/web/status/1372304777409925126,17/03/2021 15:52:09,Twitter Web App,27,6,Gobierno Guatemala,15:52:09,http://pbs.twimg.com/profile_images/1371488309743120384/QqlgsWUm.jpg
"Felicitamos al equipo de #Ciclismo del #EjércitoGT: Melvin Boron, Sergio Geovani Chumil y Víctor Tuiz Tuy por su so… https://t.co/RiN2f465Va",https://twitter.com/i/web/status/1372311469333831687,17/03/2021 16:18:45,Twitter for Android,2,1,Ejército Guatemala,16:18:45,http://pbs.twimg.com/profile_images/1371454438775398402/KrPRUXA_.jpg
Soldado del #EjércitoGT que resultó herido tras agresión por parte de pobladores durante operaciones de erradicació… https://t.co/ydGVcgKTGE,https://twitter.com/i/web/status/1372313382016155648,17/03/2021 16:26:21,Twitter for Android,9,2,Ejército Guatemala,16:26:21,http://pbs.twimg.com/profile_images/1371454438775398402/KrPRUXA_.jpg
"#VacunaCOVID19 💉
Echiri’ kopon ri aq’iij, chakojo’ awe ri kunab’al. 

🗣️Idioma: Achí https://t.co/HEaWhx4fTA",https://twitter.com/i/web/status/1372314300354678784,17/03/2021 16:30:00,Twitter Web App,6,2,Ministerio de Salud Pública,16:30:00,http://pbs.twimg.com/profile_images/1311755159027015685/QQcxgYd1.jpg
"RT @MinexGt: Hoy podemos decir que el incendio forestal en el Volcán 🌋 de Atitlán ya se encuentra controlado al 100%. 

Agradecemos al Pueb…",https://twitter.com/i/web/status/1372317398938890253,17/03/2021 16:42:18,Twitter Web App,0,8,Gobierno Guatemala,16:42:18,http://pbs.twimg.com/profile_images/1371488309743120384/QqlgsWUm.jpg
"#VisitaOficialCorea | El Gobierno de Guatemala, a través del @MinexGt, busca aumentar las inversiones coreanas en e… https://t.co/UlzWFqUUp2",https://twitter.com/i/web/status/1372318457602187267,17/03/2021 16:46:31,Twitter Web App,2,3,Gobierno Guatemala,16:46:31,http://pbs.twimg.com/profile_images/1371488309743120384/QqlgsWUm.jpg
Subdirección de Salud Policial capacita a personal del Distrito Oriente https://t.co/9Q2zN8vqLW,https://twitter.com/i/web/status/1372320032835919874,17/03/2021 16:52:46,"<a href=""http://publicize.wp.com/"" rel=""nofollow"">WordPress.com",7,1,MinGob,16:52:46,http://pbs.twimg.com/profile_images/1371480777330941958/_81AGCXa.jpg
Tercer Viceministerio y PNC reciben donación de kits de primeros auxilios y purificadores de agua https://t.co/B8Lx3V2Bnb,https://twitter.com/i/web/status/1372320502920937473,17/03/2021 16:54:39,"<a href=""http://publicize.wp.com/"" rel=""nofollow"">WordPress.com",4,2,MinGob,16:54:39,http://pbs.twimg.com/profile_images/1371480777330941958/_81AGCXa.jpg
K’o jun mexicano xchapataj loq https://t.co/Toc9OgBBJn,https://twitter.com/i/web/status/1372320805762301954,17/03/2021 16:55:51,"<a href=""http://publicize.wp.com/"" rel=""nofollow"">WordPress.com",3,1,MinGob,16:55:51,http://pbs.twimg.com/profile_images/1371480777330941958/_81AGCXa.jpg
"K’o Q102,100 chi pwaqil xriqitaj pa tzukunem pa Izab’al ri’ https://t.co/rFZjxf1T2T",https://twitter.com/i/web/status/1372320959915511808,17/03/2021 16:56:27,"<a href=""http://publicize.wp.com/"" rel=""nofollow"">WordPress.com",2,1,MinGob,16:56:27,http://pbs.twimg.com/profile_images/1371480777330941958/_81AGCXa.jpg
Xchapataj jun b’anol k’ax ajtoq’il pwaq ri’ https://t.co/JncBWhKxKp,https://twitter.com/i/web/status/1372321063279923204,17/03/2021 16:56:52,"<a href=""http://publicize.wp.com/"" rel=""nofollow"">WordPress.com",2,1,MinGob,16:56:52,http://pbs.twimg.com/profile_images/1371480777330941958/_81AGCXa.jpg
Katajin uchomaxik rech uq’atexik ri ch’a’ojinem chi rij ri k’amq’aq’ xuquje’ resaxik je’lalaj taq ab’aj https://t.co/fEH1BrMKsB,https://twitter.com/i/web/status/1372321369422200850,17/03/2021 16:58:05,"<a href=""http://publicize.wp.com/"" rel=""nofollow"">WordPress.com",2,1,MinGob,16:58:05,http://pbs.twimg.com/profile_images/1371480777330941958/_81AGCXa.jpg
"#YoDenuncio | La violencia no es BROMA, denuncia si eres víctima ó conoces información sobre casos de violencia con… https://t.co/smVNmXUe45",https://twitter.com/i/web/status/1372321856150065153,17/03/2021 17:00:01,Twitter Media Studio,1,0,MinGob,17:00:01,http://pbs.twimg.com/profile_images/1371480777330941958/_81AGCXa.jpg
"#NoticiasMSPAS | @usembassyguate dona ventiladores portátiles para atención de pacientes #COVID19 

Más información… https://t.co/aIzwIy5Jyg",https://twitter.com/i/web/status/1372321856913608708,17/03/2021 17:00:01,Twitter Web App,2,1,Ministerio de Salud Pública,17:00:01,http://pbs.twimg.com/profile_images/1311755159027015685/QQcxgYd1.jpg
Capturan a dos personas en Izabal con cigarros de contrabando https://t.co/vMQOcm4TSf,https://twitter.com/i/web/status/1372323039157878788,17/03/2021 17:04:43,"<a href=""http://publicize.wp.com/"" rel=""nofollow"">WordPress.com",2,1,MinGob,17:04:43,http://pbs.twimg.com/profile_images/1371480777330941958/_81AGCXa.jpg
"#YoDenuncio | La violencia no es BROMA, denuncia si eres víctima ó conoces información sobre casos de violencia con… https://t.co/RwklQJ4n3M",https://twitter.com/i/web/status/1372324366814351362,17/03/2021 17:10:00,Twitter Media Studio,1,0,MinGob,17:10:00,http://pbs.twimg.com/profile_images/1371480777330941958/_81AGCXa.jpg
"#RecuperaciónYControl
En Puerto Barrios, Izabal, investigadores de la #DEIC localizaron el vehículo P-188GDF marca… https://t.co/zSilgxL55D",https://twitter.com/i/web/status/1372326455481409541,17/03/2021 17:18:18,Twitter for iPhone,3,2,MinGob,17:18:18,http://pbs.twimg.com/profile_images/1371480777330941958/_81AGCXa.jpg
"Brigada de Artillería de Campaña ""Santa Bárbara"" del #EjércitoGT | #MINDEF recibe capacitación sobre ""Técnicas Bási… https://t.co/LRAfN5nbUw",https://twitter.com/i/web/status/1372329863256887299,17/03/2021 17:31:50,Twitter for Android,3,1,Ejército Guatemala,17:31:50,http://pbs.twimg.com/profile_images/1371454438775398402/KrPRUXA_.jpg
"Cuerpo de Ingenieros del #EjércitoGT | #MINDEF inició trabajos de instalación de un puente tipo rural, ubicado en l… https://t.co/GXx0dM9r3s",https://twitter.com/i/web/status/1372336617956970496,17/03/2021 17:58:41,Twitter for Android,0,0,Ejército Guatemala,17:58:41,http://pbs.twimg.com/profile_images/1371454438775398402/KrPRUXA_.jpg
