Contenido,IR,Fecha,Dispositivo,Likes,Retweets,Entidad,Hora,Foto
#GestiónMinfin | El ICAE mide el crecimiento de la actividad económica. Esto dijo el Ministro de Finanzas Públicas… https://t.co/GeNC3SE0Yv,https://twitter.com/i/web/status/1390795298520322048,07/05/2021 16:26:53,Twitter Web App,4,2,Ministerio de Finanzas Guatemala,16:26:53,http://pbs.twimg.com/profile_images/1292831294796320768/6Q8j5vtW.jpg
"Descarga la guía práctica que te ayudará a realizar gestiones ante el #RGAE 🇬🇹

👉 https://t.co/ZpzbjQgSSM https://t.co/r4VHowe4dw",https://twitter.com/i/web/status/1391087856874147841,08/05/2021 11:49:24,Twitter for Android,4,3,Ministerio de Finanzas Guatemala,11:49:24,http://pbs.twimg.com/profile_images/1292831294796320768/6Q8j5vtW.jpg
"#ReactivaciónEconómica 🇬🇹 | La
construcción de la Zona de Desarrollo
Económico Especial Pública #ZDEEP,
promoverá e… https://t.co/mY2yBf2Zav",https://twitter.com/i/web/status/1391143758205526016,08/05/2021 15:31:32,Twitter for Android,1,0,Ministerio de Finanzas Guatemala,15:31:32,http://pbs.twimg.com/profile_images/1292831294796320768/6Q8j5vtW.jpg
#GestiónMinfin I Artistas guatemaltecos trabajan en la elaboración de un timbre en conmemoración del… https://t.co/5HGqR0WMau,https://twitter.com/i/web/status/1391192102214807555,08/05/2021 18:43:38,Twitter for Android,4,1,Ministerio de Finanzas Guatemala,18:43:38,http://pbs.twimg.com/profile_images/1292831294796320768/6Q8j5vtW.jpg
"#ControlYRecaudación | ¡Ejerce tu
derecho y denuncia! 📲 https://t.co/fTPCZa3dKX",https://twitter.com/i/web/status/1391453454170791939,09/05/2021 12:02:10,Twitter for Android,7,2,Ministerio de Finanzas Guatemala,12:02:10,http://pbs.twimg.com/profile_images/1292831294796320768/6Q8j5vtW.jpg
#GestiónMinfin | El Ministerio de Finanzas invita a los empleados municipales a participar en la capacitaciones sob… https://t.co/El1Y968Koc,https://twitter.com/i/web/status/1391782598406463492,10/05/2021 09:50:04,Twitter Web App,3,1,Ministerio de Finanzas Guatemala,09:50:04,http://pbs.twimg.com/profile_images/1292831294796320768/6Q8j5vtW.jpg
"El #CancillerGT @PedroBroloGT se reunió con Alta Comisionada Adjunta @KellyTClements de #ACNUR, reconociendo y agra… https://t.co/t9CsaLmsBZ",https://twitter.com/i/web/status/1391871514778103811,10/05/2021 15:43:23,Twitter Web App,17,3,MINEX Guatemala 🇬🇹,15:43:23,http://pbs.twimg.com/profile_images/1292832595093475329/6LQbTy36.jpg
#GestiónMinfin  |  La Ley de #ZonasFrancas es una herramienta importante para incentivar la inversión e impulsar la… https://t.co/tL0z4JP31V,https://twitter.com/i/web/status/1391884754153312271,10/05/2021 16:36:00,Twitter for Android,36,9,Ministerio de Finanzas Guatemala,16:36:00,http://pbs.twimg.com/profile_images/1292831294796320768/6Q8j5vtW.jpg
"#PromotoresCulturales

#DiplomaciaCulturalGt https://t.co/sg4YTxv8nh",https://twitter.com/i/web/status/1391908835770634244,10/05/2021 18:11:41,Twitter for iPhone,2,0,MINEX Guatemala 🇬🇹,18:11:41,http://pbs.twimg.com/profile_images/1292832595093475329/6LQbTy36.jpg
Para fortalecer la cooperación bilateral y la generación de acciones en materia migratoria se llevó a cabo la mesa… https://t.co/YxsOn0sll0,https://twitter.com/i/web/status/1391927954037432322,10/05/2021 19:27:39,Twitter for Android,8,3,MINEX Guatemala 🇬🇹,19:27:39,http://pbs.twimg.com/profile_images/1292832595093475329/6LQbTy36.jpg
"El #CancillerGT @PedroBroloGT reconoció la labor de #ACNUR, que se ha convertido en un aliado estratégico para 𝗚𝘂𝗮𝘁… https://t.co/Kl1gekMWpe",https://twitter.com/i/web/status/1392116641488592905,11/05/2021 07:57:26,Twitter Web App,11,2,MINEX Guatemala 🇬🇹,07:57:26,http://pbs.twimg.com/profile_images/1292832595093475329/6LQbTy36.jpg
El @GuatemalaGob sigue con especial atención y con suma preocupación los más recientes acontecimientos suscitados e… https://t.co/JiF5GwhjWx,https://twitter.com/i/web/status/1392131882045820932,11/05/2021 08:57:59,Twitter for iPhone,43,16,MINEX Guatemala 🇬🇹,08:57:59,http://pbs.twimg.com/profile_images/1292832595093475329/6LQbTy36.jpg
"#ControlYRecaudación | Como parte de la estrategia de combate al contrabando aduanero, en los primeros meses del añ… https://t.co/5UXQNsPn4s",https://twitter.com/i/web/status/1392138672980570122,11/05/2021 09:24:58,Twitter for iPhone,3,1,Ministerio de Finanzas Guatemala,09:24:58,http://pbs.twimg.com/profile_images/1292831294796320768/6Q8j5vtW.jpg
RT @SCSPGT: Está circulando en grupos de chat y redes un mensaje en donde se dice que los adultos mayores de 60 años pueden llegar sin cita…,https://twitter.com/i/web/status/1392155272555208704,11/05/2021 10:30:56,Twitter Web App,0,80,Gobierno Guatemala,10:30:56,http://pbs.twimg.com/profile_images/1371488309743120384/QqlgsWUm.jpg
"RT @MINECOGT: Las cifras macroeconómicas demuestran que vamos por buen camino aunque aún falta mucho por hacer.

Desde el #MINECOGT seguimo…",https://twitter.com/i/web/status/1392160059619225604,11/05/2021 10:49:57,Twitter Web App,0,8,Gobierno Guatemala,10:49:57,http://pbs.twimg.com/profile_images/1371488309743120384/QqlgsWUm.jpg
#VacunaCovidGT | @MinSaludGuate continúa vacunando  contra el COVID-19 a personas previamente registradas  👉… https://t.co/Ol5AcATE1R,https://twitter.com/i/web/status/1392186130750189569,11/05/2021 12:33:33,Twitter Web App,21,8,Gobierno Guatemala,12:33:33,http://pbs.twimg.com/profile_images/1371488309743120384/QqlgsWUm.jpg
Desde que se desarrolló el Plan Nacional de Vacunación contra el #Covid19 el @MinexGt ha actuado en apego a su mand… https://t.co/sR0vPcBwcE,https://twitter.com/i/web/status/1392214294318682115,11/05/2021 14:25:28,Twitter for iPhone,7,3,MINEX Guatemala 🇬🇹,14:25:28,http://pbs.twimg.com/profile_images/1292832595093475329/6LQbTy36.jpg
"""Estamos cerrando el primer cuatrimestre del año con un repunte económico significativo, el mayor de la región cent… https://t.co/pJcmdaW2ZB",https://twitter.com/i/web/status/1392222749020590089,11/05/2021 14:59:04,Twitter Web App,31,12,Gobierno Guatemala,14:59:04,http://pbs.twimg.com/profile_images/1371488309743120384/QqlgsWUm.jpg
Se clausura en el país el Coloquio de Política y Economía de @ITU ✅ https://t.co/YImi9Cs6U2 https://t.co/xYvssatlQq,https://twitter.com/i/web/status/1392229669957685258,11/05/2021 15:26:34,Twitter Web App,4,2,Gobierno Guatemala,15:26:34,http://pbs.twimg.com/profile_images/1371488309743120384/QqlgsWUm.jpg
"#Extranjería | Las solicitudes de Residencias son resueltas en 30 días, consulta tu número de expediente en el sigu… https://t.co/v2FPoEZTOQ",https://twitter.com/i/web/status/1392253270920474630,11/05/2021 17:00:21,Hootsuite Inc.,0,0,Migración Guatemala,17:00:21,http://pbs.twimg.com/profile_images/1346129009051054081/v9JUwo36.jpg
"El #CancillerGt @PedroBroloGT se reunió con #RodolfoSabonge, secretario general de @ACS_AEC para conversar de las n… https://t.co/hQfYDwnHvA",https://twitter.com/i/web/status/1392256302408208384,11/05/2021 17:12:24,Twitter for iPhone,4,2,MINEX Guatemala 🇬🇹,17:12:24,http://pbs.twimg.com/profile_images/1292832595093475329/6LQbTy36.jpg
#Extranjería | Los formularios para trámite de visas y residencias No tienen costo! Se pueden descargar en… https://t.co/DNl80BoIU4,https://twitter.com/i/web/status/1392268349405544451,11/05/2021 18:00:16,Hootsuite Inc.,1,0,Migración Guatemala,18:00:16,http://pbs.twimg.com/profile_images/1346129009051054081/v9JUwo36.jpg
#Extranjería | Encuentra los requisitos para efectuar tus trámites en https://t.co/4Gtec7fyKe https://t.co/JhqZYbSeyE,https://twitter.com/i/web/status/1392283438540103685,11/05/2021 19:00:13,Hootsuite Inc.,2,0,Migración Guatemala,19:00:13,http://pbs.twimg.com/profile_images/1346129009051054081/v9JUwo36.jpg
"#GestiónMinfin | El Viceministro Saúl Figueroa, participó en el Seminario Regional de Política Fiscal, organizado p… https://t.co/Fz7lRbflj1",https://twitter.com/i/web/status/1392292803124895744,11/05/2021 19:37:26,Twitter for Android,5,2,Ministerio de Finanzas Guatemala,19:37:26,http://pbs.twimg.com/profile_images/1292831294796320768/6Q8j5vtW.jpg
#Extranjería | Consulta tu estado de expediente ingresando los datos solicitados en https://t.co/4Gtec7fyKe https://t.co/AyqGviBXBX,https://twitter.com/i/web/status/1392298521978712068,11/05/2021 20:00:09,Hootsuite Inc.,1,0,Migración Guatemala,20:00:09,http://pbs.twimg.com/profile_images/1346129009051054081/v9JUwo36.jpg
#InformeNacional | Guatemala mejora sus indicadores en el índice Doing Business del Banco Mundial. ▶️… https://t.co/vROBCNZNlL,https://twitter.com/i/web/status/1392302780761640964,11/05/2021 20:17:05,Twitter Web App,14,8,Gobierno Guatemala,20:17:05,http://pbs.twimg.com/profile_images/1371488309743120384/QqlgsWUm.jpg
"#Extranjería | Compartimos los requisitos para la actualización de datos de residentes, descarga el formulario en… https://t.co/qCllJUbazL",https://twitter.com/i/web/status/1392313611545088001,11/05/2021 21:00:07,Hootsuite Inc.,1,0,Migración Guatemala,21:00:07,http://pbs.twimg.com/profile_images/1346129009051054081/v9JUwo36.jpg
#IGM | ¡Compromiso! Atender efectivamente a nuestros usuarios es una de nuestras prioridades. https://t.co/taoEog0akU,https://twitter.com/i/web/status/1392464695500709895,12/05/2021 07:00:28,Hootsuite Inc.,0,0,Migración Guatemala,07:00:28,http://pbs.twimg.com/profile_images/1346129009051054081/v9JUwo36.jpg
Conozca los centros de vacunación distribuidos en todo el país. Consulte en 👉 https://t.co/Fn7znJX2HH https://t.co/5SEd8fKVdM,https://twitter.com/i/web/status/1392471867030659073,12/05/2021 07:28:58,Twitter for iPhone,18,14,Gobierno Guatemala,07:28:58,http://pbs.twimg.com/profile_images/1371488309743120384/QqlgsWUm.jpg
"#Pasaportes | El pasaporte guatemalteco cuenta con más de 30 medidas de seguridad, cumpliendo con la regulación int… https://t.co/KZempzQ8zC",https://twitter.com/i/web/status/1392479962578423814,12/05/2021 08:01:08,Hootsuite Inc.,2,0,Migración Guatemala,08:01:08,http://pbs.twimg.com/profile_images/1346129009051054081/v9JUwo36.jpg
"12 de mayo, Día Internacional de la Enfermería 🧑‍⚕️👩‍⚕️

El #MSPAS felicita a todos los enfermeros y enfermeras por… https://t.co/ENuqrtHXV4",https://twitter.com/i/web/status/1392487168824729606,12/05/2021 08:29:46,Twitter Web App,10,1,Ministerio de Salud Pública,08:29:46,http://pbs.twimg.com/profile_images/1311755159027015685/QQcxgYd1.jpg
#Arraigos | Compartimos requisitos para solicitar información de arraigos a través de un abogado: 👇 https://t.co/YH5hge55wm,https://twitter.com/i/web/status/1392489756479590406,12/05/2021 08:40:03,Hootsuite Inc.,0,0,Migración Guatemala,08:40:03,http://pbs.twimg.com/profile_images/1346129009051054081/v9JUwo36.jpg
"#YoDenuncio
#DenunciaAl1518 🗣📞🕵🏻‍
Comunícate al 1518, la línea de denuncias confidenciales del Ministerio de Gobern… https://t.co/vEpjcx5cKy",https://twitter.com/i/web/status/1392494781238972419,12/05/2021 09:00:01,Twitter Media Studio,1,2,MinGob,09:00:01,http://pbs.twimg.com/profile_images/1371480777330941958/_81AGCXa.jpg
#ControlYRecaudación | El cuarto Puesto de Control Interinstitucional #PCI fortalece la estrategia de combate al co… https://t.co/nG5mfXAfgx,https://twitter.com/i/web/status/1392502573010231308,12/05/2021 09:30:59,Twitter Web App,6,1,Ministerio de Finanzas Guatemala,09:30:59,http://pbs.twimg.com/profile_images/1292831294796320768/6Q8j5vtW.jpg
"La Cuarta Brigada de Infantería del #EjércitoGT | #MINDEF apoya al @MinSaludGuate, en la organización y funcionamie… https://t.co/5uhq3d1jCf",https://twitter.com/i/web/status/1392505981372936193,12/05/2021 09:44:32,Twitter for Android,10,2,Ejército Guatemala,09:44:32,http://pbs.twimg.com/profile_images/1371454438775398402/KrPRUXA_.jpg
"12 de mayo, Día Internacional de la Enfermería 🧑‍⚕️👩‍⚕️

#DiadelaEnfermeria #MSPAS https://t.co/SDrDe0Kefr",https://twitter.com/i/web/status/1392506331861602305,12/05/2021 09:45:55,Twitter Web App,6,3,Ministerio de Salud Pública,09:45:55,http://pbs.twimg.com/profile_images/1311755159027015685/QQcxgYd1.jpg
Maestro habría abusado sexualmente de varias niñas https://t.co/XJ1zaGd8SR,https://twitter.com/i/web/status/1392508133709434890,12/05/2021 09:53:05,"<a href=""http://publicize.wp.com/"" rel=""nofollow"">WordPress.com",2,1,MinGob,09:53:05,http://pbs.twimg.com/profile_images/1371480777330941958/_81AGCXa.jpg
RT @DrGiammattei: Hemos realizado esfuerzos interinstitucionales importantes para mejorar el clima de negocios en Guatemala y esperamos que…,https://twitter.com/i/web/status/1392509378088128515,12/05/2021 09:58:01,Twitter for iPhone,0,10,Gobierno Guatemala,09:58:01,http://pbs.twimg.com/profile_images/1371488309743120384/QqlgsWUm.jpg
RT @DrGiammattei: Hemos realizado esfuerzos interinstitucionales importantes para mejorar el clima de negocios en Guatemala y esperamos que…,https://twitter.com/i/web/status/1392512682591465481,12/05/2021 10:11:09,TweetDeck,0,10,MinGob,10:11:09,http://pbs.twimg.com/profile_images/1371480777330941958/_81AGCXa.jpg
"La ministra de Salud, #AmeliaFlores, participa en citación con diputados de la Comisión de Educación, Ciencia y Tec… https://t.co/PDlMWOcUNN",https://twitter.com/i/web/status/1392512962670256131,12/05/2021 10:12:16,Twitter Web App,5,1,Ministerio de Salud Pública,10:12:16,http://pbs.twimg.com/profile_images/1311755159027015685/QQcxgYd1.jpg
#SanMarcos | La Brigada de Operaciones para Montaña del #EjércitoGT realiza patrullajes de seguridad en cumplimient… https://t.co/xfyB9Tjjh0,https://twitter.com/i/web/status/1392513292338438144,12/05/2021 10:13:35,Twitter for Android,10,4,Ejército Guatemala,10:13:35,http://pbs.twimg.com/profile_images/1371454438775398402/KrPRUXA_.jpg
#VideoLlamada🇬🇹🇹🇼 | El #CancillerGT @PedroBroloGT conversó con el Ministro de Asuntos Exteriores de la República de… https://t.co/PAuNDfJsEf,https://twitter.com/i/web/status/1392516150999851011,12/05/2021 10:24:56,Twitter Web App,6,6,MINEX Guatemala 🇬🇹,10:24:56,http://pbs.twimg.com/profile_images/1292832595093475329/6LQbTy36.jpg
Ambos cancilleres acordaron continuar con la dinámica de #PromociónComercial que ha permitido este año 2021 el incr… https://t.co/wNgeOhhEP9,https://twitter.com/i/web/status/1392516462670123011,12/05/2021 10:26:11,Twitter Web App,1,2,MINEX Guatemala 🇬🇹,10:26:11,http://pbs.twimg.com/profile_images/1292832595093475329/6LQbTy36.jpg
La Brigada de Operaciones para Montaña del #EjércitoGT concientiza a la población sobre medidas para prevenir conta… https://t.co/RIc1aXXnWh,https://twitter.com/i/web/status/1392516768829263884,12/05/2021 10:27:24,Twitter for Android,3,1,Ejército Guatemala,10:27:24,http://pbs.twimg.com/profile_images/1371454438775398402/KrPRUXA_.jpg
🇬🇹🤝🇹🇼 https://t.co/0TSM006OTi,https://twitter.com/i/web/status/1392517795431202816,12/05/2021 10:31:28,Twitter Web App,8,2,MINEX Guatemala 🇬🇹,10:31:28,http://pbs.twimg.com/profile_images/1292832595093475329/6LQbTy36.jpg
"El Cuerpo de Ingenieros del #EjércitoGT | #MINDEF trabaja en la reconstrucción de puente colgante, ubicado en el rí… https://t.co/lS3r05VpMM",https://twitter.com/i/web/status/1392521935620395008,12/05/2021 10:47:55,Twitter for Android,5,1,Ejército Guatemala,10:47:55,http://pbs.twimg.com/profile_images/1371454438775398402/KrPRUXA_.jpg
"Servicio de Sanidad Militar del #EjércitoGT | #MINDEF apoya al @MinSaludGuate, en la organización y funcionamiento… https://t.co/2rQ9UP8C28",https://twitter.com/i/web/status/1392522806907310086,12/05/2021 10:51:23,Twitter for Android,3,1,Ejército Guatemala,10:51:23,http://pbs.twimg.com/profile_images/1371454438775398402/KrPRUXA_.jpg
Allanamientos permite capturar a dos personas por asociación ilícita https://t.co/whqwNNO2Sh,https://twitter.com/i/web/status/1392523600461279232,12/05/2021 10:54:32,"<a href=""http://publicize.wp.com/"" rel=""nofollow"">WordPress.com",1,1,MinGob,10:54:32,http://pbs.twimg.com/profile_images/1371480777330941958/_81AGCXa.jpg
"Primera Brigada de Infantería ""Mariscal Zavala"" del #EjércitoGT | #MINDEF transmitió programa radial con el tema ""M… https://t.co/dKJkFCQ4Sp",https://twitter.com/i/web/status/1392523982323257345,12/05/2021 10:56:03,Twitter for Android,5,1,Ejército Guatemala,10:56:03,http://pbs.twimg.com/profile_images/1371454438775398402/KrPRUXA_.jpg
"En cuatro días, PNC decomisa 650 libras de Marihuana en Petén https://t.co/GNqX3nIKfQ",https://twitter.com/i/web/status/1392524952042197001,12/05/2021 10:59:55,"<a href=""http://publicize.wp.com/"" rel=""nofollow"">WordPress.com",1,1,MinGob,10:59:55,http://pbs.twimg.com/profile_images/1371480777330941958/_81AGCXa.jpg
"Lávate las manos 🤲💧
Usa mascarilla 😷
Respeta el distanciamiento social ↔️

#CuidarnosEsResponsabilidadDeTodos #MSPAS https://t.co/7MCcuy8TIP",https://twitter.com/i/web/status/1392524976184508416,12/05/2021 11:00:00,Twitter Web App,0,0,Ministerio de Salud Pública,11:00:00,http://pbs.twimg.com/profile_images/1311755159027015685/QQcxgYd1.jpg
"Conoce los paso para obtener tus #AntecedentesPolicialesGT en línea ✅

El video te informará 👇🏻

https://t.co/PC0hqVryTT",https://twitter.com/i/web/status/1392524984166215682,12/05/2021 11:00:02,TweetDeck,0,0,MinGob,11:00:02,http://pbs.twimg.com/profile_images/1371480777330941958/_81AGCXa.jpg
#Arraigos | Compartimos requisitos para solicitar información de arraigos a terceras personas: 👇 https://t.co/Y7CXdtx1tN,https://twitter.com/i/web/status/1392525089904672779,12/05/2021 11:00:27,Hootsuite Inc.,0,0,Migración Guatemala,11:00:27,http://pbs.twimg.com/profile_images/1346129009051054081/v9JUwo36.jpg
"Brigada de Infantería de Marina del #EjércitoGT | #MINDEF apoya al @MinSaludGuate, en la organización y funcionamie… https://t.co/CKzgN9q7M8",https://twitter.com/i/web/status/1392526651733446664,12/05/2021 11:06:40,Twitter for Android,2,1,Ejército Guatemala,11:06:40,http://pbs.twimg.com/profile_images/1371454438775398402/KrPRUXA_.jpg
"¡Recuerda que puedes pagar en línea la boleta de los #AntecedentesPolicialesGT!

Sigue los pasos ✍🏻 https://t.co/6lyWbiVLNj",https://twitter.com/i/web/status/1392528748923084804,12/05/2021 11:15:00,Twitter Media Studio,3,1,MinGob,11:15:00,http://pbs.twimg.com/profile_images/1371480777330941958/_81AGCXa.jpg
"Un promedio de 900 personas por día son vacunadas en el Puesto de Vacunación ubicado en la Mega Frater, zona 9 de… https://t.co/d7mnyydzLp",https://twitter.com/i/web/status/1392528903210741763,12/05/2021 11:15:37,Twitter Web App,9,2,Ministerio de Salud Pública,11:15:37,http://pbs.twimg.com/profile_images/1311755159027015685/QQcxgYd1.jpg
El Ministerio de Salud Púbica agradece a la Junta Directiva de Fraternidad Cristiana por su colaboración con las in… https://t.co/wxnnSqAxoP,https://twitter.com/i/web/status/1392528906809397252,12/05/2021 11:15:37,Twitter Web App,3,0,Ministerio de Salud Pública,11:15:37,http://pbs.twimg.com/profile_images/1311755159027015685/QQcxgYd1.jpg
Ambos cancilleres acordaron continuar con la dinámica de #PromociónComercial que ha permitido este año 2021 el incr… https://t.co/3EVTgwsq9E,https://twitter.com/i/web/status/1392530054933065738,12/05/2021 11:20:11,Twitter Web App,3,4,Gobierno Guatemala,11:20:11,http://pbs.twimg.com/profile_images/1371488309743120384/QqlgsWUm.jpg
El Servicio de Sanidad Militar del #EjércitoGT | #MINDEF continúa apoyando en la aplicación de la vacuna contra el… https://t.co/vlRPakhihu,https://twitter.com/i/web/status/1392531443570679815,12/05/2021 11:25:42,Twitter for Android,2,1,Ejército Guatemala,11:25:42,http://pbs.twimg.com/profile_images/1371454438775398402/KrPRUXA_.jpg
Comisarías de PNC en donde se tramitan de manera presencial los #AntecedentesPolicialesGT ☑️ https://t.co/g4JslNvST1,https://twitter.com/i/web/status/1392532526065983492,12/05/2021 11:30:00,Twitter Media Studio,1,1,MinGob,11:30:00,http://pbs.twimg.com/profile_images/1371480777330941958/_81AGCXa.jpg
#Actualización| #MSPAS informa este 12 de mayo de 2021 los casos confirmados por laboratorio en el tablero Situació… https://t.co/qKAf2EdAqV,https://twitter.com/i/web/status/1392534271487791104,12/05/2021 11:36:57,Twitter for Android,4,1,Ministerio de Salud Pública,11:36:57,http://pbs.twimg.com/profile_images/1311755159027015685/QQcxgYd1.jpg
⚠️ En el tablero COVID-19 los fallecidos reportados el día anterior se visualizan por la fecha de defunción. Estos… https://t.co/VTh94rDWMA,https://twitter.com/i/web/status/1392534273316593670,12/05/2021 11:36:57,Twitter for Android,0,0,Ministerio de Salud Pública,11:36:57,http://pbs.twimg.com/profile_images/1311755159027015685/QQcxgYd1.jpg
El #MSPAS informa la cantidad de personas que han recibido la primera dosis y el esquema completo de la vacuna cont… https://t.co/b1aMBsEg8T,https://twitter.com/i/web/status/1392534569392422915,12/05/2021 11:38:08,Twitter for Android,4,2,Ministerio de Salud Pública,11:38:08,http://pbs.twimg.com/profile_images/1311755159027015685/QQcxgYd1.jpg
"Brigada Especial de Operaciones de Selva del #EjércitoGT | #MINDEF apoya al @MinSaludGuate, en la organización y fu… https://t.co/8OQOWuq279",https://twitter.com/i/web/status/1392535501538795522,12/05/2021 11:41:50,Twitter for Android,2,0,Ejército Guatemala,11:41:50,http://pbs.twimg.com/profile_images/1371454438775398402/KrPRUXA_.jpg
"#EjércitoGT | #MINDEF en coordinación con @PNCdeGuatemala, @SATGT y @MPguatemala, incautaron un camión con bultos d… https://t.co/85L8CgVQVS",https://twitter.com/i/web/status/1392535891223228416,12/05/2021 11:43:23,Twitter for Android,2,1,Ejército Guatemala,11:43:23,http://pbs.twimg.com/profile_images/1371454438775398402/KrPRUXA_.jpg
"Personal de @PNCdeGuatemala de la SGAIA localizó e inspecciono contenedor en Portuaria Santo Tomas de Castilla, don… https://t.co/vyiYN3Lv2Y",https://twitter.com/i/web/status/1392538789394931718,12/05/2021 11:54:54,Twitter Web App,2,1,MinGob,11:54:54,http://pbs.twimg.com/profile_images/1371480777330941958/_81AGCXa.jpg
"#VacunaCOVID19 💉
¿Conoces la diferencia entre registro y cita? 💻📲

El Ministerio de Salud Pública y Asistencia Soci… https://t.co/gWpVD7ITuJ",https://twitter.com/i/web/status/1392539867758874625,12/05/2021 11:59:11,Twitter Web App,0,1,Ministerio de Salud Pública,11:59:11,http://pbs.twimg.com/profile_images/1311755159027015685/QQcxgYd1.jpg
"#GuatePreviene 🟡

¡Denuncia toda actividad ilícita a los ☎️ 110, 1561, 1577 y 1574!
#YoDenuncio https://t.co/mYLIkax3FF",https://twitter.com/i/web/status/1392540079004864513,12/05/2021 12:00:01,Twitter Media Studio,1,1,MinGob,12:00:01,http://pbs.twimg.com/profile_images/1371480777330941958/_81AGCXa.jpg
"#MedidasDePrevención | Nos importa la salud de nuestros usuarios, recomendamos que continúen utilizando alcohol en… https://t.co/LCAnSqAs04",https://twitter.com/i/web/status/1392540189579485186,12/05/2021 12:00:27,Hootsuite Inc.,0,0,Migración Guatemala,12:00:27,http://pbs.twimg.com/profile_images/1346129009051054081/v9JUwo36.jpg
"RT @opsargentina: ❤🏥 Día internacional de enfermeras y enfermeros 👩🧑‍⚕️

Un reconocimiento especial para quienes cumplen un rol fundamental…",https://twitter.com/i/web/status/1392542029293527049,12/05/2021 12:07:46,Twitter for iPhone,0,6,OPS/OMS,12:07:46,http://pbs.twimg.com/profile_images/1096094749902028801/ijbQWupW.png
"RT @OPSOMSPeru: Evita las 3 C 👀 para prevenir la #COVID19 🦠

Y recuerda, usa tu 😷, lávate las ✋🏾🤚🏼 con 💦 y 🧼 , mantén la distancia 🧍🏻‍♀‍ ⬅️…",https://twitter.com/i/web/status/1392542049124114435,12/05/2021 12:07:51,Twitter for iPhone,0,2,OPS/OMS,12:07:51,http://pbs.twimg.com/profile_images/1096094749902028801/ijbQWupW.png
"RT @OPASOMSBrasil: Hoje é Dia Internacional da Enfermagem! 👩🏾‍⚕️🧑🏻‍⚕️🩺💕

🧐 Você sabia que enfermeiros e enfermeiras lideram o caminho para…",https://twitter.com/i/web/status/1392542192200298497,12/05/2021 12:08:25,Twitter for iPhone,0,7,OPS/OMS,12:08:25,http://pbs.twimg.com/profile_images/1096094749902028801/ijbQWupW.png
RT @OPSOMS_Col: En el #DiadelaEnfermeria hagamos un pacto de cuidado para proteger los derechos de los trabajadores de la salud y los cuida…,https://twitter.com/i/web/status/1392542241667813384,12/05/2021 12:08:37,Twitter for iPhone,0,7,OPS/OMS,12:08:37,http://pbs.twimg.com/profile_images/1096094749902028801/ijbQWupW.png
RT @opsomsels: 👉La OPS es un miembro orgulloso de #COVAX y apoya la distribución equitativa de vacunas #COVID19. https://t.co/tOjGvGNiEy,https://twitter.com/i/web/status/1392542259975962628,12/05/2021 12:08:41,Twitter for iPhone,0,3,OPS/OMS,12:08:41,http://pbs.twimg.com/profile_images/1096094749902028801/ijbQWupW.png
RT @opsomsels: ➡️Las vacunas que recibe El Salvador 🇸🇻 a través del Mecanismo #COVAX son donadas por la Alianza Mundial para Vacunas e Inmu…,https://twitter.com/i/web/status/1392542287972950021,12/05/2021 12:08:48,Twitter for iPhone,0,5,OPS/OMS,12:08:48,http://pbs.twimg.com/profile_images/1096094749902028801/ijbQWupW.png
"RT @opsomsels: Representante de la OPS/OMS en El Salvador, Dr. Giovanni Escalante: ""El mecanismo COVAX ha sido  desarrollado como una maner…",https://twitter.com/i/web/status/1392542308453728261,12/05/2021 12:08:53,Twitter for iPhone,0,5,OPS/OMS,12:08:53,http://pbs.twimg.com/profile_images/1096094749902028801/ijbQWupW.png
"RT @opsomsels: El Salvador 🇸🇻 recibe ahora 140,400 dosis de vacunas Pfizer a través de #COVAX, como OPS seguimos brindando apoyo técnico pa…",https://twitter.com/i/web/status/1392542366565818370,12/05/2021 12:09:07,Twitter for iPhone,0,5,OPS/OMS,12:09:07,http://pbs.twimg.com/profile_images/1096094749902028801/ijbQWupW.png
