Contenido,IR,Fecha,Dispositivo,Likes,Retweets,Entidad,Hora,Foto
"#GestiónMinfin  🇬🇹 | Ministro de Finanzas @alvarogricci en entrevista con @canalantigua, aborda el informe del… https://t.co/SriKRNaqXv",https://twitter.com/i/web/status/1379643285023682560,06/04/2021 21:52:46,Twitter for Android,6,1,Minfin Guatemala,21:52:46,http://pbs.twimg.com/profile_images/1292831294796320768/6Q8j5vtW.jpg
RT @CanalAntigua: Ahora en #ALas845 analizaremos los datos proporcionados por el gobierno central en donde señala un repunte económico en e…,https://twitter.com/i/web/status/1379643349209124867,06/04/2021 21:53:01,Twitter for Android,0,5,Minfin Guatemala,21:53:01,http://pbs.twimg.com/profile_images/1292831294796320768/6Q8j5vtW.jpg
"Las estimaciones del @FMInoticias son estimaciones a nivel mundial, que generan confianza de inversionistas extranj… https://t.co/avywTPU7JI",https://twitter.com/i/web/status/1379646933355130881,06/04/2021 22:07:16,Twitter for Android,1,0,Minfin Guatemala,22:07:16,http://pbs.twimg.com/profile_images/1292831294796320768/6Q8j5vtW.jpg
"#ReactivaciónEconómica |  Dichas estimaciones se deben al trabajo realizado en la recaudación, la cual ha generado… https://t.co/8Rmi5TILMU",https://twitter.com/i/web/status/1379651563656990720,06/04/2021 22:25:40,Twitter for Android,4,1,Minfin Guatemala,22:25:40,http://pbs.twimg.com/profile_images/1292831294796320768/6Q8j5vtW.jpg
"Se busca atraer inversión extranjera y local, que generen empleos formales y aumenten la #Recaudación para contar c… https://t.co/Rgr06IgGXq",https://twitter.com/i/web/status/1379660331568496647,06/04/2021 23:00:30,Twitter for Android,4,1,Minfin Guatemala,23:00:30,http://pbs.twimg.com/profile_images/1292831294796320768/6Q8j5vtW.jpg
Como parte de las actividades realizadas por el Taller Nacional de Grabados en Acero #TNGA debido a su… https://t.co/8WcbLtEZaQ,https://twitter.com/i/web/status/1379831785975087104,07/04/2021 10:21:48,Twitter for Android,8,3,Minfin Guatemala,10:21:48,http://pbs.twimg.com/profile_images/1292831294796320768/6Q8j5vtW.jpg
"El #GrabadoEnAcero como expresión artística y como proceso industrial, en apoyo a la institucionalidad guatemalteca… https://t.co/jPfT07Wawk",https://twitter.com/i/web/status/1379848884663508992,07/04/2021 11:29:45,Twitter Web App,6,2,Minfin Guatemala,11:29:45,http://pbs.twimg.com/profile_images/1292831294796320768/6Q8j5vtW.jpg
"Generación de inversión y aseguramiento de activos estratégicos para generar #ReactivaciónEconómicaYSocial, fueron… https://t.co/jNAh51KHX2",https://twitter.com/i/web/status/1379876207748132864,07/04/2021 13:18:19,Twitter Web App,15,4,Minfin Guatemala,13:18:19,http://pbs.twimg.com/profile_images/1292831294796320768/6Q8j5vtW.jpg
"El #CancillerGT @PedroBroloGT recibió del @CACIFGuatemala el 3er. informe “Actuando en el presente, pensando en el… https://t.co/3nDMERbnPC",https://twitter.com/i/web/status/1379929906692382730,07/04/2021 16:51:42,Twitter for iPhone,22,9,MINEX Guatemala 🇬🇹,16:51:42,http://pbs.twimg.com/profile_images/1292832595093475329/6LQbTy36.jpg
2/2 @PedroBroloGT resaltó el apoyo del programa #ConsejerosComercialesGt en embajadas guatemaltecas que dio resulta… https://t.co/BHBAqSXXyh,https://twitter.com/i/web/status/1379942445249662976,07/04/2021 17:41:31,Twitter for iPhone,7,4,MINEX Guatemala 🇬🇹,17:41:31,http://pbs.twimg.com/profile_images/1292832595093475329/6LQbTy36.jpg
#FinanzasPersonales ✔️ | Una meta definida para ahorrar aporta buenos resultados a tu estilo de vida. https://t.co/YrapMdlNyo,https://twitter.com/i/web/status/1379943084008554496,07/04/2021 17:44:03,Twitter for Android,3,1,Minfin Guatemala,17:44:03,http://pbs.twimg.com/profile_images/1292831294796320768/6Q8j5vtW.jpg
#ControlMigratorio | 🎥 Compartimos información sobre la salida de menores de edad de territorio guatemalteco. https://t.co/mhYPinNJth,https://twitter.com/i/web/status/1379947123077226496,07/04/2021 18:00:06,Hootsuite Inc.,7,2,Migración Guatemala,18:00:06,http://pbs.twimg.com/profile_images/1346129009051054081/v9JUwo36.jpg
El #ViceCancillerGt @eduardoehr acompañó a delegación de 🇺🇸 a un recorrido y reunión de seguimiento de temas de mig… https://t.co/uMMtj3o3Pb,https://twitter.com/i/web/status/1379947436211331087,07/04/2021 18:01:21,Twitter for iPhone,16,4,MINEX Guatemala 🇬🇹,18:01:21,http://pbs.twimg.com/profile_images/1292832595093475329/6LQbTy36.jpg
"#Información | Director General en funciones, Stuard Rodríguez, realizó un recorrido en el Centro de Recepción de R… https://t.co/6bORPqDwuN",https://twitter.com/i/web/status/1379951034525700100,07/04/2021 18:15:39,Hootsuite Inc.,1,1,Migración Guatemala,18:15:39,http://pbs.twimg.com/profile_images/1346129009051054081/v9JUwo36.jpg
"#ControlMigratorio | Si vas a salir con un menor de edad del país, es importante que leas la siguiente información… https://t.co/em9fY9otxg",https://twitter.com/i/web/status/1379962217420951557,07/04/2021 19:00:05,Hootsuite Inc.,0,0,Migración Guatemala,19:00:05,http://pbs.twimg.com/profile_images/1346129009051054081/v9JUwo36.jpg
"#ControlMigratorio | Si vas a salir con un menor de edad del país, es importante que leas la siguiente información… https://t.co/ZJgSsiCIOn",https://twitter.com/i/web/status/1379977312330993666,07/04/2021 20:00:04,Hootsuite Inc.,2,1,Migración Guatemala,20:00:04,http://pbs.twimg.com/profile_images/1346129009051054081/v9JUwo36.jpg
"#IGM | ¡Migración Segura! Promovemos una migración regular y ordenada, respetando las leyes migratorias vigentes en… https://t.co/twboMt2P3I",https://twitter.com/i/web/status/1380143465137381376,08/04/2021 07:00:18,Hootsuite Inc.,3,2,Migración Guatemala,07:00:18,http://pbs.twimg.com/profile_images/1346129009051054081/v9JUwo36.jpg
#Pasaporte | El Código QR que se genera para la cita de emisión de pasaporte no puede ser falsificado. ¡No te dejes… https://t.co/lz9hRtXCf9,https://twitter.com/i/web/status/1380173931882090501,08/04/2021 09:01:22,Hootsuite Inc.,2,1,Migración Guatemala,09:01:22,http://pbs.twimg.com/profile_images/1346129009051054081/v9JUwo36.jpg
#AvisoImportante 📢 https://t.co/Msx9bQRZDu,https://twitter.com/i/web/status/1380188691046531076,08/04/2021 10:00:01,TweetDeck,1,2,MINEX Guatemala 🇬🇹,10:00:01,http://pbs.twimg.com/profile_images/1292832595093475329/6LQbTy36.jpg
"#GestiónMinfin | Viceministro de Finanzas, Saúl Figueroa, participa en Gabinete Específico de Desarrollo Económico… https://t.co/nMacrrtyT0",https://twitter.com/i/web/status/1380194427612884993,08/04/2021 10:22:48,Twitter Web App,5,0,Minfin Guatemala,10:22:48,http://pbs.twimg.com/profile_images/1292831294796320768/6Q8j5vtW.jpg
"En el marco del #MIRPS, Guatemala participó como equipo técnico en la Mesa Redonda de Expertos: Fortalecimiento de… https://t.co/ei2AuJVSY6",https://twitter.com/i/web/status/1380214051431649294,08/04/2021 11:40:47,Twitter Web App,3,3,MINEX Guatemala 🇬🇹,11:40:47,http://pbs.twimg.com/profile_images/1292832595093475329/6LQbTy36.jpg
"#Pasaportes | 🧳 Organiza tu viaje y evita contratiempos, verifica la fecha de vencimiento de tu pasaporte con antic… https://t.co/8YiaFqfQto",https://twitter.com/i/web/status/1380218975863377922,08/04/2021 12:00:21,Hootsuite Inc.,2,1,Migración Guatemala,12:00:21,http://pbs.twimg.com/profile_images/1346129009051054081/v9JUwo36.jpg
"RT @SCEPgt: Este día, también participan los alcaldes de Alta Verapaz, quienes se reúnen con funcionarios de gobierno para dar seguimiento…",https://twitter.com/i/web/status/1380233709266333704,08/04/2021 12:58:54,Twitter Web App,0,3,Gobierno Guatemala,12:58:54,http://pbs.twimg.com/profile_images/1371488309743120384/QqlgsWUm.jpg
"RT @McdGuate: Ministro Felipe Aguilar dice que, por instrucciones del Presidente @DrGiammattei, se presentará al @CongresoGuate la iniciati…",https://twitter.com/i/web/status/1380233865315414021,08/04/2021 12:59:31,Twitter Web App,0,4,Gobierno Guatemala,12:59:31,http://pbs.twimg.com/profile_images/1371488309743120384/QqlgsWUm.jpg
⚠️ En el tablero COVID-19 los fallecidos reportados el día anterior se visualizan por la fecha de defunción. Estos… https://t.co/KemD8RzHhQ,https://twitter.com/i/web/status/1380237121219346445,08/04/2021 13:12:27,Twitter for Android,1,0,Ministerio de Salud Pública,13:12:27,http://pbs.twimg.com/profile_images/1311755159027015685/QQcxgYd1.jpg
#Actualización| #MSPAS informa este 8 de abril de 2021 los casos confirmados por laboratorio en el tablero Situació… https://t.co/91C7j2bVZD,https://twitter.com/i/web/status/1380237119361318912,08/04/2021 13:12:27,Twitter for Android,18,13,Ministerio de Salud Pública,13:12:27,http://pbs.twimg.com/profile_images/1311755159027015685/QQcxgYd1.jpg
El #MSPAS informa la cantidad de personas que han recibido la primera dosis y el esquema completo de la vacuna cont… https://t.co/I5JSTqC2qr,https://twitter.com/i/web/status/1380237518684221446,08/04/2021 13:14:02,Twitter for Android,8,1,Ministerio de Salud Pública,13:14:02,http://pbs.twimg.com/profile_images/1311755159027015685/QQcxgYd1.jpg
"Los hospitales de la red pública y temporales #COVID19 presentan alta demanda de pacientes, muchos en estado crític… https://t.co/xk0WMMXAcy",https://twitter.com/i/web/status/1380257352717377540,08/04/2021 14:32:51,Twitter Web App,95,69,Ministerio de Salud Pública,14:32:51,http://pbs.twimg.com/profile_images/1311755159027015685/QQcxgYd1.jpg
#GuatemalaNoSeDetiene | @PNCdeGuatemala desmantela bandas señaladas de dedicarse a la extorsión y secuestro 👮‍♀️👮… https://t.co/RCKZ4Ftzc6,https://twitter.com/i/web/status/1380259348228808704,08/04/2021 14:40:47,Twitter Web App,41,6,Gobierno Guatemala,14:40:47,http://pbs.twimg.com/profile_images/1371488309743120384/QqlgsWUm.jpg
#DiplomaciaComercialGT | La @GTenTailandia participó en Seminario de oportunidades comerciales entre América Latina… https://t.co/9sYQsW3koz,https://twitter.com/i/web/status/1380260262842892304,08/04/2021 14:44:25,Twitter Web App,0,1,MINEX Guatemala 🇬🇹,14:44:25,http://pbs.twimg.com/profile_images/1292832595093475329/6LQbTy36.jpg
RT @DrGiammattei: Con la suscripción del Convenio Interinstitucional para la implementación y uso del Sistema Electrónico para la Administr…,https://twitter.com/i/web/status/1380264176266977285,08/04/2021 14:59:58,Twitter Web App,0,17,Gobierno Guatemala,14:59:58,http://pbs.twimg.com/profile_images/1371488309743120384/QqlgsWUm.jpg
"Conoce los efectos secundarios de la vacuna contra el #COVID19 💉👇

Para mayor información comunícate al 1517, consu… https://t.co/AE8ShKKiuv",https://twitter.com/i/web/status/1380272992299651074,08/04/2021 15:35:00,Twitter Web App,22,8,Ministerio de Salud Pública,15:35:00,http://pbs.twimg.com/profile_images/1311755159027015685/QQcxgYd1.jpg
"La @GTenTailandia visitó al embajador de #Laos, el embajador Seng Soukhathivong con el propósito de estrechar los l… https://t.co/5dDuup78iG",https://twitter.com/i/web/status/1380274177500938241,08/04/2021 15:39:42,Twitter for Android,9,3,MINEX Guatemala 🇬🇹,15:39:42,http://pbs.twimg.com/profile_images/1292832595093475329/6LQbTy36.jpg
"RT @OPASOMSBrasil: O acesso universal à atenção médica 🏥 é essencial, mas não suficiente. A saúde precisa trabalhar com outros setores que…",https://twitter.com/i/web/status/1380274974204772353,08/04/2021 15:42:52,Twitter for iPhone,0,7,OPS/OMS,15:42:52,http://pbs.twimg.com/profile_images/1096094749902028801/ijbQWupW.png
"RT @OPSOMSPeru: Reduce el riesgo de contagio. Por ti y por los demás
ayuda a detener la propagación de la #COVID19. Evita las 3C 👇

✅ Usa a…",https://twitter.com/i/web/status/1380275925078659079,08/04/2021 15:46:39,Twitter for iPhone,0,15,OPS/OMS,15:46:39,http://pbs.twimg.com/profile_images/1096094749902028801/ijbQWupW.png
RT @SCSPGT: Hoy se firmó el convenio para la implementación del Sistema Electrónico para la Administración de Procesos de Proyectos de Cons…,https://twitter.com/i/web/status/1380278490164043776,08/04/2021 15:56:51,Twitter Web App,0,7,Gobierno Guatemala,15:56:51,http://pbs.twimg.com/profile_images/1371488309743120384/QqlgsWUm.jpg
RT @OPASOMSBrasil: Mais de 100 economias receberam vacinas contra a #COVID19 💉 por meio do #COVAX. O marco ocorre 42 dias após a entrega da…,https://twitter.com/i/web/status/1380279345332244480,08/04/2021 16:00:14,Twitter for iPhone,0,3,OPS/OMS,16:00:14,http://pbs.twimg.com/profile_images/1096094749902028801/ijbQWupW.png
#LegadoBicentenarioGT | @McdGuate presenta hallazgos arqueológicos que indican que Tikal fue un espacio de converge… https://t.co/ckQ4PDafUB,https://twitter.com/i/web/status/1380287544680660998,08/04/2021 16:32:49,Twitter Web App,33,16,Gobierno Guatemala,16:32:49,http://pbs.twimg.com/profile_images/1371488309743120384/QqlgsWUm.jpg
"Recuerda mantener el uso de la mascarilla, el lavado de manos y el distanciamiento físico 😷🤲🏻💧↔️

¡Cuidarnos es res… https://t.co/5uWvrIslvY",https://twitter.com/i/web/status/1380288092062412804,08/04/2021 16:35:00,Twitter Web App,7,1,Ministerio de Salud Pública,16:35:00,http://pbs.twimg.com/profile_images/1311755159027015685/QQcxgYd1.jpg
"RT @OPSOMSMexico: 🔔Cuarentena en el hogar 🏡 o en otro lugar: 
#COVID19 https://t.co/3QSahIETnE",https://twitter.com/i/web/status/1380298169444106244,08/04/2021 17:15:02,Twitter for iPhone,0,4,OPS/OMS,17:15:02,http://pbs.twimg.com/profile_images/1096094749902028801/ijbQWupW.png
Gobierno lanza plataforma digital para agilizar proyectos municipales #GuatemalaNoSeDetiene ✅… https://t.co/nnvRXooNCd,https://twitter.com/i/web/status/1380300101902598148,08/04/2021 17:22:43,Twitter Media Studio,13,5,Gobierno Guatemala,17:22:43,http://pbs.twimg.com/profile_images/1371488309743120384/QqlgsWUm.jpg
https://t.co/H6DFpISvRH,https://twitter.com/i/web/status/1380303989128921089,08/04/2021 17:38:10,Twitter for Android,8,1,Ministerio de Salud Pública,17:38:10,http://pbs.twimg.com/profile_images/1311755159027015685/QQcxgYd1.jpg
"RT @OPSGuate: No estaremos a salvo hasta que todos estén a salvo 🌎..

Debemos prepararnos ahora para poder enfrentar con mayor éxito la pró…",https://twitter.com/i/web/status/1380309916456513540,08/04/2021 18:01:43,Twitter for iPhone,0,4,OPS/OMS,18:01:43,http://pbs.twimg.com/profile_images/1096094749902028801/ijbQWupW.png
"Los hospitales de la red pública y temporales #COVID19 presentan alta demanda de pacientes, muchos en estado crític… https://t.co/A3raaqPH4l",https://twitter.com/i/web/status/1380319193342574592,08/04/2021 18:38:35,Twitter for Android,33,12,Ministerio de Salud Pública,18:38:35,http://pbs.twimg.com/profile_images/1311755159027015685/QQcxgYd1.jpg
"RT @OIMGuatemala: El Jefe de Misión de la OIM para #ElSalvador #Guatemala y #Honduras, Jorge Peraza, hace un recorrido por el Centro de Rec…",https://twitter.com/i/web/status/1380321632573612033,08/04/2021 18:48:16,Twitter for Android,0,3,Migración Guatemala,18:48:16,http://pbs.twimg.com/profile_images/1346129009051054081/v9JUwo36.jpg
"Guatemala participó en Feria Internacional de Panadería de #Taipéi2021, organizada por el Consejo de Desarrollo de… https://t.co/GA0HuiIxie",https://twitter.com/i/web/status/1380323994780512263,08/04/2021 18:57:40,Twitter for Android,9,2,MINEX Guatemala 🇬🇹,18:57:40,http://pbs.twimg.com/profile_images/1292832595093475329/6LQbTy36.jpg
"Es un honor tenerlos en el equipo y esperemos realizar muchas más actividades en beneficio de la Prevención, record… https://t.co/KUx1I9UowU",https://twitter.com/i/web/status/1380324912058003462,08/04/2021 19:01:18,Twitter for iPhone,19,11,MinGob,19:01:18,http://pbs.twimg.com/profile_images/1371480777330941958/_81AGCXa.jpg
Hombre capturado en flagrancia sindicado de extorsión https://t.co/bD1U0QdKB9,https://twitter.com/i/web/status/1380326392202678279,08/04/2021 19:07:11,"<a href=""http://publicize.wp.com/"" rel=""nofollow"">WordPress.com",4,2,MinGob,19:07:11,http://pbs.twimg.com/profile_images/1371480777330941958/_81AGCXa.jpg
Expertaje a vehículo permite decomisarlo por alteraciones https://t.co/DMw3BP83LA,https://twitter.com/i/web/status/1380326567373586434,08/04/2021 19:07:53,"<a href=""http://publicize.wp.com/"" rel=""nofollow"">WordPress.com",3,2,MinGob,19:07:53,http://pbs.twimg.com/profile_images/1371480777330941958/_81AGCXa.jpg
"El Viceministro de Prevención de la Violencia y el Delito, Carlos García Rubio junto a otras autoridades de distint… https://t.co/5HSIvcExpO",https://twitter.com/i/web/status/1380330148097097730,08/04/2021 19:22:07,Twitter for iPhone,16,8,MinGob,19:22:07,http://pbs.twimg.com/profile_images/1371480777330941958/_81AGCXa.jpg
#InformeNacional | @MineducGT inicia la segunda entrega de alimentación escolar en Suchitepéquez. ▶️… https://t.co/8RCJhzAoFC,https://twitter.com/i/web/status/1380333850086289411,08/04/2021 19:36:49,Twitter Web App,12,5,Gobierno Guatemala,19:36:49,http://pbs.twimg.com/profile_images/1371488309743120384/QqlgsWUm.jpg
RT @GuatemalaGob: #InformeNacional | @MineducGT inicia la segunda entrega de alimentación escolar en Suchitepéquez. ▶️ https://t.co/xUWxaod…,https://twitter.com/i/web/status/1380336327263145984,08/04/2021 19:46:40,Twitter for iPhone,0,5,MinGob,19:46:40,http://pbs.twimg.com/profile_images/1371480777330941958/_81AGCXa.jpg
"#TuDenunciaEsConfidencial 🗣📞🕵🏻‍
#YoDenuncio
Se dará seguimiento y respuesta a toda la información que usted brinde. https://t.co/F3wfMITSIX",https://twitter.com/i/web/status/1380339684761432064,08/04/2021 20:00:00,Twitter Media Studio,0,0,MinGob,20:00:00,http://pbs.twimg.com/profile_images/1371480777330941958/_81AGCXa.jpg
"#Información | En Oficinas Centrales, estamos atendiendo en horario de 7:00 a 15:00 horas de lunes a viernes. https://t.co/x7x7H24Ug4",https://twitter.com/i/web/status/1380339702704840709,08/04/2021 20:00:05,Hootsuite Inc.,0,0,Migración Guatemala,20:00:05,http://pbs.twimg.com/profile_images/1346129009051054081/v9JUwo36.jpg
"Primera Brigada de Infantería ""Mariscal Zavala"" del #EjércitoGT | #MINDEF realizó patrullajes de seguridad en el de… https://t.co/Ag3OeinER4",https://twitter.com/i/web/status/1380346003707076611,08/04/2021 20:25:07,Twitter for Android,11,4,Ejército Guatemala,20:25:07,http://pbs.twimg.com/profile_images/1371454438775398402/KrPRUXA_.jpg
"Brigada de Paracaidistas del #EjércitoGT | #MINDEF participó en la Gran Cruzada Nacional por la Nutrición, en coord… https://t.co/dTVwIb6Ymv",https://twitter.com/i/web/status/1380348212381368321,08/04/2021 20:33:54,Twitter for Android,9,4,Ejército Guatemala,20:33:54,http://pbs.twimg.com/profile_images/1371454438775398402/KrPRUXA_.jpg
"RT @CACIFGuatemala: #CumplimientoODS
@CACIFGuatemala hace entrega del tercer informe ""Actuando en el Presente, Pensando en el Futuro. El añ…",https://twitter.com/i/web/status/1380350820563173379,08/04/2021 20:44:15,Twitter for Android,0,2,MINEX Guatemala 🇬🇹,20:44:15,http://pbs.twimg.com/profile_images/1292832595093475329/6LQbTy36.jpg
RT @GuatemalaGob: Guatemala cerró el primer trimestre del año con un repunte económico y continuará creciendo. Esto representa más oportuni…,https://twitter.com/i/web/status/1380351348152098816,08/04/2021 20:46:21,Twitter for Android,0,13,MINEX Guatemala 🇬🇹,20:46:21,http://pbs.twimg.com/profile_images/1292832595093475329/6LQbTy36.jpg
#EjércitoGT | #MINDEF Único e Indivisible. https://t.co/5JE41JsNhC,https://twitter.com/i/web/status/1380352359595966465,08/04/2021 20:50:22,Twitter for Android,36,6,Ejército Guatemala,20:50:22,http://pbs.twimg.com/profile_images/1371454438775398402/KrPRUXA_.jpg
"Brigada de Artillería de Campaña ""Santa Bárbara"" del #EjércitoGT | #MINDEF realiza puestos de control y patrullajes… https://t.co/hdhoSRVMlz",https://twitter.com/i/web/status/1380358900965335040,08/04/2021 21:16:22,Twitter for Android,11,5,Ejército Guatemala,21:16:22,http://pbs.twimg.com/profile_images/1371454438775398402/KrPRUXA_.jpg
"RT @SCSPGT: El presidente de Guatemala @DrGiammattei, conversó con el periodista @JohnQABC sobre los retos que enfrenta Guatemala para cons…",https://twitter.com/i/web/status/1380360375351279616,08/04/2021 21:22:13,Twitter for iPhone,0,31,MinGob,21:22:13,http://pbs.twimg.com/profile_images/1371480777330941958/_81AGCXa.jpg
"La Brigada de Fuerzas Especiales del #EjércitoGT | #MINDEF apoyó al Sanatorio ""Manos Ayudadoras"" en el traslado, ca… https://t.co/D4m6UG07cz",https://twitter.com/i/web/status/1380364826887737345,08/04/2021 21:39:55,Twitter for Android,12,4,Ejército Guatemala,21:39:55,http://pbs.twimg.com/profile_images/1371454438775398402/KrPRUXA_.jpg
"RT @SCSPGT: El presidente de Guatemala @DrGiammattei, conversó con el periodista @JohnQABC sobre los retos que enfrenta Guatemala para cons…",https://twitter.com/i/web/status/1380367211487969281,08/04/2021 21:49:23,Twitter for Android,0,31,Ministerio de Salud Pública,21:49:23,http://pbs.twimg.com/profile_images/1311755159027015685/QQcxgYd1.jpg
"RT @SCSPGT: El presidente de Guatemala @DrGiammattei, conversó con el periodista @JohnQABC sobre los retos que enfrenta Guatemala para cons…",https://twitter.com/i/web/status/1380370546882383882,08/04/2021 22:02:39,Twitter for iPhone,0,31,Gobierno Guatemala,22:02:39,http://pbs.twimg.com/profile_images/1371488309743120384/QqlgsWUm.jpg
"RT @SCSPGT: El presidente de Guatemala @DrGiammattei, conversó con el periodista @JohnQABC sobre los retos que enfrenta Guatemala para cons…",https://twitter.com/i/web/status/1380379781519314949,08/04/2021 22:39:20,Twitter for Android,0,31,Ejército Guatemala,22:39:20,http://pbs.twimg.com/profile_images/1371454438775398402/KrPRUXA_.jpg
"¡Buenos días #Guatemala! 🇬🇹

Soldados de la Primera Brigada de Infantería ""Mariscal Zavala"" del #EjércitoGT |… https://t.co/wWMMI1pPkc",https://twitter.com/i/web/status/1380490272904249347,09/04/2021 05:58:23,Twitter for Android,16,6,Ejército Guatemala,05:58:23,http://pbs.twimg.com/profile_images/1371454438775398402/KrPRUXA_.jpg
Soldado caído en el cumplimiento del deber. https://t.co/xVZi46Pji8,https://twitter.com/i/web/status/1380504023925673985,09/04/2021 06:53:02,Twitter for Android,20,7,Ejército Guatemala,06:53:02,http://pbs.twimg.com/profile_images/1371454438775398402/KrPRUXA_.jpg
#IGM | ¡Profesionalismo! Cada trámite es atendido con honradez y eficiencia. https://t.co/9to8ZZxLEp,https://twitter.com/i/web/status/1380505146141073412,09/04/2021 06:57:30,Hootsuite Inc.,0,0,Migración Guatemala,06:57:30,http://pbs.twimg.com/profile_images/1346129009051054081/v9JUwo36.jpg
"La rendición de cuentas y la transparencia en todos los niveles son esenciales para promover la equidad en salud, e… https://t.co/eI9rpGw3hY",https://twitter.com/i/web/status/1380505776113004546,09/04/2021 07:00:00,Twitter Media Studio,10,6,OPS/OMS,07:00:00,http://pbs.twimg.com/profile_images/1096094749902028801/ijbQWupW.png
"⚠️ ATENCIÓN ⚠️
El #LaboratorioMóvil del #MSPAS continúa hoy en: 

- Mercado El Guarda, zona 11, Guatemala de 8:00 a… https://t.co/cV46Tk4J0f",https://twitter.com/i/web/status/1380510611562491906,09/04/2021 07:19:13,Twitter for Android,1,0,Ministerio de Salud Pública,07:19:13,http://pbs.twimg.com/profile_images/1311755159027015685/QQcxgYd1.jpg
RT @OPASOMSBrasil: O risco do cultivo de tabaco aos produtores 👨🏿‍🌾 e suas famílias é pouco discutido e documentado. Agricultores estão exp…,https://twitter.com/i/web/status/1380514548029997059,09/04/2021 07:34:51,Twitter for iPhone,0,3,OPS/OMS,07:34:51,http://pbs.twimg.com/profile_images/1096094749902028801/ijbQWupW.png
"RT @campusvirtualsp: 👉🏿¿Conoces nuestro espacio destinado a los profesionales de salud sobre la #COVID19 
Encontrarás:
💻 Cursos abiertos y…",https://twitter.com/i/web/status/1380514688056836096,09/04/2021 07:35:25,Twitter for iPhone,0,18,OPS/OMS,07:35:25,http://pbs.twimg.com/profile_images/1096094749902028801/ijbQWupW.png
RT @opsargentina: Las comunidades 👨‍👩‍👦‍👦 y las personas deben ejercer su derecho a la salud. Deben tener voz y participar como socias en i…,https://twitter.com/i/web/status/1380514710920044545,09/04/2021 07:35:30,Twitter for iPhone,0,2,OPS/OMS,07:35:30,http://pbs.twimg.com/profile_images/1096094749902028801/ijbQWupW.png
"RT @Ops_Paraguay: Fortalecer los sistemas nacionales de información sanitaria orientados a la equidad para:
➡️ responder a las desafíos act…",https://twitter.com/i/web/status/1380514729286901760,09/04/2021 07:35:34,Twitter for iPhone,0,3,OPS/OMS,07:35:34,http://pbs.twimg.com/profile_images/1096094749902028801/ijbQWupW.png
Cuarenta mujeres han logrado su reinserción https://t.co/nmUoqywc7O,https://twitter.com/i/web/status/1380516808067837952,09/04/2021 07:43:50,"<a href=""http://publicize.wp.com/"" rel=""nofollow"">WordPress.com",4,1,MinGob,07:43:50,http://pbs.twimg.com/profile_images/1371480777330941958/_81AGCXa.jpg
"RT @SCSPGT: Rendimos homenaje a un amigo, compañero de trabajo, gran periodista quien con su trabajo contribuyó a la construcción de un mej…",https://twitter.com/i/web/status/1380518582900121607,09/04/2021 07:50:53,Twitter for iPhone,0,10,Gobierno Guatemala,07:50:53,http://pbs.twimg.com/profile_images/1371488309743120384/QqlgsWUm.jpg
"Brigada de Artillería de Campaña ""Santa Bárbara"" del #EjércitoGT | #MINDEF realiza puesto de control en el departam… https://t.co/u3nUZcgWb4",https://twitter.com/i/web/status/1380527152895033350,09/04/2021 08:24:56,Twitter for Android,0,0,Ejército Guatemala,08:24:56,http://pbs.twimg.com/profile_images/1371454438775398402/KrPRUXA_.jpg
🔥🌳➡️ Temporada de Incendios Forestales 2020-2021. https://t.co/EbwUlkAnUA,https://twitter.com/i/web/status/1380527882510987269,09/04/2021 08:27:50,Twitter for Android,1,0,Ejército Guatemala,08:27:50,http://pbs.twimg.com/profile_images/1371454438775398402/KrPRUXA_.jpg
