Contenido,IR,Fecha,Dispositivo,Likes,Retweets,Entidad,Hora,Foto
"#GestiónMinfin | El Ministro Alvaro González Ricci, agrega que el financiamiento, no es una nueva deuda, ya que se… https://t.co/sh50eEMAbf",https://twitter.com/i/web/status/1517254982180950016,21/04/2022 15:32:31,Twitter for Android,1,0,Ministerio de Finanzas de Guatemala,15:32:31,http://pbs.twimg.com/profile_images/1471837102618853383/4xfotDwN.jpg
"#GestiónMinfin | La Viceministra de Transparencia Fiscal y Adquisicones del Estado, Violeta Mazariegos explica el f… https://t.co/K1rGavi5La",https://twitter.com/i/web/status/1517257581462441984,21/04/2022 15:42:51,Twitter for Android,2,0,Ministerio de Finanzas de Guatemala,15:42:51,http://pbs.twimg.com/profile_images/1471837102618853383/4xfotDwN.jpg
La Viceministra comenta que el portal es una herramienta importante para que todos los grupos de la sociedad civil… https://t.co/dBdSGgDv82,https://twitter.com/i/web/status/1517257584243265539,21/04/2022 15:42:52,Twitter for Android,2,0,Ministerio de Finanzas de Guatemala,15:42:52,http://pbs.twimg.com/profile_images/1471837102618853383/4xfotDwN.jpg
"RT @opsomsnic: La jornada de vacunación en Nicaragua es una festividad que es parte de la cultura y tradiciones nacionales.

¿Estás protegi…",https://twitter.com/i/web/status/1517264352918884352,21/04/2022 16:09:45,Twitter for iPhone,0,3,OPS/OMS,16:09:45,http://pbs.twimg.com/profile_images/1096094749902028801/ijbQWupW.png
"Por aparte, el Ministro @alvarogricci informa que se encuentra participando en las Reuniones de Primavera del… https://t.co/p7H4DjiFF6",https://twitter.com/i/web/status/1517284235991822337,21/04/2022 17:28:46,Twitter Web App,2,0,Ministerio de Finanzas de Guatemala,17:28:46,http://pbs.twimg.com/profile_images/1471837102618853383/4xfotDwN.jpg
#ControlMigratorio | ¡Atención! ⚠️  Puedes ingresar a territorio guatemalteco con UNO de los requisitos que se menc… https://t.co/ZcFSzr4xxV,https://twitter.com/i/web/status/1517289890815397888,21/04/2022 17:51:14,Twitter for Android,1,1,Migración Guatemala,17:51:14,http://pbs.twimg.com/profile_images/1472975116015386625/qXTSRrI2.jpg
"#TodosSomosMigrantes |  Compartimos nuestra campaña en Q’eqchí’. El ser humano que emigra puede ser tu padre, tu ab… https://t.co/Uky6T6kesx",https://twitter.com/i/web/status/1517324544859590658,21/04/2022 20:08:56,Twitter for iPhone,2,2,Migración Guatemala,20:08:56,http://pbs.twimg.com/profile_images/1472975116015386625/qXTSRrI2.jpg
"RT @AGN_noticias: #FinanzasAGN | Préstamo del @BancoMundial brindaría una tasa de interés de 0.75 %, lo que representa un ahorro para Guate…",https://twitter.com/i/web/status/1517341966387843073,21/04/2022 21:18:10,Twitter for Android,0,2,Ministerio de Finanzas de Guatemala,21:18:10,http://pbs.twimg.com/profile_images/1471837102618853383/4xfotDwN.jpg
RT @campusvirtualsp: ¿Sabías que la retinopatía del prematuro es la principal causa de ceguera prevenible en niños? Para saber más te invit…,https://twitter.com/i/web/status/1517484274269708288,22/04/2022 06:43:39,Twitter for iPhone,0,5,OPS/OMS,06:43:39,http://pbs.twimg.com/profile_images/1096094749902028801/ijbQWupW.png
"RT @PAHOemergencies: 🟢 El 19 de abril, el 🇬🇹 Sistema Nacional de Coordinación para la Reducción de Desastres de Guatemala, CONRED, informó…",https://twitter.com/i/web/status/1517484372336816128,22/04/2022 06:44:02,Twitter for iPhone,0,4,OPS/OMS,06:44:02,http://pbs.twimg.com/profile_images/1096094749902028801/ijbQWupW.png
"RT @UNDRR_Americas: 💻Te invitamos a participar del curso virtual ""Enfoque de Género y Movilidad Humana en la Gestión del Riesgo de Desastre…",https://twitter.com/i/web/status/1517484434974466049,22/04/2022 06:44:17,Twitter for iPhone,0,19,OPS/OMS,06:44:17,http://pbs.twimg.com/profile_images/1096094749902028801/ijbQWupW.png
"RT @rpsp_pajph: 🕰 Explore los hitos que marcaron la trayectoria de la Revista durante estos #100AñosdeCiencia, a través de nuestra línea de…",https://twitter.com/i/web/status/1517484849141067776,22/04/2022 06:45:56,Twitter for iPhone,0,4,OPS/OMS,06:45:56,http://pbs.twimg.com/profile_images/1096094749902028801/ijbQWupW.png
"🌎 Hoy es el #DíadelaTierra 🌎

💚 Protejamos nuestras fuentes de agua 💙 de la contaminación y utilicemos el agua de f… https://t.co/L5X0XkAFKo",https://twitter.com/i/web/status/1517488403943727106,22/04/2022 07:00:03,Twitter Web App,54,35,OPS/OMS,07:00:03,http://pbs.twimg.com/profile_images/1096094749902028801/ijbQWupW.png
#22DeAbril |  Día Internacional de las Niñas en las TIC. https://t.co/0SjVGF9mat,https://twitter.com/i/web/status/1517488623792369664,22/04/2022 07:00:56,Hootsuite Inc.,2,0,Migración Guatemala,07:00:56,http://pbs.twimg.com/profile_images/1472975116015386625/qXTSRrI2.jpg
"Conoce las reciente acciones del @GuatemalaGob por medio del #InformeNacional   👇🏻

✅#GiraPresidencial2022 llega a… https://t.co/fpa5kRMWwG",https://twitter.com/i/web/status/1517492005093449729,22/04/2022 07:14:22,Twitter Web App,1,0,Ministerio de Finanzas de Guatemala,07:14:22,http://pbs.twimg.com/profile_images/1471837102618853383/4xfotDwN.jpg
"✅Mandatario agradece aprobación de ley que facilitará el acceso a vivienda social 🏘️
@SCSPGT @AGN_noticias @DiariodeCA @TGWdigital @CIVguate",https://twitter.com/i/web/status/1517492008474099714,22/04/2022 07:14:23,Twitter Web App,0,0,Ministerio de Finanzas de Guatemala,07:14:23,http://pbs.twimg.com/profile_images/1471837102618853383/4xfotDwN.jpg
"La Tierra es nuestro hogar y promover su desarrollo sostenible es responsabilidad de todos.🌎
#DíaDeLaTierra https://t.co/4JBiDt1oef",https://twitter.com/i/web/status/1517497994442117120,22/04/2022 07:38:10,Twitter Web App,4,0,Ministerio de Finanzas de Guatemala,07:38:10,http://pbs.twimg.com/profile_images/1471837102618853383/4xfotDwN.jpg
#YoDenuncio | Te invitamos a denunciar estas anomalías. ¡No seas parte de estos actos ilícitos! https://t.co/7RRqN91Zf4,https://twitter.com/i/web/status/1517521063160205312,22/04/2022 09:09:50,Twitter for Android,1,1,Migración Guatemala,09:09:50,http://pbs.twimg.com/profile_images/1472975116015386625/qXTSRrI2.jpg
"En las Américas no hay viruela y ha sido la primera región en el mundo en eliminar la polio, el sarampión, la rubéo… https://t.co/oz2EFvhAZb",https://twitter.com/i/web/status/1517548790441414656,22/04/2022 11:00:00,Twitter Media Studio,13,6,OPS/OMS,11:00:00,http://pbs.twimg.com/profile_images/1096094749902028801/ijbQWupW.png
#GestiónMinfin 📊| La cooperación del @BCIE_Org aumentará la transformación digital en el #Minfin e impulsará más ac… https://t.co/1lnok6NJlN,https://twitter.com/i/web/status/1517550974877028354,22/04/2022 11:08:41,Twitter Web App,10,3,Ministerio de Finanzas de Guatemala,11:08:41,http://pbs.twimg.com/profile_images/1471837102618853383/4xfotDwN.jpg
#Esquela | 🕊️ Lamentamos el fallecimiento del Excelentísimo Embajador Extraordinario y Plenipotenciario de la Repúb… https://t.co/EIYIPYgoPB,https://twitter.com/i/web/status/1517565512204660737,22/04/2022 12:06:27,Twitter for Android,2,0,Migración Guatemala,12:06:27,http://pbs.twimg.com/profile_images/1472975116015386625/qXTSRrI2.jpg
Segunda Brigada de Infantería del #EjércitoGT | #MINDEF apoya al @MinSaludGuate en la organización y funcionamiento… https://t.co/kBnxnhA9v4,https://twitter.com/i/web/status/1517566430757236744,22/04/2022 12:10:06,Twitter for Android,2,2,Ejército Guatemala,12:10:06,http://pbs.twimg.com/profile_images/1471838829430640640/0yNoNrwr.jpg
"#Retornados | En el marco de la atención y protección a menores de edad, se continua con la entrega de juguetes en… https://t.co/krz8URhIn3",https://twitter.com/i/web/status/1517568605562585089,22/04/2022 12:18:45,Twitter for Android,5,2,Migración Guatemala,12:18:45,http://pbs.twimg.com/profile_images/1472975116015386625/qXTSRrI2.jpg
"Este día, el Director General, Stuard Rodríguez, compartió con los menores que retornaron en el vuelo programado pa… https://t.co/29Z6P2QyVg",https://twitter.com/i/web/status/1517568612600631296,22/04/2022 12:18:46,Twitter for Android,3,1,Migración Guatemala,12:18:46,http://pbs.twimg.com/profile_images/1472975116015386625/qXTSRrI2.jpg
El personal del Centro de Salud de San Felipe Retalhuleu conmemoró el Día internacional de la Madre Tierra con la r… https://t.co/H8h7SqbFwx,https://twitter.com/i/web/status/1517570280352329732,22/04/2022 12:25:24,Twitter Web App,0,0,Ministerio de Salud Pública,12:25:24,http://pbs.twimg.com/profile_images/1471842908043190279/bu1LHFWL.jpg
"El ministro de Salud Pública y Asistencia Social, Francisco Coma y el representante de la Organización Panamericana… https://t.co/FyieO6zjUN",https://twitter.com/i/web/status/1517571181599145991,22/04/2022 12:28:59,Twitter Web App,3,0,Ministerio de Salud Pública,12:28:59,http://pbs.twimg.com/profile_images/1471842908043190279/bu1LHFWL.jpg
Semana de la Vacuna de las Américas a realizarse del 23 al 30 de abril del presente año. https://t.co/y0l4otLKUD,https://twitter.com/i/web/status/1517571186812665860,22/04/2022 12:29:00,Twitter Web App,1,0,Ministerio de Salud Pública,12:29:00,http://pbs.twimg.com/profile_images/1471842908043190279/bu1LHFWL.jpg
Delitos sexuales ha detenido a 47 personas por delitos contra la mujer https://t.co/XfMmy7vfmC,https://twitter.com/i/web/status/1517574988282437632,22/04/2022 12:44:07,"<a href=""http://publicize.wp.com/"" rel=""nofollow"">WordPress.com",1,2,MinGob,12:44:07,http://pbs.twimg.com/profile_images/1471828174598246407/Y1Lm5nFE.jpg
Presuntos responsables de ataque armado son capturados https://t.co/dMXEHdo4Xn,https://twitter.com/i/web/status/1517575314330710016,22/04/2022 12:45:24,"<a href=""http://publicize.wp.com/"" rel=""nofollow"">WordPress.com",0,0,MinGob,12:45:24,http://pbs.twimg.com/profile_images/1471828174598246407/Y1Lm5nFE.jpg
#NoticiasMSPAS | Retalhuleu continúa reforzando sus procedimientos para el resguardo de biológicos. Conozca más en… https://t.co/uypVWSMqiZ,https://twitter.com/i/web/status/1517575324980203522,22/04/2022 12:45:27,"<a href=""https://www.socialgest.net"" rel=""nofollow"">SocialGest",0,1,Ministerio de Salud Pública,12:45:27,http://pbs.twimg.com/profile_images/1471842908043190279/bu1LHFWL.jpg
"Hoy se celebra el Día Internacional de la Madre Tierra 🌎, con el objetivo de concienciar a la humanidad sobre el cu… https://t.co/LpWVaPb3zm",https://twitter.com/i/web/status/1517578078435876864,22/04/2022 12:56:23,Twitter for Android,5,2,Ejército Guatemala,12:56:23,http://pbs.twimg.com/profile_images/1471838829430640640/0yNoNrwr.jpg
"Con el propósito de fortalecer las competencias teóricas y prácticas, de monitores de centros juveniles, autoridade… https://t.co/fQSAG71Iug",https://twitter.com/i/web/status/1517578757732720640,22/04/2022 12:59:05,Twitter Web App,1,1,MinGob,12:59:05,http://pbs.twimg.com/profile_images/1471828174598246407/Y1Lm5nFE.jpg
"En el marco de la estrategia para el #DesarrolloEconómico el Ministro @alvarogricci se reunió, en Washington, con e… https://t.co/cOwdo0DsNl",https://twitter.com/i/web/status/1517578897235353601,22/04/2022 12:59:39,Twitter for Android,5,3,Ministerio de Finanzas de Guatemala,12:59:39,http://pbs.twimg.com/profile_images/1471837102618853383/4xfotDwN.jpg
"Tu denuncia es importante, informa de actividades ilícitas ó de ubicaciones de delincuentes. Comunícate de forma an… https://t.co/VuwCD8mwuD",https://twitter.com/i/web/status/1517578990956990464,22/04/2022 13:00:01,Twitter Media Studio,0,0,MinGob,13:00:01,http://pbs.twimg.com/profile_images/1471828174598246407/Y1Lm5nFE.jpg
Inauguran Instituto de la Víctima en Jutiapa https://t.co/FpyJt2NqX5,https://twitter.com/i/web/status/1517590384330878981,22/04/2022 13:45:17,"<a href=""http://publicize.wp.com/"" rel=""nofollow"">WordPress.com",3,3,MinGob,13:45:17,http://pbs.twimg.com/profile_images/1471828174598246407/Y1Lm5nFE.jpg
PNC capacita a monitores de centros carcelarios en defensa personal https://t.co/u1OMJ39wiZ,https://twitter.com/i/web/status/1517593492284923904,22/04/2022 13:57:38,"<a href=""http://publicize.wp.com/"" rel=""nofollow"">WordPress.com",0,1,MinGob,13:57:38,http://pbs.twimg.com/profile_images/1471828174598246407/Y1Lm5nFE.jpg
"""La próxima 💉 Semana de Vacunación en las Américas 🌎 es una oportunidad para 🎉 celebrar nuestro progreso y utilizar… https://t.co/ZK20fqdjMI",https://twitter.com/i/web/status/1517594088790450177,22/04/2022 14:00:00,Twitter Media Studio,10,7,OPS/OMS,14:00:00,http://pbs.twimg.com/profile_images/1096094749902028801/ijbQWupW.png
"RT @campusvirtualsp: 📍¡Nuevo curso! 

📚 El curso brinda una caja de herramientas completa y una guía para comprender e implementar las inic…",https://twitter.com/i/web/status/1517594632686813185,22/04/2022 14:02:10,Twitter for iPhone,0,7,OPS/OMS,14:02:10,http://pbs.twimg.com/profile_images/1096094749902028801/ijbQWupW.png
"Primera Brigada de Infantería del #EjércitoGT | #MINDEF apoya al @MinSaludGuate, en puestos  de vacunación contra e… https://t.co/oSCHQoZp72",https://twitter.com/i/web/status/1517596049690480640,22/04/2022 14:07:48,Twitter for Android,10,4,Ejército Guatemala,14:07:48,http://pbs.twimg.com/profile_images/1471838829430640640/0yNoNrwr.jpg
Arrestan a presunto pandillero salvadoreño en La Antigua Guatemala https://t.co/1IhAOvAqpf,https://twitter.com/i/web/status/1517597487313440768,22/04/2022 14:13:31,"<a href=""http://publicize.wp.com/"" rel=""nofollow"">WordPress.com",5,1,MinGob,14:13:31,http://pbs.twimg.com/profile_images/1471828174598246407/Y1Lm5nFE.jpg
"🌎 La Semana de Vacunación en la región de las Américas busca vacunar a cerca de 1️⃣4️⃣0️⃣ millones de personas.

❇️… https://t.co/80125qIb4W",https://twitter.com/i/web/status/1517603792430284802,22/04/2022 14:38:34,Twitter for iPhone,13,8,OPS/OMS,14:38:34,http://pbs.twimg.com/profile_images/1096094749902028801/ijbQWupW.png
#ControlMigratorio | En el siguiente enlace encuentras los requisitos para el trámite de las certificaciones de mov… https://t.co/M8uH2xGUOn,https://twitter.com/i/web/status/1517611710399590400,22/04/2022 15:10:02,Twitter for Android,0,0,Migración Guatemala,15:10:02,http://pbs.twimg.com/profile_images/1472975116015386625/qXTSRrI2.jpg
"Los esfuerzos que está realizando 🇬🇹 para evitar la migración irregular, como el Plan de Desarrollo Integral, y la… https://t.co/oSPtAsSwL7",https://twitter.com/i/web/status/1517612001324896256,22/04/2022 15:11:11,Twitter Web App,1,1,MINEX Guatemala 🇬🇹,15:11:11,http://pbs.twimg.com/profile_images/1471828089491574785/eD5OEVK6.jpg
"El encuentro fue propicio para reconocer iniciativas impulsadas para el desarrollo humano, empleo y educación, como… https://t.co/X4BFJ9nR2V",https://twitter.com/i/web/status/1517612004437078018,22/04/2022 15:11:12,Twitter Web App,2,1,MINEX Guatemala 🇬🇹,15:11:12,http://pbs.twimg.com/profile_images/1471828089491574785/eD5OEVK6.jpg
"Hacia una 🇬🇹 más competitiva y prospera, el #CancillerGT @MarioBucaroGT reconoció y agradeció la labor de #SEDI… https://t.co/CaBV78NNZu",https://twitter.com/i/web/status/1517612002939703296,22/04/2022 15:11:12,Twitter Web App,2,3,MINEX Guatemala 🇬🇹,15:11:12,http://pbs.twimg.com/profile_images/1471828089491574785/eD5OEVK6.jpg
Ubican a presunto pandillero salvadoreño en Petén https://t.co/Kzm5PiTkcX,https://twitter.com/i/web/status/1517612697403244544,22/04/2022 15:13:57,"<a href=""http://publicize.wp.com/"" rel=""nofollow"">WordPress.com",5,2,MinGob,15:13:57,http://pbs.twimg.com/profile_images/1471828174598246407/Y1Lm5nFE.jpg
"#CancillerGT @MarioBucaroGT, en representación del @GuatemalaGob, suscribió Acuerdo de Asistencia Mutua en materia… https://t.co/Nx92wR3hHO",https://twitter.com/i/web/status/1517618027667329025,22/04/2022 15:35:08,Twitter Web App,17,10,MINEX Guatemala 🇬🇹,15:35:08,http://pbs.twimg.com/profile_images/1471828089491574785/eD5OEVK6.jpg
#Actualización| #MSPAS informa este 22 de abril de 2022 los casos confirmados por laboratorio en el tablero Situaci… https://t.co/k2CzvhZ7Xx,https://twitter.com/i/web/status/1517623389049036802,22/04/2022 15:56:26,Twitter Web App,5,2,Ministerio de Salud Pública,15:56:26,http://pbs.twimg.com/profile_images/1471842908043190279/bu1LHFWL.jpg
⚠️ En el tablero COVID-19 los fallecidos reportados el día anterior se visualizan por la fecha de defunción. Estos… https://t.co/HdBRZM1X9n,https://twitter.com/i/web/status/1517623436981456897,22/04/2022 15:56:38,Twitter Web App,1,0,Ministerio de Salud Pública,15:56:38,http://pbs.twimg.com/profile_images/1471842908043190279/bu1LHFWL.jpg
El #MSPAS informa la cantidad de personas que han recibido la primera dosis y el esquema completo de la vacuna cont… https://t.co/YA4pExaAr2,https://twitter.com/i/web/status/1517623707858046976,22/04/2022 15:57:42,Twitter Web App,3,0,Ministerio de Salud Pública,15:57:42,http://pbs.twimg.com/profile_images/1471842908043190279/bu1LHFWL.jpg
#JuntosVamosPorMás | El Gobierno del @DrGiammattei continúa fortaleciendo la seguridad alimentaria y nutricional de… https://t.co/jV0MvPot1S,https://twitter.com/i/web/status/1517624284952342538,22/04/2022 16:00:00,Twitter Media Studio,5,5,Gobierno Guatemala,16:00:00,http://pbs.twimg.com/profile_images/1479793855331459074/NqurElHC.jpg
Mensaje del secretario @klopezoliva de la @scspgt sobre la desescalada de medidas sobre la pandemia del #COVID19. https://t.co/yhOuDTGnv7,https://twitter.com/i/web/status/1517624597188775937,22/04/2022 16:01:14,"<a href=""https://periscope.tv"" rel=""nofollow"">Periscope",15,14,Gobierno Guatemala,16:01:14,http://pbs.twimg.com/profile_images/1479793855331459074/NqurElHC.jpg
#BrigadasMSPAS | Inscribe a tu #Iglesia para que el Ministerio de Salud Pública y Asistencia Social acerque la vacu… https://t.co/10yNgLPqP9,https://twitter.com/i/web/status/1517624688079425538,22/04/2022 16:01:36,"<a href=""https://www.socialgest.net"" rel=""nofollow"">SocialGest",0,0,Ministerio de Salud Pública,16:01:36,http://pbs.twimg.com/profile_images/1471842908043190279/bu1LHFWL.jpg
#NoticiasMSPAS | Guatemala se une a la 20° Semana de la Vacunación de las Américas. Lea todos los detalles aquí:… https://t.co/h0CxvT1lbq,https://twitter.com/i/web/status/1517624853700001792,22/04/2022 16:02:15,Twitter Web App,0,0,Ministerio de Salud Pública,16:02:15,http://pbs.twimg.com/profile_images/1471842908043190279/bu1LHFWL.jpg
RT @GuatemalaGob: Mensaje del secretario @klopezoliva de la @scspgt sobre la desescalada de medidas sobre la pandemia del #COVID19. https:/…,https://twitter.com/i/web/status/1517625197158973442,22/04/2022 16:03:37,Twitter for iPhone,0,14,MINEX Guatemala 🇬🇹,16:03:37,http://pbs.twimg.com/profile_images/1471828089491574785/eD5OEVK6.jpg
"El señor Javier Zepeda presentó al presidente de República Dominicana, @luisabinader, las #CartasCredenciales que l… https://t.co/Ax9FATPFy8",https://twitter.com/i/web/status/1517625648319275009,22/04/2022 16:05:25,Twitter Web App,5,1,MINEX Guatemala 🇬🇹,16:05:25,http://pbs.twimg.com/profile_images/1471828089491574785/eD5OEVK6.jpg
RT @SCSPGT: Mensaje del secretario @klopezoliva de la @scspgt sobre la desescalada de medidas sobre la pandemia del #COVID19. https://t.co/…,https://twitter.com/i/web/status/1517627541540020224,22/04/2022 16:12:56,Twitter Web App,0,23,MinGob,16:12:56,http://pbs.twimg.com/profile_images/1471828174598246407/Y1Lm5nFE.jpg
#GiraPresidencial2022 | El presidente @DrGiammattei se reunió con el gobernador y alcaldes de #Quetzaltenango en el… https://t.co/cqeYjZw1rw,https://twitter.com/i/web/status/1517628461388640258,22/04/2022 16:16:36,Twitter Web App,1,0,Gobierno Guatemala,16:16:36,http://pbs.twimg.com/profile_images/1479793855331459074/NqurElHC.jpg
#GiraPresidencial2022 | Durante la reunión las autoridades locales destacaron el trabajo en conjunto realizado con… https://t.co/moOY5WI5rL,https://twitter.com/i/web/status/1517628463540228099,22/04/2022 16:16:36,Twitter Web App,1,0,Gobierno Guatemala,16:16:36,http://pbs.twimg.com/profile_images/1479793855331459074/NqurElHC.jpg
"#GiraPresidencial2022 | El ministro del @marngt, @MarioRojas11, compartió con los alcaldes el #Reglamento164 de ges… https://t.co/p7QshnwXjT",https://twitter.com/i/web/status/1517628466828611584,22/04/2022 16:16:37,Twitter Web App,4,0,Gobierno Guatemala,16:16:37,http://pbs.twimg.com/profile_images/1479793855331459074/NqurElHC.jpg
#GiraPresidencial2022 | El presidente @DrGiammattei presentó un resumen de los proyectos ejecutados en… https://t.co/EuNR7L1v3v,https://twitter.com/i/web/status/1517628469101871105,22/04/2022 16:16:37,Twitter Web App,2,0,Gobierno Guatemala,16:16:37,http://pbs.twimg.com/profile_images/1479793855331459074/NqurElHC.jpg
"#GiraPresidencial2022 | “Yo creo en el desarrollo de los municipios”, expresó el presidente @DrGiammattei quien enf… https://t.co/cVKpza9iOM",https://twitter.com/i/web/status/1517628472088223750,22/04/2022 16:16:38,Twitter Web App,2,1,Gobierno Guatemala,16:16:38,http://pbs.twimg.com/profile_images/1479793855331459074/NqurElHC.jpg
#GiraPresidencial2022 | El presidente @DrGiammattei instó a los alcaldes a presentar los proyectos de desarrollo co… https://t.co/GkIoXXvMaq,https://twitter.com/i/web/status/1517628475628261379,22/04/2022 16:16:39,Twitter Web App,5,3,Gobierno Guatemala,16:16:39,http://pbs.twimg.com/profile_images/1479793855331459074/NqurElHC.jpg
Segunda Brigada de Policía Militar del #EjércitoGT participó en acto protocolario en conmemoración del “Día Interna… https://t.co/Z08WXD65H9,https://twitter.com/i/web/status/1517628709095854082,22/04/2022 16:17:35,Twitter for Android,7,4,Ejército Guatemala,16:17:35,http://pbs.twimg.com/profile_images/1471838829430640640/0yNoNrwr.jpg
"Segunda Brigada de Infantería del #EjércitoGT en coordinación con las Fuerzas Armadas de #Honduras, realizaron oper… https://t.co/fGQBW3HBkQ",https://twitter.com/i/web/status/1517630370342219778,22/04/2022 16:24:11,Twitter for Android,10,5,Ejército Guatemala,16:24:11,http://pbs.twimg.com/profile_images/1471838829430640640/0yNoNrwr.jpg
RT @SCSPGT: Mensaje del secretario @klopezoliva de la @scspgt sobre la desescalada de medidas sobre la pandemia del #COVID19. https://t.co/…,https://twitter.com/i/web/status/1517631005674422276,22/04/2022 16:26:42,Twitter for Android,0,23,Ejército Guatemala,16:26:42,http://pbs.twimg.com/profile_images/1471838829430640640/0yNoNrwr.jpg
"#SomosValentina 💜

Nuestro compañero de la Unidad de Comunicación Social del Ministerio de Gobernación, agradecerá… https://t.co/q7dkSFULxD",https://twitter.com/i/web/status/1517633173684953088,22/04/2022 16:35:19,Twitter Web App,3,2,MinGob,16:35:19,http://pbs.twimg.com/profile_images/1471828174598246407/Y1Lm5nFE.jpg
#Información | Durante la semana comprendida del 18 al 22 de abril se han emitido 129 pasaportes a trabajadores tem… https://t.co/Og5uPYX9sa,https://twitter.com/i/web/status/1517634764865421319,22/04/2022 16:41:38,Twitter for Android,1,1,Migración Guatemala,16:41:38,http://pbs.twimg.com/profile_images/1472975116015386625/qXTSRrI2.jpg
"Segunda Brigada de Infantería del #EjércitoGT en coordinación con las Fuerzas Armadas de #ElSalvador, realizaron op… https://t.co/ixyfeO341k",https://twitter.com/i/web/status/1517640081242304513,22/04/2022 17:02:46,Twitter for Android,7,4,Ejército Guatemala,17:02:46,http://pbs.twimg.com/profile_images/1471838829430640640/0yNoNrwr.jpg
#Información | Este día ingresaron a nuestro país 03 buses con 96 guatemaltecos. En la recepción se constató que ve… https://t.co/c7wPM3IKe9,https://twitter.com/i/web/status/1517645828034289666,22/04/2022 17:25:36,Twitter for Android,2,0,Migración Guatemala,17:25:36,http://pbs.twimg.com/profile_images/1472975116015386625/qXTSRrI2.jpg
RT @SCSPGT: Mensaje del secretario @klopezoliva de la @scspgt sobre la desescalada de medidas sobre la pandemia del #COVID19. https://t.co/…,https://twitter.com/i/web/status/1517647413472907268,22/04/2022 17:31:54,Twitter for iPhone,0,23,Ministerio de Salud Pública,17:31:54,http://pbs.twimg.com/profile_images/1471842908043190279/bu1LHFWL.jpg
#GuateSegura | La @PNCdeGuatemala captura a un presunto integrante de una banda criminal señalado de asociación ilí… https://t.co/EYJEzckF2I,https://twitter.com/i/web/status/1517654491507544066,22/04/2022 18:00:02,Twitter Web App,0,1,Gobierno Guatemala,18:00:02,http://pbs.twimg.com/profile_images/1479793855331459074/NqurElHC.jpg
El @ConsGuaMcAllen asistió en la repatriación de una connacional que perdió la vida en el desierto luego de haber i… https://t.co/ZgM3u7rioR,https://twitter.com/i/web/status/1517655556068200449,22/04/2022 18:04:15,Twitter for Android,1,1,MINEX Guatemala 🇬🇹,18:04:15,http://pbs.twimg.com/profile_images/1471828089491574785/eD5OEVK6.jpg
"Brigada de Fuerzas Especiales del #EjércitoGT llevó a cabo acto cívico en conmemoración al ""Día Internacional de Ti… https://t.co/GyQtBrePNU",https://twitter.com/i/web/status/1517655889993474053,22/04/2022 18:05:35,Twitter for Android,3,4,Ejército Guatemala,18:05:35,http://pbs.twimg.com/profile_images/1471838829430640640/0yNoNrwr.jpg
"Asimismo, destacó la importancia de continuar con el II Curso de Actualización sobre el Sistema Jurídico Interameri… https://t.co/mmDm6BTYyd",https://twitter.com/i/web/status/1517656675406262274,22/04/2022 18:08:42,Twitter Web App,0,0,MINEX Guatemala 🇬🇹,18:08:42,http://pbs.twimg.com/profile_images/1471828089491574785/eD5OEVK6.jpg
El #CancillerGT @MarioBucaroGT agradeció al Secretario de Asuntos Jurídicos @OEA_oficial y a @OEA_Justicia por la a… https://t.co/hqHevjvaqI,https://twitter.com/i/web/status/1517656672323448832,22/04/2022 18:08:42,Twitter Web App,3,1,MINEX Guatemala 🇬🇹,18:08:42,http://pbs.twimg.com/profile_images/1471828089491574785/eD5OEVK6.jpg
