Contenido,IR,Fecha,Dispositivo,Likes,Retweets,Entidad,Hora,Foto
"#GestiónMinfin | El Ministro de Finanzas Públicas, @alvarogricci y el Presidente de @el_BID, Mauricio Claver-Carone… https://t.co/jDCG9JBlqa",https://twitter.com/i/web/status/1498846699414073347,01/03/2022 20:24:35,Twitter for Android,7,2,Ministerio de Finanzas de Guatemala,20:24:35,http://pbs.twimg.com/profile_images/1471837102618853383/4xfotDwN.jpg
"Te invitamos a ver el #InformeNacional 👇

✅#Minfin participó en la  presentación de proyecto que beneficiará a más… https://t.co/v0DupfG3SH",https://twitter.com/i/web/status/1498868651524608005,01/03/2022 21:51:48,Twitter for Android,5,0,Ministerio de Finanzas de Guatemala,21:51:48,http://pbs.twimg.com/profile_images/1471837102618853383/4xfotDwN.jpg
"✅Realizan operativos contra el contrabando 
✅Nuevas instalaciones en el @HospigenGT 
@GuatemalaGob @DiariodeCA… https://t.co/AeuIFFdP0s",https://twitter.com/i/web/status/1498868654330585090,01/03/2022 21:51:49,Twitter for Android,2,1,Ministerio de Finanzas de Guatemala,21:51:49,http://pbs.twimg.com/profile_images/1471837102618853383/4xfotDwN.jpg
RT @AGN_noticias: #EntrevistaAGN | El representante del Banco Interamericano de Desarrollo indicó cuáles son las áreas a las que les debe a…,https://twitter.com/i/web/status/1499032831661641728,02/03/2022 08:44:12,Twitter Web App,0,2,Ministerio de Finanzas de Guatemala,08:44:12,http://pbs.twimg.com/profile_images/1471837102618853383/4xfotDwN.jpg
#GestiónMinfin | En el Ministerio de Finanzas Públicas priorizamos la inversión de los recursos públicos que fortal… https://t.co/0GdH14ycEC,https://twitter.com/i/web/status/1499058305376923654,02/03/2022 10:25:25,Twitter Web App,3,0,Ministerio de Finanzas de Guatemala,10:25:25,http://pbs.twimg.com/profile_images/1471837102618853383/4xfotDwN.jpg
"🌎 Debemos priorizar a las mujeres para garantizar que estén protegidas de lo peor de la pandemia. 
 Necesitamos pro… https://t.co/16WGm17Agx",https://twitter.com/i/web/status/1499064148931629059,02/03/2022 10:48:39,Twitter Web App,5,2,OPS/OMS,10:48:39,http://pbs.twimg.com/profile_images/1096094749902028801/ijbQWupW.png
"Debemos asegurarnos de que nuestros trabajadores/as de la salud estén 💉, para que los que están en primera línea es… https://t.co/N1rAYF7C5z",https://twitter.com/i/web/status/1499064761451008009,02/03/2022 10:51:05,Twitter Web App,5,6,OPS/OMS,10:51:05,http://pbs.twimg.com/profile_images/1096094749902028801/ijbQWupW.png
🌎 No olvidemos que las mujeres deben ser parte de la recuperación de la pandemia y más allá - @DirOPSPAHO #COVID19… https://t.co/YdqavgYGHO,https://twitter.com/i/web/status/1499065728296787969,02/03/2022 10:54:55,Twitter Web App,7,4,OPS/OMS,10:54:55,http://pbs.twimg.com/profile_images/1096094749902028801/ijbQWupW.png
"🌎En la región de las Américas, las mujeres representan solo el 30 % de los expertos que dan forma a las estrategias… https://t.co/BNPrXerwfT",https://twitter.com/i/web/status/1499066103120674822,02/03/2022 10:56:24,Twitter Web App,5,4,OPS/OMS,10:56:24,http://pbs.twimg.com/profile_images/1096094749902028801/ijbQWupW.png
RT @EmbaGuateCanada: La @EmbaGuateCanada avec son Conseillère Commercial et @InguatPrensa organisent #FAMTRIP en Mars 2022 avec 6 important…,https://twitter.com/i/web/status/1499071222038114305,02/03/2022 11:16:45,Twitter Web App,0,7,MINEX Guatemala 🇬🇹,11:16:45,http://pbs.twimg.com/profile_images/1471828089491574785/eD5OEVK6.jpg
"RT @OPSOMS_Col: “Vemos en el Observatorio Nacional de Equidad en Salud #ONES, un modelo para apoyar, fortalecer y expandir una iniciativa c…",https://twitter.com/i/web/status/1499074514935848966,02/03/2022 11:29:50,Twitter for iPhone,0,6,OPS/OMS,11:29:50,http://pbs.twimg.com/profile_images/1096094749902028801/ijbQWupW.png
"RT @panaftosa_inf: IVVO cuenta con la posibilidad de realizar diferentes tipos de vigilancia en salud pública veterinaria.
Vigilancia pasiv…",https://twitter.com/i/web/status/1499075126591164419,02/03/2022 11:32:16,Twitter for iPhone,0,3,OPS/OMS,11:32:16,http://pbs.twimg.com/profile_images/1096094749902028801/ijbQWupW.png
RT @el_BID: El Pdte. Claver-Carone habló con el Ministro de Finanzas @alvarogricci @MinfinGT y el Pdte. del @Banguat Sergio Recinos de #Gua…,https://twitter.com/i/web/status/1499080350210965514,02/03/2022 11:53:01,Twitter Web App,0,4,Ministerio de Finanzas de Guatemala,11:53:01,http://pbs.twimg.com/profile_images/1471837102618853383/4xfotDwN.jpg
#CancillerGt @MarioBucaroGT participó en reunión de emergencia del Consejo de Gobierno de @CommunityofDem por la si… https://t.co/pJMbvXmOki,https://twitter.com/i/web/status/1499090893718147076,02/03/2022 12:34:55,Twitter Web App,11,6,MINEX Guatemala 🇬🇹,12:34:55,http://pbs.twimg.com/profile_images/1471828089491574785/eD5OEVK6.jpg
El @ConsGuateTucson brindó asistencia y protección a migrante connacional que fue rescatada luego de haber estado p… https://t.co/sX20eYGVQk,https://twitter.com/i/web/status/1499091821926010882,02/03/2022 12:38:36,Twitter Web App,1,2,MINEX Guatemala 🇬🇹,12:38:36,http://pbs.twimg.com/profile_images/1471828089491574785/eD5OEVK6.jpg
"En la región de las Américas 🌎, alrededor de 217 millones de personas viven con pérdida auditiva, es decir, el 21,5… https://t.co/YO1WedtG7x",https://twitter.com/i/web/status/1499109373674766347,02/03/2022 13:48:21,Twitter Web App,12,6,OPS/OMS,13:48:21,http://pbs.twimg.com/profile_images/1096094749902028801/ijbQWupW.png
"El Ministro @alvarogricci y los Viceministros lamentan el fallecimiento del señor Aníbal de León, quien formó parte… https://t.co/M8rik3O55F",https://twitter.com/i/web/status/1499121255521345539,02/03/2022 14:35:34,Twitter Web App,1,0,Ministerio de Finanzas de Guatemala,14:35:34,http://pbs.twimg.com/profile_images/1471837102618853383/4xfotDwN.jpg
"RT @OPSOMS_Col: ""Solo lograremos la salud universal cuando nos libremos de la pesada carga de la inequidad"": dr. Oscar Mújica, asesor regio…",https://twitter.com/i/web/status/1499126806229790726,02/03/2022 14:57:37,Twitter for iPhone,0,6,OPS/OMS,14:57:37,http://pbs.twimg.com/profile_images/1096094749902028801/ijbQWupW.png
"RT @AGN_noticias: #GuateCrece | @el_BID reiteró apoyo a Plan #GuatemalaNoSeDetiene, creado para promover el desarrollo económico.

#Economí…",https://twitter.com/i/web/status/1499130649709531146,02/03/2022 15:12:54,Twitter Web App,0,1,Ministerio de Finanzas de Guatemala,15:12:54,http://pbs.twimg.com/profile_images/1471837102618853383/4xfotDwN.jpg
#BrevesMSPAS | El Hospital General San Juan de Dios inaugura nueva sala de Emergencia de Ginecología y Obstetricia.… https://t.co/oolqPUSFyW,https://twitter.com/i/web/status/1499137529244798976,02/03/2022 15:40:14,Twitter Web App,1,0,Ministerio de Salud Pública,15:40:14,http://pbs.twimg.com/profile_images/1471842908043190279/bu1LHFWL.jpg
"#MSPAS | En esta jornada de intensificación, el personal de salud realizó visitas de casa en casa, las cuales repre… https://t.co/iK1iUlxoQL",https://twitter.com/i/web/status/1499140767486513161,02/03/2022 15:53:06,Twitter Web App,0,0,Ministerio de Salud Pública,15:53:06,http://pbs.twimg.com/profile_images/1471842908043190279/bu1LHFWL.jpg
"#UnidosContraElCovid | Estuardo Sicán, portero de @Rojos_Municipal lanza una invitación para vacunarse contra el CO… https://t.co/1jZmrwCKu0",https://twitter.com/i/web/status/1499141987219431429,02/03/2022 15:57:57,Twitter Web App,2,0,Ministerio de Salud Pública,15:57:57,http://pbs.twimg.com/profile_images/1471842908043190279/bu1LHFWL.jpg
"RT @ConsGRI: CONSRHODEISLAND participó en la reunión del Grupo de  Consulados de América Latina y El Caribe GRULAC, para conversar sobre la…",https://twitter.com/i/web/status/1499145940619436046,02/03/2022 16:13:39,Twitter Web App,0,3,MINEX Guatemala 🇬🇹,16:13:39,http://pbs.twimg.com/profile_images/1471828089491574785/eD5OEVK6.jpg
La Dirección de Área de Salud de Quiché inauguró la ampliación del Centro de Atención Permanente de San Bartolomé J… https://t.co/GNYS9qbM7S,https://twitter.com/i/web/status/1499147233127772164,02/03/2022 16:18:47,Twitter Web App,2,0,Ministerio de Salud Pública,16:18:47,http://pbs.twimg.com/profile_images/1471842908043190279/bu1LHFWL.jpg
"Esto, es posible gracias al apoyo del Alcalde Municipal, Sociedad Civil y el CODEDE. https://t.co/EXBdwj5EWe",https://twitter.com/i/web/status/1499147323062034435,02/03/2022 16:19:09,Twitter Web App,0,0,Ministerio de Salud Pública,16:19:09,http://pbs.twimg.com/profile_images/1471842908043190279/bu1LHFWL.jpg
".@GuatemalaGob nombró a @tagairlines como aerolínea bandera de Guatemala 🇬🇹, una empresa cien por ciento nacional q… https://t.co/c3My06XhiB",https://twitter.com/i/web/status/1499153965941985281,02/03/2022 16:45:33,Twitter for Android,10,4,MINEX Guatemala 🇬🇹,16:45:33,http://pbs.twimg.com/profile_images/1471828089491574785/eD5OEVK6.jpg
#GuateAvanza | Dan inicio al proceso de remoción de bienes inservibles en todos los establecimientos educativos púb… https://t.co/cC379mLkkc,https://twitter.com/i/web/status/1499156021520044033,02/03/2022 16:53:43,Twitter Web App,5,6,Gobierno Guatemala,16:53:43,http://pbs.twimg.com/profile_images/1479793855331459074/NqurElHC.jpg
"#GuateAvanza | El proceso permitirá desocupar las áreas como terrazas, patios y salones para que sean utilizados a… https://t.co/Xei8DtWIiX",https://twitter.com/i/web/status/1499156026112806913,02/03/2022 16:53:44,Twitter Web App,8,5,Gobierno Guatemala,16:53:44,http://pbs.twimg.com/profile_images/1479793855331459074/NqurElHC.jpg
"#GuateAvanza | La ministra del @MineducGT, Claudia Ruíz, resaltó que el procedimiento será de beneficio para la sal… https://t.co/j6Z266XX27",https://twitter.com/i/web/status/1499156030420398080,02/03/2022 16:53:45,Twitter Web App,6,5,Gobierno Guatemala,16:53:45,http://pbs.twimg.com/profile_images/1479793855331459074/NqurElHC.jpg
RT @GuatemalaGob: #GuateAvanza | Dan inicio al proceso de remoción de bienes inservibles en todos los establecimientos educativos públicos…,https://twitter.com/i/web/status/1499156317692469260,02/03/2022 16:54:53,Twitter for Android,0,6,Ejército Guatemala,16:54:53,http://pbs.twimg.com/profile_images/1471838829430640640/0yNoNrwr.jpg
"RT @GuatemalaGob: #GuateAvanza | El proceso permitirá desocupar las áreas como terrazas, patios y salones para que sean utilizados a conven…",https://twitter.com/i/web/status/1499156335606259726,02/03/2022 16:54:58,Twitter for Android,0,5,Ejército Guatemala,16:54:58,http://pbs.twimg.com/profile_images/1471838829430640640/0yNoNrwr.jpg
"RT @GuatemalaGob: #GuateAvanza | La ministra del @MineducGT, Claudia Ruíz, resaltó que el procedimiento será de beneficio para la salud de…",https://twitter.com/i/web/status/1499156345936912386,02/03/2022 16:55:00,Twitter for Android,0,5,Ejército Guatemala,16:55:00,http://pbs.twimg.com/profile_images/1471838829430640640/0yNoNrwr.jpg
"""Muchos países ya han dado prioridad a las mujeres embarazadas para las 💉 vacunas. Es fundamental que los trabajado… https://t.co/Whx8BQviKR",https://twitter.com/i/web/status/1499157603955392519,02/03/2022 17:00:00,Twitter Media Studio,14,11,OPS/OMS,17:00:00,http://pbs.twimg.com/profile_images/1096094749902028801/ijbQWupW.png
#GiraPresidencial2022 | Las obras inauguradas por el Gobierno del presidente @DrGiammattei en El Progreso serán de… https://t.co/fykuVRLQt0,https://twitter.com/i/web/status/1499157608447442945,02/03/2022 17:00:01,Twitter Media Studio,7,7,Gobierno Guatemala,17:00:01,http://pbs.twimg.com/profile_images/1479793855331459074/NqurElHC.jpg
🛎️ La falta de acceso a la atención oportuna y la interrupción de los servicios prenatales son los responsables del… https://t.co/36olWCOBAY,https://twitter.com/i/web/status/1499162927580000263,02/03/2022 17:21:09,Twitter Web App,16,14,OPS/OMS,17:21:09,http://pbs.twimg.com/profile_images/1096094749902028801/ijbQWupW.png
Guatemala copatrocinó y votó a favor de la histórica resolución de la ONU en la que 141 países reprueban la agresió… https://t.co/qCakV95ixq,https://twitter.com/i/web/status/1499167186249732099,02/03/2022 17:38:05,Twitter for Android,11,6,MINEX Guatemala 🇬🇹,17:38:05,http://pbs.twimg.com/profile_images/1471828089491574785/eD5OEVK6.jpg
"#FinanzasSaludables 💡 | ¿Ya estableciste tu plan de ahorro? 
Te presentamos algunos pasos esenciales 👇 https://t.co/orNqogaW5z",https://twitter.com/i/web/status/1499171463986880512,02/03/2022 17:55:04,Twitter for Android,0,0,Ministerio de Finanzas de Guatemala,17:55:04,http://pbs.twimg.com/profile_images/1471837102618853383/4xfotDwN.jpg
#GuateEsVida https://t.co/b0F1I1kRM3,https://twitter.com/i/web/status/1499172705999884291,02/03/2022 18:00:01,Twitter Web App,8,6,Gobierno Guatemala,18:00:01,http://pbs.twimg.com/profile_images/1479793855331459074/NqurElHC.jpg
Brigada Especial de Operaciones de Selva del #EjércitoGT | #MINDEF apoya al @MinSaludGuate en la organización y fun… https://t.co/9AUOU92LgU,https://twitter.com/i/web/status/1499173991386337285,02/03/2022 18:05:07,Twitter for Android,8,2,Ejército Guatemala,18:05:07,http://pbs.twimg.com/profile_images/1471838829430640640/0yNoNrwr.jpg
"¡Buenas tardes Guatemala! 🇬🇹

Soldados del Comando Aéreo del Sur del #EjércitoGT | #MINDEF te saludan. https://t.co/dZyI9Zzdq3",https://twitter.com/i/web/status/1499174953169661953,02/03/2022 18:08:56,Twitter for Android,18,2,Ejército Guatemala,18:08:56,http://pbs.twimg.com/profile_images/1471838829430640640/0yNoNrwr.jpg
"¡Buenas tardes Guatemala! 🇬🇹

Soldados de la Tercera Brigada de Infantería del #EjércitoGT | #MINDEF te saludan. https://t.co/V1VRx8CHxK",https://twitter.com/i/web/status/1499177951413342213,02/03/2022 18:20:51,Twitter for Android,26,2,Ejército Guatemala,18:20:51,http://pbs.twimg.com/profile_images/1471838829430640640/0yNoNrwr.jpg
"#ControlMigratorio | ¡Atención! ⚠️  El @MinSaludGuate solicita los siguientes requisitos, para ingresar a territori… https://t.co/YJwi6jNmu2",https://twitter.com/i/web/status/1499179676958351360,02/03/2022 18:27:43,Twitter for iPhone,0,1,Migración Guatemala,18:27:43,http://pbs.twimg.com/profile_images/1472975116015386625/qXTSRrI2.jpg
"El Ministro de Salud, Francisco Coma asistió a la primer jornada de vacunación contra COVID-19, realizada a través… https://t.co/Vsj4pRrs6i",https://twitter.com/i/web/status/1499180253721157640,02/03/2022 18:30:00,Twitter Web App,2,0,Ministerio de Salud Pública,18:30:00,http://pbs.twimg.com/profile_images/1471842908043190279/bu1LHFWL.jpg
Presentan estadísticas de seguridad y acciones de prevención a gobernadores https://t.co/llsCGhEPSW,https://twitter.com/i/web/status/1499183882779901953,02/03/2022 18:44:25,"<a href=""http://publicize.wp.com/"" rel=""nofollow"">WordPress.com",3,4,MinGob,18:44:25,http://pbs.twimg.com/profile_images/1471828174598246407/Y1Lm5nFE.jpg
#GuateEnElMundo | Guatemala ha consolidado una relación estratégica con Estados Unidos para abordar de manera conju… https://t.co/KRVkB6x75K,https://twitter.com/i/web/status/1499184496243093506,02/03/2022 18:46:52,Twitter for Android,2,5,Gobierno Guatemala,18:46:52,http://pbs.twimg.com/profile_images/1479793855331459074/NqurElHC.jpg
RT @Gob_SanMarcos: Elementos del @Ejercito_GT concluyeron el curso que permite estar preparados ante algún incendio forestal que se pueda r…,https://twitter.com/i/web/status/1499187156350291968,02/03/2022 18:57:26,Twitter for Android,0,5,Ejército Guatemala,18:57:26,http://pbs.twimg.com/profile_images/1471838829430640640/0yNoNrwr.jpg
#JuntosVamosPorMás | El Gobierno del presidente @DrGiammattei continúa llevando el desarrollo a las comunidades más… https://t.co/Z5vbrZYXhK,https://twitter.com/i/web/status/1499187802424197123,02/03/2022 19:00:00,Twitter Media Studio,37,34,Gobierno Guatemala,19:00:00,http://pbs.twimg.com/profile_images/1479793855331459074/NqurElHC.jpg
"RT @CONAPgt: #ÁreaProtegidaGT | 𝗣𝗮𝗿𝗾𝘂𝗲 𝗡𝗮𝗰𝗶𝗼𝗻𝗮𝗹 𝗦𝗶𝗽𝗮𝗰𝗮𝘁𝗲 𝗡𝗮𝗿𝗮𝗻𝗷𝗼 🌱🌊🇬🇹
Conserva especies forestales valiosas y  además es #santuario de una…",https://twitter.com/i/web/status/1499189324524527622,02/03/2022 19:06:03,Twitter for iPhone,0,2,Gobierno Guatemala,19:06:03,http://pbs.twimg.com/profile_images/1479793855331459074/NqurElHC.jpg
RT @GuatemalaGob: #JuntosVamosPorMás | El Gobierno del presidente @DrGiammattei continúa llevando el desarrollo a las comunidades más lejan…,https://twitter.com/i/web/status/1499189438919888900,02/03/2022 19:06:30,Twitter for Android,0,34,Ejército Guatemala,19:06:30,http://pbs.twimg.com/profile_images/1471838829430640640/0yNoNrwr.jpg
"RT @InguatPrensa: Pronto volveremos a sentir la Semana Santa con los 5 sentidos…

 #SienteGuatemala
 #SemanaSanta2022 https://t.co/kSW6JlcG…",https://twitter.com/i/web/status/1499189871981875205,02/03/2022 19:08:13,Twitter for iPhone,0,13,Gobierno Guatemala,19:08:13,http://pbs.twimg.com/profile_images/1479793855331459074/NqurElHC.jpg
"Primera Brigada de Policía Militar ""Guardia de Honor"" del #EjércitoGT apoyó en el proceso de remoción de bienes ins… https://t.co/xXkz30cfg0",https://twitter.com/i/web/status/1499191808416436224,02/03/2022 19:15:55,Twitter for Android,8,3,Ejército Guatemala,19:15:55,http://pbs.twimg.com/profile_images/1471838829430640640/0yNoNrwr.jpg
RT @GuatemalaGob: #JuntosVamosPorMás | El Gobierno del presidente @DrGiammattei continúa llevando el desarrollo a las comunidades más lejan…,https://twitter.com/i/web/status/1499192304275443718,02/03/2022 19:17:53,Twitter for iPhone,0,34,MinGob,19:17:53,http://pbs.twimg.com/profile_images/1471828174598246407/Y1Lm5nFE.jpg
RT @GuatemalaGob: #JuntosVamosPorMás | El Gobierno del presidente @DrGiammattei continúa llevando el desarrollo a las comunidades más lejan…,https://twitter.com/i/web/status/1499196837332402191,02/03/2022 19:35:54,Twitter for Android,0,34,MINEX Guatemala 🇬🇹,19:35:54,http://pbs.twimg.com/profile_images/1471828089491574785/eD5OEVK6.jpg
"RT @InguatPrensa: Pronto volveremos a sentir la Semana Santa con los 5 sentidos…

 #SienteGuatemala
 #SemanaSanta2022 https://t.co/kSW6JlcG…",https://twitter.com/i/web/status/1499197465580478466,02/03/2022 19:38:24,Twitter for Android,0,13,MINEX Guatemala 🇬🇹,19:38:24,http://pbs.twimg.com/profile_images/1471828089491574785/eD5OEVK6.jpg
"#TuDenunciaEsConfidencial 🗣📞🕵🏻‍

#YoDenuncio

Se dará seguimiento y respuesta a toda la información que usted brinde https://t.co/PYtnrdDAw9",https://twitter.com/i/web/status/1499202903701135365,02/03/2022 20:00:00,Twitter Media Studio,0,0,MinGob,20:00:00,http://pbs.twimg.com/profile_images/1471828174598246407/Y1Lm5nFE.jpg
[#Video] 📹 Personal del Ministerio de Gobernación recibe Cruz de Ceniza https://t.co/fE1g3lEzTq,https://twitter.com/i/web/status/1499202994759479299,02/03/2022 20:00:22,Twitter for iPhone,2,2,MinGob,20:00:22,http://pbs.twimg.com/profile_images/1471828174598246407/Y1Lm5nFE.jpg
#TodosSomosMigrantes | Compartimos nuestra campaña en Qanjobal.  Todos hemos sido migrantes alguna vez en la vida.… https://t.co/JfQWHkkwvc,https://twitter.com/i/web/status/1499207957950648329,02/03/2022 20:20:05,Hootsuite Inc.,1,0,Migración Guatemala,20:20:05,http://pbs.twimg.com/profile_images/1472975116015386625/qXTSRrI2.jpg
#Actualización| #MSPAS informa este 2 de marzo de 2022 los casos confirmados por laboratorio en el tablero Situació… https://t.co/Q4myfCmavm,https://twitter.com/i/web/status/1499210251043803137,02/03/2022 20:29:12,Twitter Web App,10,2,Ministerio de Salud Pública,20:29:12,http://pbs.twimg.com/profile_images/1471842908043190279/bu1LHFWL.jpg
⚠️ En el tablero COVID-19 los fallecidos reportados el día anterior se visualizan por la fecha de defunción. Estos… https://t.co/mjKf8eev6w,https://twitter.com/i/web/status/1499210290453708802,02/03/2022 20:29:21,Twitter Web App,0,0,Ministerio de Salud Pública,20:29:21,http://pbs.twimg.com/profile_images/1471842908043190279/bu1LHFWL.jpg
El #MSPAS informa la cantidad de personas que han recibido la primera dosis y el esquema completo de la vacuna cont… https://t.co/bWTfgjiKMA,https://twitter.com/i/web/status/1499210694302081026,02/03/2022 20:30:58,Twitter Web App,6,2,Ministerio de Salud Pública,20:30:58,http://pbs.twimg.com/profile_images/1471842908043190279/bu1LHFWL.jpg
#InformeNacional | 2 de marzo de 2022. https://t.co/Rhjm50FpXD,https://twitter.com/i/web/status/1499213599268552705,02/03/2022 20:42:30,Twitter for Android,10,11,Gobierno Guatemala,20:42:30,http://pbs.twimg.com/profile_images/1479793855331459074/NqurElHC.jpg
#InformeNacional | 2 de marzo de 2022. https://t.co/Qol6Ry1TM3,https://twitter.com/i/web/status/1499216413315186688,02/03/2022 20:53:41,Twitter for Android,4,2,Ejército Guatemala,20:53:41,http://pbs.twimg.com/profile_images/1471838829430640640/0yNoNrwr.jpg
#InformeNacional https://t.co/isRkJdrI3L,https://twitter.com/i/web/status/1499216637333016577,02/03/2022 20:54:35,Twitter for Android,1,1,MINEX Guatemala 🇬🇹,20:54:35,http://pbs.twimg.com/profile_images/1471828089491574785/eD5OEVK6.jpg
"Su denuncia es anónima y confidencial, llame a la #LíneaAntinarcótica1577 para informar sobre venta y distribución… https://t.co/MdDY6blSoe",https://twitter.com/i/web/status/1499218006097944582,02/03/2022 21:00:01,Twitter Media Studio,1,0,MinGob,21:00:01,http://pbs.twimg.com/profile_images/1471828174598246407/Y1Lm5nFE.jpg
"#InformeNacional👇

✅Unen esfuerzos para intensificar el plan de vacunación 
✅Resolución autoriza dar de baja bienes… https://t.co/feUOK4I06j",https://twitter.com/i/web/status/1499227308124786690,02/03/2022 21:36:59,Twitter for Android,0,0,Ministerio de Finanzas de Guatemala,21:36:59,http://pbs.twimg.com/profile_images/1471837102618853383/4xfotDwN.jpg
"@OFM2020 Buen día, le comentamos que el Instituto Guatemalteco de Migración atiende casos de emergencia, si este es… https://t.co/djCoig0oWf",https://twitter.com/i/web/status/1499229876666396678,02/03/2022 21:47:11,Twitter for iPhone,1,0,Migración Guatemala,21:47:11,http://pbs.twimg.com/profile_images/1472975116015386625/qXTSRrI2.jpg
RT @GuatemalaGob: #InformeNacional | 2 de marzo de 2022. https://t.co/Rhjm50FpXD,https://twitter.com/i/web/status/1499230828055908357,02/03/2022 21:50:58,Twitter for iPhone,0,11,MinGob,21:50:58,http://pbs.twimg.com/profile_images/1471828174598246407/Y1Lm5nFE.jpg
"@panchointer @arcangelsamael @ZurdiaAaa @hurtadopaola Buenas noches,  le recomendamos hacer su denuncia a través de… https://t.co/UA4x5wgURD",https://twitter.com/i/web/status/1499232116424560643,02/03/2022 21:56:05,Twitter for iPhone,0,0,Migración Guatemala,21:56:05,http://pbs.twimg.com/profile_images/1472975116015386625/qXTSRrI2.jpg
"@carlosmedrano Buen día, le comentamos que el Instituto Guatemalteco de Migración atiende casos de emergencia, si e… https://t.co/OheyaXlsLl",https://twitter.com/i/web/status/1499232286318936064,02/03/2022 21:56:46,Twitter for iPhone,0,0,Migración Guatemala,21:56:46,http://pbs.twimg.com/profile_images/1472975116015386625/qXTSRrI2.jpg
[#Video] 📹 @DTransitoPNC busca reducir la siniestralidad vial en el país https://t.co/Q5gQRcgdhy,https://twitter.com/i/web/status/1499232342128345094,02/03/2022 21:56:59,Twitter for iPhone,0,0,MinGob,21:56:59,http://pbs.twimg.com/profile_images/1471828174598246407/Y1Lm5nFE.jpg
"@JHernan02704831 @ZurdiaAaa @hurtadopaola Buenas noches , para realizar su trámite de gestión de pasaporte debe rea… https://t.co/kB49R2hyz8",https://twitter.com/i/web/status/1499232521900417024,02/03/2022 21:57:42,Twitter for iPhone,0,0,Migración Guatemala,21:57:42,http://pbs.twimg.com/profile_images/1472975116015386625/qXTSRrI2.jpg
@JHernan02704831 @ZurdiaAaa @hurtadopaola Luego programar su cita en línea en el siguiente enlace … https://t.co/Uz0msv4Aoj,https://twitter.com/i/web/status/1499232583074340864,02/03/2022 21:57:56,Twitter for iPhone,0,0,Migración Guatemala,21:57:56,http://pbs.twimg.com/profile_images/1472975116015386625/qXTSRrI2.jpg
@JHernan02704831 @ZurdiaAaa @hurtadopaola La entrega de pasaportes sedes departamentales es en 5 días hábiles. Y en… https://t.co/f54ugKyqVG,https://twitter.com/i/web/status/1499232725492027394,02/03/2022 21:58:30,Twitter for iPhone,0,0,Migración Guatemala,21:58:30,http://pbs.twimg.com/profile_images/1472975116015386625/qXTSRrI2.jpg
"@zapataadr Buenas noches, le comentamos que el Instituto Guatemalteco de Migración atiende casos de emergencia, si… https://t.co/V4EuVNaRwY",https://twitter.com/i/web/status/1499233554940796930,02/03/2022 22:01:48,Twitter for iPhone,0,0,Migración Guatemala,22:01:48,http://pbs.twimg.com/profile_images/1472975116015386625/qXTSRrI2.jpg
[#Video] 📹 Fortalecen acompañamiento policial por denuncias de redes sociales https://t.co/BrS7Ntc4y5,https://twitter.com/i/web/status/1499235083479306241,02/03/2022 22:07:52,Twitter for iPhone,3,1,MinGob,22:07:52,http://pbs.twimg.com/profile_images/1471828174598246407/Y1Lm5nFE.jpg
[#Video] 📹 Presentan estadísticas de seguridad y acciones de prevención a gobernadores https://t.co/VfKPWbj9IB,https://twitter.com/i/web/status/1499236685955145730,02/03/2022 22:14:15,Twitter for iPhone,1,0,MinGob,22:14:15,http://pbs.twimg.com/profile_images/1471828174598246407/Y1Lm5nFE.jpg
[#Video] 📹 #SeguridadyControl4 continúa en Mixco https://t.co/QKOs0v8ED6,https://twitter.com/i/web/status/1499238751402434568,02/03/2022 22:22:27,Twitter for iPhone,2,0,MinGob,22:22:27,http://pbs.twimg.com/profile_images/1471828174598246407/Y1Lm5nFE.jpg
@JHernan02704831 @ZurdiaAaa @hurtadopaola Le comentamos que el trámite es personal.,https://twitter.com/i/web/status/1499242518197768194,02/03/2022 22:37:25,Twitter for iPhone,0,0,Migración Guatemala,22:37:25,http://pbs.twimg.com/profile_images/1472975116015386625/qXTSRrI2.jpg
