Contenido,IR,Fecha,Dispositivo,Likes,Retweets,Entidad,Hora,Foto
"#EnVivo |  Firma de Convenio Interinstitucionales para el fortalecimiento de la carrera diplomática.

▶https://t.co/sg3w1E3Zca",https://twitter.com/i/web/status/1354100995240951809,26/01/2021 10:16:49,Twitter for Android,5,4,MINEX Guatemala 🇬🇹,10:16:49,http://pbs.twimg.com/profile_images/1292832595093475329/6LQbTy36.jpg
El @MinexGt felicita al Pueblo y Gobierno de la República de La India 🇮🇳 por su #DíaDeLaRepública. https://t.co/0smoVd1pvK,https://twitter.com/i/web/status/1354118212791791616,26/01/2021 11:25:14,Twitter Web App,125,10,MINEX Guatemala 🇬🇹,11:25:14,http://pbs.twimg.com/profile_images/1292832595093475329/6LQbTy36.jpg
"El Ministro @MaloufTony, quien participa en el #ForoEconómico2021 explica que la agenda de… https://t.co/onUuACavk5",https://twitter.com/i/web/status/1354127227227664393,26/01/2021 12:01:04,Twitter Web App,5,1,Minfin Guatemala,12:01:04,http://pbs.twimg.com/profile_images/1292831294796320768/6Q8j5vtW.jpg
"El Presidente del @Banguat, Sergio Recinos informó que según el @FMInoticias, Guatemala 🇬🇹 fue uno de los países de… https://t.co/nSehG4Jv1S",https://twitter.com/i/web/status/1354127231757529088,26/01/2021 12:01:05,Twitter Web App,8,0,Minfin Guatemala,12:01:05,http://pbs.twimg.com/profile_images/1292831294796320768/6Q8j5vtW.jpg
"#Información | Se realizan monitoreos constantes en los Puestos Fronterizos de Agua Caliente, Corinto, El Florido;… https://t.co/p4lwWXi3vl",https://twitter.com/i/web/status/1354138208569843717,26/01/2021 12:44:42,Hootsuite Inc.,1,3,Migración Guatemala,12:44:42,http://pbs.twimg.com/profile_images/1346129009051054081/v9JUwo36.jpg
"Ante un periodo de fuerte contracción económica, en donde la economía opera muy por debajo de su potencial, la resp… https://t.co/SvtmT5hOmP",https://twitter.com/i/web/status/1354140018395242500,26/01/2021 12:51:53,Twitter Web App,8,2,Minfin Guatemala,12:51:53,http://pbs.twimg.com/profile_images/1292831294796320768/6Q8j5vtW.jpg
#ReactivaciónEconómicaSocial  |  El Ministro @alvarogricci informa que la inversión para los programas económicos y… https://t.co/R4NJbmzBd4,https://twitter.com/i/web/status/1354140019733233667,26/01/2021 12:51:54,Twitter Web App,3,1,Minfin Guatemala,12:51:54,http://pbs.twimg.com/profile_images/1292831294796320768/6Q8j5vtW.jpg
"El Ministro de Finanzas Públicas, @alvarogricci, explica que los programas sociales que se implementaron permitiero… https://t.co/es5VR4e5ED",https://twitter.com/i/web/status/1354140104172957696,26/01/2021 12:52:14,Twitter Web App,5,1,Minfin Guatemala,12:52:14,http://pbs.twimg.com/profile_images/1292831294796320768/6Q8j5vtW.jpg
#Extranjería | Encuentra el formulario de actualización de datos para residentes y garantes en el siguiente enlace… https://t.co/NzhXBM3MFJ,https://twitter.com/i/web/status/1354142217343000576,26/01/2021 13:00:38,Hootsuite Inc.,0,1,Migración Guatemala,13:00:38,http://pbs.twimg.com/profile_images/1346129009051054081/v9JUwo36.jpg
#ForoEconómico2021 🇬🇹  | Siempre estamos evaluando estrategias y acciones para optimizar y facilitar al contribuyen… https://t.co/FGbpKvbuZE,https://twitter.com/i/web/status/1354151763365003265,26/01/2021 13:38:33,Twitter Web App,3,0,Minfin Guatemala,13:38:33,http://pbs.twimg.com/profile_images/1292831294796320768/6Q8j5vtW.jpg
"#Transparencia 🔍 | Ch@tio se conecta a la base de datos de #Guatecompras, lo cual permite responder las preguntas m… https://t.co/CXjswFHtX0",https://twitter.com/i/web/status/1354160986761162752,26/01/2021 14:15:12,Twitter Web App,5,0,Minfin Guatemala,14:15:12,http://pbs.twimg.com/profile_images/1292831294796320768/6Q8j5vtW.jpg
"📢#AvisoImportante | estamos implementado el nuevo sistema de apostilla electrónica en línea.🖥️

Toma en cuenta lo s… https://t.co/hZ4YxEyeKA",https://twitter.com/i/web/status/1354165224954355718,26/01/2021 14:32:03,Twitter Web App,10,7,MINEX Guatemala 🇬🇹,14:32:03,http://pbs.twimg.com/profile_images/1292832595093475329/6LQbTy36.jpg
"Luego de los exámenes correspondientes para la correcta donación, el director del hospital, Dr. Gerardo Hernández,… https://t.co/PcdPk16w7i",https://twitter.com/i/web/status/1354171899086057473,26/01/2021 14:58:34,Twitter Web App,11,3,Ministerio de Salud Pública,14:58:34,http://pbs.twimg.com/profile_images/1311755159027015685/QQcxgYd1.jpg
#Extranjería | Los formularios para trámite de visas y residencias No tienen costo! Se pueden descargar en… https://t.co/ZuR6fLybio,https://twitter.com/i/web/status/1354172373658963968,26/01/2021 15:00:27,Hootsuite Inc.,0,0,Migración Guatemala,15:00:27,http://pbs.twimg.com/profile_images/1346129009051054081/v9JUwo36.jpg
El #MSPAS logró un abastecimiento adecuado en la red de hospitales y áreas de salud lo que permitió brindar atenció… https://t.co/kskKdQxcSu,https://twitter.com/i/web/status/1354183582445690881,26/01/2021 15:45:00,Twitter Web App,3,1,Ministerio de Salud Pública,15:45:00,http://pbs.twimg.com/profile_images/1311755159027015685/QQcxgYd1.jpg
#NotaDeDuelo | El @GuatemalaGob expresa sus condolencias al Pueblo y Gobierno de la República de #Colombia por el s… https://t.co/KFPpCeDbx8,https://twitter.com/i/web/status/1354197778747035657,26/01/2021 16:41:24,Twitter Web App,9,3,MINEX Guatemala 🇬🇹,16:41:24,http://pbs.twimg.com/profile_images/1292832595093475329/6LQbTy36.jpg
"#BrevesMSPAS
Estamos listos para recibir la #VacunaCOVID19

Conoce la capacidad de almacenamiento de nuestras vacun… https://t.co/9sN9PPxUYn",https://twitter.com/i/web/status/1354198308290506755,26/01/2021 16:43:31,Twitter for Android,10,0,Ministerio de Salud Pública,16:43:31,http://pbs.twimg.com/profile_images/1311755159027015685/QQcxgYd1.jpg
"Mercados 🛍️
Conoce aquí las disposiciones para la contención y prevención del incremento de contagios de #COVID19… https://t.co/8CVdxMWuuJ",https://twitter.com/i/web/status/1354215806205358080,26/01/2021 17:53:02,Twitter for Android,10,0,Ministerio de Salud Pública,17:53:02,http://pbs.twimg.com/profile_images/1311755159027015685/QQcxgYd1.jpg
#Extranjería | Encuentra los requisitos para efectuar tus trámites en https://t.co/4Gtec7fyKe https://t.co/xmhV2d6YlB,https://twitter.com/i/web/status/1354217673429839873,26/01/2021 18:00:28,Hootsuite Inc.,1,0,Migración Guatemala,18:00:28,http://pbs.twimg.com/profile_images/1346129009051054081/v9JUwo36.jpg
#TransparenciaGT 🔍 | El Manual de #ClasificacionesPresupuestarias establece la forma en que se operan y registran l… https://t.co/lyOH3Cc2VB,https://twitter.com/i/web/status/1354224162559176705,26/01/2021 18:26:15,Twitter for Android,3,1,Minfin Guatemala,18:26:15,http://pbs.twimg.com/profile_images/1292831294796320768/6Q8j5vtW.jpg
"En 14 días, los #LaboratoriosMóviles del #MSPAS han realizado 4,173pruebas #COVID19 en los mercados El Guarda, La T… https://t.co/Gx2Hw9pKW7",https://twitter.com/i/web/status/1354232498398625794,26/01/2021 18:59:22,Twitter for Android,5,1,Ministerio de Salud Pública,18:59:22,http://pbs.twimg.com/profile_images/1311755159027015685/QQcxgYd1.jpg
A los casos positivos se les entrega plan educacional y su kit con medicamentos para pacientes leves bajo la prescr… https://t.co/8tWYGQQDSA,https://twitter.com/i/web/status/1354232500210573318,26/01/2021 18:59:23,Twitter for Android,1,1,Ministerio de Salud Pública,18:59:23,http://pbs.twimg.com/profile_images/1311755159027015685/QQcxgYd1.jpg
#Extranjería | Consulta tu estado de expediente ingresando los datos solicitados en https://t.co/4Gtec7fyKe https://t.co/UYI9vHaX0w,https://twitter.com/i/web/status/1354247822288310273,26/01/2021 20:00:16,Hootsuite Inc.,1,0,Migración Guatemala,20:00:16,http://pbs.twimg.com/profile_images/1346129009051054081/v9JUwo36.jpg
"#Recaudación  |  La @SATGT realiza capacitaciones virtuales sobre los procesos tributarios. 
Inscríbete y… https://t.co/8CE760xg8N",https://twitter.com/i/web/status/1354429509500608515,27/01/2021 08:02:13,Twitter Web App,1,2,Minfin Guatemala,08:02:13,http://pbs.twimg.com/profile_images/1292831294796320768/6Q8j5vtW.jpg
"Usa tu mascarilla correctamente, ¡Úsala siempre! 😷

Recuerda, ¡cuidarnos es responsabilidad de todos!… https://t.co/gncp8wYxOV",https://twitter.com/i/web/status/1354436514625822720,27/01/2021 08:30:03,Twitter Web App,10,6,Ministerio de Salud Pública,08:30:03,http://pbs.twimg.com/profile_images/1311755159027015685/QQcxgYd1.jpg
"El #CancillerGT @PedroBroloGT suscribió cuatro convenios de cooperación interinstitucional con la @senacytgt, @uvgg… https://t.co/aDtF9MQ03F",https://twitter.com/i/web/status/1354439057300926468,27/01/2021 08:40:10,Twitter Web App,9,1,MINEX Guatemala 🇬🇹,08:40:10,http://pbs.twimg.com/profile_images/1292832595093475329/6LQbTy36.jpg
#PrimerInformeGT | Nuestras #RelacionesConElMundo 🌎fueron mejoradas y recuperadas a través de una política exterior… https://t.co/Uuwmuc5i35,https://twitter.com/i/web/status/1354444744835870725,27/01/2021 09:02:46,Twitter Web App,2,1,MINEX Guatemala 🇬🇹,09:02:46,http://pbs.twimg.com/profile_images/1292832595093475329/6LQbTy36.jpg
"La Segunda Brigada de Infantería del #EjércitoGT | #MINDEF efectúa puesto de control en el kilómetro 207, El Florid… https://t.co/lfDkDWo3vz",https://twitter.com/i/web/status/1354454427462209544,27/01/2021 09:41:14,Twitter for Android,3,1,Ejército Guatemala,09:41:14,http://pbs.twimg.com/profile_images/1319662500535803906/WdyAkHlu.jpg
La Segunda Brigada de Infantería del #EjércitoGT | #MINDEF realiza patrullajes de seguridad en los departamentos de… https://t.co/1KZzFBJenD,https://twitter.com/i/web/status/1354455542803083267,27/01/2021 09:45:40,Twitter for Android,6,2,Ejército Guatemala,09:45:40,http://pbs.twimg.com/profile_images/1319662500535803906/WdyAkHlu.jpg
"Cuarta Brigada de Infantería del #EjércitoGT | #MINDEF recibe capacitación sobre ""Técnicas Básicas para el Control… https://t.co/kUzqM3EUor",https://twitter.com/i/web/status/1354458308996968450,27/01/2021 09:56:40,Twitter for Android,5,3,Ejército Guatemala,09:56:40,http://pbs.twimg.com/profile_images/1319662500535803906/WdyAkHlu.jpg
"La Primera Brigada de Infantería ""Mariscal Zavala"" del #EjércitoGT | #MINDEF efectúa puesto de control en el kilóme… https://t.co/xgnnYn6oJD",https://twitter.com/i/web/status/1354462906981765121,27/01/2021 10:14:56,Twitter for Android,5,1,Ejército Guatemala,10:14:56,http://pbs.twimg.com/profile_images/1319662500535803906/WdyAkHlu.jpg
"#WeRemember | hoy #27DeEnero rendimos tributo a la memoria de las víctimas del #Holocausto, en contra del antisemit… https://t.co/R3qhYiarwr",https://twitter.com/i/web/status/1354464290338648065,27/01/2021 10:20:26,Twitter Web App,23,15,MINEX Guatemala 🇬🇹,10:20:26,http://pbs.twimg.com/profile_images/1292832595093475329/6LQbTy36.jpg
#ServiciosMinfin | Realiza la actualización de tu Constancia del Registro General de Adquisiciones del Estado #RGAE… https://t.co/LnLTqPFj1C,https://twitter.com/i/web/status/1354464456269574146,27/01/2021 10:21:05,Twitter Web App,0,0,Minfin Guatemala,10:21:05,http://pbs.twimg.com/profile_images/1292831294796320768/6Q8j5vtW.jpg
"Supermercados, tiendas de conveniencia y tiendas de barrio 🛒
Conoce aquí las disposiciones para la contención y pre… https://t.co/WEurgtHpOH",https://twitter.com/i/web/status/1354466472836403207,27/01/2021 10:29:06,Twitter Web App,6,4,Ministerio de Salud Pública,10:29:06,http://pbs.twimg.com/profile_images/1311755159027015685/QQcxgYd1.jpg
Para este 2021 se tiene programado ejecutar 3 mil proyectos entre los 22 departamentos del país.… https://t.co/W0oftb6Fta,https://twitter.com/i/web/status/1354470842139365379,27/01/2021 10:46:28,Twitter Web App,3,3,Gobierno Guatemala,10:46:28,http://pbs.twimg.com/profile_images/1292921828256735234/sNXpArrM.jpg
"#Información | PNC efectúa un Operativo alrededor del Centro de Emisión de Pasaportes zona 4, para prevenir el acos… https://t.co/Gl79fgYccx",https://twitter.com/i/web/status/1354471670254362624,27/01/2021 10:49:45,Hootsuite Inc.,2,2,Migración Guatemala,10:49:45,http://pbs.twimg.com/profile_images/1346129009051054081/v9JUwo36.jpg
#Pasaportes | El documento que se genera al momento de realizar la cita para emisión de pasaportes tiene medidas de… https://t.co/afJXtWYb4Y,https://twitter.com/i/web/status/1354474428948738049,27/01/2021 11:00:43,Hootsuite Inc.,3,2,Migración Guatemala,11:00:43,http://pbs.twimg.com/profile_images/1346129009051054081/v9JUwo36.jpg
"Economía, competitividad y prosperidad. 

Política General de Gobierno.

#PrimerInformeGT https://t.co/5JKpWCYMT8",https://twitter.com/i/web/status/1354475557833076738,27/01/2021 11:05:12,Twitter Web App,1,2,Gobierno Guatemala,11:05:12,http://pbs.twimg.com/profile_images/1292921828256735234/sNXpArrM.jpg
"Brigada de Paracaidistas del #EjércitoGT recibe entrenamiento sobre:
🔸️Métodos de evacuación
🔸️Primeros auxilios… https://t.co/cWuUkOoMdG",https://twitter.com/i/web/status/1354478910747136002,27/01/2021 11:18:31,Twitter for Android,8,2,Ejército Guatemala,11:18:31,http://pbs.twimg.com/profile_images/1319662500535803906/WdyAkHlu.jpg
#EnVivo | Conferencia de prensa a cargo del #CancillerGT Pedro Brolo para presentar el Informe de la Misión Especia… https://t.co/mx0c4yn0or,https://twitter.com/i/web/status/1354479110941106178,27/01/2021 11:19:19,"<a href=""https://periscope.tv"" rel=""nofollow"">Periscope",8,7,Gobierno Guatemala,11:19:19,http://pbs.twimg.com/profile_images/1292921828256735234/sNXpArrM.jpg
#AHORA | #CancillerGT @PedroBroloGT brinda conferencia de prensa en relación al informe de la Misión Especial en Gu… https://t.co/VEc9XBdMs2,https://twitter.com/i/web/status/1354479692120776716,27/01/2021 11:21:38,Twitter Web App,2,1,MINEX Guatemala 🇬🇹,11:21:38,http://pbs.twimg.com/profile_images/1292832595093475329/6LQbTy36.jpg
#Escuintla | Brigada de Paracaidistas del #EjércitoGT | #MINDEF concientiza a la población sobre el uso de la masca… https://t.co/vW2gRoCFxh,https://twitter.com/i/web/status/1354479923784773637,27/01/2021 11:22:33,Twitter for Android,4,2,Ejército Guatemala,11:22:33,http://pbs.twimg.com/profile_images/1319662500535803906/WdyAkHlu.jpg
"El @Ejercito_GT continúa llevando ayuda a las familias afectadas por Eta e Iota, en Panzós, San Cristóbal Verapaz y… https://t.co/GMFr5HfnEz",https://twitter.com/i/web/status/1354482771515858946,27/01/2021 11:33:52,Twitter Web App,25,4,Gobierno Guatemala,11:33:52,http://pbs.twimg.com/profile_images/1292921828256735234/sNXpArrM.jpg
"RT @GuatemalaGob: El @Ejercito_GT continúa llevando ayuda a las familias afectadas por Eta e Iota, en Panzós, San Cristóbal Verapaz y San P…",https://twitter.com/i/web/status/1354482821092532230,27/01/2021 11:34:04,Twitter for Android,0,4,Ejército Guatemala,11:34:04,http://pbs.twimg.com/profile_images/1319662500535803906/WdyAkHlu.jpg
#EnVivo | Conferencia de prensa a cargo del #CancillerGT Pedro Brolo para presentar el Informe de la Misión Especia… https://t.co/mCR5QNUujo,https://twitter.com/i/web/status/1354484063935975424,27/01/2021 11:39:00,"<a href=""https://periscope.tv"" rel=""nofollow"">Periscope",9,4,Gobierno Guatemala,11:39:00,http://pbs.twimg.com/profile_images/1292921828256735234/sNXpArrM.jpg
Las Unidades del #EjércitoGT | #MINDEF se mantienen en constante entrenamiento para cumplir con la misión constituc… https://t.co/0IdYTEK4N7,https://twitter.com/i/web/status/1354488299587592192,27/01/2021 11:55:50,Twitter for Android,7,1,Ejército Guatemala,11:55:50,http://pbs.twimg.com/profile_images/1319662500535803906/WdyAkHlu.jpg
"#Pasaportes | La demanda para el trámite de pasaporte es alta, por lo que recomendamos que realicen la cita con suf… https://t.co/XDJpSBidJ1",https://twitter.com/i/web/status/1354489510269218818,27/01/2021 12:00:39,Hootsuite Inc.,0,0,Migración Guatemala,12:00:39,http://pbs.twimg.com/profile_images/1346129009051054081/v9JUwo36.jpg
#EnVivo | Noticiero Informe Nacional https://t.co/urwqQ9kPzJ,https://twitter.com/i/web/status/1354489848061521920,27/01/2021 12:01:59,"<a href=""https://periscope.tv"" rel=""nofollow"">Periscope",6,6,Gobierno Guatemala,12:01:59,http://pbs.twimg.com/profile_images/1292921828256735234/sNXpArrM.jpg
"Dominga Revolorio, vecina de la zona 11, insta a las mujeres a denunciar el maltrato y violencia contra la mujer ll… https://t.co/jsr3m9PcQk",https://twitter.com/i/web/status/1354495122503847937,27/01/2021 12:22:57,Twitter for iPhone,2,1,MinGob,12:22:57,http://pbs.twimg.com/profile_images/1219274761961951237/aSdvPUzB.jpg
Agentes de la Policía Nacional Civil de la comisaría 14 continúa realizando operativos de identificación de persona… https://t.co/JvAd6Tut8v,https://twitter.com/i/web/status/1354495762810470405,27/01/2021 12:25:29,Twitter for iPhone,3,0,MinGob,12:25:29,http://pbs.twimg.com/profile_images/1219274761961951237/aSdvPUzB.jpg
El @MinSaludGuate confirma tener el espacio y equipo de refrigeración necesario para resguardar más de 200 millones… https://t.co/bgH4sw6fYx,https://twitter.com/i/web/status/1354496897164201984,27/01/2021 12:30:00,Twitter Web App,16,4,Gobierno Guatemala,12:30:00,http://pbs.twimg.com/profile_images/1292921828256735234/sNXpArrM.jpg
"Autoridades de la cartera del Interior, Energía y Minas, representantes de Cooperación Alemana GIZ, Prevención del… https://t.co/pOOLITGYbe",https://twitter.com/i/web/status/1354498629126512646,27/01/2021 12:36:53,Twitter for iPhone,6,5,MinGob,12:36:53,http://pbs.twimg.com/profile_images/1219274761961951237/aSdvPUzB.jpg
En la reunión con Gobernadores departamentales se intercambian estrategias y acciones utilizadas en la resolución d… https://t.co/3tCHblqsLj,https://twitter.com/i/web/status/1354498642720260103,27/01/2021 12:36:56,Twitter for iPhone,4,4,MinGob,12:36:56,http://pbs.twimg.com/profile_images/1219274761961951237/aSdvPUzB.jpg
"#DonaciónDeSangre 🩸 ¡Los pacientes que son atendidos en los Hospitales del #MSPAS necesitan de tu ayuda!

Participa… https://t.co/7WPT0RsZGG",https://twitter.com/i/web/status/1354499347933761537,27/01/2021 12:39:44,Twitter Web App,3,3,Ministerio de Salud Pública,12:39:44,http://pbs.twimg.com/profile_images/1311755159027015685/QQcxgYd1.jpg
"#CancillerGT @PedroBroloGT trasmitió el agradecimiento del @GuatemalaGob al Secretario General @Almagro_OEA2015, a… https://t.co/FsRTskxkfj",https://twitter.com/i/web/status/1354501679987773446,27/01/2021 12:49:00,Twitter Web App,2,3,MINEX Guatemala 🇬🇹,12:49:00,http://pbs.twimg.com/profile_images/1292832595093475329/6LQbTy36.jpg
#Arraigos | Compartimos requisitos para solicitar información de arraigos a terceras personas: 👇 https://t.co/Hqlb2ZzdfV,https://twitter.com/i/web/status/1354504589832302592,27/01/2021 13:00:34,Hootsuite Inc.,2,2,Migración Guatemala,13:00:34,http://pbs.twimg.com/profile_images/1346129009051054081/v9JUwo36.jpg
"""Es necesario contar con una estrategia que permita la atención y abordaje institucional de la conflictividad socia… https://t.co/P1sNfbq7bW",https://twitter.com/i/web/status/1354505696776237058,27/01/2021 13:04:58,Twitter for iPhone,1,1,MinGob,13:04:58,http://pbs.twimg.com/profile_images/1219274761961951237/aSdvPUzB.jpg
"""Durante la elaboración de la misma, se tomó en cuenta el abordaje de la conflictividad social, es necesario debido… https://t.co/IHPJLh1fh9",https://twitter.com/i/web/status/1354505712748081153,27/01/2021 13:05:02,Twitter for iPhone,2,1,MinGob,13:05:02,http://pbs.twimg.com/profile_images/1219274761961951237/aSdvPUzB.jpg
[#Video] Adolescente denuncia a profesor por material pornográfico https://t.co/JV59rL9th2,https://twitter.com/i/web/status/1354507070830227456,27/01/2021 13:10:25,Twitter for iPhone,0,0,MinGob,13:10:25,http://pbs.twimg.com/profile_images/1219274761961951237/aSdvPUzB.jpg
[#Video] Personal de DIDAE realizan práctica de tiro https://t.co/lZZW0ZngC5,https://twitter.com/i/web/status/1354508191435026434,27/01/2021 13:14:53,Twitter for iPhone,0,0,MinGob,13:14:53,http://pbs.twimg.com/profile_images/1219274761961951237/aSdvPUzB.jpg
Descarga el informe de la #OEA ⬇ https://t.co/zqlX2WHMKK,https://twitter.com/i/web/status/1354512356043354112,27/01/2021 13:31:25,Twitter for Android,0,0,MINEX Guatemala 🇬🇹,13:31:25,http://pbs.twimg.com/profile_images/1292832595093475329/6LQbTy36.jpg
Agentes de la @PNCdeGuatemala y fiscales del @MPguatemala realizaron la captura de una persona responsable de distr… https://t.co/HL3gh29Mqx,https://twitter.com/i/web/status/1354512405578002435,27/01/2021 13:31:37,Twitter Web App,6,3,Gobierno Guatemala,13:31:37,http://pbs.twimg.com/profile_images/1292921828256735234/sNXpArrM.jpg
"#RecuperadosCOVID19 | ""Esto no es un juego, es una amenaza real... estuve al borde de la muerte""

Una paciente egre… https://t.co/F05wFEoBVu",https://twitter.com/i/web/status/1354520593710903301,27/01/2021 14:04:09,Twitter Web App,4,3,Ministerio de Salud Pública,14:04:09,http://pbs.twimg.com/profile_images/1311755159027015685/QQcxgYd1.jpg
"Cada una de estas personas tiene un rostro, un nombre y una historia. En su honor, me gustaría reconocer a alguien… https://t.co/TGyQLpXA6V",https://twitter.com/i/web/status/1354520728662634498,27/01/2021 14:04:42,TweetDeck,5,2,OPS/OMS,14:04:42,http://pbs.twimg.com/profile_images/1096094749902028801/ijbQWupW.png
"La Dra. Rosemary Costa Pinto fue socia de la OPS, líder local y pieza clave en la respuesta a la pandemia, lo que a… https://t.co/Oe7qgxRrxC",https://twitter.com/i/web/status/1354521331166023689,27/01/2021 14:07:05,TweetDeck,4,2,OPS/OMS,14:07:05,http://pbs.twimg.com/profile_images/1096094749902028801/ijbQWupW.png
"RT @guatemala_dgac: 🤩✈️ “...everything is super clean. It’s been an amazing experience...”

Usuarios manifiestan su satisfacción por el exc…",https://twitter.com/i/web/status/1354523973980188682,27/01/2021 14:17:35,Twitter for Android,0,8,Gobierno Guatemala,14:17:35,http://pbs.twimg.com/profile_images/1292921828256735234/sNXpArrM.jpg
La Cuarta Brigada de Infantería del #EjércitoGT | #MINDEF efectúa puesto de control en el departamento de… https://t.co/RMGdY8rZK6,https://twitter.com/i/web/status/1354524044834570246,27/01/2021 14:17:52,Twitter for Android,2,1,Ejército Guatemala,14:17:52,http://pbs.twimg.com/profile_images/1319662500535803906/WdyAkHlu.jpg
Más de 3 mil jóvenes fueron capacitados por el @McdGuate sobre derechos de los pueblos indígenas.… https://t.co/hJkhzjC7uv,https://twitter.com/i/web/status/1354528628122513411,27/01/2021 14:36:05,Twitter Web App,5,3,Gobierno Guatemala,14:36:05,http://pbs.twimg.com/profile_images/1292921828256735234/sNXpArrM.jpg
"🌎 Esta pandemia ha marcado el comienzo de una crisis de #saludmental, ya que hemos sido sacudidos por el miedo, la… https://t.co/jmVAebqETp",https://twitter.com/i/web/status/1354528753481895939,27/01/2021 14:36:35,TweetDeck,14,11,OPS/OMS,14:36:35,http://pbs.twimg.com/profile_images/1096094749902028801/ijbQWupW.png
"Algunos grupos, como las personas que viven con discapacidades o trastornos de salud mental y abuso de sustancias,… https://t.co/m61NDCnqFW",https://twitter.com/i/web/status/1354529230319718404,27/01/2021 14:38:29,TweetDeck,12,7,OPS/OMS,14:38:29,http://pbs.twimg.com/profile_images/1096094749902028801/ijbQWupW.png
#Quiché | La Sexta Brigada de Infantería del #EjércitoGT | #MINDEF realiza patrullajes de seguridad en cumplimiento… https://t.co/hlJMJtfO9n,https://twitter.com/i/web/status/1354530696577114114,27/01/2021 14:44:18,Twitter for Android,2,1,Ejército Guatemala,14:44:18,http://pbs.twimg.com/profile_images/1319662500535803906/WdyAkHlu.jpg
Presentan Estrategia de Atención y Abordaje de la Conflictividad Social a Gobernadores https://t.co/Cmi8xO8Kk0,https://twitter.com/i/web/status/1354531510964072458,27/01/2021 14:47:32,"<a href=""http://publicize.wp.com/"" rel=""nofollow"">WordPress.com",2,4,MinGob,14:47:32,http://pbs.twimg.com/profile_images/1219274761961951237/aSdvPUzB.jpg
🌎 Muchas del millón de personas que hemos perdido a causa de este virus eran el sostén de familia cuyas familias de… https://t.co/XpqLB0hCCn,https://twitter.com/i/web/status/1354532677198761984,27/01/2021 14:52:10,TweetDeck,5,3,OPS/OMS,14:52:10,http://pbs.twimg.com/profile_images/1096094749902028801/ijbQWupW.png
"🌎 Hoy, 16 millones más de personas viven en la pobreza, en comparación con cuando comenzó la pandemia, y millones m… https://t.co/PcyYCjFfAG",https://twitter.com/i/web/status/1354532903909281793,27/01/2021 14:53:04,TweetDeck,7,4,OPS/OMS,14:53:04,http://pbs.twimg.com/profile_images/1096094749902028801/ijbQWupW.png
"🌎 Millones de familias corren el riesgo de pasar hambre, un desafío que se complica aún más por el aumento de los p… https://t.co/Dr7iz8MD4e",https://twitter.com/i/web/status/1354533093294673923,27/01/2021 14:53:50,TweetDeck,7,6,OPS/OMS,14:53:50,http://pbs.twimg.com/profile_images/1096094749902028801/ijbQWupW.png
#Pasaportes | La programación de citas para emisión de pasaportes se realiza en cumplimiento con las medidas sanita… https://t.co/q6EsrAm2zf,https://twitter.com/i/web/status/1354534780533145601,27/01/2021 15:00:32,Hootsuite Inc.,2,0,Migración Guatemala,15:00:32,http://pbs.twimg.com/profile_images/1346129009051054081/v9JUwo36.jpg
"Si eres víctima o conoces de algún caso de violencia intrafamiliar, denuncia a los teléfonos 110 y 1561 de la… https://t.co/3DTFIwOMWH",https://twitter.com/i/web/status/1354536978612674565,27/01/2021 15:09:16,Twitter Media Studio,1,1,MinGob,15:09:16,http://pbs.twimg.com/profile_images/1219274761961951237/aSdvPUzB.jpg
