Contenido,IR,Fecha,Dispositivo,Likes,Retweets,Entidad,Hora,Foto
#GestiónMinfin 🇬🇹 | El Ministro @alvarogricci participa en la XLIX Reunión Ordinaria del #COSEFIN en la cual se lle… https://t.co/0pqYZU9zEh,https://twitter.com/i/web/status/1407822624571465733,23/06/2021 16:07:24,Twitter Web App,14,4,Ministerio de Finanzas Guatemala,16:07:24,http://pbs.twimg.com/profile_images/1292831294796320768/6Q8j5vtW.jpg
En la Reunión Ordinaria del #COSEFIN se aprobó la resolución para mejorar las condiciones habilitantes para inversi… https://t.co/hGTXSWcrcg,https://twitter.com/i/web/status/1407822625892704260,23/06/2021 16:07:24,Twitter Web App,4,1,Ministerio de Finanzas Guatemala,16:07:24,http://pbs.twimg.com/profile_images/1292831294796320768/6Q8j5vtW.jpg
"Asimismo, se abordó la segunda fase del programa Buena Gobernanza Financiera para una #RecuperaciónEconómica verde… https://t.co/Si82ZR7mcm",https://twitter.com/i/web/status/1407822626802786305,23/06/2021 16:07:24,Twitter Web App,7,2,Ministerio de Finanzas Guatemala,16:07:24,http://pbs.twimg.com/profile_images/1292831294796320768/6Q8j5vtW.jpg
"En la Reunión Ordinaria del #COSEFIN se aprobó la resolución ""Unidos para la recuperación económica post #COVID19"",… https://t.co/N00VMLzDfa",https://twitter.com/i/web/status/1407842428699152385,23/06/2021 17:26:06,Twitter Web App,9,4,Ministerio de Finanzas Guatemala,17:26:06,http://pbs.twimg.com/profile_images/1292831294796320768/6Q8j5vtW.jpg
"RT @MarioRojas11: Hoy participamos en el lanzamiento del programa ""Reforestemos #Guatemala un legado del #Bicentenario, en Santa Catarina P…",https://twitter.com/i/web/status/1407855657496293381,23/06/2021 18:18:40,Twitter Web App,0,4,Gobierno Guatemala,18:18:40,http://pbs.twimg.com/profile_images/1371488309743120384/QqlgsWUm.jpg
#InformeNacional | @McdGuate impulsará recuperación del patrimonio cultural en segundo semestre de 2021. ▶️… https://t.co/CZjfs6EWtN,https://twitter.com/i/web/status/1407904106665189377,23/06/2021 21:31:11,Twitter Web App,6,4,Gobierno Guatemala,21:31:11,http://pbs.twimg.com/profile_images/1371488309743120384/QqlgsWUm.jpg
"El Ministro de Finanzas, @alvarogricci participó en la XLIX Reunión Ordinaria del #COSEFIN, en la cual se llevó a c… https://t.co/4UgLXq7UpC",https://twitter.com/i/web/status/1408050369255686145,24/06/2021 07:12:22,Twitter for Android,12,2,Ministerio de Finanzas Guatemala,07:12:22,http://pbs.twimg.com/profile_images/1292831294796320768/6Q8j5vtW.jpg
#Pasaportes | ¡La cita para el pasaporte No tiene costo! Se realiza en https://t.co/4Gtec6XXlE https://t.co/R6ZSzUvbeJ,https://twitter.com/i/web/status/1408062504568115204,24/06/2021 08:00:36,Hootsuite Inc.,0,0,Migración Guatemala,08:00:36,http://pbs.twimg.com/profile_images/1346129009051054081/v9JUwo36.jpg
#Denuncia | Recuerda que la cita para el pasaporte No tiene costo. Puedes hacer tu denuncia a través del siguiente… https://t.co/qEVTX2m623,https://twitter.com/i/web/status/1408077532231049222,24/06/2021 09:00:19,Hootsuite Inc.,1,1,Migración Guatemala,09:00:19,http://pbs.twimg.com/profile_images/1346129009051054081/v9JUwo36.jpg
El Gobierno de Guatemala presentó hoy una iniciativa de ley con la que se cumpliría otro de los requisitos de los f… https://t.co/TaCOJeEtvn,https://twitter.com/i/web/status/1408087512749424642,24/06/2021 09:39:58,Twitter for iPhone,6,4,Gobierno Guatemala,09:39:58,http://pbs.twimg.com/profile_images/1371488309743120384/QqlgsWUm.jpg
"RT @OPSOMS_Honduras: Llega vuelo Honduras 🇭🇳 con 19,310 dosis de vacunas 💉 #AstraZeneca reubicadas desde la isla de Dominica 🇩🇲 a este país…",https://twitter.com/i/web/status/1408088407910367235,24/06/2021 09:43:32,Twitter for iPhone,0,14,OPS/OMS,09:43:32,http://pbs.twimg.com/profile_images/1096094749902028801/ijbQWupW.png
"RT @campusvirtualsp: NUEVO 👉🏿 curso sobre Diagnóstico y manejo clínico del dengue

✅ Aprende sobre la epidemiología del dengue, definición…",https://twitter.com/i/web/status/1408088484829712394,24/06/2021 09:43:50,Twitter for iPhone,0,13,OPS/OMS,09:43:50,http://pbs.twimg.com/profile_images/1096094749902028801/ijbQWupW.png
"RT @campusvirtualsp: #covid19 👉🏾 Curso sobre Manejo Clínico de las Infecciones Respiratorias Agudas Graves (IRAG)

✅ Destinado a profesiona…",https://twitter.com/i/web/status/1408088502894567432,24/06/2021 09:43:54,Twitter for iPhone,0,8,OPS/OMS,09:43:54,http://pbs.twimg.com/profile_images/1096094749902028801/ijbQWupW.png
"RT @campusvirtualsp: ¿Qué te ofrece el curso sobre control integral del #cáncercervicouterino?

✅ Actualización en las estrategias de preve…",https://twitter.com/i/web/status/1408088525216550918,24/06/2021 09:44:00,Twitter for iPhone,0,10,OPS/OMS,09:44:00,http://pbs.twimg.com/profile_images/1096094749902028801/ijbQWupW.png
"RT @campusvirtualsp: NUEVO CURSO❗️
Estrategias de evaluación en educación basada en competencias para profesionales de la salud con enfoque…",https://twitter.com/i/web/status/1408088536989982733,24/06/2021 09:44:02,Twitter for iPhone,0,8,OPS/OMS,09:44:02,http://pbs.twimg.com/profile_images/1096094749902028801/ijbQWupW.png
"#ControlMigratorio | Los formularios para trámites de control migratorio no tienen costo, puedes descargarlos es… https://t.co/8OSmOsGPN2",https://twitter.com/i/web/status/1408092641431072777,24/06/2021 10:00:21,Hootsuite Inc.,0,0,Migración Guatemala,10:00:21,http://pbs.twimg.com/profile_images/1346129009051054081/v9JUwo36.jpg
"RT @OPSOMSPeru: Perú podría reducir 📉 las pérdidas económicas y
de salud causadas por las ENT y trastornos mentales si implementara las int…",https://twitter.com/i/web/status/1408095855794655233,24/06/2021 10:13:07,Twitter for iPhone,0,3,OPS/OMS,10:13:07,http://pbs.twimg.com/profile_images/1096094749902028801/ijbQWupW.png
"Si te perdiste esta conversación 👀⬇️, aquí encontrarás enlace para ver la grabación: https://t.co/xwLAyB6xuI",https://twitter.com/i/web/status/1408096523980771328,24/06/2021 10:15:47,Twitter for iPhone,8,3,OPS/OMS,10:15:47,http://pbs.twimg.com/profile_images/1096094749902028801/ijbQWupW.png
#GestiónMinfin  | El Ministro de Finanzas @alvarogricci  aclara que a raíz del buen #DesempeñoEconómico y a la reca… https://t.co/GGvf3iPldU,https://twitter.com/i/web/status/1408096939913224196,24/06/2021 10:17:26,Twitter Web App,4,0,Ministerio de Finanzas Guatemala,10:17:26,http://pbs.twimg.com/profile_images/1292831294796320768/6Q8j5vtW.jpg
Por instrucción del Presidente @DrGiammattei se proporcionan los recursos para ejecutar los proyectos identificados… https://t.co/xc4KbqroVj,https://twitter.com/i/web/status/1408097197426626561,24/06/2021 10:18:27,Twitter Web App,1,0,Ministerio de Finanzas Guatemala,10:18:27,http://pbs.twimg.com/profile_images/1292831294796320768/6Q8j5vtW.jpg
El Ministro mencionó que desde el Minfin se han hecho las previsiones para priorizar la inversión en reconstrucción… https://t.co/grozwomjK3,https://twitter.com/i/web/status/1408101488640024581,24/06/2021 10:35:30,Twitter Web App,0,0,Ministerio de Finanzas Guatemala,10:35:30,http://pbs.twimg.com/profile_images/1292831294796320768/6Q8j5vtW.jpg
#GestiónMinfin | El Ministro @alvarogricci participa en una reunión de trabajo en el @CongresoGuate en donde se abo… https://t.co/13VGI0HfNO,https://twitter.com/i/web/status/1408101487574724617,24/06/2021 10:35:30,Twitter Web App,1,0,Ministerio de Finanzas Guatemala,10:35:30,http://pbs.twimg.com/profile_images/1292831294796320768/6Q8j5vtW.jpg
#ControlMigratorio |  Puedes descargar nuestros formularios de forma gratuita en https://t.co/h9drWvrvgu https://t.co/3UsEH1yNOc,https://twitter.com/i/web/status/1408107744490627078,24/06/2021 11:00:22,Hootsuite Inc.,0,0,Migración Guatemala,11:00:22,http://pbs.twimg.com/profile_images/1346129009051054081/v9JUwo36.jpg
"¿Eres vacunador ‍👨🏾‍⚕👩🏽‍⚕️️, responsable de políticas de salud o coordinas un programa de inmunización 💉? 

¡Descar… https://t.co/VpHZUNym1Z",https://twitter.com/i/web/status/1408115846061436935,24/06/2021 11:32:33,Twitter Web App,23,20,OPS/OMS,11:32:33,http://pbs.twimg.com/profile_images/1096094749902028801/ijbQWupW.png
"#Información | Stuard Rodríguez, Director General de @MigracionGuate, sostuvo una reunión para dar a conocer la sit… https://t.co/QcYXiLM9Lx",https://twitter.com/i/web/status/1408119032042115078,24/06/2021 11:45:13,Twitter for iPhone,3,1,Migración Guatemala,11:45:13,http://pbs.twimg.com/profile_images/1346129009051054081/v9JUwo36.jpg
"#𝙉𝙤𝙩𝙞𝙘𝙞𝙖𝙨𝙈𝙞𝙣𝙛𝙞𝙣 📰
Te invitamos a leer el Boletín 𝙋𝙖𝙣𝙤𝙧𝙖𝙢𝙖 𝙁𝙞𝙣𝙖𝙣𝙘𝙞𝙚𝙧𝙤, donde se destacan las acciones del Ministerio… https://t.co/DIKfGWYyUg",https://twitter.com/i/web/status/1408126004284084232,24/06/2021 12:12:55,Twitter Web App,5,0,Ministerio de Finanzas Guatemala,12:12:55,http://pbs.twimg.com/profile_images/1292831294796320768/6Q8j5vtW.jpg
#EnDirecto | Guatemala recibe donación de vacunas contra el COVID-19 por parte de los Estados Unidos Mexicanos https://t.co/qVVAvNcWdD,https://twitter.com/i/web/status/1408133931694657536,24/06/2021 12:44:25,"<a href=""https://periscope.tv"" rel=""nofollow"">Periscope",70,23,Gobierno Guatemala,12:44:25,http://pbs.twimg.com/profile_images/1371488309743120384/QqlgsWUm.jpg
RT @GuatemalaGob: #EnDirecto | Guatemala recibe donación de vacunas contra el COVID-19 por parte de los Estados Unidos Mexicanos https://t.…,https://twitter.com/i/web/status/1408134162696003589,24/06/2021 12:45:20,Twitter Web App,0,23,Ministerio de Salud Pública,12:45:20,http://pbs.twimg.com/profile_images/1311755159027015685/QQcxgYd1.jpg
"#ControlMigratorio |Nuestros formularios no tienen costo, puedes descargarlos en el siguiente enlace… https://t.co/nFHBTA6bvO",https://twitter.com/i/web/status/1408137945446555649,24/06/2021 13:00:22,Hootsuite Inc.,0,0,Migración Guatemala,13:00:22,http://pbs.twimg.com/profile_images/1346129009051054081/v9JUwo36.jpg
"RT @PRONACOMGT: Durante reunión de #GabineteEconómico, la Directora @Lieschen_Eger dio a conocer las estrategias que se implementan desde #…",https://twitter.com/i/web/status/1408140291715080198,24/06/2021 13:09:42,Twitter Web App,0,4,Gobierno Guatemala,13:09:42,http://pbs.twimg.com/profile_images/1371488309743120384/QqlgsWUm.jpg
"Como parte de los acuerdos alcanzados durante la reciente visita del presidente @DrGiammattei a México, hoy arribar… https://t.co/5MbaeyLAfC",https://twitter.com/i/web/status/1408148154114060289,24/06/2021 13:40:56,Twitter Web App,397,111,Gobierno Guatemala,13:40:56,http://pbs.twimg.com/profile_images/1371488309743120384/QqlgsWUm.jpg
La Ministra de Salud Dra. #AmeliaFlores recibe en Fuerza Aérea Guatemalteca una donación de 150 mil dosis de vacuna… https://t.co/dK525NT3oM,https://twitter.com/i/web/status/1408149932834443264,24/06/2021 13:48:00,Twitter Web App,27,7,Ministerio de Salud Pública,13:48:00,http://pbs.twimg.com/profile_images/1311755159027015685/QQcxgYd1.jpg
"Las dosis de vacuna fueron entregadas por el  Excelentísimo señor Marcelo Ebrard Casaubón, Secretario de Relaciones… https://t.co/4BLJH4zDnB",https://twitter.com/i/web/status/1408149936370298883,24/06/2021 13:48:01,Twitter Web App,2,0,Ministerio de Salud Pública,13:48:01,http://pbs.twimg.com/profile_images/1311755159027015685/QQcxgYd1.jpg
y otros funcionarios mexicanos en un acto en el que además de la Ministra de Salud participó el viceministro de Rel… https://t.co/VcEREXH6e6,https://twitter.com/i/web/status/1408149940824686602,24/06/2021 13:48:02,Twitter Web App,0,0,Ministerio de Salud Pública,13:48:02,http://pbs.twimg.com/profile_images/1311755159027015685/QQcxgYd1.jpg
y la preocupación el acceso universal a las vacunas. Hoy vengo en representación de México y les entrego 150 mil do… https://t.co/5ltzHHi0Ex,https://twitter.com/i/web/status/1408149944536604679,24/06/2021 13:48:03,Twitter Web App,3,0,Ministerio de Salud Pública,13:48:03,http://pbs.twimg.com/profile_images/1311755159027015685/QQcxgYd1.jpg
envasada en México bajo la licencia de #AstraZeneca. Vamos a regresar con las otras 150 mil dosis para las segundas… https://t.co/iTNMYevEvt,https://twitter.com/i/web/status/1408149947795623938,24/06/2021 13:48:04,Twitter Web App,12,3,Ministerio de Salud Pública,13:48:04,http://pbs.twimg.com/profile_images/1311755159027015685/QQcxgYd1.jpg
"Por su parte la Ministra de Salud Dra. #AmeliaFlores dijo” agradezco la entrega de esta donación importante, adicio… https://t.co/RIi3zknd7V",https://twitter.com/i/web/status/1408149951113318412,24/06/2021 13:48:05,Twitter Web App,7,2,Ministerio de Salud Pública,13:48:05,http://pbs.twimg.com/profile_images/1311755159027015685/QQcxgYd1.jpg
"RT @EmbaMexGua: Amelia Flores, ministra de @MinSaludGuate, y Eduardo Hernández, viceministro de @MinexGt, agradecieron al pueblo de México…",https://twitter.com/i/web/status/1408151767674720258,24/06/2021 13:55:18,Twitter Web App,0,8,Gobierno Guatemala,13:55:18,http://pbs.twimg.com/profile_images/1371488309743120384/QqlgsWUm.jpg
"#DonacióndeVacunas🇲🇽 @m_ebrard, Secretario de Relaciones Exteriores de México, entregó donación de 150 mil dosis de… https://t.co/WwRzN0EBhn",https://twitter.com/i/web/status/1408154080095113224,24/06/2021 14:04:29,Twitter Web App,7,2,MINEX Guatemala 🇬🇹,14:04:29,http://pbs.twimg.com/profile_images/1292832595093475329/6LQbTy36.jpg
El Gobierno del @DrGiammattei agradece el apoyo y esfuerzo del hermano Gobierno de México al hacer efectiva esta do… https://t.co/mteUEA1eix,https://twitter.com/i/web/status/1408154083152826382,24/06/2021 14:04:30,Twitter Web App,4,1,MINEX Guatemala 🇬🇹,14:04:30,http://pbs.twimg.com/profile_images/1292832595093475329/6LQbTy36.jpg
"Como parte de los acuerdos alcanzados durante la reciente visita del presidente de la República, @DrGiammattei a Mé… https://t.co/CYEP73Nse2",https://twitter.com/i/web/status/1408155987010260994,24/06/2021 14:12:04,Twitter Web App,12,6,MINEX Guatemala 🇬🇹,14:12:04,http://pbs.twimg.com/profile_images/1292832595093475329/6LQbTy36.jpg
"Las 150 mil dosis de vacunas #AstraZeneca que fueron donadas por el Gobierno de #México, ya ingresaron al Centro Na… https://t.co/tRVX6RPAci",https://twitter.com/i/web/status/1408156783563218947,24/06/2021 14:15:14,Twitter for Android,25,1,Ministerio de Salud Pública,14:15:14,http://pbs.twimg.com/profile_images/1311755159027015685/QQcxgYd1.jpg
"Denuncia si conoces información sobre casos de violencia contra las mujeres y niñas

¡Denuncia al ☎️  110, 1561, 15… https://t.co/eAWgslIkig",https://twitter.com/i/web/status/1408160502627258368,24/06/2021 14:30:00,Twitter Media Studio,0,1,MinGob,14:30:00,http://pbs.twimg.com/profile_images/1371480777330941958/_81AGCXa.jpg
"Denuncia si conoces información sobre casos de violencia contra las mujeres y niñas

¡Denuncia al ☎️  110, 1561, 15… https://t.co/I1Z0tPyDuF",https://twitter.com/i/web/status/1408163016626028545,24/06/2021 14:40:00,Twitter Media Studio,0,1,MinGob,14:40:00,http://pbs.twimg.com/profile_images/1371480777330941958/_81AGCXa.jpg
"#TuDenunciaEsConfidencial 🗣 📞 🕵🏻‍
#YoDenuncio
Se dará seguimiento y respuesta a toda la información que usted brind… https://t.co/xf7M8DA2YX",https://twitter.com/i/web/status/1408168052798201861,24/06/2021 15:00:00,Twitter Media Studio,0,0,MinGob,15:00:00,http://pbs.twimg.com/profile_images/1371480777330941958/_81AGCXa.jpg
#ControlMigratorio | Descarga nuestros formularios de forma gratuita y sencilla https://t.co/h9drWvrvgu https://t.co/XPDi8RwA9O,https://twitter.com/i/web/status/1408168122171940866,24/06/2021 15:00:17,Hootsuite Inc.,2,0,Migración Guatemala,15:00:17,http://pbs.twimg.com/profile_images/1346129009051054081/v9JUwo36.jpg
Celebran XLII aniversario del Día del Empleado Penitenciario https://t.co/q95L7PVLQg,https://twitter.com/i/web/status/1408169151328407553,24/06/2021 15:04:22,"<a href=""http://publicize.wp.com/"" rel=""nofollow"">WordPress.com",1,1,MinGob,15:04:22,http://pbs.twimg.com/profile_images/1371480777330941958/_81AGCXa.jpg
Apoyo Interinstitucional | Al contar con capacidades diferenciadas se pueden ejercer operaciones de desarrollo y se… https://t.co/EbygHjwpz7,https://twitter.com/i/web/status/1408169739931865094,24/06/2021 15:06:43,Twitter for Android,8,3,Ejército Guatemala,15:06:43,http://pbs.twimg.com/profile_images/1400165461548048384/3Vbvt8E2.jpg
En reunión de Viceministros de Relaciones Exteriores de países miembros del @sg_sica con el ministro adjunto de Rel… https://t.co/SIprNRxpCO,https://twitter.com/i/web/status/1408181505554268171,24/06/2021 15:53:28,Twitter Web App,6,4,MINEX Guatemala 🇬🇹,15:53:28,http://pbs.twimg.com/profile_images/1292832595093475329/6LQbTy36.jpg
"Como parte de la Gran Cruzada Nacional contra la Desnutrición, el #ÁreaDeSalud de Jutiapa recibió 15 mil kilos de a… https://t.co/mdJcLsOdx8",https://twitter.com/i/web/status/1408189377617014784,24/06/2021 16:24:45,Twitter for Android,3,0,Ministerio de Salud Pública,16:24:45,http://pbs.twimg.com/profile_images/1311755159027015685/QQcxgYd1.jpg
"#YoDenuncio
#DenunciaAl1518 🗣 📞 🕵🏻‍
Comunícate al 1518, la línea de denuncias confidenciales del Ministerio de Gobe… https://t.co/6cq2AytZ18",https://twitter.com/i/web/status/1408190700252909570,24/06/2021 16:30:00,Twitter Media Studio,6,1,MinGob,16:30:00,http://pbs.twimg.com/profile_images/1371480777330941958/_81AGCXa.jpg
Guatemala participó en la Reunión del LXXXV Consejo de Ministros de Relaciones Exteriores del #SICA celebrada en fo… https://t.co/gxYY7OHK6G,https://twitter.com/i/web/status/1408195756792725505,24/06/2021 16:50:06,Twitter for Android,3,2,MINEX Guatemala 🇬🇹,16:50:06,http://pbs.twimg.com/profile_images/1292832595093475329/6LQbTy36.jpg
"#GuatePreviene 🟡 fue creada con el objetivo de asentar una cultura de prevención por convicción

¡Todos somos preve… https://t.co/xWrkZdmTHt",https://twitter.com/i/web/status/1408198252902567938,24/06/2021 17:00:01,Twitter Media Studio,8,2,MinGob,17:00:01,http://pbs.twimg.com/profile_images/1371480777330941958/_81AGCXa.jpg
#Pasaportes | 🎥 Conoce el proceso para realizar el trámite de pasaporte. https://t.co/xZZxE4WF43,https://twitter.com/i/web/status/1408198300180811776,24/06/2021 17:00:12,Hootsuite Inc.,1,1,Migración Guatemala,17:00:12,http://pbs.twimg.com/profile_images/1346129009051054081/v9JUwo36.jpg
"Reemplazarlo no es dejarlo 🚭

El vapeo, la shisha y los productos de tabaco calentado son perjudiciales para tu sal… https://t.co/lFejGPZ8kF",https://twitter.com/i/web/status/1408198771268374529,24/06/2021 17:02:04,Twitter for iPhone,18,9,OPS/OMS,17:02:04,http://pbs.twimg.com/profile_images/1096094749902028801/ijbQWupW.png
RT @OPSOMSPeru: 📣 183 mil muertes pueden evitarse en Perú con prevención y control de enfermedades no transmisibles y el tratamiento de los…,https://twitter.com/i/web/status/1408200813244211203,24/06/2021 17:10:11,Twitter for iPhone,0,6,OPS/OMS,17:10:11,http://pbs.twimg.com/profile_images/1096094749902028801/ijbQWupW.png
"RT @MinexGt: #CancillerGT @PedroBroloGT sostuvo reunión bilateral con Canciller Serguéi Lavrov, a quien reiteró la necesidad de la pronta r…",https://twitter.com/i/web/status/1408201871307718658,24/06/2021 17:14:23,Twitter Web App,0,11,Gobierno Guatemala,17:14:23,http://pbs.twimg.com/profile_images/1371488309743120384/QqlgsWUm.jpg
RT @DrGiammattei: Un gusto recibir al canciller @m_ebrard en Casa Presidencial a quien le agradecí por la generosa donación del Gobierno y…,https://twitter.com/i/web/status/1408202048064086017,24/06/2021 17:15:06,Twitter Web App,0,31,Gobierno Guatemala,17:15:06,http://pbs.twimg.com/profile_images/1371488309743120384/QqlgsWUm.jpg
Reservas Militares del #EjércitoGT | #MINDEF concientiza a la población sobre medidas para prevenir contagios de CO… https://t.co/LGJ9iya7xu,https://twitter.com/i/web/status/1408202642690564102,24/06/2021 17:17:27,Twitter for Android,6,2,Ejército Guatemala,17:17:27,http://pbs.twimg.com/profile_images/1400165461548048384/3Vbvt8E2.jpg
"Reservistas Militares del #EjércitoGT | #MINDEF apoyan al @MinSaludGuate, en la organización y funcionamiento, en j… https://t.co/ii789gd81l",https://twitter.com/i/web/status/1408206289709289472,24/06/2021 17:31:57,Twitter for Android,6,2,Ejército Guatemala,17:31:57,http://pbs.twimg.com/profile_images/1400165461548048384/3Vbvt8E2.jpg
#BrevesMSPAS | El Gobierno de Guatemala recibió en Fuerza Aérea Guatemalteca una donación de 150 mil dosis de vacun… https://t.co/LVwSQ8Gr5r,https://twitter.com/i/web/status/1408212631136215040,24/06/2021 17:57:09,Twitter for Android,4,1,Ministerio de Salud Pública,17:57:09,http://pbs.twimg.com/profile_images/1311755159027015685/QQcxgYd1.jpg
"Reservistas Militares del #EjércitoGT | #MINDEF realizó jornada de reforestación, sembrando arbolitos de pino, en e… https://t.co/9mapXh82QX",https://twitter.com/i/web/status/1408212804553916417,24/06/2021 17:57:50,Twitter for Android,7,1,Ejército Guatemala,17:57:50,http://pbs.twimg.com/profile_images/1400165461548048384/3Vbvt8E2.jpg
#ControlMigratorio| Pasos para descargar formularios de Control Migratorio https://t.co/Iy0Vaz0iQb,https://twitter.com/i/web/status/1408213394616991745,24/06/2021 18:00:11,Hootsuite Inc.,0,1,Migración Guatemala,18:00:11,http://pbs.twimg.com/profile_images/1346129009051054081/v9JUwo36.jpg
"¡Buenas tardes #Guatemala! 🇬🇹

Un Soldado Reservista del #EjércitoGT | #MINDEF te saluda. https://t.co/WC5SG6yK0i",https://twitter.com/i/web/status/1408216902577627137,24/06/2021 18:14:07,Twitter for Android,29,3,Ejército Guatemala,18:14:07,http://pbs.twimg.com/profile_images/1400165461548048384/3Vbvt8E2.jpg
"Presidente @DrGiammattei, en compañía del #ViceCancillerGT @eduardoehr, sostuvo audiencia con Canciller de 🇲🇽,… https://t.co/Kjw6frfhT9",https://twitter.com/i/web/status/1408217100271951874,24/06/2021 18:14:54,Twitter for Android,4,3,MINEX Guatemala 🇬🇹,18:14:54,http://pbs.twimg.com/profile_images/1292832595093475329/6LQbTy36.jpg
"RT @UPCV_gt: ROMPE CON EL SILENCIO 📞📲☎️⚠️
¡La denuncia garantiza tus derechos! 📱📲☎️
Ingresa al código QR y escanea la prevención⚠️ 📲🤳👇
#Tod…",https://twitter.com/i/web/status/1408226388927205378,24/06/2021 18:51:49,Twitter for iPhone,0,3,MinGob,18:51:49,http://pbs.twimg.com/profile_images/1371480777330941958/_81AGCXa.jpg
#InformeNacional | Guatemala y México reafirman sus lazos de amistad y cooperación con la donación de 150 mil dosis… https://t.co/qylIMfDrJr,https://twitter.com/i/web/status/1408230874227908608,24/06/2021 19:09:38,Twitter Web App,29,10,Gobierno Guatemala,19:09:38,http://pbs.twimg.com/profile_images/1371488309743120384/QqlgsWUm.jpg
"Reservas Militares del #EjércitoGT | #MINDEF apoya al @MinSaludGuate, en la organización y funcionamiento, en jorna… https://t.co/hg70YugC1W",https://twitter.com/i/web/status/1408231453658333186,24/06/2021 19:11:56,Twitter for Android,2,2,Ejército Guatemala,19:11:56,http://pbs.twimg.com/profile_images/1400165461548048384/3Vbvt8E2.jpg
Reservistas Militares del #EjércitoGT | #MINDEF concientizan a la población sobre medidas para prevenir contagios d… https://t.co/aagic1m7O8,https://twitter.com/i/web/status/1408235483113660421,24/06/2021 19:27:57,Twitter for Android,4,1,Ejército Guatemala,19:27:57,http://pbs.twimg.com/profile_images/1400165461548048384/3Vbvt8E2.jpg
RT @GuatemalaGob: #InformeNacional | Guatemala y México reafirman sus lazos de amistad y cooperación con la donación de 150 mil dosis de la…,https://twitter.com/i/web/status/1408237514134020099,24/06/2021 19:36:01,Twitter for iPhone,0,10,MinGob,19:36:01,http://pbs.twimg.com/profile_images/1371480777330941958/_81AGCXa.jpg
"#TuDenunciaEsConfidencial 🗣 📞 🕵🏻‍
#YoDenuncio
Se dará seguimiento y respuesta a toda la información que usted brind… https://t.co/nf2M2XlIJ4",https://twitter.com/i/web/status/1408243547913048064,24/06/2021 20:00:00,Twitter Media Studio,0,0,MinGob,20:00:00,http://pbs.twimg.com/profile_images/1371480777330941958/_81AGCXa.jpg
"📻🎙#SinergiaRadio 
No te pierdas mañana, la entrevista especial con el tema:
Tipos de armas y municiones que pueden… https://t.co/k1TeyQIEfC",https://twitter.com/i/web/status/1408245806621208578,24/06/2021 20:08:58,Twitter for Android,2,1,Ejército Guatemala,20:08:58,http://pbs.twimg.com/profile_images/1400165461548048384/3Vbvt8E2.jpg
"#YoSoyEseSoldado que brindó una mano a los guatemaltecos después de la tormenta tropical Agatha en 2010.
🤝💂🇬🇹👏… https://t.co/01eNF2y8SW",https://twitter.com/i/web/status/1408255206941499395,24/06/2021 20:46:20,Twitter for Android,11,2,Ejército Guatemala,20:46:20,http://pbs.twimg.com/profile_images/1400165461548048384/3Vbvt8E2.jpg
"#Pasaportes | 🛫 Recomendamos verificar la fecha de vencimiento del pasaporte, previo a realizar la compra de boleto… https://t.co/WTB9hkgAbU",https://twitter.com/i/web/status/1408258667040886786,24/06/2021 21:00:05,Hootsuite Inc.,3,1,Migración Guatemala,21:00:05,http://pbs.twimg.com/profile_images/1346129009051054081/v9JUwo36.jpg
#PPTSICA | El #ViceCancillerGt  @eduardoehr participó en Reunión Extraordinaria de los Presidentes de los países mi… https://t.co/544bq9104r,https://twitter.com/i/web/status/1408262193011953665,24/06/2021 21:14:05,Twitter Web App,8,3,MINEX Guatemala 🇬🇹,21:14:05,http://pbs.twimg.com/profile_images/1292832595093475329/6LQbTy36.jpg
Guatemala agradece el apoyo y esfuerzo del hermano Gobierno de México al hacer efectiva esta donación que beneficia… https://t.co/KPtArYbb1l,https://twitter.com/i/web/status/1408266412284649473,24/06/2021 21:30:51,Twitter for iPhone,0,1,MINEX Guatemala 🇬🇹,21:30:51,http://pbs.twimg.com/profile_images/1292832595093475329/6LQbTy36.jpg
