Contenido,IR,Fecha,Dispositivo,Likes,Retweets,Entidad,Hora,Foto
"¡Buenas tardes Guatemala! 🇬🇹

Soldados de la Segunda Brigada de Infantería del #EjércitoGT | #MINDEF te saludan. https://t.co/JTdA7OIzSY",https://twitter.com/i/web/status/1517657612275228673,22/04/2022 18:12:26,Twitter for Android,6,3,Ejército Guatemala,18:12:26,http://pbs.twimg.com/profile_images/1471838829430640640/0yNoNrwr.jpg
"En conmemoración al #DíaInternacionalDeLaTierra, la Primera Brigada de Infantería del #EjércitoGT participó en acto… https://t.co/Q8yCSkmFdw",https://twitter.com/i/web/status/1517659925706592256,22/04/2022 18:21:37,Twitter for Android,4,3,Ejército Guatemala,18:21:37,http://pbs.twimg.com/profile_images/1471838829430640640/0yNoNrwr.jpg
"RT @DrGiammattei: Durante la reunión de la #GiraPresidencial2022 con los alcaldes de Quetzaltenango, abordamos las obras realizadas y la pl…",https://twitter.com/i/web/status/1517664712925884416,22/04/2022 18:40:39,Twitter for Android,0,6,Gobierno Guatemala,18:40:39,http://pbs.twimg.com/profile_images/1479793855331459074/NqurElHC.jpg
📹 Representantes de los países miembros de la @OEA_oficial saludan y reconocen el liderazgo de Guatemala🇬🇹 en la Se… https://t.co/PMCuINMWM3,https://twitter.com/i/web/status/1517671845608275969,22/04/2022 19:08:59,Twitter for iPhone,0,0,MINEX Guatemala 🇬🇹,19:08:59,http://pbs.twimg.com/profile_images/1471828089491574785/eD5OEVK6.jpg
