Contenido,IR,Fecha,Dispositivo,Likes,Retweets,Entidad,Hora,Foto
#EnDirecto | Gran jornada de vacunación masiva en la Plaza de la Constitución. https://t.co/lp2VYvkGvQ,https://twitter.com/i/web/status/1436767156062998528,11/09/2021 13:02:38,"<a href=""https://periscope.tv"" rel=""nofollow"">Periscope",16,17,Gobierno Guatemala,13:02:38,http://pbs.twimg.com/profile_images/1371488309743120384/QqlgsWUm.jpg
"#ConciertoVirtual | Maderas &amp; Metales, conmemorando el Bicentenario de Independencia.
 
🗓 Sábado 11 de septiembre… https://t.co/cbXRDV1e6i",https://twitter.com/i/web/status/1436826891751731207,11/09/2021 17:00:00,Twitter Media Studio,20,12,Gobierno Guatemala,17:00:00,http://pbs.twimg.com/profile_images/1371488309743120384/QqlgsWUm.jpg
"#ConciertoVirtual | Maderas &amp; Metales, conmemorando el Bicentenario de Independencia. https://t.co/iCAmGLCX8c",https://twitter.com/i/web/status/1436857300388495361,11/09/2021 19:00:50,"<a href=""https://periscope.tv"" rel=""nofollow"">Periscope",55,28,Gobierno Guatemala,19:00:50,http://pbs.twimg.com/profile_images/1371488309743120384/QqlgsWUm.jpg
"RT @OPSOMSPeru: ¿Cómo se han 🙌🏽 apoyado unos a otros en tu comunidad 🏘 durante la pandemia?

Cuéntanos tus #HistoriasDeSolidaridad para com…",https://twitter.com/i/web/status/1437412295336988678,13/09/2021 07:46:11,Twitter for iPhone,0,4,OPS/OMS,07:46:11,http://pbs.twimg.com/profile_images/1096094749902028801/ijbQWupW.png
"RT @OPSOMS_Col: Estamos complacidos de haber contribuido a que Colombia 🇨🇴recibiera con prontitud, a través de COVAX y el Fondo Rotatorio d…",https://twitter.com/i/web/status/1437429467023032326,13/09/2021 08:54:25,Twitter for iPhone,0,8,OPS/OMS,08:54:25,http://pbs.twimg.com/profile_images/1096094749902028801/ijbQWupW.png
RT @OPSOMS_Col: Hoy en Puerto Arica desarrollamos un taller de comunicación del riesgo para conocer los mitos y despejar las dudas que tien…,https://twitter.com/i/web/status/1437432998924853262,13/09/2021 09:08:27,Twitter for iPhone,0,4,OPS/OMS,09:08:27,http://pbs.twimg.com/profile_images/1096094749902028801/ijbQWupW.png
#EnDirecto | Conferencia de prensa del Gabinete de Gobierno. https://t.co/KFf7C6DFLE,https://twitter.com/i/web/status/1437433359580295169,13/09/2021 09:09:53,"<a href=""https://periscope.tv"" rel=""nofollow"">Periscope",27,22,Gobierno Guatemala,09:09:53,http://pbs.twimg.com/profile_images/1371488309743120384/QqlgsWUm.jpg
"RT @OPSECU: Todos estamos poniendo el hombro en la lucha contra la #COVID19. Si seguimos cuidándonos y nos vacunamos, pronto será parte del…",https://twitter.com/i/web/status/1437436022237843458,13/09/2021 09:20:28,Twitter for iPhone,0,36,OPS/OMS,09:20:28,http://pbs.twimg.com/profile_images/1096094749902028801/ijbQWupW.png
"RT @OPSECU: El cumplimiento del #PlanVacunación9100 fue posible gracias al liderazgo de @LassoGuillermo, la capacidad técnica de @XimenaGar…",https://twitter.com/i/web/status/1437436060041154567,13/09/2021 09:20:37,Twitter for iPhone,0,9,OPS/OMS,09:20:37,http://pbs.twimg.com/profile_images/1096094749902028801/ijbQWupW.png
"#Presupuesto2022 | Balsells también comentó que para desarrollar proyectos de mediano plazo, como los de agua y san… https://t.co/4tK5YupOfT",https://twitter.com/i/web/status/1437441133504761856,13/09/2021 09:40:47,Twitter Web App,0,0,Ministerio de Finanzas Guatemala,09:40:47,http://pbs.twimg.com/profile_images/1292831294796320768/6Q8j5vtW.jpg
"Equidad es: 

✳️ Acceso a la salud para todas y todos
✳️ Educación para todas y todos
✳️ Comunidades empoderadas… https://t.co/qeElYzNl6o",https://twitter.com/i/web/status/1437441904057196552,13/09/2021 09:43:50,Twitter Web App,22,12,OPS/OMS,09:43:50,http://pbs.twimg.com/profile_images/1096094749902028801/ijbQWupW.png
"#GestiónMinfin | El Titular de Finanzas Públicas, @alvarogricci explica que el presupuesto del @MinSaludGuate fue f… https://t.co/xmqcPGMBI2",https://twitter.com/i/web/status/1437442736945311744,13/09/2021 09:47:09,Twitter Web App,2,0,Ministerio de Finanzas Guatemala,09:47:09,http://pbs.twimg.com/profile_images/1292831294796320768/6Q8j5vtW.jpg
"En  su intervención, el Dr. Eliú Mazariegos, comentó que a la fecha se han aplicado más de 5 millones 589 mil 320 d… https://t.co/a4sNMNLkHE",https://twitter.com/i/web/status/1437465631696244736,13/09/2021 11:18:08,Twitter for Android,2,1,Ministerio de Salud Pública,11:18:08,http://pbs.twimg.com/profile_images/1311755159027015685/QQcxgYd1.jpg
"""Una lección que nos ha enseñado esta pandemia 🦠 es que no basta con que las comunidades se unan. Las personas que… https://t.co/kbEOHMk9yE",https://twitter.com/i/web/status/1437466102687141891,13/09/2021 11:20:00,Twitter Web App,13,10,OPS/OMS,11:20:00,http://pbs.twimg.com/profile_images/1096094749902028801/ijbQWupW.png
Unidades especializadas de la SGIC salvaron la vida de 1 mil guatemaltecos https://t.co/lWy1ephYxM,https://twitter.com/i/web/status/1437471914826649610,13/09/2021 11:43:06,"<a href=""http://publicize.wp.com/"" rel=""nofollow"">WordPress.com",23,6,MinGob,11:43:06,http://pbs.twimg.com/profile_images/1371480777330941958/_81AGCXa.jpg
Avanzan proyectos del Nuevo Modelo de Gestión Penitenciaria https://t.co/VopoUXzBkT,https://twitter.com/i/web/status/1437472356553920515,13/09/2021 11:44:51,"<a href=""http://publicize.wp.com/"" rel=""nofollow"">WordPress.com",6,2,MinGob,11:44:51,http://pbs.twimg.com/profile_images/1371480777330941958/_81AGCXa.jpg
"Si tienes 18 años o más y te registraste, el #MSPAS te notificará para poder ir al puesto de vacunación.

Regístrat… https://t.co/3Y1NpU4Z6Q",https://twitter.com/i/web/status/1437474735990972421,13/09/2021 11:54:18,Twitter Web App,7,2,Ministerio de Salud Pública,11:54:18,http://pbs.twimg.com/profile_images/1311755159027015685/QQcxgYd1.jpg
"El #CancillerGT @PedroBroloGT dio a conocer, junto al embajador William Popp de @usembassyguate, el proceso acordad… https://t.co/Roju0I78GI",https://twitter.com/i/web/status/1437478857037189128,13/09/2021 12:10:41,Twitter Web App,10,3,MINEX Guatemala 🇬🇹,12:10:41,http://pbs.twimg.com/profile_images/1292832595093475329/6LQbTy36.jpg
"El secretario ejecutivo de @conamigua1, Raúl Berríos, indicó: ""Estamos complacidos por unir esfuerzos para resolver… https://t.co/ybIloXm2CR",https://twitter.com/i/web/status/1437483263908528131,13/09/2021 12:28:11,Twitter Web App,5,1,MINEX Guatemala 🇬🇹,12:28:11,http://pbs.twimg.com/profile_images/1292832595093475329/6LQbTy36.jpg
"El director del @MigracionGuate, Estuardo Rodríguez, dijo: ""En El Ceibo hemos recibido hondureños y salvadoreños ya… https://t.co/dDhdSGUbzE",https://twitter.com/i/web/status/1437486020354789379,13/09/2021 12:39:09,Twitter Web App,6,1,MINEX Guatemala 🇬🇹,12:39:09,http://pbs.twimg.com/profile_images/1292832595093475329/6LQbTy36.jpg
"""Trabajamos coordinadamente con las demás instituciones en El Ceibo y en la Fuerza Aérea. Y se prepara para recibir… https://t.co/aWHHMUQSwG",https://twitter.com/i/web/status/1437486030102437888,13/09/2021 12:39:11,Twitter Web App,3,0,MINEX Guatemala 🇬🇹,12:39:11,http://pbs.twimg.com/profile_images/1292832595093475329/6LQbTy36.jpg
"""Agradezco al @GuatemalaGob e instituciones representadas hoy como socios por el esfuerzo conjunto de apoyar retorn… https://t.co/UM3NlAtPLG",https://twitter.com/i/web/status/1437489026953617413,13/09/2021 12:51:05,Twitter Web App,2,1,MINEX Guatemala 🇬🇹,12:51:05,http://pbs.twimg.com/profile_images/1292832595093475329/6LQbTy36.jpg
"""EE. UU. continuará aplicando leyes de migración de manera justa y humana y trabajando con el @GuatemalaGob. Sabemo… https://t.co/A22E0o4KBo",https://twitter.com/i/web/status/1437489036445331460,13/09/2021 12:51:08,Twitter Web App,1,1,MINEX Guatemala 🇬🇹,12:51:08,http://pbs.twimg.com/profile_images/1292832595093475329/6LQbTy36.jpg
Analizan implementación de programas para prevenir la violencia en jóvenes https://t.co/wLFReiPY6s,https://twitter.com/i/web/status/1437491905005228043,13/09/2021 13:02:32,"<a href=""http://publicize.wp.com/"" rel=""nofollow"">WordPress.com",8,2,MinGob,13:02:32,http://pbs.twimg.com/profile_images/1371480777330941958/_81AGCXa.jpg
"Lleva a tus hijos a vacunar al servicio de salud más cercano.

Con sus vacunas al día, proteges su vida. 👶👧… https://t.co/LV3PAq194d",https://twitter.com/i/web/status/1437492155048763392,13/09/2021 13:03:31,Twitter Web App,2,1,Ministerio de Salud Pública,13:03:31,http://pbs.twimg.com/profile_images/1311755159027015685/QQcxgYd1.jpg
"RT @OPSOMS_Col: La vacunación salva vidas. Por ti y por los tuyos, vacúnate. https://t.co/5ieYm1mY6B",https://twitter.com/i/web/status/1437493001484480513,13/09/2021 13:06:53,Twitter for iPhone,0,7,OPS/OMS,13:06:53,http://pbs.twimg.com/profile_images/1096094749902028801/ijbQWupW.png
"RT @OPSOMS_Col: Jobino Cuello, médico tradicional del Amazonas, ya se puso la vacuna contra la COVID-19. Según él, ""es muy bueno, porque es…",https://twitter.com/i/web/status/1437493140865290245,13/09/2021 13:07:26,Twitter for iPhone,0,10,OPS/OMS,13:07:26,http://pbs.twimg.com/profile_images/1096094749902028801/ijbQWupW.png
"El personal de salud de San Benito, #Petén benefició a más de 400 personas de la comunidad que asistieron al puesto… https://t.co/whbPPNAUJg",https://twitter.com/i/web/status/1437496683508686852,13/09/2021 13:21:31,Twitter Web App,3,0,Ministerio de Salud Pública,13:21:31,http://pbs.twimg.com/profile_images/1311755159027015685/QQcxgYd1.jpg
"⚠️ ATENCIÓN ⚠️
Las personas de 18 años o más ya pueden registrarse en la página web 👉 https://t.co/XjxozAmJfy o en… https://t.co/uxRvzs996P",https://twitter.com/i/web/status/1437499571375116293,13/09/2021 13:32:59,Twitter Web App,19,12,Gobierno Guatemala,13:32:59,http://pbs.twimg.com/profile_images/1371488309743120384/QqlgsWUm.jpg
"Frente a la Municipalidad de San Andrés, #Petén, personal del Distrito de Salud, benefició este fin de semana alred… https://t.co/c09ZZSDW3Q",https://twitter.com/i/web/status/1437500109722460165,13/09/2021 13:35:08,Twitter Web App,4,2,Ministerio de Salud Pública,13:35:08,http://pbs.twimg.com/profile_images/1311755159027015685/QQcxgYd1.jpg
El #CancillerGT @PedroBroloGT recalcó que Guatemala ha alcanzado grandes acuerdos para que los retornados lleguen a… https://t.co/lSB431PwAx,https://twitter.com/i/web/status/1437501383490646017,13/09/2021 13:40:11,Twitter Web App,7,2,MINEX Guatemala 🇬🇹,13:40:11,http://pbs.twimg.com/profile_images/1292832595093475329/6LQbTy36.jpg
Misiones consulares y autoridades locales en México gestionan el retorno de niños a la brevedad. “Hemos tenido comu… https://t.co/jBisSaK156,https://twitter.com/i/web/status/1437501391505960972,13/09/2021 13:40:13,Twitter Web App,3,1,MINEX Guatemala 🇬🇹,13:40:13,http://pbs.twimg.com/profile_images/1292832595093475329/6LQbTy36.jpg
"El #CancillerGT @PedroBroloGT reiteró la solicitud del #TPS al embajador William Popp de la @usembassyguate, para q… https://t.co/8hVrHOlF6t",https://twitter.com/i/web/status/1437501399928082432,13/09/2021 13:40:15,Twitter Web App,2,0,MINEX Guatemala 🇬🇹,13:40:15,http://pbs.twimg.com/profile_images/1292832595093475329/6LQbTy36.jpg
Vecinos agradecen a brigadas militares de vacunación de casa en casa en La Limonada #YoMeVacuno 👉… https://t.co/5uu862fV5J,https://twitter.com/i/web/status/1437504006537027586,13/09/2021 13:50:37,Twitter Web App,10,3,Gobierno Guatemala,13:50:37,http://pbs.twimg.com/profile_images/1371488309743120384/QqlgsWUm.jpg
"📣 ¡Únete al equipo! 

Buscamos a un consultor que hable español e inglés para trabajar en sistemas de información p… https://t.co/ODeCBMfZQv",https://twitter.com/i/web/status/1437505956850634760,13/09/2021 13:58:22,Twitter Web App,9,8,OPS/OMS,13:58:22,http://pbs.twimg.com/profile_images/1096094749902028801/ijbQWupW.png
[#Video] 📹 Cuarto Viceministerio avanza con Proyectos Tecnológicos de beneficio para el país https://t.co/OaNWs425HK,https://twitter.com/i/web/status/1437506699531886605,13/09/2021 14:01:19,Twitter for iPhone,9,4,MinGob,14:01:19,http://pbs.twimg.com/profile_images/1371480777330941958/_81AGCXa.jpg
"#VacunaCOVID19 | El personal de salud aplicó más de 500 mil dosis de vacuna contra COVID-19 la semana pasada

Más i… https://t.co/Asl56tZYq7",https://twitter.com/i/web/status/1437513270592786437,13/09/2021 14:27:26,Twitter Web App,7,2,Ministerio de Salud Pública,14:27:26,http://pbs.twimg.com/profile_images/1311755159027015685/QQcxgYd1.jpg
#EnDirecto | Presidente @DrGiammattei participa en el reconocimiento como guatemaltecos destacados a Atletas Olímpi… https://t.co/35meG6TYoa,https://twitter.com/i/web/status/1437513681353404417,13/09/2021 14:29:04,"<a href=""https://periscope.tv"" rel=""nofollow"">Periscope",23,17,Gobierno Guatemala,14:29:04,http://pbs.twimg.com/profile_images/1371488309743120384/QqlgsWUm.jpg
[#Video] 📹 Avanzan proyectos del Nuevo Modelo de Gestión Penitenciaria https://t.co/1iyFGm2ify,https://twitter.com/i/web/status/1437520165609091077,13/09/2021 14:54:49,Twitter for iPhone,7,4,MinGob,14:54:49,http://pbs.twimg.com/profile_images/1371480777330941958/_81AGCXa.jpg
#BrevesMSPAS | El personal de salud aplicó más de 500 mil dosis de vacuna contra COVID-19 la semana pasada https://t.co/978Rdxhf2p,https://twitter.com/i/web/status/1437529018576814081,13/09/2021 15:30:00,Twitter Web App,2,0,Ministerio de Salud Pública,15:30:00,http://pbs.twimg.com/profile_images/1311755159027015685/QQcxgYd1.jpg
"🇬🇹🤝🏻🇺🇸 | Guatemala y EE. UU. buscan retorno seguro, ordenado y digno de migrantes.

#NotaDePrensa ➡️… https://t.co/anSt5v9DMJ",https://twitter.com/i/web/status/1437537735028379648,13/09/2021 16:04:38,Twitter Web App,6,3,MINEX Guatemala 🇬🇹,16:04:38,http://pbs.twimg.com/profile_images/1292832595093475329/6LQbTy36.jpg
"Lanquín, Alta Verapaz continúa con los esfuerzos de promoción para que los pobladores conozcan los beneficios de la… https://t.co/T1vuG7TGw5",https://twitter.com/i/web/status/1437537786731630597,13/09/2021 16:04:51,Twitter for Android,3,5,Ministerio de Salud Pública,16:04:51,http://pbs.twimg.com/profile_images/1311755159027015685/QQcxgYd1.jpg
"#TuDenunciaEsConfidencial 🗣📞🕵🏻‍
#YoDenuncio
Se dará seguimiento y respuesta a toda la información que usted brinde https://t.co/vQyYJzJxeM",https://twitter.com/i/web/status/1437542218257031170,13/09/2021 16:22:27,Twitter for iPhone,4,0,MinGob,16:22:27,http://pbs.twimg.com/profile_images/1371480777330941958/_81AGCXa.jpg
"#NotaDeDuelo | Lamentamos el fallecimiento de María Luisa Calito, madre de Wilson Estuardo Arroyo Calito, quien lab… https://t.co/X4IxRtxCBf",https://twitter.com/i/web/status/1437546924115124229,13/09/2021 16:41:09,Twitter for Android,5,2,Ministerio de Salud Pública,16:41:09,http://pbs.twimg.com/profile_images/1311755159027015685/QQcxgYd1.jpg
"Brigada de Artillería de Campaña ""Santa Bárbara"" del #EjércitoGT | #MINDEF apoya al @MinSaludGuate, en la organizac… https://t.co/1lXIKWgKq4",https://twitter.com/i/web/status/1437557308637188106,13/09/2021 17:22:25,Twitter for Android,9,2,Ejército Guatemala,17:22:25,http://pbs.twimg.com/profile_images/1400165461548048384/3Vbvt8E2.jpg
"Tercera Brigada de Infantería del #EjércitoGT | #MINDEF apoya al @MinSaludGuate, en la organización y funcionamient… https://t.co/ZnaSYpVnhU",https://twitter.com/i/web/status/1437558575132520449,13/09/2021 17:27:27,Twitter for Android,9,5,Ejército Guatemala,17:27:27,http://pbs.twimg.com/profile_images/1400165461548048384/3Vbvt8E2.jpg
"Cuarta Brigada de Infantería del #EjércitoGT | #MINDEF llevó a cabo la siembra del Árbol Nacional ""La Ceiba"", en el… https://t.co/VPJ9sNcDI6",https://twitter.com/i/web/status/1437559860544118784,13/09/2021 17:32:33,Twitter for Android,8,4,Ejército Guatemala,17:32:33,http://pbs.twimg.com/profile_images/1400165461548048384/3Vbvt8E2.jpg
[#Video] 📹 Analizan implementación de programas para prevenir la violencia en jóvenes https://t.co/MKoNumSmpi,https://twitter.com/i/web/status/1437560752597049356,13/09/2021 17:36:06,Twitter for iPhone,3,2,MinGob,17:36:06,http://pbs.twimg.com/profile_images/1371480777330941958/_81AGCXa.jpg
"#GestiónMinfin | El Ministro de Finanzas Públicas, @alvarogricci, participa en la entrevista🎙️ del programa… https://t.co/3Wimk8ne7B",https://twitter.com/i/web/status/1437563081761116162,13/09/2021 17:45:21,Twitter Web App,3,4,Ministerio de Finanzas Guatemala,17:45:21,http://pbs.twimg.com/profile_images/1292831294796320768/6Q8j5vtW.jpg
"#Presupuesto2022 |  El Ministro de Finanzas explica que se llevó a cabo un ejercicio de #PresupuestoAbiertoGT, que… https://t.co/ugsOUPqAjL",https://twitter.com/i/web/status/1437563083199819778,13/09/2021 17:45:22,Twitter Web App,2,1,Ministerio de Finanzas Guatemala,17:45:22,http://pbs.twimg.com/profile_images/1292831294796320768/6Q8j5vtW.jpg
El Titular de Finanzas resalta que las fases de la Formulación del #PresupuestoAbierto2022 alcanzaron más de 400 mi… https://t.co/6oDX2yMX80,https://twitter.com/i/web/status/1437563084491706371,13/09/2021 17:45:22,Twitter Web App,2,1,Ministerio de Finanzas Guatemala,17:45:22,http://pbs.twimg.com/profile_images/1292831294796320768/6Q8j5vtW.jpg
"#VacunaCOVID19 | En Suchitepéquez se intensifican las jornadas de vacunación contra la COVID-19

Más información 👉🏻… https://t.co/xI201Gl92T",https://twitter.com/i/web/status/1437565941513134080,13/09/2021 17:56:43,Twitter Web App,3,0,Ministerio de Salud Pública,17:56:43,http://pbs.twimg.com/profile_images/1311755159027015685/QQcxgYd1.jpg
"¡Buenas tardes #Guatemala! 
🌤🇬🇹
Desde el cerro Santo Tomás de Castilla soldados del Comando Naval del Caribe del… https://t.co/62orYC3YpM",https://twitter.com/i/web/status/1437571188654579713,13/09/2021 18:17:34,Twitter for Android,58,14,Ejército Guatemala,18:17:34,http://pbs.twimg.com/profile_images/1400165461548048384/3Vbvt8E2.jpg
"#AlertaIsabelClaudina | ¿Cómo reportar una mujer desaparecida?  

Por una vida libre de violencia para las mujeres.… https://t.co/3erfmW6dNm",https://twitter.com/i/web/status/1437571798665551877,13/09/2021 18:20:00,Twitter Media Studio,6,5,Gobierno Guatemala,18:20:00,http://pbs.twimg.com/profile_images/1371488309743120384/QqlgsWUm.jpg
"#Presupuesto2022 | El Ministro de Finanzas, @alvarogricci, indica que para el próximo año se proyecta una recaudaci… https://t.co/i8jaLdfR7N",https://twitter.com/i/web/status/1437573503855874053,13/09/2021 18:26:46,Twitter Web App,3,2,Ministerio de Finanzas Guatemala,18:26:46,http://pbs.twimg.com/profile_images/1292831294796320768/6Q8j5vtW.jpg
El Ministro reitera que el #Presupuesto2022 articula las políticas y planes del @GuatemalaGob y confía que el… https://t.co/BoN9Rha3lf,https://twitter.com/i/web/status/1437573508830273539,13/09/2021 18:26:47,Twitter Web App,2,1,Ministerio de Finanzas Guatemala,18:26:47,http://pbs.twimg.com/profile_images/1292831294796320768/6Q8j5vtW.jpg
"#Presupuesto2022 | Referente al Déficit Fiscal, el Ministro de Finanzas explica que el año pasado se registró un dé… https://t.co/aAw4XOcxEB",https://twitter.com/i/web/status/1437573507290914816,13/09/2021 18:26:47,Twitter Web App,2,1,Ministerio de Finanzas Guatemala,18:26:47,http://pbs.twimg.com/profile_images/1292831294796320768/6Q8j5vtW.jpg
"#GestiónMinfin | El Ministro explica que derivado del crecimiento en la recaudación tributaria, en el proyecto de… https://t.co/BTXpe6ilHW",https://twitter.com/i/web/status/1437573505885904897,13/09/2021 18:26:47,Twitter Web App,2,1,Ministerio de Finanzas Guatemala,18:26:47,http://pbs.twimg.com/profile_images/1292831294796320768/6Q8j5vtW.jpg
"#GestiónMinfin | Tras la aprobación de la Ley de Emergencia para la Atención de la Pandemia COVID-19, el Ministro i… https://t.co/uWLVyUmdXc",https://twitter.com/i/web/status/1437575071388815361,13/09/2021 18:33:00,Twitter Web App,2,1,Ministerio de Finanzas Guatemala,18:33:00,http://pbs.twimg.com/profile_images/1292831294796320768/6Q8j5vtW.jpg
"RT @DrGiammattei: Rendimos un homenaje a los 26 atletas olímpicos y paralímpicos, guatemaltecos que han inspirado a todo un país. Represent…",https://twitter.com/i/web/status/1437578011608551428,13/09/2021 18:44:41,Twitter for iPhone,0,16,Gobierno Guatemala,18:44:41,http://pbs.twimg.com/profile_images/1371488309743120384/QqlgsWUm.jpg
"RT @DrGiammattei: Rendimos un homenaje a los 26 atletas olímpicos y paralímpicos, guatemaltecos que han inspirado a todo un país. Represent…",https://twitter.com/i/web/status/1437579117587804161,13/09/2021 18:49:05,Twitter for iPhone,0,16,MinGob,18:49:05,http://pbs.twimg.com/profile_images/1371480777330941958/_81AGCXa.jpg
"Segunda Brigada de Policía Militar del #EjércitoGT | #MINDEF llevó a cabo la siembra del Árbol Nacional ""La Ceiba"",… https://t.co/K7NgAeS4KH",https://twitter.com/i/web/status/1437581800356728834,13/09/2021 18:59:44,Twitter for Android,5,3,Ejército Guatemala,18:59:44,http://pbs.twimg.com/profile_images/1400165461548048384/3Vbvt8E2.jpg
[#Video] 📹 Unidades especializadas de la SGIC salvaron la vida de 1 mil guatemaltecos https://t.co/lKEKRANEBk,https://twitter.com/i/web/status/1437582900346736640,13/09/2021 19:04:07,Twitter for iPhone,6,2,MinGob,19:04:07,http://pbs.twimg.com/profile_images/1371480777330941958/_81AGCXa.jpg
"Quinta Brigada de Infantería del #EjércitoGT | #MINDEF apoyó al @MinSaludGuate, en la organización y funcionamiento… https://t.co/3UusvOrIeV",https://twitter.com/i/web/status/1437583618088579075,13/09/2021 19:06:58,Twitter for Android,4,3,Ejército Guatemala,19:06:58,http://pbs.twimg.com/profile_images/1400165461548048384/3Vbvt8E2.jpg
"#YoDenuncio
#RompeConElSilencio 📣🚨
Denuncia si conoces información sobre casos de violencia contra las mujeres y ni… https://t.co/rZhHddFBRA",https://twitter.com/i/web/status/1437594129987477506,13/09/2021 19:48:44,Twitter Web App,6,1,MinGob,19:48:44,http://pbs.twimg.com/profile_images/1371480777330941958/_81AGCXa.jpg
"Primera Brigada de Infantería del #EjércitoGT | #MINDEF apoyó al @MinSaludGuate, en la organización y funcionamient… https://t.co/jxqEAjXrVh",https://twitter.com/i/web/status/1437596632984559617,13/09/2021 19:58:41,Twitter for Android,4,2,Ejército Guatemala,19:58:41,http://pbs.twimg.com/profile_images/1400165461548048384/3Vbvt8E2.jpg
@rgprendes Estamos a la orden.,https://twitter.com/i/web/status/1437606737884983296,13/09/2021 20:38:50,Twitter Web App,0,0,Migración Guatemala,20:38:50,http://pbs.twimg.com/profile_images/1346129009051054081/v9JUwo36.jpg
"@baygamesgt Buenas noches, le comentamos que el Instituto Guatemalteco de Migración atiende casos de emergencia, si… https://t.co/XydZCEe1dA",https://twitter.com/i/web/status/1437606925047316480,13/09/2021 20:39:35,Twitter Web App,1,0,Migración Guatemala,20:39:35,http://pbs.twimg.com/profile_images/1346129009051054081/v9JUwo36.jpg
"@GlendaMarcos6 Buenas noches, le hemos escrito vía Direct, para darle continuidad a su consulta.",https://twitter.com/i/web/status/1437607267541700608,13/09/2021 20:40:56,Twitter Web App,1,0,Migración Guatemala,20:40:56,http://pbs.twimg.com/profile_images/1346129009051054081/v9JUwo36.jpg
"La Tercera Brigada de Infantería del #EjércitoGT invitó a la población de #Jalapa, a realizarse la prueba de COVID-… https://t.co/vXwzwpKIeC",https://twitter.com/i/web/status/1437608215672393729,13/09/2021 20:44:42,Twitter for Android,4,3,Ejército Guatemala,20:44:42,http://pbs.twimg.com/profile_images/1400165461548048384/3Vbvt8E2.jpg
#Extranjería | Los formularios para trámite de visas y residencias No tienen costo! Se pueden descargar en ➡️… https://t.co/C7RK7XMm8c,https://twitter.com/i/web/status/1437612082195742720,13/09/2021 21:00:04,Hootsuite Inc.,0,0,Migración Guatemala,21:00:04,http://pbs.twimg.com/profile_images/1346129009051054081/v9JUwo36.jpg
"Ejército del Bicentenario 🇬🇹💂‍♂️
#365DíasAlServicioDeMiPatria https://t.co/le9MxVtSPB",https://twitter.com/i/web/status/1437615622964326402,13/09/2021 21:14:08,Twitter for Android,20,5,Ejército Guatemala,21:14:08,http://pbs.twimg.com/profile_images/1400165461548048384/3Vbvt8E2.jpg
RT @SCSPGT: #InformeNacional | 13-09-2021 https://t.co/zuGLD9YDiW,https://twitter.com/i/web/status/1437616170941784072,13/09/2021 21:16:19,Twitter for Android,0,5,Ejército Guatemala,21:16:19,http://pbs.twimg.com/profile_images/1400165461548048384/3Vbvt8E2.jpg
#Extranjería | Encuentra los requisitos para efectuar tus trámites en ➡️ https://t.co/eG7HzmPUW2 https://t.co/mewol7UohA,https://twitter.com/i/web/status/1437619623525031939,13/09/2021 21:30:02,Hootsuite Inc.,0,0,Migración Guatemala,21:30:02,http://pbs.twimg.com/profile_images/1346129009051054081/v9JUwo36.jpg
#InformeNacional | El Gobierno de Guatemala otorgó un reconocimiento a la delegación de atletas que participaron en… https://t.co/X0HqthCtqL,https://twitter.com/i/web/status/1437624759538307074,13/09/2021 21:50:27,Twitter Media Studio,5,1,Gobierno Guatemala,21:50:27,http://pbs.twimg.com/profile_images/1371488309743120384/QqlgsWUm.jpg
#Extranjería | Consulta tu estado de expediente ingresando los datos solicitados en ➡️ https://t.co/XLxahaCrDU https://t.co/WYzc5Ek99I,https://twitter.com/i/web/status/1437634724554584070,13/09/2021 22:30:02,Hootsuite Inc.,0,0,Migración Guatemala,22:30:02,http://pbs.twimg.com/profile_images/1346129009051054081/v9JUwo36.jpg
#Extranjería | Revisa si tu número de expediente se encuentra en la Lista de Residencias y Visas con Previo Pendien… https://t.co/QxvmwXf2Xg,https://twitter.com/i/web/status/1437635979163185152,13/09/2021 22:35:02,Hootsuite Inc.,0,0,Migración Guatemala,22:35:02,http://pbs.twimg.com/profile_images/1346129009051054081/v9JUwo36.jpg
