Contenido,IR,Fecha,Dispositivo,Likes,Retweets,Entidad,Hora,Foto
"#AtenciónMunicipal | Con el objetivo de automatizar operaciones, transparentar el gasto y formular presupuestos de… https://t.co/E4cDlkXVlo",https://twitter.com/i/web/status/1495098239447621633,19/02/2022 12:09:32,Twitter for iPhone,6,2,Ministerio de Finanzas de Guatemala,12:09:32,http://pbs.twimg.com/profile_images/1471837102618853383/4xfotDwN.jpg
"#TransparenciaGT | Ejerce tu derecho a conocer y fiscalizar información del uso de los recursos públicos 🔎.

Ingres… https://t.co/nfvGDMRGiO",https://twitter.com/i/web/status/1495207131389337602,19/02/2022 19:22:14,Twitter for iPhone,4,2,Ministerio de Finanzas de Guatemala,19:22:14,http://pbs.twimg.com/profile_images/1471837102618853383/4xfotDwN.jpg
"Nos sentimos orgullosos de nuestra cultura e instrumento nacional, el cual nos representa como guatemaltecos. 🇬🇹… https://t.co/h5uWMzcaWy",https://twitter.com/i/web/status/1495411985885892609,20/02/2022 08:56:15,Twitter for iPhone,10,2,Ministerio de Finanzas de Guatemala,08:56:15,http://pbs.twimg.com/profile_images/1471837102618853383/4xfotDwN.jpg
#GestiónMinfin | Durante el conversatorio: Liderazgo de los Ministerios de Finanzas de la Región en la Acción Climá… https://t.co/vm1AShSoie,https://twitter.com/i/web/status/1495533833806127115,20/02/2022 17:00:26,Twitter for iPhone,9,3,Ministerio de Finanzas de Guatemala,17:00:26,http://pbs.twimg.com/profile_images/1471837102618853383/4xfotDwN.jpg
"#GestiónMinfin | La Junta Monetaria, de la cual es parte el Ministro de Finanzas Públicas, @alvarogricci, informó q… https://t.co/bA9qOCiipq",https://twitter.com/i/web/status/1495811059269177344,21/02/2022 11:22:02,Twitter for Android,8,2,Ministerio de Finanzas de Guatemala,11:22:02,http://pbs.twimg.com/profile_images/1471837102618853383/4xfotDwN.jpg
🤝Únete al lanzamiento de un nuevo informe de la OMS y UNICEF  sobre el mercadeo agresivo de leche de fórmula infant… https://t.co/Ie94234i2K,https://twitter.com/i/web/status/1495866200479473672,21/02/2022 15:01:08,Twitter Web App,20,12,OPS/OMS,15:01:08,http://pbs.twimg.com/profile_images/1096094749902028801/ijbQWupW.png
#GestiónMinfin | Con el objetivo de garantizar el abastecimiento de  medicamentos e insumos médicos para tratar a p… https://t.co/yE167ReJNe,https://twitter.com/i/web/status/1495906899946000393,21/02/2022 17:42:52,Twitter for Android,2,0,Ministerio de Finanzas de Guatemala,17:42:52,http://pbs.twimg.com/profile_images/1471837102618853383/4xfotDwN.jpg
"#InformeNacional | Te invitamos a conocer las recientes acciones del @GuatemalaGob

✅ Gobierno oficializa ciclo esc… https://t.co/vMT3JeKAGx",https://twitter.com/i/web/status/1495964097342541828,21/02/2022 21:30:09,Twitter for Android,0,0,Ministerio de Finanzas de Guatemala,21:30:09,http://pbs.twimg.com/profile_images/1471837102618853383/4xfotDwN.jpg
"#GuateTransparente | ¿Sabías que entre tus derechos está hacer auditoría social de los recursos públicos?

Involúcr… https://t.co/NTf9k4J4ui",https://twitter.com/i/web/status/1496131028209094662,22/02/2022 08:33:28,Twitter Web App,5,1,Ministerio de Finanzas de Guatemala,08:33:28,http://pbs.twimg.com/profile_images/1471837102618853383/4xfotDwN.jpg
"El amor por un recién nacido genera fuerzas infinitas, opina Sebastián 🇲🇽

#Primeros28Días #SaludDelReciénNacido https://t.co/8PsAGPqngi",https://twitter.com/i/web/status/1496131960732893185,22/02/2022 08:37:10,Twitter Web App,6,2,OPS/OMS,08:37:10,http://pbs.twimg.com/profile_images/1096094749902028801/ijbQWupW.png
RT @PAHOemergencies: ¡Hoy en breve! 🙌A las 10 AM (EST) no te pierdas la presentación de la colección Evidence Aid sobre sistemas de salud r…,https://twitter.com/i/web/status/1496132259908407296,22/02/2022 08:38:22,Twitter for iPhone,0,7,OPS/OMS,08:38:22,http://pbs.twimg.com/profile_images/1096094749902028801/ijbQWupW.png
El dado de alta de la maternidad es una instancia clave de información sobre el manejo adecuado del recién nacido e… https://t.co/UzLm8GUY8N,https://twitter.com/i/web/status/1496141245646790664,22/02/2022 09:14:04,Twitter Web App,2,1,OPS/OMS,09:14:04,http://pbs.twimg.com/profile_images/1096094749902028801/ijbQWupW.png
"RT @campusvirtualsp: ¿Conoces la Clasificación Internacional de Enfermedad  (CIE)📋? ¿Debes utilizarla en tu trabajo? 
📚 Comienza el curso s…",https://twitter.com/i/web/status/1496145566946009088,22/02/2022 09:31:14,Twitter for iPhone,0,26,OPS/OMS,09:31:14,http://pbs.twimg.com/profile_images/1096094749902028801/ijbQWupW.png
"RT @campusvirtualsp: ¿Conoces los 21 métodos modernos de planificación familiar?
📌Comienza nuestro nuevo curso virtual y aprende sobre la p…",https://twitter.com/i/web/status/1496145593122570255,22/02/2022 09:31:21,Twitter for iPhone,0,15,OPS/OMS,09:31:21,http://pbs.twimg.com/profile_images/1096094749902028801/ijbQWupW.png
"RT @campusvirtualsp: CURSO👉🏼Salud integral de las y los adolescentes

✅Aprenderás a desarrollar e implementar programas, intervenciones y s…",https://twitter.com/i/web/status/1496145614723244032,22/02/2022 09:31:26,Twitter for iPhone,0,8,OPS/OMS,09:31:26,http://pbs.twimg.com/profile_images/1096094749902028801/ijbQWupW.png
RT @campusvirtualsp: 📣 Atención: ante la pandemia de #COVID19 👉🏾 hemos incluido nuevo contenido al curso sobre primera ayuda psicológica (P…,https://twitter.com/i/web/status/1496145628899987456,22/02/2022 09:31:29,Twitter for iPhone,0,13,OPS/OMS,09:31:29,http://pbs.twimg.com/profile_images/1096094749902028801/ijbQWupW.png
RT @EmbaGuaFr: Funcionarios de la @EmbaGuaFr se reunieron con autoridades de la Convención para la salvaguardia del patrimonio cultural inm…,https://twitter.com/i/web/status/1496169486956863488,22/02/2022 11:06:17,Twitter Web App,0,3,MINEX Guatemala 🇬🇹,11:06:17,http://pbs.twimg.com/profile_images/1471828089491574785/eD5OEVK6.jpg
"RT @EmbGuaIndia: EmbaGuateIndia held a meeting with a representative from Bharat Biotech, a leading manufacturer of vaccines such as Hepati…",https://twitter.com/i/web/status/1496169940268814349,22/02/2022 11:08:05,Twitter Web App,0,5,MINEX Guatemala 🇬🇹,11:08:05,http://pbs.twimg.com/profile_images/1471828089491574785/eD5OEVK6.jpg
"Después de la pandemia, la salud mental de los equipos de salud será un desafío urgente. 

Lea el primer informe de… https://t.co/j8rlRQJr7Y",https://twitter.com/i/web/status/1496183011431399433,22/02/2022 12:00:02,Twitter Media Studio,32,24,OPS/OMS,12:00:02,http://pbs.twimg.com/profile_images/1096094749902028801/ijbQWupW.png
El @ConsGuateTucson y @ConsGuaTijuana coordinaron asistencia y protección a connacional y su hijo recién nacido ret… https://t.co/0NBEWekJmc,https://twitter.com/i/web/status/1496194763573415939,22/02/2022 12:46:44,Twitter Web App,2,5,MINEX Guatemala 🇬🇹,12:46:44,http://pbs.twimg.com/profile_images/1471828089491574785/eD5OEVK6.jpg
[#Video] 📹 Personal de tres Delegaciones de @PNCdeGuatemala recuperaron 26 espacios de grafitis https://t.co/gwlqAFCJ4h,https://twitter.com/i/web/status/1496207917837651977,22/02/2022 13:39:00,Twitter for iPhone,4,2,MinGob,13:39:00,http://pbs.twimg.com/profile_images/1471828174598246407/Y1Lm5nFE.jpg
#NuevasMetas | 💪🏻 Estamos comprometidos con nuestros usuarios. https://t.co/oio1cBHkxS,https://twitter.com/i/web/status/1496220405807587328,22/02/2022 14:28:37,Twitter for iPhone,1,1,Migración Guatemala,14:28:37,http://pbs.twimg.com/profile_images/1472975116015386625/qXTSRrI2.jpg
#FinanzasPersonales 💡| La banca por internet es importante para gestionar tus finanzas y una apuesta cómoda e innov… https://t.co/SFdZUTPzYm,https://twitter.com/i/web/status/1496220543846125576,22/02/2022 14:29:10,Twitter Web App,4,1,Ministerio de Finanzas de Guatemala,14:29:10,http://pbs.twimg.com/profile_images/1471837102618853383/4xfotDwN.jpg
[#Video] 📹 Traslado aéreo por parte de FIAAT de vacunas hacia lugares de difícil acceso en el departamento de Quiché https://t.co/FWsm1zGc03,https://twitter.com/i/web/status/1496224581824270338,22/02/2022 14:45:13,Twitter Web App,5,3,MinGob,14:45:13,http://pbs.twimg.com/profile_images/1471828174598246407/Y1Lm5nFE.jpg
"#Información | Director General, Stuard Rodríguez, sostiene reunión con representantes de @OIMGuatemala,… https://t.co/YCfxHWsMIw",https://twitter.com/i/web/status/1496225119529746438,22/02/2022 14:47:21,Twitter for iPhone,4,1,Migración Guatemala,14:47:21,http://pbs.twimg.com/profile_images/1472975116015386625/qXTSRrI2.jpg
RT @consgtmontreal: 🇬🇹 | @consgtmontreal realiza visita a finca para velar por la protección consular  de trabajadores extranjeros temporal…,https://twitter.com/i/web/status/1496225813062205445,22/02/2022 14:50:07,Twitter Web App,0,7,MINEX Guatemala 🇬🇹,14:50:07,http://pbs.twimg.com/profile_images/1471828089491574785/eD5OEVK6.jpg
"Personal de la Dirección de Área de Salud de Ixil, realizará una jornada de vacunación contra COVID-19 en el munici… https://t.co/Fau10Vp27n",https://twitter.com/i/web/status/1496228970890735625,22/02/2022 15:02:39,Twitter Web App,3,1,Ministerio de Salud Pública,15:02:39,http://pbs.twimg.com/profile_images/1471842908043190279/bu1LHFWL.jpg
"Personal de la Dirección de Área de Salud de Ixcán realizan barrido de casa en casa, con el objetivo de beneficiar… https://t.co/a0Gr7qOuiJ",https://twitter.com/i/web/status/1496230003352158228,22/02/2022 15:06:46,Twitter Web App,0,0,Ministerio de Salud Pública,15:06:46,http://pbs.twimg.com/profile_images/1471842908043190279/bu1LHFWL.jpg
RT @OEA_oficial: VIERNES | Consejo Permanente de la #OEA dialoga sobre “La pandemia de #COVID19: creando resiliencia en el sector de atenci…,https://twitter.com/i/web/status/1496231188159209472,22/02/2022 15:11:28,Twitter for iPhone,0,6,OPS/OMS,15:11:28,http://pbs.twimg.com/profile_images/1096094749902028801/ijbQWupW.png
#DíaDeLaLenguaMaterna | Tramita la certificación de movimientos migratorios en la 6 av. 3-11 zona 4 de la ciudad de… https://t.co/ZXvSxWjUJL,https://twitter.com/i/web/status/1496232093646573571,22/02/2022 15:15:04,Hootsuite Inc.,0,0,Migración Guatemala,15:15:04,http://pbs.twimg.com/profile_images/1472975116015386625/qXTSRrI2.jpg
"#MSPAS intensifica vacunación contra COVID-19 en todo el país. 

Le contamos detalles: https://t.co/IO9QnnaONw https://t.co/LbffKNE3Ox",https://twitter.com/i/web/status/1496233126242177026,22/02/2022 15:19:10,Twitter Web App,5,0,Ministerio de Salud Pública,15:19:10,http://pbs.twimg.com/profile_images/1471842908043190279/bu1LHFWL.jpg
"El #CancillerGT @MarioBucaroGT sostuvo reunión con el Embajador de Egipto en Guatemala, en la cual reafirmaron el c… https://t.co/7H6UGbxFbO",https://twitter.com/i/web/status/1496235558628167682,22/02/2022 15:28:50,Twitter Web App,14,6,MINEX Guatemala 🇬🇹,15:28:50,http://pbs.twimg.com/profile_images/1471828089491574785/eD5OEVK6.jpg
"Viceministros de Prevención de la Violencia y el Delito, Ronald Portillo y de Tecnología de la Información, Edgar Á… https://t.co/MA8leitRxs",https://twitter.com/i/web/status/1496238280416841737,22/02/2022 15:39:39,Twitter Web App,10,5,MinGob,15:39:39,http://pbs.twimg.com/profile_images/1471828174598246407/Y1Lm5nFE.jpg
DIDAE refuerza apoyo ciudadano con operativos en zona 12 https://t.co/hLxLKTLYzY,https://twitter.com/i/web/status/1496240012425322502,22/02/2022 15:46:32,"<a href=""http://publicize.wp.com/"" rel=""nofollow"">WordPress.com",6,3,MinGob,15:46:32,http://pbs.twimg.com/profile_images/1471828174598246407/Y1Lm5nFE.jpg
"El Ministro de Salud de El Salvador,  Francisco José Alabi Montoya y el de Guatemala Francisco Coma,  firmaron el A… https://t.co/lmFdIZvrT6",https://twitter.com/i/web/status/1496240932831776774,22/02/2022 15:50:11,Twitter Web App,3,0,Ministerio de Salud Pública,15:50:11,http://pbs.twimg.com/profile_images/1471842908043190279/bu1LHFWL.jpg
"Funcionarios del @MinexGt participaron en Reunión  de la Subcomisión de Detección, Atención, Protección y Repatriac… https://t.co/ECkmMe4R5b",https://twitter.com/i/web/status/1496241299833470976,22/02/2022 15:51:39,Twitter Web App,12,6,MINEX Guatemala 🇬🇹,15:51:39,http://pbs.twimg.com/profile_images/1471828089491574785/eD5OEVK6.jpg
“Quiero iniciar resaltando la trascendencia de este acuerdo binacional entre los Ministerios de Salud de Guatemala… https://t.co/uTKJDjovoH,https://twitter.com/i/web/status/1496241375569920006,22/02/2022 15:51:57,Twitter Web App,0,0,Ministerio de Salud Pública,15:51:57,http://pbs.twimg.com/profile_images/1471842908043190279/bu1LHFWL.jpg
"expresó  el Ministro de Salud Francisco Coma.
Las acciones transfronterizas que se emprenderán permitirán la coordi… https://t.co/D0SysN25oA",https://twitter.com/i/web/status/1496242070444548103,22/02/2022 15:54:43,Twitter Web App,0,0,Ministerio de Salud Pública,15:54:43,http://pbs.twimg.com/profile_images/1471842908043190279/bu1LHFWL.jpg
"#JornadaMóvil | Se emitieron 1,018 pasaportes durante la jornada móvil en el departamento de Jutiapa. ➡️… https://t.co/MlBCHFHZqr",https://twitter.com/i/web/status/1496243456737529856,22/02/2022 16:00:13,Hootsuite Inc.,4,1,Migración Guatemala,16:00:13,http://pbs.twimg.com/profile_images/1472975116015386625/qXTSRrI2.jpg
"#BrevesMSPAS | El ministro de Salud, Francisco Coma y la Presidente de la Liga Nacional contra el Cáncer, Dra. Vick… https://t.co/7jcAiZ9VzT",https://twitter.com/i/web/status/1496250033720770565,22/02/2022 16:26:21,Twitter Web App,1,1,Ministerio de Salud Pública,16:26:21,http://pbs.twimg.com/profile_images/1471842908043190279/bu1LHFWL.jpg
#Actualización| #MSPAS informa este 22 de febrero de 2022 los casos confirmados por laboratorio en el tablero Situa… https://t.co/fTbdumWELt,https://twitter.com/i/web/status/1496251090307895297,22/02/2022 16:30:33,Twitter Web App,4,8,Ministerio de Salud Pública,16:30:33,http://pbs.twimg.com/profile_images/1471842908043190279/bu1LHFWL.jpg
⚠️ En el tablero COVID-19 los fallecidos reportados el día anterior se visualizan por la fecha de defunción. Estos… https://t.co/qh9oLmDPpS,https://twitter.com/i/web/status/1496251139888754689,22/02/2022 16:30:45,Twitter Web App,0,1,Ministerio de Salud Pública,16:30:45,http://pbs.twimg.com/profile_images/1471842908043190279/bu1LHFWL.jpg
El #MSPAS informa la cantidad de personas que han recibido la primera dosis y el esquema completo de la vacuna cont… https://t.co/7F5eCPte82,https://twitter.com/i/web/status/1496251564130021387,22/02/2022 16:32:26,Twitter Web App,7,1,Ministerio de Salud Pública,16:32:26,http://pbs.twimg.com/profile_images/1471842908043190279/bu1LHFWL.jpg
Guatemala condena reconocimiento de repúblicas separatistas de Ucrania por parte de Rusia. https://t.co/PIf4D8r4PU,https://twitter.com/i/web/status/1496260258448252928,22/02/2022 17:06:59,Twitter Web App,67,38,MINEX Guatemala 🇬🇹,17:06:59,http://pbs.twimg.com/profile_images/1471828089491574785/eD5OEVK6.jpg
Guatemala condena enérgicamente el reconocimiento unilateral por parte de la Federación de Rusia a las llamadas rep… https://t.co/khVOEcT7SU,https://twitter.com/i/web/status/1496262835126640644,22/02/2022 17:17:13,Twitter Web App,48,41,MINEX Guatemala 🇬🇹,17:17:13,http://pbs.twimg.com/profile_images/1471828089491574785/eD5OEVK6.jpg
"#Información | Con el fin de compartir experiencias para mejorar coordinaciones bilaterales con México, el Subdirec… https://t.co/RGqj5swo6I",https://twitter.com/i/web/status/1496270304590671881,22/02/2022 17:46:54,Twitter for iPhone,4,1,Migración Guatemala,17:46:54,http://pbs.twimg.com/profile_images/1472975116015386625/qXTSRrI2.jpg
#Extranjería | Revisa si tu número de expediente se encuentra en la Lista de Residencias y Visas con Previo Pendien… https://t.co/XiAu6CA832,https://twitter.com/i/web/status/1496273729697030145,22/02/2022 18:00:31,Hootsuite Inc.,1,0,Migración Guatemala,18:00:31,http://pbs.twimg.com/profile_images/1472975116015386625/qXTSRrI2.jpg
#JuntosVamosPorMás | El Gobierno del presidente Alejandro Giammattei apoya a menores y adolescentes migrantes a tra… https://t.co/ulZlfGcKgy,https://twitter.com/i/web/status/1496276433848737796,22/02/2022 18:11:15,Twitter for Android,5,3,Ejército Guatemala,18:11:15,http://pbs.twimg.com/profile_images/1471838829430640640/0yNoNrwr.jpg
"[#Video]📹 La Fuerza de Tarea de Interdicción Aérea, Antinarcótica y Antiterrorista (FIAAT), bajo la coordinación de… https://t.co/dziyHXXoBk",https://twitter.com/i/web/status/1496281150540500995,22/02/2022 18:30:00,Twitter Media Studio,3,2,MinGob,18:30:00,http://pbs.twimg.com/profile_images/1471828174598246407/Y1Lm5nFE.jpg
#GiraPresidencial2022 | Cientos de familias han sido beneficiadas con el plan de electrificación implementado por e… https://t.co/jmMVcxAJsE,https://twitter.com/i/web/status/1496281151002009609,22/02/2022 18:30:00,Twitter Web App,5,6,Gobierno Guatemala,18:30:00,http://pbs.twimg.com/profile_images/1479793855331459074/NqurElHC.jpg
#GuateSegura | La @PNCdeGuatemala brindó información sobre acciones de seguridad ciudadana implementadas en Alta Ve… https://t.co/UDRbL5F9E7,https://twitter.com/i/web/status/1496288700984020992,22/02/2022 19:00:00,Twitter Web App,0,5,Gobierno Guatemala,19:00:00,http://pbs.twimg.com/profile_images/1479793855331459074/NqurElHC.jpg
"Brigada de Artillería de Campaña ""Santa Bárbara"" del #EjércitoGT | #MINDEF apoyó al @MinSaludGuate en la organizaci… https://t.co/r1QeX7RDOl",https://twitter.com/i/web/status/1496289063892144135,22/02/2022 19:01:27,Twitter for Android,6,3,Ejército Guatemala,19:01:27,http://pbs.twimg.com/profile_images/1471838829430640640/0yNoNrwr.jpg
"#SinergiaTGW🎙 | Sintoniza Radio #TGW 107.3 F.M y escucha tu programa ""Sinergia Institucional Radio"". En nuestra ent… https://t.co/CT4FUMfQVj",https://twitter.com/i/web/status/1496290809842487298,22/02/2022 19:08:23,Twitter for Android,8,2,Ejército Guatemala,19:08:23,http://pbs.twimg.com/profile_images/1471838829430640640/0yNoNrwr.jpg
#GiraPresidencial2022 | El Gobierno del presidente @DrGiammattei fortalece la economía de los pobladores a través d… https://t.co/VExOO21XIs,https://twitter.com/i/web/status/1496296403248758786,22/02/2022 19:30:37,Twitter Web App,4,6,Gobierno Guatemala,19:30:37,http://pbs.twimg.com/profile_images/1479793855331459074/NqurElHC.jpg
"RT @DrGiammattei: Con miras a un futuro distinto para Santa Catarina Ixtahuacán y Nahualá, continuamos con la mesa de diálogo para llegar a…",https://twitter.com/i/web/status/1496297134848675843,22/02/2022 19:33:31,Twitter Web App,0,18,Gobierno Guatemala,19:33:31,http://pbs.twimg.com/profile_images/1479793855331459074/NqurElHC.jpg
#MesaDeDiálogo |El presidente @DrGiammattei sostuvo una reunión con autoridades de #Nahualá y… https://t.co/gsaZx4u6gX,https://twitter.com/i/web/status/1496297684696711172,22/02/2022 19:35:42,Twitter for iPhone,12,7,Gobierno Guatemala,19:35:42,http://pbs.twimg.com/profile_images/1479793855331459074/NqurElHC.jpg
"@JMoratayaA Buenas noches, muy pronto estaremos visitando más departamentos.",https://twitter.com/i/web/status/1496301312014794754,22/02/2022 19:50:07,Twitter for iPhone,0,0,Migración Guatemala,19:50:07,http://pbs.twimg.com/profile_images/1472975116015386625/qXTSRrI2.jpg
"El Comando Naval del Pacífico del #EjércitoGT | #MINDEF apoyó al @MinSaludGuate, en la organización y funcionamient… https://t.co/R9Rr9eGhBy",https://twitter.com/i/web/status/1496301591745417218,22/02/2022 19:51:14,Twitter for Android,5,2,Ejército Guatemala,19:51:14,http://pbs.twimg.com/profile_images/1471838829430640640/0yNoNrwr.jpg
"#Migración | @MinexGt brinda apoyo a guatemalteca y su hijo interceptados en Arizona, Estados Unidos. 👇
https://t.co/KtImZiYkMR",https://twitter.com/i/web/status/1496303798553178114,22/02/2022 20:00:00,Twitter Web App,2,4,Gobierno Guatemala,20:00:00,http://pbs.twimg.com/profile_images/1479793855331459074/NqurElHC.jpg
"#TuDenunciaEsConfidencial 🗣📞🕵🏻‍

#YoDenuncio

Se dará seguimiento y respuesta a toda la información que usted brinde https://t.co/x2XUzP0b6M",https://twitter.com/i/web/status/1496303804588773376,22/02/2022 20:00:01,Twitter Media Studio,1,0,MinGob,20:00:01,http://pbs.twimg.com/profile_images/1471828174598246407/Y1Lm5nFE.jpg
"Señor Presidente de la República @DrGiammattei preside mesa de diálogo en compañía del @SrMindefGT y @mingobguate,… https://t.co/M0iuzDYgRy",https://twitter.com/i/web/status/1496304230788915201,22/02/2022 20:01:43,Twitter for Android,6,3,Ejército Guatemala,20:01:43,http://pbs.twimg.com/profile_images/1471838829430640640/0yNoNrwr.jpg
#TodosSomosMigrantes | Compartimos nuestra campaña en Kaqchiquel. Todos tenemos a un ser querido que migró en búsqu… https://t.co/eLAqaaTnfd,https://twitter.com/i/web/status/1496304648361324544,22/02/2022 20:03:22,Twitter for iPhone,1,1,Migración Guatemala,20:03:22,http://pbs.twimg.com/profile_images/1472975116015386625/qXTSRrI2.jpg
RT @GuatemalaGob: #JuntosVamosPorMás | El Gobierno del presidente @DrGiammattei apoya a menores y adolescentes migrantes a través de la Cas…,https://twitter.com/i/web/status/1496310056635228167,22/02/2022 20:24:52,Twitter for Android,0,28,Ministerio de Finanzas de Guatemala,20:24:52,http://pbs.twimg.com/profile_images/1471837102618853383/4xfotDwN.jpg
#GiraPresidencial2022 | Las acciones realizadas por el Gobierno del presidente @DrGiammattei permitirán el benefici… https://t.co/Orsuf4mOdR,https://twitter.com/i/web/status/1496311350125072386,22/02/2022 20:30:00,Twitter Web App,6,6,Gobierno Guatemala,20:30:00,http://pbs.twimg.com/profile_images/1479793855331459074/NqurElHC.jpg
MINGOB brinda apoyo aéreo para traslado de vacunas https://t.co/JSCWY3b8Kp,https://twitter.com/i/web/status/1496313534472458245,22/02/2022 20:38:41,"<a href=""http://publicize.wp.com/"" rel=""nofollow"">WordPress.com",2,1,MinGob,20:38:41,http://pbs.twimg.com/profile_images/1471828174598246407/Y1Lm5nFE.jpg
RT @GuatemalaGob: #JuntosVamosPorMás | El Gobierno del presidente @DrGiammattei apoya a menores y adolescentes migrantes a través de la Cas…,https://twitter.com/i/web/status/1496314287031304193,22/02/2022 20:41:40,Twitter for iPhone,0,28,MinGob,20:41:40,http://pbs.twimg.com/profile_images/1471828174598246407/Y1Lm5nFE.jpg
#Extranjería | Consulta tu estado de expediente ingresando los datos solicitados en ➡️ https://t.co/DnLPTTQGSp https://t.co/c3aAjtwhiD,https://twitter.com/i/web/status/1496318921254838274,22/02/2022 21:00:05,Hootsuite Inc.,1,0,Migración Guatemala,21:00:05,http://pbs.twimg.com/profile_images/1472975116015386625/qXTSRrI2.jpg
"Brigada Fuerzas Especiales del #EjércitoGT | #MINDEF apoyó al @MinSaludGuate, en la organización y funcionamiento d… https://t.co/DZu26lJwRK",https://twitter.com/i/web/status/1496322698133352450,22/02/2022 21:15:06,Twitter for Android,5,2,Ejército Guatemala,21:15:06,http://pbs.twimg.com/profile_images/1471838829430640640/0yNoNrwr.jpg
"RT @DrGiammattei: Con miras a un futuro distinto para Santa Catarina Ixtahuacán y Nahualá, continuamos con la mesa de diálogo para llegar a…",https://twitter.com/i/web/status/1496322731507433472,22/02/2022 21:15:14,Twitter for Android,0,18,Ejército Guatemala,21:15:14,http://pbs.twimg.com/profile_images/1471838829430640640/0yNoNrwr.jpg
Dirección General de Control de Armas y Municiones del #EjércitoGT | #MINDEF entrega café y pan a personas que se e… https://t.co/BO6Nl6WKmo,https://twitter.com/i/web/status/1496324825471668225,22/02/2022 21:23:33,Twitter for Android,9,3,Ejército Guatemala,21:23:33,http://pbs.twimg.com/profile_images/1471838829430640640/0yNoNrwr.jpg
"RT @DrGiammattei: Con miras a un futuro distinto para Santa Catarina Ixtahuacán y Nahualá, continuamos con la mesa de diálogo para llegar a…",https://twitter.com/i/web/status/1496329621847085059,22/02/2022 21:42:36,Twitter for iPhone,0,18,MinGob,21:42:36,http://pbs.twimg.com/profile_images/1471828174598246407/Y1Lm5nFE.jpg
RT @MinexGt: Guatemala condena reconocimiento de repúblicas separatistas de Ucrania por parte de Rusia. https://t.co/PIf4D8r4PU,https://twitter.com/i/web/status/1496329992506167299,22/02/2022 21:44:05,Twitter for iPhone,0,38,Gobierno Guatemala,21:44:05,http://pbs.twimg.com/profile_images/1479793855331459074/NqurElHC.jpg
#InformeNacional | 22 de febrero de 2022. https://t.co/IP9EinCFsa,https://twitter.com/i/web/status/1496330215395676166,22/02/2022 21:44:58,Twitter for Android,10,9,Gobierno Guatemala,21:44:58,http://pbs.twimg.com/profile_images/1479793855331459074/NqurElHC.jpg
#GiraPresidencial2022 | El programa de electrificación implementado por el Gobierno del presidente @DrGiammattei im… https://t.co/yhXZNasJex,https://twitter.com/i/web/status/1496334001279320064,22/02/2022 22:00:01,Twitter Web App,1,2,Gobierno Guatemala,22:00:01,http://pbs.twimg.com/profile_images/1479793855331459074/NqurElHC.jpg
RT @GuatemalaGob: #InformeNacional | 22 de febrero de 2022. https://t.co/IP9EinCFsa,https://twitter.com/i/web/status/1496338969348517894,22/02/2022 22:19:45,Twitter for iPhone,0,9,MinGob,22:19:45,http://pbs.twimg.com/profile_images/1471828174598246407/Y1Lm5nFE.jpg
"Reservas Militares del #EjércitoGT | #MINDEF apoyó al @MinSaludGuate, en la organización y funcionamiento de jornad… https://t.co/SMLwzIbBLu",https://twitter.com/i/web/status/1496340818180952064,22/02/2022 22:27:06,Twitter for Android,5,1,Ejército Guatemala,22:27:06,http://pbs.twimg.com/profile_images/1471838829430640640/0yNoNrwr.jpg
RT @GuatemalaGob: #JuntosVamosPorMás | El Gobierno del presidente @DrGiammattei apoya a menores y adolescentes migrantes a través de la Cas…,https://twitter.com/i/web/status/1496341589857570820,22/02/2022 22:30:10,Twitter for Android,0,28,MINEX Guatemala 🇬🇹,22:30:10,http://pbs.twimg.com/profile_images/1471828089491574785/eD5OEVK6.jpg
