Contenido,IR,Fecha,Dispositivo,Likes,Retweets,Entidad,Hora,Foto
Te invitamos a ver el #ResumenConsularGT con las actividades destacadas de la #RedConsularGT en el exterior durante… https://t.co/Q5DLqMX6xM,https://twitter.com/i/web/status/1419356523474587650,25/07/2021 11:59:00,Twitter Web App,0,0,MINEX Guatemala 🇬🇹,11:59:00,http://pbs.twimg.com/profile_images/1292832595093475329/6LQbTy36.jpg
"#EjércitoGT | #MINDEF apoya en puesto de vacunación contra el COVID-19, ubicado en la Primera Brigada de Policía Mi… https://t.co/r2vSB9Ym0f",https://twitter.com/i/web/status/1419356700839235589,25/07/2021 11:59:42,Twitter for Android,2,1,Ejército Guatemala,11:59:42,http://pbs.twimg.com/profile_images/1400165461548048384/3Vbvt8E2.jpg
"#Pasaportes | 🌎 Si te encuentras fuera del país y necesitas tramitar el pasaporte para un menor de edad, estos son… https://t.co/K9AOG93cvd",https://twitter.com/i/web/status/1419356807240339456,25/07/2021 12:00:07,Hootsuite Inc.,0,0,Migración Guatemala,12:00:07,http://pbs.twimg.com/profile_images/1346129009051054081/v9JUwo36.jpg
"El proceso de #PresupuestoAbiertoGT es una acción más de la política general de transparencia, expresó el President… https://t.co/tlQVHnHQe8",https://twitter.com/i/web/status/1419357276390010887,25/07/2021 12:01:59,Twitter for Android,1,0,Ministerio de Finanzas Guatemala,12:01:59,http://pbs.twimg.com/profile_images/1292831294796320768/6Q8j5vtW.jpg
25 de julio | Día del empleado municipal. https://t.co/gReaSA3q5I,https://twitter.com/i/web/status/1419357489011757057,25/07/2021 12:02:50,Twitter for Android,1,1,Ejército Guatemala,12:02:50,http://pbs.twimg.com/profile_images/1400165461548048384/3Vbvt8E2.jpg
