Contenido,IR,Fecha,Dispositivo,Likes,Retweets,Entidad,Hora,Foto
"¿Qué debe incluir una infancia normal? 

✅ Hacer amigos 
✅ Ir a la escuela 
❌ Sarampión, rubeola o poliomielitis… https://t.co/eeYT0vIh2E",https://twitter.com/i/web/status/1613189124588011526,11/01/2023 09:00:33,Twitter Media Studio,12,7,OPS/OMS,09:00:33,http://pbs.twimg.com/profile_images/1096094749902028801/ijbQWupW.png
"Cinco millones de niños y niñas murieron antes de cumplir cinco años y otros 2,1 millones de niños y jóvenes de ent… https://t.co/47NxQQdKES",https://twitter.com/i/web/status/1613257226180870144,11/01/2023 13:31:10,Twitter Web App,5,4,OPS/OMS,13:31:10,http://pbs.twimg.com/profile_images/1096094749902028801/ijbQWupW.png
"Hable con Pahola hoy para aprender más sobre los efectos que el alcohol tiene en usted, su familia y la sociedad. C… https://t.co/Brw2sG2yBi",https://twitter.com/i/web/status/1613566600409481217,12/01/2023 10:00:30,Twitter Media Studio,7,1,OPS/OMS,10:00:30,http://pbs.twimg.com/profile_images/1096094749902028801/ijbQWupW.png
"¿Sabías que la #influenza suele ser grave 😔 en los grupos más vulnerables, incluyendo en los niños 👧🏻🧑🏽‍🦱 menores d… https://t.co/f68JFkirkP",https://twitter.com/i/web/status/1613596671853592583,12/01/2023 12:00:00,Twitter Media Studio,7,2,OPS/OMS,12:00:00,http://pbs.twimg.com/profile_images/1096094749902028801/ijbQWupW.png
"#VideoNota | 📹 Hoy se llevó a cabo una reunión extraordinaria del CAP, tras la información emitida por la Casa Blan… https://t.co/IjfKABqSwX",https://twitter.com/i/web/status/1613660473932615687,12/01/2023 16:13:32,Twitter for iPhone,3,3,Migración Guatemala,16:13:32,http://pbs.twimg.com/profile_images/1602704855520497672/pgzuFmHY.jpg
"@Ferndando_13 Buenas noches, por este medio podemos apoyarlo.",https://twitter.com/i/web/status/1613698255325466624,12/01/2023 18:43:39,Twitter for iPhone,0,0,Migración Guatemala,18:43:39,http://pbs.twimg.com/profile_images/1602704855520497672/pgzuFmHY.jpg
#Información | @MigracionGuate brinda atención y asistencia a un adulto mayor extranjero en condición de calle. ➡️… https://t.co/ho6JNYHuaM,https://twitter.com/i/web/status/1613711815598346240,12/01/2023 19:37:32,Twitter for Android,2,1,Migración Guatemala,19:37:32,http://pbs.twimg.com/profile_images/1602704855520497672/pgzuFmHY.jpg
"@aleoquezada Buenas noches, le hemos escrito vía Direct.",https://twitter.com/i/web/status/1613712197548400641,12/01/2023 19:39:03,Twitter for iPhone,2,0,Migración Guatemala,19:39:03,http://pbs.twimg.com/profile_images/1602704855520497672/pgzuFmHY.jpg
"RT @EmbaGuate_Es: Hoy se celebró la presentación #FITUR2023, en la que #Guatemala 🇬🇹 será país socio a los medios de comunicación. Ha parti…",https://twitter.com/i/web/status/1613757943962374144,12/01/2023 22:40:50,Twitter for Android,0,13,MINEX Guatemala 🇬🇹,22:40:50,http://pbs.twimg.com/profile_images/1471828089491574785/eD5OEVK6.jpg
#InformeNacional https://t.co/yMdVOxPbIK,https://twitter.com/i/web/status/1613758105761841152,12/01/2023 22:41:29,Twitter for Android,4,2,MINEX Guatemala 🇬🇹,22:41:29,http://pbs.twimg.com/profile_images/1471828089491574785/eD5OEVK6.jpg
🇬🇹🤝🇸🇨 | Hoy se celebran 30 años de relaciones diplomáticas con #Seychelles. Guatemala reafirma el compromiso por es… https://t.co/F3EfBn7TiL,https://twitter.com/i/web/status/1613823301016555524,13/01/2023 03:00:33,Twitter Media Studio,6,4,MINEX Guatemala 🇬🇹,03:00:33,http://pbs.twimg.com/profile_images/1471828089491574785/eD5OEVK6.jpg
"#Arraigos | Si deseas consultar tu estatus migratorio, en el siguiente enlace puedes verificar 👉🏻… https://t.co/ctFg9zY5sc",https://twitter.com/i/web/status/1613894711458013184,13/01/2023 07:44:18,Twitter for iPhone,2,1,Migración Guatemala,07:44:18,http://pbs.twimg.com/profile_images/1602704855520497672/pgzuFmHY.jpg
"#GestiónMinfin | El ministro de Finanzas Públicas, Edwin Martínez, ofrece una entrevista a @Lared1061 📻 en la cual… https://t.co/IdosoHGmco",https://twitter.com/i/web/status/1613907772483203073,13/01/2023 08:36:12,Twitter Web App,3,2,Ministerio de Finanzas Públicas,08:36:12,http://pbs.twimg.com/profile_images/1471837102618853383/4xfotDwN.jpg
@Lared1061 @AGN_noticias @TGWdigital @DiariodeCA @GuatemalaGob @SCSPGT El saldo de caja para el ejercicio fiscal 20… https://t.co/scAMmN1XU4,https://twitter.com/i/web/status/1613909744262987776,13/01/2023 08:44:02,Twitter Web App,2,1,Ministerio de Finanzas Públicas,08:44:02,http://pbs.twimg.com/profile_images/1471837102618853383/4xfotDwN.jpg
"Ciencia 🧪 en 5 - Enfermedad respiratoria en niños

Estamos viendo un aumento de las enfermedades respiratorias entr… https://t.co/iOzVcZ8a8I",https://twitter.com/i/web/status/1613913893834817539,13/01/2023 09:00:32,Twitter Media Studio,16,10,OPS/OMS,09:00:32,http://pbs.twimg.com/profile_images/1096094749902028801/ijbQWupW.png
"Agrega que este saldo de caja, Q10 mil 104 millones ya están incluidos en el Presupuesto aprobado por el… https://t.co/Vwp7aQDX3B",https://twitter.com/i/web/status/1613917941577252865,13/01/2023 09:16:37,Twitter Web App,1,0,Ministerio de Finanzas Públicas,09:16:37,http://pbs.twimg.com/profile_images/1471837102618853383/4xfotDwN.jpg
"Finalmente, el Ministro de Finanzas Públicas indicó que este saldo de caja, es positivo para el país ✅, debido a qu… https://t.co/iwrC39Ly58",https://twitter.com/i/web/status/1613918739019272195,13/01/2023 09:19:47,Twitter Web App,1,0,Ministerio de Finanzas Públicas,09:19:47,http://pbs.twimg.com/profile_images/1471837102618853383/4xfotDwN.jpg
"#JornadaMóvil | 🤩 A partir del 16 al 20 de enero, podrás tramitar tu pasaporte en el Progreso Guastatoya. Se atende… https://t.co/hwbP6yUtE7",https://twitter.com/i/web/status/1613920248578846721,13/01/2023 09:25:47,Twitter for iPhone,2,1,Migración Guatemala,09:25:47,http://pbs.twimg.com/profile_images/1602704855520497672/pgzuFmHY.jpg
"La @PNCdeGuatemala en apoyo al @MPguatemala reporta el hallazgo de una subametralladora Uzi, municiones, chalecos t… https://t.co/Y8yqNLjerV",https://twitter.com/i/web/status/1613945599937712147,13/01/2023 11:06:31,Twitter Web App,10,3,MinGob,11:06:31,http://pbs.twimg.com/profile_images/1471828174598246407/Y1Lm5nFE.jpg
#Información | Retorna vía terrestre menor con alerta Alba Keneth activa. ➡️ https://t.co/XkvZMdZACn https://t.co/CAlXJRMnct,https://twitter.com/i/web/status/1613948832836128768,13/01/2023 11:19:22,Twitter for Android,1,2,Migración Guatemala,11:19:22,http://pbs.twimg.com/profile_images/1602704855520497672/pgzuFmHY.jpg
"La @PNCdeGuatemala en apoyo al @MPguatemala realiza 41 allanamientos, inspección, registro y secuestro de evidencia… https://t.co/IRIeDTB8MO",https://twitter.com/i/web/status/1613949483548643330,13/01/2023 11:21:57,Twitter Web App,1,1,MinGob,11:21:57,http://pbs.twimg.com/profile_images/1471828174598246407/Y1Lm5nFE.jpg
"#CancillerGT @MarioBucaroGT conversó con su homólogo de Kirguistán, Kulubaev Zheenbek Moldokanovich, con quien coin… https://t.co/pLO6FGq6ic",https://twitter.com/i/web/status/1613950225856757760,13/01/2023 11:24:54,Twitter Web App,8,3,MINEX Guatemala 🇬🇹,11:24:54,http://pbs.twimg.com/profile_images/1471828089491574785/eD5OEVK6.jpg
"Durante el 2023, personal de la Subdirección General de Análisis de Información Antinarcótica #SGAIA de la… https://t.co/U8tOZkU8AI",https://twitter.com/i/web/status/1613951093884739584,13/01/2023 11:28:21,Twitter Web App,9,4,Gobierno Guatemala,11:28:21,http://pbs.twimg.com/profile_images/1479793855331459074/NqurElHC.jpg
"¿Eres un adulto mayor 👩🏼‍🦳👴🏼? #Vacúnate 💙 contra la #influenza  

➡️ ¡Acércate al centro de salud más cercano cada… https://t.co/rQGkNPBhAQ",https://twitter.com/i/web/status/1613959187809042447,13/01/2023 12:00:30,Twitter Media Studio,4,3,OPS/OMS,12:00:30,http://pbs.twimg.com/profile_images/1096094749902028801/ijbQWupW.png
"#GestiónMinfin | El ministro de Finanzas Públicas, Edwin Martínez, recibió la visita de una misión del @BCIE_Org co… https://t.co/rKgCmozXKN",https://twitter.com/i/web/status/1613959488314441731,13/01/2023 12:01:42,Twitter Web App,3,0,Ministerio de Finanzas Públicas,12:01:42,http://pbs.twimg.com/profile_images/1471837102618853383/4xfotDwN.jpg
"Durante la reunión, el Gerente del Sector Público del @BCIE_Org, Manuel Torres, manifestó al ministro Martínez el a… https://t.co/EWwpIK2uxJ",https://twitter.com/i/web/status/1613959493011767296,13/01/2023 12:01:43,Twitter Web App,1,0,Ministerio de Finanzas Públicas,12:01:43,http://pbs.twimg.com/profile_images/1471837102618853383/4xfotDwN.jpg
"Por su parte, el Titular del #Minfin agradeció el acercamiento con el nuevo Oficial Jefe de País, a quien le dio la… https://t.co/xgk0wZ70Rc",https://twitter.com/i/web/status/1613959494492356619,13/01/2023 12:01:44,Twitter Web App,0,0,Ministerio de Finanzas Públicas,12:01:44,http://pbs.twimg.com/profile_images/1471837102618853383/4xfotDwN.jpg
La OPS ha desarrollado una plataforma digital para llevar los servicios de telesalud a poblaciones remotas de paíse… https://t.co/ohMxtn8vMg,https://twitter.com/i/web/status/1613966883333472259,13/01/2023 12:31:05,Twitter Web App,11,4,OPS/OMS,12:31:05,http://pbs.twimg.com/profile_images/1096094749902028801/ijbQWupW.png
#Información | Se activa alerta amarilla por posible movimiento masivo de personas migrantes. ➡️… https://t.co/4BDeV9gL8m,https://twitter.com/i/web/status/1613968947199475740,13/01/2023 12:39:17,Twitter for Android,2,2,Migración Guatemala,12:39:17,http://pbs.twimg.com/profile_images/1602704855520497672/pgzuFmHY.jpg
".@CafedeGuatemala dio a conocer que, durante la cosecha 2021-2022, las exportaciones de café superaron los 4.3 mill… https://t.co/SrDI0f1CHs",https://twitter.com/i/web/status/1613974161721786405,13/01/2023 13:00:01,Twitter Web App,5,4,Gobierno Guatemala,13:00:01,http://pbs.twimg.com/profile_images/1479793855331459074/NqurElHC.jpg
A la población en general se hace el llamado a denunciar el mal actuar de cualquier agente de la @PNCdeGuatemala. L… https://t.co/Gq0p7zPw24,https://twitter.com/i/web/status/1613975521616089088,13/01/2023 13:05:25,Twitter Media Studio,4,3,MinGob,13:05:25,http://pbs.twimg.com/profile_images/1471828174598246407/Y1Lm5nFE.jpg
203 M de personas no han recibido la vacuna contra la #COVID19 en la región de las Américas. Para alcanzar a los má… https://t.co/GdpeHoDuzv,https://twitter.com/i/web/status/1613981170491969537,13/01/2023 13:27:52,Twitter Web App,20,6,OPS/OMS,13:27:52,http://pbs.twimg.com/profile_images/1096094749902028801/ijbQWupW.png
"En Panamá 🇵🇦, refrigeradores de energía solar y cajas frías donadas por Canadá a través de OPS han facilitado la di… https://t.co/f01PwwrUgz",https://twitter.com/i/web/status/1613989084703363072,13/01/2023 13:59:18,Twitter Web App,3,1,OPS/OMS,13:59:18,http://pbs.twimg.com/profile_images/1096094749902028801/ijbQWupW.png
La OPS y Canadá han ayudado a 2⃣2⃣ países a fortalecer sus cadenas de frío para gestionar las vacunas #COVID19. En… https://t.co/jfc8lUnHc1,https://twitter.com/i/web/status/1613989082488573955,13/01/2023 13:59:18,Twitter Web App,3,0,OPS/OMS,13:59:18,http://pbs.twimg.com/profile_images/1096094749902028801/ijbQWupW.png
El @MINECOGT autorizó un contingente arancelario de 800 mil toneladas de maíz amarillo para fortalecer la seguridad… https://t.co/wQjZf96t9U,https://twitter.com/i/web/status/1613996934456348706,13/01/2023 14:30:30,Twitter Web App,3,2,Gobierno Guatemala,14:30:30,http://pbs.twimg.com/profile_images/1479793855331459074/NqurElHC.jpg
"El presidente @DrGiammattei supervisó el Hospital Nacional de Chimaltenango, construido con la cooperación de la Re… https://t.co/cdp93pAZpR",https://twitter.com/i/web/status/1613999312014397453,13/01/2023 14:39:57,Twitter Web App,13,8,Gobierno Guatemala,14:39:57,http://pbs.twimg.com/profile_images/1479793855331459074/NqurElHC.jpg
#Actualización| #MSPAS informa este 13 de enero de 2023 los casos confirmados por laboratorio en el tablero Situaci… https://t.co/GZDEGvBxhq,https://twitter.com/i/web/status/1614004908331618307,13/01/2023 15:02:11,Twitter for iPhone,3,0,Ministerio de Salud Pública,15:02:11,http://pbs.twimg.com/profile_images/1471842908043190279/bu1LHFWL.jpg
⚠️ En el tablero COVID-19 los fallecidos reportados el día anterior se visualizan por la fecha de defunción. Estos… https://t.co/fmkVUlMp5f,https://twitter.com/i/web/status/1614004912089714695,13/01/2023 15:02:12,Twitter for iPhone,0,0,Ministerio de Salud Pública,15:02:12,http://pbs.twimg.com/profile_images/1471842908043190279/bu1LHFWL.jpg
El #MSPAS informa la cantidad de personas que han recibido la primera dosis y el esquema completo de la vacuna cont… https://t.co/0OnAA5Fmr4,https://twitter.com/i/web/status/1614005203925192715,13/01/2023 15:03:22,Twitter for iPhone,2,0,Ministerio de Salud Pública,15:03:22,http://pbs.twimg.com/profile_images/1471842908043190279/bu1LHFWL.jpg
#NoticiasMSPAS | Vacunas COVID-19 disponibles para niños y niñas. Conozca toda la información en la siguiente nota:… https://t.co/usAiIiS2Ay,https://twitter.com/i/web/status/1614007871523495940,13/01/2023 15:13:58,"<a href=""https://www.socialgest.net"" rel=""nofollow"">SocialGest",0,0,Ministerio de Salud Pública,15:13:58,http://pbs.twimg.com/profile_images/1471842908043190279/bu1LHFWL.jpg
#VideoNota | 📹 Se convocó a una mesa de seguridad para abordar el tema migratorio de manera integral. https://t.co/99uwpvHfVM,https://twitter.com/i/web/status/1614013570983002112,13/01/2023 15:36:36,Twitter for iPhone,0,0,Migración Guatemala,15:36:36,http://pbs.twimg.com/profile_images/1602704855520497672/pgzuFmHY.jpg
#EnDirecto | El presidente @DrGiammattei participa en el 64 Aniversario de la Marina Nacional. https://t.co/hx6PzMwA2d,https://twitter.com/i/web/status/1614020040155713548,13/01/2023 16:02:19,"<a href=""https://periscope.tv"" rel=""nofollow"">Periscope",32,11,Gobierno Guatemala,16:02:19,http://pbs.twimg.com/profile_images/1479793855331459074/NqurElHC.jpg
"Mañana el Presidente @DrGiammattei realizará la presentación del #TercerInformeGT, en el cual se compartirán los re… https://t.co/317D2eNISj",https://twitter.com/i/web/status/1614020744710705158,13/01/2023 16:05:07,Twitter Web App,3,1,MinGob,16:05:07,http://pbs.twimg.com/profile_images/1471828174598246407/Y1Lm5nFE.jpg
"#CancillerGT @MarioBucaroGT conversó con su homólogo brasileño, Mauro Vieira, para hacer votos por una excelente ge… https://t.co/KlPcLGyvbu",https://twitter.com/i/web/status/1614021321142292504,13/01/2023 16:07:24,Twitter Web App,20,5,MINEX Guatemala 🇬🇹,16:07:24,http://pbs.twimg.com/profile_images/1471828089491574785/eD5OEVK6.jpg
Ambos Cancilleres sostuvieron un fructífero diálogo. 🇬🇹 y 🇧🇷 tienen una notable relación político-diplomática y una… https://t.co/MszOU3uM71,https://twitter.com/i/web/status/1614021323986186240,13/01/2023 16:07:25,Twitter Web App,2,1,MINEX Guatemala 🇬🇹,16:07:25,http://pbs.twimg.com/profile_images/1471828089491574785/eD5OEVK6.jpg
"¡Viento en popa y buena mar!

Felicidades en su 64 Aniversario a los hombres y mujeres que conforman la… https://t.co/NiJLACeeXZ",https://twitter.com/i/web/status/1614032532219039744,13/01/2023 16:51:57,Twitter for Android,27,5,Ejército Guatemala,16:51:57,http://pbs.twimg.com/profile_images/1471838829430640640/0yNoNrwr.jpg
"El Ministro de Gobernación, @NapoleonBG_, junto con los Viceministros, Cúpula Policial, Jefes de Unidades y Depende… https://t.co/PFLF3809cA",https://twitter.com/i/web/status/1614034735994470400,13/01/2023 17:00:43,Twitter Web App,11,2,MinGob,17:00:43,http://pbs.twimg.com/profile_images/1471828174598246407/Y1Lm5nFE.jpg
#MSPAS | La devoción al Cristo Negro de Esquipulas es una de las fiestas católicas cuyas raíces se remontan desde e… https://t.co/jTH21UhN96,https://twitter.com/i/web/status/1614034750506680320,13/01/2023 17:00:46,"<a href=""https://www.socialgest.net"" rel=""nofollow"">SocialGest",8,2,Ministerio de Salud Pública,17:00:46,http://pbs.twimg.com/profile_images/1471842908043190279/bu1LHFWL.jpg
"Ceremonial marítimo con motivo del 64 Aniversario de la Marina de la Defensa Nacional.

 🔴Transmisión en vivo 
⬇️… https://t.co/W0qDZSEaap",https://twitter.com/i/web/status/1614035876362817536,13/01/2023 17:05:14,Twitter for Android,5,1,Ejército Guatemala,17:05:14,http://pbs.twimg.com/profile_images/1471838829430640640/0yNoNrwr.jpg
"El Titular de la Cartera, @NapoleonBG_, instó en dicha reunión a fortalecer al personal que labora en el #Mingob pa… https://t.co/BuhMi4h0hc",https://twitter.com/i/web/status/1614036080897966080,13/01/2023 17:06:03,Twitter Web App,1,1,MinGob,17:06:03,http://pbs.twimg.com/profile_images/1471828174598246407/Y1Lm5nFE.jpg
#NoticiasMSPAS | Cuide su piel ante las bajas temperaturas. Lea más aquí: https://t.co/1DCh67YqqG https://t.co/WQp6sXyZXd,https://twitter.com/i/web/status/1614041155934511111,13/01/2023 17:26:13,Twitter Web App,0,0,Ministerio de Salud Pública,17:26:13,http://pbs.twimg.com/profile_images/1471842908043190279/bu1LHFWL.jpg
Guatemala se posiciona como uno de los diez países de Latinoamérica y el Caribe en tener una macroeconomía estable.… https://t.co/izpfVM4Z5x,https://twitter.com/i/web/status/1614042234143363073,13/01/2023 17:30:30,Twitter Web App,1,2,Gobierno Guatemala,17:30:30,http://pbs.twimg.com/profile_images/1479793855331459074/NqurElHC.jpg
"#MSPAS | Que la prevención sea parte de tus metas, vacúnate contra COVID-19. Encuentra tu puesto de vacunación más… https://t.co/UXCiDJDFTI",https://twitter.com/i/web/status/1614042276300210179,13/01/2023 17:30:40,"<a href=""https://www.socialgest.net"" rel=""nofollow"">SocialGest",1,0,Ministerio de Salud Pública,17:30:40,http://pbs.twimg.com/profile_images/1471842908043190279/bu1LHFWL.jpg
"Concierto de Música Sacra por la Banda Sinfónica Marcial del Servicio de Músicas Militares del #EjércitoGT.

🗓 15 d… https://t.co/5Nav29f8rx",https://twitter.com/i/web/status/1614046738381168640,13/01/2023 17:48:24,Twitter for Android,10,1,Ejército Guatemala,17:48:24,http://pbs.twimg.com/profile_images/1471838829430640640/0yNoNrwr.jpg
"¡Buenas tardes Guatemala! 🇬🇹

Soldados de la Marina de la Defensa Nacional del #EjércitoGT | #MINDEF te saludan. https://t.co/voJf8eKH6I",https://twitter.com/i/web/status/1614051359283617796,13/01/2023 18:06:46,Twitter for Android,20,1,Ejército Guatemala,18:06:46,http://pbs.twimg.com/profile_images/1471838829430640640/0yNoNrwr.jpg
"#EjércitoGT realiza operaciones conjuntas en apoyo a la @PNCdeGuatemala, para la búsqueda de delincuentes que han e… https://t.co/il40eNuWqa",https://twitter.com/i/web/status/1614053125572141056,13/01/2023 18:13:47,Twitter for Android,4,0,Ejército Guatemala,18:13:47,http://pbs.twimg.com/profile_images/1471838829430640640/0yNoNrwr.jpg
#Extranjería | 🤩 Te compartimos los pasos para realizar tus pagos de extranjería desde cualquier dispositovo móvil. https://t.co/Ph54MohH4l,https://twitter.com/i/web/status/1614053375712149505,13/01/2023 18:14:47,Twitter for iPhone,1,0,Migración Guatemala,18:14:47,http://pbs.twimg.com/profile_images/1602704855520497672/pgzuFmHY.jpg
"#JuntosVamosPorMás | El Programa de Movilidad Laboral del @MINTRABAJOGuate, ha permitido la construcción de muros d… https://t.co/ZJOoAy3Zkr",https://twitter.com/i/web/status/1614057208244850694,13/01/2023 18:30:00,Twitter Media Studio,6,4,Gobierno Guatemala,18:30:00,http://pbs.twimg.com/profile_images/1479793855331459074/NqurElHC.jpg
"Sintoniza este sábado 14 de enero, a las 17:00 horas, la presentación del #TercerInformeGT, en la que se compartirá… https://t.co/bfnMdApAkO",https://twitter.com/i/web/status/1614062163529969664,13/01/2023 18:49:42,Twitter for Android,0,0,Ministerio de Finanzas Públicas,18:49:42,http://pbs.twimg.com/profile_images/1471837102618853383/4xfotDwN.jpg
"Realice la compra de un vehículo en establecimientos concurridos, de lo contrario tome en cuenta las recomendacione… https://t.co/YuUpFN9vBS",https://twitter.com/i/web/status/1614064888179036160,13/01/2023 19:00:31,Twitter Media Studio,3,2,MinGob,19:00:31,http://pbs.twimg.com/profile_images/1471828174598246407/Y1Lm5nFE.jpg
"Alto Mando del #EjérctoGT participó en los actos del 64 Aniversario de la Marina de la Defensa Nacional, llevados a… https://t.co/lkEnxcZESG",https://twitter.com/i/web/status/1614065842269872133,13/01/2023 19:04:19,Twitter for Android,7,0,Ejército Guatemala,19:04:19,http://pbs.twimg.com/profile_images/1471838829430640640/0yNoNrwr.jpg
#EjércitoGT a través de la Brigada de Operaciones para Montaña realizó patrullajes en el departamento de #SanMarcos… https://t.co/4ZBAQ9XQ2R,https://twitter.com/i/web/status/1614066763150561283,13/01/2023 19:07:58,Twitter for Android,12,1,Ejército Guatemala,19:07:58,http://pbs.twimg.com/profile_images/1471838829430640640/0yNoNrwr.jpg
"#EjércitoGT a través de la Brigada Militar ""Mariscal Zavala"", en coordinación con @MinSaludGuate, continúa apoyando… https://t.co/paIgO42Sqm",https://twitter.com/i/web/status/1614067131695366144,13/01/2023 19:09:26,Twitter for Android,1,0,Ejército Guatemala,19:09:26,http://pbs.twimg.com/profile_images/1471838829430640640/0yNoNrwr.jpg
[#𝗩𝗶𝗱𝗲𝗼] 📹 Gobernación enfoca su plan 2023 en la prevención del delito e incremento de capacidades operativas. https://t.co/2CnuSj5UKK,https://twitter.com/i/web/status/1614067523514957824,13/01/2023 19:11:00,Twitter for iPhone,4,2,MinGob,19:11:00,http://pbs.twimg.com/profile_images/1471828174598246407/Y1Lm5nFE.jpg
"#ViceCancillerGT #GeovaniCastillo realizó la V reunión con Líderes Migrantes en EEUU, la cual tuvo como invitado es… https://t.co/PTCs0awF2d",https://twitter.com/i/web/status/1614067653764681729,13/01/2023 19:11:31,Twitter for Android,14,5,MINEX Guatemala 🇬🇹,19:11:31,http://pbs.twimg.com/profile_images/1471828089491574785/eD5OEVK6.jpg
Personal de la @SecretariaSESAN visitó diversos departamentos del país como parte del Programa de Alimento Compleme… https://t.co/oic1UL5kiy,https://twitter.com/i/web/status/1614072431630483457,13/01/2023 19:30:30,Twitter Web App,4,2,Gobierno Guatemala,19:30:30,http://pbs.twimg.com/profile_images/1479793855331459074/NqurElHC.jpg
"#MSPAS | ¡Compañero salubrista, gracias por tu esfuerzo y dedicación! 🤩💯 Recuerda completar tu esquema de vacunació… https://t.co/mu0WADoAF0",https://twitter.com/i/web/status/1614079960024580096,13/01/2023 20:00:25,"<a href=""https://www.socialgest.net"" rel=""nofollow"">SocialGest",1,1,Ministerio de Salud Pública,20:00:25,http://pbs.twimg.com/profile_images/1471842908043190279/bu1LHFWL.jpg
"En la conmemoración del 64 Aniversario de la Marina de la Defensa Nacional, el presidente @DrGiammattei destacó el… https://t.co/8ClkP1EgtU",https://twitter.com/i/web/status/1614082457770369027,13/01/2023 20:10:20,Twitter for iPhone,6,2,Gobierno Guatemala,20:10:20,http://pbs.twimg.com/profile_images/1479793855331459074/NqurElHC.jpg
"RT @GuatemalaGob: #JuntosVamosPorMás | El Programa de Movilidad Laboral del @MINTRABAJOGuate, ha permitido la construcción de muros de pros…",https://twitter.com/i/web/status/1614109610247442433,13/01/2023 21:58:14,Twitter for Android,0,4,Ministerio de Finanzas Públicas,21:58:14,http://pbs.twimg.com/profile_images/1471837102618853383/4xfotDwN.jpg
"#InformeNacional | 13 de enero de 2023

✔️ Presidente @DrGiammattei supervisa Hospital de Chimaltenango

✔️ Conmemo… https://t.co/T42BSJDDnk",https://twitter.com/i/web/status/1614114523861946370,13/01/2023 22:17:45,Twitter Web App,11,7,Gobierno Guatemala,22:17:45,http://pbs.twimg.com/profile_images/1479793855331459074/NqurElHC.jpg
"RT @GuatemalaGob: #InformeNacional | 13 de enero de 2023

✔️ Presidente @DrGiammattei supervisa Hospital de Chimaltenango

✔️ Conmemoración…",https://twitter.com/i/web/status/1614116133556178944,13/01/2023 22:24:09,Twitter for Android,0,7,Ministerio de Finanzas Públicas,22:24:09,http://pbs.twimg.com/profile_images/1471837102618853383/4xfotDwN.jpg
"El Titular de la Cartera del Interior, @NapoleonBG_ comentó que se incrementarán las capacidades operativas en las… https://t.co/tjs2tggtkg",https://twitter.com/i/web/status/1614119975324721152,13/01/2023 22:39:25,TweetDeck,0,0,MinGob,22:39:25,http://pbs.twimg.com/profile_images/1471828174598246407/Y1Lm5nFE.jpg
#InformeNacional https://t.co/1PUr2YfW7l,https://twitter.com/i/web/status/1614121340293767168,13/01/2023 22:44:51,Twitter for Android,1,0,MINEX Guatemala 🇬🇹,22:44:51,http://pbs.twimg.com/profile_images/1471828089491574785/eD5OEVK6.jpg
"RT @GuatemalaGob: #InformeNacional | 13 de enero de 2023

✔️ Presidente @DrGiammattei supervisa Hospital de Chimaltenango

✔️ Conmemoración…",https://twitter.com/i/web/status/1614122535871811585,13/01/2023 22:49:36,Twitter for iPhone,0,7,MinGob,22:49:36,http://pbs.twimg.com/profile_images/1471828174598246407/Y1Lm5nFE.jpg
#NotaDeDuelo | #EjércitoGT | #MINDEF lamenta el trágico fallecimiento del Soldado de Segunda Especialista César Ger… https://t.co/rRzpjHOx5I,https://twitter.com/i/web/status/1614127824754941954,13/01/2023 23:10:37,Twitter for Android,4,0,Ejército Guatemala,23:10:37,http://pbs.twimg.com/profile_images/1471838829430640640/0yNoNrwr.jpg
#InformeNacional | Viernes 13 de enero de 2023. https://t.co/PXoN9b5LkY,https://twitter.com/i/web/status/1614134385996926978,13/01/2023 23:36:41,Twitter for iPhone,0,0,Ministerio de Salud Pública,23:36:41,http://pbs.twimg.com/profile_images/1471842908043190279/bu1LHFWL.jpg
