Contenido,IR,Fecha,Dispositivo,Likes,Retweets,Entidad,Hora,Foto
#ModernizaciónDelEstado | La Ley para la Simplificación de Trámites es una herramienta más para posicionar a… https://t.co/qp8a75wGvT,https://twitter.com/i/web/status/1395009902192599049,19/05/2021 07:34:13,Twitter Web App,3,2,Ministerio de Finanzas Guatemala,07:34:13,http://pbs.twimg.com/profile_images/1292831294796320768/6Q8j5vtW.jpg
"RT @DiariodeCA: @alvarogricci, titular del @MinfinGT, sostuvo una reunión de trabajo con representantes del @el_BID quienes, debido a la po…",https://twitter.com/i/web/status/1395067655216934920,19/05/2021 11:23:42,Twitter Web App,0,2,Ministerio de Finanzas Guatemala,11:23:42,http://pbs.twimg.com/profile_images/1292831294796320768/6Q8j5vtW.jpg
#ControlYRecaudación | En el #MinfinGT impulsamos acciones estratégicas para aumentar los ingresos tributarios y co… https://t.co/Fnfn3AMs2O,https://twitter.com/i/web/status/1395108612574519298,19/05/2021 14:06:27,Twitter Web App,3,2,Ministerio de Finanzas Guatemala,14:06:27,http://pbs.twimg.com/profile_images/1292831294796320768/6Q8j5vtW.jpg
"RT @DiariodeCA: #EconómicasDCA El @EIB actualmente ejecuta acciones para transformarse en Banco por el Clima, y prioriza los sectores de: e…",https://twitter.com/i/web/status/1395154737947889670,19/05/2021 17:09:44,Twitter for Android,0,2,Ministerio de Finanzas Guatemala,17:09:44,http://pbs.twimg.com/profile_images/1292831294796320768/6Q8j5vtW.jpg
#GestiónMinfin | El Ministerio de Finanzas ha implementado acciones que contribuyen a mejorar los indicadores en el… https://t.co/kSsXEMbo1F,https://twitter.com/i/web/status/1395210450665607171,19/05/2021 20:51:07,Twitter for Android,3,1,Ministerio de Finanzas Guatemala,20:51:07,http://pbs.twimg.com/profile_images/1292831294796320768/6Q8j5vtW.jpg
"#IGM | ¡Migración Segura! Promovemos una migración regular y ordenada, respetando las leyes migratorias vigentes en… https://t.co/vUcqjsG2R4",https://twitter.com/i/web/status/1395379022209683456,20/05/2021 08:00:58,Hootsuite Inc.,0,0,Migración Guatemala,08:00:58,http://pbs.twimg.com/profile_images/1346129009051054081/v9JUwo36.jpg
#ControlYRecaudación | Los Puestos de Control Interinstitucional #PCI tienen como objetivo aumentar los ingresos tr… https://t.co/GO0gHngOQG,https://twitter.com/i/web/status/1395387270379843586,20/05/2021 08:33:44,Twitter Web App,4,1,Ministerio de Finanzas Guatemala,08:33:44,http://pbs.twimg.com/profile_images/1292831294796320768/6Q8j5vtW.jpg
#Pasaportes | ¡La cita para el pasaporte No tiene costo! Se realiza en https://t.co/4Gtec7fyKe https://t.co/FeISIZJKHP,https://twitter.com/i/web/status/1395393951453093889,20/05/2021 09:00:17,Hootsuite Inc.,1,0,Migración Guatemala,09:00:17,http://pbs.twimg.com/profile_images/1346129009051054081/v9JUwo36.jpg
"El bello quetzal adorna ahora uno de los Airbus A320neo✈️de la aerolínea @FlyFrontier, que en abril comenzó a opera… https://t.co/gsuCUg91Hg",https://twitter.com/i/web/status/1395410515581669382,20/05/2021 10:06:07,Twitter for Android,47,17,MINEX Guatemala 🇬🇹,10:06:07,http://pbs.twimg.com/profile_images/1292832595093475329/6LQbTy36.jpg
"RT @AGN_noticias: Con el objetivo de reactivar la economía guatemalteca, generando nuevas inversiones y fuentes de empleo, el 
@MINECOGT ha…",https://twitter.com/i/web/status/1395430066784555016,20/05/2021 11:23:48,Twitter Web App,0,4,MINEX Guatemala 🇬🇹,11:23:48,http://pbs.twimg.com/profile_images/1292832595093475329/6LQbTy36.jpg
#RecorridoFronterizo2021 | Como parte importante de la agenda de trabajo el #CancillerGT @PedroBroloGT se reunió co… https://t.co/eetq7tGy81,https://twitter.com/i/web/status/1395435384503422977,20/05/2021 11:44:56,Twitter Web App,3,2,MINEX Guatemala 🇬🇹,11:44:56,http://pbs.twimg.com/profile_images/1292832595093475329/6LQbTy36.jpg
"#Pasaportes | 🛫 Recomendamos verificar la fecha de vencimiento del pasaporte, previo a realizar la compra de boleto… https://t.co/xHDonafNbq",https://twitter.com/i/web/status/1395439278486953993,20/05/2021 12:00:24,Hootsuite Inc.,4,1,Migración Guatemala,12:00:24,http://pbs.twimg.com/profile_images/1346129009051054081/v9JUwo36.jpg
"#RecorridoFronterizo2021 Hoy el #CancillerGT @PedroBroloGT visitó albergue de Caridades Católicas (@CCharitiesRGV),… https://t.co/n6Un57EF5v",https://twitter.com/i/web/status/1395450662545203200,20/05/2021 12:45:38,Twitter Web App,5,10,MINEX Guatemala 🇬🇹,12:45:38,http://pbs.twimg.com/profile_images/1292832595093475329/6LQbTy36.jpg
El #CancillerGT tuvo la oportunidad de verificar las condiciones de los connacionales y el seguimiento de los proce… https://t.co/Z1xaihiChH,https://twitter.com/i/web/status/1395451240671322117,20/05/2021 12:47:56,Twitter Web App,3,4,MINEX Guatemala 🇬🇹,12:47:56,http://pbs.twimg.com/profile_images/1292832595093475329/6LQbTy36.jpg
"#SemanaDeLasTelecomunicaciones🇬🇹 

¿Quieres aprender sobre la industria inteligente? No te pierdas este webinar 

🗓… https://t.co/uQQppopcP1",https://twitter.com/i/web/status/1395469379995721731,20/05/2021 14:00:01,Twitter Media Studio,2,0,Gobierno Guatemala,14:00:01,http://pbs.twimg.com/profile_images/1371488309743120384/QqlgsWUm.jpg
"𝗔𝗿𝘁𝗲𝘀𝗮𝗻𝗼𝘀 𝗴𝘂𝗮𝘁𝗲𝗺𝗮𝗹𝘁𝗲𝗰𝗼𝘀 𝘀𝗲𝗿𝗮́𝗻 𝗽𝗿𝗲𝗺𝗶𝗮𝗱𝗼𝘀 𝗰𝗼𝗻 𝗨𝗦$𝟱 𝗺𝗶𝗹 

¿Deseas participar? 🤷‍♂️🤷‍♀️ 

Encuentra más información en… https://t.co/aUQnt07WAI",https://twitter.com/i/web/status/1395469628378337285,20/05/2021 14:01:00,Twitter Web App,4,2,Gobierno Guatemala,14:01:00,http://pbs.twimg.com/profile_images/1371488309743120384/QqlgsWUm.jpg
"#ReactivaciónEconómica | Las acciones que el Gobierno del Presidente @DrGiammattei ha realizado, permiten mejorar l… https://t.co/akqcnXZvl3",https://twitter.com/i/web/status/1395475080180903941,20/05/2021 14:22:40,Twitter Web App,9,2,Ministerio de Finanzas Guatemala,14:22:40,http://pbs.twimg.com/profile_images/1292831294796320768/6Q8j5vtW.jpg
#UniónAduanera | Guatemala y Honduras modernizan infraestructura fronteriza 🇬🇹🤝🇭🇳 https://t.co/nAOhooNZ4m https://t.co/Egp6KTDleI,https://twitter.com/i/web/status/1395480303079153666,20/05/2021 14:43:25,Twitter Web App,16,5,Gobierno Guatemala,14:43:25,http://pbs.twimg.com/profile_images/1371488309743120384/QqlgsWUm.jpg
"En el segundo día de su gira por Texas, EE.UU. el #CancillerGT @PedroBroloGT inició recorrido por la ciudad de… https://t.co/P9ztIUlJSj",https://twitter.com/i/web/status/1395497587130707973,20/05/2021 15:52:06,Twitter Web App,5,6,MINEX Guatemala 🇬🇹,15:52:06,http://pbs.twimg.com/profile_images/1292832595093475329/6LQbTy36.jpg
Guatemala recibe segundo lote de vacunas Sputnik V  #VacunaCovidGT 💉 https://t.co/Bg7mQ1Q5ZX https://t.co/pOpIAwrpfq,https://twitter.com/i/web/status/1395501627424088069,20/05/2021 16:08:09,Twitter Web App,80,15,Gobierno Guatemala,16:08:09,http://pbs.twimg.com/profile_images/1371488309743120384/QqlgsWUm.jpg
"El segundo lote de 50 mil dosis de vacunas #SputnikV, ingresan al Centro Nacional de Biológicos del Ministerio de S… https://t.co/zSdfnGUr4r",https://twitter.com/i/web/status/1395505528370077697,20/05/2021 16:23:39,Twitter for Android,31,7,Ministerio de Salud Pública,16:23:39,http://pbs.twimg.com/profile_images/1311755159027015685/QQcxgYd1.jpg
"RT @marngt: Con 100 mil árboles será reforestada la cuenca del río #Ocosito, un plan integral con el objetivo de proteger los ecosistemas q…",https://twitter.com/i/web/status/1395509596643631106,20/05/2021 16:39:49,Twitter Web App,0,4,Gobierno Guatemala,16:39:49,http://pbs.twimg.com/profile_images/1371488309743120384/QqlgsWUm.jpg
"#NoticiasMSPAS | Ingresa a Guatemala el segundo lote de vacunas #SputnikV

Más información 👉🏻… https://t.co/ItfOTMLQGJ",https://twitter.com/i/web/status/1395514675194892293,20/05/2021 17:00:00,Twitter Web App,10,2,Ministerio de Salud Pública,17:00:00,http://pbs.twimg.com/profile_images/1311755159027015685/QQcxgYd1.jpg
"RT @McdGuate: Ministro de Cultura y Deportes, Felipe Aguilar, y Hugo Guevara, Director de @StateINL, firman convenio de apoyo para la ejecu…",https://twitter.com/i/web/status/1395538688558440454,20/05/2021 18:35:25,Twitter for iPhone,0,28,Gobierno Guatemala,18:35:25,http://pbs.twimg.com/profile_images/1371488309743120384/QqlgsWUm.jpg
"#Información | En Oficinas Centrales, estamos atendiendo en horario de 7:00 a 15:00 horas de lunes a viernes. https://t.co/MwKdr4Djzh",https://twitter.com/i/web/status/1395559994335154177,20/05/2021 20:00:05,Hootsuite Inc.,1,0,Migración Guatemala,20:00:05,http://pbs.twimg.com/profile_images/1346129009051054081/v9JUwo36.jpg
Actualización| #MSPAS informa este 20 de mayo de 2021 los casos confirmados por laboratorio en el tablero Situación… https://t.co/CaKUqIQtN5,https://twitter.com/i/web/status/1395560377170206720,20/05/2021 20:01:36,Twitter for Android,11,1,Ministerio de Salud Pública,20:01:36,http://pbs.twimg.com/profile_images/1311755159027015685/QQcxgYd1.jpg
⚠️ En el tablero COVID-19 los fallecidos reportados el día anterior se visualizan por la fecha de defunción. Estos… https://t.co/LJSFaWJo5d,https://twitter.com/i/web/status/1395560378856361992,20/05/2021 20:01:37,Twitter for Android,0,0,Ministerio de Salud Pública,20:01:37,http://pbs.twimg.com/profile_images/1311755159027015685/QQcxgYd1.jpg
El #MSPAS informa la cantidad de personas que han recibido la primera dosis y el esquema completo de la vacuna cont… https://t.co/H9jfxcj6mQ,https://twitter.com/i/web/status/1395560734277390338,20/05/2021 20:03:01,Twitter for Android,8,1,Ministerio de Salud Pública,20:03:01,http://pbs.twimg.com/profile_images/1311755159027015685/QQcxgYd1.jpg
"Como parte de su gira de trabajo por Texas, el #CancillerGT @PedroBroloGT visitó a las dos niñas guatemaltecas que… https://t.co/FwIjGqbb11",https://twitter.com/i/web/status/1395579067571785728,20/05/2021 21:15:52,Twitter for Android,1,3,MINEX Guatemala 🇬🇹,21:15:52,http://pbs.twimg.com/profile_images/1292832595093475329/6LQbTy36.jpg
#InformeNacional | Este jueves ingresó a Guatemala el segundo lote de 50 mil dosis de la vacuna Sputnik V. ▶️… https://t.co/j34u9vmufT,https://twitter.com/i/web/status/1395588862135750663,20/05/2021 21:54:48,Twitter Web App,7,1,Gobierno Guatemala,21:54:48,http://pbs.twimg.com/profile_images/1371488309743120384/QqlgsWUm.jpg
"#LosMásBuscados 🔎 

Mediante un trabajo de inteligencia la @PNCdeGuatemala, capturó a Vanessa Adali Ruíz Juárez, al… https://t.co/SuoFAOROQ9",https://twitter.com/i/web/status/1395706237514354689,21/05/2021 05:41:12,Twitter for iPhone,33,7,Gobierno Guatemala,05:41:12,http://pbs.twimg.com/profile_images/1371488309743120384/QqlgsWUm.jpg
#IGM | ¡Profesionalismo! Cada trámite es atendido con honradez y eficiencia. https://t.co/YpNeeE0DVe,https://twitter.com/i/web/status/1395726241576128514,21/05/2021 07:00:41,Hootsuite Inc.,1,0,Migración Guatemala,07:00:41,http://pbs.twimg.com/profile_images/1346129009051054081/v9JUwo36.jpg
"#SemanaDeLasTelecomunicaciones🇬🇹 

¿Te gusta el arte y el mundo digital? No te pierdas este webinar 🎨🎭🩰

🗓 21 de ma… https://t.co/t9g4fgYwzj",https://twitter.com/i/web/status/1395737257877835776,21/05/2021 07:44:28,Twitter for iPhone,3,3,Gobierno Guatemala,07:44:28,http://pbs.twimg.com/profile_images/1371488309743120384/QqlgsWUm.jpg
"#Pasaportes | El pasaporte guatemalteco cuenta con más de 30 medidas de seguridad, cumpliendo con la regulación int… https://t.co/4hisq6YTWu",https://twitter.com/i/web/status/1395741457819082752,21/05/2021 08:01:09,Hootsuite Inc.,1,0,Migración Guatemala,08:01:09,http://pbs.twimg.com/profile_images/1346129009051054081/v9JUwo36.jpg
"#GestiónMinfin | Autoridades de las 11 instituciones que conforman el #CentroCívicoGT, se reúnen en el #MinfinGT pa… https://t.co/Bsnn5z74FM",https://twitter.com/i/web/status/1395743356622413828,21/05/2021 08:08:42,Twitter for Android,6,0,Ministerio de Finanzas Guatemala,08:08:42,http://pbs.twimg.com/profile_images/1292831294796320768/6Q8j5vtW.jpg
"En la reunión participan: el Ministro de Finanzas @alvarogricci y autoridades de:
@OJGuatemala
@muniguate… https://t.co/pQcy171CtX",https://twitter.com/i/web/status/1395743363744374787,21/05/2021 08:08:44,Twitter for Android,3,1,Ministerio de Finanzas Guatemala,08:08:44,http://pbs.twimg.com/profile_images/1292831294796320768/6Q8j5vtW.jpg
"#CentroCívicoGT | Los proyectos, enmarcados en el año del #BicentenarioGuatemala, se presentan según las mesas de t… https://t.co/zGXibj5x9p",https://twitter.com/i/web/status/1395744076721496068,21/05/2021 08:11:34,Twitter for Android,1,0,Ministerio de Finanzas Guatemala,08:11:34,http://pbs.twimg.com/profile_images/1292831294796320768/6Q8j5vtW.jpg
"21 de mayo, Día del Químico Biólogo 🧪🧬🔬

Gracias por su esfuerzo y profesionalismo al desempeñar esta labor con com… https://t.co/o6fhEBwNub",https://twitter.com/i/web/status/1395748797700005889,21/05/2021 08:30:19,Twitter for Android,4,1,Ministerio de Salud Pública,08:30:19,http://pbs.twimg.com/profile_images/1311755159027015685/QQcxgYd1.jpg
"RT @OPSOMSMexico: 🔔 La Dra. Carissa Etienne, Directora de la OPS, dijo Sí con su firma de la Carta Abierta 📖 #CallesParaLaVida: Un llamado…",https://twitter.com/i/web/status/1395755602387812352,21/05/2021 08:57:22,Twitter for iPhone,0,2,OPS/OMS,08:57:22,http://pbs.twimg.com/profile_images/1096094749902028801/ijbQWupW.png
"RT @opsargentina: Si tenés #COVID19 podés continuar la lactancia. 

Conocé los cuidados básicos para cuidarte a vos y a tu bebé.

Semana Mu…",https://twitter.com/i/web/status/1395755629436940296,21/05/2021 08:57:28,Twitter for iPhone,0,4,OPS/OMS,08:57:28,http://pbs.twimg.com/profile_images/1096094749902028801/ijbQWupW.png
"RT @OPASOMSBrasil: Ame seu coração ❤️ Peça ao médico(a) para aferir sua #pressãoarterial regularmente.

#ConheçaSeusNúmeros #HEARTSAméricas…",https://twitter.com/i/web/status/1395755693878169605,21/05/2021 08:57:43,Twitter for iPhone,0,4,OPS/OMS,08:57:43,http://pbs.twimg.com/profile_images/1096094749902028801/ijbQWupW.png
RT @OPSOMSMexico: 🔔 Participa en las acciones que llevamos a cabo en la actualización ✍ e implementación de los lineamientos nacionales 📒 p…,https://twitter.com/i/web/status/1395755720063295488,21/05/2021 08:57:50,Twitter for iPhone,0,1,OPS/OMS,08:57:50,http://pbs.twimg.com/profile_images/1096094749902028801/ijbQWupW.png
"RT @bireme: Webinar EIH/CLAP/OPS/OMS
Protegiendo los logros regionales en salud neonatal después de la COVID-19
1 de junio 11:30 am - 1:00…",https://twitter.com/i/web/status/1395755765936312324,21/05/2021 08:58:01,Twitter for iPhone,0,3,OPS/OMS,08:58:01,http://pbs.twimg.com/profile_images/1096094749902028801/ijbQWupW.png
"RT @opscuba: La Directora de OPS, Carissa F. Etienne, llamó a cerrar brechas en el acceso a las vacunas contra la #COVID19 en América Latin…",https://twitter.com/i/web/status/1395755780788400129,21/05/2021 08:58:04,Twitter for iPhone,0,5,OPS/OMS,08:58:04,http://pbs.twimg.com/profile_images/1096094749902028801/ijbQWupW.png
RT @OPSGuate: #Hoy acompañamos al Sistema Integral de Atención en Salud (SIAS) de @MinSaludGuate en su presentación de ruta de implementaci…,https://twitter.com/i/web/status/1395755808059797504,21/05/2021 08:58:11,Twitter for iPhone,0,1,OPS/OMS,08:58:11,http://pbs.twimg.com/profile_images/1096094749902028801/ijbQWupW.png
"RT @OPSOMSMexico: 🔔 Profesional de la salud 👩‍⚕‍👨‍⚕‍, colabora 🤝 junto a nosotros en impulsar en el país la ✅ Estrategia para las Américas…",https://twitter.com/i/web/status/1395755846009868290,21/05/2021 08:58:20,Twitter for iPhone,0,6,OPS/OMS,08:58:20,http://pbs.twimg.com/profile_images/1096094749902028801/ijbQWupW.png
"RT @OPSGuate: Nadie debería privarse de andar en bicicleta o caminar por miedo a ser atropellado o morir. 
Exige límites de velocidad de 30…",https://twitter.com/i/web/status/1395755860983488514,21/05/2021 08:58:23,Twitter for iPhone,0,9,OPS/OMS,08:58:23,http://pbs.twimg.com/profile_images/1096094749902028801/ijbQWupW.png
#Pasaporte | El Código QR que se genera para la cita de emisión de pasaporte no puede ser falsificado. ¡No te dejes… https://t.co/vBQCVgIVBa,https://twitter.com/i/web/status/1395756494537334791,21/05/2021 09:00:54,Hootsuite Inc.,2,0,Migración Guatemala,09:00:54,http://pbs.twimg.com/profile_images/1346129009051054081/v9JUwo36.jpg
"#EnDesarrollo | En el Comando Aéreo del Norte del #EjércitoGT | #MINDEF, delegados de la SGAIA-@PNCdeGuatemala y… https://t.co/Me2IA1t7lz",https://twitter.com/i/web/status/1395757297310310404,21/05/2021 09:04:06,Twitter for Android,4,2,Ejército Guatemala,09:04:06,http://pbs.twimg.com/profile_images/1371454438775398402/KrPRUXA_.jpg
#Información | Se reportan largas filas de vehículos en cercanías del Puesto Fronterizo de Pedro de Alvarado (Jutia… https://t.co/nJRoL51yjI,https://twitter.com/i/web/status/1395759269077823489,21/05/2021 09:11:56,Twitter for iPhone,1,0,Migración Guatemala,09:11:56,http://pbs.twimg.com/profile_images/1346129009051054081/v9JUwo36.jpg
"#SinergiaRadio🎙📻 | En nuestra #Entrevista conversamos con el Mayor Asimilado y Licenciado Hipólito Alonzo, quien no… https://t.co/HFxQe7HgwI",https://twitter.com/i/web/status/1395759883782348802,21/05/2021 09:14:22,Twitter for Android,5,3,Ejército Guatemala,09:14:22,http://pbs.twimg.com/profile_images/1371454438775398402/KrPRUXA_.jpg
"Quinta Brigada de Infantería del #EjércitoGT | #MINDEF apoya al @MinSaludGuate, en la organización y funcionamiento… https://t.co/SZLiiBYUYC",https://twitter.com/i/web/status/1395760882903302147,21/05/2021 09:18:21,Twitter for Android,2,2,Ejército Guatemala,09:18:21,http://pbs.twimg.com/profile_images/1371454438775398402/KrPRUXA_.jpg
"#URGENTE

Personal de la Subdirección General de Análisis de Información Antinarcótica (SGAIA) junto al Ministerio… https://t.co/QtaGL2h9Fr",https://twitter.com/i/web/status/1395761134377000965,21/05/2021 09:19:21,Twitter for iPhone,4,0,MinGob,09:19:21,http://pbs.twimg.com/profile_images/1371480777330941958/_81AGCXa.jpg
[#Video] 📹 Con esta captura suman cuatro detenidos de #LosMasBuscadosGT 🔍 https://t.co/khbO21WDBP,https://twitter.com/i/web/status/1395767330576216069,21/05/2021 09:43:58,Twitter Web App,11,4,MinGob,09:43:58,http://pbs.twimg.com/profile_images/1371480777330941958/_81AGCXa.jpg
"En Comando Aéreo del Norte del #EjércitoGT | #MINDEF, delegados de la SGAIA y MP, tras proceso de judicialización c… https://t.co/F9MIMPzV3w",https://twitter.com/i/web/status/1395768662292893696,21/05/2021 09:49:15,Twitter for Android,15,2,Ejército Guatemala,09:49:15,http://pbs.twimg.com/profile_images/1371454438775398402/KrPRUXA_.jpg
"#Huehuetenango | Quinta Brigada de Infantería del #EjércitoGT | #MINDEF apoya al @MinSaludGuate, en la organización… https://t.co/28YqTgXn51",https://twitter.com/i/web/status/1395770850557800452,21/05/2021 09:57:57,Twitter for Android,2,1,Ejército Guatemala,09:57:57,http://pbs.twimg.com/profile_images/1371454438775398402/KrPRUXA_.jpg
"Cuarta Brigada de Infantería y Reservistas Militares del #EjércitoGT | #MINDEF apoyan al @MinSaludGuate, en la orga… https://t.co/qoRvbrc9s2",https://twitter.com/i/web/status/1395771286304006147,21/05/2021 09:59:41,Twitter for Android,3,1,Ejército Guatemala,09:59:41,http://pbs.twimg.com/profile_images/1371454438775398402/KrPRUXA_.jpg
"#LosMásBuscadosGT 🔍  por el delito de Violación y Agresión Sexual 

Denuncia al teléfono 1561 ó escribe al correo s… https://t.co/HaCQUa3t3w",https://twitter.com/i/web/status/1395771375743291397,21/05/2021 10:00:02,TweetDeck,6,5,MinGob,10:00:02,http://pbs.twimg.com/profile_images/1371480777330941958/_81AGCXa.jpg
"Brigada de Infantería de Marina y Reservistas Militares del #EjércitoGT | #MINDEF transmitieron programa radial, da… https://t.co/t38FojGgOl",https://twitter.com/i/web/status/1395773631981096960,21/05/2021 10:09:00,Twitter for Android,6,2,Ejército Guatemala,10:09:00,http://pbs.twimg.com/profile_images/1371454438775398402/KrPRUXA_.jpg
"Cuarta Brigada de Infantería del #EjércitoGT | #MINDEF apoya al @MinSaludGuate, en la organización y funcionamiento… https://t.co/dGypjbDXpK",https://twitter.com/i/web/status/1395774632351969283,21/05/2021 10:12:59,Twitter for Android,6,2,Ejército Guatemala,10:12:59,http://pbs.twimg.com/profile_images/1371454438775398402/KrPRUXA_.jpg
[#Video] 📹 El Tercer Viceministerio de Prevención continua su ardua labor ejecutando estrategias y planes bajo la d… https://t.co/jl38KKz2bW,https://twitter.com/i/web/status/1395775139917312003,21/05/2021 10:15:00,Twitter Media Studio,3,2,MinGob,10:15:00,http://pbs.twimg.com/profile_images/1371480777330941958/_81AGCXa.jpg
#Actualización| #MSPAS informa este 21 de mayo de 2021 los casos confirmados por laboratorio en el tablero Situació… https://t.co/G2pEflzADW,https://twitter.com/i/web/status/1395775493199249411,21/05/2021 10:16:24,Twitter for Android,3,2,Ministerio de Salud Pública,10:16:24,http://pbs.twimg.com/profile_images/1311755159027015685/QQcxgYd1.jpg
⚠️ En el tablero COVID-19 los fallecidos reportados el día anterior se visualizan por la fecha de defunción. Estos… https://t.co/8ICNUPLD5M,https://twitter.com/i/web/status/1395775495220965387,21/05/2021 10:16:24,Twitter for Android,0,0,Ministerio de Salud Pública,10:16:24,http://pbs.twimg.com/profile_images/1311755159027015685/QQcxgYd1.jpg
#RecorridoFronterizo2021 | Hoy #CancillerGT @PedroBroloGT y #ViceCancillerGT @eduardoehr visitaron el Centro de Pro… https://t.co/lWt2SFMF0i,https://twitter.com/i/web/status/1395775510492467201,21/05/2021 10:16:28,Twitter Web App,3,2,MINEX Guatemala 🇬🇹,10:16:28,http://pbs.twimg.com/profile_images/1292832595093475329/6LQbTy36.jpg
El #MSPAS informa la cantidad de personas que han recibido la primera dosis y el esquema completo de la vacuna cont… https://t.co/E5Jtw7qmld,https://twitter.com/i/web/status/1395775780882456580,21/05/2021 10:17:33,Twitter for Android,1,2,Ministerio de Salud Pública,10:17:33,http://pbs.twimg.com/profile_images/1311755159027015685/QQcxgYd1.jpg
"#CancillerGT también visitó el albergue Delphi EIS, donde compartió con niñas, niños y adolescentes a quienes les t… https://t.co/ljRUkr3rTn",https://twitter.com/i/web/status/1395776555280896001,21/05/2021 10:20:37,Twitter Web App,0,1,MINEX Guatemala 🇬🇹,10:20:37,http://pbs.twimg.com/profile_images/1292832595093475329/6LQbTy36.jpg
[#Video] 📹 Tercer Viceministro asistió a la reunión del Gabinete Específico de Desarrollo Social https://t.co/Qz6Uo0EZwH,https://twitter.com/i/web/status/1395776638806282242,21/05/2021 10:20:57,Twitter Web App,3,1,MinGob,10:20:57,http://pbs.twimg.com/profile_images/1371480777330941958/_81AGCXa.jpg
"#Preliminar 

Al momento se contabilizan 401 paquete con posible ilícito, que han sido localizados en 14 tulas, en… https://t.co/cWktF3Y7pn",https://twitter.com/i/web/status/1395777026028707840,21/05/2021 10:22:29,Twitter Web App,1,0,MinGob,10:22:29,http://pbs.twimg.com/profile_images/1371480777330941958/_81AGCXa.jpg
Dentro de los 100 más buscados hay tres mujeres https://t.co/ogsKkA47kr,https://twitter.com/i/web/status/1395779082873417728,21/05/2021 10:30:40,"<a href=""http://publicize.wp.com/"" rel=""nofollow"">WordPress.com",9,3,MinGob,10:30:40,http://pbs.twimg.com/profile_images/1371480777330941958/_81AGCXa.jpg
"En el marco de su gira por Texas, EE.UU. el #CancillerGT @PedroBroloGT, acompañado del #ViceCancillerGT, el embajad… https://t.co/zoHjrTuQBo",https://twitter.com/i/web/status/1395782564552581122,21/05/2021 10:44:30,Twitter Web App,2,3,MINEX Guatemala 🇬🇹,10:44:30,http://pbs.twimg.com/profile_images/1292832595093475329/6LQbTy36.jpg
#ControlMigratorio | 🚌 Compartimos los requisitos de ingreso al país vía terrestre para guatemaltecos y extranjeros… https://t.co/6CfVJiM7Wu,https://twitter.com/i/web/status/1395784815677513731,21/05/2021 10:53:27,Twitter for iPhone,1,0,Migración Guatemala,10:53:27,http://pbs.twimg.com/profile_images/1346129009051054081/v9JUwo36.jpg
"Tercer Viceministro Carlos García Rubio, lidera la reunión del Comité Técnico para la Protección de la Vida y la In… https://t.co/CJ9iOjMLeS",https://twitter.com/i/web/status/1395785272042926084,21/05/2021 10:55:15,Twitter Web App,10,3,MinGob,10:55:15,http://pbs.twimg.com/profile_images/1371480777330941958/_81AGCXa.jpg
"#URGENTE 

Valdor Ernesto Alfaro Trigueros es la sexta persona capturada de #LosMasBuscadosGT 🔍, sindicado del deli… https://t.co/KxKB8fIZ3s",https://twitter.com/i/web/status/1395788525753208835,21/05/2021 11:08:11,Twitter Web App,5,5,MinGob,11:08:11,http://pbs.twimg.com/profile_images/1371480777330941958/_81AGCXa.jpg
"RT @marngt: El #MARN en #Zacapa, en coordinación con la Segunda Brigada Militar Capitán General Rafael Carrera, hicieron una jornada de ref…",https://twitter.com/i/web/status/1395795088861712384,21/05/2021 11:34:16,Twitter Web App,0,2,Ejército Guatemala,11:34:16,http://pbs.twimg.com/profile_images/1371454438775398402/KrPRUXA_.jpg
"Segunda Brigada de Infantería del #EjércitoGT | #MINDEF apoya al @MinSaludGuate, en la organización y funcionamient… https://t.co/pFtQU6e4x6",https://twitter.com/i/web/status/1395798963643731969,21/05/2021 11:49:40,Twitter for Android,2,1,Ejército Guatemala,11:49:40,http://pbs.twimg.com/profile_images/1371454438775398402/KrPRUXA_.jpg
"En la Región, al menos el 43% de las mujeres ha tenido experiencias de trato irrespetuoso y ofensivo durante el par… https://t.co/TgybxZI1KI",https://twitter.com/i/web/status/1395799329521217539,21/05/2021 11:51:07,Twitter Media Studio,15,6,OPS/OMS,11:51:07,http://pbs.twimg.com/profile_images/1096094749902028801/ijbQWupW.png
