Contenido,IR,Fecha,Dispositivo,Likes,Retweets,Entidad,Hora,Foto
"Durante su visita a Guatemala, el Jeque @fahimaq, del Emirato de Sharjah, conoció el potencial económico para los i… https://t.co/Q6GkkSheg7",https://twitter.com/i/web/status/1518626824061960193,25/04/2022 10:23:44,Twitter Web App,13,4,Ministerio de Finanzas de Guatemala,10:23:44,http://pbs.twimg.com/profile_images/1471837102618853383/4xfotDwN.jpg
@fahimaq @GuatemalaGob @MINECOGT @TGWdigital @AGN_noticias @DiariodeCA La presentación del Viceministro fue durante… https://t.co/Wp8s9Wycnh,https://twitter.com/i/web/status/1518627531531902978,25/04/2022 10:26:32,Twitter Web App,7,2,Ministerio de Finanzas de Guatemala,10:26:32,http://pbs.twimg.com/profile_images/1471837102618853383/4xfotDwN.jpg
@fahimaq @GuatemalaGob @MINECOGT @TGWdigital @AGN_noticias @DiariodeCA @MinexGt @FUNDESA @AGEXPORTGT… https://t.co/a1xu9l7Drc,https://twitter.com/i/web/status/1518662780764803080,25/04/2022 12:46:36,Twitter Web App,3,0,Ministerio de Finanzas de Guatemala,12:46:36,http://pbs.twimg.com/profile_images/1471837102618853383/4xfotDwN.jpg
La reunión de negocios con el Jeque @fahimaq es parte de la estrategia de la Política General de Gobierno del Presi… https://t.co/gOW6O12zy4,https://twitter.com/i/web/status/1518664448713633797,25/04/2022 12:53:14,Twitter for Android,1,0,Ministerio de Finanzas de Guatemala,12:53:14,http://pbs.twimg.com/profile_images/1471837102618853383/4xfotDwN.jpg
"En el marco de la 55° reunión de Jefes de Bancos Centrales y @SECOSEFIN, el Ministro de Finanzas Públicas… https://t.co/sdf9M5EbuG",https://twitter.com/i/web/status/1518746732707950593,25/04/2022 18:20:12,Twitter for Android,4,2,Ministerio de Finanzas de Guatemala,18:20:12,http://pbs.twimg.com/profile_images/1471837102618853383/4xfotDwN.jpg
#TodosSomosMigrantes | Compartimos nuestra campaña en traducción Kaqchiquel. Todos debemos de forjar un mundo acoge… https://t.co/MFrd2CaeWX,https://twitter.com/i/web/status/1518775623321329664,25/04/2022 20:15:00,Twitter for iPhone,5,2,Migración Guatemala,20:15:00,http://pbs.twimg.com/profile_images/1472975116015386625/qXTSRrI2.jpg
RT @GuatemalaGob: #GiraPresidencial2022 | La visión municipalista del Gobierno del presidente @DrGiammattei ha impulsado el desarrollo soci…,https://twitter.com/i/web/status/1518793576632786945,25/04/2022 21:26:21,Twitter for Android,0,9,Ministerio de Finanzas de Guatemala,21:26:21,http://pbs.twimg.com/profile_images/1471837102618853383/4xfotDwN.jpg
"#InformeNacional del @GuatemalaGob:

✅ Marzo registró US$127 millones en inversión extranjera directa, lo cual perm… https://t.co/I8qeTtOrZU",https://twitter.com/i/web/status/1518812557057961986,25/04/2022 22:41:46,Twitter for Android,2,1,Ministerio de Finanzas de Guatemala,22:41:46,http://pbs.twimg.com/profile_images/1471837102618853383/4xfotDwN.jpg
"#YoDenuncio | Recuerda, si realizas una de estas actividades puedes recibir una pena de presión de hasta 18 años. https://t.co/zN7LQOa3e2",https://twitter.com/i/web/status/1518924547176771585,26/04/2022 06:06:46,Twitter for iPhone,3,4,Migración Guatemala,06:06:46,http://pbs.twimg.com/profile_images/1472975116015386625/qXTSRrI2.jpg
"El Fondo Rotatorio contribuye a la solidez 🔒 de los programas de vacunación de los países, y tiene un rol important… https://t.co/NePP77cpRE",https://twitter.com/i/web/status/1518959105209110530,26/04/2022 08:24:06,Twitter for iPhone,0,3,OPS/OMS,08:24:06,http://pbs.twimg.com/profile_images/1096094749902028801/ijbQWupW.png
El Fondo Rotatorio facilitó la entrega de las vacunas COVID-19 para 33 países de la región 🌎 asegurando además la c… https://t.co/0RM9t9tRDU,https://twitter.com/i/web/status/1518959106421235713,26/04/2022 08:24:06,Twitter for iPhone,3,3,OPS/OMS,08:24:06,http://pbs.twimg.com/profile_images/1096094749902028801/ijbQWupW.png
¿Estás protegido? #PonteTodasTusVacunas #SVA20 https://t.co/2uSvzNloDD,https://twitter.com/i/web/status/1518959107772153856,26/04/2022 08:24:06,Twitter for iPhone,2,0,OPS/OMS,08:24:06,http://pbs.twimg.com/profile_images/1096094749902028801/ijbQWupW.png
"@carmengut_gt Buen día, le comentamos que el Instituto Guatemalteco de Migración atiende casos de emergencia, si es… https://t.co/45BGe49NXi",https://twitter.com/i/web/status/1518960392306843650,26/04/2022 08:29:13,Twitter Web App,0,0,Migración Guatemala,08:29:13,http://pbs.twimg.com/profile_images/1472975116015386625/qXTSRrI2.jpg
"#GestióMinfin | El Ministerio de Finanzas Públicas, por medio de la Dirección General de Adquisiciones del Estado,… https://t.co/T86xRhkkzA",https://twitter.com/i/web/status/1518960814019035136,26/04/2022 08:30:53,Twitter Web App,3,2,Ministerio de Finanzas de Guatemala,08:30:53,http://pbs.twimg.com/profile_images/1471837102618853383/4xfotDwN.jpg
"@ManuelOP2310 @Lared1061 Buen día, le recomendamos hacer su denuncia a través del siguiente número +502 42149091",https://twitter.com/i/web/status/1518961071704453120,26/04/2022 08:31:55,Twitter Web App,0,0,Migración Guatemala,08:31:55,http://pbs.twimg.com/profile_images/1472975116015386625/qXTSRrI2.jpg
RT @OPSOMSMexico: Es fundamental que los gobiernos gestionen la lucha antipalúdica 🦟 y que también participen en ella las comunidades 👪…,https://twitter.com/i/web/status/1518964309342236673,26/04/2022 08:44:46,Twitter for iPhone,0,2,OPS/OMS,08:44:46,http://pbs.twimg.com/profile_images/1096094749902028801/ijbQWupW.png
RT @PAHOemergencies: Los 🏥 Inteligentes (#SmartHospitals) están construidos estratégicamente para resistir 🌀 desastres naturales y proveer…,https://twitter.com/i/web/status/1518965318051377155,26/04/2022 08:48:47,Twitter for iPhone,0,9,OPS/OMS,08:48:47,http://pbs.twimg.com/profile_images/1096094749902028801/ijbQWupW.png
"👏""Le debemos este avance científico a los investigadores, científicos, reguladores y miles de personas que particip… https://t.co/lwbSvVvD6H",https://twitter.com/i/web/status/1518968151907602432,26/04/2022 09:00:03,Twitter Media Studio,17,10,OPS/OMS,09:00:03,http://pbs.twimg.com/profile_images/1096094749902028801/ijbQWupW.png
"#Extranjería |  Si usted necesita permanecer más tiempo del autorizado en Guatemala, le recomendamos tramitar su pr… https://t.co/zjHJ4u0mZZ",https://twitter.com/i/web/status/1518977527703871488,26/04/2022 09:37:18,Hootsuite Inc.,2,1,Migración Guatemala,09:37:18,http://pbs.twimg.com/profile_images/1472975116015386625/qXTSRrI2.jpg
"@ErikAudon2711 Buenos días, le hemos escrito vía inbox.",https://twitter.com/i/web/status/1518989656796372993,26/04/2022 10:25:30,Twitter Web App,0,0,Migración Guatemala,10:25:30,http://pbs.twimg.com/profile_images/1472975116015386625/qXTSRrI2.jpg
"¡Nuevo curso! 

📚 El curso brinda una caja de herramientas completa y una guía para comprender e implementar las me… https://t.co/KA8vsr4vwW",https://twitter.com/i/web/status/1518998348056903681,26/04/2022 11:00:02,Twitter Web App,4,3,OPS/OMS,11:00:02,http://pbs.twimg.com/profile_images/1096094749902028801/ijbQWupW.png
"#EnDirecto | Entrevista presidencial con aspirante a fiscal general y jefe del @MPguatemala, Henry Alejandro Elías… https://t.co/pUbLjQIAMe",https://twitter.com/i/web/status/1519002577488162817,26/04/2022 11:16:50,"<a href=""https://periscope.tv"" rel=""nofollow"">Periscope",59,50,Gobierno Guatemala,11:16:50,http://pbs.twimg.com/profile_images/1479793855331459074/NqurElHC.jpg
#Esquela | 🕊️ Lamentamos el fallecimiento de la abuela de nuestra compañera Jackeline Belteton Sical. Expresamos nu… https://t.co/nhLGpo3IB0,https://twitter.com/i/web/status/1519006859348393986,26/04/2022 11:33:51,Twitter for Android,1,0,Migración Guatemala,11:33:51,http://pbs.twimg.com/profile_images/1472975116015386625/qXTSRrI2.jpg
"RT @CONAPgt: 🙋‍♀️🙋#RetoNaturalista departamento de #Guatemala | del 29 de abril al 2 de mayo  

Participa 📷
Comparte tus observaciones en #…",https://twitter.com/i/web/status/1519014711928500225,26/04/2022 12:05:03,Twitter Web App,0,4,Gobierno Guatemala,12:05:03,http://pbs.twimg.com/profile_images/1479793855331459074/NqurElHC.jpg
"RT @MINECOGT: #MisionesMinecoGT2022 🇺🇸 El Ministro de Economía #JanioRosales y el Congresista de Nueva York @RepEspaillat,miembro del @Hisp…",https://twitter.com/i/web/status/1519016247463223298,26/04/2022 12:11:10,Twitter Web App,0,10,Gobierno Guatemala,12:11:10,http://pbs.twimg.com/profile_images/1479793855331459074/NqurElHC.jpg
"RT @OPSOMS_Honduras: Desde el CIS, Pascual Izaguirre, en Choloma, celebrando la #SVA20 y Desparasitació; donde también se entregarón  obras…",https://twitter.com/i/web/status/1519018660693786626,26/04/2022 12:20:45,Twitter for iPhone,0,4,OPS/OMS,12:20:45,http://pbs.twimg.com/profile_images/1096094749902028801/ijbQWupW.png
"RT @Ops_Paraguay: ""Sin las vacunas, las epidemias causadas por muchas enfermedades prevenibles podrían reaparecer"" Dra. Fabiana Michel, Ase…",https://twitter.com/i/web/status/1519019241416048640,26/04/2022 12:23:03,Twitter for iPhone,0,2,OPS/OMS,12:23:03,http://pbs.twimg.com/profile_images/1096094749902028801/ijbQWupW.png
"⚽️ Gracias @ECavaniOfficial  por el continuo apoyo a nuestro trabajo 🙏

ℹ️ Toda la información sobre la Semana de V… https://t.co/WWuekkYBwL",https://twitter.com/i/web/status/1519023985308184576,26/04/2022 12:41:54,Twitter for iPhone,9,4,OPS/OMS,12:41:54,http://pbs.twimg.com/profile_images/1096094749902028801/ijbQWupW.png
"@EsGeo1 Buen día, le hemos escrito vía inbox.",https://twitter.com/i/web/status/1519024338921529347,26/04/2022 12:43:19,Twitter Web App,1,0,Migración Guatemala,12:43:19,http://pbs.twimg.com/profile_images/1472975116015386625/qXTSRrI2.jpg
"El Distrito Municipal de Salud de San Pablo La Laguna, Sololá realizó el  lanzamiento de la 20° Semana de la Vacuna… https://t.co/S9obBhQRlh",https://twitter.com/i/web/status/1519024477966843914,26/04/2022 12:43:52,Twitter Web App,2,1,Ministerio de Salud Pública,12:43:52,http://pbs.twimg.com/profile_images/1471842908043190279/bu1LHFWL.jpg
"ofertando diferente tipo de biológicos, así como  suplementación, monitoreo de  crecimiento y otros servicios de prevención.",https://twitter.com/i/web/status/1519024558862475264,26/04/2022 12:44:11,Twitter Web App,0,0,Ministerio de Salud Pública,12:44:11,http://pbs.twimg.com/profile_images/1471842908043190279/bu1LHFWL.jpg
#GiraPresidencial2022 | Miles de pobladores de #Sololá son beneficiados con la inauguración de proyectos de infraes… https://t.co/TkrIwkDrCb,https://twitter.com/i/web/status/1519028542582927361,26/04/2022 13:00:01,Twitter Media Studio,8,9,Gobierno Guatemala,13:00:01,http://pbs.twimg.com/profile_images/1479793855331459074/NqurElHC.jpg
#NoticiasMSPAS | Petén Sur Oriente intensifica acciones de vacunación durante la 20° Semana de la Vacunación en las… https://t.co/tFAmXd2O6f,https://twitter.com/i/web/status/1519036434891644928,26/04/2022 13:31:23,"<a href=""https://www.socialgest.net"" rel=""nofollow"">SocialGest",1,0,Ministerio de Salud Pública,13:31:23,http://pbs.twimg.com/profile_images/1471842908043190279/bu1LHFWL.jpg
RT @Ejercito_GT: #EjércitoGT | #MINDEF felicita al @mingobguate por conmemorar un año más de entrega y compromiso hacia la población 🇬🇹👏…,https://twitter.com/i/web/status/1519037504229457922,26/04/2022 13:35:38,Twitter for iPhone,0,5,MinGob,13:35:38,http://pbs.twimg.com/profile_images/1471828174598246407/Y1Lm5nFE.jpg
"Autoridades del @MinSaludGuate emiten recomendaciones para evitar el contagio de dengue. 👇
https://t.co/FHagFPIdPZ",https://twitter.com/i/web/status/1519043637497237505,26/04/2022 14:00:00,Twitter Web App,6,7,Gobierno Guatemala,14:00:00,http://pbs.twimg.com/profile_images/1479793855331459074/NqurElHC.jpg
#GestiónMinfin📊 | El @BCIE_Org apoyará la transformación digital en el #MinfinGT por medio de una cooperación no re… https://t.co/8fwMMYmbrh,https://twitter.com/i/web/status/1519043937729712134,26/04/2022 14:01:11,Twitter Web App,8,5,Ministerio de Finanzas de Guatemala,14:01:11,http://pbs.twimg.com/profile_images/1471837102618853383/4xfotDwN.jpg
"#183AniversarioMinGob

Conmemoración del Aniversario del Ministerio de Gobernación bajo el firme compromiso de vela… https://t.co/I21AXLE2ra",https://twitter.com/i/web/status/1519043960873922560,26/04/2022 14:01:17,Twitter Web App,7,5,MinGob,14:01:17,http://pbs.twimg.com/profile_images/1471828174598246407/Y1Lm5nFE.jpg
RT @MinfinGT: #GestiónMinfin📊 | El @BCIE_Org apoyará la transformación digital en el #MinfinGT por medio de una cooperación no reembolsable…,https://twitter.com/i/web/status/1519047221458657280,26/04/2022 14:14:14,Twitter Web App,0,5,Gobierno Guatemala,14:14:14,http://pbs.twimg.com/profile_images/1479793855331459074/NqurElHC.jpg
"Representantes del Proyecto Crecer Sano, participaron en citación convocada por  diputados al Congreso de la Repúbl… https://t.co/StlKAcOiTv",https://twitter.com/i/web/status/1519051891564589058,26/04/2022 14:32:48,Twitter Web App,1,0,Ministerio de Salud Pública,14:32:48,http://pbs.twimg.com/profile_images/1471842908043190279/bu1LHFWL.jpg
Gobernación extenderá por un mes “Plan Operativo Táctico Integral 13-2022” https://t.co/uaIgomAyCf,https://twitter.com/i/web/status/1519055514147119105,26/04/2022 14:47:11,"<a href=""http://publicize.wp.com/"" rel=""nofollow"">WordPress.com",3,4,MinGob,14:47:11,http://pbs.twimg.com/profile_images/1471828174598246407/Y1Lm5nFE.jpg
#ControlMigratorio | 🛳️ Nuestros delegados realizan controles migratorios a tripulantes de un crucero en el Puerto… https://t.co/mHoXuG3j07,https://twitter.com/i/web/status/1519056848971833345,26/04/2022 14:52:30,Twitter for Android,4,1,Migración Guatemala,14:52:30,http://pbs.twimg.com/profile_images/1472975116015386625/qXTSRrI2.jpg
"El tercer viceministro de Prevención de la Violencia y el Delito, Ronald Portillo Cordón, participa en la reunión d… https://t.co/vk0VizXick",https://twitter.com/i/web/status/1519060059313131520,26/04/2022 15:05:15,Twitter for iPhone,5,4,MinGob,15:05:15,http://pbs.twimg.com/profile_images/1471828174598246407/Y1Lm5nFE.jpg
"En esta ocasión se abordan temas como, el proceso de elaboración del Plan de Acción de la Política Pública Contra l… https://t.co/fhIZhV0hOH",https://twitter.com/i/web/status/1519060091017867271,26/04/2022 15:05:23,Twitter for iPhone,6,4,MinGob,15:05:23,http://pbs.twimg.com/profile_images/1471828174598246407/Y1Lm5nFE.jpg
"Abordo de la embarcación, se detectaron 20 bidones de combustible vacíos, asimismo, 2 toneles que podrían haber tra… https://t.co/ozMx1xsM2l",https://twitter.com/i/web/status/1519060165420593159,26/04/2022 15:05:40,Twitter for Android,2,3,Ejército Guatemala,15:05:40,http://pbs.twimg.com/profile_images/1471838829430640640/0yNoNrwr.jpg
"Esta mañana, la Marina de la Defensa Nacional del #EjércitoGT interceptó una embarcación tipo tiburonera sin bander… https://t.co/iziuWkYe8W",https://twitter.com/i/web/status/1519060163654823937,26/04/2022 15:05:40,Twitter for Android,2,4,Ejército Guatemala,15:05:40,http://pbs.twimg.com/profile_images/1471838829430640640/0yNoNrwr.jpg
"Asimismo, por encontrarse en aguas guatemaltecas de manera indocumentada, están siendo trasladadas hacia el Comando… https://t.co/4nWAYZqM2u",https://twitter.com/i/web/status/1519060484460265475,26/04/2022 15:06:56,Twitter for Android,1,2,Ejército Guatemala,15:06:56,http://pbs.twimg.com/profile_images/1471838829430640640/0yNoNrwr.jpg
"#EnDirecto | Entrevista presidencial con aspirante a fiscal general y jefe del @MPguatemala, Darleene Apolonia Mong… https://t.co/s215GuBSDI",https://twitter.com/i/web/status/1519061859088801794,26/04/2022 15:12:24,"<a href=""https://periscope.tv"" rel=""nofollow"">Periscope",58,50,Gobierno Guatemala,15:12:24,http://pbs.twimg.com/profile_images/1479793855331459074/NqurElHC.jpg
"RT @GuatemalaGob: #EnDirecto | Entrevista presidencial con aspirante a fiscal general y jefe del @MPguatemala, Darleene Apolonia Monge Pine…",https://twitter.com/i/web/status/1519062436296503296,26/04/2022 15:14:42,Twitter for iPhone,0,50,MinGob,15:14:42,http://pbs.twimg.com/profile_images/1471828174598246407/Y1Lm5nFE.jpg
"RT @GuatemalaGob: #EnDirecto | Entrevista presidencial con aspirante a fiscal general y jefe del @MPguatemala, Darleene Apolonia Monge Pine…",https://twitter.com/i/web/status/1519064238446329857,26/04/2022 15:21:51,Twitter for iPhone,0,50,Ministerio de Salud Pública,15:21:51,http://pbs.twimg.com/profile_images/1471842908043190279/bu1LHFWL.jpg
#NoticiasMSPAS | Fortalecen capacidades de personal para abordaje de la desnutrición en el marco del Proyecto Crece… https://t.co/Qq3NT3bLbi,https://twitter.com/i/web/status/1519066623696678912,26/04/2022 15:31:20,"<a href=""https://www.socialgest.net"" rel=""nofollow"">SocialGest",1,0,Ministerio de Salud Pública,15:31:20,http://pbs.twimg.com/profile_images/1471842908043190279/bu1LHFWL.jpg
La Dirección de Área de Salud de Santa Rosa intensifica acciones de inmunización en los 14 Centros de Salud del dep… https://t.co/IM2v6mW3t1,https://twitter.com/i/web/status/1519073820828700674,26/04/2022 15:59:56,Twitter for iPhone,2,1,Ministerio de Salud Pública,15:59:56,http://pbs.twimg.com/profile_images/1471842908043190279/bu1LHFWL.jpg
La Dirección de Área de Salud de Sololá continúa realizando acciones de inmunización de casa en casa con el objetiv… https://t.co/MRTDPNXFCw,https://twitter.com/i/web/status/1519074045785956352,26/04/2022 16:00:50,Twitter for iPhone,1,0,Ministerio de Salud Pública,16:00:50,http://pbs.twimg.com/profile_images/1471842908043190279/bu1LHFWL.jpg
Sib’alaj tajin kachapik nik’aj pandilleros e salvadoreños ri’ https://t.co/rnrXPLtUOv,https://twitter.com/i/web/status/1519075238331432964,26/04/2022 16:05:34,"<a href=""http://publicize.wp.com/"" rel=""nofollow"">WordPress.com",1,1,MinGob,16:05:34,http://pbs.twimg.com/profile_images/1471828174598246407/Y1Lm5nFE.jpg
RT @MINTRABAJOGuate: Mintrab realizará una Feria de Empleo Nacional en conmemoración del Día Internacional de los Trabajadores. Entérate má…,https://twitter.com/i/web/status/1519079108260642827,26/04/2022 16:20:57,Twitter for iPhone,0,21,Ministerio de Salud Pública,16:20:57,http://pbs.twimg.com/profile_images/1471842908043190279/bu1LHFWL.jpg
"RT @GuatemalaGob: #EnDirecto | Entrevista presidencial con aspirante a fiscal general y jefe del @MPguatemala, Darleene Apolonia Monge Pine…",https://twitter.com/i/web/status/1519088193437679619,26/04/2022 16:57:03,Twitter for Android,0,50,Ejército Guatemala,16:57:03,http://pbs.twimg.com/profile_images/1471838829430640640/0yNoNrwr.jpg
RT @MINTRABAJOGuate: Mintrab realizará una Feria de Empleo Nacional en conmemoración del Día Internacional de los Trabajadores. Entérate má…,https://twitter.com/i/web/status/1519088217890426881,26/04/2022 16:57:09,Twitter for Android,0,21,Ejército Guatemala,16:57:09,http://pbs.twimg.com/profile_images/1471838829430640640/0yNoNrwr.jpg
183 años de velar por la seguridad y gobernabilidad del país https://t.co/SFjxRA99u4,https://twitter.com/i/web/status/1519090855499419649,26/04/2022 17:07:37,"<a href=""http://publicize.wp.com/"" rel=""nofollow"">WordPress.com",2,2,MinGob,17:07:37,http://pbs.twimg.com/profile_images/1471828174598246407/Y1Lm5nFE.jpg
"Brigada de Infantería de Marina del #EjércitoGT apoyó a @CONAPgt en la instalación de una biobarda, en el río Motag… https://t.co/uQIBMnzooU",https://twitter.com/i/web/status/1519093283129069568,26/04/2022 17:17:16,Twitter for Android,5,3,Ejército Guatemala,17:17:16,http://pbs.twimg.com/profile_images/1471838829430640640/0yNoNrwr.jpg
"RT @OEA_BelizeGuate: Recibimos a una Delegación de USD @MinexGT en las instalaciones de la @OEA_BelizeGuate, donde conversamos sobre el apo…",https://twitter.com/i/web/status/1519096166008467456,26/04/2022 17:28:44,Twitter for Android,0,8,Ejército Guatemala,17:28:44,http://pbs.twimg.com/profile_images/1471838829430640640/0yNoNrwr.jpg
"Detrás de #UnNobleSueño, muy pronto. ¡No te lo pierdas! https://t.co/OZHArscR8g",https://twitter.com/i/web/status/1519098246873841664,26/04/2022 17:37:00,Twitter Web App,25,24,Gobierno Guatemala,17:37:00,http://pbs.twimg.com/profile_images/1479793855331459074/NqurElHC.jpg
"RT @Segeplan: Te esperamos este 28 de abril para la inauguración de ExpoBecasGT
 Dos días llenos de  Conferencias, charlas con países coope…",https://twitter.com/i/web/status/1519102604764188672,26/04/2022 17:54:19,Twitter for Android,0,13,Gobierno Guatemala,17:54:19,http://pbs.twimg.com/profile_images/1479793855331459074/NqurElHC.jpg
"#JuntosVamosPorMás | El Gobierno del @DrGiammattei fortalece la seguridad alimentaria del país, impartiendo capacit… https://t.co/OmzIsNhjwd",https://twitter.com/i/web/status/1519104041929744386,26/04/2022 18:00:01,Twitter Media Studio,5,7,Gobierno Guatemala,18:00:01,http://pbs.twimg.com/profile_images/1479793855331459074/NqurElHC.jpg
Presentan proyectos de prevención durante la reunión de la CONAPRE https://t.co/SkGwhMzmHv,https://twitter.com/i/web/status/1519104332960047106,26/04/2022 18:01:11,"<a href=""http://publicize.wp.com/"" rel=""nofollow"">WordPress.com",3,3,MinGob,18:01:11,http://pbs.twimg.com/profile_images/1471828174598246407/Y1Lm5nFE.jpg
"RT @GuatemalaGob: Detrás de #UnNobleSueño, muy pronto. ¡No te lo pierdas! https://t.co/OZHArscR8g",https://twitter.com/i/web/status/1519107967169269761,26/04/2022 18:15:37,Twitter for iPhone,0,24,Ministerio de Salud Pública,18:15:37,http://pbs.twimg.com/profile_images/1471842908043190279/bu1LHFWL.jpg
"RT @MINECOGT: #MisionesMINECOGT2022 En la reunión entre Mineco y Junta Directiva de @el_BID , #Guatemala 🇬🇹 presenta las oportunidades de i…",https://twitter.com/i/web/status/1519109831092838400,26/04/2022 18:23:02,Twitter for Android,0,3,MINEX Guatemala 🇬🇹,18:23:02,http://pbs.twimg.com/profile_images/1471828089491574785/eD5OEVK6.jpg
#JuntosVamosPorMás https://t.co/AcbY0aInG5,https://twitter.com/i/web/status/1519109910537158658,26/04/2022 18:23:21,Twitter for Android,0,0,MINEX Guatemala 🇬🇹,18:23:21,http://pbs.twimg.com/profile_images/1471828089491574785/eD5OEVK6.jpg
"RT @MINECOGT: #MisionesMINECOGT Delegación conformada por Ministros de 🇬🇹 se reunieron con @RepLouCorrea, congresista Demócrata de Californ…",https://twitter.com/i/web/status/1519110069417299968,26/04/2022 18:23:58,Twitter for Android,0,4,MINEX Guatemala 🇬🇹,18:23:58,http://pbs.twimg.com/profile_images/1471828089491574785/eD5OEVK6.jpg
RT @consgtmontreal: #AccionConsularGt | @ConsGtMontreal en conjunto con Institucion financiera @Desjardins realizan planificación para proy…,https://twitter.com/i/web/status/1519110407386021890,26/04/2022 18:25:19,Twitter for Android,0,0,MINEX Guatemala 🇬🇹,18:25:19,http://pbs.twimg.com/profile_images/1471828089491574785/eD5OEVK6.jpg
"RT @ConsGuateTucson: ConsTucson participa en la conferencia anual de Pueblos Indígenas, organizada por la Asociación de Programas Académico…",https://twitter.com/i/web/status/1519110556111810561,26/04/2022 18:25:54,Twitter for Android,0,2,MINEX Guatemala 🇬🇹,18:25:54,http://pbs.twimg.com/profile_images/1471828089491574785/eD5OEVK6.jpg
"RT @GuatemalaGob: #JuntosVamosPorMás | El Gobierno del @DrGiammattei fortalece la seguridad alimentaria del país, impartiendo capacitacione…",https://twitter.com/i/web/status/1519110640614494208,26/04/2022 18:26:15,Twitter for Android,0,7,Ministerio de Finanzas de Guatemala,18:26:15,http://pbs.twimg.com/profile_images/1471837102618853383/4xfotDwN.jpg
"RT @EmbaGuate_Es: #DiplomaciaComercialGT| Hoy en Madrid 🇪🇸 se celebró la 1ra. Cata de Cafés de Centroamérica, con la presentación exclusiva…",https://twitter.com/i/web/status/1519110649028227072,26/04/2022 18:26:17,Twitter for Android,0,7,MINEX Guatemala 🇬🇹,18:26:17,http://pbs.twimg.com/profile_images/1471828089491574785/eD5OEVK6.jpg
RT @ConsGtSeattle: https://t.co/Kvxo7LLSR9,https://twitter.com/i/web/status/1519110715419893762,26/04/2022 18:26:32,Twitter for Android,0,2,MINEX Guatemala 🇬🇹,18:26:32,http://pbs.twimg.com/profile_images/1471828089491574785/eD5OEVK6.jpg
"El @ConsGuateTucson brindó asistencia y protección a una menor no acompañada originaria de nuestro país, quien fue… https://t.co/TmK4yBxiTs",https://twitter.com/i/web/status/1519111385464119297,26/04/2022 18:29:12,Twitter for Android,0,0,MINEX Guatemala 🇬🇹,18:29:12,http://pbs.twimg.com/profile_images/1471828089491574785/eD5OEVK6.jpg
"RT @GuatemalaGob: Detrás de #UnNobleSueño, muy pronto. ¡No te lo pierdas! https://t.co/OZHArscR8g",https://twitter.com/i/web/status/1519114004106461187,26/04/2022 18:39:37,Twitter for Android,0,24,Ejército Guatemala,18:39:37,http://pbs.twimg.com/profile_images/1471838829430640640/0yNoNrwr.jpg
"RT @GuatemalaGob: Detrás de #UnNobleSueño, muy pronto. ¡No te lo pierdas! https://t.co/OZHArscR8g",https://twitter.com/i/web/status/1519115409252888577,26/04/2022 18:45:12,Twitter for iPhone,0,24,MinGob,18:45:12,http://pbs.twimg.com/profile_images/1471828174598246407/Y1Lm5nFE.jpg
#Extranjería | Los formularios para trámite de visas y residencias No tienen costo! Se pueden descargar en ➡️… https://t.co/q9mGdMVoJN,https://twitter.com/i/web/status/1519115554954653704,26/04/2022 18:45:46,Twitter for iPhone,0,0,Migración Guatemala,18:45:46,http://pbs.twimg.com/profile_images/1472975116015386625/qXTSRrI2.jpg
Comando Naval del Pacífico del #EjércitoGT | #MINDEF apoyó al @MinSaludGuate y al Instituto Guatemalteco de Segurid… https://t.co/3WE2B0kqJA,https://twitter.com/i/web/status/1519117160995504130,26/04/2022 18:52:09,Twitter for Android,1,1,Ejército Guatemala,18:52:09,http://pbs.twimg.com/profile_images/1471838829430640640/0yNoNrwr.jpg
