Contenido,IR,Fecha,Dispositivo,Likes,Retweets,Entidad,Hora,Foto
#Retornados | Compartimos situación actual de guatemaltecos retornados vía terrestre que se encuentran albergados. https://t.co/UAGkPZE5Xc,https://twitter.com/i/web/status/1324335835370708994,05/11/2020 07:00:42,Hootsuite Inc.,4,2,Migración Guatemala,07:00:42,http://pbs.twimg.com/profile_images/1290300788347146241/7sOKfiDS.jpg
"#Pasaportes | De enero a octubre de este año, se han emitido 218,447 pasaportes. https://t.co/nBubnz7yJ1",https://twitter.com/i/web/status/1324381213809889280,05/11/2020 10:01:01,Hootsuite Inc.,1,0,Migración Guatemala,10:01:01,http://pbs.twimg.com/profile_images/1290300788347146241/7sOKfiDS.jpg
"#ControlMigratorio | Compartimos información sobre la salida de menores de edad del país, vía aérea, terrestre y ma… https://t.co/ZH5P2dP7b4",https://twitter.com/i/web/status/1324426385327333377,05/11/2020 13:00:31,Hootsuite Inc.,2,2,Migración Guatemala,13:00:31,http://pbs.twimg.com/profile_images/1290300788347146241/7sOKfiDS.jpg
#Donación | La @OIMGuatemala realizó una donación para atender a la población guatemalteca retornada ➡️… https://t.co/neNj5ngLPL,https://twitter.com/i/web/status/1324504416288911363,05/11/2020 18:10:35,Twitter for iPhone,4,1,Migración Guatemala,18:10:35,http://pbs.twimg.com/profile_images/1290300788347146241/7sOKfiDS.jpg
"Ministro @alvarogricci: Estamos trabajando en una reestructuración de la @SATGT, implementando herramientas tecnoló… https://t.co/dzMmgAALeY",https://twitter.com/i/web/status/1324549352438857729,05/11/2020 21:09:09,Twitter for Android,2,0,Minfin Guatemala,21:09:09,http://pbs.twimg.com/profile_images/1292831294796320768/6Q8j5vtW.jpg
"#Compromiso | 🤝 ¡Por una Migración regular, ordenada y segura! https://t.co/IU9rCXQWI5",https://twitter.com/i/web/status/1324698192919859202,06/11/2020 07:00:35,Hootsuite Inc.,3,0,Migración Guatemala,07:00:35,http://pbs.twimg.com/profile_images/1290300788347146241/7sOKfiDS.jpg
"El Ministerio de Finanzas, por medio de la Dirección de Contabilidad del Estado, realiza una jornada de capacitacio… https://t.co/2KwavXfQOJ",https://twitter.com/i/web/status/1324755313078210560,06/11/2020 10:47:34,Twitter Web App,2,1,Minfin Guatemala,10:47:34,http://pbs.twimg.com/profile_images/1292831294796320768/6Q8j5vtW.jpg
"El personal técnico del @FMInoticias, realizó una visita virtual a #Guatemala del 26 al 30 de octubre del presente… https://t.co/5ijlEORhWb",https://twitter.com/i/web/status/1324773660469665793,06/11/2020 12:00:28,Twitter Web App,4,1,Minfin Guatemala,12:00:28,http://pbs.twimg.com/profile_images/1292831294796320768/6Q8j5vtW.jpg
#ControlMigratorio | Compartimos información sobre la salida de menores de edad de territorio guatemalteco cuando v… https://t.co/FT5vMbhEYo,https://twitter.com/i/web/status/1324788778309980163,06/11/2020 13:00:32,Hootsuite Inc.,0,1,Migración Guatemala,13:00:32,http://pbs.twimg.com/profile_images/1290300788347146241/7sOKfiDS.jpg
"En el #MinfinGT, bajo la visión y liderazgo del Presidente @DrGiammattei, contribuimos a las prontas acciones de ay… https://t.co/Y5xWh0aMAL",https://twitter.com/i/web/status/1324798685750960129,06/11/2020 13:39:54,Twitter Web App,3,0,Minfin Guatemala,13:39:54,http://pbs.twimg.com/profile_images/1292831294796320768/6Q8j5vtW.jpg
RT @campusvirtualsp: 👉🏾Si te perdiste el seminario web sobre: La atención a las personas mayores durante y después de #COVID19 ¿qué deben s…,https://twitter.com/i/web/status/1324802850141184005,06/11/2020 13:56:27,Twitter for iPhone,0,11,OPS/OMS,13:56:27,http://pbs.twimg.com/profile_images/1096094749902028801/ijbQWupW.png
"RT @IUHPE: Participe en el Webinario interactivo @UNESCOchairGHE el miércoles 18 de noviembre, de las 16:30 a las 17.30 CET, 11.30 – 12.30…",https://twitter.com/i/web/status/1324806485822574592,06/11/2020 14:10:54,Twitter for iPhone,0,1,OPS/OMS,14:10:54,http://pbs.twimg.com/profile_images/1096094749902028801/ijbQWupW.png
#ETA | ¡Mandemos un abrazo! a los niños afectados por la depresión tropical ETA. Estaremos recolectando juguetes en… https://t.co/ZTUjCI3bkW,https://twitter.com/i/web/status/1324810241536593923,06/11/2020 14:25:50,Hootsuite Inc.,5,3,Migración Guatemala,14:25:50,http://pbs.twimg.com/profile_images/1290300788347146241/7sOKfiDS.jpg
RT @OPSOMSPeru: El #DíaMalariaAméricas es una oportunidad para aprender acerca de esta enfermedad y saber si estas en riesgo #malariacero h…,https://twitter.com/i/web/status/1324825077301551105,06/11/2020 15:24:47,Twitter for iPhone,0,4,OPS/OMS,15:24:47,http://pbs.twimg.com/profile_images/1096094749902028801/ijbQWupW.png
"RT @OPSOMSBolivia: En el #DíaMalariaAméricas, se parte de la solución para acabar con la #malaria y conviértete en un defensor de la elimin…",https://twitter.com/i/web/status/1324825160160083968,06/11/2020 15:25:06,Twitter for iPhone,0,2,OPS/OMS,15:25:06,http://pbs.twimg.com/profile_images/1096094749902028801/ijbQWupW.png
RT @OPSOMSBolivia: Se parte de la solución; se un defensor para la eliminación de la malaria. Sostengamos las intervenciones contra la mala…,https://twitter.com/i/web/status/1324825171962855424,06/11/2020 15:25:09,Twitter for iPhone,0,3,OPS/OMS,15:25:09,http://pbs.twimg.com/profile_images/1096094749902028801/ijbQWupW.png
"RT @OPSOMS_Col: 📹 Por su contribución significativa a la eliminación de la malaria, el municipio de Quibdó (Chocó) recibió el reconocimient…",https://twitter.com/i/web/status/1324825186751913985,06/11/2020 15:25:13,Twitter for iPhone,0,15,OPS/OMS,15:25:13,http://pbs.twimg.com/profile_images/1096094749902028801/ijbQWupW.png
"RT @PAHOemergencies: Profesionales de la salud 👩🏾‍⚕️👨🏽‍⚕️⚕️🏥 ¿Saben que hacer antes y después de una tormenta 🌀🌪️ 🌧️?

¡Aquí te lo mostramo…",https://twitter.com/i/web/status/1324825245690286081,06/11/2020 15:25:27,Twitter for iPhone,0,17,OPS/OMS,15:25:27,http://pbs.twimg.com/profile_images/1096094749902028801/ijbQWupW.png
"El Ministro de Finanzas Públicas, @alvarogricci, se refirió al reciente informe del @FMInoticias, el cual detalla e… https://t.co/JbwqynDTek",https://twitter.com/i/web/status/1324829631510417411,06/11/2020 15:42:52,Twitter for Android,5,0,Minfin Guatemala,15:42:52,http://pbs.twimg.com/profile_images/1292831294796320768/6Q8j5vtW.jpg
Economía &amp; #COVID19  👇 https://t.co/G4HtWwWScF,https://twitter.com/i/web/status/1324833940809666560,06/11/2020 16:00:00,Twitter Web App,7,7,OPS/OMS,16:00:00,http://pbs.twimg.com/profile_images/1096094749902028801/ijbQWupW.png
#ControlMigratorio | Compartimos los requisitos de ingreso a territorio guatemalteco para los países que integran e… https://t.co/WC3Zy3qmjs,https://twitter.com/i/web/status/1324833998728843264,06/11/2020 16:00:14,Hootsuite Inc.,5,2,Migración Guatemala,16:00:14,http://pbs.twimg.com/profile_images/1290300788347146241/7sOKfiDS.jpg
"✳️ Podemos protegernos unos a otros de la COVID-19 participando en el rastreo de contactos. 

✳️ Todos estamos más… https://t.co/m6eElAuYWW",https://twitter.com/i/web/status/1324847959813611521,06/11/2020 16:55:42,Twitter Web App,86,41,OPS/OMS,16:55:42,http://pbs.twimg.com/profile_images/1096094749902028801/ijbQWupW.png
"RT @DrGiammattei: Quiero decirle a los guatemaltecos que no están solos, estamos unidos y este momento lo superaremos juntos. Tengo fe que…",https://twitter.com/i/web/status/1324860578716848128,06/11/2020 17:45:51,Twitter for Android,0,34,MINEX Guatemala 🇬🇹,17:45:51,http://pbs.twimg.com/profile_images/1292832595093475329/6LQbTy36.jpg
El informe del @FMInoticias describe que los programas de apoyo para las familias más afectadas por Covid-19 han mi… https://t.co/yvTmfJA5XH,https://twitter.com/i/web/status/1324860715107278850,06/11/2020 17:46:23,Twitter for Android,8,1,Minfin Guatemala,17:46:23,http://pbs.twimg.com/profile_images/1292831294796320768/6Q8j5vtW.jpg
@CancilleriaPeru En nombre del @GuatemalaGob expresamos nuestro agradecimiento por su mensaje de solidaridad en est… https://t.co/Rdy08eQwzE,https://twitter.com/i/web/status/1324875776089534469,06/11/2020 18:46:14,Twitter for Android,3,2,MINEX Guatemala 🇬🇹,18:46:14,http://pbs.twimg.com/profile_images/1292832595093475329/6LQbTy36.jpg
@CancilleriaCol En nombre del @GuatemalaGob expresamos nuestro agradecimiento por su mensaje de solidaridad en esto… https://t.co/6txfDG9OTK,https://twitter.com/i/web/status/1324876695229362184,06/11/2020 18:49:53,Twitter for Android,3,2,MINEX Guatemala 🇬🇹,18:49:53,http://pbs.twimg.com/profile_images/1292832595093475329/6LQbTy36.jpg
@TW__Guatemala En nombre del @GuatemalaGob expresamos nuestro agradecimiento por su mensaje de solidaridad en estos… https://t.co/HKwo5bwe3c,https://twitter.com/i/web/status/1324877203566452737,06/11/2020 18:51:55,Twitter for Android,5,3,MINEX Guatemala 🇬🇹,18:51:55,http://pbs.twimg.com/profile_images/1292832595093475329/6LQbTy36.jpg
@iingwen En nombre del @GuatemalaGob expresamos nuestro agradecimiento por su mensaje de solidaridad en estos momen… https://t.co/NNVANNb1G6,https://twitter.com/i/web/status/1324879561960660993,06/11/2020 19:01:17,Twitter for Android,2,0,MINEX Guatemala 🇬🇹,19:01:17,http://pbs.twimg.com/profile_images/1292832595093475329/6LQbTy36.jpg
"RT @GuatemalaGob: #InformeNacional | En apoyo a las familias damnificadas por la depresión tropical Eta, el Gobierno de Guatemala trabaja j…",https://twitter.com/i/web/status/1324889536279834634,06/11/2020 19:40:55,Twitter Web App,0,16,MINEX Guatemala 🇬🇹,19:40:55,http://pbs.twimg.com/profile_images/1292832595093475329/6LQbTy36.jpg
#Pasaportes | 🎥 Conoce el proceso para realizar el trámite de pasaporte. https://t.co/PXhJKEBDZX,https://twitter.com/i/web/status/1325060461985853440,07/11/2020 07:00:07,Hootsuite Inc.,0,0,Migración Guatemala,07:00:07,http://pbs.twimg.com/profile_images/1290300788347146241/7sOKfiDS.jpg
El Ministerio de Finanzas pone a disposición de los guatemaltecos una serie de portales de #TransparenciaFiscal con… https://t.co/iNA1DMuLqi,https://twitter.com/i/web/status/1325077694694961152,07/11/2020 08:08:35,Twitter for Android,2,1,Minfin Guatemala,08:08:35,http://pbs.twimg.com/profile_images/1292831294796320768/6Q8j5vtW.jpg
"""El precio que la #COVID19 podría tener en la salud mental de las personas en nuestra 🌎 🌍 🌏 Región y en todo el mun… https://t.co/p1WrEUXaU5",https://twitter.com/i/web/status/1325105983392079872,07/11/2020 10:01:00,Twitter Web App,32,20,OPS/OMS,10:01:00,http://pbs.twimg.com/profile_images/1096094749902028801/ijbQWupW.png
"El Ministro de Finanzas, @alvarogricci, participó en la  reunión del Consejo Nacional para la Reducción de Desastre… https://t.co/HwDd5lQ9Yw",https://twitter.com/i/web/status/1325131898310578178,07/11/2020 11:43:58,Twitter for Android,6,3,Minfin Guatemala,11:43:58,http://pbs.twimg.com/profile_images/1292831294796320768/6Q8j5vtW.jpg
"Conoce la historia de Gabriela, ella trabaja en una empresa textil y fue un caso asintomático de COVID-19

Esta fue… https://t.co/12RBAk7twG",https://twitter.com/i/web/status/1325158581142876164,07/11/2020 13:30:00,Twitter Web App,1,0,Ministerio de Salud Pública,13:30:00,http://pbs.twimg.com/profile_images/1311755159027015685/QQcxgYd1.jpg
"#COVID19 | Recomendaciones para las personas albergadas 

#Eta #MSPAS https://t.co/ojnxNX7CsM",https://twitter.com/i/web/status/1325171006181347334,07/11/2020 14:19:23,Twitter for iPhone,3,2,Ministerio de Salud Pública,14:19:23,http://pbs.twimg.com/profile_images/1311755159027015685/QQcxgYd1.jpg
"El Proyecto de #Presupuesto2021GT incluye un capítulo de #ReactivaciónEconómica y social, orientado a recuperar la… https://t.co/4FFhmLFHix",https://twitter.com/i/web/status/1325172629687373826,07/11/2020 14:25:50,Twitter for Android,1,1,Minfin Guatemala,14:25:50,http://pbs.twimg.com/profile_images/1292831294796320768/6Q8j5vtW.jpg
"Chaya’ ub’ixik loq wexa’ k’o b’anoj k’ax kab’an chi ke e ri’j taq winaq ri’

¡Chaya ub’ixik ☎️ pa le 110 ó 1572!… https://t.co/GGJsz3e9oH",https://twitter.com/i/web/status/1325181233115131904,07/11/2020 15:00:01,Twitter Media Studio,0,0,MinGob,15:00:01,http://pbs.twimg.com/profile_images/1219274761961951237/aSdvPUzB.jpg
"Cuidemos la salud de nuestros niños y niñas convirtiendo su comida en #SuperAlimento. 👶🏻👧🏻

Acude a tu Servicio de… https://t.co/9fFKENCbYK",https://twitter.com/i/web/status/1325181233006055427,07/11/2020 15:00:01,Twitter Web App,4,3,Ministerio de Salud Pública,15:00:01,http://pbs.twimg.com/profile_images/1311755159027015685/QQcxgYd1.jpg
"Sin importar el tiempo, los caminos, los obstáculos, incluso hasta el cansancio, seguiremos  trabajando por ayudar… https://t.co/wJowbQcN0k",https://twitter.com/i/web/status/1325185335114956801,07/11/2020 15:16:19,TweetDeck,32,7,Gobierno Guatemala,15:16:19,http://pbs.twimg.com/profile_images/1292921828256735234/sNXpArrM.jpg
RT @DrGiammattei: No hemos descansado en buscar apoyo y de coordinar toda la ayuda necesaria. Gracias a todas las instituciones públicas y…,https://twitter.com/i/web/status/1325185950629158912,07/11/2020 15:18:46,Twitter for iPhone,0,12,MinGob,15:18:46,http://pbs.twimg.com/profile_images/1219274761961951237/aSdvPUzB.jpg
RT @PNCdeGuatemala: La ayuda humanitaria continúa siendo trasladada a través de helicópteros de la PNC a los lugares más afectados del país…,https://twitter.com/i/web/status/1325186035828072450,07/11/2020 15:19:06,Twitter for iPhone,0,4,MinGob,15:19:06,http://pbs.twimg.com/profile_images/1219274761961951237/aSdvPUzB.jpg
El @GuatemalaGob extiende sus felicitaciones a @JoeBiden por su elección como Presidente y a @KamalaHarris como vic… https://t.co/PCDCIB6zsy,https://twitter.com/i/web/status/1325187667659640835,07/11/2020 15:25:35,Twitter for Android,29,17,MINEX Guatemala 🇬🇹,15:25:35,http://pbs.twimg.com/profile_images/1292832595093475329/6LQbTy36.jpg
El @GuatemalaGob extiende sus felicitaciones a @JoeBiden por su elección como Presidente y a @KamalaHarris como vic… https://t.co/RAD0aHS881,https://twitter.com/i/web/status/1325187869170806785,07/11/2020 15:26:23,Twitter for Android,85,25,Gobierno Guatemala,15:26:23,http://pbs.twimg.com/profile_images/1292921828256735234/sNXpArrM.jpg
"Sistema de Alertas Sanitarias COVID-19 | TRANSPORTE 🚌🚎

Conoce aquí las restricciones para el sector de transporte… https://t.co/dUWXvQXwKl",https://twitter.com/i/web/status/1325192553587761152,07/11/2020 15:45:00,Twitter Web App,3,2,Ministerio de Salud Pública,15:45:00,http://pbs.twimg.com/profile_images/1311755159027015685/QQcxgYd1.jpg
"RT @DrGiammattei: Me congratulo con el pueblo de Estados Unidos por la demostración de democracia, y felicito a @JoeBiden y a @KamalaHarris…",https://twitter.com/i/web/status/1325194181371813888,07/11/2020 15:51:28,Twitter for iPhone,0,116,MINEX Guatemala 🇬🇹,15:51:28,http://pbs.twimg.com/profile_images/1292832595093475329/6LQbTy36.jpg
RT @GuatemalaGob: El @GuatemalaGob extiende sus felicitaciones a @JoeBiden por su elección como Presidente y a @KamalaHarris como vicepresi…,https://twitter.com/i/web/status/1325196201281589248,07/11/2020 15:59:29,Twitter for Android,0,25,MINEX Guatemala 🇬🇹,15:59:29,http://pbs.twimg.com/profile_images/1292832595093475329/6LQbTy36.jpg
"En aldea Nueva Esperanza, El Estor, Izabal, una mujer embarazada fue rescatada por elementos del ejército, luego de… https://t.co/miEgUiMl0s",https://twitter.com/i/web/status/1325196328209584129,07/11/2020 16:00:00,TweetDeck,19,6,Gobierno Guatemala,16:00:00,http://pbs.twimg.com/profile_images/1292921828256735234/sNXpArrM.jpg
#Pasaportes | Compartimos los pasos para hacer la cita en línea para emisión de pasaporte. Puedes hacer en el sigui… https://t.co/7ilv7aNv4l,https://twitter.com/i/web/status/1325196378209832962,07/11/2020 16:00:12,Hootsuite Inc.,3,0,Migración Guatemala,16:00:12,http://pbs.twimg.com/profile_images/1290300788347146241/7sOKfiDS.jpg
"En el #MinfinGT, bajo la visión y liderazgo del Presidente @DrGiammattei, contribuimos a las prontas acciones de ay… https://t.co/bvz7vLJAXe",https://twitter.com/i/web/status/1325202884640829440,07/11/2020 16:26:03,Twitter for Android,3,2,Minfin Guatemala,16:26:03,http://pbs.twimg.com/profile_images/1292831294796320768/6Q8j5vtW.jpg
".@PNCdeGuatemala en un trabajo interinstitucional donde participan el Ejército de Guatemala, cuerpos de socorro y h… https://t.co/Sqg6xfh2wx",https://twitter.com/i/web/status/1325203209925746688,07/11/2020 16:27:20,Twitter for iPhone,9,1,MinGob,16:27:20,http://pbs.twimg.com/profile_images/1219274761961951237/aSdvPUzB.jpg
"¿Qué son los rastreadores de casos y contactos COVID-19? 😷

Es personal capacitado que identifica y da seguimiento… https://t.co/b6GVNjXA09",https://twitter.com/i/web/status/1325203878460203008,07/11/2020 16:30:00,Twitter Web App,4,3,Ministerio de Salud Pública,16:30:00,http://pbs.twimg.com/profile_images/1311755159027015685/QQcxgYd1.jpg
Agentes de prevención entregan raciones frías y calzado a personas albergadas en Alta Verapaz https://t.co/Doq9crc81G,https://twitter.com/i/web/status/1325207322822545410,07/11/2020 16:43:41,"<a href=""http://publicize.wp.com/"" rel=""nofollow"">WordPress.com",0,0,MinGob,16:43:41,http://pbs.twimg.com/profile_images/1219274761961951237/aSdvPUzB.jpg
Recomendaciones #MSPAS | Cómo reducir riesgos durante el tiempo que dure la emergencia #Eta https://t.co/zrclojFA7s,https://twitter.com/i/web/status/1325214144878968833,07/11/2020 17:10:48,Twitter for iPhone,3,3,Ministerio de Salud Pública,17:10:48,http://pbs.twimg.com/profile_images/1311755159027015685/QQcxgYd1.jpg
Agradecemos el apoyo del @Southcom y la @usembassyguate para hacer posibles las labores de rescate. Esta tarde lleg… https://t.co/XenbhTFo30,https://twitter.com/i/web/status/1325215326141882369,07/11/2020 17:15:29,Twitter for iPhone,57,10,MINEX Guatemala 🇬🇹,17:15:29,http://pbs.twimg.com/profile_images/1292832595093475329/6LQbTy36.jpg
"En época de lluvia ¡Cuida tu salud! 👇🏻

#PrevenciónLluvias ☔️ 🌧 https://t.co/8nMaLEBKdZ",https://twitter.com/i/web/status/1325222752241012737,07/11/2020 17:45:00,Twitter Web App,7,4,Ministerio de Salud Pública,17:45:00,http://pbs.twimg.com/profile_images/1311755159027015685/QQcxgYd1.jpg
Familias que habitaban en las bananeras de Izabal y tras quedar atrapadas por las inundaciones fueron rescatadas po… https://t.co/8ZVRUeq4Ud,https://twitter.com/i/web/status/1325225507747663874,07/11/2020 17:55:57,Twitter Media Studio,17,5,Gobierno Guatemala,17:55:57,http://pbs.twimg.com/profile_images/1292921828256735234/sNXpArrM.jpg
"Gestiona tus #AntecedentesPolicialesGT en línea, a través del portal https://t.co/5u4MNgMmZN, desde tu computadora… https://t.co/qzLvAXCUoX",https://twitter.com/i/web/status/1325226529320824838,07/11/2020 18:00:00,TweetDeck,0,1,MinGob,18:00:00,http://pbs.twimg.com/profile_images/1219274761961951237/aSdvPUzB.jpg
"Para el presidente @DrGiammattei y el Gobierno de Guatemala, hay un compromiso profundo por apoyar y llegar a cada… https://t.co/BzcjBLY4GE",https://twitter.com/i/web/status/1325227534116478976,07/11/2020 18:04:00,TweetDeck,31,5,Gobierno Guatemala,18:04:00,http://pbs.twimg.com/profile_images/1292921828256735234/sNXpArrM.jpg
Recomendaciones #MSPAS | Cómo reducir riesgos durante el tiempo que dure la emergencia #Eta https://t.co/85GKsgRpzO,https://twitter.com/i/web/status/1325230261450240000,07/11/2020 18:14:50,Twitter for iPhone,5,4,Ministerio de Salud Pública,18:14:50,http://pbs.twimg.com/profile_images/1311755159027015685/QQcxgYd1.jpg
"Todas las mujeres deben de denunciar cualquier tipo de violencia

¡Denuncia ☎️ al 110 ó 1572!
#NOmasViolencia ❌
Cc.… https://t.co/GyNS8zH6YT",https://twitter.com/i/web/status/1325241628903301120,07/11/2020 19:00:00,Twitter Media Studio,4,0,MinGob,19:00:00,http://pbs.twimg.com/profile_images/1219274761961951237/aSdvPUzB.jpg
Recomendaciones #MSPAS | Cómo reducir riesgos durante el tiempo que dure la emergencia #Eta https://t.co/dsAN2nLOPW,https://twitter.com/i/web/status/1325247186448359425,07/11/2020 19:22:05,Twitter for iPhone,6,3,Ministerio de Salud Pública,19:22:05,http://pbs.twimg.com/profile_images/1311755159027015685/QQcxgYd1.jpg
#FuerzaGuate 🇬🇹 https://t.co/TvvYAJ1SaQ,https://twitter.com/i/web/status/1325262023026946049,07/11/2020 20:21:03,Twitter for Android,26,2,Gobierno Guatemala,20:21:03,http://pbs.twimg.com/profile_images/1292921828256735234/sNXpArrM.jpg
"El #LaboratorioMóvil continúa mañana 8 de noviembre 2020 en El Tejar, #Chimaltenango de 7:00 a 15:30 horas 

Si pre… https://t.co/nT3eKVJ5ov",https://twitter.com/i/web/status/1325268864867983360,07/11/2020 20:48:14,Twitter for iPhone,5,3,Ministerio de Salud Pública,20:48:14,http://pbs.twimg.com/profile_images/1311755159027015685/QQcxgYd1.jpg
#FuerzaGuate 🇬🇹 https://t.co/yR5HwVADsg,https://twitter.com/i/web/status/1325277392198373377,07/11/2020 21:22:07,Twitter for Android,34,5,Gobierno Guatemala,21:22:07,http://pbs.twimg.com/profile_images/1292921828256735234/sNXpArrM.jpg
Porque nadie se queda atrás. El @Ejercito_GT rescató a una familia que fue afectada por la depresión tropical Eta.… https://t.co/3iR3YFBDHQ,https://twitter.com/i/web/status/1325280401561153536,07/11/2020 21:34:04,Twitter for Android,41,7,Gobierno Guatemala,21:34:04,http://pbs.twimg.com/profile_images/1292921828256735234/sNXpArrM.jpg
"RT @GuatemalaGob: Porque nadie se queda atrás. El @Ejercito_GT rescató a una familia que fue afectada por la depresión tropical Eta.
#Fuerz…",https://twitter.com/i/web/status/1325280444636680192,07/11/2020 21:34:15,Twitter for Android,0,7,Ejército Guatemala,21:34:15,http://pbs.twimg.com/profile_images/1319662500535803906/WdyAkHlu.jpg
#EjércitoGT a través de la Brigada Especial de Operaciones de Selva apoyó a la población afectada por la… https://t.co/ozcuZaaffi,https://twitter.com/i/web/status/1325281536502083586,07/11/2020 21:38:35,Twitter for Android,12,3,Ejército Guatemala,21:38:35,http://pbs.twimg.com/profile_images/1319662500535803906/WdyAkHlu.jpg
"El ministro de la Defensa, Juan Carlos Alemán, agradece el apoyo de instituciones públicas y privadas que han colab… https://t.co/FMTchG7gzp",https://twitter.com/i/web/status/1325282109641138177,07/11/2020 21:40:52,Twitter for Android,27,7,Gobierno Guatemala,21:40:52,http://pbs.twimg.com/profile_images/1292921828256735234/sNXpArrM.jpg
"Viceministro de Seguridad, @Henry87667604, apoya y respalda el trabajo que realizan agentes de @PNCdeGuatemala de l… https://t.co/YhFv2f3bMN",https://twitter.com/i/web/status/1325284002664755210,07/11/2020 21:48:23,Twitter for iPhone,6,2,MinGob,21:48:23,http://pbs.twimg.com/profile_images/1219274761961951237/aSdvPUzB.jpg
"#EjércitoGT a través de la Primera Brigada de Policía Militar ""Guardia de Honor"", continúa apoyando en la carga de… https://t.co/D6V1iZDFSo",https://twitter.com/i/web/status/1325284186643697666,07/11/2020 21:49:07,Twitter for Android,8,1,Ejército Guatemala,21:49:07,http://pbs.twimg.com/profile_images/1319662500535803906/WdyAkHlu.jpg
#EjércitoGT a través de la Sexta Brigada de Infantería apoyó en la evacuación de familias afectadas por inundación… https://t.co/mz9CSx9weI,https://twitter.com/i/web/status/1325286572363804672,07/11/2020 21:58:36,Twitter for Android,23,4,Ejército Guatemala,21:58:36,http://pbs.twimg.com/profile_images/1319662500535803906/WdyAkHlu.jpg
"#EjércitoGT a través de Reservas Militares Departamentales, realizó actividades en apoyo a la implementación de med… https://t.co/FbAfTZHIZP",https://twitter.com/i/web/status/1325288117440548864,07/11/2020 22:04:44,Twitter for Android,5,1,Ejército Guatemala,22:04:44,http://pbs.twimg.com/profile_images/1319662500535803906/WdyAkHlu.jpg
"#EjércitoGT a través de Reservas Militares de #Izabal, apoyó en la evacuación de familias damnificadas por la… https://t.co/xkmbey4CPo",https://twitter.com/i/web/status/1325291566127329283,07/11/2020 22:18:26,Twitter for Android,11,2,Ejército Guatemala,22:18:26,http://pbs.twimg.com/profile_images/1319662500535803906/WdyAkHlu.jpg
"Primera Brigada de Infantería ""General Luis García León"". https://t.co/t0Vo4VdAqD",https://twitter.com/i/web/status/1325292064570028032,07/11/2020 22:20:25,Twitter for Android,4,1,Ejército Guatemala,22:20:25,http://pbs.twimg.com/profile_images/1319662500535803906/WdyAkHlu.jpg
#FuerzaGuate 🇬🇹 https://t.co/1TmxxjKAsw,https://twitter.com/i/web/status/1325292238147121153,07/11/2020 22:21:06,Twitter for Android,26,1,Gobierno Guatemala,22:21:06,http://pbs.twimg.com/profile_images/1292921828256735234/sNXpArrM.jpg
"RT @GuatemalaGob: El ministro de la Defensa, Juan Carlos Alemán, agradece el apoyo de instituciones públicas y privadas que han colaborado…",https://twitter.com/i/web/status/1325294761692028929,07/11/2020 22:31:08,Twitter for Android,0,7,Ejército Guatemala,22:31:08,http://pbs.twimg.com/profile_images/1319662500535803906/WdyAkHlu.jpg
RT @GuatemalaGob: #FuerzaGuate 🇬🇹,https://twitter.com/i/web/status/1325294802972233733,07/11/2020 22:31:18,Twitter for Android,0,5,Ejército Guatemala,22:31:18,http://pbs.twimg.com/profile_images/1319662500535803906/WdyAkHlu.jpg
#EjércitoGT a través del Cuerpo de Ingenieros y Guardia Presidencial apoyan en la descarga de insumos para bolsas d… https://t.co/Fd5YXyckrQ,https://twitter.com/i/web/status/1325299183474118656,07/11/2020 22:48:42,Twitter for Android,11,3,Ejército Guatemala,22:48:42,http://pbs.twimg.com/profile_images/1319662500535803906/WdyAkHlu.jpg
