Contenido,IR,Fecha,Dispositivo,Likes,Retweets,Entidad,Hora,Foto
#Retornados | Compartimos la historia de una guatemalteca que retornó a nuestro país y está siendo atendida en el a… https://t.co/klC7pqdvUC,https://twitter.com/i/web/status/1288994438270922752,30/07/2020 18:26:37,Twitter for Android,5,4,Migración Guatemala,18:26:37,http://pbs.twimg.com/profile_images/1219655611463491587/s7Aze-TV.jpg
"#Retornados | Desde el 13 de marzo a la fecha 7,696 personas, tanto vía aérea como terrestre. https://t.co/WtXgUVEg8H",https://twitter.com/i/web/status/1289003098137137152,30/07/2020 19:01:01,Hootsuite Inc.,1,1,Migración Guatemala,19:01:01,http://pbs.twimg.com/profile_images/1219655611463491587/s7Aze-TV.jpg
"#Información | Por tu salud y la nuestra, los servicios migratorios que se prestan en los Centros de Emisión de Pas… https://t.co/yXZFiSeh9u",https://twitter.com/i/web/status/1289184291155521536,31/07/2020 07:01:01,Hootsuite Inc.,2,0,Migración Guatemala,07:01:01,http://pbs.twimg.com/profile_images/1219655611463491587/s7Aze-TV.jpg
"#JuntosSaldremosAdelante, para demostrar que #GuatemalaNoSeDetiene https://t.co/rxEXRGm4Da",https://twitter.com/i/web/status/1289209050190745600,31/07/2020 08:39:24,Twitter for Android,6,3,Ministerio Economía,08:39:24,http://pbs.twimg.com/profile_images/1219303221803528198/BEKXsgxy.jpg
"#Delegaciones | La delegación migratoria de El Florido, permanecerá cerrada este día por un proceso de desinfección… https://t.co/mz3F9fnFBj",https://twitter.com/i/web/status/1289214549468438528,31/07/2020 09:01:15,Hootsuite Inc.,1,1,Migración Guatemala,09:01:15,http://pbs.twimg.com/profile_images/1219655611463491587/s7Aze-TV.jpg
"El Ministro de Finanzas, Alvaro González Ricci, los Viceministros y la familia financista lamentan profundamente el… https://t.co/ATOnjTdkRG",https://twitter.com/i/web/status/1289234903637270529,31/07/2020 10:22:08,Twitter for Android,13,0,Minfin Guatemala,10:22:08,http://pbs.twimg.com/profile_images/1219297807565230081/1USnYWKO.png
"#Esquela | Lamentamos el sensible fallecimiento de uno de nuestros delegados en Tecún Umán, San Marcos. https://t.co/7kk69PMsj0",https://twitter.com/i/web/status/1289239127519420416,31/07/2020 10:38:55,Hootsuite Inc.,5,1,Migración Guatemala,10:38:55,http://pbs.twimg.com/profile_images/1219655611463491587/s7Aze-TV.jpg
"Recuerda que con el uso correcto de la mascarilla evitamos el contagio del #Covid19. 
#JuntosSaldremosAdelante https://t.co/SJ4zx069K3",https://twitter.com/i/web/status/1289268298979262466,31/07/2020 12:34:50,Twitter for Android,1,0,Minfin Guatemala,12:34:50,http://pbs.twimg.com/profile_images/1219297807565230081/1USnYWKO.png
"#Pasaportes | 🇱🇷 Garantizamos la emisión de pasaportes en Estados Unidos, conoce los consulados en donde se imprime… https://t.co/MJ48LSkfiq",https://twitter.com/i/web/status/1289269632910622720,31/07/2020 12:40:08,Hootsuite Inc.,4,0,Migración Guatemala,12:40:08,http://pbs.twimg.com/profile_images/1219655611463491587/s7Aze-TV.jpg
"✅ ""Ahora es más que nunca que debemos asumir e implementar las medidas sanitarias y económicas necesarias para abor… https://t.co/XZs8qMFOqC",https://twitter.com/i/web/status/1289289731746885632,31/07/2020 14:00:00,TweetDeck,21,15,OPS/OMS,14:00:00,http://pbs.twimg.com/profile_images/1096094749902028801/ijbQWupW.png
RT @MigracionHND: Comunicado Importante 👉🏻 https://t.co/98rrXTYA7s,https://twitter.com/i/web/status/1289295094000975872,31/07/2020 14:21:19,Twitter Web App,0,14,Migración Guatemala,14:21:19,http://pbs.twimg.com/profile_images/1219655611463491587/s7Aze-TV.jpg
RT @opsargentina: No te pierdas el miércoles 5 de agosto a las 11 hs el lanzamiento del suplemento especial COVID-19 de la Revista Argentin…,https://twitter.com/i/web/status/1289305775429435393,31/07/2020 15:03:45,Twitter for iPhone,0,8,OPS/OMS,15:03:45,http://pbs.twimg.com/profile_images/1096094749902028801/ijbQWupW.png
"RT @OPSOMSPeru: 💻 Nuevo curso virtual (gratuito):

✅ Derechos humanos de las personas mayores: Conocimientos para el análisis y para la acc…",https://twitter.com/i/web/status/1289305803929686016,31/07/2020 15:03:52,Twitter for iPhone,0,4,OPS/OMS,15:03:52,http://pbs.twimg.com/profile_images/1096094749902028801/ijbQWupW.png
"RT @OPSOMSBolivia: COVID-19 ha traído muchos cambios a nuestras vidas, pero algunas cosas no deberían cambiar.

Si tienes diabetes o hipert…",https://twitter.com/i/web/status/1289305824683204609,31/07/2020 15:03:57,Twitter for iPhone,0,6,OPS/OMS,15:03:57,http://pbs.twimg.com/profile_images/1096094749902028801/ijbQWupW.png
RT @OPSGuate: @OPSGuate firma convenio de cooperación con Instituto Guatemalteco de Seguridad Social para la mejora de servicios y prestaci…,https://twitter.com/i/web/status/1289305893398384640,31/07/2020 15:04:13,Twitter for iPhone,0,10,OPS/OMS,15:04:13,http://pbs.twimg.com/profile_images/1096094749902028801/ijbQWupW.png
RT @OPSOMSBolivia: COVID-19 👉🏽 La nueva normalidad ... mantente saludable 🙋🏻‍♀️ 🙋🏾‍♂️ y ayuda a prevenir la propagación de #COVID19 en todo…,https://twitter.com/i/web/status/1289305906342064128,31/07/2020 15:04:16,Twitter for iPhone,0,16,OPS/OMS,15:04:16,http://pbs.twimg.com/profile_images/1096094749902028801/ijbQWupW.png
"RT @OPSECU: 📍 La nueva normalidad  👉🏽 Trabajador de salud 👩🏾‍⚕️🧑🏻‍⚕️ 🧍🏼‍♀️🧍🏼, recuerda que  el riesgo de contraer COVID-19 existe aún cuand…",https://twitter.com/i/web/status/1289305922502762496,31/07/2020 15:04:20,Twitter for iPhone,0,22,OPS/OMS,15:04:20,http://pbs.twimg.com/profile_images/1096094749902028801/ijbQWupW.png
"RT @OPSGuate: Agradecemos al personal de @conred, Fuerza Aérea Guatemalteca (FAG) y @MinexGt por el apoyo logístico brindado durante la ent…",https://twitter.com/i/web/status/1289305973723545600,31/07/2020 15:04:32,Twitter for iPhone,0,4,OPS/OMS,15:04:32,http://pbs.twimg.com/profile_images/1096094749902028801/ijbQWupW.png
"RT @PRONACOMGT: El Comisionado @rpaizk sostuvo una reunión con el alcalde de San José, Escuintla, Sr. Marco Vinicio Najarro, en donde se pr…",https://twitter.com/i/web/status/1289314306211758082,31/07/2020 15:37:39,Twitter for Android,0,4,Gobierno Guatemala,15:37:39,http://pbs.twimg.com/profile_images/1220379425516195840/KwahSLS-.png
"RT @CIVguate: Seguidamente iniciaremos los trabajos, que durante 10 años habían estado abandonados, y en 6 meses de Gobierno, con arduo tra…",https://twitter.com/i/web/status/1289314430572871681,31/07/2020 15:38:09,Twitter for Android,0,4,Gobierno Guatemala,15:38:09,http://pbs.twimg.com/profile_images/1220379425516195840/KwahSLS-.png
"Las fuerzas de mar del @Ejercito_GT, en coordinación con la Armada de Estados Unidos, realizó una práctica naval co… https://t.co/CrRsQB4shl",https://twitter.com/i/web/status/1289327479501418498,31/07/2020 16:30:00,TweetDeck,10,3,Gobierno Guatemala,16:30:00,http://pbs.twimg.com/profile_images/1220379425516195840/KwahSLS-.png
El Registro de Prestadores de Servicios de Certificación -RPSC- impartió capacitación a Directores Ejecutivos de Ba… https://t.co/OC3lwwHxVi,https://twitter.com/i/web/status/1289334607326744576,31/07/2020 16:58:19,Twitter for Android,0,1,Ministerio Economía,16:58:19,http://pbs.twimg.com/profile_images/1219303221803528198/BEKXsgxy.jpg
"El programa de Huertos Familiares ha llegado a 447 comunidades de
todo el país y a través del programa de semillas… https://t.co/GGMr7cLrNr",https://twitter.com/i/web/status/1289342579331534848,31/07/2020 17:30:00,TweetDeck,14,4,Gobierno Guatemala,17:30:00,http://pbs.twimg.com/profile_images/1220379425516195840/KwahSLS-.png
"El Ministro de Finanzas Públicas, @alvarogricci se refirió a las etapas y acciones estratégicas para la… https://t.co/ISXCywcm8E",https://twitter.com/i/web/status/1289345853778546689,31/07/2020 17:43:01,Twitter for Android,4,0,Minfin Guatemala,17:43:01,http://pbs.twimg.com/profile_images/1219297807565230081/1USnYWKO.png
"El Ministro de Finanzas Públicas, @alvarogricci participa en evento organizado por el Club Rotario Guatemala del Es… https://t.co/qClVFUvSDF",https://twitter.com/i/web/status/1289349943157637120,31/07/2020 17:59:16,Twitter for Android,5,1,Minfin Guatemala,17:59:16,http://pbs.twimg.com/profile_images/1219297807565230081/1USnYWKO.png
"Viceministro de las Mipymes Ernesto Morales, se reúne con  Alcalde de la Municipalidad de Puerto San José, para coo… https://t.co/Pxe299g5yT",https://twitter.com/i/web/status/1289356392130732032,31/07/2020 18:24:53,Twitter for Android,3,3,Ministerio Economía,18:24:53,http://pbs.twimg.com/profile_images/1219303221803528198/BEKXsgxy.jpg
"El Presidente @DrGiammattei a la población en general informa.

#JuntosSaldremosAdelante https://t.co/eZSMv0n5jL",https://twitter.com/i/web/status/1289379906485444609,31/07/2020 19:58:19,Twitter for Android,205,54,Gobierno Guatemala,19:58:19,http://pbs.twimg.com/profile_images/1220379425516195840/KwahSLS-.png
"El Ministro de Finanzas, @alvarogricci comentó sobre los protocolos y fases para la actividad económica en todos lo… https://t.co/vHleiJP32a",https://twitter.com/i/web/status/1289382100701831168,31/07/2020 20:07:03,Twitter for Android,3,0,Minfin Guatemala,20:07:03,http://pbs.twimg.com/profile_images/1219297807565230081/1USnYWKO.png
"¡Yo valgo y soy importante! 

En tiempos de #COVID19, cuido mi salud mental. 🧠 

#JuntosSaldremosAdelante #MSPAS https://t.co/51460XR9qI",https://twitter.com/i/web/status/1289382779545935873,31/07/2020 20:09:44,Twitter for iPhone,25,6,Ministerio de Salud Pública,20:09:44,http://pbs.twimg.com/profile_images/1219336233689780224/jXtTZnsi.jpg
"Presidente @DrGiammattei a la población en general informa.

#JuntosSaldremosAdelante https://t.co/jIVeuSpjPu",https://twitter.com/i/web/status/1289383191002849283,31/07/2020 20:11:22,Twitter for Android,148,57,Gobierno Guatemala,20:11:22,http://pbs.twimg.com/profile_images/1220379425516195840/KwahSLS-.png
"El Ministro de Finanzas, @alvarogricci afirmó que el manejo prudente de las finanzas públicas ha permitido enfrenta… https://t.co/RB6fJXqBR3",https://twitter.com/i/web/status/1289401485806059520,31/07/2020 21:24:04,Twitter for Android,6,1,Minfin Guatemala,21:24:04,http://pbs.twimg.com/profile_images/1219297807565230081/1USnYWKO.png
"RT @GuatemalaGob: El Presidente @DrGiammattei a la población en general informa.

#JuntosSaldremosAdelante https://t.co/eZSMv0n5jL",https://twitter.com/i/web/status/1289404304554512384,31/07/2020 21:35:16,Twitter for Android,0,54,Ministerio Economía,21:35:16,http://pbs.twimg.com/profile_images/1219303221803528198/BEKXsgxy.jpg
"#NotaDeDuelo | Lamentamos el fallecimiento de el Dr. Carlos Augusto Castellanos Salvatierra, Coordinador del Centro… https://t.co/MYZzKU1z7s",https://twitter.com/i/web/status/1289408259170992129,31/07/2020 21:50:59,Twitter for iPhone,37,5,Ministerio de Salud Pública,21:50:59,http://pbs.twimg.com/profile_images/1219336233689780224/jXtTZnsi.jpg
"#NoticiasMSPAS | MSPAS busca adquirir pruebas rápidas para la detección de antígeno viral

Más información 👉… https://t.co/DD0bsPU6Nk",https://twitter.com/i/web/status/1289409023087869954,31/07/2020 21:54:01,Twitter Web App,16,2,Ministerio de Salud Pública,21:54:01,http://pbs.twimg.com/profile_images/1219336233689780224/jXtTZnsi.jpg
"RT @DrGiammattei: Como Presidente de la República de Guatemala, a la población en general informo:

#JuntosSaldremosAdelante https://t.co/3…",https://twitter.com/i/web/status/1289539036634218503,01/08/2020 06:30:39,Twitter for Android,0,88,Ministerio de Salud Pública,06:30:39,http://pbs.twimg.com/profile_images/1219336233689780224/jXtTZnsi.jpg
Muchas gracias @TW__Guatemala por su amistad y constante apoyo. #JuntosSaldremosAdelante https://t.co/QQUR8JZuan,https://twitter.com/i/web/status/1289556255095189504,01/08/2020 07:39:04,Twitter for Android,26,6,MINEX Guatemala 🇬🇹,07:39:04,http://pbs.twimg.com/profile_images/1220460259074105355/flDmdBSG.jpg
"En San Agustín Acasaguastlán, El Progreso, así como en varios sectores de Sacatepéquez y Jalapa, agentes de la Poli… https://t.co/68x2VxDSMt",https://twitter.com/i/web/status/1289556535216164864,01/08/2020 07:40:11,Twitter for iPhone,2,1,MinGob,07:40:11,http://pbs.twimg.com/profile_images/1219274761961951237/aSdvPUzB.jpg
"""Esta pandemia ha sido alimentada por la desigualdad y ha dejado al descubierto cómo las personas de 🌎 se están que… https://t.co/6AZ6UuYSKS",https://twitter.com/i/web/status/1289561526173667328,01/08/2020 08:00:01,TweetDeck,39,35,OPS/OMS,08:00:01,http://pbs.twimg.com/profile_images/1096094749902028801/ijbQWupW.png
"✅ El coronavirus afecta los pulmones. 
✅ Si tienes asma moderada o grave tienes más riesgo de desarrollar una enfer… https://t.co/H265N0jhLO",https://twitter.com/i/web/status/1289570782654291970,01/08/2020 08:36:48,Twitter for iPhone,178,164,OPS/OMS,08:36:48,http://pbs.twimg.com/profile_images/1096094749902028801/ijbQWupW.png
Recuerda que el uso correcto de la mascarilla es importante para prevenir el contagio del #Covid19.… https://t.co/0fOP8awIKz,https://twitter.com/i/web/status/1289574526645202946,01/08/2020 08:51:40,Twitter for Android,0,1,Minfin Guatemala,08:51:40,http://pbs.twimg.com/profile_images/1219297807565230081/1USnYWKO.png
"El Ministerio de Economía finaliza el mes de julio, con la aprobación de Q200,0 millones en créditos dirigidos a em… https://t.co/ApxP7Efqdm",https://twitter.com/i/web/status/1289575535694057475,01/08/2020 08:55:41,Twitter for Android,7,5,Ministerio Economía,08:55:41,http://pbs.twimg.com/profile_images/1219303221803528198/BEKXsgxy.jpg
#Actualizacion| #MSPAS informa este 1 de agosto de 2020 los casos confirmados por laboratorio y datos de las última… https://t.co/VYJ9tCDBTt,https://twitter.com/i/web/status/1289576785211019264,01/08/2020 09:00:39,Twitter for iPhone,43,21,Ministerio de Salud Pública,09:00:39,http://pbs.twimg.com/profile_images/1219336233689780224/jXtTZnsi.jpg
RT @MinSaludGuate: #Actualizacion| #MSPAS informa este 1 de agosto de 2020 los casos confirmados por laboratorio y datos de las últimas 24…,https://twitter.com/i/web/status/1289577955249623041,01/08/2020 09:05:18,Twitter for iPhone,0,21,MinGob,09:05:18,http://pbs.twimg.com/profile_images/1219274761961951237/aSdvPUzB.jpg
Salvadoreños buscados en su país son captados en Guatemala https://t.co/5qgX7ru5vJ,https://twitter.com/i/web/status/1289584685669122049,01/08/2020 09:32:03,"<a href=""http://publicize.wp.com/"" rel=""nofollow"">WordPress.com",1,0,MinGob,09:32:03,http://pbs.twimg.com/profile_images/1219274761961951237/aSdvPUzB.jpg
PNC y vecinos construyen vivienda en Sololá https://t.co/iy6PMBWTXt,https://twitter.com/i/web/status/1289585500781555712,01/08/2020 09:35:17,"<a href=""http://publicize.wp.com/"" rel=""nofollow"">WordPress.com",4,2,MinGob,09:35:17,http://pbs.twimg.com/profile_images/1219274761961951237/aSdvPUzB.jpg
#GuatemalaNoSeDetiene | Recuerda usar correctamente la mascarilla cubriendo boca y nariz. 😷 #JuntosSaldremosAdelante https://t.co/5FnbVlhTgy,https://twitter.com/i/web/status/1289591723153412097,01/08/2020 10:00:00,TweetDeck,0,1,MINEX Guatemala 🇬🇹,10:00:00,http://pbs.twimg.com/profile_images/1220460259074105355/flDmdBSG.jpg
Thank You @IndiaInGuate for your frienship and helping hand. #JuntosSaldremosAdelante  #GuatemalaNoSeDetiene https://t.co/oehxXMzLy5,https://twitter.com/i/web/status/1289592270337998849,01/08/2020 10:02:11,Twitter for Android,5,4,MINEX Guatemala 🇬🇹,10:02:11,http://pbs.twimg.com/profile_images/1220460259074105355/flDmdBSG.jpg
#NoticiasMSPAS | #Sacatepéquez: intensifican la búsqueda de niños y niñas para completar el esquema de vacunación… https://t.co/wBYqS1AYMa,https://twitter.com/i/web/status/1289594159045545986,01/08/2020 10:09:41,Twitter Web App,8,3,Ministerio de Salud Pública,10:09:41,http://pbs.twimg.com/profile_images/1219336233689780224/jXtTZnsi.jpg
Saludamos al pueblo y Gobierno de la República de Benín por la celebración de su Día de Independencia.🇧🇯… https://t.co/cIfJACuCBc,https://twitter.com/i/web/status/1289595495300521984,01/08/2020 10:15:00,TweetDeck,20,2,MINEX Guatemala 🇬🇹,10:15:00,http://pbs.twimg.com/profile_images/1220460259074105355/flDmdBSG.jpg
#EnLinea | Los invitamos a utilizar nuestros servicios en línea ingresando a: https://t.co/4Gtec6XXlE https://t.co/ADNIV22yoY,https://twitter.com/i/web/status/1289596791587930112,01/08/2020 10:20:09,Hootsuite Inc.,1,0,Migración Guatemala,10:20:09,http://pbs.twimg.com/profile_images/1219655611463491587/s7Aze-TV.jpg
"Recuerda mantener el distanciamiento social. #JuntosSaldremosAdelante
#GuatemalaNoSeDetiene https://t.co/dH866k0Bx7",https://twitter.com/i/web/status/1289598536984616960,01/08/2020 10:27:05,Twitter for Android,1,0,Ministerio Economía,10:27:05,http://pbs.twimg.com/profile_images/1219303221803528198/BEKXsgxy.jpg
Elementos de PNC continúa desarrollando operativos de control vehicular y seguridad en comercios y agencias bancari… https://t.co/WFMhmv5PQc,https://twitter.com/i/web/status/1289602606415769606,01/08/2020 10:43:15,Twitter for iPhone,2,0,MinGob,10:43:15,http://pbs.twimg.com/profile_images/1219274761961951237/aSdvPUzB.jpg
"Feliz Día Nacional a la Confederación Suiza!🇨🇭

@SwissMFA

#SwissNationalDay #1aout #1august #1agosto https://t.co/NezmBqP5IZ",https://twitter.com/i/web/status/1289610594778218502,01/08/2020 11:15:00,TweetDeck,10,2,MINEX Guatemala 🇬🇹,11:15:00,http://pbs.twimg.com/profile_images/1220460259074105355/flDmdBSG.jpg
#Retornados | Se realiza proceso de desinfección en el Albergue  Ramiro de León Carpio. Atender y proteger a la pob… https://t.co/jN4zMcAB0L,https://twitter.com/i/web/status/1289620584251314176,01/08/2020 11:54:41,Hootsuite Inc.,8,1,Migración Guatemala,11:54:41,http://pbs.twimg.com/profile_images/1219655611463491587/s7Aze-TV.jpg
El Ministerio de Gobernación hace la cordial invitación a todas las mujeres guatemaltecas al #CyberWomenChallenge… https://t.co/5Zr6ImfdSL,https://twitter.com/i/web/status/1289621919713681408,01/08/2020 12:00:00,TweetDeck,4,3,MinGob,12:00:00,http://pbs.twimg.com/profile_images/1219274761961951237/aSdvPUzB.jpg
Para atender a nuestra #ComunidadGt en 🇺🇸 iniciamos agosto con la atención en #SábadoConsularGt con servicios de do… https://t.co/kJNO5Xra9g,https://twitter.com/i/web/status/1289622809430249472,01/08/2020 12:03:32,Twitter for Android,3,2,MINEX Guatemala 🇬🇹,12:03:32,http://pbs.twimg.com/profile_images/1220460259074105355/flDmdBSG.jpg
🇧🇯Felicitamos al pueblo y Gobierno de la República de Benín por la celebración de su día de Independencia.🇧🇯 https://t.co/sc8TW6JgdX,https://twitter.com/i/web/status/1289625303904477186,01/08/2020 12:13:27,Twitter for Android,6,1,Ministerio Economía,12:13:27,http://pbs.twimg.com/profile_images/1219303221803528198/BEKXsgxy.jpg
El presidente @DrGiammattei recibió por parte del gobierno de la República de China (Taiwán) la donación de 1 mil t… https://t.co/JjhdcgRNKd,https://twitter.com/i/web/status/1289626399049826304,01/08/2020 12:17:48,Twitter for Android,47,7,Gobierno Guatemala,12:17:48,http://pbs.twimg.com/profile_images/1220379425516195840/KwahSLS-.png
"#PorSiTeLoPerdiste 
El Ministro de Finanzas, @alvarogricci comentó que, con el objetivo de reactivar la economía, p… https://t.co/V23bKERZPG",https://twitter.com/i/web/status/1289626916849254400,01/08/2020 12:19:51,Twitter for Android,2,1,Minfin Guatemala,12:19:51,http://pbs.twimg.com/profile_images/1219297807565230081/1USnYWKO.png
"El Ministerio de Salud Pública y Asistencia Social te comparte los síntomas, formas de contagio y cómo prevenir el… https://t.co/wdDg4a1OOf",https://twitter.com/i/web/status/1289628169822015488,01/08/2020 12:24:50,Twitter for iPhone,6,1,Ministerio de Salud Pública,12:24:50,http://pbs.twimg.com/profile_images/1219336233689780224/jXtTZnsi.jpg
"EL Ministerio de Economía, incrementa Q50, 0 millones al fondo de emergencia Covid-19, para atender la demanda cred… https://t.co/OfZ8HAvL8S",https://twitter.com/i/web/status/1289642152163770368,01/08/2020 13:20:24,Twitter for Android,1,3,Ministerio Economía,13:20:24,http://pbs.twimg.com/profile_images/1219303221803528198/BEKXsgxy.jpg
"RT @EmbCanGuatemala: 👏👏  Recibimos el 2o 🛬 de las @CanadianForces en🇬🇹.
 
🇨🇦 tuvo el privilegio de ayudar a @OPSGuate con el transporte de…",https://twitter.com/i/web/status/1289649302067765248,01/08/2020 13:48:48,Twitter for Android,0,5,MINEX Guatemala 🇬🇹,13:48:48,http://pbs.twimg.com/profile_images/1220460259074105355/flDmdBSG.jpg
"Del 1 al 7 de agosto, Semana Mundial de la Lactancia Materna | Las mujeres con COVID-19 pueden amamantar a su bebé… https://t.co/pXY5MDkgrK",https://twitter.com/i/web/status/1289661038204338176,01/08/2020 14:35:26,Twitter for iPhone,14,6,Ministerio de Salud Pública,14:35:26,http://pbs.twimg.com/profile_images/1219336233689780224/jXtTZnsi.jpg
"🇨🇭Felicitamos en su día, a la Confederación de Suiza .🇨🇭 https://t.co/yf1zMyqGcZ",https://twitter.com/i/web/status/1289664497548918785,01/08/2020 14:49:11,Twitter for Android,10,1,Ministerio Economía,14:49:11,http://pbs.twimg.com/profile_images/1219303221803528198/BEKXsgxy.jpg
"Yo cuido de ti, tú cuidas de ellos y así todos nos cuidamos.

#GuatemalaNoSeDetiene
#YoJuroCuidarLaVida https://t.co/5HJuxBdTsS",https://twitter.com/i/web/status/1289667219094294528,01/08/2020 15:00:00,TweetDeck,0,2,MINEX Guatemala 🇬🇹,15:00:00,http://pbs.twimg.com/profile_images/1220460259074105355/flDmdBSG.jpg
"Conoce las funciones y estructura interna del Ministerio de Finanzas Públicas.
En el #MinfinGT seguimos trabajando… https://t.co/q5MbbSLLJv",https://twitter.com/i/web/status/1289680873307045889,01/08/2020 15:54:15,Twitter for Android,0,2,Minfin Guatemala,15:54:15,http://pbs.twimg.com/profile_images/1219297807565230081/1USnYWKO.png
#EjércitoGT a través de la Tercera Brigada de Infantería realiza patrullajes en distintos puntos del departamento d… https://t.co/tajQJshXZO,https://twitter.com/i/web/status/1289685002469294091,01/08/2020 16:10:40,Twitter for Android,15,4,Ejército Guatemala,16:10:40,http://pbs.twimg.com/profile_images/1254217220038766592/viO6of2l.jpg
#Delegaciones | Se realizó un proceso de desinfección en la delegación migratoria de Valle Nuevo. https://t.co/L8nYeu7sxs,https://twitter.com/i/web/status/1289697618831060992,01/08/2020 17:00:48,Hootsuite Inc.,1,0,Migración Guatemala,17:00:48,http://pbs.twimg.com/profile_images/1219655611463491587/s7Aze-TV.jpg
"Con el compromiso de garantizar la seguridad de todos los ciudadanos, agentes de la Policía Nacional Civil continúa… https://t.co/NXXc7yMEDv",https://twitter.com/i/web/status/1289698011879288832,01/08/2020 17:02:22,Twitter for iPhone,7,0,MinGob,17:02:22,http://pbs.twimg.com/profile_images/1219274761961951237/aSdvPUzB.jpg
"#InformeEconómicoCovid - Conoce las medidas económicas de carácter fiscal, monetaria y de libre competencia que dis… https://t.co/FbnH5oRJbJ",https://twitter.com/i/web/status/1289709143029211136,01/08/2020 17:46:35,Twitter Web App,4,2,Ministerio Economía,17:46:35,http://pbs.twimg.com/profile_images/1219303221803528198/BEKXsgxy.jpg
"El Presidente de la República @DrGiammattei y el Gobierno de Guatemala, expresan sus más sentidas condolencias a la… https://t.co/UvZfnw4FlX",https://twitter.com/i/web/status/1289712821534482436,01/08/2020 18:01:13,Twitter for Android,54,12,Gobierno Guatemala,18:01:13,http://pbs.twimg.com/profile_images/1220379425516195840/KwahSLS-.png
#EjércitoGT a través de la Brigada de Operaciones para Montaña realiza patrullajes en el departamento de #SanMarcos… https://t.co/cAuKIlCBF7,https://twitter.com/i/web/status/1289713360087343105,01/08/2020 18:03:21,Twitter for Android,13,3,Ejército Guatemala,18:03:21,http://pbs.twimg.com/profile_images/1254217220038766592/viO6of2l.jpg
"¡Buenas tardes #Guatemala!🇬🇹

Soldados del #EjércitoGT te saludan. https://t.co/iB085nMEkS",https://twitter.com/i/web/status/1289713782164357120,01/08/2020 18:05:02,Twitter for Android,19,4,Ejército Guatemala,18:05:02,http://pbs.twimg.com/profile_images/1254217220038766592/viO6of2l.jpg
"#MSPAS recibe donación de OPS/OMS y Embajada de Canadá

Áreas de Salud de #Guatemala contarán con pruebas de antíge… https://t.co/AS0872lBU2",https://twitter.com/i/web/status/1289714713991888896,01/08/2020 18:08:44,Twitter for iPhone,11,3,Ministerio de Salud Pública,18:08:44,http://pbs.twimg.com/profile_images/1219336233689780224/jXtTZnsi.jpg
RT @DrGiammattei: En nombre del Gobierno y del pueblo de Guatemala expresamos nuestras más sentidas condolencias por tan irreparable pérdid…,https://twitter.com/i/web/status/1289724710758932480,01/08/2020 18:48:27,Twitter for Android,0,46,MINEX Guatemala 🇬🇹,18:48:27,http://pbs.twimg.com/profile_images/1220460259074105355/flDmdBSG.jpg
"#EjércitoGT a través de la Primera Brigada de Infantería ""Mariscal Zavala"" realiza patrullajes en el departamento d… https://t.co/hs6O0C1Vkj",https://twitter.com/i/web/status/1289726791033266177,01/08/2020 18:56:43,Twitter for Android,19,4,Ejército Guatemala,18:56:43,http://pbs.twimg.com/profile_images/1254217220038766592/viO6of2l.jpg
"Agentes de la Policía Nacional Civil del Grupo de Reacción Inmediata Lobos #GRIL, realizan patrullajes en distintas… https://t.co/FUoXNqf1r9",https://twitter.com/i/web/status/1289726867319091200,01/08/2020 18:57:01,Twitter for iPhone,3,1,MinGob,18:57:01,http://pbs.twimg.com/profile_images/1219274761961951237/aSdvPUzB.jpg
