Contenido,IR,Fecha,Dispositivo,Likes,Retweets,Entidad,Hora,Foto
"""El Presupuesto es el instrumento para hacer realidad los planes de desarrollo"", comentó Carlos Amador, representan… https://t.co/gFMoBxioq8",https://twitter.com/i/web/status/1418588494188974080,23/07/2021 09:07:07,Twitter Web App,5,2,Ministerio de Finanzas Guatemala,09:07:07,http://pbs.twimg.com/profile_images/1292831294796320768/6Q8j5vtW.jpg
"@SoloKarlis @CESGuate @SCSPGT @GuatemalaGob @LegadoBicenGT Gracias por la consulta, toda la información relacionada… https://t.co/tbzLYukXxw",https://twitter.com/i/web/status/1418679333607116808,23/07/2021 15:08:05,Twitter Web App,0,1,Ministerio de Finanzas Guatemala,15:08:05,http://pbs.twimg.com/profile_images/1292831294796320768/6Q8j5vtW.jpg
"RT @opsargentina: Florencia, el recurso digital de la OMS @WHO, puede ayudarte con consejos útiles a planear cómo dejar el tabaco.

🎥👉https…",https://twitter.com/i/web/status/1418709074506653697,23/07/2021 17:06:16,Twitter for iPhone,0,2,OPS/OMS,17:06:16,http://pbs.twimg.com/profile_images/1096094749902028801/ijbQWupW.png
"RT @Ops_Paraguay: COVID-19 🦠 Haces todo 👀 para mantenerte 🧥 🧤🧣 abrigado ➡ hacé todo para mantenerte seguro ⤵️
Protégete y protege a los dem…",https://twitter.com/i/web/status/1418709093007626241,23/07/2021 17:06:20,Twitter for iPhone,0,7,OPS/OMS,17:06:20,http://pbs.twimg.com/profile_images/1096094749902028801/ijbQWupW.png
"RT @opsomsels: Actívate contra el zancudo‼️:  No basta solo eliminar criaderos en tu casa, también pueden haber criaderos en todo la coloni…",https://twitter.com/i/web/status/1418709190885904384,23/07/2021 17:06:44,Twitter for iPhone,0,3,OPS/OMS,17:06:44,http://pbs.twimg.com/profile_images/1096094749902028801/ijbQWupW.png
"RT @ACNURamericas: El equipo olímpico de refugiados @RefugiadosOlympic ya está listo para competir en los #JuegosOlimpicos.

Estos 29 atlet…",https://twitter.com/i/web/status/1418709679589502983,23/07/2021 17:08:40,Twitter for iPhone,0,85,OPS/OMS,17:08:40,http://pbs.twimg.com/profile_images/1096094749902028801/ijbQWupW.png
"Los no fumadores expuestos a humo ajeno tienen riesgo de desarrollar cáncer de pulmón 🫁 

Comprométete a dejarlo po… https://t.co/ynjMzIafJY",https://twitter.com/i/web/status/1418716135374024706,23/07/2021 17:34:19,Twitter for iPhone,30,13,OPS/OMS,17:34:19,http://pbs.twimg.com/profile_images/1096094749902028801/ijbQWupW.png
"""En el proceso de #PresupuestoAbiertoGT la sociedad ejerce un rol importante para la fiscalización de los recursos… https://t.co/ohYVxnibC3",https://twitter.com/i/web/status/1418717902899929088,23/07/2021 17:41:21,Twitter Web App,3,2,Ministerio de Finanzas Guatemala,17:41:21,http://pbs.twimg.com/profile_images/1292831294796320768/6Q8j5vtW.jpg
#OFICIAL | Conoce los centros de vacunación abiertos al público y sus diferentes horarios.… https://t.co/NM0P3Rd7jF,https://twitter.com/i/web/status/1418727908680556546,23/07/2021 18:21:06,Twitter for Android,17,8,Gobierno Guatemala,18:21:06,http://pbs.twimg.com/profile_images/1371488309743120384/QqlgsWUm.jpg
#ViceCancillerGt @eduardoehr dirigió reunión del Plan de actuación de eventos masivos de migración internacional ir… https://t.co/QRYHKfdN5B,https://twitter.com/i/web/status/1418739103793876995,23/07/2021 19:05:35,Twitter Web App,5,2,MINEX Guatemala 🇬🇹,19:05:35,http://pbs.twimg.com/profile_images/1292832595093475329/6LQbTy36.jpg
"@JulioHectorE Gracias por escribirnos @JulioHectorE.
Hemos tomado en cuenta su pregunta por lo que al ingresar a ca… https://t.co/uxjEmsSzPO",https://twitter.com/i/web/status/1418747562828443650,23/07/2021 19:39:12,Twitter Web App,0,0,Ministerio de Finanzas Guatemala,19:39:12,http://pbs.twimg.com/profile_images/1292831294796320768/6Q8j5vtW.jpg
Te invitamos a participar en el primer taller temático del #PresupuestoAbiertoGT: 𝗚𝗲𝗻𝗲𝗿𝗮𝗰𝗶𝗼́𝗻 𝗱𝗲 𝗲𝗺𝗽𝗹𝗲𝗼𝘀 𝘆 𝗿𝗲𝗰𝘂𝗽𝗲𝗿𝗮… https://t.co/b2hCc2ntgw,https://twitter.com/i/web/status/1418747789165703170,23/07/2021 19:40:06,Twitter Web App,8,3,Ministerio de Finanzas Guatemala,19:40:06,http://pbs.twimg.com/profile_images/1292831294796320768/6Q8j5vtW.jpg
El Plan Nacional de Vacunación avanza y los guatemaltecos continúan vacunándose en los diferentes centros de todo e… https://t.co/QSSBttsdaU,https://twitter.com/i/web/status/1418766237497233410,23/07/2021 20:53:25,Twitter Media Studio,23,11,Gobierno Guatemala,20:53:25,http://pbs.twimg.com/profile_images/1371488309743120384/QqlgsWUm.jpg
"La vacuna es segura y puede salvar tu vida, regístrate gratis en 👉 https://t.co/sTWUqniL3q https://t.co/vAJKgHo9P9",https://twitter.com/i/web/status/1418771528855048193,23/07/2021 21:14:26,Twitter for iPhone,9,4,Gobierno Guatemala,21:14:26,http://pbs.twimg.com/profile_images/1371488309743120384/QqlgsWUm.jpg
RT @SCSPGT: Actualización del avance en el registro de vacunación para las universidades del país. #VacunaCovidGT https://t.co/Ys5KcszKmy,https://twitter.com/i/web/status/1418774492776652804,23/07/2021 21:26:13,Twitter for Android,0,22,Gobierno Guatemala,21:26:13,http://pbs.twimg.com/profile_images/1371488309743120384/QqlgsWUm.jpg
El Plan Nacional de Vacunación avanza y los guatemaltecos continúan vacunándose en los diferentes centros de todo e… https://t.co/wlLnjLFsae,https://twitter.com/i/web/status/1418780477721178118,23/07/2021 21:50:00,Twitter Media Studio,12,2,Gobierno Guatemala,21:50:00,http://pbs.twimg.com/profile_images/1371488309743120384/QqlgsWUm.jpg
"Al vacunarte 👩🏾‍🦱👱🏼👨🏻‍🦳 creas inmunidad 🛡 sin los efectos nocivos que provoca la #COVID19 🦠

Vacunarse contra la CO… https://t.co/LfLCG5PJhA",https://twitter.com/i/web/status/1418928956439416840,24/07/2021 07:40:00,Twitter Web App,85,76,OPS/OMS,07:40:00,http://pbs.twimg.com/profile_images/1096094749902028801/ijbQWupW.png
"Del 26 de julio al 3 de agosto se desarrollarán los talleres temáticos del #PresupuestoAbiertoGT. 

Te invitamos a… https://t.co/Eshs4yBtCd",https://twitter.com/i/web/status/1418937007997399057,24/07/2021 08:11:59,Twitter for Android,4,4,Ministerio de Finanzas Guatemala,08:11:59,http://pbs.twimg.com/profile_images/1292831294796320768/6Q8j5vtW.jpg
"Inicia jornada de #SábadoConsularGt en el @ConsMarylandGt, @Consulguatesf, @ConGtFiladelfia brindando servicios de… https://t.co/5lOh4zu2q3",https://twitter.com/i/web/status/1418965513925967883,24/07/2021 10:05:16,Twitter for Android,2,1,MINEX Guatemala 🇬🇹,10:05:16,http://pbs.twimg.com/profile_images/1292832595093475329/6LQbTy36.jpg
Conozca los puestos de vacunación que estarán abiertos este fin de semana: sábado 24 y domingo 25 en horario de 7:0… https://t.co/oP60AFMpEm,https://twitter.com/i/web/status/1418968889053130766,24/07/2021 10:18:40,Twitter for Android,7,3,Ministerio de Salud Pública,10:18:40,http://pbs.twimg.com/profile_images/1311755159027015685/QQcxgYd1.jpg
#EnDirecto | Jornada de vacunación contra el #COVID19  desde Universidad del Valle #AccionesQueTransforman https://t.co/CwwWIwV9pP,https://twitter.com/i/web/status/1418975925790720006,24/07/2021 10:46:38,"<a href=""https://periscope.tv"" rel=""nofollow"">Periscope",25,15,Gobierno Guatemala,10:46:38,http://pbs.twimg.com/profile_images/1371488309743120384/QqlgsWUm.jpg
#ExtensiónVigencia | ¿Te urge viajar y no puedes esperar la fecha de tu cita? Ahora podrás extender la vigencia eme… https://t.co/URIuL4j3cm,https://twitter.com/i/web/status/1418982713802035204,24/07/2021 11:13:37,Twitter for iPhone,5,3,Migración Guatemala,11:13:37,http://pbs.twimg.com/profile_images/1346129009051054081/v9JUwo36.jpg
El #ViceCancillerGT Carlos Ramiro Martínez participará hoy en la XXI Reunión de Cancilleres de la Comunidad de Esta… https://t.co/41ky48XhZP,https://twitter.com/i/web/status/1418983717054332933,24/07/2021 11:17:36,Twitter for Android,16,6,MINEX Guatemala 🇬🇹,11:17:36,http://pbs.twimg.com/profile_images/1292832595093475329/6LQbTy36.jpg
#VacunaCOVID19 | Conoce los puestos de vacunación abiertos este sábado 24 y domingo 25 de julio a nivel nacional 💉… https://t.co/5cMMAmwqmU,https://twitter.com/i/web/status/1418985235321081857,24/07/2021 11:23:38,Twitter Web App,4,3,Ministerio de Salud Pública,11:23:38,http://pbs.twimg.com/profile_images/1311755159027015685/QQcxgYd1.jpg
"RT @SCSPGT: @Sonny_Figueroa FALSO.  Aquí no se descansa, el país sigue adelante.  La reunión de trabajo que realiza la @SCEPgt  desde tempr…",https://twitter.com/i/web/status/1418987970389061632,24/07/2021 11:34:30,Twitter for Android,0,39,Gobierno Guatemala,11:34:30,http://pbs.twimg.com/profile_images/1371488309743120384/QqlgsWUm.jpg
"✨Nueva fecha límite✨

Queremos financiar proyectos que implementen medidas preventivas en poblaciones en situación… https://t.co/RdAGCZFitj",https://twitter.com/i/web/status/1418994392627499008,24/07/2021 12:00:01,Twitter Web App,36,19,OPS/OMS,12:00:01,http://pbs.twimg.com/profile_images/1096094749902028801/ijbQWupW.png
"Tablero de Alertas Sanitarias #COVID19

El #MSPAS actualizó el Tablero de Alertas Sanitarias COVID-19; para los pró… https://t.co/yaUKGFW8np",https://twitter.com/i/web/status/1419001752498606083,24/07/2021 12:29:16,Twitter Web App,36,16,Ministerio de Salud Pública,12:29:16,http://pbs.twimg.com/profile_images/1311755159027015685/QQcxgYd1.jpg
#EnDirecto | Reunión de Secretaría Ejecutiva SCEP con gobernadores para dar seguimiento a 205 compromisos de obras… https://t.co/bk3BQtytCP,https://twitter.com/i/web/status/1419002243626332162,24/07/2021 12:31:13,"<a href=""https://periscope.tv"" rel=""nofollow"">Periscope",14,11,Gobierno Guatemala,12:31:13,http://pbs.twimg.com/profile_images/1371488309743120384/QqlgsWUm.jpg
"El Presidente @DrGiammattei comenta que la inversión del #Presupuesto2022 se enfocará en seguridad, salud y educaci… https://t.co/KsElOhbqey",https://twitter.com/i/web/status/1419004081834758157,24/07/2021 12:38:31,Twitter for Android,8,6,Ministerio de Finanzas Guatemala,12:38:31,http://pbs.twimg.com/profile_images/1292831294796320768/6Q8j5vtW.jpg
"- Guatemala recibe 3 millones de dosis de vacuna Moderna donadas por Estados Unidos

- Donativo de 300 mil mascaril… https://t.co/1OQ01nw6OY",https://twitter.com/i/web/status/1419009491421388800,24/07/2021 13:00:01,"<a href=""https://ads-api.twitter.com"" rel=""nofollow"">Twitter for Advertisers.",12,1,Ministerio de Salud Pública,13:00:01,http://pbs.twimg.com/profile_images/1311755159027015685/QQcxgYd1.jpg
"#ExtensiónVigencia | Si te urge el pasaporte, eres mayor de edad y tienes cita programada, ahora podrás extender la… https://t.co/naumlTJM19",https://twitter.com/i/web/status/1419014230301462530,24/07/2021 13:18:51,Hootsuite Inc.,5,2,Migración Guatemala,13:18:51,http://pbs.twimg.com/profile_images/1346129009051054081/v9JUwo36.jpg
"📢 ""Nuestros países están listos para administrar 💉💉 tan pronto como lleguen, y nosotros seguimos comprometidos a ay… https://t.co/RE16B8QPbf",https://twitter.com/i/web/status/1419032136888111104,24/07/2021 14:30:00,Twitter Media Studio,15,5,OPS/OMS,14:30:00,http://pbs.twimg.com/profile_images/1096094749902028801/ijbQWupW.png
⚠️ En el tablero COVID-19 los fallecidos reportados el día anterior se visualizan por la fecha de defunción. Estos… https://t.co/3IpwZagwC8,https://twitter.com/i/web/status/1419045822998749185,24/07/2021 15:24:23,Twitter for Android,1,0,Ministerio de Salud Pública,15:24:23,http://pbs.twimg.com/profile_images/1311755159027015685/QQcxgYd1.jpg
#Actualización| #MSPAS informa este 24 de julio de 2021 los casos confirmados por laboratorio en el tablero Situaci… https://t.co/LtrzBHCaHt,https://twitter.com/i/web/status/1419045821186727938,24/07/2021 15:24:23,Twitter for Android,14,8,Ministerio de Salud Pública,15:24:23,http://pbs.twimg.com/profile_images/1311755159027015685/QQcxgYd1.jpg
El #MSPAS informa la cantidad de personas que han recibido la primera dosis y el esquema completo de la vacuna cont… https://t.co/OSaIBH0isj,https://twitter.com/i/web/status/1419046608172371968,24/07/2021 15:27:30,Twitter for Android,30,7,Ministerio de Salud Pública,15:27:30,http://pbs.twimg.com/profile_images/1311755159027015685/QQcxgYd1.jpg
"El #ViceCancillerGT Carlos Ramiro Martínez participó hoy en la XXI Reunión de Cancilleres de la @PPT_CELAC, encuent… https://t.co/JUyyt7t71G",https://twitter.com/i/web/status/1419049087970729984,24/07/2021 15:37:21,Twitter for Android,6,2,MINEX Guatemala 🇬🇹,15:37:21,http://pbs.twimg.com/profile_images/1292832595093475329/6LQbTy36.jpg
El #ViceCancillerGT Carlos Ramiro Martínez concluyó con un agradecimiento a la @FAO y @cepal_onu por acceder a los… https://t.co/K0iN8wT5mA,https://twitter.com/i/web/status/1419049105553334272,24/07/2021 15:37:26,Twitter for Android,3,1,MINEX Guatemala 🇬🇹,15:37:26,http://pbs.twimg.com/profile_images/1292832595093475329/6LQbTy36.jpg
#MedidasDePrevención | En el Instituto Guatemalteco de Migración continuamos fomentando las medidas sanitarias vige… https://t.co/Lz6NwJsTcu,https://twitter.com/i/web/status/1419054805360783374,24/07/2021 16:00:05,Hootsuite Inc.,2,1,Migración Guatemala,16:00:05,http://pbs.twimg.com/profile_images/1346129009051054081/v9JUwo36.jpg
"RT @SCSPGT: Ante las declaraciones de Juan Francisco Sandoval, el @GuatemalaGob hace saber ▶️  https://t.co/JTFclgfymY https://t.co/gBctiZn…",https://twitter.com/i/web/status/1419064911225835523,24/07/2021 16:40:14,Twitter for Android,0,29,Gobierno Guatemala,16:40:14,http://pbs.twimg.com/profile_images/1371488309743120384/QqlgsWUm.jpg
"La @EmbaGuaFr llevó a cabo jornada de #SábadoConsular brindaron atención, servicio y asesoría consular a guatemalte… https://t.co/J8TFQrD8F5",https://twitter.com/i/web/status/1419073364929482753,24/07/2021 17:13:49,Twitter for Android,2,0,MINEX Guatemala 🇬🇹,17:13:49,http://pbs.twimg.com/profile_images/1292832595093475329/6LQbTy36.jpg
"El Ministro de Finanzas @alvarogricci invita a los centros de investigación, medios de comunicación, academia y dem… https://t.co/FhvUgM7VfB",https://twitter.com/i/web/status/1419079204453371906,24/07/2021 17:37:02,Twitter for Android,7,2,Ministerio de Finanzas Guatemala,17:37:02,http://pbs.twimg.com/profile_images/1292831294796320768/6Q8j5vtW.jpg
"RT @PPT_CELAC: 🇬🇹 | El Viceministro de Relaciones Exteriores del @MinexGt, Carlos Ramiro Martínez agradeció la donación de vacunas💉 contra…",https://twitter.com/i/web/status/1419079236745302019,24/07/2021 17:37:09,Twitter for Android,0,12,MINEX Guatemala 🇬🇹,17:37:09,http://pbs.twimg.com/profile_images/1292832595093475329/6LQbTy36.jpg
"El @ConsMarylandGt participó en evento comunitario junto a los consulados de El Salvador y México, con el apoyo de… https://t.co/XtvrBj8Q9w",https://twitter.com/i/web/status/1419087069318635520,24/07/2021 18:08:17,Twitter for Android,3,1,MINEX Guatemala 🇬🇹,18:08:17,http://pbs.twimg.com/profile_images/1292832595093475329/6LQbTy36.jpg
"Este evento brindó servicios de salud general, aplicación de vacuna contra el COVID-19, información consular y entr… https://t.co/mSm3lGWB2P",https://twitter.com/i/web/status/1419087081117208589,24/07/2021 18:08:20,Twitter for Android,2,1,MINEX Guatemala 🇬🇹,18:08:20,http://pbs.twimg.com/profile_images/1292832595093475329/6LQbTy36.jpg
"#YoDenuncio
#RompeConElSilencio 📣 🚨
Denuncia si conoces información sobre casos de violencia contra las mujeres y n… https://t.co/LjJri5Q2s6",https://twitter.com/i/web/status/1419088759195193344,24/07/2021 18:15:00,Twitter Media Studio,5,0,MinGob,18:15:00,http://pbs.twimg.com/profile_images/1371480777330941958/_81AGCXa.jpg
"#LosMásBuscadosGT 🔍  por plagio o secuestro 

Cualquier información comunícate al teléfono 1561 ó escribe al correo… https://t.co/7T19SQbdCt",https://twitter.com/i/web/status/1419100086085226497,24/07/2021 19:00:00,Twitter Media Studio,2,0,MinGob,19:00:00,http://pbs.twimg.com/profile_images/1371480777330941958/_81AGCXa.jpg
"#TuDenunciaEsConfidencial 🗣📞🕵🏻‍
#YoDenuncio
Se dará seguimiento y respuesta a toda la información que usted brinde. https://t.co/dsowpysGC3",https://twitter.com/i/web/status/1419122734160769026,24/07/2021 20:30:00,Twitter Media Studio,2,1,MinGob,20:30:00,http://pbs.twimg.com/profile_images/1371480777330941958/_81AGCXa.jpg
"#YoDenuncio
#RompeConElSilencio 📣 🚨
Denuncia si conoces información sobre casos de violencia contra las mujeres y n… https://t.co/0eiS4QatQO",https://twitter.com/i/web/status/1419281286460444673,25/07/2021 07:00:02,Twitter Media Studio,3,2,MinGob,07:00:02,http://pbs.twimg.com/profile_images/1371480777330941958/_81AGCXa.jpg
#IGM | ¡Profesionalismo! Cada trámite es atendido con honradez y eficiencia. https://t.co/zy89KUZgCi,https://twitter.com/i/web/status/1419281312729419777,25/07/2021 07:00:08,Hootsuite Inc.,2,1,Migración Guatemala,07:00:08,http://pbs.twimg.com/profile_images/1346129009051054081/v9JUwo36.jpg
"Haz tu parte para ayudar a poner fin a esta pandemia 🦠. 

➡️ Protégete y protege a los demás ♥ 

Continúa poniéndot… https://t.co/ZwojldSWxb",https://twitter.com/i/web/status/1419288828263624704,25/07/2021 07:30:00,Twitter Web App,23,22,OPS/OMS,07:30:00,http://pbs.twimg.com/profile_images/1096094749902028801/ijbQWupW.png
Migración se prepara para implementar la extensión de la vigencia del pasaporte 🛂 https://t.co/XFvfwbDOz4 https://t.co/xLypc4dA4N,https://twitter.com/i/web/status/1419289854031060997,25/07/2021 07:34:04,Twitter for iPhone,10,6,Gobierno Guatemala,07:34:04,http://pbs.twimg.com/profile_images/1371488309743120384/QqlgsWUm.jpg
#Pasaportes ¡Atención Xela! Ya puedes programar en línea la cita para el trámite de pasaporte en el Centro de Emisi… https://t.co/cr8JmCjpkr,https://twitter.com/i/web/status/1419296412123152385,25/07/2021 08:00:08,Hootsuite Inc.,3,1,Migración Guatemala,08:00:08,http://pbs.twimg.com/profile_images/1346129009051054081/v9JUwo36.jpg
RT @GuatemalaGob: Migración se prepara para implementar la extensión de la vigencia del pasaporte 🛂 https://t.co/XFvfwbDOz4 https://t.co/xL…,https://twitter.com/i/web/status/1419303580641677317,25/07/2021 08:28:37,Twitter for Android,0,6,Migración Guatemala,08:28:37,http://pbs.twimg.com/profile_images/1346129009051054081/v9JUwo36.jpg
Tus comentarios en los talleres de #PresupuestoAbiertoGT aportan a la creación de programas sociales y económicos q… https://t.co/kg7hJgDOPn,https://twitter.com/i/web/status/1419312139752415234,25/07/2021 09:02:38,Twitter for Android,3,2,Ministerio de Finanzas Guatemala,09:02:38,http://pbs.twimg.com/profile_images/1292831294796320768/6Q8j5vtW.jpg
#Pasaportes |¿Saliste de viaje y perdiste el pasaporte? Esto debes hacer 👇🏻 https://t.co/DAkCgV6Otc,https://twitter.com/i/web/status/1419314005693411333,25/07/2021 09:10:03,Hootsuite Inc.,3,1,Migración Guatemala,09:10:03,http://pbs.twimg.com/profile_images/1346129009051054081/v9JUwo36.jpg
"#VacunaCOVID19 | Conoce los puestos de vacunación abiertos este domingo 25 de julio a nivel nacional 💉 

Más inform… https://t.co/t8o5xg9lKY",https://twitter.com/i/web/status/1419316796230885379,25/07/2021 09:21:08,Twitter for Android,4,4,Ministerio de Salud Pública,09:21:08,http://pbs.twimg.com/profile_images/1311755159027015685/QQcxgYd1.jpg
"Brigada Especial de Operaciones de Selva del #EjércitoGT | #MINDEF apoya al @MinSaludGuate, en la organización y fu… https://t.co/CPapVSFQAc",https://twitter.com/i/web/status/1419321180339716101,25/07/2021 09:38:33,Twitter for Android,6,1,Ejército Guatemala,09:38:33,http://pbs.twimg.com/profile_images/1400165461548048384/3Vbvt8E2.jpg
"Brigada de Paracaidistas del #EjércitoGT | #MINDEF apoya al @MinSaludGuate, en la organización y funcionamiento, en… https://t.co/S6O3CyPIas",https://twitter.com/i/web/status/1419324715349549060,25/07/2021 09:52:36,Twitter for Android,11,2,Ejército Guatemala,09:52:36,http://pbs.twimg.com/profile_images/1400165461548048384/3Vbvt8E2.jpg
"⚠️ En chats de Whatsapp circular esta información la cual es totalmente falsa. 

El registro para vacunación contra… https://t.co/4z2yyNsZlk",https://twitter.com/i/web/status/1419325615480655877,25/07/2021 09:56:11,Twitter for Android,26,14,Ministerio de Salud Pública,09:56:11,http://pbs.twimg.com/profile_images/1311755159027015685/QQcxgYd1.jpg
"#LosMásBuscadosGT 🔍  por plagio o secuestro 

Cualquier información comunícate al teléfono 1561 ó escribe al correo… https://t.co/Ec45hCTEnh",https://twitter.com/i/web/status/1419326581332267019,25/07/2021 10:00:01,Twitter Media Studio,3,0,MinGob,10:00:01,http://pbs.twimg.com/profile_images/1371480777330941958/_81AGCXa.jpg
"#Pasaportes | 🌎 Si te encuentras fuera del país y necesitas renovar el pasaporte de un menor de edad, estos son los… https://t.co/zcSrQAlkYk",https://twitter.com/i/web/status/1419326641013145600,25/07/2021 10:00:15,Hootsuite Inc.,1,0,Migración Guatemala,10:00:15,http://pbs.twimg.com/profile_images/1346129009051054081/v9JUwo36.jpg
25 de julio | Día Nacional de la Mujer Garífuna. https://t.co/ndLm4F3H90,https://twitter.com/i/web/status/1419327869751373826,25/07/2021 10:05:08,Twitter for Android,12,2,Ejército Guatemala,10:05:08,http://pbs.twimg.com/profile_images/1400165461548048384/3Vbvt8E2.jpg
Invitamos a todas las mujeres guatemaltecas a participar del #CyberWomenChallenge 🙋🏼 🙋🏾 🙋🏻 organizado por la… https://t.co/hKGFJ2G5fa,https://twitter.com/i/web/status/1419334126956552194,25/07/2021 10:30:00,Twitter Media Studio,0,0,MinGob,10:30:00,http://pbs.twimg.com/profile_images/1371480777330941958/_81AGCXa.jpg
"#EjércitoGT | #MINDEF apoya en puesto de vacunación vehicular contra el COVID-19, ubicado en el Campo de Marte, el… https://t.co/pw6W81uUNE",https://twitter.com/i/web/status/1419334537188974597,25/07/2021 10:31:38,Twitter for Android,10,2,Ejército Guatemala,10:31:38,http://pbs.twimg.com/profile_images/1400165461548048384/3Vbvt8E2.jpg
Las #VariantesCOVID19 surgen por cambios comunes a nivel genético del virus. Son procesos esperados en la evolución… https://t.co/nF9A0tkYDR,https://twitter.com/i/web/status/1419339159055990788,25/07/2021 10:50:00,Twitter Web App,40,33,OPS/OMS,10:50:00,http://pbs.twimg.com/profile_images/1096094749902028801/ijbQWupW.png
"Conoce los paso para obtener tus #AntecedentesPolicialesGT en línea ✅

El video te informará 👇🏻

https://t.co/PC0hqV9Y2l",https://twitter.com/i/web/status/1419341678511595522,25/07/2021 11:00:00,TweetDeck,2,0,MinGob,11:00:00,http://pbs.twimg.com/profile_images/1371480777330941958/_81AGCXa.jpg
"#Pasaportes | 🌎 Si te encuentras fuera del país y necesitas renovar el pasaporte, estos son los requisitos: https://t.co/2p2o6S5bQ9",https://twitter.com/i/web/status/1419341709104881668,25/07/2021 11:00:08,Hootsuite Inc.,1,0,Migración Guatemala,11:00:08,http://pbs.twimg.com/profile_images/1346129009051054081/v9JUwo36.jpg
"⚠️ Circula en redes sociales que se está vacunando a personas de 18 años en adelante, en el Área de Salud de… https://t.co/M8nKrj3lXL",https://twitter.com/i/web/status/1419341787139870723,25/07/2021 11:00:26,Twitter for Android,12,14,Ministerio de Salud Pública,11:00:26,http://pbs.twimg.com/profile_images/1311755159027015685/QQcxgYd1.jpg
"#EjércitoGT | #MINDEF apoya al @MinSaludGuate, en la organización y funcionamiento, en jornada de vacunación contra… https://t.co/VzDuehFUys",https://twitter.com/i/web/status/1419344366192189446,25/07/2021 11:10:41,Twitter for Android,6,1,Ejército Guatemala,11:10:41,http://pbs.twimg.com/profile_images/1400165461548048384/3Vbvt8E2.jpg
"¡Recuerda que puedes pagar en línea la boleta de los #AntecedentesPolicialesGT!

Sigue los pasos ✍🏻 https://t.co/N8iRh5zCUa",https://twitter.com/i/web/status/1419345450663088136,25/07/2021 11:15:00,Twitter Media Studio,1,0,MinGob,11:15:00,http://pbs.twimg.com/profile_images/1371480777330941958/_81AGCXa.jpg
Comisarías de PNC en donde se tramitan de manera presencial los #AntecedentesPolicialesGT ☑️ https://t.co/IzxvyZe5dT,https://twitter.com/i/web/status/1419349225305825289,25/07/2021 11:30:00,Twitter Media Studio,2,0,MinGob,11:30:00,http://pbs.twimg.com/profile_images/1371480777330941958/_81AGCXa.jpg
RT @SCSPGT: #VacunaCovidGT | Con orden y fluidez está funcionando el centro de vacunación peatonal ubicado en la brigada Mariscal Zavala. A…,https://twitter.com/i/web/status/1419351315768086532,25/07/2021 11:38:18,Twitter for Android,0,5,Ejército Guatemala,11:38:18,http://pbs.twimg.com/profile_images/1400165461548048384/3Vbvt8E2.jpg
RT @SCSPGT: #VacunaCovidGT | En el interior del país también están funcionando distintos centros de vacunación.  Aquí algunas imágenes que…,https://twitter.com/i/web/status/1419351335435186179,25/07/2021 11:38:23,Twitter for Android,0,8,Ejército Guatemala,11:38:23,http://pbs.twimg.com/profile_images/1400165461548048384/3Vbvt8E2.jpg
RT @SCSPGT: Buenos días. Este es el ambiente que se vive desde temprano en el centro de vacunación ubicado en el Campo Marte. #VacunaCovidG…,https://twitter.com/i/web/status/1419351356528287748,25/07/2021 11:38:28,Twitter for Android,0,18,Ejército Guatemala,11:38:28,http://pbs.twimg.com/profile_images/1400165461548048384/3Vbvt8E2.jpg
"🚨  Alerta información importante

Jorge Arturo Salán Alvarado es uno #LosMásBuscadosGT 🔍  señalado del delito de pl… https://t.co/egmzMw2OVa",https://twitter.com/i/web/status/1419353000397533188,25/07/2021 11:45:00,Twitter Media Studio,1,1,MinGob,11:45:00,http://pbs.twimg.com/profile_images/1371480777330941958/_81AGCXa.jpg
