Contenido,IR,Fecha,Dispositivo,Likes,Retweets,Entidad,Hora,Foto
"✅Presentan herramienta para fortalecer operaciones de actividad exportadora y de maquila
✅Guatemaltecos acuden a va… https://t.co/COb1PKIKGF",https://twitter.com/i/web/status/1485819433331269632,24/01/2022 21:38:52,Twitter for iPhone,4,2,Ministerio de Finanzas de Guatemala,21:38:52,http://pbs.twimg.com/profile_images/1471837102618853383/4xfotDwN.jpg
#GuateTransparente | En el SICOIN puedes conocer y monitorear la ejecución presupuestaria de las entidades del Esta… https://t.co/EqmJ08H3WQ,https://twitter.com/i/web/status/1485993531927928837,25/01/2022 09:10:41,Twitter Web App,8,3,Ministerio de Finanzas de Guatemala,09:10:41,http://pbs.twimg.com/profile_images/1471837102618853383/4xfotDwN.jpg
"#FinanzasSaludables 💡 | Antes de liquidar un servicio financiero, asegúrate conocer todo lo relacionado con el proc… https://t.co/t3Pf5vssXp",https://twitter.com/i/web/status/1486079073365512199,25/01/2022 14:50:35,Twitter Web App,4,3,Ministerio de Finanzas de Guatemala,14:50:35,http://pbs.twimg.com/profile_images/1471837102618853383/4xfotDwN.jpg
"#ControlMigratorio | Si vas a salir con un menor de edad del país, es importante que leas la siguiente información… https://t.co/W9wbgDgxxq",https://twitter.com/i/web/status/1486127355085168651,25/01/2022 18:02:27,Hootsuite Inc.,0,0,Migración Guatemala,18:02:27,http://pbs.twimg.com/profile_images/1472975116015386625/qXTSRrI2.jpg
"#TodosSomosMigrantes | Compartimos nuestra campaña en idioma materno. Solidaridad, empatía y respeto para quienes e… https://t.co/V5ry5Tc9pL",https://twitter.com/i/web/status/1486158358780514304,25/01/2022 20:05:38,Twitter for iPhone,1,0,Migración Guatemala,20:05:38,http://pbs.twimg.com/profile_images/1472975116015386625/qXTSRrI2.jpg
#InformeNacional https://t.co/xoxY3bizel,https://twitter.com/i/web/status/1486174975031664650,25/01/2022 21:11:40,Twitter for Android,1,1,MINEX Guatemala 🇬🇹,21:11:40,http://pbs.twimg.com/profile_images/1471828089491574785/eD5OEVK6.jpg
"Te invitamos a ver el #InformeNacional del @GuatemalaGob:👇🏼

✅Guatemala supera el millón de dosis de refuerzo aplic… https://t.co/sldeFuJl5R",https://twitter.com/i/web/status/1486175727976423424,25/01/2022 21:14:40,Twitter for iPhone,2,1,Ministerio de Finanzas de Guatemala,21:14:40,http://pbs.twimg.com/profile_images/1471837102618853383/4xfotDwN.jpg
"✅Guatemala participará simulacro regional de asistencia a desastres 

#AccionesQueTransforman 🇬🇹
@SCSPGT… https://t.co/IblSKzeBnC",https://twitter.com/i/web/status/1486175733135417345,25/01/2022 21:14:41,Twitter for iPhone,3,1,Ministerio de Finanzas de Guatemala,21:14:41,http://pbs.twimg.com/profile_images/1471837102618853383/4xfotDwN.jpg
"#JuntosVamosPorMás 
#AccionesQueTransforman https://t.co/f6vviW79hj",https://twitter.com/i/web/status/1486202240738103302,25/01/2022 23:00:01,Twitter Media Studio,1,0,MINEX Guatemala 🇬🇹,23:00:01,http://pbs.twimg.com/profile_images/1471828089491574785/eD5OEVK6.jpg
#Pasaportes | Compartimos los pasos para poder realizar el pago de trámite de pasaporte en línea. Más información e… https://t.co/IO2Fvoyn9e,https://twitter.com/i/web/status/1486342183082987520,26/01/2022 08:16:06,Hootsuite Inc.,6,2,Migración Guatemala,08:16:06,http://pbs.twimg.com/profile_images/1472975116015386625/qXTSRrI2.jpg
"#GestiónMinfin | Guatemala🇬🇹 se une a la Alianza para la Acción hacia una Economía Verde #PAGE, con el fin de desar… https://t.co/RUtxhjBOnq",https://twitter.com/i/web/status/1486354348292644876,26/01/2022 09:04:26,Twitter Web App,12,2,Ministerio de Finanzas de Guatemala,09:04:26,http://pbs.twimg.com/profile_images/1471837102618853383/4xfotDwN.jpg
Celebramos el Día Mundial de la Educación Ambiental con el propósito de concienciar sobre la necesidad de difundir… https://t.co/lPzRYFZdK5,https://twitter.com/i/web/status/1486374955847938049,26/01/2022 10:26:19,Twitter Web App,5,3,MINEX Guatemala 🇬🇹,10:26:19,http://pbs.twimg.com/profile_images/1471828089491574785/eD5OEVK6.jpg
"RT @DiariodeCA: #NacionalesDCA | El @MinfinGT bajo el marco de la Estrategia Fiscal Ambiental, oficializó el lanzamiento de la Alianza para…",https://twitter.com/i/web/status/1486401427182432258,26/01/2022 12:11:30,Twitter Web App,0,1,Ministerio de Finanzas de Guatemala,12:11:30,http://pbs.twimg.com/profile_images/1471837102618853383/4xfotDwN.jpg
#GuateAvanza | La @SEPREMGUATEMALA ha implementado diferentes acciones para mejorar la situación de las mujeres en… https://t.co/h7pOYg4mMb,https://twitter.com/i/web/status/1486406083384004613,26/01/2022 12:30:01,TweetDeck,4,5,Gobierno Guatemala,12:30:01,http://pbs.twimg.com/profile_images/1479793855331459074/NqurElHC.jpg
El @MinexGt y la @Segeplan se reunieron con los embajadores y representantes de organismos internacionales para coo… https://t.co/XpW2h6pzPf,https://twitter.com/i/web/status/1486407915124793346,26/01/2022 12:37:17,Twitter Web App,20,11,MINEX Guatemala 🇬🇹,12:37:17,http://pbs.twimg.com/profile_images/1471828089491574785/eD5OEVK6.jpg
RT @MinexGt: El @MinexGt y la @Segeplan se reunieron con los embajadores y representantes de organismos internacionales para cooperación pa…,https://twitter.com/i/web/status/1486408454214455308,26/01/2022 12:39:26,Twitter Web App,0,11,Gobierno Guatemala,12:39:26,http://pbs.twimg.com/profile_images/1479793855331459074/NqurElHC.jpg
"#ControlMigratorio | Los formularios para trámites de control migratorio no tienen costo, puedes descargarlos de fo… https://t.co/nSiT6fpi8L",https://twitter.com/i/web/status/1486411012404355074,26/01/2022 12:49:36,Hootsuite Inc.,2,1,Migración Guatemala,12:49:36,http://pbs.twimg.com/profile_images/1472975116015386625/qXTSRrI2.jpg
"En muchos países, particularmente en nuestras islas y territorios del Caribe, la cobertura de vacunación entre los… https://t.co/U7VsAsfmRC",https://twitter.com/i/web/status/1486413912903806976,26/01/2022 13:01:07,Twitter for iPhone,1,2,OPS/OMS,13:01:07,http://pbs.twimg.com/profile_images/1096094749902028801/ijbQWupW.png
"En estos países, donde los grupos vulnerables ya han sido protegidos y donde pueden estar disponibles suministros 📦… https://t.co/LWotgLiaux",https://twitter.com/i/web/status/1486413917538508803,26/01/2022 13:01:08,Twitter for iPhone,3,2,OPS/OMS,13:01:08,http://pbs.twimg.com/profile_images/1096094749902028801/ijbQWupW.png
"Pero doce países y territorios de las Américas 🌎 ya alcanzaron la meta de cobertura de vacunación del 70% de la OMS.

@DirOPSPAHO #COVID19",https://twitter.com/i/web/status/1486413914296315907,26/01/2022 13:01:08,Twitter for iPhone,1,2,OPS/OMS,13:01:08,http://pbs.twimg.com/profile_images/1096094749902028801/ijbQWupW.png
Muchos países ya han autorizado y están administrando de manera segura las vacunas contra el COVID a los adolescent… https://t.co/5gKH3BG0Sq,https://twitter.com/i/web/status/1486413920629710850,26/01/2022 13:01:09,Twitter for iPhone,6,2,OPS/OMS,13:01:09,http://pbs.twimg.com/profile_images/1096094749902028801/ijbQWupW.png
A medida que los países sopesan los beneficios de vacunar a los niños y trabajan para recuperar el aprendizaje en p… https://t.co/MLYoLv26Lx,https://twitter.com/i/web/status/1486413927969812482,26/01/2022 13:01:11,Twitter for iPhone,2,0,OPS/OMS,13:01:11,http://pbs.twimg.com/profile_images/1096094749902028801/ijbQWupW.png
"Los países deben actuar con urgencia para que la próxima generación tenga las oportunidades de salud, educación y s… https://t.co/mDrd2M49T4",https://twitter.com/i/web/status/1486413934588354562,26/01/2022 13:01:12,Twitter for iPhone,3,1,OPS/OMS,13:01:12,http://pbs.twimg.com/profile_images/1096094749902028801/ijbQWupW.png
"Estos datos son la clave para restaurar u ofrecer estos servicios de forma segura.

@DirOPSPAHO #COVID19",https://twitter.com/i/web/status/1486413931690094595,26/01/2022 13:01:12,Twitter for iPhone,0,0,OPS/OMS,13:01:12,http://pbs.twimg.com/profile_images/1096094749902028801/ijbQWupW.png
"@LuisM_92 Buena tarde Luis, podriamos brindarle alguna asistencia?",https://twitter.com/i/web/status/1486417662926368771,26/01/2022 13:16:01,Twitter Web App,0,0,Migración Guatemala,13:16:01,http://pbs.twimg.com/profile_images/1472975116015386625/qXTSRrI2.jpg
#GuateAvanza | @ConredGuatemala destaca apoyo internacional en caso de emergencia por desastres.  👇https://t.co/tqEPcrjGDw,https://twitter.com/i/web/status/1486421181636902914,26/01/2022 13:30:00,TweetDeck,8,6,Gobierno Guatemala,13:30:00,http://pbs.twimg.com/profile_images/1479793855331459074/NqurElHC.jpg
@LuisM_92 Nos podria enviar sus cita a oscsmigra@gmail.com? Se atendiendo en los horarios establecidos de acuerdo a… https://t.co/B305NCvXa8,https://twitter.com/i/web/status/1486425259586826242,26/01/2022 13:46:12,Twitter Web App,0,0,Migración Guatemala,13:46:12,http://pbs.twimg.com/profile_images/1472975116015386625/qXTSRrI2.jpg
La Dirección de Área de Salud de Quiché realizó reunión técnica con autoridades locales del Ministerio de Educación… https://t.co/4I9VuLPASA,https://twitter.com/i/web/status/1486433502597951488,26/01/2022 14:18:58,Twitter Web App,4,0,Ministerio de Salud Pública,14:18:58,http://pbs.twimg.com/profile_images/1471842908043190279/bu1LHFWL.jpg
"La Dirección de Salud de Ixil, realizó una reunión técnica con personal del Ministerio de Educación e integrantes d… https://t.co/nCewmCOfAR",https://twitter.com/i/web/status/1486433785935708163,26/01/2022 14:20:05,Twitter Web App,3,0,Ministerio de Salud Pública,14:20:05,http://pbs.twimg.com/profile_images/1471842908043190279/bu1LHFWL.jpg
MINGOB busca prevenir la violencia y la conflictividad https://t.co/6H5zRnh1Zq,https://twitter.com/i/web/status/1486440085616836617,26/01/2022 14:45:07,"<a href=""http://publicize.wp.com/"" rel=""nofollow"">WordPress.com",7,3,MinGob,14:45:07,http://pbs.twimg.com/profile_images/1471828174598246407/Y1Lm5nFE.jpg
"Y la semana pasada, el grupo de expertos en inmunización de la OMS autorizó la vacuna COVID de Pfizer para niños de… https://t.co/eYTF6QdqjN",https://twitter.com/i/web/status/1486440487456153604,26/01/2022 14:46:43,Twitter Web App,12,10,OPS/OMS,14:46:43,http://pbs.twimg.com/profile_images/1096094749902028801/ijbQWupW.png
"#JuntosVamosPorMás | Víctor Álvarez es un guatemalteco que gracias a su esfuerzo y dedicación, pero también a los p… https://t.co/n69Yfvpuar",https://twitter.com/i/web/status/1486440557962579972,26/01/2022 14:47:00,Twitter Media Studio,14,6,Gobierno Guatemala,14:47:00,http://pbs.twimg.com/profile_images/1479793855331459074/NqurElHC.jpg
"RT @GuatemalaGob: #JuntosVamosPorMás | Víctor Álvarez es un guatemalteco que gracias a su esfuerzo y dedicación, pero también a los program…",https://twitter.com/i/web/status/1486440835671638016,26/01/2022 14:48:06,Twitter for iPhone,0,6,MinGob,14:48:06,http://pbs.twimg.com/profile_images/1471828174598246407/Y1Lm5nFE.jpg
#PlanNacionalDeVacunación💉 | El Centro de Operaciones de Emergencia de Baja Verapaz afina los detalles para la segu… https://t.co/E4z6tue4d0,https://twitter.com/i/web/status/1486443832451420163,26/01/2022 15:00:01,TweetDeck,6,7,Gobierno Guatemala,15:00:01,http://pbs.twimg.com/profile_images/1479793855331459074/NqurElHC.jpg
#GestiónMinfin | El Portal #TransparenciaPresupuestaria permite a la ciudadanía dar seguimiento y analizar el uso d… https://t.co/9kFOAKveZd,https://twitter.com/i/web/status/1486446783697932297,26/01/2022 15:11:44,Twitter Web App,2,1,Ministerio de Finanzas de Guatemala,15:11:44,http://pbs.twimg.com/profile_images/1471837102618853383/4xfotDwN.jpg
Dos hombres fueron capturados por violencia contra la mujer https://t.co/natNdVf5n7,https://twitter.com/i/web/status/1486453128585166868,26/01/2022 15:36:57,"<a href=""http://publicize.wp.com/"" rel=""nofollow"">WordPress.com",2,1,MinGob,15:36:57,http://pbs.twimg.com/profile_images/1471828174598246407/Y1Lm5nFE.jpg
"Delegados de la @DIGEMAR_MDN participaron en la reunión de planificación, para integrar el equipo que realizará las… https://t.co/TDspAXAp7G",https://twitter.com/i/web/status/1486453571038109696,26/01/2022 15:38:42,Twitter for Android,4,2,Ejército Guatemala,15:38:42,http://pbs.twimg.com/profile_images/1471838829430640640/0yNoNrwr.jpg
Convivencia pacífica se fortalece en municipios de Sololá https://t.co/YRNvxnLxgB,https://twitter.com/i/web/status/1486453578269184014,26/01/2022 15:38:44,"<a href=""http://publicize.wp.com/"" rel=""nofollow"">WordPress.com",2,2,MinGob,15:38:44,http://pbs.twimg.com/profile_images/1471828174598246407/Y1Lm5nFE.jpg
Implicado en caso de secuestro es detenido por investigadores https://t.co/IJvJBn3pGj,https://twitter.com/i/web/status/1486453825829588997,26/01/2022 15:39:43,"<a href=""http://publicize.wp.com/"" rel=""nofollow"">WordPress.com",2,0,MinGob,15:39:43,http://pbs.twimg.com/profile_images/1471828174598246407/Y1Lm5nFE.jpg
"Información para todas las asociaciones, fundaciones y cualquier otra entidad que opere como ONG (Organización No G… https://t.co/ial1OjbAUO",https://twitter.com/i/web/status/1486458929324331014,26/01/2022 16:00:00,Twitter Media Studio,5,2,MinGob,16:00:00,http://pbs.twimg.com/profile_images/1471828174598246407/Y1Lm5nFE.jpg
"#GuateCrece | Se llevó a cabo la primera reunión ordinaria del Gabinete Específico de Desarrollo Económico, en el c… https://t.co/P9TbLK2GvE",https://twitter.com/i/web/status/1486458934571544589,26/01/2022 16:00:01,TweetDeck,9,5,Gobierno Guatemala,16:00:01,http://pbs.twimg.com/profile_images/1479793855331459074/NqurElHC.jpg
#Actualización| #MSPAS informa este 26 de enero de 2022 los casos confirmados por laboratorio en el tablero Situaci… https://t.co/6UuFacufqN,https://twitter.com/i/web/status/1486459096161214469,26/01/2022 16:00:40,Twitter Web App,7,9,Ministerio de Salud Pública,16:00:40,http://pbs.twimg.com/profile_images/1471842908043190279/bu1LHFWL.jpg
⚠️ En el tablero COVID-19 los fallecidos reportados el día anterior se visualizan por la fecha de defunción. Estos… https://t.co/KW8YHBrwR0,https://twitter.com/i/web/status/1486459154424344577,26/01/2022 16:00:54,Twitter Web App,1,0,Ministerio de Salud Pública,16:00:54,http://pbs.twimg.com/profile_images/1471842908043190279/bu1LHFWL.jpg
El #MSPAS informa la cantidad de personas que han recibido la primera dosis y el esquema completo de la vacuna cont… https://t.co/WYZXSqL0Ys,https://twitter.com/i/web/status/1486460331916500995,26/01/2022 16:05:34,Twitter Web App,5,2,Ministerio de Salud Pública,16:05:34,http://pbs.twimg.com/profile_images/1471842908043190279/bu1LHFWL.jpg
"#MSPAS | Como parte de las acciones de intensificación del Plan Nacional de Vacunación contra COVID-19, el Minister… https://t.co/LI3b4TQOMe",https://twitter.com/i/web/status/1486465236634939392,26/01/2022 16:25:04,Twitter Web App,6,0,Ministerio de Salud Pública,16:25:04,http://pbs.twimg.com/profile_images/1471842908043190279/bu1LHFWL.jpg
Conozca más: https://t.co/tgnybVfZWM https://t.co/bvm5Cap1dK,https://twitter.com/i/web/status/1486465951235256323,26/01/2022 16:27:54,Twitter Web App,1,0,Ministerio de Salud Pública,16:27:54,http://pbs.twimg.com/profile_images/1471842908043190279/bu1LHFWL.jpg
"#JuntosVamosPorMás | Gracias a los programas impulsados por el Gobierno del presidente @DrGiammattei, productores a… https://t.co/dD1UJ4u9WF",https://twitter.com/i/web/status/1486468293745647619,26/01/2022 16:37:13,Twitter for Android,4,2,Ejército Guatemala,16:37:13,http://pbs.twimg.com/profile_images/1471838829430640640/0yNoNrwr.jpg
"A medida que la pandemia de COVID-19 llega a su tercer año en las Américas 🌎, millones de niños no están recibiendo… https://t.co/VfEjhO8yzX",https://twitter.com/i/web/status/1486472819122728961,26/01/2022 16:55:12,Twitter Web App,26,35,OPS/OMS,16:55:12,http://pbs.twimg.com/profile_images/1096094749902028801/ijbQWupW.png
"#GuateAvanza | Con el objetivo de coadyuvar en el cuidado del medio ambiente, entidades desarrollan acciones para e… https://t.co/5xvRtij8Y4",https://twitter.com/i/web/status/1486474028525178882,26/01/2022 17:00:00,TweetDeck,2,3,Gobierno Guatemala,17:00:00,http://pbs.twimg.com/profile_images/1479793855331459074/NqurElHC.jpg
#ControlMigratorio | En el siguiente enlace encuentras los requisitos para el trámite de las certificaciones de mov… https://t.co/1LjJ7Hql6L,https://twitter.com/i/web/status/1486479631188480004,26/01/2022 17:22:16,Hootsuite Inc.,0,0,Migración Guatemala,17:22:16,http://pbs.twimg.com/profile_images/1472975116015386625/qXTSRrI2.jpg
"¡Buenas tardes Guatemala! 🇬🇹

Soldados de la Primera Brigada de Infantería del #EjércitoGT | #MINDEF te saludan. https://t.co/Iqa1GWmCVB",https://twitter.com/i/web/status/1486488685663199237,26/01/2022 17:58:14,Twitter for Android,12,2,Ejército Guatemala,17:58:14,http://pbs.twimg.com/profile_images/1471838829430640640/0yNoNrwr.jpg
#GuateAvanza | La 𝗙𝗲𝗿𝗶𝗮 𝗱𝗲 𝗘𝗺𝗽𝗹𝗲𝗼 𝗡𝗮𝗰𝗶𝗼𝗻𝗮𝗹 𝟮𝟬𝟮𝟮 permitirá a la población en busca de trabajo optar a espacios en em… https://t.co/LxZlm0w6EN,https://twitter.com/i/web/status/1486489127151280129,26/01/2022 18:00:00,TweetDeck,1,3,Gobierno Guatemala,18:00:00,http://pbs.twimg.com/profile_images/1479793855331459074/NqurElHC.jpg
"@_yenita21 Buenas tardes, ya hemos procedido a enviarle la información.",https://twitter.com/i/web/status/1486492547669188609,26/01/2022 18:13:35,Twitter for iPhone,0,0,Migración Guatemala,18:13:35,http://pbs.twimg.com/profile_images/1472975116015386625/qXTSRrI2.jpg
"Escuela Politécnica
🔶️Admisiones abiertas🔶️
⬇️⬇️⬇️
📅 28 de enero al 25 de marzo del 2022

📞 4497-4278
📞 4497-4277… https://t.co/DxEuLCkHme",https://twitter.com/i/web/status/1486492653294346243,26/01/2022 18:14:00,Twitter for Android,3,2,Ejército Guatemala,18:14:00,http://pbs.twimg.com/profile_images/1471838829430640640/0yNoNrwr.jpg
[#Video] 📹 Convivencia pacífica se fortalece en municipios de Sololá https://t.co/gOSLHZWodW,https://twitter.com/i/web/status/1486501531226673155,26/01/2022 18:49:17,Twitter for iPhone,9,2,MinGob,18:49:17,http://pbs.twimg.com/profile_images/1471828174598246407/Y1Lm5nFE.jpg
"#Urgente | En atención a una serie de comunicados que han estado circulando acerca del tema de ""El proceso de incor… https://t.co/Uq8oPuWvKf",https://twitter.com/i/web/status/1486502909735063554,26/01/2022 18:54:46,Twitter Web App,3,1,Ministerio de Salud Pública,18:54:46,http://pbs.twimg.com/profile_images/1471842908043190279/bu1LHFWL.jpg
"La Dirección General de Recursos Humanos de este Ministerio, es la única que podrá emitir los procedimientos y dire… https://t.co/vAUOtEKGMk",https://twitter.com/i/web/status/1486502950897963008,26/01/2022 18:54:56,Twitter Web App,2,0,Ministerio de Salud Pública,18:54:56,http://pbs.twimg.com/profile_images/1471842908043190279/bu1LHFWL.jpg
El #CancillerGT @PedroBroloGT inauguró oficinas remodeladas de Dirección General de Asuntos Consulares y Migratorio… https://t.co/DG5A79ifbk,https://twitter.com/i/web/status/1486503731634049027,26/01/2022 18:58:02,Twitter for Android,27,6,MINEX Guatemala 🇬🇹,18:58:02,http://pbs.twimg.com/profile_images/1471828089491574785/eD5OEVK6.jpg
"🚨 ""A medida que los casos de #COVID19 se propagan de manera más activa y más rápida que nunca, está claro que ómicr… https://t.co/Yo2Iolekbj",https://twitter.com/i/web/status/1486504228327624713,26/01/2022 19:00:00,Twitter Media Studio,23,16,OPS/OMS,19:00:00,http://pbs.twimg.com/profile_images/1096094749902028801/ijbQWupW.png
"Logros del Ministerio de la Defensa Nacional 2021 💯🇬🇹
⬇️⬇️⬇️
#SegundoInformeGT 
#InformeRepúblicaGT
#InformeGT https://t.co/1VCjBXymkb",https://twitter.com/i/web/status/1486511100149616640,26/01/2022 19:27:18,Twitter for Android,13,4,Ejército Guatemala,19:27:18,http://pbs.twimg.com/profile_images/1471838829430640640/0yNoNrwr.jpg
"#TuDenunciaEsConfidencial 🗣📞🕵🏻‍

#YoDenuncio

Se dará seguimiento y respuesta a toda la información que usted brinde https://t.co/vF1fN8FV0d",https://twitter.com/i/web/status/1486519332209315841,26/01/2022 20:00:01,Twitter Media Studio,1,1,MinGob,20:00:01,http://pbs.twimg.com/profile_images/1471828174598246407/Y1Lm5nFE.jpg
Brigada de Infantería de Marina del #EjércitoGT | #MINDEF concientiza a la población sobre las medidas de prevenció… https://t.co/ek3S1gRO4z,https://twitter.com/i/web/status/1486519385657335811,26/01/2022 20:00:14,Twitter for Android,10,3,Ejército Guatemala,20:00:14,http://pbs.twimg.com/profile_images/1471838829430640640/0yNoNrwr.jpg
"#ComunicadoOficial | El @GuatemalaGob a través del Ministerio de Gobernación, a la población en general informa: https://t.co/3sXy0VQtgf",https://twitter.com/i/web/status/1486520886693933060,26/01/2022 20:06:12,Twitter for iPhone,14,11,MinGob,20:06:12,http://pbs.twimg.com/profile_images/1471828174598246407/Y1Lm5nFE.jpg
#TodosSomosMigrantes | Compartimos nuestra campaña en idioma materno. Todos de una u otra manera hemos sido migrant… https://t.co/R4IfJbmmkr,https://twitter.com/i/web/status/1486521676649144321,26/01/2022 20:09:20,Twitter for iPhone,0,0,Migración Guatemala,20:09:20,http://pbs.twimg.com/profile_images/1472975116015386625/qXTSRrI2.jpg
"#ComunicadoOficial | El Gobierno de Guatemala a través del @mingobguate, a la población en general informa: https://t.co/rxCcf4AUJo",https://twitter.com/i/web/status/1486524000788492298,26/01/2022 20:18:34,Twitter for iPhone,13,7,Gobierno Guatemala,20:18:34,http://pbs.twimg.com/profile_images/1479793855331459074/NqurElHC.jpg
#Informacion | Con el apoyo de @PlanGuatemala se continúa brindado apoyo a los familiares de las víctimas del accid… https://t.co/XS6Hy2SHiD,https://twitter.com/i/web/status/1486526736858857479,26/01/2022 20:29:27,Twitter for iPhone,4,1,Migración Guatemala,20:29:27,http://pbs.twimg.com/profile_images/1472975116015386625/qXTSRrI2.jpg
#InformeNacional Miércoles 26 de enero 2022 https://t.co/0HZXRDAurn,https://twitter.com/i/web/status/1486527640907493376,26/01/2022 20:33:02,Twitter for iPhone,1,0,Ministerio de Salud Pública,20:33:02,http://pbs.twimg.com/profile_images/1471842908043190279/bu1LHFWL.jpg
#InformeNacional | 26 de enero de 2022 https://t.co/CPz8Gi7maD,https://twitter.com/i/web/status/1486539814883233792,26/01/2022 21:21:25,Twitter Media Studio,7,5,Gobierno Guatemala,21:21:25,http://pbs.twimg.com/profile_images/1479793855331459074/NqurElHC.jpg
"✅Resaltan la importancia de educación ambiental para preservar recursos
✅Atienden a más de 6 mil 600 personas durante temporada de frío",https://twitter.com/i/web/status/1486540113437990912,26/01/2022 21:22:36,Twitter for Android,0,0,Ejército Guatemala,21:22:36,http://pbs.twimg.com/profile_images/1471838829430640640/0yNoNrwr.jpg
"Te compartimos el #InformeNacional del @GuatemalaGob:
✅Feria Nacional de Empleo llega a los departamentos del país… https://t.co/0XA7sguaVc",https://twitter.com/i/web/status/1486540191426916354,26/01/2022 21:22:54,Twitter for iPhone,0,0,Ministerio de Finanzas de Guatemala,21:22:54,http://pbs.twimg.com/profile_images/1471837102618853383/4xfotDwN.jpg
"✅Resaltan la importancia de educación ambiental para preservar los recursos
#AccionesQueTransforman 🇬🇹
@SCSPGT… https://t.co/2E0kieA9ik",https://twitter.com/i/web/status/1486540194794950657,26/01/2022 21:22:55,Twitter for iPhone,1,0,Ministerio de Finanzas de Guatemala,21:22:55,http://pbs.twimg.com/profile_images/1471837102618853383/4xfotDwN.jpg
#InformeNacional https://t.co/dG0RaSD7B5,https://twitter.com/i/web/status/1486542928524849158,26/01/2022 21:33:47,Twitter for Android,3,1,MINEX Guatemala 🇬🇹,21:33:47,http://pbs.twimg.com/profile_images/1471828089491574785/eD5OEVK6.jpg
"#InformeNacional 26-01-2022

✅Feria Nacional de Empleo llega a los departamentos del país
✅Se inician trabajos de m… https://t.co/icBYlsPx22",https://twitter.com/i/web/status/1486542932001837058,26/01/2022 21:33:48,Twitter for Android,3,2,Ejército Guatemala,21:33:48,http://pbs.twimg.com/profile_images/1471838829430640640/0yNoNrwr.jpg
"✅Resaltan la importancia de educación ambiental para preservar recursos
✅Atienden a más de 6 mil 600 personas durante temporada de frío",https://twitter.com/i/web/status/1486542935248281601,26/01/2022 21:33:49,Twitter for Android,3,2,Ejército Guatemala,21:33:49,http://pbs.twimg.com/profile_images/1471838829430640640/0yNoNrwr.jpg
RT @GuatemalaGob: #InformeNacional | 26 de enero de 2022 https://t.co/CPz8Gi7maD,https://twitter.com/i/web/status/1486546493351809025,26/01/2022 21:47:57,Twitter for iPhone,0,5,MinGob,21:47:57,http://pbs.twimg.com/profile_images/1471828174598246407/Y1Lm5nFE.jpg
"#JuntosVamosPorMás 
#AccionesQueTransforman https://t.co/bJc3dbCcCD",https://twitter.com/i/web/status/1486567392939372544,26/01/2022 23:11:00,Twitter Media Studio,2,0,MINEX Guatemala 🇬🇹,23:11:00,http://pbs.twimg.com/profile_images/1471828089491574785/eD5OEVK6.jpg
🇬🇹🤝🇧🇧 | Hoy se celebran 30 años de relaciones diplomáticas con #Barbados. Guatemala reafirma el compromiso por estr… https://t.co/LF78y24AhA,https://twitter.com/i/web/status/1486662774293876736,27/01/2022 05:30:00,Twitter Media Studio,1,1,MINEX Guatemala 🇬🇹,05:30:00,http://pbs.twimg.com/profile_images/1471828089491574785/eD5OEVK6.jpg
🇬🇹🤝🇲🇾 | Hoy se celebran 29 años de relaciones diplomáticas con #Malasia. Guatemala reafirma el compromiso por estre… https://t.co/iTpcCEVfCS,https://twitter.com/i/web/status/1486666546516615171,27/01/2022 05:45:00,Twitter Media Studio,0,0,MINEX Guatemala 🇬🇹,05:45:00,http://pbs.twimg.com/profile_images/1471828089491574785/eD5OEVK6.jpg
