Contenido,IR,Fecha,Dispositivo,Likes,Retweets,Entidad,Hora,Foto
El Banco Mundial ofrece su apoyo técnico para la estructuración de proyectos de infraestructura y en el tratamiento… https://t.co/BtBeUXxD2L,https://twitter.com/i/web/status/1430940403730112514,26/08/2021 11:09:12,Twitter Web App,3,1,Ministerio de Finanzas Guatemala,11:09:12,http://pbs.twimg.com/profile_images/1292831294796320768/6Q8j5vtW.jpg
"#PresupuestoAbiertoGT | Hermann Girón, Presidente de la @CamFinanzasGT habla de los riesgos a lo largo de la estruc… https://t.co/GoqkwyXVRI",https://twitter.com/i/web/status/1430951384724168711,26/08/2021 11:52:50,Twitter Web App,5,2,Ministerio de Finanzas Guatemala,11:52:50,http://pbs.twimg.com/profile_images/1292831294796320768/6Q8j5vtW.jpg
"El Viceministro del @CIVguate, Sergio González, informa que en el #Presupuesto2022 se incluyen cuatro grandes proye… https://t.co/SSexQ21YJH",https://twitter.com/i/web/status/1430956840565751809,26/08/2021 12:14:31,Twitter Web App,6,1,Ministerio de Finanzas Guatemala,12:14:31,http://pbs.twimg.com/profile_images/1292831294796320768/6Q8j5vtW.jpg
"#Presupuesto2022 | 𝗠𝗲𝗷𝗼𝗿𝗮𝗻𝗱𝗼 𝗲𝗹 𝗗𝗲𝘀𝗲𝗺𝗽𝗲𝗻̃𝗼 𝗱𝗲 𝗹𝗮 𝗜𝗻𝗳𝗿𝗮𝗲𝘀𝘁𝗿𝘂𝗰𝘁𝘂𝗿𝗮 𝗲𝗻 𝗚𝘂𝗮𝘁𝗲𝗺𝗮𝗹𝗮, fue el tema que se abordó en el últi… https://t.co/HPlvlAjtQO",https://twitter.com/i/web/status/1431074045844410377,26/08/2021 20:00:15,Twitter Web App,13,4,Ministerio de Finanzas Guatemala,20:00:15,http://pbs.twimg.com/profile_images/1292831294796320768/6Q8j5vtW.jpg
"Continúa con las medidas de prevención, estamos luchando 24/7 👩‍⚕️🧑‍⚕️ https://t.co/8QuRmo2DNE",https://twitter.com/i/web/status/1431271856716328964,27/08/2021 09:06:17,Twitter Media Studio,24,13,Gobierno Guatemala,09:06:17,http://pbs.twimg.com/profile_images/1371488309743120384/QqlgsWUm.jpg
RT @MaloufTony: Uno de los tres ejes del ABC de la #ReactivacionEconómicaGT es el #CrecimientoMIPYMES y hoy rebasan Q.1 millón en ventas en…,https://twitter.com/i/web/status/1431332635217993729,27/08/2021 13:07:47,Twitter Web App,0,9,Gobierno Guatemala,13:07:47,http://pbs.twimg.com/profile_images/1371488309743120384/QqlgsWUm.jpg
+ INFO sobre la Edadismo,https://twitter.com/i/web/status/1431343553993535490,27/08/2021 13:51:11,Twitter for iPhone,3,1,OPS/OMS,13:51:11,http://pbs.twimg.com/profile_images/1096094749902028801/ijbQWupW.png
¡No corras riesgos migrando de manera irregular! https://t.co/Oabqdi247y,https://twitter.com/i/web/status/1431360927631388674,27/08/2021 15:00:13,Hootsuite Inc.,3,2,MINEX Guatemala 🇬🇹,15:00:13,http://pbs.twimg.com/profile_images/1292832595093475329/6LQbTy36.jpg
"Aujourd'hui, nous avons livré un total de 87 palettes (86 m3) de fournitures et d'équipements médicaux en Haiti pou… https://t.co/RPlkSKRBDI",https://twitter.com/i/web/status/1431373644257587201,27/08/2021 15:50:45,Twitter for iPhone,9,2,OPS/OMS,15:50:45,http://pbs.twimg.com/profile_images/1096094749902028801/ijbQWupW.png
Nous avons aussi fourni une assistance logistique à nos partenaires de l'International Medical Corps pour la livrai… https://t.co/bhAPDz2LFu,https://twitter.com/i/web/status/1431373650490380290,27/08/2021 15:50:46,Twitter for iPhone,19,4,OPS/OMS,15:50:46,http://pbs.twimg.com/profile_images/1096094749902028801/ijbQWupW.png
"#TransformaciónMinex 👉🏽 Conozca el testimonio de un guatemalteco beneficiado con el Programa de Trabajo Temporal, q… https://t.co/XkqxfffiXL",https://twitter.com/i/web/status/1431381097410146306,27/08/2021 16:20:22,Twitter Web App,1,2,MINEX Guatemala 🇬🇹,16:20:22,http://pbs.twimg.com/profile_images/1292832595093475329/6LQbTy36.jpg
"RT @DrGiammattei: Dicen que usted y yo estuvimos en un yate con unos rusos-israelíes. Lo invito a que la próxima vez, lleve pantaloneta y u…",https://twitter.com/i/web/status/1431391170014363648,27/08/2021 17:00:23,Twitter Web App,0,347,Gobierno Guatemala,17:00:23,http://pbs.twimg.com/profile_images/1371488309743120384/QqlgsWUm.jpg
Trasladan vía aérea más de 32 mil dosis de vacuna contra COVID-19 hacia Zacapa #YoMeVacuno 💉 https://t.co/KguAY7dfq4 https://t.co/4ibJgenNSx,https://twitter.com/i/web/status/1431399763040210947,27/08/2021 17:34:32,Twitter Web App,8,3,Gobierno Guatemala,17:34:32,http://pbs.twimg.com/profile_images/1371488309743120384/QqlgsWUm.jpg
"#TransformaciónMinex 
Los empleadores se sienten satisfechos con el excelente trabajo, actitud y buen desempeño de… https://t.co/3OPm0VLMf9",https://twitter.com/i/web/status/1431400131920687107,27/08/2021 17:36:00,Twitter Web App,3,2,MINEX Guatemala 🇬🇹,17:36:00,http://pbs.twimg.com/profile_images/1292832595093475329/6LQbTy36.jpg
"Te invitamos a ver nuestro #ResumenSemanal

✅Programa de Trabajadores Temporales
✅Visita a México de #CancillerGT… https://t.co/sBuxX7xkgp",https://twitter.com/i/web/status/1431413721306484741,27/08/2021 18:30:00,Twitter Web App,6,4,MINEX Guatemala 🇬🇹,18:30:00,http://pbs.twimg.com/profile_images/1292832595093475329/6LQbTy36.jpg
"El investigador del @CIENgt, Jorge Lavarreda, nos explica por qué es importante que el @CongresoGuate apruebe el… https://t.co/rycMXDxGTo",https://twitter.com/i/web/status/1431637785451040770,28/08/2021 09:20:21,Twitter for Android,57,7,Ministerio de Finanzas Guatemala,09:20:21,http://pbs.twimg.com/profile_images/1292831294796320768/6Q8j5vtW.jpg
"Es posible, pero raro enfermarte con #COVID19 después de vacunarte.

Son principalmente los no vacunados quienes se… https://t.co/rfJWUzoRco",https://twitter.com/i/web/status/1431670295039909891,28/08/2021 11:29:32,Twitter for iPhone,49,38,OPS/OMS,11:29:32,http://pbs.twimg.com/profile_images/1096094749902028801/ijbQWupW.png
"¿Sabía qué?

El #Minex identifica oportunidades laborales en otros países por medio de sus misiones diplomáticas y… https://t.co/iXTfHZ4Aj7",https://twitter.com/i/web/status/1431670414934257673,28/08/2021 11:30:00,Twitter Web App,6,2,MINEX Guatemala 🇬🇹,11:30:00,http://pbs.twimg.com/profile_images/1292832595093475329/6LQbTy36.jpg
Alta Comisionada Auxiliar de @Refugees @GillianTriggs visitó Guatemala y realizó un recorrido junto al… https://t.co/vDvNLhW31U,https://twitter.com/i/web/status/1431686100284755970,28/08/2021 12:32:20,Twitter Web App,12,6,MINEX Guatemala 🇬🇹,12:32:20,http://pbs.twimg.com/profile_images/1292832595093475329/6LQbTy36.jpg
Visitaron la Casa del Migrante y @tierranuevaong para conversar con los solicitantes de refugio. También las instal… https://t.co/ayXo6X5tey,https://twitter.com/i/web/status/1431686105443749891,28/08/2021 12:32:21,Twitter Web App,2,0,MINEX Guatemala 🇬🇹,12:32:21,http://pbs.twimg.com/profile_images/1292832595093475329/6LQbTy36.jpg
La aprobación del #Presupuesto2022 es fundamental para Guatemala porque da la ruta al @GuatemalaGob para alcanzar s… https://t.co/RbCgQgZqpq,https://twitter.com/i/web/status/1431701661802766336,28/08/2021 13:34:10,Twitter for Android,46,3,Ministerio de Finanzas Guatemala,13:34:10,http://pbs.twimg.com/profile_images/1292831294796320768/6Q8j5vtW.jpg
#TransformaciónMinex  En el #Minex trabajamos en la búsqueda de oportunidades de trabajo temporal en el exterior pa… https://t.co/7cj2gY36la,https://twitter.com/i/web/status/1431738364831670273,28/08/2021 16:00:01,Twitter Web App,5,1,MINEX Guatemala 🇬🇹,16:00:01,http://pbs.twimg.com/profile_images/1292832595093475329/6LQbTy36.jpg
"Saúl Figueroa, Viceministro de Ingresos y Evaluación Fiscal del #Minfin, se refiere al panorama macroeconómico y fi… https://t.co/yd4NgLYh6z",https://twitter.com/i/web/status/1431754087213711364,28/08/2021 17:02:29,Twitter for Android,7,0,Ministerio de Finanzas Guatemala,17:02:29,http://pbs.twimg.com/profile_images/1292831294796320768/6Q8j5vtW.jpg
Nous mettons en place une surveillance syndromique dans les abris des communes affectées conjointement avec la Dire… https://t.co/yth68w26Wr,https://twitter.com/i/web/status/1431755987178778628,28/08/2021 17:10:02,Twitter for iPhone,9,1,OPS/OMS,17:10:02,http://pbs.twimg.com/profile_images/1096094749902028801/ijbQWupW.png
"RT @ConjuveGuate: El Consejo Nacional de la Juventud -CONJUVE-, en coordinación con el @MINTRABAJOGuate, te invitan a participar en la #Fer…",https://twitter.com/i/web/status/1431762323312676870,28/08/2021 17:35:13,Twitter for Android,0,10,Gobierno Guatemala,17:35:13,http://pbs.twimg.com/profile_images/1371488309743120384/QqlgsWUm.jpg
SAAS apoya vacunación en puesto habilitado en Plaza de la Constitución #YoMeVacuno 🙋🏽‍♂️🙋🏻‍♀️… https://t.co/ELEBoGYxGW,https://twitter.com/i/web/status/1431986774092521475,29/08/2021 08:27:06,Twitter for iPhone,19,8,Gobierno Guatemala,08:27:06,http://pbs.twimg.com/profile_images/1371488309743120384/QqlgsWUm.jpg
"#TransformaciónMinex 
Empresas que cultivan productos agrícolas 🍑🍓🍈 usan desde hace varios años el Programa de Trab… https://t.co/KVyzVHQis7",https://twitter.com/i/web/status/1432002603475369986,29/08/2021 09:30:00,Twitter Web App,3,1,MINEX Guatemala 🇬🇹,09:30:00,http://pbs.twimg.com/profile_images/1292832595093475329/6LQbTy36.jpg
"Por qué el Fondo Estratégico del a OPS es importante para los países🌎? 

👉 Porque brinda apoyo para mejorar el acce… https://t.co/IkKLvLxhOh",https://twitter.com/i/web/status/1432035562735562757,29/08/2021 11:40:58,Twitter Web App,8,8,OPS/OMS,11:40:58,http://pbs.twimg.com/profile_images/1096094749902028801/ijbQWupW.png
Los Foros Públicos del #PresupuestoAbiertoGT permitieron a la ciudadanía participar e informarse sobre todo lo rela… https://t.co/YXtLpg70yy,https://twitter.com/i/web/status/1432051602534305799,29/08/2021 12:44:42,Twitter for Android,22,3,Ministerio de Finanzas Guatemala,12:44:42,http://pbs.twimg.com/profile_images/1292831294796320768/6Q8j5vtW.jpg
"¿Cómo el Fondo Estratégico de la OPS apoyó a los países en la respuesta a la #COVID19?

✅ Con más de US$250 millone… https://t.co/jvlyAt7OaB",https://twitter.com/i/web/status/1432064836930707457,29/08/2021 13:37:18,Twitter Web App,26,12,OPS/OMS,13:37:18,http://pbs.twimg.com/profile_images/1096094749902028801/ijbQWupW.png
➕ INFO ⬇️ https://t.co/BED3angY6C,https://twitter.com/i/web/status/1432065201130520579,29/08/2021 13:38:45,Twitter Web App,9,3,OPS/OMS,13:38:45,http://pbs.twimg.com/profile_images/1096094749902028801/ijbQWupW.png
"Pablo Hurtado, Secretario Ejecutivo de @ASIES_GT, calificó de positivos los Foros Públicos del… https://t.co/3t8ApGYpKO",https://twitter.com/i/web/status/1432089290419408896,29/08/2021 15:14:28,Twitter for Android,5,1,Ministerio de Finanzas Guatemala,15:14:28,http://pbs.twimg.com/profile_images/1292831294796320768/6Q8j5vtW.jpg
"📽️Te invitamos a ver el siguiente video para conocer el Programa de Trabajo Temporal que el @MinexGt impulsa, y las… https://t.co/3QWO56BmRg",https://twitter.com/i/web/status/1432105781562941448,29/08/2021 16:20:00,Twitter Web App,3,0,MINEX Guatemala 🇬🇹,16:20:00,http://pbs.twimg.com/profile_images/1292832595093475329/6LQbTy36.jpg
"Lávate las manos constantemente y no olvides usar alcohol en gel 

#UnidosContraElCoronavirus… https://t.co/N7Sabadxqy",https://twitter.com/i/web/status/1432143492004958210,29/08/2021 18:49:51,Twitter for iPhone,2,0,MinGob,18:49:51,http://pbs.twimg.com/profile_images/1371480777330941958/_81AGCXa.jpg
El @MINECOGT presenta hoy su informe de gestión 📊 https://t.co/VloYNXRa8m,https://twitter.com/i/web/status/1432327144991043589,30/08/2021 06:59:37,Twitter for iPhone,14,11,Gobierno Guatemala,06:59:37,http://pbs.twimg.com/profile_images/1371488309743120384/QqlgsWUm.jpg
Esta donación aporta significativamente a las acciones por combatir esta enfermedad al incrementar la capacidad de… https://t.co/lRCIZDu2QE,https://twitter.com/i/web/status/1432343843928686601,30/08/2021 08:05:58,Twitter Web App,0,0,Ministerio de Salud Pública,08:05:58,http://pbs.twimg.com/profile_images/1311755159027015685/QQcxgYd1.jpg
"Hasta la fecha, #JICA ha contribuido al sistema de salud con pruebas de antígeno, equipo e insumos médicos para hos… https://t.co/D6UOvGzjka",https://twitter.com/i/web/status/1432343848710180870,30/08/2021 08:05:59,Twitter Web App,0,0,Ministerio de Salud Pública,08:05:59,http://pbs.twimg.com/profile_images/1311755159027015685/QQcxgYd1.jpg
Entre Enero 2018 a Junio 2021 el Fondo Estratégico de la OPS realizó adquisiciones por US$580 millones en medicamen… https://t.co/4jX2M1Moiu,https://twitter.com/i/web/status/1432343909603049488,30/08/2021 08:06:14,Twitter Web App,4,2,OPS/OMS,08:06:14,http://pbs.twimg.com/profile_images/1096094749902028801/ijbQWupW.png
¿Sabias que los productos adquiridos a través del Fondo Estratégico de la OPS cumplen con los estándares internacio… https://t.co/O9KSQBZbFF,https://twitter.com/i/web/status/1432343908093030402,30/08/2021 08:06:14,Twitter Web App,15,6,OPS/OMS,08:06:14,http://pbs.twimg.com/profile_images/1096094749902028801/ijbQWupW.png
Agentes Antinarcóticos fortalecen capacidades en Medicina Táctica https://t.co/jKbULrIVem,https://twitter.com/i/web/status/1432345065326788617,30/08/2021 08:10:49,"<a href=""http://publicize.wp.com/"" rel=""nofollow"">WordPress.com",8,3,MinGob,08:10:49,http://pbs.twimg.com/profile_images/1371480777330941958/_81AGCXa.jpg
"RT @EmisorasUnidas: #EUTV 🎥🔴 Álvaro González Ricci, ministro de Finanzas Públicas, se refiere en A Primera Hora a la asistencia que se ha b…",https://twitter.com/i/web/status/1432353103576244225,30/08/2021 08:42:46,Twitter Web App,0,1,Ministerio de Finanzas Guatemala,08:42:46,http://pbs.twimg.com/profile_images/1292831294796320768/6Q8j5vtW.jpg
#EnDirecto | Presentación del informe de gestión del @MINECOGT https://t.co/tPhf90W8XM,https://twitter.com/i/web/status/1432359492574871558,30/08/2021 09:08:09,"<a href=""https://periscope.tv"" rel=""nofollow"">Periscope",11,11,Gobierno Guatemala,09:08:09,http://pbs.twimg.com/profile_images/1371488309743120384/QqlgsWUm.jpg
#Informativo | 🎥 Conoce las acciones que se impulsan en materia migratoria. https://t.co/tN03L1lvuZ,https://twitter.com/i/web/status/1432364384018386945,30/08/2021 09:27:35,Twitter for iPhone,0,0,Migración Guatemala,09:27:35,http://pbs.twimg.com/profile_images/1346129009051054081/v9JUwo36.jpg
"Primera Brigada de Infantería del #EjércitoGT apoya al @MinSaludGuate, en la organización y funcionamiento de la jo… https://t.co/71aYQl8ffF",https://twitter.com/i/web/status/1432365974666326016,30/08/2021 09:33:55,Twitter for Android,6,2,Ejército Guatemala,09:33:55,http://pbs.twimg.com/profile_images/1400165461548048384/3Vbvt8E2.jpg
Ministerio de Salud Pública y Asistencia Social recibe donativo de pruebas de antígeno para la detección de COVID-1… https://t.co/nToDsKR9E9,https://twitter.com/i/web/status/1432369831869886467,30/08/2021 09:49:14,Twitter Web App,1,1,Ministerio de Salud Pública,09:49:14,http://pbs.twimg.com/profile_images/1311755159027015685/QQcxgYd1.jpg
"#EjércitoGT | #MINDEF apoya en puesto de vacunación peatonal y vehicular contra el COVID-19, ubicado en… https://t.co/hPFXSqIS7X",https://twitter.com/i/web/status/1432370612320804865,30/08/2021 09:52:20,Twitter for Android,7,2,Ejército Guatemala,09:52:20,http://pbs.twimg.com/profile_images/1400165461548048384/3Vbvt8E2.jpg
"Panorama en el puesto de vacunación vehicular #MariscalZavala, con poca afluencia, te invitamos a vacunarte contra… https://t.co/3fetZfjAcD",https://twitter.com/i/web/status/1432372124933578758,30/08/2021 09:58:21,Twitter for Android,4,1,Ejército Guatemala,09:58:21,http://pbs.twimg.com/profile_images/1400165461548048384/3Vbvt8E2.jpg
"#Pasaportes | 🛫 Recomendamos verificar la fecha de vencimiento del pasaporte, previo a realizar la compra de boleto… https://t.co/4sBx8sUX1w",https://twitter.com/i/web/status/1432372712723427339,30/08/2021 10:00:41,Hootsuite Inc.,3,0,Migración Guatemala,10:00:41,http://pbs.twimg.com/profile_images/1346129009051054081/v9JUwo36.jpg
"¡Vacúnate contra el COVID-19!
⬇️
Experiencia de la población civil en el puesto de vacunación contra el COVID-19… https://t.co/YlgfdIQ6Oh",https://twitter.com/i/web/status/1432373080920297473,30/08/2021 10:02:09,Twitter for Android,4,2,Ejército Guatemala,10:02:09,http://pbs.twimg.com/profile_images/1400165461548048384/3Vbvt8E2.jpg
#EnDirecto | Conferencia de prensa del Gabinete de Gobierno. https://t.co/f4VArkTIZS,https://twitter.com/i/web/status/1432375926143152130,30/08/2021 10:13:27,"<a href=""https://periscope.tv"" rel=""nofollow"">Periscope",20,16,Gobierno Guatemala,10:13:27,http://pbs.twimg.com/profile_images/1371488309743120384/QqlgsWUm.jpg
"¿Puedo registrarme en línea para mi segunda dosis si me vacuné en el extranjero? 💉

El #MSPAS te explica 👇 https://t.co/hDuvlu4sOL",https://twitter.com/i/web/status/1432376749137006603,30/08/2021 10:16:43,Twitter Web App,12,5,Ministerio de Salud Pública,10:16:43,http://pbs.twimg.com/profile_images/1311755159027015685/QQcxgYd1.jpg
"Brigada de Artillería de Campaña ""Santa Bárbara"" del #EjércitoGT | #MINDEF apoya al @MinSaludGuate, en la organizac… https://t.co/RampYdCx4a",https://twitter.com/i/web/status/1432379222723543041,30/08/2021 10:26:33,Twitter for Android,4,2,Ejército Guatemala,10:26:33,http://pbs.twimg.com/profile_images/1400165461548048384/3Vbvt8E2.jpg
"Quinta Brigada de Infantería del #EjércitoGT | #MINDEF apoya al @MinSaludGuate, en la organización y funcionamiento… https://t.co/FboAEYckwe",https://twitter.com/i/web/status/1432382124200538113,30/08/2021 10:38:05,Twitter for Android,5,1,Ejército Guatemala,10:38:05,http://pbs.twimg.com/profile_images/1400165461548048384/3Vbvt8E2.jpg
"El viceministro de Atención Primaria en Salud, Dr. Edwin Montúfar y la viceministra Técnica Licda. Leslie Samayoa a… https://t.co/vtk2pvSKaX",https://twitter.com/i/web/status/1432382752746360832,30/08/2021 10:40:35,Twitter Web App,1,0,Ministerio de Salud Pública,10:40:35,http://pbs.twimg.com/profile_images/1311755159027015685/QQcxgYd1.jpg
"Durante la reunión  se abordan temas como; situación de la pandemia #COVID19, seguimiento al Plan Nacional de Vacun… https://t.co/ZA81IfCu9N",https://twitter.com/i/web/status/1432382757292941318,30/08/2021 10:40:36,Twitter Web App,3,0,Ministerio de Salud Pública,10:40:36,http://pbs.twimg.com/profile_images/1311755159027015685/QQcxgYd1.jpg
"Quinto Viceministro, Fernando Rodas participa en el acto de clausura del II Curso Básico de Operador de Dron, con o… https://t.co/7yrFtx5xSc",https://twitter.com/i/web/status/1432383609772576768,30/08/2021 10:43:59,Twitter for iPhone,5,2,MinGob,10:43:59,http://pbs.twimg.com/profile_images/1371480777330941958/_81AGCXa.jpg
"Mil jóvenes se beneficiarán con trabajo formal durante #FeriaDelEmpleo 

Ingresa a 👉 https://t.co/RL3U2rh6Tt ¡Un se… https://t.co/ZczzUFWcuF",https://twitter.com/i/web/status/1432383639078285323,30/08/2021 10:44:06,Twitter Web App,4,3,Gobierno Guatemala,10:44:06,http://pbs.twimg.com/profile_images/1371488309743120384/QqlgsWUm.jpg
Pa Comisarías rech Santa Rosa xopan usolixik kichak rech ya’olchajinem b’anom ri’ https://t.co/N1Ke2axYgX,https://twitter.com/i/web/status/1432385423154814978,30/08/2021 10:51:11,"<a href=""http://publicize.wp.com/"" rel=""nofollow"">WordPress.com",1,1,MinGob,10:51:11,http://pbs.twimg.com/profile_images/1371480777330941958/_81AGCXa.jpg
Eri Ministro rech Gobernación xopan xusolij kichak ri PNC pa Jutiapa ri’ https://t.co/wbU6Uo56Cj,https://twitter.com/i/web/status/1432385565463351299,30/08/2021 10:51:45,"<a href=""http://publicize.wp.com/"" rel=""nofollow"">WordPress.com",3,1,MinGob,10:51:45,http://pbs.twimg.com/profile_images/1371480777330941958/_81AGCXa.jpg
#ExtensiónVigencia | 🎥 Conoce el proceso para realizar el trámite de Extensión de Pasaportes. https://t.co/5cwLCFoMeC,https://twitter.com/i/web/status/1432387696341696515,30/08/2021 11:00:13,Hootsuite Inc.,2,0,Migración Guatemala,11:00:13,http://pbs.twimg.com/profile_images/1346129009051054081/v9JUwo36.jpg
"RECICLE ♻️
¡Prevenir el mosquito está en tus manos!

#PrevengamosElMosquito #MSPAS https://t.co/m4WtV6ZJXe",https://twitter.com/i/web/status/1432388062525468674,30/08/2021 11:01:41,Twitter Web App,0,0,Ministerio de Salud Pública,11:01:41,http://pbs.twimg.com/profile_images/1311755159027015685/QQcxgYd1.jpg
"@CorinneDedik Buen día, ¿en qué la podemos ayudar?",https://twitter.com/i/web/status/1432388121086332935,30/08/2021 11:01:55,Twitter for iPhone,0,0,Migración Guatemala,11:01:55,http://pbs.twimg.com/profile_images/1346129009051054081/v9JUwo36.jpg
@angelmusic502 Para realizar su trámite de gestión de pasaporte debe realizar su pago de $50 equivalente en quetzal… https://t.co/UKLWxrVPrW,https://twitter.com/i/web/status/1432388324438822916,30/08/2021 11:02:43,Twitter for iPhone,0,0,Migración Guatemala,11:02:43,http://pbs.twimg.com/profile_images/1346129009051054081/v9JUwo36.jpg
"Brigada de Operaciones para Montaña del #EjércitoGT | #MINDEF apoya al @MinSaludGuate, en la organización y funcion… https://t.co/FGBInNCXGC",https://twitter.com/i/web/status/1432388327769100299,30/08/2021 11:02:44,Twitter for Android,3,0,Ejército Guatemala,11:02:44,http://pbs.twimg.com/profile_images/1400165461548048384/3Vbvt8E2.jpg
"@angelmusic502 REQUISITOS PASAPORTES
https://t.co/YGpvcukwRG",https://twitter.com/i/web/status/1432388349126381575,30/08/2021 11:02:49,Twitter for iPhone,0,0,Migración Guatemala,11:02:49,http://pbs.twimg.com/profile_images/1346129009051054081/v9JUwo36.jpg
"@IsisMir18208018 Buen día, le recomiendo presentarse a Oficinas Centrales, en el sexto nivel ubicado en la 6ª. Aven… https://t.co/T1eNuU2ayb",https://twitter.com/i/web/status/1432388763947315208,30/08/2021 11:04:28,Twitter for iPhone,0,0,Migración Guatemala,11:04:28,http://pbs.twimg.com/profile_images/1346129009051054081/v9JUwo36.jpg
"@RonaldB25857222 Le escribí en el área de mensajes, para darle seguimiento a su caso.",https://twitter.com/i/web/status/1432388882142793728,30/08/2021 11:04:56,Twitter for iPhone,0,0,Migración Guatemala,11:04:56,http://pbs.twimg.com/profile_images/1346129009051054081/v9JUwo36.jpg
"@montc71 Buen día, le hemos escrito vía inbox, para darle seguimiento a su caso.",https://twitter.com/i/web/status/1432389024803606534,30/08/2021 11:05:30,Twitter for iPhone,0,0,Migración Guatemala,11:05:30,http://pbs.twimg.com/profile_images/1346129009051054081/v9JUwo36.jpg
"Cuarta Brigada de Infantería del #EjércitoGT | #MINDEF apoya al @MinSaludGuate, en la organización y funcionamiento… https://t.co/X96ia1EDa9",https://twitter.com/i/web/status/1432389832152649731,30/08/2021 11:08:43,Twitter for Android,3,1,Ejército Guatemala,11:08:43,http://pbs.twimg.com/profile_images/1400165461548048384/3Vbvt8E2.jpg
"Se hace entrega de los diplomas a los agentes de la fuerza Xinca, Chortí y Tecún Umán, otorgados personalmente por… https://t.co/6NZ9LqCkXU",https://twitter.com/i/web/status/1432391081597997058,30/08/2021 11:13:41,Twitter for iPhone,7,3,MinGob,11:13:41,http://pbs.twimg.com/profile_images/1371480777330941958/_81AGCXa.jpg
"En la clausura del II Curso Básico de Operador de Dron también se realiza una demostración de vuelo de drones, mane… https://t.co/KPlwpBHVv0",https://twitter.com/i/web/status/1432391093585420288,30/08/2021 11:13:43,Twitter for iPhone,7,2,MinGob,11:13:43,http://pbs.twimg.com/profile_images/1371480777330941958/_81AGCXa.jpg
"@aalemd Buenos días, claro, se atenderá hasta media noche en los tres centros de vacunación.
#MariscalZavala
#GuardiaDeHonor 
#CampoDeMarte",https://twitter.com/i/web/status/1432394981818474496,30/08/2021 11:29:10,Twitter for Android,1,0,Ejército Guatemala,11:29:10,http://pbs.twimg.com/profile_images/1400165461548048384/3Vbvt8E2.jpg
@angelmusic502 El pago se hace en quetzales.,https://twitter.com/i/web/status/1432395560246448134,30/08/2021 11:31:28,Twitter for iPhone,0,0,Migración Guatemala,11:31:28,http://pbs.twimg.com/profile_images/1346129009051054081/v9JUwo36.jpg
⚠️ En el tablero COVID-19 los fallecidos reportados el día anterior se visualizan por la fecha de defunción. Estos… https://t.co/XOLR6wyr9F,https://twitter.com/i/web/status/1432397912613531651,30/08/2021 11:40:49,Twitter for Android,0,0,Ministerio de Salud Pública,11:40:49,http://pbs.twimg.com/profile_images/1311755159027015685/QQcxgYd1.jpg
#Actualización| #MSPAS informa este 30 de agosto de 2021 los casos confirmados por laboratorio en el tablero Situac… https://t.co/najg6siAUh,https://twitter.com/i/web/status/1432397910432436239,30/08/2021 11:40:49,Twitter for Android,7,3,Ministerio de Salud Pública,11:40:49,http://pbs.twimg.com/profile_images/1311755159027015685/QQcxgYd1.jpg
El #MSPAS informa la cantidad de personas que han recibido la primera dosis y el esquema completo de la vacuna cont… https://t.co/xDTc5mAXml,https://twitter.com/i/web/status/1432398227014397962,30/08/2021 11:42:04,Twitter for Android,4,1,Ministerio de Salud Pública,11:42:04,http://pbs.twimg.com/profile_images/1311755159027015685/QQcxgYd1.jpg
"Incomparecencias, conflictos y rebeldía motivos para activar Alerta Alba Keneth https://t.co/urs63bD4Av",https://twitter.com/i/web/status/1432399590444179458,30/08/2021 11:47:29,"<a href=""http://publicize.wp.com/"" rel=""nofollow"">WordPress.com",1,1,MinGob,11:47:29,http://pbs.twimg.com/profile_images/1371480777330941958/_81AGCXa.jpg
DEIC resalta los más de 300 hechos positivos a nivel nacional https://t.co/b0tK3mE9A4,https://twitter.com/i/web/status/1432400042745204736,30/08/2021 11:49:17,"<a href=""http://publicize.wp.com/"" rel=""nofollow"">WordPress.com",1,1,MinGob,11:49:17,http://pbs.twimg.com/profile_images/1371480777330941958/_81AGCXa.jpg
