Contenido,IR,Fecha,Dispositivo,Likes,Retweets,Entidad,Hora,Foto
"💻 Asiste al lanzamiento de ENLACE, el nuevo portal de datos de la OPS sobre enfermedades no transmisibles, salud me… https://t.co/j3B7uXzgpu",https://twitter.com/i/web/status/1483137045782413314,17/01/2022 12:00:01,Twitter Web App,3,1,OPS/OMS,12:00:01,http://pbs.twimg.com/profile_images/1096094749902028801/ijbQWupW.png
"Conoce los paso para obtener tus #AntecedentesPolicialesGT en línea ✅

El video te informará 👇🏻

https://t.co/PC0hqVryTT",https://twitter.com/i/web/status/1483137047778922497,17/01/2022 12:00:02,TweetDeck,0,0,MinGob,12:00:02,http://pbs.twimg.com/profile_images/1471828174598246407/Y1Lm5nFE.jpg
"Reservas Militares del #EjércitoGT | #MINDEF apoya al @MinSaludGuate, en la organización y funcionamiento de jornad… https://t.co/kQrvMVGvUi",https://twitter.com/i/web/status/1483137449324953602,17/01/2022 12:01:37,Twitter for Android,2,2,Ejército Guatemala,12:01:37,http://pbs.twimg.com/profile_images/1471838829430640640/0yNoNrwr.jpg
