Contenido,IR,Fecha,Dispositivo,Likes,Retweets,Entidad,Hora,Foto
"📢 ""3️⃣9️⃣ países y territorios de las Américas 🌎 han implementado dosis adicionales para garantizar que sus poblaci… https://t.co/xMJ23crwxg",https://twitter.com/i/web/status/1481981928807059460,14/01/2022 07:30:00,Twitter Media Studio,19,11,OPS/OMS,07:30:00,http://pbs.twimg.com/profile_images/1096094749902028801/ijbQWupW.png
"📣 ¡Únete al equipo! 

Buscamos 🔎 a un Consultor de Comunicación para coordinar todas las actividades de comunicació… https://t.co/Kq43QwMVKT",https://twitter.com/i/web/status/1482029916262572033,14/01/2022 10:40:41,Twitter Web App,17,13,OPS/OMS,10:40:41,http://pbs.twimg.com/profile_images/1096094749902028801/ijbQWupW.png
"💻 Asiste al lanzamiento de ENLACE, el nuevo portal de datos de la OPS sobre enfermedades no transmisibles, salud me… https://t.co/iwpqap9ut6",https://twitter.com/i/web/status/1482095174339547138,14/01/2022 15:00:00,Twitter Web App,10,3,OPS/OMS,15:00:00,http://pbs.twimg.com/profile_images/1096094749902028801/ijbQWupW.png
"RT @GuatemalaGob: Presentación del Informe General de la República 2021.
Sigue la transmisión desde Canal de Gobierno y nuestras redes soci…",https://twitter.com/i/web/status/1482117932448632834,14/01/2022 16:30:26,Twitter for Android,0,13,Ministerio de Finanzas de Guatemala,16:30:26,http://pbs.twimg.com/profile_images/1471837102618853383/4xfotDwN.jpg
"RT @rpsp_pajph: 👩🏾‍🏫 Curso “Comunicación científica”

Este curso de autoaprendizaje aborda temas como:

🔹 Redacción y lenguaje científico,…",https://twitter.com/i/web/status/1482125644536303618,14/01/2022 17:01:04,Twitter for iPhone,0,29,OPS/OMS,17:01:04,http://pbs.twimg.com/profile_images/1096094749902028801/ijbQWupW.png
RT @GuatemalaGob: Presentación del Informe General de la República 2021. https://t.co/bdLRGMcoax,https://twitter.com/i/web/status/1482129260211015680,14/01/2022 17:15:26,Twitter Web App,0,46,Ministerio de Finanzas de Guatemala,17:15:26,http://pbs.twimg.com/profile_images/1471837102618853383/4xfotDwN.jpg
"#GestiónMinfin | El Ministro de Finanzas Públicas, @alvarogricci, asiste a la presentación del #SegundoInformeGT de… https://t.co/JXGyYWEcMZ",https://twitter.com/i/web/status/1482142135818280967,14/01/2022 18:06:36,Twitter Web App,5,1,Ministerio de Finanzas de Guatemala,18:06:36,http://pbs.twimg.com/profile_images/1471837102618853383/4xfotDwN.jpg
"#InformeGT 🇬🇹 | La rendición de cuentas es un eje fundamental en el @GuatemalaGob del Presidente @DrGiammattei, por… https://t.co/xPFeCHqQUH",https://twitter.com/i/web/status/1482153100341358592,14/01/2022 18:50:10,Twitter Web App,1,0,Ministerio de Finanzas de Guatemala,18:50:10,http://pbs.twimg.com/profile_images/1471837102618853383/4xfotDwN.jpg
"#InformeGT 🇬🇹 | En 2021, el @GuatemalaGob del Presidente @DrGiammattei priorizó la inversión en proyectos estratégi… https://t.co/fV0OeXNJqG",https://twitter.com/i/web/status/1482156929635991557,14/01/2022 19:05:23,Twitter Web App,1,1,Ministerio de Finanzas de Guatemala,19:05:23,http://pbs.twimg.com/profile_images/1471837102618853383/4xfotDwN.jpg
"RT @GuatemalaGob: El presidente @Alejandro Giammattei, acompañado por su gabinete de gobierno, presentó el #SegundoInformeGT, que incluye a…",https://twitter.com/i/web/status/1482196358413131777,14/01/2022 21:42:04,Twitter for iPhone,0,8,MINEX Guatemala 🇬🇹,21:42:04,http://pbs.twimg.com/profile_images/1471828089491574785/eD5OEVK6.jpg
"RT @GuatemalaGob: Con los resultados alcanzados durante 2021, el gobierno del presidente @DrGiammattei seguirá profundizando en los esfuerz…",https://twitter.com/i/web/status/1482196415552139266,14/01/2022 21:42:18,Twitter for iPhone,0,13,MINEX Guatemala 🇬🇹,21:42:18,http://pbs.twimg.com/profile_images/1471828089491574785/eD5OEVK6.jpg
"RT @DrGiammattei: Como presidente Constitucional de la República de Guatemala, presento mis muestras de solidaridad a todas aquellas person…",https://twitter.com/i/web/status/1482196435877736453,14/01/2022 21:42:22,Twitter for iPhone,0,14,MINEX Guatemala 🇬🇹,21:42:22,http://pbs.twimg.com/profile_images/1471828089491574785/eD5OEVK6.jpg
"RT @DrGiammattei: Hoy, cumpliendo con los principios democráticos de rendición de cuentas y transparencia, presento al pueblo de Guatemala…",https://twitter.com/i/web/status/1482196485768949773,14/01/2022 21:42:34,Twitter for iPhone,0,41,MINEX Guatemala 🇬🇹,21:42:34,http://pbs.twimg.com/profile_images/1471828089491574785/eD5OEVK6.jpg
#InformeNacional https://t.co/XwGTlBQUVT,https://twitter.com/i/web/status/1482209501709225985,14/01/2022 22:34:17,Twitter for iPhone,0,0,MINEX Guatemala 🇬🇹,22:34:17,http://pbs.twimg.com/profile_images/1471828089491574785/eD5OEVK6.jpg
#InformeNacional https://t.co/kWhuL707N9,https://twitter.com/i/web/status/1482217514532757506,14/01/2022 23:06:08,Twitter for Android,3,1,MINEX Guatemala 🇬🇹,23:06:08,http://pbs.twimg.com/profile_images/1471828089491574785/eD5OEVK6.jpg
"RT @SCSPGT: El presidente @DrGiammattei, acompañado por sus ministros, presentó su #SegundoInformeGT, que incluye avances en salud, educaci…",https://twitter.com/i/web/status/1482359077372104708,15/01/2022 08:28:39,Twitter for iPhone,0,3,MINEX Guatemala 🇬🇹,08:28:39,http://pbs.twimg.com/profile_images/1471828089491574785/eD5OEVK6.jpg
"Te compartimos el #InformeNacional: 

✅Presidente presenta segundo informe de gestión ante el @CongresoGuate
✅Pande… https://t.co/n3vVq6n00v",https://twitter.com/i/web/status/1482372114560790529,15/01/2022 09:20:27,Twitter for iPhone,0,0,Ministerio de Finanzas de Guatemala,09:20:27,http://pbs.twimg.com/profile_images/1471837102618853383/4xfotDwN.jpg
"✅Avances en la lucha contra el narcotráfico, seguridad y gobernabilidad
✅Ejecutivo presenta iniciativa de ley para… https://t.co/ict2NBxQhh",https://twitter.com/i/web/status/1482372118444752899,15/01/2022 09:20:28,Twitter for iPhone,2,1,Ministerio de Finanzas de Guatemala,09:20:28,http://pbs.twimg.com/profile_images/1471837102618853383/4xfotDwN.jpg
"El acceso a la vacuna #COVID19 en áreas remotas o vulnerables de las Américas 🌎 es aún muy limitado, mientras que a… https://t.co/2ouAigrfsc",https://twitter.com/i/web/status/1482382065828040705,15/01/2022 10:00:00,Twitter Media Studio,67,37,OPS/OMS,10:00:00,http://pbs.twimg.com/profile_images/1096094749902028801/ijbQWupW.png
RT @GuatemalaGob: #IniciativaDeLey | Con la finalidad de endurecer las penas contra el tráfico de personas para la migración irregular de g…,https://twitter.com/i/web/status/1482405361210564612,15/01/2022 11:32:34,Twitter for Android,0,15,MINEX Guatemala 🇬🇹,11:32:34,http://pbs.twimg.com/profile_images/1471828089491574785/eD5OEVK6.jpg
"#InformeRepúblicaGT
#SegundoInformeGT
#InformeGT https://t.co/ldmKJXhbDD",https://twitter.com/i/web/status/1482406729040252929,15/01/2022 11:38:00,Twitter for Android,7,1,MINEX Guatemala 🇬🇹,11:38:00,http://pbs.twimg.com/profile_images/1471828089491574785/eD5OEVK6.jpg
"Durante la pandemia de COVID-19 🦠, usar tu máscara ✅ correctamente 😷 reduce 👇 el riesgo de #COVID19. 

ℹ️ Obtén más… https://t.co/N6vZpySulo",https://twitter.com/i/web/status/1482427369474383872,15/01/2022 13:00:01,Twitter Web App,31,18,OPS/OMS,13:00:01,http://pbs.twimg.com/profile_images/1096094749902028801/ijbQWupW.png
"#InformeGT 🇬🇹 | El liderazgo y acciones estratégicas del Directorio de la @SATGT, presidido por el Ministro… https://t.co/hBlLQlEZIt",https://twitter.com/i/web/status/1482428152454463488,15/01/2022 13:03:08,Twitter for Android,6,1,Ministerio de Finanzas de Guatemala,13:03:08,http://pbs.twimg.com/profile_images/1471837102618853383/4xfotDwN.jpg
"El virus de la #COVID19 🦠 se propaga principalmente entre personas en contacto estrecho entre sí. 

🔸 Se propaga co… https://t.co/UN4oykqxPU",https://twitter.com/i/web/status/1482487761571434498,15/01/2022 17:00:00,Twitter Web App,133,127,OPS/OMS,17:00:00,http://pbs.twimg.com/profile_images/1096094749902028801/ijbQWupW.png
"Durante la pandemia de COVID-19 🦠, usar tu máscara ✅ correctamente 😷 reduce 👇 el riesgo de #COVID19. 

ℹ️ Obtén más… https://t.co/Be17RCHFxQ",https://twitter.com/i/web/status/1482744454813528065,16/01/2022 10:00:00,Twitter Web App,40,33,OPS/OMS,10:00:00,http://pbs.twimg.com/profile_images/1096094749902028801/ijbQWupW.png
"#GestiónMinfin | En 2021 #Guatemala alcanzó el 98.6% de ejecución del presupuesto operativo, porcentaje más alto re… https://t.co/CHusqGgJi5",https://twitter.com/i/web/status/1482756882125230086,16/01/2022 10:49:23,Twitter for iPhone,5,1,Ministerio de Finanzas de Guatemala,10:49:23,http://pbs.twimg.com/profile_images/1471837102618853383/4xfotDwN.jpg
Desde el pasado 15 de enero iniciaron estas jornadas de vacunación que están enfocadas en las hermandades y feligre… https://t.co/Z2cWbwcgrU,https://twitter.com/i/web/status/1482760150922498054,16/01/2022 11:02:22,Twitter for iPhone,0,0,Ministerio de Salud Pública,11:02:22,http://pbs.twimg.com/profile_images/1471842908043190279/bu1LHFWL.jpg
"La vacunación contra COVID-19 en centros educativos continúa, personal del Distrito IV de Sacatepéquez inmuniza a d… https://t.co/rSRwwHLBg9",https://twitter.com/i/web/status/1482762594322726916,16/01/2022 11:12:05,Twitter for iPhone,5,2,Ministerio de Salud Pública,11:12:05,http://pbs.twimg.com/profile_images/1471842908043190279/bu1LHFWL.jpg
Hondureños son remitidos por PNC a Migración https://t.co/2T6zo7JyKK,https://twitter.com/i/web/status/1482781078024765446,16/01/2022 12:25:32,"<a href=""http://publicize.wp.com/"" rel=""nofollow"">WordPress.com",5,1,MinGob,12:25:32,http://pbs.twimg.com/profile_images/1471828174598246407/Y1Lm5nFE.jpg
Elementos Policiales continúan brindando seguridad en fronteras https://t.co/31B3dConrj,https://twitter.com/i/web/status/1482801450698870784,16/01/2022 13:46:29,"<a href=""http://publicize.wp.com/"" rel=""nofollow"">WordPress.com",2,1,MinGob,13:46:29,http://pbs.twimg.com/profile_images/1471828174598246407/Y1Lm5nFE.jpg
"📍 El lugar de vacunación contra la #COVID19 que te corresponde depende de las autoridades de tu país.  

Consulta e… https://t.co/xdn1uaxrUF",https://twitter.com/i/web/status/1482819951995936768,16/01/2022 15:00:00,Twitter Web App,7,3,OPS/OMS,15:00:00,http://pbs.twimg.com/profile_images/1096094749902028801/ijbQWupW.png
#Pasaportes | Compartimos los requisitos para trámite de pasaporte de menores de edad cuando ambos padres han falle… https://t.co/8tzm6GogTg,https://twitter.com/i/web/status/1482836685834665986,16/01/2022 16:06:30,Hootsuite Inc.,1,1,Migración Guatemala,16:06:30,http://pbs.twimg.com/profile_images/1472975116015386625/qXTSRrI2.jpg
#Actualización| #MSPAS informa este domingo 16 de enero de 2022 los casos confirmados por laboratorio en el tablero… https://t.co/MHxrIKDC3q,https://twitter.com/i/web/status/1482839636112285696,16/01/2022 16:18:13,Twitter for iPhone,14,5,Ministerio de Salud Pública,16:18:13,http://pbs.twimg.com/profile_images/1471842908043190279/bu1LHFWL.jpg
⚠️ En el tablero COVID-19 los fallecidos reportados el día anterior se visualizan por la fecha de defunción. Estos… https://t.co/TlQeYhUPxA,https://twitter.com/i/web/status/1482839671533191171,16/01/2022 16:18:22,Twitter for iPhone,1,1,Ministerio de Salud Pública,16:18:22,http://pbs.twimg.com/profile_images/1471842908043190279/bu1LHFWL.jpg
El #MSPAS informa la cantidad de personas que han recibido la primera dosis y el esquema completo de la vacuna cont… https://t.co/mXpk3b47ek,https://twitter.com/i/web/status/1482839918544146445,16/01/2022 16:19:21,Twitter for iPhone,16,4,Ministerio de Salud Pública,16:19:21,http://pbs.twimg.com/profile_images/1471842908043190279/bu1LHFWL.jpg
Personal de salud realiza jornada de vacunación contra COVID-19 en los centros educativos de los municipios de Sant… https://t.co/fX32mTFPdU,https://twitter.com/i/web/status/1482858723731247104,16/01/2022 17:34:04,Twitter for iPhone,5,0,Ministerio de Salud Pública,17:34:04,http://pbs.twimg.com/profile_images/1471842908043190279/bu1LHFWL.jpg
Estos puestos estarán funcionando del 16 al 18 de enero con el objetivo de  inmunizar a toda la comunidad educativa de la región.,https://twitter.com/i/web/status/1482858753347268611,16/01/2022 17:34:11,Twitter for iPhone,1,0,Ministerio de Salud Pública,17:34:11,http://pbs.twimg.com/profile_images/1471842908043190279/bu1LHFWL.jpg
"#MSPAS | Distrito de salud de Camotán, Chiquimula realiza jornada de vacunación COVID-19 para padres de familia y m… https://t.co/3TYl2Tesae",https://twitter.com/i/web/status/1482858996566421505,16/01/2022 17:35:09,Twitter for iPhone,6,0,Ministerio de Salud Pública,17:35:09,http://pbs.twimg.com/profile_images/1471842908043190279/bu1LHFWL.jpg
#Caravana2022 | Durante este día 430 personas fueron retornadas hacia Honduras (420 por el puesto fronterizo de Cor… https://t.co/VZnRkaDFVg,https://twitter.com/i/web/status/1482866202439569411,16/01/2022 18:03:47,Twitter for iPhone,6,3,Migración Guatemala,18:03:47,http://pbs.twimg.com/profile_images/1472975116015386625/qXTSRrI2.jpg
#Pasaportes | 🎥 Conoce el proceso para realizar el trámite de pasaporte. https://t.co/835yVJJ6We,https://twitter.com/i/web/status/1482879138109300739,16/01/2022 18:55:11,Hootsuite Inc.,4,2,Migración Guatemala,18:55:11,http://pbs.twimg.com/profile_images/1472975116015386625/qXTSRrI2.jpg
"#TuDenunciaEsConfidencial 🗣📞🕵🏻‍

#YoDenuncio

Se dará seguimiento y respuesta a toda la información que usted brinde https://t.co/Goj0bEyUUH",https://twitter.com/i/web/status/1482895452299165696,16/01/2022 20:00:01,Twitter Media Studio,6,1,MinGob,20:00:01,http://pbs.twimg.com/profile_images/1471828174598246407/Y1Lm5nFE.jpg
#Pasaportes |👵🏼 Compartimos los requisitos para trámite de pasaporte de personas de la tercera edad. No deben prese… https://t.co/EOdq4SkQan,https://twitter.com/i/web/status/1482910559410569218,16/01/2022 21:00:03,Hootsuite Inc.,3,1,Migración Guatemala,21:00:03,http://pbs.twimg.com/profile_images/1472975116015386625/qXTSRrI2.jpg
RT @GuatemalaGob: #EnDirecto | Entrevista al señor presidente @DrGiammattei en @Noti7Guatemala. https://t.co/FuOr8j3jCH,https://twitter.com/i/web/status/1482912563948101632,16/01/2022 21:08:01,Twitter for Android,0,63,Ministerio de Finanzas de Guatemala,21:08:01,http://pbs.twimg.com/profile_images/1471837102618853383/4xfotDwN.jpg
RT @GuatemalaGob: #EnDirecto | Entrevista al señor presidente @DrGiammattei en @Noti7Guatemala. https://t.co/FuOr8j3jCH,https://twitter.com/i/web/status/1482912900415205377,16/01/2022 21:09:21,Twitter for iPhone,0,63,MINEX Guatemala 🇬🇹,21:09:21,http://pbs.twimg.com/profile_images/1471828089491574785/eD5OEVK6.jpg
RT @GuatemalaGob: #EnDirecto | Entrevista al señor presidente @DrGiammattei en @Noti7Guatemala. https://t.co/FuOr8j3jCH,https://twitter.com/i/web/status/1482913171514052608,16/01/2022 21:10:25,Twitter Web App,0,63,MinGob,21:10:25,http://pbs.twimg.com/profile_images/1471828174598246407/Y1Lm5nFE.jpg
RT @GuatemalaGob: #EnDirecto | Entrevista al señor presidente @DrGiammattei en @Noti7Guatemala. https://t.co/FuOr8j3jCH,https://twitter.com/i/web/status/1482913278082834439,16/01/2022 21:10:51,Twitter Web App,0,63,Ministerio de Salud Pública,21:10:51,http://pbs.twimg.com/profile_images/1471842908043190279/bu1LHFWL.jpg
"¡Buenos días #Guatemala! 🇬🇹

Soldados de la Brigada de Operaciones para Montaña del #EjércitoGT | #MINDEF te saluda… https://t.co/QIoAudcfIc",https://twitter.com/i/web/status/1483050146392903681,17/01/2022 06:14:43,Twitter for Android,21,3,Ejército Guatemala,06:14:43,http://pbs.twimg.com/profile_images/1471838829430640640/0yNoNrwr.jpg
Soldado caído en el cumplimiento del deber. https://t.co/335n7zJZAf,https://twitter.com/i/web/status/1483069590833930243,17/01/2022 07:31:59,Twitter for Android,27,6,Ejército Guatemala,07:31:59,http://pbs.twimg.com/profile_images/1471838829430640640/0yNoNrwr.jpg
"@IsaSotoMayedo @aeroLaAurora @pdh @MinexGt @BrunoRguezP @OIMGuatemala Buen día, el Instituto Guatemalteco de Migrac… https://t.co/zhS3T70Rda",https://twitter.com/i/web/status/1483073082017386499,17/01/2022 07:45:51,Twitter Web App,0,0,Migración Guatemala,07:45:51,http://pbs.twimg.com/profile_images/1472975116015386625/qXTSRrI2.jpg
"@gildanny75 @LeninistaLuis Buen día, le recomendamos detallar su caso, para ayudarle oportunamente.",https://twitter.com/i/web/status/1483073611888050177,17/01/2022 07:47:57,Twitter Web App,0,0,Migración Guatemala,07:47:57,http://pbs.twimg.com/profile_images/1472975116015386625/qXTSRrI2.jpg
"#Extranjería | Las Constancias de  Estatus Migratorio son emitidas directamente en nuestras oficinas, la puedes des… https://t.co/Qwda5fPivU",https://twitter.com/i/web/status/1483074061601325056,17/01/2022 07:49:45,Hootsuite Inc.,0,0,Migración Guatemala,07:49:45,http://pbs.twimg.com/profile_images/1472975116015386625/qXTSRrI2.jpg
Alias “Chuki” sicario del Barrio 18 es detenido en Mixco https://t.co/XarMKQp4QN,https://twitter.com/i/web/status/1483075098307297280,17/01/2022 07:53:52,"<a href=""http://publicize.wp.com/"" rel=""nofollow"">WordPress.com",2,1,MinGob,07:53:52,http://pbs.twimg.com/profile_images/1471828174598246407/Y1Lm5nFE.jpg
"#TuDenunciaEsConfidencial 🗣📞🕵🏻‍

#YoDenuncio

Se dará seguimiento y respuesta a toda la información que usted brinde https://t.co/jJGLaoPcXP",https://twitter.com/i/web/status/1483091744061227008,17/01/2022 09:00:00,Twitter Media Studio,0,0,MinGob,09:00:00,http://pbs.twimg.com/profile_images/1471828174598246407/Y1Lm5nFE.jpg
"Cuarta Brigada de Infantería del #EjércitoGT | #MINDEF apoya al @MinSaludGuate, en la organización y funcionamiento… https://t.co/GOfrwHAKnN",https://twitter.com/i/web/status/1483092810358267909,17/01/2022 09:04:15,Twitter for Android,3,2,Ejército Guatemala,09:04:15,http://pbs.twimg.com/profile_images/1471838829430640640/0yNoNrwr.jpg
"RT @GuatemalaGob: #EnDirecto | El presidente @DrGiammattei participa en la presentación del Acuerdo Gubernativo 164-2021, Reglamento para l…",https://twitter.com/i/web/status/1483096095861493767,17/01/2022 09:17:18,Twitter Web App,0,14,Ministerio de Salud Pública,09:17:18,http://pbs.twimg.com/profile_images/1471842908043190279/bu1LHFWL.jpg
#Escuintla | La Brigada de Paracaidistas a través de la Escuela Militar de Paracaidismo realizó inauguración del Cu… https://t.co/JNLGXEsnwT,https://twitter.com/i/web/status/1483100580759408643,17/01/2022 09:35:07,Twitter for Android,4,3,Ejército Guatemala,09:35:07,http://pbs.twimg.com/profile_images/1471838829430640640/0yNoNrwr.jpg
"Brigada Especial de Operaciones de Selva del #EjércitoGT | #MINDEF apoya al @MinSaludGuate y @MineducGT, en la orga… https://t.co/vhw014ImSe",https://twitter.com/i/web/status/1483103906087387136,17/01/2022 09:48:20,Twitter for Android,2,2,Ejército Guatemala,09:48:20,http://pbs.twimg.com/profile_images/1471838829430640640/0yNoNrwr.jpg
"Brigada de Infantería de Marina del #EjércitoGT | #MINDEF apoya al @MinSaludGuate, en la organización y funcionamie… https://t.co/CXeXcxLzZE",https://twitter.com/i/web/status/1483105684195581954,17/01/2022 09:55:24,Twitter for Android,3,2,Ejército Guatemala,09:55:24,http://pbs.twimg.com/profile_images/1471838829430640640/0yNoNrwr.jpg
"Logros del Ministerio de la Defensa Nacional 2021 💯🇬🇹
⬇️⬇️⬇️
#SegundoInformeGT 
#InformeRepúblicaGT
#InformeGT https://t.co/58jBpcPI9d",https://twitter.com/i/web/status/1483107724397264896,17/01/2022 10:03:30,Twitter for Android,2,2,Ejército Guatemala,10:03:30,http://pbs.twimg.com/profile_images/1471838829430640640/0yNoNrwr.jpg
"Brigada de Paracaidistas del #EjércitoGT | #MINDEF apoya al @MinSaludGuate, en la organización y funcionamiento de… https://t.co/HR7mOL5iIb",https://twitter.com/i/web/status/1483110187611439106,17/01/2022 10:13:18,Twitter for Android,2,2,Ejército Guatemala,10:13:18,http://pbs.twimg.com/profile_images/1471838829430640640/0yNoNrwr.jpg
"Un ejemplo es la aldea San Antonio Las Flores, en el municipio de Chinautla, en la que por tres años consecutivos h… https://t.co/O6WGxHf2zi",https://twitter.com/i/web/status/1483115477866012674,17/01/2022 10:34:19,Twitter Web App,1,0,Gobierno Guatemala,10:34:19,http://pbs.twimg.com/profile_images/1479793855331459074/NqurElHC.jpg
"""Un ejemplo es la aldea San Antonio Las Flores, en el municipio de Chinautla, en la que por tres años consecutivos… https://t.co/txvfWC1bwE",https://twitter.com/i/web/status/1483116182706212869,17/01/2022 10:37:07,Twitter Web App,0,0,Gobierno Guatemala,10:37:07,http://pbs.twimg.com/profile_images/1479793855331459074/NqurElHC.jpg
"#InformeRepúblicaGT

¡Su seguridad es nuestra prioridad!
Bajo las directrices del Ministro de Gobernación,… https://t.co/59110DqdKE",https://twitter.com/i/web/status/1483117386928640009,17/01/2022 10:41:54,Twitter Web App,10,8,MinGob,10:41:54,http://pbs.twimg.com/profile_images/1471828174598246407/Y1Lm5nFE.jpg
"En el Plan de Gobierno del @DrGiammattei se identificó el componente ambiental de manera transversal, la gestión in… https://t.co/aFRYnhdCbW",https://twitter.com/i/web/status/1483117991260831744,17/01/2022 10:44:18,Twitter Web App,1,0,Gobierno Guatemala,10:44:18,http://pbs.twimg.com/profile_images/1479793855331459074/NqurElHC.jpg
"El @DrGiammattei expresa que de la misma forma en que nuestro país crece en población, la generación de residuos y… https://t.co/eymnp4SpWe",https://twitter.com/i/web/status/1483118928960315395,17/01/2022 10:48:02,Twitter Web App,0,0,Gobierno Guatemala,10:48:02,http://pbs.twimg.com/profile_images/1479793855331459074/NqurElHC.jpg
"“Es por ello que hoy, junto al ministro del @marngt, Mario Rojas Espino, tengo el gusto de presentarles un gran log… https://t.co/w72voi5ruu",https://twitter.com/i/web/status/1483120067697065995,17/01/2022 10:52:33,Twitter Web App,2,2,Gobierno Guatemala,10:52:33,http://pbs.twimg.com/profile_images/1479793855331459074/NqurElHC.jpg
"“El Acuerdo Gubernativo 164-2021, Reglamento para la gestión integral de residuos y desechos sólidos tiene por obje… https://t.co/f6BvbVLNZ1",https://twitter.com/i/web/status/1483120706682560512,17/01/2022 10:55:06,Twitter Web App,2,0,Gobierno Guatemala,10:55:06,http://pbs.twimg.com/profile_images/1479793855331459074/NqurElHC.jpg
"“El reglamento también contempla sanciones para quienes no estén dispuestos a cumplir, multas que van desde uno has… https://t.co/RAJWwSW5fu",https://twitter.com/i/web/status/1483121144916021253,17/01/2022 10:56:50,Twitter Web App,0,0,Gobierno Guatemala,10:56:50,http://pbs.twimg.com/profile_images/1479793855331459074/NqurElHC.jpg
"“Guatemala es uno de los 10 países megadiversos del mundo, por eso, nos corresponde trabajar unidos para proteger y… https://t.co/Kkor0rYk7V",https://twitter.com/i/web/status/1483121633724444684,17/01/2022 10:58:47,Twitter Web App,2,2,Gobierno Guatemala,10:58:47,http://pbs.twimg.com/profile_images/1479793855331459074/NqurElHC.jpg
"#YoDenuncio

#DenunciasConfidenciales ☑️

Ingresa a nuestra página web https://t.co/IThYDjFuuk y en la sección de s… https://t.co/bee5g5BEjZ",https://twitter.com/i/web/status/1483121947726606336,17/01/2022 11:00:02,Twitter Media Studio,0,0,MinGob,11:00:02,http://pbs.twimg.com/profile_images/1471828174598246407/Y1Lm5nFE.jpg
#Extranjería | Compartimos los pasos para poder programar cita en línea para notificar residencia. La puedes realiz… https://t.co/jtsFul2l9D,https://twitter.com/i/web/status/1483121977346904071,17/01/2022 11:00:09,Hootsuite Inc.,0,0,Migración Guatemala,11:00:09,http://pbs.twimg.com/profile_images/1472975116015386625/qXTSRrI2.jpg
Elementos de COP detienen a hombre sindicado de delitos sexuales https://t.co/H2yvF8cFAG,https://twitter.com/i/web/status/1483122480810184704,17/01/2022 11:02:09,"<a href=""http://publicize.wp.com/"" rel=""nofollow"">WordPress.com",0,0,MinGob,11:02:09,http://pbs.twimg.com/profile_images/1471828174598246407/Y1Lm5nFE.jpg
#Caravana2022 | Se brindó asistencia humanitaria a 33 personas de nacionalidad nicaragüense que fueron retornadas e… https://t.co/S17E8fUbur,https://twitter.com/i/web/status/1483122894607728645,17/01/2022 11:03:47,Hootsuite Inc.,1,0,Migración Guatemala,11:03:47,http://pbs.twimg.com/profile_images/1472975116015386625/qXTSRrI2.jpg
"Primera Brigada de Infantería del #EjércitoGT | #MINDEF apoya al @MinSaludGuate y @MineducGT, en la organización y… https://t.co/QdGoBCxni8",https://twitter.com/i/web/status/1483123139391504384,17/01/2022 11:04:46,Twitter for Android,5,2,Ejército Guatemala,11:04:46,http://pbs.twimg.com/profile_images/1471838829430640640/0yNoNrwr.jpg
#TodosSomosMigrantes | Compartimos nuestra campaña en Kekchí.  Todos hemos sido migrantes alguna vez en la vida. ¡T… https://t.co/g62RAXVWnF,https://twitter.com/i/web/status/1483123721393033216,17/01/2022 11:07:04,Twitter for iPhone,0,0,Migración Guatemala,11:07:04,http://pbs.twimg.com/profile_images/1472975116015386625/qXTSRrI2.jpg
"""Gracias a FUNCAGUA por el trabajo que hace. Este reconocimiento va con el cariño, respeto y admiración por el trab… https://t.co/6S2ooTcDH8",https://twitter.com/i/web/status/1483123956802539523,17/01/2022 11:08:01,Twitter Web App,2,2,Gobierno Guatemala,11:08:01,http://pbs.twimg.com/profile_images/1479793855331459074/NqurElHC.jpg
#LeyDeMigración | El presidente @DrGiammattei explica iniciativa de ley que busca endurecer penas contra traficante… https://t.co/ZSoWdR2NfS,https://twitter.com/i/web/status/1483129021831565314,17/01/2022 11:28:08,TweetDeck,15,7,Gobierno Guatemala,11:28:08,http://pbs.twimg.com/profile_images/1479793855331459074/NqurElHC.jpg
