name,url,description,datePublished,imagen,pais,Fuente
México dona 4 ventiladores a Guatemala para atención de pacientes Covid 19,https://www.chapintv.com/noticia/mexico-dona-4-ventiladores-a-guatemala-para-atencion-de-pacientes-covid-19/,"El Gobierno de Guatemala, a través del Ministerio de Salud Pública y Asistencia Social (MSPAS), recibió una donación de cuatro ventiladores mecánicos para el abordaje de los casos COVID-19 en la red h",01-06-2021 05:01,https://www.bing.com/th?id=OVFT.HpmzlQ6uDYuBRAisIC-ZnS,Guatemala,Chapin TV
Vacunas covid-19: Salud habilita sistema para registrar adultos mayores de 50 años,https://republica.gt/2021/06/01/vacunas-covid-19-salud-habilita-sistema-para-registrar-adultos-mayores-de-50-anos/,"El Ministerio de Salud habilitó el sistema para el registro de adultos mayores de 50 años, proceso necesario para la vacunación del covid-19.",01-06-2021 16:52,https://www.bing.com/th?id=OVFT.vd5yc7Q9Hjq4gMdaXMG6pS,Guatemala,Republica
Guatemala reporta 1 mil 416 nuevos casos de COVID-19,https://stereo100.com.gt/2021/guatemala-reporta-1-mil-416-nuevos-casos-de-covid-19/,"Por Luis Hernández | Este martes, el Ministerio de Salud Pública y Asistencia Social (MSPAS) reporta en las últimas 24 horas, en Guatemala, 1 mil 416 nuevos casos de COVID-19 y 18 fallecidos registrad",01-06-2021 17:34,https://www.bing.com/th?id=OVFT.X3ogQEZQ0jaOnW67jq4s3S,Guatemala,Stereo 100
Presidente recibe donación de congeladores para trasladar vacunas contra el COVID-19,https://elmetropolitano.com.gt/es/2021/06/01/presidente-recibe-donacion-de-congeladores-para-trasladar-vacunas-contra-el-covid-19/,"Agradecemos esta donación de 21 congeladores que soportan entre -18 y los -20 grados, los cuales serán distribuidos en el interior del país, indicó el presidente Alejandro Giammattei. El mandatario de",01-06-2021 18:43,https://www.bing.com/th?id=OVFT.eHrIgGAMWapxMHBvG__7wi,Guatemala,El Metropolitano
Avon celebra a más de 2.5 millones de Representantes en su día,https://newsinamerica.com/pdcc/gerenciales/2021/avon-celebra-a-mas-de-2-5-millones-de-representantes-en-su-dia/,"Amplia cobertura que brinda a nuestros lectores la información que necesitan para estar actualizados del acontecer centroamericano, caribeño y latinoamericano.",01-06-2021 20:55,https://www.bing.com/th?id=OVFT.Ro9NrK4CdUl_0qHBlxjsci,Guatemala,Periódico Digital Centroamericano y del Caribe
Guatemala tiene 1 mil 416 nuevos casos de coronavirus y 18 fallecidos más,https://www.prensalibre.com/ahora/guatemala/comunitario/guatemala-tiene-1-mil-416-nuevos-casos-de-coronavirus-y-18-fallecidos-mas/,"El Ministerio de Salud procesó 6 mil 275 pruebas para detectar covid-19 en las últimas 24 horas, de las que resultaron positivas 1 mil 416 personas. Además, se reportan 18 fallecidos de fechas",01-06-2021 22:08,https://www.bing.com/th?id=OVFT.VaHO1UVfuEpuAUexKErWky,Guatemala,Prensa Libre
Guatemala ha pagado Q107.8 millones en sistema Covax para compra de vacunas contra Covid 19,https://www.chapintv.com/noticia/guatemala-ha-pagado-q107-8-millones-en-sistema-covax-para-compra-de-vacunas-contra-covid-19/,"A la fecha, Guatemala ha desembolsado más de 100 millones de quetzales a Covax para la compra de vacunas contra el coronavirus.",02-06-2021 04:21,https://www.bing.com/th?id=OVFT.QJ69LOMj-c0HPU0H3Rppuy,Guatemala,Chapin TV
Gobernador de Guatemala se vacunó; argumenta que está en línea de “fuego”,https://lahora.gt/gobernador-de-guatemala-se-vacuno-argumenta-que-esta-en-linea-de-fuego/,"El gobernador del departamento de Guatemala, Carlos Waldemar Barillas, recibió la primera dosis de la vacuna contra el Covid-19 y argumentó que ha estado en primera línea de fuego, ya que realiza trab",02-06-2021 14:29,https://www.bing.com/th?id=OVFT.Blv3Qkm44l8KMtfQXHkzky,Guatemala,La Hora
Desmienten clausura del centro de vacunación Usac por falta de dosis,https://lahora.gt/desmienten-clausura-del-centro-de-vacunacion-usac-por-falta-de-dosis/,Autoridades de la Universidad de San Carlos de Guatemala y la Dirección de Área Central del Ministerio de Salud desmintieron los rumores que circularon desde tempranas horas sobre el posible cierre de,02-06-2021 15:50,https://www.bing.com/th?id=OVFT.R9xAvZfFHn4bTZhp-OGH-C,Guatemala,La Hora
Se inicia registro a personas de 50 años en adelante para Vacunación,https://www.deguate.com/artman/publish/salud_breves/Se-inicia-registro-a-personas-de-50-anos-en-adelante-para-Vacunacion.shtml,"Guatemala. Para fortalecer el proceso de inmunización de los guatemaltecos contra el coronavirus, el Ministerio de Salud Pública y Asistencia Social (MSPAS) mantiene un promedio superior a 20 mil pers",02-06-2021 15:53,https://www.bing.com/th?id=OVFT.8depuNVx5QIQC26oBAneuS,Guatemala,De Guate
Capturan al duodécimo implicado en el caso del “Diario Militar”,https://crnnoticias.com/capturan-al-duodecimo-implicado-en-el-caso-del-diario-militar/,"El juzgado de Mayor Riesgo ""B"" ordenó capturar a Jacobo Esdras Salán Sánchez, el duodécimo implicado en el caso Diario Militar.",02-06-2021 16:11,https://www.bing.com/th?id=OVFT.Jj_MHWfxOHduVqSlAADuOi,Guatemala,CRN Noticias
Trabajadores de Gobernación Departamental son inmunizados contra el Covid-19,https://www.deguate.com/artman/publish/noticias-guatemala/Trabajadores-de-Gobernacion-Departamental-son-inmunizados-contra-el-Covid-19.shtml,"Un total de 40 empleados de la Gobernación Departamental de Guatemala y del Consejo Departamental de Desarrollo comenzaron a ser vacunados contra el Covid-19, por los técnicos del Área de Salud Guatem",02-06-2021 16:14,https://www.bing.com/th?id=OVFT.WZSWxpQTvuBGUX4nubPB8S,Guatemala,De Guate
El parque acuático Xocomil abrirá nuevamente al público en junio de 2021,https://www.guatemala.com/guias/aventura/el-parque-acuatico-xocomil-abrira-nuevamente-al-publico-en-junio-de-2021/,El parque acuático Xocomil anuncia su fecha de reapertura para recibir nuevamente a los visitantes con todas las medidas y protocolos de seguridad.,02-06-2021 17:07,https://www.bing.com/th?id=OVFT.tHPYCBz0r0El87DfpcUglC,Guatemala,Guatemala
