name,url,description,datePublished,imagen,pais,Fuente
Se registra mil 194 casos nuevos de COVID-19,https://elmetropolitano.com.gt/es/2021/05/06/se-registra-mil-194-casos-nuevos-de-covid-19/,"En el país se registraron, en las últimas 24 horas, mil 194 casos nuevos de coronavirus, de acuerdo con el tablero situación de COVID-19, del Ministerio de Salud Pública y Asistencia Social (MSPAS). L",06-05-2021 14:32,https://www.bing.com/th?id=OVFT.-IiIdeCJYFiEPlWha1m49y,Guatemala,El Metropolitano
Ingresa en Guatemala primer lote de vacunas Sputnik V,https://www.deguate.com/artman/publish/salud_breves/Ingresa-en-Guatemala-primer-lote-de-vacunas-Sputnik-V.shtml,"En total, 50 mil dosis de la vacuna Sputnik V ingresó en el país este miércoles, para continuar con el  Plan Nacional de Vacunación contra el Covid-19.",06-05-2021 15:47,https://www.bing.com/th?id=OVFT.zlaZRrx8kpzRK1sab2g1Ti,Guatemala,De Guate
"“Me pidieron que regresara, que no habían pruebas”: Salud limita acceso a test de coronavirus",https://www.guatevision.com/nacionales/me-pidieron-que-regresara-que-no-habian-pruebas-salud-limita-acceso-a-pruebas-de-coronavirus,"Ministerio limita el acceso a las pruebas de coronavirus. Personas esperan días para tener una. La cantidad de casos de covid-19 luego de la tercera ola ha comenzado a disminuir, según las autoridades",06-05-2021 19:08,https://www.bing.com/th?id=OVFT.sm30eYenYv3CFGAM4vZnLC,Guatemala,Guatevision
"Ericka Esteban e Isaac Leiva, los primeros clasificados a Juegos Paralímpicos de Tokio 2020",https://www.guatemala.com/deportes/eventos-multideportivos/ericka-esteban-e-isaac-leiva-primeros-clasificados-juegos-paralimpicos-tokio-2020.html,¡Guatemala tiene a sus primeros representantes! Ericka Esteban e Isaac Leiva son los primeros clasificados a los Juegos Paralímpicos de Tokio 2020.,06-05-2021 20:18,https://www.bing.com/th?id=OVFT.RKlFBPenoMy_HfRjEwKXky,Guatemala,Guatemala
Guatemala reporta 1 mil 150 nuevos casos de COVID-19,https://stereo100.com.gt/2021/guatemala-reporta-1-mil-150-nuevos-casos-de-covid-19/,"Por Luis Hernández | Este jueves, el Ministerio de Salud Pública y Asistencia Social (MSPAS) reporta en las últimas 24 horas, en Guatemala, 1 mil 150 nuevos casos de COVID-19. En el reporte publicado",06-05-2021 21:12,https://www.bing.com/th?id=OVFT.0lR1kulPRpkKNP7y5lxHXi,Guatemala,Stereo 100
COVID-19: Contraloría pide a Salud el contrato de vacunas Sputnik V,https://crnnoticias.com/covid-19-contraloria-pide-a-salud-el-contrato-de-vacunas-sputnik-v/,La Contraloría actuó por las denuncias de supuestas irregularidades en el contrato entre Guatemala y Rusia por las vacunas Sputnik V.,06-05-2021 23:57,https://www.bing.com/th?id=OVFT.tignhshzAgDHKs1YJ5TgiS,Guatemala,CRN Noticias
Inauguran centro de vacunación en el CUM,https://elmetropolitano.com.gt/es/2021/05/07/inauguran-centro-de-vacunacion-en-el-cum/,"Guatemala cuenta con un nuevo puesto de vacunación peatonal, el cual está ubicado en el Centro Universitario Metropolitano (CUM), para atender a adultos mayores de 70 años y contrarrestar el COVID-19.",07-05-2021 00:00,https://www.bing.com/th?id=OVFT.Q-QB9ah0S3CQLNed445eKy,Guatemala,El Metropolitano
Salud reporta mil 150 contagios nuevos de covid-19 y 35 fallecidos,https://www.prensalibre.com/ahora/guatemala/comunitario/salud-reporta-mil-150-contagios-nuevos-de-covid-19-y-35-fallecidos/,"El Ministerio de Salud informó este jueves 6 de mayo que de siete mil 724 pruebas efectuadas en el país, mil 150 dieron positivas por coronavirus, por lo que la suma de contagios alcanza 232 mil",07-05-2021 03:24,https://www.bing.com/th?id=OVFT.VaHO1UVfuEpuAUexKErWky,Guatemala,Prensa Libre
AMLO y Kamala Harris sostendrán una reunión virtual,https://www.chapintv.com/noticia/amlo-y-kamala-harris-sostendran-una-reunion-virtual/,"Se espera que el mandatario mexicano y la vicepresidenta de Estados Unidos hablarán sobre la pandemia de covid-19 y la migración. López Obrador le solicitará aHarris, que se brinde apoyo al programa s",07-05-2021 14:17,https://www.bing.com/th?id=OVFT.P4iM5jDgBkFgjAjoRRsJwi,Guatemala,Chapin TV
Crece descontento por vacunación Covid-19; guatemaltecos se expresan,https://lahora.gt/crece-descontento-por-vacunacion-covid-19-guatemaltecos-se-expresan/,"Por Jeanelly Vásquez jvasquez@lahora.com.gt Por segundo sábado consecutivo, organizaciones sociales convocaron a movilizaciones para exigir un mejor manejo de la pandemia y la compra de vacunas contra",07-05-2021 15:58,https://www.bing.com/th?id=OVFT.zVsWQZ9oXFamfC6feCoNhC,Guatemala,La Hora
MP investiga compra de vacunas Sputnik V; Salud lo ve positivo,https://crnnoticias.com/mp-investiga-compra-de-vacunas-sputnik-v-salud-lo-ve-positivo/,La ministra de Salud catalogó como positiva la investigación de la Fiscalía Contra la Corrupción por la compra de las vacunas Sputnik V.,07-05-2021 21:04,https://www.bing.com/th?id=OVFT.otJm3nk31SKiexTh_ctQGy,Guatemala,CRN Noticias
"COVID-19: Salud registra 1,257 casos en menos de 8 mil pruebas",https://lahora.gt/covid-19-salud-registra-1257-casos-en-menos-de-8-mil-pruebas/,"Por María España mespana@lahora.com.gt El Ministerio de Salud Pública y Asistencia Social (MSPAS) registró 1,257 casos nuevos de Covid-19 en 7,468 pruebas realizadas en las últimas 24 horas. Con este",07-05-2021 21:11,https://www.bing.com/th?id=OVFT.65Ftik2c1AgVeItgGC6CDi,Guatemala,La Hora
Guatemala reporta en las últimas 24 horas 1 mil 257 nuevos casos de COVID-19,https://stereo100.com.gt/2021/guatemala-reporta-en-las-ultimas-24-horas-1-mil-257-nuevos-casos-de-covid-19/,"Por Luis Hernández | Este viernes, el Ministerio de Salud Pública y Asistencia Social (MSPAS) reporta en las últimas 24 horas, en Guatemala, 1 mil 257 nuevos casos de COVID-19 y 18 fallecidos registra",07-05-2021 21:39,https://www.bing.com/th?id=OVFT.dPSNRG7hks1apF7mFWHr5C,Guatemala,Stereo 100
Realizan operativos para prevenir accidentes y verificar protocolos de bioseguridad,https://www.deguate.com/artman/publish/noticias-guatemala/Realizan-operativos-para-prevenir-accidentes-y-verificar-protocolos-de-bioseguridad.shtml,"Para prevenir accidentes y verificar que los pilotos del transporte público  cumplan con las medidas de bioseguridad establecidas para evitar contagios de Covid-19, personal de la Dirección General de",07-05-2021 22:02,https://www.bing.com/th?id=OVFT.4nSgGL39Q-ornSdU9hzbvi,Guatemala,De Guate
Guatemala participa en Reunión Extraordinaria de Autoridades de Turismo de las Américas,https://newsinamerica.com/pdcc/turismo/2021/guatemala-participa-en-reunion-extraordinaria-de-autoridades-de-turismo-de-las-americas/,"Amplia cobertura que brinda a nuestros lectores la información que necesitan para estar actualizados del acontecer centroamericano, caribeño y latinoamericano.",08-05-2021 00:22,https://www.bing.com/th?id=OVFT.M87GYr2-1prs8s79GxkQgi,Guatemala,Periódico Digital Centroamericano y del Caribe
Henkel presenta un fuerte comienzo del año 2021,https://newsinamerica.com/pdcc/economia/2021/henkel-presenta-un-fuerte-comienzo-del-ano-2021/,"Amplia cobertura que brinda a nuestros lectores la información que necesitan para estar actualizados del acontecer centroamericano, caribeño y latinoamericano.",08-05-2021 04:24,https://www.bing.com/th?id=OVFT.yHWb3pgyQUMr_fskolmhoS,Guatemala,Periódico Digital Centroamericano y del Caribe
CUM apoyará como centro de vacunación contra Covid 19 por 4 meses,https://www.chapintv.com/noticia/cum-apoyara-como-centro-de-vacunacion-contra-covid-19-por-4-meses/,"El Ministerio de Salud Pública y Asistencia Social y las autoridades de la Universidad de San Carlos de Guatemala, inauguraron el centro de vacunación instalado en el Centro Universitario Metropolitan",08-05-2021 04:49,https://www.bing.com/th?id=OVFT.XM-biymFZWrkFhKCcZvQbS,Guatemala,Chapin TV
América tiene 500 millones de vacunas anticovid pero la inequidad persiste,https://www.prensalibre.com/ahora/internacional/america-tiene-500-millones-de-vacunas-anticovid-pero-la-inequidad-persiste/,"América ha recibido más de 500 millones de vacunas contra el covid-19 lo que, sin embargo, no ha garantizado el acceso equitativo a la población, especialmente de países como Guatemala, Honduras y",08-05-2021 05:38,https://www.bing.com/th?id=OVFT.-UbqM06lTdRkK_RD45KueC,Guatemala,Prensa Libre
Vacunación masiva incide en la reducción exponencial de muertes y contagios de COVID-19,https://elperiodico.com.gt/nacionales/2021/05/08/vacunacion-masiva-incide-en-la-reduccion-exponencial-de-muertes-y-contagios-de-covid-19/,"Mientras no se vacune a más del 70 por ciento de la población, se debe continuar aplicando el distanciamiento físico, lavado de manos y el uso de mascarilla.",08-05-2021 06:03,https://www.bing.com/th?id=OVFT.vJ6t8KzTVnCcBPE8UvFjLi,Guatemala,El Periódico Guatemala
La crisis del COVID-19 y el desbordante descontento social,https://elperiodico.com.gt/opinion/opiniones-de-hoy/2021/05/08/la-crisis-del-covid-19-y-el-desbordante-descontento-social/,"El actual agravamiento de la crisis del COVID-19 no es un fenómeno inesperado, como tampoco lo fue, en su momento, la misma aparición de un virus anunciado con bastante anticipación. No es sorpresivo,",08-05-2021 06:21,https://www.bing.com/th?id=OVFT.4WzW4TWzJq9vrLj9fmwupi,Guatemala,El Periódico Guatemala
"Coronavirus: “Pruebas solo si tuvo contacto con positivo”, dice la ministra de Salud",https://www.guatevision.com/nacionales/coronavirus-pruebas-solo-si-tuvo-contacto-con-positivo-dice-la-ministra-de-salud,"La ministra Flores recomendó que se busquen pruebas para detectar el coronavirus solo si las personas tienen síntomas, estuvieron en contacto con un positivo o si no usaron mascarilla.",08-05-2021 08:02,https://www.bing.com/th?id=OVFT.m42uuyjaeCbjgKawr2Iwky,Guatemala,Guatevision
