name,url,description,datePublished,imagen,pais,Fuente
"En julio murieron 10 bebés y 3 adolescentes por Covid-19, según tablero de Salud",https://www.publinews.gt/gt/noticias/2020/08/04/muertes-por-covid-19-en-julio.html,"Muertes registradas en julio. Foto: Captura de pantalla. Muertes por Covid-19 en cada departamento El departamento de Guatemala es el que más cantidad de fallecidos acumula hasta la fecha, con un número mayor a 1 mil 300. A este le sigue Escuintla (163), ...",04-08-2020 18:55,https://www.bing.com/th?id=ON.21C3FA44E4B5FF11F67099797F2039BC,Guatemala,Publinews
Pamela Pennington es parte de grupo asesor internacional para tratar el COVID-19,https://www.guatemala.com/noticias/sociedad/pamela-pennington-parte-grupo-asesor-internacional-para-contrarrestar-covid-19.html,La doctora guatemalteca Pamela Pennington es parte de grupo asesor internacional que busca curar el Coronavirus —COVID-19—. ¡Qué orgullo! Pamela Pennington es una reconocida doctora guatemalteca que r,04-08-2020 21:04,https://www.bing.com/th?id=ON.0624D6A41C5486C1F8E322E13555A938,Guatemala,Guatemala
Área central del país muestra tendencia a la baja de casos de covid-19,https://republica.gt/2020/08/04/area-central-del-pais-muestra-tendencia-a-la-baja-de-casos-de-covid-19/,"El área central de Guatemala muestra signos alentadores que permiten anticipar que se entró en un proceso de reducción de contagios de covid-19, según los últimos registros de las autoridades de Salud",04-08-2020 22:37,https://www.bing.com/th?id=ON.9F0808091BECBFC3CAFB76E49DD99406,Guatemala,Republica
LA HORA EN POCOS MINUTOS,https://lahora.gt/la-hora-en-pocos-minutos-81/,"En conferencia de prensa, el director de la Comisión Presidencial de Atención al Covid-19 (Coprecovid), Edwin Asturias, señaló que actualmente desarrollan una estrategia a nivel comunitario para “enca",05-08-2020 00:43,https://www.bing.com/th?id=ON.C73C3BDF747D9BC8160099B43BF36E10,Guatemala,La Hora
Japón busca desarrollar una vacuna contra COVID-19 con gusanos de seda,https://elperiodico.com.gt/insolito/2020/08/05/japon-busca-desarrollar-una-vacuna-contra-covid-19-con-gusanos-de-seda/,Está previsto que los ensayos de la vacuna japonesa en animales empiecen en el transcurso del actual año fiscal que en este país acaba el 31 de marzo de 2021. Japón suma hasta la fecha más de 42.300 contagios y más de 1.000 fallecimientos por COVID-19.,05-08-2020 12:56,https://www.bing.com/th?id=ON.32B6BDC0910BC65563230F8A5D005DB8,Guatemala,El Periódico Guatemala
"COVID-19: 1 mil 145 casos ayer, 3,730 pruebas y 35 fallecidos",https://lahora.gt/covid-19-1-mil-145-casos-ayer-3730-pruebas-y-35-fallecidos/,"El Ministerio de Salud Pública y Asistencia Social (MSPAS) dio a conocer que ayer se registraron un total de 1 mil 145 casos nuevos de COVID-19 en Guatemala, así como el fallecimiento de 35 personas m",05-08-2020 14:34,https://www.bing.com/th?id=ON.6EA30FEE18BC9AFBAEAD8AC830EC91F5,Guatemala,La Hora
Guatemala registra en las últimas 24 horas 1 mil 145 casos de COVID-19 y 35 fallecidos,https://stereo100.com.gt/guatemala-registra-en-las-ultimas-24-horas-1-mil-145-casos-de-covid-19-y-35-fallecidos/,"Este miércoles, el Ministerio de Salud Pública y Asistencia Social (MSPAS) actualizó los datos de casos de COVID-19 en Guatemala e indicó que se registran 1 mil 145 nuevos casos del nuevo coronavirus",05-08-2020 14:46,https://www.bing.com/th?id=ON.5B74E1E02A26D78D1DD9871FB544C2B8,Guatemala,Stereo 100
A propósito de derechos,https://publicogt.com/2020/08/05/a-proposito-de-derechos/,"Hace algunos días, entre la algarabía, el apeñuzcamiento y otros males, el gobierno de Guatemala publicó un comunicado donde ... Comisión Presidencial de Atención a la Emergencia del COVID-19, Coprecovid; que, por cierto, está siendo fuertemente ...",05-08-2020 15:46,https://www.bing.com/th?id=ON.1EF758483A6F9538480E79028CFF1369,Guatemala,Publico GT
Coronavirus: La empresa Disagro donó ventiladores que se utilizarán para atender a pacientes,https://elmetropolitano.com.gt/es/2020/08/05/coronavirus-la-empresa-disagro-dono-ventiladores-que-se-utilizaran-para-atender-a-pacientes/,"La Comisión Presidencial de Centro de Gobierno gestionó la donación de nueve ventiladores mecánicos, que serán distribuidos para atender a pacientes con coronavirus (COVID-19 ... Actualmente, Guatemala reporta 52 mil 365 casos acumulados registrados ...",05-08-2020 15:51,https://www.bing.com/th?id=ON.7F21710F8D4B46FA4C4CADB8C21ADC18,Guatemala,El Metropolitano
Coronavirus se infiltra en clase política de la región,https://stereo100.com.gt/coronavirus-se-infiltra-en-clase-politica-de-la-region/,"La pandemia de coronavirus en Guatemala ha infectado hasta el 4 de agosto de 2020 a 52.365 personas y matado a 2.037, según cifras de la Universidad Johns Hopkins. Como en otros lugares, las estadísti",05-08-2020 16:06,https://www.bing.com/th?id=ON.F9176BE3D0000ACF57F961A3445B825B,Guatemala,Stereo 100
Guatemala amanece con 53 mil 509 casos de Covid-19,https://www.publinews.gt/gt/noticias/2020/08/05/guatemala-amanece-con-53-mil-509-casos-de-covid-19.html,El Ministerio de Salud Pública y Asistencia Social (MSPAS) informó sobre el nuevo número de casos positivos por coronavirus SARS-CoV-2. El tablero electrónico indica que para este miércoles 5 de agost,05-08-2020 17:14,https://www.bing.com/th?id=ON.A8860DCE80ED75B4817FF50657CA59FF,Guatemala,Publinews
Unión Europea dona mascarillas para apoyar la reactivación económica,https://elperiodico.com.gt/nacion/2020/08/05/union-europea-dona-mascarillas-para-apoyar-la-reactivacion-economica/,"La Unión Europea a través del Programa Mipymes y Cooperativas realizó la donación de mascarillas al Ministerio de Economía (MINECO), en apoyo a la Reactivación Económica. La organización entrega un lo",05-08-2020 18:41,https://www.bing.com/th?id=ON.611D18C77FC7742469C1661871347F63,Guatemala,El Periódico Guatemala
Guatemala registra 10 mil 238 casos activos de covid-19,https://republica.gt/2020/08/05/guatemala-registra-10-mil-238-casos-activos-de-covid-19/,El 27 de julio empezó a regir un sistema de alertas que definió la apertura o el cierre de municipios. Todo depende del número de casos que se registren por cada 100 mil habitantes. El sistema está de,05-08-2020 18:43,https://www.bing.com/th?id=ON.B3ED44AA393A2E67DD2D62932FC89086,Guatemala,Republica
Bantrab donó más de 8 mil pruebas y 300 escafandras para la detección del COVID-19,https://www.guatemala.com/noticias/sociedad/bantrab-dono-mas-8-mil-pruebas-300-escafandras-para-deteccion-covid-19.html,"Bantrab donó 8,800 mil pruebas PCR y 300 escafandras, a través de Fundesa, para la detección del Coronavirus —COVID-19—. ¡Qué buena iniciativa! Bantrab donó al Ministerio de Salud Pública y Asistencia",05-08-2020 19:23,https://www.bing.com/th?id=ON.0B5EDFE02506F9EE4A1F47A61EB8AD64,Guatemala,Guatemala
