name,url,description,datePublished,imagen,pais,Fuente
Otras 11 personas mueren por covid-19 y Salud reporta 166 contagios más en Guatemala,https://www.prensalibre.com/guatemala/comunitario/otras-11-personas-mueren-por-covid-19-y-salud-reporta-166-contagios-mas-en-guatemala-breaking/,"Este domingo 15 de noviembre la actualización del tablero de Salud indica que otras 11 personas murieron por covid-19 en Guatemala. El país se acerca a los 4 mil decesos por la enfermedad, pues con es",15-11-2020 21:27,https://www.bing.com/th?id=OVFT.NNGQ7gNLFhtfOgcqVkyyyy,Guatemala,Prensa Libre
En ocho meses Guatemala registra 3 mil 932 muertos por covid-19,https://republica.gt/2020/11/15/en-ocho-meses-guatemala-registra-3-mil-932-muertos-por-covid-19/,"Guatemala sumó 11 decesos y 166 nuevos contagios de covid-19 en las últimas 24 horas, según reportó este domingo el Ministerio de Salud.",15-11-2020 23:26,https://www.bing.com/th?id=OVFT.GdGwhD2YTDRVLZy2FJKOcS,Guatemala,Republica
Se registra 6 mil 308 casos activos de Covid-19 en el país,https://elmetropolitano.com.gt/es/2020/11/16/se-registra-6-mil-308-casos-activos-de-covid-19-en-el-pais/,"En el país hay un registro de 6 mil 308 casos activos de coronavirus. Así se lee en el tablero situación de COVID-19 en Guatemala, del Ministerio de Salud Pública y Asistencia Social (MSPAS). Esta cif",16-11-2020 00:00,https://www.bing.com/th?id=OVFT.7-siCr_IhJQcLcqlgYqj5S,Guatemala,El Metropolitano
Guatemala prevé incremento de lluvias entre martes y viernes por Iota,https://crnnoticias.com/guatemala-preve-incremento-de-lluvias-entre-martes-y-viernes-por-iota/,Autoridades de Guatemala esperan un incremento de lluvias entre martes y el viernes debido al acercamiento del huracán Iota a Centroamérica.,16-11-2020 04:55,https://www.bing.com/th?id=OVFT.W6iHRXh2DP2OLk0vLSIm9S,Guatemala,CRN Noticias
Sálvese quien pueda,https://lahora.gt/salvese-quien-pueda-2/,"No hace mucho, el Presidente dijo que salvarse del Covid-19 era una especie de responsabilidad personal y que cada quien tenía que encargarse de sí mismo tras la decisión oficial de reabrir la activid",16-11-2020 14:50,https://www.bing.com/th?id=OVFT.rQBmPakEq_KWj36T_WuyQS,Guatemala,La Hora
Guatemala supera los 115 mil casos de Covid-19,https://emisorasunidas.com/2020/11/16/casos-coronavirus-guatemala-16-noviembre-2020/,Las autoridades del Ministerio de Salud Pública brindaron la actualización de datos por casos de coronavirus correspondiente para el lunes 16 de noviembre.,16-11-2020 15:25,https://www.bing.com/th?id=OVFT.-KsHl7TA6uinE64ziRprwS,Guatemala,Emisoras Unidas
COVID-19: Guatemala supera los 115 mil casos y suma 3 mil 938 muertes,https://crnnoticias.com/covid-19-guatemala-supera-los-115-mil-casos-y-suma-3-mil-938-muertes/,Guatemala superó este los 115 mil casos de COVID-19 y se acerca a los 4 mil decesos tras la última actualización del Ministerio de Salud.,16-11-2020 17:43,https://www.bing.com/th?id=OVFT.JIdzDfi8qp5RAQ3OIdgPCi,Guatemala,CRN Noticias
Guatemala acumula más de 115 mil casos de COVID-19,https://www.chapintv.com/noticia/guatemala-acumula-mas-de-115-mil-casos-de-covid-19/,"Según las cifras publicadas por el Ministerio de Salud Pública y Asistencia Social, Guatemala acumula un total de 115 mil 32 casos de infectados de COVID-19.",16-11-2020 20:23,https://www.bing.com/th?id=OVFT.6-CONPLgd9e5afddab7tOC,Guatemala,Chapin TV
Contagios de coronavirus en Guatemala fueron de 147 y se reportaron 6 fallecidos en 24 horas,https://www.prensalibre.com/guatemala/comunitario/contagios-de-coronavirus-en-guatemala-fueron-de-147-y-se-reportaron-6-fallecidos-en-24-horas-breaking/,"Las autoridades dieron a conocer que en las últimas 24 horas hubo 147casos positivos de coronavirus en Guatemala, se realizaron 1 mil 096 pruebas en todo el país y se registraron 6 muertes en todo el",16-11-2020 21:33,https://www.bing.com/th?id=OVFT.oQFICBBk5OfJfBiEsrdUwi,Guatemala,Prensa Libre
Mueren otras 6 personas por coronavirus en Guatemala y hay 147 casos positivos nuevos,https://www.guatevision.com/nacionales/mueren-otras-6-personas-por-coronavirus-en-guatemala-y-hay-147-casos-positivos-nuevos-breaking,Contagios totales en Guatemala llegan a 115 mil 032 y cifra de muertos es de 3 mil 938. El Ministerio de Salud se actualizó este 16 de noviembre el Tablero de casos de covid-19 en Guatemala con los da,16-11-2020 21:37,https://www.bing.com/th?id=OVFT.0oBMNckGlj01y53BzBkxJC,Guatemala,Guatevision
Acción Contra el Hambre busca salvar vidas en Guatemala,https://www.guatemala.com/noticias/sociedad/accion-contra-hambre-busca-salvar-vidas-guatemala.html,"Conoce las iniciativas que ha implementado Acción Contra el Hambre en el país, una organización que busca mejorar la vida de cientos de guatemaltecos.",17-11-2020 01:06,https://www.bing.com/th?id=OVFT.JNiq8Nc-8cWkCa_VvCSbsC,Guatemala,Guatemala
Panamá acuerda incentivos a cruceros para impulsará el turismo,https://newsinamerica.com/pdcc/otrasnoticias/2020/guatemala-y-honduras-solicitaran-apoyo-a-cepal-para-realizar-evaluacion-conjunta-de-danos-y-perdidas-por-la-tormenta-tropical-eta,"Guatemala. Durante la reunión sostenida entre los presidentes de Guatemala, Alejandro Giammattei, y de Honduras, Juan Orlando Hernández, se acordó solicitar a la Comisión Económica para América Latina",17-11-2020 01:34,https://www.bing.com/th?id=OVFT.eOwC5fhHBDBHssgaUVvQPi,Guatemala,Periódico Digital Centroamericano y del Caribe
Guatemala reporta 147 nuevos casos de COVID-19,https://www.chapintv.com/noticia/guatemala-reporta-147-nuevos-casos-de-covid-19/,"Según el MSPAS, en las últimas 24 horas se registran 147 nuevos casos de COVID-19 y 6 pacientes fallecidos. Los resultados corresponden a las 1 mil 096 pruebas que se desarrollaron el domingo 15 de no",17-11-2020 05:47,https://www.bing.com/th?id=OVFT.RR75d56gjk3JLt32TXFCGi,Guatemala,Chapin TV
CANG espera aprobación de Salud para elección de magistrado de la CC,https://republica.gt/2020/11/17/colegio-de-abogados-de-guatemala-eleccion-de-magistrado-de-la-cc/,El CANG envió al Ministerio de Salud el protocolo para realizar el proceso de convocatoria para elegir al magistrado titular para CC.,17-11-2020 13:07,https://www.bing.com/th?id=OVFT.0zOz4w9AMVjUmAYR_qKHpC,Guatemala,Republica
Resumen 24 horas: Guatemala reporta 698 nuevos casos de COVID-19 y 9 fallecidos,https://stereo100.com.gt/2020/resumen-24-horas-guatemala-reporta-698-nuevos-casos-de-covid-19-y-9-fallecidos/,"Por Luis Hernández | Este martes, el Ministerio de Salud Pública y Asistencia Social (MSPAS) da a conocer, en sus cuentas en redes sociales, la actualización de casos de COVID-19. El MSPAS informó",17-11-2020 14:50,https://www.bing.com/th?id=OVFT.502CD0ats18DvnWZQ9fY1C,Guatemala,Stereo 100
Estudio en Guatemala reveló bajo riesgo de infección en gimnasios,https://www.guatemala.com/noticias/sociedad/estudio-guatemala-revelo-bajo-riesgo-infeccion-gimnasios.html,Los resultados del estudio demostraron que regresar a los gimnasios puede ser una excelente opción para la salud y bienestar de los guatemaltecos.,17-11-2020 15:03,https://www.bing.com/th?id=OVFT.znC_7o5j2RvSpOZns43mfy,Guatemala,Guatemala
Centroamérica solicita asistencia tras devastación de huracanes y COVID-19,https://stereo100.com.gt/2020/centroamerica-solicita-asistencia-tras-devastacion-de-huracanes-y-covid-19/,Los presidentes de Centroamérica han solicitado al Banco Centroamericano de Integración Económica (BCIE) que implementen una estrategia conjunta de movilización de recursos para reconstruir las,17-11-2020 16:04,https://www.bing.com/th?id=OVFT.dF1m1xkvxR1V0gxheV6Rny,Guatemala,Stereo 100
Ministerio de Salud reporta 698 casos nuevos de COVID-19,https://elperiodico.com.gt/nacionales/2020/11/17/ministerio-de-salud-reporta-698-casos-nuevos-de-covid-19/,El Ministerio de Salud Pública y Asistencia Social (MSPAS) reporta en el tablero de situación de COVID-19 en el país 698 casos nuevos que corresponden al 16 de noviembre. Adems,17-11-2020 16:30,https://www.bing.com/th?id=OVFT.69nWnF4KhcTLAJFxgK6x8y,Guatemala,El Periódico Guatemala
"Juez perdona a ""burgueses"" de fiesta en mueblería y cierra caso",https://www.deguate.com/artman/publish/noticias-guatemala/juez-perdona-a-burgueses-de-fiesta-en-muebler-a-y-cierra-caso.shtml,Un juez cerró el proceso penal en contra de los implicados en la fiesta clandestina que indignó a los guatemaltecos en carretera a El Salvador en junio,17-11-2020 18:30,https://www.bing.com/th?id=OVFT.jHOPg5ScRqAKT7pJUVdhdy,Guatemala,De Guate
COVID-19 transforma el Galardón Nacional a la Exportación 2020,https://elperiodico.com.gt/economia/2020/11/17/covid-19-transforma-el-galardon-nacional-a-la-exportacion-2020/,"La edición del Galardón Nacional a la Exportación 2020 de la Asociación Guatemalteca de Exportadores (Agexport) ha dado un giro este año, debido a la pandemia del nuevo coronavirus. Para esta ocasión",17-11-2020 18:53,https://www.bing.com/th?id=OVFT._B9HAQHaIfLlB3BnzkLKxC,Guatemala,El Periódico Guatemala
Malacates Trébol Shop brindará concierto en vivo en autocinema,https://emisorasunidas.com/2020/11/17/malacates-trebol-shop-brindara-concierto-en-vivo/,La banda guatemalteca deleitará con sus éxitos en un concierto en vivo que se llevará a cabo en un autocinema de Guatemala. “¿Quieres hacer algo diferente este 21 de noviembre? ¿Quieres salir con toda,17-11-2020 19:17,https://www.bing.com/th?id=OVFT.c_51Gij_pcm34bmlfu13Jy,Guatemala,Emisoras Unidas
La resiliencia en la agricultura,https://newsinamerica.com/pdcc/otrasnoticias/2020/la-resiliencia-en-la-agricultura,"La disponibilidad de alimentos en los hogares guatemaltecos es uno de los pilares en la seguridad alimentaria y nutricional, para ello es indispensable la salud del agricultor siendo uno de los motore",17-11-2020 21:29,https://www.bing.com/th?id=OVFT.QOZwWUOa70EXVHTdn0MdnS,Guatemala,Periódico Digital Centroamericano y del Caribe
Involucrados en fiesta clandestina piden disculpas durante audiencia para no ser enviados a juicio,https://www.deguate.com/artman/publish/seguridad_actualidad/involucrados-en-fiesta-clandestina-piden-disculpas-durante-audiencia-para-no-ser-enviados-a-juicio.shtml,Los involucrados piden disculpas para no ser enviados a juicio. Ahora deben donar equipo médico para socorristas y el hospital del Parque de la,17-11-2020 21:55,https://www.bing.com/th?id=OVFT.qnwwUBWxsuaXrEApJEJuWi,Guatemala,De Guate
Esta fue la ayuda que Estados Unidos le dio a Guatemala por la emergencia que generó Eta,https://www.guatevision.com/nacionales/esta-fue-la-ayuda-que-estados-unidos-le-dio-a-guatemala-por-la-emergencia-que-genero-eta,"Distintas agencias de EE. UU. apoyan a Guatemala con helicópteros, pilotos, víveres e insumos para atender la emergencia que generó Eta en el país.",17-11-2020 21:59,https://www.bing.com/th?id=OVFT.QNUuPvRkO3QWDdiRr_cpDS,Guatemala,Guatevision
