name,url,description,datePublished,imagen,pais,Fuente
“Se unen para ayudar a 20 mil familias con Amor en Caja”,https://lahora.gt/se-unen-para-ayudar-a-20-mil-familias-con-amor-en-caja/,"• Todos pueden apoyar a una familia en necesidad de alimentos durante la emergencia del Covid-19 uniéndose al proyecto “Con tu ayuda, el amor en caja” a través de donaciones desde Q20 a través de la p",06-05-2020 16:38,https://www.bing.com/th?id=ON.37DD50DC220A5EEC712148CA71D7B8BB,Guatemala,La Hora
Covid-19: CIEN realiza análisis sobre medidas adoptadas en Guatemala,https://www.publinews.gt/gt/noticias/2020/05/05/cien-medidas-adoptadas-covid-19.html,"El Centro de Investigaciones Económicas Nacionales (CIEN) presentó la segunda conferencia virtual, de una serie de tres, en las que realizan un análisis de las medidas adoptadas ante la pandemia del n",06-05-2020 18:35,https://www.bing.com/th?id=ON.09E402997B70597FD2457D28537A462E,Guatemala,Publinews
Sobre la inflación en época de covid-19: una instancia de fantología económica,https://plazapublica.com.gt/content/sobre-la-inflacion-en-epoca-de-covid-19-una-instancia-de-fantologia-economica,[1] Una prueba econométrica empleada para constatar la estacionariedad o no de una serie de tiempo es la desarrollada por Dickey y Fuller (1979). Para la serie de tiempo del multiplicador M1 mensual e,06-05-2020 21:47,https://www.bing.com/th?id=ON.C35E9F73481B82A220A98D862EF542CB,Guatemala,Plaza Publica
AGEXPORT presenta tendencias de consumo para readecuar los modelos de negocios de ...,https://newsinamerica.com/pdcc/economia/2020/agexport-presenta-tendencias-de-consumo-para-readecuar-los-modelos-de-negocios-de-las-empresas-guatemaltecas,"Guatemala. Las exportaciones van a sufrir contracción, sin embargo, se estima no mayor a dos dígitos pues los diferentes productos y servicios reaccionaron diferente al shock, esta es una de las concl",07-05-2020 04:17,https://www.bing.com/th?id=ON.203DF756AA869FC68185CA3EF4FD837E,Guatemala,Periódico Digital Centroamericano y del Caribe
Desescalada de restricciones con motivo de la pandemia,https://elperiodico.com.gt/opinion/2020/05/07/desescalada-de-restricciones-con-motivo-de-la-pandemia/,"El martes pasado, la Organización Panamericana de la Salud (OPS), a través de su directora, doctora Carissa F. Etienne, pidió a los países del continente americano cautela a la hora de eliminar o suav",07-05-2020 06:16,https://www.bing.com/th?id=ON.70F07150C746231AED57ADCE960069B9,Guatemala,El Periódico Guatemala
Guatemala en riesgo de crisis alimentaria por COVID-19,https://elperiodico.com.gt/inversion/2020/05/07/guatemala-en-riesgo-de-crisis-alimentaria-por-covid-19/,"Guatemala se encuentra, junto con Haití y Venezuela, entre los países con un alto grado de impacto en el riesgo de reducción de la capacidad adquisitiva para acceder a alimentos. Según el informe Segu",07-05-2020 06:16,https://www.bing.com/th?id=ON.488F1140A058E5B4EAD87B2F372EFCAA,Guatemala,El Periódico Guatemala
VIDEO. Se confirman 35 nuevos casos de Covid-19; ascienden a 798,https://www.publinews.gt/gt/noticias/2020/05/06/casos-coronavirus-guatemala-hoy-6-mayo-2020.html,"El Gobierno de Guatemala confirmó que el miércoles, 6 de mayo se registran nuevos casos de contagios de la pandemia Covid-19 (nuevo) coronavirus en el país. Este es el segundo día consecutivo en el qu",07-05-2020 13:08,https://www.bing.com/th?id=ON.19A825D36546EC55E3FF262C8EE9A6F0,Guatemala,Publinews
Coronavirus: Así se pueden empezar a recuperar las industrias más golpeadas en Guatemala,https://www.prensalibre.com/economia/coronavirus-asi-se-pueden-empezar-a-recuperar-las-industrias-mas-golpeadas-en-guatemala/,"Desde mediados de marzo, Agexport implementó una forma distinta de trabajo por las disposiciones dadas por el presidente Alejandro Giammattei. Algunos de sus sectores dejaron de operar, otros disminuy",07-05-2020 13:11,https://www.bing.com/th?id=ON.25BB63BBBE12618C1C0CB68439EF8120,Guatemala,Prensa Libre
"Menores deportados de México positivos a COVID-19, según AP",https://lahora.gt/menores-deportados-de-mexico-positivos-a-covid-19-segun-ap/,"Cuatro menores que fueron deportados desde México a Guatemala luego de intentar llegar a Estados Unidos dieron positivo al nuevo coronavirus, informó la Secretaría de Bienestar Social de Guatemala. An",07-05-2020 15:58,https://www.bing.com/th?id=ON.B1B206D5EFDEAF9825B8521EDB0FA499,Guatemala,La Hora
Cuatro menores guatemaltecos dan positivo de coronavirus tras ser deportados de México,https://www.prensalibre.com/guatemala/migrantes/cuatro-menores-guatemaltecos-dan-positivo-de-coronavirus-tras-ser-deportados-de-mexico/,"“Los adolescentes traían desde México un informe donde hacía referencia que se encontraban asintomáticos para el COVID-19”, afirmó Torres. Sin embargo, el Ministerio de Salud guatemalteco les hizo pru",07-05-2020 19:33,https://www.bing.com/th?id=ON.06E5C92EB4E558C2E5F4717A4EA665E9,Guatemala,Prensa Libre
BAC Credomatic y CentraRSE invitan a participar en Conversatorio Virtual,https://newsinamerica.com/pdcc/gerenciales/2020/bac-credomatic-y-centrarse-invitan-a-participar-en-conversatorio-virtual,"Debido a la pandemia por el COVID-19, la dinámica en la que se había estado trabajando cambió para muchas mujeres, lo que representa algunos retos para quienes deben de realizar su labor profesional d",07-05-2020 20:16,https://www.bing.com/th?id=ON.CA7C12047266955A15ADE0FF25982F02,Guatemala,Periódico Digital Centroamericano y del Caribe
