name,url,description,datePublished,imagen,pais,Fuente
"Baja cifra de pruebas de coronavirus en Guatemala, se reportan 621 casos nuevos y una positividad de 52.85%",https://www.prensalibre.com/guatemala/comunitario/baja-cifra-de-pruebas-de-coronavirus-en-guatemala-se-reportan-621-casos-nuevos-y-una-positividad-de-52-85-por-ciento-breaking/,El reporte de Salud detalla que se hicieron 1 mil 175 exámenes para detectar covid-19 en todo el país y hubo 26 muertes de casos registrados en rechas anteriores.,15-01-2021 18:43,https://www.bing.com/th?id=OVFT.gmjquO59aUDciD_srY6Y7y,Guatemala,Prensa Libre
"El 50,8 por ciento de casos de COVID-19 se ha presentado en el departamento de Guatemala",https://elmetropolitano.com.gt/es/2021/01/15/el-508-por-ciento-de-casos-de-covid-19-se-ha-presentado-en-el-departamento-de-guatemala/,"El 50,8 por ciento de casos de coronavirus (COVID-19) registrados en todo el país corresponden al departamento de Guatemala. Así lo evidencia el tablero situación de COVID-19, del Ministerio de Salud",15-01-2021 19:09,https://www.bing.com/th?id=OVFT.GxxQfXo8UTjbjJ3_IO_0ty,Guatemala,El Metropolitano
Centros educativos deberán crear comités de atención Covid-19,https://www.chapintv.com/noticia/centros-educativos-deberan-crear-comites-de-atencion-covid-19/,"De acuerdo a una nueva normativa del Mineduc, los centros educativos de Guatemala deberán crear un comité que vigile y atienda la pandemia del Covid-19 en sus instalaciones.",15-01-2021 20:25,https://www.bing.com/th?id=OVFT.4_hX-ll0V07-DNUlIzbBdC,Guatemala,Chapin TV
Guatemala reafirma que no dejará pasar a la caravana de migrantes hondureños,https://crnnoticias.com/guatemala-reafirma-que-no-dejara-pasar-a-la-caravana-de-migrantes-hondurenos/,El Gobierno de Guatemala mantiene firme su posición de no permitir el ingreso al territorio de los miles de migrantes hondureños en caravana.,15-01-2021 20:34,https://www.bing.com/th?id=OVFT.DpOsMoRfZViOXKXtgX_DCi,Guatemala,CRN Noticias
Gobierno decreta Estado de Prevención,https://www.deguate.com/artman/publish/noticias-guatemala/Gobierno-decreta-Estado-de-Prevencion.shtml,"Guatemala. Para garantizar el orden, la gobernabilidad y la seguridad de la población guatemalteca, el presidente Alejandro Giammattei, en Consejo de Ministros, decretó Estado de Prevención por un pla",15-01-2021 20:37,https://www.bing.com/th?id=OVFT.72kdlgROnS8F1lU1Pi0bSy,Guatemala,De Guate
Quiche: Presidente inicia los trabajos para asfaltar un camino rural de Sacapulas,https://elmetropolitano.com.gt/es/2021/01/16/quiche-presidente-inicia-los-trabajos-para-asfaltar-un-camino-rural-de-sacapulas/,"El comienzo de los trabajos para asfaltar un camino rural en Sacapulas, Quiché, se han iniciado este sábado con la visita del presidente Alejandro Giammattei. El tramo carretero tendrá 6,7 kilómetros",16-01-2021 00:00,https://www.bing.com/th?id=OVFT.InB77HN9FyBgkjJChMDNbi,Guatemala,El Metropolitano
"“Somos el país que menos vamos a sufrir económicamente”, dice Giammattei",https://www.deguate.com/artman/publish/noticias-guatemala/somos-el-pais-que-menos-vamos-a-sufrir-economicamente-dice-giammattei.shtml,El presidente Alejandro Giammattei asegura que Guatemala será el país que menos sufrirá económicamente por la pandemia del,16-01-2021 00:24,https://www.bing.com/th?id=OVFT.ErYnKJcHi_teMNj-Tkrqky,Guatemala,De Guate
Cantidad de pruebas de covid-19 bajan en las últimas 24 horas en Guatemala y se reportan 621 casos nuevos,https://www.guatevision.com/nacionales/cantidad-de-pruebas-de-covid-19-bajan-en-las-ultimas-24-horas-en-guatemala-y-se-reportan-621-casos-nuevos-breaking,El reporte de Salud detalla que se hicieron 1 mil 175 exámenes para detectar covid-19 en todo el país y hubo 26 muertes de casos registrados en rechas anteriores.,16-01-2021 00:47,https://www.bing.com/th?id=OVFT.LqKgyLhn_77IaQf4Ni1_Yi,Guatemala,Guatevision
Guatemala tiene 621 nuevos casos de Covid 19,https://www.chapintv.com/noticia/guatemala-tiene-621-nuevos-casos-de-covid-19/,"El Ministerio de Salud reporta 621 nuevos casos de covid-19 detectados en las últimas 24 horas de 1 mil 175 pruebas procesadas. Además, hay 26 fallecidos de fechas anteriores. El total de infectados a",16-01-2021 04:10,https://www.bing.com/th?id=OVFT.RR75d56gjk3JLt32TXFCGi,Guatemala,Chapin TV
Monitorean evolución del flujo migratorio,https://radiotgw.gob.gt/monitorean-evolucion-del-flujo-migratorio/,A la visita también asistió la Representante en Guatemala de la Agencia de las Naciones Unidas ... de contagio y protección de nuestra población por la pandemia del COVID-19.,16-01-2021 13:53,https://www.bing.com/th?id=OVFT.Vs-ZJJ7N2jDnXPl4BGb1CC,Guatemala,TGW
Caravana de migrantes hondureños cruza frontera con Guatemala,https://emisorasunidas.com/2021/01/16/caravana-de-migrantes-hondurenos-cruza-frontera-con-guatemala/,"En la frontera con Guatemala, los migrantes hondureños apretaron la marcha y, tras un forcejeo inicial, lograron ingresar sin enfrentamientos.",16-01-2021 16:29,https://www.bing.com/th?id=OVFT.KAhjXvrru6PLEjiWxctkJS,Guatemala,Emisoras Unidas
Pandemia llega a los 148 mil 598 casos de Covid-19 en el país,https://emisorasunidas.com/2021/01/16/coronavirus-en-guatemala-16-enero-2021-covid/,"La pandemia del nuevo coronavirus ha provocado 5 mil 220  muertes en Guatemala desde que la enfermedad apareció en marzo del año pasado. Desde el comienzo de la pandemia, 148 mil 598 personas contraje",16-01-2021 16:55,https://www.bing.com/th?id=OVFT.YdRjkjUzjlmIWFTshNEFDC,Guatemala,Emisoras Unidas
Migración estima que hasta 8 mil personas integran caravana migrante,https://lahora.gt/migracion-estima-que-hasta-8-mil-personas-integran-caravana-migrante/,"Vídeo IGM Por Grecia Ortíz gortiz@lahora.com.gt Luego que ingresará al país un tercer grupo de migrantes, quienes conforman la nueva caravana que busca llegar a Estados Unidos, el Instituto Guatemalte",16-01-2021 20:46,https://www.bing.com/th?id=OVFT.Fkqdb7LlY4Nn6a9l8d956y,Guatemala,La Hora
Guatemala pide a Honduras contener las caravanas de migrantes,https://crnnoticias.com/guatemala-pide-a-honduras-contener-las-caravanas-de-migrantes/,"Según estimaciones, nueve mil hondureños ingresaron al país desde el viernes. Guatemala reforzó sus fronteras con elementos policiales.",16-01-2021 20:50,https://www.bing.com/th?id=OVFT.PgsITmn4-iwByuJ7r5LCKy,Guatemala,CRN Noticias
Giammattei anuncia que en febrero se espera la llegada de las vacunas contra el covid-19,https://republica.gt/2021/01/16/giammattei-anuncia-que-en-febrero-se-espera-la-llegada-de-las-vacunas-contra-el-covid-19/,"Durante su visita a San Juan Ostuncalco, Quetzaltenango, para la inauguración de un tramo de carretera, el presidente Alejandro",16-01-2021 23:23,https://www.bing.com/th?id=OVFT.AplT9383q0RcJjALzhYkCS,Guatemala,Republica
Migrantes de caravana rompen cerco; autoridades detienen flujo de nuevo,https://lahora.gt/migrantes-de-caravana-rompen-cerco-autoridades-detienen-flujo-de-nuevo/,"Foto Pastoral de Movilidad Humana/Video: IGM Por Grecia Ortíz gortiz@lahora.com.gt Un estimado de 3,500 personas que forman parte de la nueva caravana de migrantes que salió de Honduras el 14 de enero",17-01-2021 00:10,https://www.bing.com/th?id=OVFT.1SkBzxsmA42KuVls57NJWC,Guatemala,La Hora
Guatemala se pronuncia mientras hondureños avanzan por su territorio,https://stereo100.com.gt/2021/guatemala-se-pronuncia-mientras-hondurenos-avanzan-por-su-territorio/,Con información de Prensa Libre. Guatemala le pide a Honduras que detenga la salida masiva de su población. El Gobierno de Guatemala hizo un llamado este sábado 16 de enero a Honduras para “contener l,17-01-2021 01:26,https://www.bing.com/th?id=OVFT.8VIB3j8RfXsLCwy9bbvvti,Guatemala,Stereo 100
"Guatemala otra vez reporta más de 1 mil casos de COVID-19, en 24 horas",https://stereo100.com.gt/2021/guatemala-otra-vez-reporta-mas-de-1-mil-casos-de-covid-19-en-24-horas/,"Guatemala. El Ministerio de Salud reportó 1,038 nuevos contagios de Coronavirus Covid-19 este sábado 16 de enero, tras efectuar 5 mil 670 hisopados. En las últimas tres semanas, la mayoría de días se",17-01-2021 02:47,https://www.bing.com/th?id=OVFT.aHJW71-4z1EmvEOqc61sgy,Guatemala,Stereo 100
Honduras y países conectados con el mundo Maya acuerdan impulsar el turismo,https://newsinamerica.com/pdcc/turismo/2021/honduras-y-paises-conectados-con-el-mundo-maya-acuerdan-impulsar-el-turismo/,"Honduras y otros países como México, El Salvador, Guatemala y Belice acordaron impulsar el turismo durante la celebración de la Rueda de Negocios Virtual organizada por Mundo Maya. Durante la reunión,",17-01-2021 02:53,https://www.bing.com/th?id=OVFT.xzxITiVfEPBzY5UJtzXV4i,Guatemala,Periódico Digital Centroamericano y del Caribe
Presidente Giammattei presenta Informe General de la República 2020,https://radiotgw.gob.gt/presidente-giammattei-presenta-informe-general-de-la-republica-2020/,"TGW Digital – El presidente constitucional de la República, Doctor Alejandro Giammattei, presentó el Informe General de la República 2020; le acompañaron en la mesa principal Allan Rodríguez, titular del Congreso de Guatemala, y Silvia Patricia ...",17-01-2021 03:16,https://www.bing.com/th?id=OVFT.LLcaMLgl3MFUVf5ghAIaYC,Guatemala,TGW
El COVID-19 aumenta en silencio,https://elperiodico.com.gt/noticias/domingo/2021/01/17/el-covid-19-aumenta-en-silencio/,"El personal de salud empieza a ver cómo nuevamente las camas se llenan, los insumos se agotan y los medicamentos son insuficientes.",17-01-2021 06:28,https://www.bing.com/th?id=OVFT.EGyEP45Sv3Y8gU2C36ySWC,Guatemala,El Periódico Guatemala
Precio de la vacuna contra el COVID-19 será público,https://elperiodico.com.gt/nacionales/2021/01/17/precio-de-la-vacuna-contra-el-covid-19-sera-publico/,"Según la poca información que se ha revelado, los precios de la vacuna van de Q16 hasta Q137. Estos precios no son fijos y pueden variar.",17-01-2021 06:35,https://www.bing.com/th?id=OVFT.xUx5iYVU07zF5gYf2SG0Uy,Guatemala,El Periódico Guatemala
Verificamos por usted: ¿La vacuna contra el coronavirus ya está a la venta en Guatemala?,https://www.prensalibre.com/guatemala/comunitario/verificamos-por-usted-la-vacuna-contra-el-coronavirus-ya-esta-a-la-venta-en-guatemala/,"Usuarios de redes sociales han alertado sobre un grupo de personas que están ofreciendo y vendiendo una supuesta vacuna contra el covid-19, pero el Ministerio de Salud ya confirmó que la misma es",17-01-2021 07:03,https://www.bing.com/th?id=OVFT.tGjbXV4t7M4ebu8gJtB-9i,Guatemala,Prensa Libre
Verificamos por usted: ¿La vacuna contra el covid-19 ya está a la venta en Guatemala?,https://www.guatevision.com/nacionales/verificamos-por-usted-la-vacuna-contra-el-covid-19-ya-esta-a-la-venta-en-guatemala,"Los primeros reportes de grupos de personas que intentan engañar a los guatemaltecos provienen de Zacapa y de la zona 6 de Mixco. Según varios testimonios, un grupo de personas vestidas con trajes",17-01-2021 07:03,https://www.bing.com/th?id=OVFT.pIBG1yddwEGXmKT9feuoRS,Guatemala,Guatevision
"Migrantes, vacunas y elección de magistrado, los temas de la semana",https://republica.gt/2021/01/17/resumen-de-noticias-de-la-semana-en-guatemala/,"Esta semana los temas relevantes fueron la caravana de migrantes de Honduras, la compra de vacunas y la elección del magistrado de la CC",17-01-2021 07:57,https://www.bing.com/th?id=OVFT.ZVQZ_-857O6tgf5mMV6i7C,Guatemala,Republica
