name,url,description,datePublished,imagen,pais,Fuente
Habilitarán plataforma digital para informar casos de coronavirus,https://republica.gt/2020/07/12/habilitaran-plataforma-digital-para-informar-casos-de-coronavirus/,"El Gobierno habilitará una plataforma virtual para informar sobre los casos de coronavirus Covid-19 en Guatemala. Amelia Flores, ministra de Salud, manifestó que la plataforma digital será habilitada",12-07-2020 00:00,https://www.bing.com/th?id=ON.E91D2017FC02E206CA1CF2E1967C5BF6,Guatemala,Republica
Rusia presenta desde Guatemala a América Latina su medicamento contra el covid-19,https://elmetropolitano.com.gt/es/2020/07/11/rusia-presenta-desde-guatemala-a-america-latina-su-medicamento-contra-el-covid-19/,"La Embajada de Rusia en Guatemala junto con el Fondo de Inversión Directa de Rusia (RDIF) han realizado este viernes una presentación del Avifavir, medicamento contra el coronavirus, para América Lati",12-07-2020 04:01,https://www.bing.com/th?id=ON.0903F3503C9CDDCDCC079B36DFE1EF7F,Guatemala,El Metropolitano
El desparasitante que se incluiría en los kits que se distribuirán para pacientes leves de covid-19,https://www.prensalibre.com/guatemala/comunitario/el-desparasitante-que-se-incluiria-en-los-kits-que-se-distribuiran-para-pacientes-leves-de-covid-19/,"Dichos conjuntos contendrán “las medicinas precisas y en las dosis ideales”, afirmó la funcionaria. Entre estas destaca la ivermectina, un desparasitante que ya es utilizado en el país para combatir e",12-07-2020 08:33,https://www.bing.com/th?id=ON.CD2AAB49B0E27BEA6D36D8247F072B6C,Guatemala,Prensa Libre
América Latina primera en recibir el medicamento contra el covid-19,https://aldia.com.gt/2020/07/12/america-latina-primera-en-recibir-el-medicamento-contra-el-covid-19/,"El Avifavir ha sido utilizado con éxito para tratar a más de 30.000 pacientes en 51 regiones de Rusia, según el fabricante del fármaco. Fue oficialmente presentado este viernes para América Latina y e",12-07-2020 14:52,https://www.bing.com/th?id=ON.9D7FC75D20A2477049F89F1E82251B66,Guatemala,Al Dia
"COVID-19: Guatemala suma otros 33 fallecidos, incluidos un médico y un enfermero",https://crnnoticias.com/covid-19-guatemala-suma-otros-33-fallecidos-incluidos-un-medico-y-un-enfermero/,"Guatemala registró este sábado 979 nuevos casos de la COVID-19 y 33 muertes en las últimas 24 horas, incluyendo a un médico y un enfermero. El país contabiliza un total de 1 mil 172 fallecidos por el",12-07-2020 16:28,https://www.bing.com/th?id=ON.3DEC78808E8CDF05398C6AA3EFF322E4,Guatemala,CRN Noticias
Salud reporta 979 casos nuevos de coronavirus y otros 33 fallecidos,https://www.guatevision.com/nacionales/salud-reporta-979-casos-nuevos-de-coronavirus-y-otros-33-fallecidos-breaking,"De acuerdo con los datos proporcionados este sábado, 979 pacientes más dieron positivo por coronavirus y se registraron 33 decesos. Salud reportó 33 muertes por coronavirus este 11 de julio y elevó es",12-07-2020 16:52,https://www.bing.com/th?id=ON.FC5E99FEE001DAD98062137902F85A96,Guatemala,Guatevision
Francia realizará tests virológicos a viajeros procedentes de zonas en riesgo,https://elperiodico.com.gt/mundo/2020/07/12/francia-realizara-tests-virologicos-a-viajeros-procedentes-de-zonas-en-riesgo/,"Francia realizará sistemáticamente test virológicos para detectar COVID-19 en sus aeropuertos a los viajeros procedentes de países de riesgo, anunció el domingo el portavoz del gobierno Gabriel Attal,",12-07-2020 17:43,https://www.bing.com/th?id=ON.30605221335F6A4644C6DE28B0F6FC8E,Guatemala,El Periódico Guatemala
"Actualización diaria de cifras de COVID-19 en Guatemala, domingo 12 de julio",https://stereo100.com.gt/actualizacion-diaria-de-cifras-de-covid-19-en-guatemala-domingo-12-de-julio/,"Con información de Henry Popá. Quetzaltenango. El Ministerio de Salud de Guatemala, reporta 757 casos nuevos de Coronavirus COVID-19, 47 personas más fallecidas por el virus, 141 nuevos casos contabil",12-07-2020 22:30,https://www.bing.com/th?id=ON.26D1D180E9B9C25453FFA46E164488A3,Guatemala,Stereo 100
"Departamento de Guatemala, cerca de superar los 20 mil casos de COVID-19",https://lahora.gt/departamento-de-guatemala-cerca-de-superar-los-20-mil-casos-de-covid-19/,"Mañana se cumplen 4 meses desde que se confirmó el primer caso de COVID-19 en el país y hasta las 23:59 horas del mes del 10 de julio, se han confirmado 28 mil 598 contagios en todo el país. Sin embar",13-07-2020 04:33,https://www.bing.com/th?id=ON.4C9DAB771E5B8D0B567917641E76DE34,Guatemala,La Hora
Disposiciones presidenciales continuarán hasta el 27 de julio,https://crnnoticias.com/disposiciones-presidenciales-continuaran-hasta-el-27-de-julio/,"El Gobierno de Guatemala mantendrá por 15 días más las disposiciones presidenciales emitidas por Alejandro Giammattei, que afectan la movilidad de vehículos y personas como medida de prevención del co",13-07-2020 05:07,https://www.bing.com/th?id=ON.B0AB81BFB06CB6F19DECB5FD4559C6B6,Guatemala,CRN Noticias
Guatemala: el país de los lamentos,https://elperiodico.com.gt/opinion/2020/07/13/guatemala-el-pais-de-los-lamentos/,"Mientras la pandemia de la COVID-19 arrasa Guatemala a la vista ciega de las autoridades -concretamente del ejecutivo- el país está convirtiéndose, una vez más, en una letanía de lamentos. Este pareciera ser un ciclo macabro de duelo. Con cada ...",13-07-2020 06:53,https://www.bing.com/th?id=ON.53034AEF4B46F1580541BBE9D38F7593,Guatemala,El Periódico Guatemala
"Coronavirus: Joram Gil, expresidente del Colegio de Ingenieros, fallece a causa del Covid-19",https://www.prensalibre.com/guatemala/comunitario/coronavirus-joram-gil-expresidente-del-colegio-de-ingenieros-fallece-a-causa-del-covid-19/,"El expresidente del Colegio de Ingenieros de Guatemala, Joram Matías Gil Laroj, murió el sábado último a consecuencia del coronavirus, se informó este domingo 12 de julio. La Universidad de San Carlos",13-07-2020 11:21,https://www.bing.com/th?id=ON.0DD4E356F7D927AB83EFD700403F0B80,Guatemala,Prensa Libre
Guatemala usará un sistema de alertas para la COVID-19 a partir del 27 de julio,https://newsinamerica.com/pdcc/boletin/2020/guatemala-usara-un-sistema-de-alertas-para-la-covid-19-a-partir-del-27-de-julio,"“No quiero hablar de apertura, sino de recuperación”, dijo el mandatario en una cadena nacional al indicar que ahora los poblados con menos de cinco casos por cada 100.000 habitantes pueden iniciar un",13-07-2020 13:54,https://www.bing.com/th?id=ON.FEF3A3844BA8844FA62332D225899D54,Guatemala,Periódico Digital Centroamericano y del Caribe
Director de Coprecovid informa sobre tablero de alertas por COVID-19,https://stereo100.com.gt/director-de-coprecovid-informa-sobre-tablero-de-alertas-por-covid-19/,"Este lunes, en una entrevista en el canal del Gobierno de Guatemala, el director de la Comisión Presidencial de Atención de la Emergencia Covid-19 (Coprecovid), Edwin Asturias, informó sobre el tabler",13-07-2020 14:45,https://www.bing.com/th?id=ON.DE6C928D6112A8F91C2D415B2E9B2D3D,Guatemala,Stereo 100
Presupuesto Abierto 2021: Reactivación económica se enfocará en la inversión social,https://newsinamerica.com/pdcc/boletin/2020/presupuesto-abierto-2021-reactivacion-economica-se-enfocara-en-la-inversion-social,"Guatemala. La secretaria de Planificación y Planificación ... muy importante para superar los efectos de la pandemia del coronavirus (COVID-19). Para el próximo año, el Minfin proyecta, preliminarmente, un presupuesto de 96 mil millones de quetzales.",13-07-2020 14:58,https://www.bing.com/th?id=ON.832C464A375E64E043FDFF3422FE5618,Guatemala,Periódico Digital Centroamericano y del Caribe
Guatemala espera que el Avifavir pase a su Fase III de su estudio,https://lahora.gt/guatemala-espera-que-el-avifavir-pase-a-su-fase-iii-de-su-estudio/,"... en Guatemala emitió ayer un comunicado de prensa en el que indican que Guatemala no rechazó el uso del medicamento ruso Avifavir para tratar a pacientes con COVID-19. En tal sentido, rechazaron lo que se ha publicado en algunos medios de ...",13-07-2020 15:23,https://www.bing.com/th?id=ON.F980972D93B1431709C0A816BDD954B4,Guatemala,La Hora
Coronavirus: Guatemala está por llegar a los 30 mil casos y sobrepasa los mil 200 decesos,https://www.guatevision.com/nacionales/coronavirus-guatemala-esta-por-llegar-a-los-30-mil-casos-y-sobrepasa-los-1200-decesos,"El Ministerio de Salud informó este domingo que se registraron 757 contagios nuevos de coronavirus, en tanto que 47 pacientes más fallecieron. La cartera de Salud informó que 757 resultaron contagiada",13-07-2020 15:24,https://www.bing.com/th?id=ON.E4F33B745165DAA703CFE7B24C20BA18,Guatemala,Guatevision
DA Studio Fotográfico toma fotografías gratis a emprendedores en julio y agosto 2020,https://www.guatemala.com/noticias/sociedad/da-studio-fotografico-toma-fotografias-gratis-emprendedores-julio-agosto-2020.html,"DA Studio Fotográfico toma fotografías gratis, a domicilio, a los productos de emprendedores guatemaltecos que necesiten apoyo ante el COVID-19. Debido a la emergencia del Coronavirus —COVID-19— el eq",13-07-2020 15:48,https://www.bing.com/th?id=ON.C6127B575B82C67F7F9F8D924FA322A4,Guatemala,Guatemala
"Guatemalteco, recuperado de COVID-19, donó camas a hospital de Antigua Guatemala en julio 2020",https://www.guatemala.com/noticias/sociedad/guatemalteco-recuperado-covid-19-dono-camas-a-hospital-antigua-guatemala-julio-2020.html,"Guatemalteco, recuperado de Coronavirus —COVID-19—, donó siete camas a Hospital Nacional Pedro De Bethancourt en Antigua Guatemala, Sacatepéquez. Como agradecimiento por la atención recibida, un paciente que se recuperó de Coronavirus —COVID-19 ...",13-07-2020 17:59,https://www.bing.com/th?id=ON.0FF3EA5C8BC423C16A34307C1CC18E12,Guatemala,Guatemala
