name,url,description,datePublished,imagen,pais,Fuente
COVID-19: Salud registra 830 nuevos contagios; casos activos se mantienen arriba de 7 mil,https://lahora.gt/covid-19-salud-registra-830-nuevos-contagios-casos-activos-se-mantienen-arriba-de-7-mil/,"De acuerdo a las estadísticas de la cartera, del total de pruebas, el 18.9% fueron diagnosticados como positivos a Covid-19. VACUNAS ASTRAZENECA El Gobierno de Guatemala informó, este miércoles, sobre la llegada del primer lote de vacunas AstraZeneca ...",10-03-2021 21:27,https://www.bing.com/th?id=OVFT.xjfFY3RSrxWrhUfQV7W2hS,Guatemala,La Hora
Primer lote de vacunas de Covax llega a Guatemala este jueves,https://republica.gt/2021/03/10/guatemala-recibira-el-primer-lote-de-vacunas-con-covax-este-viernes/,Las 81 mil 600 que se recibirán son de la farmacéutica Astrazeneca. Se suman a las 205 mil dosis donadas por India e Israel.,10-03-2021 22:34,https://www.bing.com/th?id=OVFT.YaaRki7a1qLieR-_0Q-rWi,Guatemala,Republica
Comienza vacunación de personal de centros asistenciales privados,https://elmetropolitano.com.gt/es/2021/03/11/comienza-vacunacion-de-personal-de-centros-asistenciales-privados/,"Este día se inició la vacunación contra el coronavirus (COVID-19) a 65 integrantes del personal de salud de primera línea de los hospitales privados del país, informó el Ministerio de Salud Pública y",11-03-2021 00:00,https://www.bing.com/th?id=OVFT.6AWLAKjuSCSXYLwZfX8e9S,Guatemala,El Metropolitano
Directores de áreas de salud reciben vacuna COVID-19,https://elperiodico.com.gt/nacionales/2021/03/11/directores-de-areas-de-salud-reciben-vacuna-covid-19/,"El Ministerio de Salud Pública y Asistencia Social (MSPAS) sigue sin apegarse al Plan Nacional de Vacunación COVID-19 que presentó en febrero, pues empleados administrativos continúan siendo inmunizad",11-03-2021 06:24,https://www.bing.com/th?id=OVFT.GDL95-iKog5mOtSULc1JzS,Guatemala,El Periódico Guatemala
Guatemala recibirá hoy 81 mil 600 dósis de vacunas contra el COVID-19,https://crnnoticias.com/guatemala-recibira-este-jueves-81-mil-600-vacunas-contra-el-covid-19/,"Guatemala recibirá este jueves 81 mil 600 dosis de vacunas contra el COVID-19 por medio del mecanismo COVAX. Mediante un comunicado, las autoridades de Gobierno informaron que se trata del primer enví",11-03-2021 14:28,https://www.bing.com/th?id=OVFT.XNbUlkrSW0IIaiXeI7nF8y,Guatemala,CRN Noticias
Totonicapán sumó 150 fallecidos a consecuencia del COVID-19.,https://crnnoticias.com/totonicapan-sumo-150-fallecidos-a-consecuencia-del-covid-19/,Totonicapán llegó a 150 fallecidos a causa del COVID-19. Autoridades municipales han hecho un llamado a la población para evitar más casos.,11-03-2021 14:57,https://www.bing.com/th?id=OVFT.hyaLDki2smWkc_chHmJFRi,Guatemala,CRN Noticias
Sitio «Our World in Data» ubica a Guatemala en el último lugar en avance de vacunación,https://stereo100.com.gt/2021/sitio-our-world-in-data-ubica-a-guatemala-en-el-ultimo-lugar-en-avance-de-vacunacion/,"Por Redacción Sucesos | Según la página Our World in Data, que recopila información oficial relacionada con el COVID-19 en todos los países, Guatemala es el último de América en avanzar con el proceso",11-03-2021 15:17,https://www.bing.com/th?id=OVFT.0kSRS6zQuPL2R61G2kx01y,Guatemala,Stereo 100
COVID-19: una crisis mundial en 10 momentos clave,https://elperiodico.com.gt/noticias/internacionales/2021/03/11/covid-19-una-crisis-mundial-en-10-momentos-clave-2/,"Este es el resumen de la pandemia de covid-19 en 10 momentos clave, desde el surgimiento en China de una enfermedad desconocida a finales de 2019 a las campañas de vacunación actuales.",11-03-2021 20:58,https://www.bing.com/th?id=OVFT.ck32CPbJmVboHr9VrsgwVy,Guatemala,El Periódico Guatemala
Guatemala recibe la primera dotación de 81 mil 600 vacunas AstraZeneca del mecanismo COVAX,https://radiotgw.gob.gt/guatemala-recibe-la-primera-dotacion-de-81-mil-600-vacunas-astrazeneca-del-mecanismo-covax/,"TGW Digital – El primer lote de Vacuna AstraZeneca, con 81 mil dosis, arribó a Guatemala, tras ser adquirido por medio del Mecanismo COVAX. El Ministerio de Salud Pública y Asistencia Social",11-03-2021 21:09,https://www.bing.com/th?id=OVFT.RxEj6-4i1H-tknj2jSVOxC,Guatemala,TGW
Llegan a Guatemala 81 mil 600 dosis de vacuna contra el COVID-19,https://stereo100.com.gt/2021/llegan-a-guatemala-81-mil-600-dosis-de-vacuna-contra-el-covid-19/,"Por Redacción Multimedia Stereo 100 | Este jueves, llegan a Guatemala las 81 mil 600 dosis de la vacuna contra el COVID-19 AstraZeneca, las cuales se adquirieron por medio del mecanismo Covax de la Or",11-03-2021 22:36,https://www.bing.com/th?id=OVFT.r4OCzmerFoOohPyLXMqvCC,Guatemala,Stereo 100
Guatemala recibe 81 mil 600 dosis de vacunas gestionadas por Covax,https://www.prensalibre.com/guatemala/comunitario/guatemala-recibe-81-mil-600-dosis-de-vacunas-gestionadas-por-covax-breaking/,Ministra de Salud afirma que las vacunas existentes actualmente alcanzan para completar la primera fase del plan de inmunización.,11-03-2021 22:46,https://www.bing.com/th?id=OVFT.L0g_yelUBJai7wpkalsZby,Guatemala,Prensa Libre
Salud se pronuncia por suspensión de vacuna AstraZeneca en Europa y detalla cuál es la situación para Guatemala,https://www.prensalibre.com/guatemala/comunitario/salud-se-pronuncia-por-suspension-de-vacuna-astrazeneca-en-europa-y-detalla-cual-es-la-situacion-para-guatemala/,"El relación a esa información, el Ministerio de Salud de Guatemala informó que tiene información oficial de la Organización Panamericana de la Salud (OPS) que suspendieron la aplicación de la vacuna p",12-03-2021 01:57,https://www.bing.com/th?id=OVFT.1VEc-R_tNVAv2FcRyYW0oi,Guatemala,Prensa Libre
PDH recomienda a Giammattei y al MSPAS garantizar la vacunación universal,https://lahora.gt/pdh-recomienda-a-giammattei-y-al-mspas-garantizar-la-vacunacion-universal/,"Por Lourdes Arana lcarana@lahora.com.gt Por medio de un pronunciamiento, el procurador de los Derechos Humanos, Jordán Rodas, recomendó al Ministerio de Salud Pública y Asistencia Social (MSPAS) adqui",12-03-2021 02:58,https://www.bing.com/th?id=OVFT.sqTOZo2aDaozf5DgLHcJEy,Guatemala,La Hora
Salud reporta otros 750 contagios de coronavirus y nueve decesos más,https://www.guatevision.com/nacionales/salud-reporta-otros-750-contagios-de-coronavirus-y-nueve-decesos-mas-breaking,El Ministerio de Salud informa que en las últimas horas se efectuaron 5 mil 738 pruebas y se diagnosticaron 750 nuevos contagios de covid-19. A escasos días de cumplirse el primer año de que fue anunc,12-03-2021 03:55,https://www.bing.com/th?id=OVFT.NWJnEME9ArtrrMEDUAKWcS,Guatemala,Guatevision
Fotos: Así fue la llegada a Guatemala de las primeras vacunas gestionadas por Covax,https://www.guatevision.com/nacionales/fotos-asi-fue-la-llegada-a-guatemala-de-las-primeras-vacunas-gestionadas-por-covax,"Guatemala recibió este 11 de marzo el primer envío de vacunas AstraZeneca a través del mecanismo Covax de la Organización Mundial de la Salud (OMS). La ministra de Salud, Amelia Flores, dijo que se tr",12-03-2021 04:53,https://www.bing.com/th?id=OVFT.jaIiqmH7JOk6ZNXBvGhBKS,Guatemala,Guatevision
