name,url,description,datePublished,imagen,pais,Fuente
Alejandro Giammattei habla sobre las nuevas medidas para evitar el aumento de casos de COVID-19 en Guatemala,https://crnnoticias.com/covid-19-giammattei-adelanta-nuevas-medidas-contra-la-pandemia/,El gobierno de Guatemala implementará nuevas medidas para intentar frenar la segunda ola de contagios de COVID-19 en el país.,21-01-2021 01:44,https://www.bing.com/th?id=OVFT.z72u-7RBuM4howPTYOboyS,Guatemala,CRN Noticias
Guatemala implementa nuevas medidas para frenar la segunda ola de COVID-19,https://crnnoticias.com/ministra-de-salud-anuncia-nuevas-medidas-para-prevenir-el-covid-19/,El gobierno de Guatemala velará de forma estricta que se cumpla con el aforo de personas en lugares públicos según el semáforo COVID-19.,21-01-2021 02:06,https://www.bing.com/th?id=OVFT.W_9H5bmosJxJcIAs0Q_cGi,Guatemala,CRN Noticias
Ministra de Salud expresa preocupación por descuido de la población y anuncia estas medidas,https://stereo100.com.gt/2021/ministra-de-salud-expresa-preocupacion-por-descuido-de-la-poblacion-y-anuncia-estas-medidas/,"Con información de Herberth Tax y Daniel Ixmatá. Guatemala. Este miércoles 20 de enero, la ministra de salud, Amelia Flores, habló en Cadena Nacional de Radio y Televisión, en referencia al tema de Co",21-01-2021 02:11,https://www.bing.com/th?id=OVFT.mXTTDmFK9ouOV6YjtIxDSS,Guatemala,Stereo 100
Planifique su boda rodeado de naturaleza,https://newsinamerica.com/pdcc/gerenciales/2021/114172/,"Llega Super Chapín, el supermercado 100 por ciento en línea Guatemala. La nueva era digital ha generado cambios en los hábitos de los consumidores, que demandan productos de forma inmediata, cómoda y",21-01-2021 04:59,https://www.bing.com/th?id=OVFT.ev0cdfhyEb81jGC4lSXAQy,Guatemala,Periódico Digital Centroamericano y del Caribe
Coronavirus: Guatemala emite nuevas disposiciones ante el “relajamiento” de la población,https://www.prensalibre.com/guatemala/comunitario/coronavirus-guatemala-reanuda-medidas-ante-el-relajamiento-de-la-poblacion-breaking/,"El Ejecutivo de Guatemala estableció este 20 de enero algunas medidas de mitigación ante el “relajamiento evidente” de la población ante el contagio del coronavirus, que ya supera los 151 mil casos. L",21-01-2021 07:08,https://www.bing.com/th?id=OVFT.oHQ0uaJUZcMdmtkSYPdHxC,Guatemala,Prensa Libre
Gobierno de Guatemala anuncia nuevas restricciones ante el incremento de casos de coronavirus,https://www.guatevision.com/nacionales/gobierno-de-guatemala-anuncia-nuevas-restricciones-ante-el-incremento-de-casos-de-coronavirus,Ministra de Salud anuncia nuevas disposiciones para tratar de contener el avance de la pandemia de coronavirus.,21-01-2021 07:15,https://www.bing.com/th?id=OVFT.zBk6EdAq8ruTUnjHlTVOci,Guatemala,Guatevision
Covid-19: Gobierno oficializa medidas para reducir contagios,https://emisorasunidas.com/2021/01/21/covid-19-gobierno-medidas-reducir-contagios/,El Gobierno de Guatemala oficializó este jueves las medidas que empezaron a regir en el país con el objetivo de contener la pandemia del Covid-19.,21-01-2021 14:54,https://www.bing.com/th?id=OVFT.Vuu0Ej3FNBhpCJW8sErAYS,Guatemala,Emisoras Unidas
Guatemala registra otros 46 decesos por covid-19 y en las últimas horas se reportan más de mil casos,https://www.guatevision.com/nacionales/guatemala-registra-otros-46-decesos-por-covid-19-y-en-las-ultimas-horas-se-reportan-mas-de-mil-casos-breaking,Nuevamente en las últimas horas se superaron las 6 mil pruebas para detectar casos de covid-19. El último reporte del tablero de Salud da cuenta de otras 46 personas fallecidas por covid-19. Según Sal,21-01-2021 22:17,https://www.bing.com/th?id=OVFT.9lIQFCTvV_gD5KtyC8oYHi,Guatemala,Guatevision
"“El impacto que tiene relajar las medidas”, Salud advierte del colapso del sistema la próxima semana por aumento de casos de covid-19",https://www.prensalibre.com/guatemala/comunitario/el-impacto-que-tiene-relajar-las-medidas-salud-advierte-del-colapso-del-sistema-la-proxima-semana-por-aumento-de-casos-de-covid-19/,"Salud advierte colapso del sistema hospitalario por aumento de casos de covid-19, luego de relajación en medidas de prevención.",22-01-2021 01:03,https://www.bing.com/th?id=OVFT.vlj1LQwfoVLD28S5L-IF-i,Guatemala,Prensa Libre
Biden busca mejorar la estrategia contra la pandemia,https://elperiodico.com.gt/noticias/internacionales/2021/01/22/biden-busca-mejorar-la-estrategia-contra-la-pandemia/,"“Las cosas van a seguir empeorando antes de mejorar”, dijo Biden durante un acto en la Casa Blanca, en el que firmó una decena de medidas y decretos para acelerar la respuesta a la pandemia. “La cifra",22-01-2021 06:35,https://www.bing.com/th?id=OVFT.HzqK1x5ktpwSpbyQxKQrni,Guatemala,El Periódico Guatemala
Salud analiza cambios en los protocolos para quienes ingresen al país,https://elperiodico.com.gt/nacionales/2021/01/22/salud-analiza-cambios-en-los-protocolos-para-quienes-ingresen-al-pais/,Actualmente trabajan en los lineamientos para que las personas que ya fueron vacunadas puedan ingresar al país sin mostrar una prueba negativa de COVID-19.,22-01-2021 06:51,https://www.bing.com/th?id=OVFT.nwKmo-qfxhT4UzZ-Z1lPWC,Guatemala,El Periódico Guatemala
