name,url,description,datePublished,imagen,pais,Fuente
Reformas a Ley de Zonas Francas abren oportunidades para nuevas inversiones,https://radiotgw.gob.gt/reformas-a-ley-de-zonas-francas-abren-oportunidades-para-nuevas-inversiones/,TGW Digital – Una puerta más para la reactivación económica del país se abrió ayer en el Congreso de la República con la aprobación de la iniciativa 5174 que reforma la Ley de Zonas Francas.,13-05-2021 19:15,https://www.bing.com/th?id=OVFT.SkkGMYzV00d7XCPDxm6i9i,Guatemala,TGW
"Ángel Barrios, el guatemalteco que representará a Guatemala en el World Class Bartender 2021",https://www.guatemala.com/comida/noticias-gastronomicas/angel-barrios-guatemalteco-representara-guatemala-world-class-2021/,Ángel Barrios es el joven ganador que representará a Guatemala en el concurso mundial World Class Bartender of the Year 2021 que será en junio.,13-05-2021 21:11,https://www.bing.com/th?id=OVFT.KU1rBZbzp3UVaENBAWJWli,Guatemala,Guatemala
Mantienen alerta roja por el Covid-19,https://www.deguate.com/artman/publish/noticias-guatemala/Mantienen-alerta-roja-por-el-Covid-19.shtml,"Autoridades de Salud hacen llamado a respetar las medidas biosanitarias, para evitar que siga el repunte de casos.",14-05-2021 15:35,https://www.bing.com/th?id=OVFT.BP7nmKLlIngJz3HcXqFP0C,Guatemala,De Guate
Reformas a la Ley de Zonas Francas representan hito para la reactivación económica,https://radiotgw.gob.gt/reformas-a-la-ley-de-zonas-francas-representan-hito-para-la-reactivacion-economica/,"TGW Digital – Autoridades del Ministerio de Economía (MINECO) y la Superintendencia de Administración Tributaria (SAT) reconocieron este viernes mediante una conferencia de prensa, el",14-05-2021 23:53,https://www.bing.com/th?id=OVFT.nZlJIoxc0h2ng-vlmuApTy,Guatemala,TGW
Aumentan las alertas rojas por la covid-19 a 152 municipios,https://www.chapintv.com/noticia/aumentan-las-alertas-rojas-por-la-covid-19-a-152-municipios/,"Este sábado será publicado en nuevo semáforo de alerta que estará vigente por los próximos 15 días Las alertas rojas municipales por el coronavirus aumentaron en los últimos 15 días en Guatemala, aseg",15-05-2021 04:14,https://www.bing.com/th?id=OVFT.FJV6z2QT-MMdVTSPTMeaYS,Guatemala,Chapin TV
Semáforo covid-19: alza de municipios en rojo no cesa en nueva actualización y Salud vigila de cerca a 11 departamentos,https://www.prensalibre.com/guatemala/comunitario/semaforo-covid-19-alza-de-municipios-en-rojo-no-cesa-en-nueva-actualizacion-y-salud-vigila-de-cerca-a-11-departamentos-breaking/,Autoridades del Ministerio de Salud expresaron este viernes en conferencia de prensa su preocupación por el alza imparable de municipios con alertas rojas en el país.  Salud informó que mañana sábado,15-05-2021 06:01,https://www.bing.com/th?id=OVFT.l7TTTBX59EEsSnQpa7R1NS,Guatemala,Prensa Libre
Detectan la cepa británica del COVID-19 en Guatemala,https://www.chapintv.com/noticia/detectan-la-cepa-britanica-del-covid-19-en-guatemala/,"Autoridades del Ministerio de Salud, confirmaron el ingreso de la variante británica del COVID-19, la cual sería un 90% más contagiosa.",15-05-2021 06:50,https://www.bing.com/th?id=OVFT.sCGPhNJSQytM5V8s5KO8RS,Guatemala,Chapin TV
"Covid-19: Azucena, “Chico” y sus hijos, como millones más, enfrentan las brechas educativas de GT",https://lahora.gt/covid-19-azucena-chico-y-sus-hijos-como-millones-mas-enfrentan-las-brechas-educativas-de-gt/,"Por Margarita Girón jgiron@lahora.com.gt Desde la llegada del COVID-19 a Guatemala, las clases presenciales se interrumpieron, como sucedió alrededor del mundo obligando a los Gobiernos a implementar",15-05-2021 13:58,https://www.bing.com/th?id=OVFT.8dOEFVYU7Tox91Q_3PYoYS,Guatemala,La Hora
Semáforo COVID-19: Municipios en alerta roja aumentan de 138 a 152,https://lahora.gt/semaforo-covid-19-municipios-en-alerta-roja-aumentan-de-138-a-152/,"Por María España mespana@lahora.com.gt El Ministerio de Salud Pública y Asistencia Social (MSPAS) publicó esta mañana la actualización del Sistema de Alertas Sanitarias Covid-19, el cual establece que",15-05-2021 15:18,https://www.bing.com/th?id=OVFT.dD16sq4Ir7yUgGutVOEDOy,Guatemala,La Hora
Municipios en alerta roja siguen aumentando,https://elperiodico.com.gt/nacionales/2021/05/15/municipios-en-alerta-roja-siguen-aumentando/,Los departamentos en alerta roja han aumentado en las últimas tres actualizaciones que publica el Ministerio de Salud Pública y Asistencia Social (MSPAS) cada 15 días. De acuerdo con la actualización,15-05-2021 15:49,https://www.bing.com/th?id=OVFT.oUTiqlo7MUhhOmUrgXyBYy,Guatemala,El Periódico Guatemala
Guatemala entre los cuatro países de América con menos del 1 por ciento de vacunados con las dos dosis,https://elperiodico.com.gt/nacionales/2021/05/15/guatemala-entre-los-cuatro-paises-de-america-con-menos-del-1-por-ciento-de-vacunados-con-las-dos-dosis-1/,"Solo 2.521 personas en Guatemala han recibido las dos dosis de la vacuna, un 0,01 por ciento. Cuatro países de América, Guatemala, Honduras, Paraguay y Venezuela, tienen menos del 1 por ciento de su p",15-05-2021 16:34,https://www.bing.com/th?id=OVFT.IUzZkIsBfb3_NShk2cPJyy,Guatemala,El Periódico Guatemala
Guatemala con menos del 1 % en vacunación completa contra el COVID,https://crnnoticias.com/guatemala-con-menos-del-1-en-vacunacion-completa-contra-el-covid/,"En América, Guatemala, Honduras, Paraguay y Venezuela, tienen menos del 1 % de su población vacunada con dos dosis.",15-05-2021 17:15,https://www.bing.com/th?id=OVFT.THwrMPYrGLIqCqCq0s_55i,Guatemala,CRN Noticias
