name,url,description,datePublished,imagen,pais,Fuente
Guatemala ya contabiliza 4 mil 250 fallecidos por COVID-19. Hoy fueron reportados 198 casos positivos nuevos,https://stereo100.com.gt/2020/guatemala-ya-contabiliza-4-mil-240-fallecidos-por-covid-19-hoy-fueron-reportados-198-casos-positivos-nuevos/,"Con información de @MinSaludGuate Coronavirus | En la actualización de cifras del COVID-19 en el país, este domingo el Ministerio de Salud reporta 198 casos positivos nuevos y 11 muertes más por",06-12-2020 16:23,https://www.bing.com/th?id=OVFT.eKXAF7WNRWvXZ5PtkYNGUC,Guatemala,Stereo 100
Latinoamérica mira al comercio electrónico,https://newsinamerica.com/pdcc/boletin/2020/latinoamerica-mira-al-comercio-electronico,"El fuerte impacto de la Covid-19 en todas las esferas de la economía global sacude hoy con particular virulencia a América Latina, que mira ahora con notable interés al comercio electrónico. En la reg",06-12-2020 16:54,https://www.bing.com/th?id=OVFT.iVdJW0ZzIFg94SW3z536_S,Guatemala,Periódico Digital Centroamericano y del Caribe
"Guatemala, el país con menos afectación económica en Latinoamérica",https://newsinamerica.com/pdcc/economia/2020/guatemala-el-pais-con-menos-afectacion-economica-en-latinoamerica,"Guatemala. La economía guatemalteca es la menos afectada a nivel latinoamericano este año, según el reporte del Banco de Guatemala (Banguat). La entidad indica que la caída del producto interno bruto",06-12-2020 17:06,https://www.bing.com/th?id=OVFT.gPhI2A9A2eVwsxCeJvjdyy,Guatemala,Periódico Digital Centroamericano y del Caribe
Mesa técnica de presupuesto 2021 conoce meta de recaudación fiscal,https://elmetropolitano.com.gt/es/2020/12/07/mesa-tecnica-de-presupuesto-2021-conoce-meta-de-recaudacion-fiscal/,"Durante la reunión de la mesa técnica de presupuesto 2021, que dirigió el vicepresidente Guillermo Castillo, los diversos actores conocieron la meta de recaudación fiscal estimada para el cierre de 20",07-12-2020 00:00,https://www.bing.com/th?id=OVFT.4vmn7Zrvcc3GQRwUDNOlNS,Guatemala,El Metropolitano
Guatemala acumula más de 114 mil casos de Covid-19,https://www.chapintv.com/noticia/guatemala-acumula-mas-de-114-mil-casos-de-covid-19/,"Según informaciones recopiladas por el Ministerio de Salud Pública y Asistencia Social, Guatemala acumula un total de 114 mil 697 casos de Covid-19.",07-12-2020 19:56,https://www.bing.com/th?id=OVFT.lKkE7iVE-xYfPjTWEgwdjS,Guatemala,Chapin TV
Los laboratorios móviles del MSPAS estarán esta semana en Escuintla y Sololá,https://elmetropolitano.com.gt/es/2020/12/07/los-laboratorios-moviles-del-mspas-estaran-esta-semana-en-escuintla-y-solola/,"Los laboratorios móviles del Ministerio de Salud Pública y Asistencia Social (MSPAS) continúan su recorrido por el país, esta semana las unidades móviles estarán en los departamentos de Escuintla y So",07-12-2020 20:09,https://www.bing.com/th?id=OVFT.KHmp-stSl8LS8bPMv2eKFi,Guatemala,El Metropolitano
Guatemala suma 24 fallecidos por COVID-19 y 125 nuevos casos,https://crnnoticias.com/guatemala-suma-24-fallecidos-por-covid-19-y-125-nuevos-casos/,"Guatemala registró este lunes la muerte de 24 personas por COVID-19 y 125 nuevos casos de la enfermedad, según datos oficiales.",07-12-2020 20:51,https://www.bing.com/th?id=OVFT.V-ii08h59AhLGY1F0kKcHC,Guatemala,CRN Noticias
Diputados y Salud abordarán avances para adquirir vacunas contra Covid-19,https://emisorasunidas.com/2020/12/07/diputados-reunion-ministra-salud-vacunas-covid-19/,El bloque Unionista citó a las autoridades de Salud y Finanzas para abordar los avances en el proceso de adquisición de vacunas contra Covid-19.,07-12-2020 22:40,https://www.bing.com/th?id=OVFT.pIlQxqp5P1IGSybdPCgwxy,Guatemala,Emisoras Unidas
Salud supervisa protocolos covid-19 en centros comerciales,https://republica.gt/2020/12/07/salud-supervisa-centros-comerciales/,"El equipo técnico multisectorial que participa en la ejecución del plan está conformado por los ministerios de Salud, Trabajo y Economía, la Comisión Presidencial para la Atención de la Emergencia covid-19 (Coprecovid), Municipalidad de Guatemala ...",08-12-2020 10:55,https://www.bing.com/th?id=OVFT.2X4J3RCH_XbMR9zBWXrbXS,Guatemala,Republica
Hospital General San Juan de Dios recibió donación para apoyar el trabajo de médicos,https://www.guatemala.com/noticias/sociedad/hospital-general-san-juan-dios-recibio-donacion-apoyar-trabajo-medicos.html,El Hospital General San Juan de Dios recibió donación para apoyar el trabajo del personal de salud en primera línea para la atención de la pandemia.,08-12-2020 14:57,https://www.bing.com/th?id=OVFT.gAeRrs1OXFHZiHqbf36o4S,Guatemala,Guatemala
Edwin Asturias presenta su renuncia como director ejecutivo de la Coprecovid,https://www.guatevision.com/nacionales/edwin-asturias-presenta-su-renuncia-como-director-ejecutivo-de-la-coprecovid-breaking,"La renuncia de Asturias es a partir del 31 de diciembre. Edwin Asturias, quien durante estos meses ha dirigido la Comisión Presidencial de Atención a la Emergencia Covid-19 (Coprecovid, informó este m",08-12-2020 15:26,https://www.bing.com/th?id=OVFT.FxpKgbAtNIJn3mRiTdws7C,Guatemala,Guatevision
Coronavirus en Guatemala: ocupación en intensivos está cerca del límite de capacidad,https://www.prensalibre.com/guatemala/comunitario/coronavirus-en-guatemala-ocupacion-en-intensivos-esta-cerca-del-limite-de-capacidad/,"La ocupación en las salas de cuidados intensivos para pacientes con coronavirus ha aumentado en las últimas semanas, según la Coprecovid.",08-12-2020 16:29,https://www.bing.com/th?id=OVFT.mNDc65I6QP-_HVsJaCDmLC,Guatemala,Prensa Libre
Asturias: “Guatemala inicia escalamiento lento pero sostenido de casos de Covid-19”,https://emisorasunidas.com/2020/12/08/aumento-casos-covid-19-diciembre-2020/,"El director de la Coprecovid, Edwin Asturias, informó que Guatemala muestra un aumento de contagios de coronavirus que es ""lento"", pero genera preocupación.",08-12-2020 16:30,https://www.bing.com/th?id=OVFT.V7phq-gx5Kmci_CnBbG9aS,Guatemala,Emisoras Unidas
Caso de COVID-19 y la ocupación de camas en el intensivo van en aumento,https://elperiodico.com.gt/nacionales/2020/12/08/caso-de-covid-19-y-la-ocupacion-de-camas-en-el-intensivo-van-en-aumento/,La Coprecovid advierte que el país podría regresar a un pico de contagios como el que se registró en junio pasado.,08-12-2020 17:42,https://www.bing.com/th?id=OVFT.xA2t3Hp0EqKz1chbNfpFLS,Guatemala,El Periódico Guatemala
Guatemala presenta su reclamo territorial sobre Belice ante La Haya,https://crnnoticias.com/guatemala-presenta-su-reclamo-territorial-sobre-belice-ante-la-haya/,Guatemala presentó de manera oficial su demanda de reclamo territorial sobre Belice frente a la Corte Internacional de Justicia -CIJ-.,08-12-2020 17:47,https://www.bing.com/th?id=OVFT.09hnGejTih55V0UosbSeli,Guatemala,CRN Noticias
Iniciativa Ilumina el Mundo 2020 busca recaudar víveres y juguetes para familias guatemaltecas,https://www.guatemala.com/noticias/vida/iniciativa-ilumina-mundo-2020-busca-recaudar-viveres-juguetes-familias-guatemaltecas.html,Iniciativa Ilumina el Mundo 2020 busca recaudar víveres y juguetes para familias guatemaltecas de escasos recursos y compartir con ellas en navidad.,08-12-2020 17:51,https://www.bing.com/th?id=OVFT.lJhlfg9aoCuv3hH4HVyXrC,Guatemala,Guatemala
Guatemala reporta 798 nuevos casos de COVID-19,https://stereo100.com.gt/2020/guatemala-reporta-798-nuevos-casos-de-covid-19/,"Por Luis Hernández | Este martes, el Ministerio de Salud Pública y Asistencia Social (MSPAS) informó que en las últimas 24 horas, en Guatemala, se registran 798 nuevos casos de COVID-19 y 12",08-12-2020 18:01,https://www.bing.com/th?id=OVFT.u2dg8ZGfCy9qedNgOoIBei,Guatemala,Stereo 100
Coprecovid insta a seguir con las medidas de protección para evitar el covid-19,https://republica.gt/2020/12/08/coprecovid-insta-seguir-con-medidas-de-proteccion-para-evitar-el-covid-19/,"Para no llegar a medidas estrictas, como un nuevo confinamiento, el director de la Comisión Presidencial de Atención a la Emergencia",08-12-2020 19:59,https://www.bing.com/th?id=OVFT.6xHk8lTuO8eKk3zXoZZ3uC,Guatemala,Republica
Coprecovid finalizará su funcionamiento,https://www.chapintv.com/noticia/coprecovid-finalizara-su-funcionamiento/,"La mañana de este martes, el Gobierno de Guatemala anunció el término de la Comisión Presidencial contra el Covid-19 el próximo 31 de diciembre.",08-12-2020 20:33,https://www.bing.com/th?id=OVFT.0CwYEiy2a7hETwMKYdZHey,Guatemala,Chapin TV
Salud reporta 12 decesos por covid-19 en las últimas horas y 798 contagios más,https://www.prensalibre.com/guatemala/comunitario/salud-reporta-12-decesos-por-covid-19-en-las-ultimas-horas-y-798-contagios-mas-breaking/,Los decesos continúan por la pandemia y el acumulado a escala nacional es de 4 mil 286 fallecidos. La cifra de nuevos contagios es de 798 para hacer un total de casos acumulados registrados de 126 mil,08-12-2020 21:54,https://www.bing.com/th?id=OVFT.4hshp6AgtT2c_pLvALu34i,Guatemala,Prensa Libre
Centroamérica y México buscan mitigar migración forzada,https://elperiodico.com.gt/noticias/internacionales/2020/12/08/centroamerica-y-mexico-buscan-mitigar-migracion-forzada/,"Tras una reunión virtual del Marco Integral Regional para la Protección y Soluciones (MIRPS), Guatemala, Belice, El Salvador, Honduras, Costa Rica, Panamá y México, consignaron trabajar «de manera coo",08-12-2020 22:16,https://www.bing.com/th?id=OVFT.aKiTqqgS9c6OPZkZkd60Yy,Guatemala,El Periódico Guatemala
