name,url,description,datePublished,imagen,pais,Fuente
Gerardo Hernández asume como director del Hospital General San Juan de Dios,https://lahora.gt/gerardo-hernandez-asume-como-director-del-hospital-general-san-juan-de-dios/,"Por María España mespana@lahora.com.gt Como parte de la reestructuración del Ministerio de Salud Pública y Asistencia Social (MSPAS), esta mañana fue nombrado el doctor Gerardo David Hernández como nu",04-01-2021 05:00,https://www.bing.com/th?id=OVFT.9BOgxe-_GP4BZafvAEfSjS,Guatemala,La Hora
Nuevo lote de vacunas donadas por la India iniciará a aplicarse este miércoles,https://elmetropolitano.com.gt/es/2021/03/01/nuevo-lote-de-vacunas-donadas-por-la-india-iniciara-a-aplicarse-este-miercoles/,Guatemala recibirá esta semana un nuevo lote de vacuna donadas por la India contra el coronavirus (COVID-19). Son 200 mil dosis destinadas a 100 mil trabajadores en primera línea. “El (próximo) 3 de m,01-03-2021 00:00,https://www.bing.com/th?id=OVFT.qmrxRAzRfypjFmMtoKSFUC,Guatemala,El Metropolitano
"COVID-19: Guatemala registra el 92,6 por ciento de pacientes recuperados",https://elmetropolitano.com.gt/es/2021/03/01/covid-19-guatemala-registra-el-926-por-ciento-de-pacientes-recuperados/,"En Guatemala el 92,6 por ciento de las personas contagiadas por coronavirus (COVID-19) se han recuperado desde que se registró la pandemia, informó el Ministerio de Salud Pública y Asistencia Social (",01-03-2021 00:00,https://www.bing.com/th?id=OVFT.-9kR2rLW8Q6g0I2XRBEL7C,Guatemala,El Metropolitano
"Vacunación continúa para personal de salud, mañana llegan 200 mil dosis donadas por India",https://lahora.gt/vacunacion-continua-para-personal-de-salud-manana-llegan-200-mil-dosis-donadas-por-india/,"Puede leer: Guatemala recibirá vacunas de cuatro farmacéuticas distintas; estudios aseguran efectividad MÁS DE 2 MIL TRABAJADORES DE SALUD HAN RECIBIDO PRIMERA DOSIS Según el Tablero Covid-19, ha sido suministrada la primera dosis de Moderna a 2,224 ...",01-03-2021 22:10,https://www.bing.com/th?id=OVFT.tJVXRP4_WaVBEmDKXmonOy,Guatemala,La Hora
OMS anticipa que el coronavirus ya no causará más muertes en 2022,https://republica.gt/2021/03/01/oms-el-coronavirus-ya-no-causara-mas-muertes-en-2022/,"El director de Emergencias Sanitarias de la OMS, Mike Ryan, consideró ""prematuro y poco realista"" predecir que el nuevo coronavirus",01-03-2021 22:23,https://www.bing.com/th?id=OVFT.ywsOdKu4satlOhPMXpFUVy,Guatemala,Republica
Presidente Alejandro Giammattei coordina primera reunión de Sinaprese,https://www.deguate.com/artman/publish/noticias-guatemala/Presidente-Alejandro-Giammattei-coordina-primera-reunion-de-Sinaprese.shtml,Guatemala. “Tuvimos una reunión con las instituciones que ... que el descanso más grande del año estará nuevamente marcado por la pandemia del Covid-19. Debido a ello se analizó cuál es la situación de los destinos turísticos con base al tablero ...,01-03-2021 22:28,https://www.bing.com/th?id=OVFT.co-Dzenh3jJ1ZfZ3O-KQlS,Guatemala,De Guate
Ingresan 200 mil dosis de la vacuna Covishield contra COVID-19 donadas por India,https://elperiodico.com.gt/nacionales/2021/03/02/ingresan-200-mil-dosis-de-la-vacuna-covishield-contra-covid-19-donadas-por-india/,"India donó a Guatemala 200 mil dosis. Las vacunas serán entregadas a centros asistenciales de los departamentos de Escuintla, Zacapa, Petén y Guatemala a partir de las 7:30 horas del 3 de marzo. Las a",02-03-2021 00:00,https://www.bing.com/th?id=OVFT.zO7RAduutDcEq-nKO74mei,Guatemala,El Periódico Guatemala
Maestros se contagian de covid-19 en escuela y obligan a Chiantla a suspender las clases presenciales,https://www.prensalibre.com/ciudades/huehuetenango/coronavirus-en-guatemala-maestros-se-contagian-de-covid-19-en-chiantla/,"Autoridades de salud coordinaron la suspensión de actividades presenciales en Chiantla, por nueve contagios de docentes.",02-03-2021 02:19,https://www.bing.com/th?id=OVFT.RaKNM2UVaLuD8MAxmvL7rC,Guatemala,Prensa Libre
Guatemala es el país con más fallecidos por COVID-19 en Centroamérica,https://crnnoticias.com/guatemala-supera-6-mil-400-decesos-por-covid-19/,"Guatemala es el país de Centroamérica con más muertes por COVID-19, estos son los datos que reporta el Ministerio de Salud.",02-03-2021 02:24,https://www.bing.com/th?id=OVFT.3lsiQtEPKwG5CT5NjevW0i,Guatemala,CRN Noticias
Hablamos con primera vacunada contra el Covid-19 en Guatemala,https://www.chapintv.com/noticia/hablamos-con-primera-vacunada-contra-el-covid-19-en-guatemala/,Equipo de Telediario conversó con enfermera del Hospital del Parque de la Industria sobre su experiencia Magdalena Guevara fue la primera vacunada contra el Covid-19 en nuestro país. La enfermera del,02-03-2021 13:43,https://www.bing.com/th?id=OVFT.sfkg0ILrUWsOcScyelBA1y,Guatemala,Chapin TV
La doble pandemia que azota a España: la Covid-19 y el socialismo que nos argentiniza,https://republica.gt/2021/03/02/la-doble-pandemia-que-azota-a-espana-la-covid-19-y-el-socialismo-que-nos-argentiniza/,"España sufre dos pandemias: La Covid-19 y el socialismo más intervencionista y menos socialdemócrata, que está mutando a pasos acelerados",02-03-2021 14:09,https://www.bing.com/th?id=OVFT.hD4m8R677xOwudLp8lWtty,Guatemala,Republica
Centroamérica y la inseguridad ciudadana,https://publicogt.com/2021/03/02/centroamerica-y-la-inseguridad-ciudadana/,"Centroamérica constituye el área más pobre y olvidada del subcontinente latinoamericano. La gran mayoría de la población mundial asocia la región con “países bananeros”, y eso es todo el conocimiento",02-03-2021 14:50,https://www.bing.com/th?id=OVFT.4ysJBghjI1gddpI9LfUDXC,Guatemala,Publico GT
"Qué se conoce sobre Covishield, la vacuna contra el COVID-19 que viene de India",https://elperiodico.com.gt/nacionales/2021/03/02/que-se-conoce-sobre-covishield-la-vacuna-contra-el-covid-19-que-viene-de-india/,Las vacunas Covishield donadas por la India ingresan este martes a Guatemala. Un cargamento con 100 mil vacunas “Covishield / ChAdOx1nCoV-19 Corona Virus Vaccine – Recombinant” que fueron donadas por,02-03-2021 18:23,https://www.bing.com/th?id=OVFT.uGqOudSoGDG3EcqhPLzYFC,Guatemala,El Periódico Guatemala
Salud corrige datos y reporta 758 casos nuevos de coronavirus y 10 muertos más por la pandemia,https://www.prensalibre.com/guatemala/comunitario/salud-reporta-mil-124-casos-nuevos-de-coronavirus-y-10-muertos-mas-por-la-pandemia-breaking/,"El total de contagios acumulados registrados es de 175 mil 411 casos desde que comenzó la pandemia del coronavirus. Se registran 10 decesos de fechas anteriores, y en las últimas 24 horas no se regist",03-03-2021 03:01,https://www.bing.com/th?id=OVFT.crcNVoJwuBXimjMTTd-QXi,Guatemala,Prensa Libre
Municipalidad de San Juan Comalapa se convierte en embajadora del sello de bioseguridad turística,https://www.guatemala.com/guias/noticias-turisticas/municipalidad-de-san-juan-comalapa-se-convierte-en-embajadora-del-sello-de-bioseguridad-turistica/,La Municipalidad de San Juan Comalapa es ahora la embajadora del sello de bioseguridad turística de Guatemala para garantizar viajes seguros.,03-03-2021 03:17,https://www.bing.com/th?id=OVFT.Zu9AuUa7t_uzX80gG3LG0S,Guatemala,Guatemala
Arriban a Guatemala 200 mil dosis de vacunas contra COVID-19 donadas por la República de India,https://www.chapintv.com/noticia/arriban-a-guatemala-200-mil-dosis-de-vacunas-contra-covid-19-donadas-por-la-republica-de-india/,"Foto: facebook.com/dgacguatemala La donación de vacunas llegó a suelo guatemalteco la noche del martes 02 de marzo. En horas de la noche del martes 02 de marzo de 2021, arribaron a Guatemala las 200 m",03-03-2021 06:36,https://www.bing.com/th?id=OVFT.EcQqV-mNtC_QjdH4Fb3m8i,Guatemala,Chapin TV
"Coronavirus en Guatemala: con mil 124 casos nuevos, país acumula 175 mil 411 contagios",https://www.guatevision.com/internacionales/coronavirus-en-guatemala-con-mil-124-casos-nuevos-pais-acumula-175-mil-411-contagios-breaking,El Ministerio de Salud informa que en las últimas horas se practicaron 7 mil 989 pruebas y se diagnosticaron mil 124 nuevos casos de covid-19. El total de contagios acumulados registrados es de,03-03-2021 08:16,https://www.bing.com/th?id=OVFT.sAYgQh2hSbjJ97tO3sZ-My,Guatemala,Guatevision
