name,url,description,datePublished,imagen,pais,Fuente
Laboratorio guatemalteco es uno de los pioneros en análisis de nueva cepa del coronavirus,https://elmetropolitano.com.gt/es/2021/01/08/laboratorio-guatemalteco-es-uno-de-los-pioneros-en-analisis-de-nueva-cepa-del-coronavirus/,"El Laboratorio Nacional de Salud (LNS) es uno de los pioneros en la región en elaboración de pruebas para identificación de nueva cepa del SARS-CoV-2, informó el Ministerio de Salud Pública y Asistenc",08-01-2021 00:00,https://www.bing.com/th?id=OVFT.K2c8a-Un3xFyeK1f1-dyjS,Guatemala,El Metropolitano
Covid-19: primera dotación de vacunas de AstraZeneca llegaría en febrero,https://republica.gt/2021/01/07/covid-19-primera-dotacion-de-vacunas-de-astrazeneca-llegaria-en-febrero/,"La primera dotación de vacunas contra el covid-19 de la farmacéutica AstraZeneca llegaría a Guatemala en febrero, confirmó Salud",08-01-2021 03:30,https://www.bing.com/th?id=OVFT.8HDEbZilkCMqyMdxCPmtQS,Guatemala,Republica
Vacuna contra el Covid-19 llegaría a Guatemala en febrero,https://www.chapintv.com/noticia/vacuna-contra-el-covid-19-llegaria-a-guatemala-en-febrero/,El Ministerio de Salud prevé que las primeras vacunas contra el Covid-19 lleguen a Guatemala en febrero. Estas serían adquiridas a través del mecanismo de compra global COVAX.,08-01-2021 04:32,https://www.bing.com/th?id=OVFT.deEk_FMTEnxwH8GoC8olQS,Guatemala,Chapin TV
Intur impulsará recuperación de la industria turística en 2021,https://newsinamerica.com/pdcc/boletin/2021/nosotros-tenemos-la-obligacion-de-vacunar-a-toda-la-poblacion-de-manera-gratuita-dice-ministra-de-salud-respecto-del-covid-19,"Guatemala. A pocos  días de que se presentará al Congreso la iniciativa “Ley para el financiamiento y adquisición de vacunas contra el coronavirus covid 19”, la ministra de Salud, Amelia Flores, se re",08-01-2021 12:39,https://www.bing.com/th?id=OVFT.sXzdwTY0_CT4LDBLnXyGbi,Guatemala,Periódico Digital Centroamericano y del Caribe
Guatemala se encuentra preparada para la recepción de la vacuna contra COVID-19,https://newsinamerica.com/pdcc/boletin/2021/guatemala-se-encuentra-preparada-para-la-recepcion-de-la-vacuna-contra-covid-19,"Guatemala se encuentra preparada para la recepción y almacenaje de las vacunas contra el coronavirus (COVID-19) aseguró Amelia Flores, titular del Ministerio de Salud Pública y Asistencia Social (MSPA",08-01-2021 13:53,https://www.bing.com/th?id=OVFT.sXzdwTY0_CT4LDBLnXyGbi,Guatemala,Periódico Digital Centroamericano y del Caribe
Preocupación ante aumento de casos de COVID-19 en Guatemala,https://www.chapintv.com/noticia/preocupacion-ante-aumento-de-casos-de-covid-19-en-guatemala/,Ministra de Salud indicó que los casos positivos de COVID- 19 han aumentado en los últimos días. Temas: actualidad; Chapín TV; Covid-19; Ministerio de Salud Guatemala; Noti7;,08-01-2021 14:24,https://www.bing.com/th?id=OVFT.S7GHqGmFofGc2nQWkpEQLC,Guatemala,Chapin TV
Guatemala alcanza cifra récord de remesas familiares pese a pandemia,https://emisorasunidas.com/2021/01/08/guatemala-cifra-record-de-remesas/,"Las remesas familiares desde el extranjero, uno de los pilares de Guatemala, creció 8% interanual en 2020 y alcanzó los 11.340 millones de dólares.",08-01-2021 14:55,https://www.bing.com/th?id=OVFT.1xK63AWAj7Bnz90SAu6IAC,Guatemala,Emisoras Unidas
Guatemala a la espera de la vacuna contra COVID-19,https://stereo100.com.gt/2021/guatemala-a-la-espera-de-la-vacuna-contra-covid-19/,"Guatemala tiene como meta vacunar a 11 millones de personas durante 2021, sin embargo, la negociación para adquirir las dosis aún está en proceso. Según la ministra de Salud, Amelia Flores, ya se hizo",08-01-2021 15:34,https://www.bing.com/th?id=OVFT.eLclICaSt5na5yspSm4j8y,Guatemala,Stereo 100
Vacunas contra el covid-19 podrían ingresar en febrero,https://www.deguate.com/artman/publish/noticias-guatemala/Vacunas-contra-el-covid-19-podrian-ingresar-en-febrero.shtml,"Guatemala. El primer cargamento de vacunas contra el coronavirus se podría tener para febrero, a través del mecanismo del Fondo de Acceso Global para Vacunas Covid-19 (COVAX), que gestiona la organiza",08-01-2021 16:23,https://www.bing.com/th?id=OVFT.lGj1IedyE390p29AaLng3C,Guatemala,De Guate
Guatemala reporta 991 nuevos casos de COVID-19,https://stereo100.com.gt/2021/guatemala-reporta-991-nuevos-casos-de-covid-19/,"Por Luis Hernández | Este viernes, el Ministerio de Salud Pública y Asistencia Social (MSPAS) reporta en las últimas 24 horas, en Guatemala, 991 nuevos casos de COVID-19 y 44 casos de fallecidos regis",08-01-2021 20:54,https://www.bing.com/th?id=OVFT.9UxPnZYfuedgpou0AH9ZbS,Guatemala,Stereo 100
Ejército apoya acciones de concientización contra la COVID-19,https://radiotgw.gob.gt/ejercito-apoya-acciones-de-concientizacion-contra-la-covid-19/,"TGW Digital – Para evitar el contagio y transmisión del Coronavirus (COVID-19), el Ejército de Guatemala continúa con el plan de concientización en la población guatemalteca. Las acciones",08-01-2021 21:00,https://www.bing.com/th?id=OVFT.yTPzb7gFASR2DWWn_2lFSC,Guatemala,TGW
"Centroamérica sin plan de vacunación contra COVID-19, salvo Panamá y Costa Rica",https://crnnoticias.com/centroamerica-no-tiene-plan-de-vacuna-contra-covid-19-salvo-panama-y-costa-rica/,"La llegada de las vacunas contra el COVID-19 en Centroamérica, es incierta en todos sus países, a excepción de Costa Rica y de Panamá.",08-01-2021 21:38,https://www.bing.com/th?id=OVFT.1-3jSMHulZfqq7REQsP6uC,Guatemala,CRN Noticias
Ejecutivo socializará con Legislativo iniciativa para compra de vacunas contra el covid-19,https://www.deguate.com/artman/publish/salud_breves/Ejecutivo-socializara-con-Legislativo-iniciativa-para-compra-de-vacunas-contra-el-covid-19.shtml,"El Ejecutivo socializará, el próximo lunes, con los jefes de bloque del Congreso de la República, la Ley para Financiamiento y adquisición de vacunas contra el covid-19, a fin de disipar dudas sobre l",08-01-2021 22:48,https://www.bing.com/th?id=OVFT.IypTLIdzx07Xo7u3r7stgy,Guatemala,De Guate
Guatemala llega a los 5 mil fallecidos a causa del COVID-19,https://emisorasunidas.com/2021/01/09/guatemala-covid-fallecidos-casos/,Las estadísticas del Ministerio de Salud Pública y Asistencia Social indican que en el país se han recuperado más de 130 pacientes de COVID-19.,09-01-2021 14:51,https://www.bing.com/th?id=OVFT.7MqA8-B56pX2cYW2wISWYi,Guatemala,Emisoras Unidas
"Guatemala sobrepasa los mil casos nuevos de coronavirus, con casi seis mil pruebas efectuadas",https://www.prensalibre.com/guatemala/comunitario/guatemala-sobrepasa-los-mil-casos-nuevos-de-coronavirus-con-casi-seis-pruebas-efectuadas-breaking/,"De acuerdo con la actualización del tablero de Salud de este sábado, se detectaron mil 63 casos nuevos de coronavirus en las últimas horas, la cifra más alta en los primeros días de enero 2021. Así, e",09-01-2021 15:26,https://www.bing.com/th?id=OVFT.GTx-82BLwxric8KXY2h8FS,Guatemala,Prensa Libre
Guatemala supera nuevamente los mil casos de Covid-19 por día,https://elperiodico.com.gt/nacionales/2021/01/09/guatemala-supera-nuevamente-los-mil-casos-de-covid-19-por-dia-1/,"El Ministerio de Salud Pública y Asistencia Social (MSPAS) actualizó el tablero de la situación del COVID-19 en el país, el cual registró en los datos de las últimas 24 horas un aumento de más de mil",09-01-2021 17:00,https://www.bing.com/th?id=OVFT.ZpqUpOyWKjnAJjK06Se57C,Guatemala,El Periódico Guatemala
Muere por covid-19 el médico personal del papa Francisco,https://republica.gt/2021/01/09/muere-por-covid-19-el-medico-personal-del-papa-francisco/,"El médico personal del papa Francisco, Fabrizzio Socorsi, murió por complicaciones debidas al covid-19, informan los medios vaticanos.",09-01-2021 18:31,https://www.bing.com/th?id=OVFT.1I00NbLLGOF4sWM_mcKe0S,Guatemala,Republica
Guatemala: a un caso de llegar a los 5 mil fallecidos por COVID-19,https://crnnoticias.com/guatemala-a-un-caso-de-llegar-a-los-5-mil-fallecidos-por-covid-19/,El tablero del Ministerio de Salud Pública y Asistencia Social –MSPAS- registra 4 mil 999 guatemaltecos fallecidos a causa del virus.,09-01-2021 19:50,https://www.bing.com/th?id=OVFT.U3I4BvB13Zi2MFnP8zfXTC,Guatemala,CRN Noticias
Coronavirus: Guatemala se acerca a los cinco mil muertos y sobrepasa los mil contagios nuevos,https://www.guatevision.com/nacionales/coronavirus-guatemala-se-acerca-a-los-cinco-mil-muertos-y-sobrepasa-los-mil-contagios-nuevos-breaking,"De acuerdo con la actualización del tablero de Salud de este sábado, se detectaron mil 63 casos nuevos de coronavirus en las últimas horas, la cifra más alta en los primeros días de enero 2021. Así, e",09-01-2021 21:36,https://www.bing.com/th?id=OVFT.iwlZ-iNKvPJe8e82yX0Cai,Guatemala,Guatevision
Semáforo Covid-19: 68 municipios están en alerta roja a causa del coronavirus,https://www.guatevision.com/nacionales/semaforo-covid-19-68-municipios-estan-en-alerta-roja-a-causa-del-coronavirus-breaking,"Sesenta y ocho municipios están en el nivel máximo de alerta por el coronavirus en todo el país, según la actualización del Semáforo Covid-19, por medio del cual el Ministerio de Salud regula las acti",10-01-2021 06:02,https://www.bing.com/th?id=OVFT.Oi1Moob-2fUd9DyVhlydsy,Guatemala,Guatevision
Semáforo Covid-19: Salud reporta que 68 municipios están en alerta roja,https://www.prensalibre.com/guatemala/comunitario/semaforo-covid-19-salud-reporta-que-68-municipios-estan-en-alerta-roja-breaking/,"Autoridades de Salud actualizaron el Semáforo Covid-19, el cual refleja que 68 municipios están en alerta roja por el número de casos.",10-01-2021 06:07,https://www.bing.com/th?id=OVFT.vWsxSove-FGV6Ws2DBld1S,Guatemala,Prensa Libre
Se vuelven a registrar más de mil casos en un día,https://elperiodico.com.gt/nacionales/2021/01/10/se-vuelven-a-registrar-mas-de-mil-casos-en-un-dia/,Guatemala llega a cinco mil personas fallecidas por la pandemia desde que se registró el primer caso el 13 de marzo de 2020.,10-01-2021 07:06,https://www.bing.com/th?id=OVFT.xwvnWo-fuy9J8z3s7hKIzi,Guatemala,El Periódico Guatemala
