name,url,description,datePublished,imagen,pais,Fuente
El Covid-19 provoca que Guatemala juegue en la Copa Oro 2021,https://lared.com.gt/seleccion-nacional/el-covid-19-provoca-que-guatemala-juegue-en-la-copa-oro-2021/,"Todo surgió por la posibilidad, todavía no oficializada por la Federación Nacional de Futbol (Fedefut), de que Guatemala participe en la Copa Oro 2021 debido a un contagio masivo de covid-19 en la Selección de Curazao. De ser cierta la información ...",09-07-2021 22:17,https://www.bing.com/th?id=OVFT.McKI1QsKLEo_OH_97tLaei,Guatemala,lared
Guatemala decreta estado de prevención 15 días por expansión de la covid-19,https://www.msn.com/es-us/noticias/mundo/guatemala-decreta-estado-de-prevenci%C3%B3n-15-d%C3%ADas-por-expansi%C3%B3n-de-la-covid-19/ar-AAM7MKQ,"El Gobierno de Guatemala decretó este martes un estado de prevención durante 15 días ante la reciente expansión del SARS-CoV-2, una medida que incluye la reducción del horario de expendio de bebidas a",14-07-2021 01:16,https://www.bing.com/th?id=OVFT.M6O7FL76glzDU5Vg6KL1NC,Guatemala,MSN
Identifican casos de COVID-19 en hotel de delegación de Brasil en Tokio,https://www.msn.com/es-us/deportes/other/identifican-casos-de-covid-19-en-hotel-de-delegaci%C3%B3n-de-brasil-en-tokio/ar-AAM9Sti,Siete trabajadores de un hotel en Hamamatsu dieron positivo por coronavirus; en dichas instalaciones se hospeda una parte de la delegación brasileña.,14-07-2021 20:42,https://www.bing.com/th?id=OVFT.rIsWdYEdXW6eCofiJd1Try,Guatemala,MSN
Zacapa cuenta con segundo centro de vacunación masiva contra el Covid-19,https://elmetropolitano.com.gt/es/2021/07/17/zacapa-cuenta-con-segundo-centro-de-vacunacion-masiva-contra-el-covid-19/,En las instalaciones de la Segunda Brigada de Infantería General Rafael Carrera se habilitó este sábado el segundo centro de vacunación masiva interinstitucional que funciona en Zacapa. La apertura de,17-07-2021 00:00,https://www.bing.com/th?id=OVFT.giuYNym5KW2gNVec3f-vii,Guatemala,El Metropolitano
Estados Unidos anuncia donación de 3 millones de la vacuna moderna,https://elmetropolitano.com.gt/es/2021/07/17/estados-unidos-anuncia-donacion-de-3-millones-de-la-vacuna-moderna/,El gobierno de los Estados Unidos anunció este sábado que la próxima semana enviará a Guatemala tres millones de dosis de la vacuna Moderna contra la Covid-19 convirtiéndose el gobierno de Joseph Biden en el “Salvavidas” del gobierno de Alejandro ...,17-07-2021 00:00,https://www.bing.com/th?id=OVFT.-54tmAnkOzNbHsiNva6ZGy,Guatemala,El Metropolitano
Se registran 2 mil 896 nuevos casos de COVID-19 en las últimas horas en Guatemala,https://www.chapintv.com/noticia/se-registran-2-mil-896-nuevos-casos-de-covid-19-en-las-ultimas-horas-en-guatemala/,Según datos actualizados se reportan 2 mil 896 nuevos casos confirmados de COVID-19 en el país. Compartir en Facebook Compartir en Twitter Compartir en Whatsapp,17-07-2021 03:57,https://www.bing.com/th?id=OVFT.JvvfGrVFnLZnDhJELQDVcS,Guatemala,Chapin TV
Coronavirus en Guatemala: primera quincena de julio cierra con vertiginosa alza de contagios,https://www.guatevision.com/nacionales/coronavirus-en-guatemala-primera-quincena-de-julio-cierra-con-vertiginosa-alza-de-contagios-breaking,"De acuerdo con la actualización de casos de coronavirus del Ministerio de Salud de este viernes 16 de julio, la primera quincena de julio cerró con un alza de contagios que se h",17-07-2021 04:39,https://www.bing.com/th?id=OVFT.NGUz_-MiVsbYfXXzJDGdYS,Guatemala,Guatevision
Estados Unidos donará a Guatemala otras 3 millones de dosis de vacuna contra el coronavirus,https://www.prensalibre.com/guatemala/comunitario/estados-unidos-donara-a-guatemala-otras-3-millones-de-dosis-de-vacuna-contra-el-coronavirus-breaking/,La administración de Joe Biden y Kamala Harris hace anuncio oficial de nuevo lote de biológicos que llegaría a Guatemala la próxima semana.,17-07-2021 18:36,https://www.bing.com/th?id=OVFT.5PquI1mwlzWLPGq3ScYzuC,Guatemala,Prensa Libre
"Chimaltenango comienza vacunación de personas de 40 años, mientras que en la capital se atiende de 50 en adelante",https://www.prensalibre.com/guatemala/comunitario/chimaltenango-comienza-vacunacion-de-personas-de-40-anos-mientras-que-en-la-capital-se-atiende-de-50-en-adelante-breaking/,"En 10 municipios de los 16 que integran el departamento de Chimaltenango, el personal de Salud continúa con la vacunación contra el covid-19. En la mayoría de los centros de vacunación se observa gran",17-07-2021 18:46,https://www.bing.com/th?id=OVFT.5dleciMuy2X6dqZlPTLo3y,Guatemala,Prensa Libre
Estados Unidos anuncia donación de 3 millones de vacunas contra el COVID-19,https://crnnoticias.com/estados-unidos-anuncia-donacion-de-3-millones-de-vacunas-contra-el-covid-19/,Estados Unidos anunció una donación de 3 millones de vacunas de la marca Moderna para combatir el COVID-19. Esta es el segundo envío que hace la nación norteamericana en calidad de donación ya que el,17-07-2021 20:20,https://www.bing.com/th?id=OVFT.AoLNIrwgdVjkoETV0pSbES,Guatemala,CRN Noticias
Centroamérica vuelve a pasar hambre según FAO,https://crnnoticias.com/centroamerica-vuelve-a-pasar-hambre-segun-fao/,"Centroamérica vuelve a sufrir hambre, con el 10% de su población sin poder acceder a los alimentos básicos para su actividad diaria.",17-07-2021 20:24,https://www.bing.com/th?id=OVFT.La-JdEj9LH1g4aMGFRa-WS,Guatemala,CRN Noticias
Guatemala recibirá donación de 3 millones de vacunas de los Estados Unidos,https://radiotgw.gob.gt/guatemala-recibira-donacion-de-3-millones-de-vacunas-de-los-estados-unidos/,"TGW Digital – El gobierno de Estados Unidos anunció que donará al país 3 millones de dosis de vacuna de la casa Moderna, adicionales a los 1.5 millones de dosis ya entregadas a Guatemala;",17-07-2021 22:04,https://www.bing.com/th?id=OVFT.7LCEgLqqNLW5JWKKnh6RPy,Guatemala,El Diário de Centro America
Estados Unidos donará a Guatemala 3 millones de dosis de la vacuna contra el COVID-19,https://stereo100.com.gt/2021/estados-unidos-donara-a-guatemala-3-millones-de-dosis-de-la-vacuna-contra-el-covid-19/,"Por Moisés Cottom | Este sábado, el Gobierno de Estados Unidos de América anunció que donará a Guatemala 3 millones de dosis de la vacuna contra el COVID-19 (Moderna). Este es el segundo envío de",17-07-2021 22:13,https://www.bing.com/th?id=OVFT.NxYgcp6F9EtdOu0WmVJ89C,Guatemala,Stereo 100
"Estados Unidos, no Rusia, donará 3 millones de dosis",https://lahora.gt/estados-unidos-no-rusia-donara-3-millones-de-dosis/,"La administración del presidente de Estados Unidos, Joe Biden y la vicepresidenta Kamala Harris, anunciaron este sábado un segundo donativo de vacunas contra el Covid-19 a Guatemala. En esta oportunid",17-07-2021 22:18,https://www.bing.com/th?id=OVFT.IHW0WYC8rlHCY0GCupidAC,Guatemala,La Hora
Gobierno de Guatemala incumple las fases del plan de vacunación contra el covid-19,https://republica.gt/2021/07/17/gobierno-guatemala-incumple-fases-vacunacion-covid19/,El plan de vacunación que aprobó el Ministerio de Salud para inmunizar a los guatemaltecos contra el covid-19 sigue sin cumplirse.,17-07-2021 22:59,https://www.bing.com/th?id=OVFT.br8juBJneBwgdcA1IUCykC,Guatemala,Republica
"Guatemala recibirá la otra semana 3 millones de dosis de vacuna contra el coronavirus, que donará Estados Unidos",https://www.guatevision.com/nacionales/guatemala-recibira-la-otra-semana-3-millones-de-dosis-de-vacuna-contra-el-coronavirus-que-donara-estados-unidos-breaking,La administración de Joe Biden y Kamala Harris hace anuncio oficial de nuevo lote de biológicos que llegaría a Guatemala la próxima semana.,18-07-2021 00:44,https://www.bing.com/th?id=OVFT.wL7IZvehPw7pDSk57TGS4S,Guatemala,Guatevision
Estados Unidos donará tres millones de dosis de la vacuna de Moderna,https://republica.gt/2021/07/17/estados-unidos-donara-a-guatemala-tres-millones-dosis-vacuna-moderna/,La donación de vacunas de Moderna llegarán al país cuando hay preocupación por el incremento de casos de covid-19.,18-07-2021 03:50,https://www.bing.com/th?id=OVFT.XhiNj9gBLRxU0Qgdv6wlsS,Guatemala,Republica
EE. UU. donará 3 millones más de vacunas contra el COVID-19 al país,https://elperiodico.com.gt/politica/ejecutivo/2021/07/17/ee-uu-donara-3-millones-mas-de-vacunas-contra-el-covid-19-al-pais/,La Embajada de Estados Unidos en Guatemala anunció que ese país hará una segunda donación de dosis de la vacuna contra el COVID-19. El suministro en esta ocasión será de 3 millones de dosis de la marc,18-07-2021 05:58,https://www.bing.com/th?id=OVFT.BDSuQ3xLW7jZ6X0EuMpY0C,Guatemala,El Periódico Guatemala
Habilitan puesto de vacunación vehicular en Quetzaltenango,https://elperiodico.com.gt/lo-mas-importante-de-hoy/2021/07/18/habilitan-puesto-de-vacunacion-vehicular-en-quetzaltenango/,En ese centro de inmunización se estará administrando las dosis contra el coronavirus a personas de 50 años o más.,18-07-2021 14:11,https://www.bing.com/th?id=OVFT.xBbInGm0bIcMlz1B9hiYoi,Guatemala,El Periódico Guatemala
Asturias señala récord de casos activos y pone de ejemplo a Joyabaj para mitigar situación,https://lahora.gt/asturias-senala-record-de-casos-activos-y-pone-de-ejemplo-a-joyabaj-para-mitigar-situacion/,"Luego de que el pasado viernes el Ministerio de Salud Pública y Asistencia Social (MSPAS) registrara 33,115 casos activos de coronavirus, el epidemiólogo y extitular de la Comisión Presidencial de Ate",18-07-2021 15:37,https://www.bing.com/th?id=OVFT.4ofcy4x0GhhoCnvCnIMPLy,Guatemala,La Hora
