name,url,description,datePublished,imagen,pais,Fuente
Epidemiólogos y virólogos alemanes apoyarán a Salud y a la Coprecovid,https://republica.gt/2020/10/07/epidemiologos-y-virologos-alemanes-apoyaran-a-salud-y-coprecovid-de-guatemala/,En las próximas semanas cuatro epidemiólogos arribarán al país para apoyar a la Coprecovid y al Laboratorio Nacional del Ministerio de Salud.,07-10-2020 19:45,https://www.bing.com/th?id=OVFT.AVAAX1kr6boBamedBwQG9C,Guatemala,Republica
"“Estamos viviendo la segunda ola de contagios por COVID-19”, asegura Giammattei",https://www.deguate.com/artman/publish/noticias-guatemala/estamos-viviendo-la-segunda-ola-de-contagios-por-covid-19-asegura-giammattei.shtml,"El mandatario aseguró que el número de contagios se elevó por la “irresponsabilidad de muchas personas”. Además, dijo que la segunda ola de contagios ya la estamos viviendo y está declarado oficialmen",07-10-2020 19:48,https://www.bing.com/th?id=OVFT.sOG0rSHYnc9qF1otRXcfry,Guatemala,De Guate
Guatemala suma 834 nuevos casos y 25 fallecidos por COVID-19,https://crnnoticias.com/guatemala-suma-834-nuevos-casos-y-25-fallecidos-por-covid-19/,"Guatemala alcanzó este miércoles los 95 mil 704 casos de COVID-19, de los cuales 3 mil 335 han fallecido. Estos datos según la última actualización de Ministerio de Salud. Luego de procesar 4 mil 701",07-10-2020 20:54,https://www.bing.com/th?id=OVFT.1NPEz1tHQ0xjzaMsJG_agS,Guatemala,CRN Noticias
Guatemala entró a segunda ola de contagios de Covid-19 según Giammattei,https://elperiodico.com.gt/nacion/2020/10/07/guatemala-entro-a-segunda-ola-de-contagios-de-covid-19-segun-giammattei/,"Guatemala experimenta una segunda ola de contagios del nuevo coronavirus en momentos que el país avanza con la reapertura de su economía, golpeada por la pandemia, informó este miércoles el presidente",07-10-2020 21:32,https://www.bing.com/th?id=OVFT.yXHadqoMTp1yQzt7O5x0nS,Guatemala,El Periódico Guatemala
Detectan 834 personas contagiadas de coronavirus,https://elmetropolitano.com.gt/es/2020/10/07/detectan-834-personas-contagiadas-de-coronavirus/,"Tras procesar 4 mil 701 pruebas en todo el país, el Ministerio de Salud Pública y Asistencia Social (MSPAS) detectó 834 casos nuevos de coronavirus (COVID-19).Así se informó, por medio del Tablero Sit",07-10-2020 22:02,https://www.bing.com/th?id=OVFT.wqP6UinCI5ljT8bkc8sGwS,Guatemala,El Metropolitano
Alerta: Ya estamos viviendo la segunda ola del Covid-19,https://elmetropolitano.com.gt/es/2020/10/07/alerta-ya-estamos-viviendo-la-segunda-ola-del-covid-19/,"“Ya estamos en la segunda ola de la pandemia del coronavirus (COVID-19)”, confirmó este miércoles el presidente Alejandro Giammattei y destacó que el país está preparado para enfrentar esta nueva etap",07-10-2020 22:11,https://www.bing.com/th?id=OVFT.BnRiui25RnDakCBEsd3qpi,Guatemala,El Metropolitano
"Guatemala se enfrenta a la segunda ola de Covid-19, indica el presidente Alejandro Giammattei",http://www.chapintv.com/actualidad/guatemala-se-enfrenta-a-la-segunda-ola-de-covid-19-indica-el-presidente-alejandro-giammattei-311117,El mandatario Alejandro Giammattei señala que esto se debe a la irresponsabilidad de algunos guatemaltecos. (Foto: Twitter / @DrGiammattei),07-10-2020 22:51,https://www.bing.com/th?id=OVFT.wLoDHxsLneEwZLwJ0SvHcC,Guatemala,Chapin TV
Más de 64 mil estudiantes se han retirado de las aulas,https://republica.gt/2020/10/07/desercion-escolar-en-guatemala-por-el-covid-19/,"A pocas semanas de concluir el ciclo escolar, el Ministerio de Educación registra que 64 mil 536 estudiantes se han retirado de las aulas.",07-10-2020 23:20,https://www.bing.com/th?id=OVFT.4aFkS4cOqgqksb-YynauBS,Guatemala,Republica
TECHO regresa a construir en comunidad,https://newsinamerica.com/pdcc/gerenciales/2020/techo-regresa-a-construir-en-comunidad,"Guatemala. Después de seis meses de inactividad, TECHO regresa con proyectos de infraestructura brindando soluciones sostenibles y a largo plazo para la población cuya situación de vulnerabilidad incr",08-10-2020 01:01,https://www.bing.com/th?id=OVFT.GIhqYLIEEdsrOl3Tz2crPy,Guatemala,Periódico Digital Centroamericano y del Caribe
"Parque Ecológico La Asunción, un destino natural en la Ciudad de Guatemala",https://www.guatemala.com/guias/pasatiempos/parque-ecologico-la-asuncion-un-destino-natural-en-la-ciudad-de-guatemala/,"El Parque Ecológico La Asunción es un destino lleno de naturaleza que se encuentra ubicado en la Ciudad de Guatemala, ofrece senderos y mucho más.",08-10-2020 05:20,https://www.bing.com/th?id=OVFT.waJ4BfiCfHoacSEwKa_noy,Guatemala,Guatemala
Pruebas Covid-19: 44% en salud pública; 40% privados y casi 15% en el IGSS,https://lahora.gt/pruebas-covid-19-44-en-salud-publica-40-privados-y-casi-15-en-el-igss/,"POR MARGARITA GIRÓN jgiron@lahora.com.gt Desde que inició la emergencia, diversas voces han manifestado la necesidad de contar con un promedio de pruebas de COVID-19 diarias para determinar la trazabi",08-10-2020 05:27,https://www.bing.com/th?id=OVFT.FlMMLlS8pkup0WzHFevA7C,Guatemala,La Hora
Seguros pagaron Q138.2 millones por COVID-19,https://elperiodico.com.gt/inversion/2020/10/08/seguros-pagaron-q138-2-millones-por-covid-19/,"Las aseguradoras han atendido un total de 4 mil 233 casos positivos por COVID-19 hasta septiembre pasado, los cuales han representado indemnizaciones pagadas por Q138.2 millones en los ramos de gastos",08-10-2020 07:10,https://www.bing.com/th?id=OVFT.nry-0fN9SZUbgL3f7aZ_ZC,Guatemala,El Periódico Guatemala
Guatemala suma 834 nuevos contagios de Covid 19,http://www.chapintv.com/actualidad/guatemala-suma-834-nuevos-contagios-de-covid-19-311175,"Guatemala reportó este miércoles la muerte de 25 personas por la COVID-19 y 834 nuevos contagios, por lo que hay total de 3.335 fallecidos y 95.704 casos positivos desde el inicio de la pandemia.",08-10-2020 07:29,https://www.bing.com/th?id=OVFT.uFEfEhkbQcna6debtUh1oy,Guatemala,Chapin TV
Resumen 24 horas en Guatemala: 776 nuevos casos de COVID-19 y 12 fallecidos,https://stereo100.com.gt/2020/resumen-24-horas-en-guatemala-776-nuevos-casos-de-covid-19-y-12-fallecidos/,"Guatemala, de marzo a la fecha, reporta 96 mil 480 casos del nuevo coronavirus, de los cuales se estima que 8 mil 395 siguen activos, 3 mil 347 pacientes han fallecido y 84 mil 738 se han recuperado.",08-10-2020 14:39,https://www.bing.com/th?id=OVFT.f2qliC7z6GBgapPH88_nfi,Guatemala,Stereo 100
Coronavirus: Salud reporta que en las últimas horas se superaron las 5 mil pruebas y registra otros 776 contagios,https://www.guatevision.com/nacionales/coronavirus-salud-reporta-que-en-las-ultimas-horas-se-superaron-las-5-mil-pruebas-y-registra-otros-776-contagios-breaking,"De acuerdo con los datos del tablero del Ministerio de Salud, el 7 de octubre Guatemala superó las 5 mil pruebas en ... quien dirige la Comisión Presidencial de Atención a la Emergencia Covid-19 (Coprecovid), informó el 5 de octubre que hace dos ...",08-10-2020 14:51,https://www.bing.com/th?id=OVFT.kjZIL6CmDXf6xsBNCixAby,Guatemala,Guatevision
Guatemala y Costa Rica promueven alianza estratégica,https://radiotgw.gob.gt/guatemala-y-costa-rica-promueven-alianza-estrategica/,"TGW Digital – En el marco de la III Reunión del Mecanismo de Consultas Políticas el viceministro de Relaciones Exteriores de la República de Guatemala, Carlos Martínez Alvarado, junto a su",08-10-2020 15:32,https://www.bing.com/th?id=OVFT.GMXFZ91sXAeR1b-x7praKy,Guatemala,TGW
Asturias explica comportamiento “heterogéneo” de la pandemia en Guatemala,https://emisorasunidas.com/2020/10/08/coprecovid-segunda-ola-pandemia-guatemala/,"Edwin Asturias, de la Coprecovid, explicó la situación de la pandemia, luego de que el presidente Alejandro Giammattei declaró el inicio de la segunda ola.",08-10-2020 16:06,https://www.bing.com/th?id=OVFT.7iCZcagsdbZ4WwjPk-6AMi,Guatemala,Emisoras Unidas
Hospitales procesan cerca de 6 mil pruebas de coronavirus en un día,https://crnnoticias.com/hospitales-procesan-cerca-de-6-mil-pruebas-de-coronavirus-en-un-dia/,"Los hospitales públicos, privados y el seguro social procesaron cerca de 6 mil pruebas de coronavirus en un día. En las 24 horas del miércoles se detectaron a 776 personas contagiadas de COVID-19. Seg",08-10-2020 16:30,https://www.bing.com/th?id=OVFT.Ykw_hxcrfwzLj5bsM2moGC,Guatemala,CRN Noticias
Guatemala ganó 21 medallas en la Copa Colombia en línea 2020,https://www.guatemala.com/deportes/pesas/guatemala-gano-21-medallas-copa-colombia-en-linea-2020.html,La selección nacional de levantamiento de pesas de Guatemala ganó un total de 21 medallas en su participación en la Copa Colombia en línea 2020.,08-10-2020 16:53,https://www.bing.com/th?id=OVFT.u4eky0FiE4sJvQ_9tAtjei,Guatemala,Guatemala
Covid-19: Mineduc registra 10 mil escuelas sin agua potable ni servicios sanitarios,https://lahora.gt/covid-19-mineduc-registra-10-mil-escuelas-sin-agua-potable-ni-servicios-sanitarios/,POR HEDY QUINO hquino@lahora.com.gt En un informe que le presentó el Ministerio de Educación (Mineduc) a la bancada Unidad Nacional de la Esperanza (UNE) se detalla que 10 mil escuelas no cuentan con,08-10-2020 17:17,https://www.bing.com/th?id=OVFT.J0on5JElAwDUOAAGmlI2ES,Guatemala,La Hora
Éver Hugo Almeida extécnico de Municipal y Selección de Guatemala dio positivo a covid-19,https://www.prensalibre.com/deportes/futbol-nacional/ever-hugo-almeida-extecnico-de-municipal-y-seleccion-de-guatemala-dio-positivo-a-covid-19/,"Éver Hugo Almeida es ampliamente reconocido en Guatemala por clasificar a nuestro pais por primera vez a un mundial de futbol once, en Colombia 2011 a nivel Sub20, múltiple campeón con Municipal y",08-10-2020 18:12,https://www.bing.com/th?id=OVFT.0XQmzhHT75rHSwFCyG9RmS,Guatemala,Prensa Libre
Ejército apoya entrega de víveres a familias de escasos recursos en Izabal,https://radiotgw.gob.gt/ejercito-apoya-entrega-de-viveres-a-familias-de-escasos-recursos-en-izabal/,"TGW Digital – El Ejército de Guatemala continúa apoyando las diferentes acciones implementadas por el Gobierno de la República, las cuales contribuyen con la mitigación y reducción de los",08-10-2020 18:58,https://www.bing.com/th?id=OVFT.rVdI0-zZVi8jjayf3lUJdi,Guatemala,TGW
Cementerio San Lázaro de Antigua Guatemala permanecerá cerrado este 1 y 2 de noviembre por riesgo de la pandemia,https://www.prensalibre.com/ciudades/sacatepequez/cementerio-san-lazaro-de-antigua-guatemala-permanecera-cerrado-este-1-y-2-de-noviembre-por-riesgo-de-la-pandemia/,"El cementerio es un punto crítico, ya que aún se llevan a cabo inhumaciones de personas fallecidas por el covid-19.",08-10-2020 19:45,https://www.bing.com/th?id=OVFT.bcGgfqKBpaZ9Y73F8VC-mC,Guatemala,Prensa Libre
Coronavirus: Cementerio San Lázaro de Antigua Guatemala permanecerá cerrado este 1 y 2 de noviembre,https://www.guatevision.com/nacionales/coronavirus-cementerio-san-lazaro-de-antigua-guatemala-permanecera-cerrado-este-1-y-2-de-noviembre,"Comuna afirma que llevar a cabo un regreso a la nueva normalidad de forma ordenada, es responsabilidad de todos.",08-10-2020 19:56,https://www.bing.com/th?id=OVFT.yaFtEFEggYx8ezttTScXuC,Guatemala,Guatevision
Envío de remesas a Guatemala crece 1.91% pese a pandemia,https://emisorasunidas.com/2020/10/08/envio-remesas-guatemala-septiembre-2020/,Guatemala registró un crecimiento de 1.91% en las remesas que sus emigrantes enviaron a sus familiares entre enero y septiembre 2020.,08-10-2020 20:15,https://www.bing.com/th?id=OVFT.ae6T9bkkctTBtMEAErbevS,Guatemala,Emisoras Unidas
