name,url,description,datePublished,imagen,pais,Fuente
"En pandemia del covid-19, la ONU urge a no olvidar la lucha contra el sida",https://republica.gt/2020/12/01/en-pandemia-del-covid-19-la-onu-urge-a-no-olvidar-la-lucha-contra-el-sida/,"Con toda la atención y los esfuerzos internacionales centrados en la pandemia de la covid-19, la ONU urgió este martes",01-12-2020 22:39,https://www.bing.com/th?id=OVFT.8bEpup5f1oxbnx9yBwgCQy,Guatemala,Republica
Semuc Champey abre oficialmente sus puertas al público en Guatemala,https://www.guatemala.com/guias/noticias-turisticas/semuc-champey-abre-oficialmente-sus-puertas-al-publico-en-guatemala/,El famoso Parque Natural Semuc Champey abre oficialmente sus puertas al público en Guatemala con nuevos protocolos de seguridad y horarios distintos.,02-12-2020 00:45,https://www.bing.com/th?id=OVFT.TR7TCDbzhJA7AnRZFUlJ4i,Guatemala,Guatemala
La tradicional carrera Ternium se hace virtual y apoya a los bomberos voluntarios,https://newsinamerica.com/pdcc/gerenciales/2020/la-tradicional-carrera-ternium-se-hace-virtual-y-apoya-a-los-bomberos-voluntarios,"Guatemala. La tercera edición de la carrera 10k Ternium se realizará del 5 al 13 de diciembre, con una dinámica diferente, adaptada a los tiempos de Covid-19, de forma virtual y en la que podrá partic",02-12-2020 01:23,https://www.bing.com/th?id=OVFT.HcRY2v8fz5QPwSHdO3YObi,Guatemala,Periódico Digital Centroamericano y del Caribe
La vacuna contra el coronavirus llegaría a Guatemala entre marzo y abril del 2021 (y estas personas serían las primeras en recibirla),https://www.guatevision.com/nacionales/la-vacuna-contra-el-coronavirus-llegaria-a-guatemala-entre-marzo-y-abril-del-2021-y-estas-personas-serian-las-primeras-en-recibirla,Con la llegada de las primeras dosis de la vacuna contra el coronavirus a Guatemala las autoridades de Salud deben priorizar su distribución.,02-12-2020 05:58,https://www.bing.com/th?id=OVFT.L555tIB0JvEv9trKEhQV_S,Guatemala,Guatevision
OMS recomienda no usar mascarillas con válvula para protegerse del covid-19 y esto indica Salud en Guatemala,https://www.prensalibre.com/vida/salud-y-familia/oms-recomienda-no-usar-mascarillas-con-valvula-para-protegerse-del-covid-19/,"La Organización Mundial de la Salud (OMS) emitió este miércoles 2 de diciembre nuevas recomendaciones sobre el uso de mascarillas protectoras durante la pandemia de covid-19, que entre otras cosas des",02-12-2020 13:07,https://www.bing.com/th?id=OVFT._sbsygy9-ns7cs3ZQEmODS,Guatemala,Prensa Libre
Se confirman 686 nuevos casos positivos de Covid-19,https://emisorasunidas.com/2020/12/02/casos-coronavirus-guatemala-2-diciembre-2020/,Las autoridades del Ministerio de Salud brindaron la actualización de datos por casos de coronavirus correspondiente para el miércoles 2 de diciembre.,02-12-2020 13:37,https://www.bing.com/th?id=OVFT.MDME1n8rOVuavzA3Yon_vi,Guatemala,Emisoras Unidas
Guatemala acumula más de 123 mil casos de Covid-19,https://www.chapintv.com/noticia/guatemala-acumula-mas-de-123-mil-casos-de-covid-19/,"Según cifras publicadas por el Ministerio de Salud Pública y Asistencia Social, Guatemala acumula un total de 123 mil 460 casos de infectados de Covid-19.",02-12-2020 14:14,https://www.bing.com/th?id=OVFT.RR75d56gjk3JLt32TXFCGi,Guatemala,Chapin TV
Ministerio de Salud reporta 686 casos nuevos de COVID-19,https://elperiodico.com.gt/nacionales/2020/12/02/ministerio-de-salud-reporta-686-casos-nuevos-de-covid-19/,"El Ministerio de Salud Pública y Asistencia Social (MSPAS) reporta en el tablero de situación de COVID-19 en el país 686 casos nuevos que corresponden al 1 de diciembre. Además, la plataforma muestra",02-12-2020 14:40,https://www.bing.com/th?id=OVFT.lWQQX6BooMZWgsWObNxMKi,Guatemala,El Periódico Guatemala
Guatemala reporta 712 nuevos casos de COVID-19,https://stereo100.com.gt/2020/guatemala-reporta-712-nuevos-casos-de-covid-19/,"Por Luis Hernández | Este martes, el Ministerio de Salud Pública y Asistencia Social (MSPAS) informó que en las últimas 24 horas, en Guatemala, se registran 712 nuevos casos de COVID-19 y 7",02-12-2020 15:13,https://www.bing.com/th?id=OVFT.jiVnjlYyuwMYqINboddcwy,Guatemala,Stereo 100
Antigua cancela festival navideño por aumento de casos de coronavirus,https://crnnoticias.com/antigua-cancela-festival-navideno-por-aumento-de-casos-de-coronavirus/,La Municipalidad de la Antigua Guatemala canceló el festival navideño por aumento de casos de coronavirus en la última semana.,02-12-2020 16:13,https://www.bing.com/th?id=OVFT.JyoXE0RLWCybU40-tBn4oi,Guatemala,CRN Noticias
Salud reporta otros 13 decesos por coronavirus en las últimas horas y 686 contagios,https://www.guatevision.com/nacionales/salud-reporta-otros-13-decesos-por-coronavirus-en-las-ultimas-horas-y-686-contagios-breaking,"Trece personas perdieron la vida en Guatemala en las últimas horas por el coronavirus, informa el Ministerio de Salud. Con estos decesos, la acumulación de casos fallecidos asciende a 4 mil 191en todo",02-12-2020 20:34,https://www.bing.com/th?id=OVFT.1gDYJuvhamUeSjoWTlq86i,Guatemala,Guatevision
En las últimas horas se reporta 686 casos de coronavirus y trece fallecidos,https://www.prensalibre.com/guatemala/comunitario/en-las-ultimas-horas-se-reporta-686-casos-de-coronavirus-y-trece-fallecidos-breaking/,"Trece personas perdieron la vida en Guatemala en las últimas horas por el coronavirus, informa el Ministerio de Salud. Con estos decesos, la acumulación de casos fallecidos asciende a 4 mil 191en todo",02-12-2020 20:34,https://www.bing.com/th?id=OVFT.na9ha3nRZb80xvJk6oWW0y,Guatemala,Prensa Libre
Guatemala registra 13 muertes y 686 contagios nuevos de COVID-19,https://crnnoticias.com/guatemala-registra-13-muertes-y-686-contagios-nuevos-de-covid-19/,"Guatemala registró 13 muertes y 686 nuevos casos de COVID-19, en las últimas 24 horas, indicó este miércoles el Ministerio de Salud Pública.",02-12-2020 20:52,https://www.bing.com/th?id=OVFT.L4ltdZJYS6AeUlXDwxP0RC,Guatemala,CRN Noticias
"Anunciaron reapertura del Centro Deportivo y Recreativo Parque Erick Barrondo, diciembre 2020",https://www.guatemala.com/deportes/actualidad/anunciaron-reapertura-centro-deportivo-y-recreativo-parque-erick-barrondo-diciembre-2020.html,El Ministerio de Cultura y Deportes anunció la reapertura del Centro Deportivo y Recreativo Erick Barrondo a partir del 1 de diciembre de 2020.,02-12-2020 22:24,https://www.bing.com/th?id=OVFT.O9p4eDDoffJmLisXnCbYfi,Guatemala,Guatemala
Gobierno de Nicaragua afirma que cuenta con fondos para comprar vacunas contra Covid-19,https://elperiodico.com.gt/noticias/internacionales/2020/12/02/gobierno-de-nicaragua-afirma-que-cuenta-con-fondos-para-comprar-vacunas-contra-covid-19/,"El ministro de Hacienda, Iván Acosta, dijo que preparan los recursos y están a la espera que se pruebe la efectividad de la vacuna para proceder a su compra.",02-12-2020 22:52,https://www.bing.com/th?id=OVFT.SKOQlvTds78N9BajqeVp-S,Guatemala,El Periódico Guatemala
Presentan acción para que el CANG cumpla con convocar a elección,https://republica.gt/2020/12/02/presentan-accion-para-que-el-cang-cumpla-con-convocar-a-eleccion/,Solicitan a la Sala de Contencioso la debida ejecución del amparo provisional otorgado que fijó 5 días para que el CANG convocará a elección.,02-12-2020 23:19,https://www.bing.com/th?id=OVFT.0Ld6nqeseqdxG9mI8WRkei,Guatemala,Republica
Comité Nacional de Coordinación para Vacunación contra COVID-19 establece equipos de trabajo para continuidad de acciones,https://stereo100.com.gt/2020/comite-nacional-de-coordinacion-para-vacunacion-contra-covid-19-establece-equipos-de-trabajo-para-continuidad-de-acciones/,"Este miércoles se realizó la segunda reunión del Comité Nacional de Coordinación para la Vacunación contra el COVID-19 que tiene como finalidad, coordinar y ensamblar el Plan Estratégico Nacional",03-12-2020 00:52,https://www.bing.com/th?id=OVFT.JAXdzbZ6n-EYFMypusSICC,Guatemala,Stereo 100
PNC entregará a policias Q4 mil de bono por su buen trabajo,https://www.deguate.com/artman/publish/noticias-guatemala/pnc-entregara-a-policias-q4-mil-de-bono-por-su-buen-trabajo.shtml,La Policía Nacional Civil (PNC) informó que entregará un bono de Q4 mil a sus agentes por haber ayudado a reducir los índices de criminalidad y ayudar durante la emergencia del,03-12-2020 02:26,https://www.bing.com/th?id=OVFT.Ta-mlR7eGdEAP35yFtaigS,Guatemala,De Guate
