name,url,description,datePublished,imagen,pais,Fuente
Edwin Asturias presenta su renuncia como director ejecutivo de la Coprecovid,https://www.guatevision.com/nacionales/edwin-asturias-presenta-su-renuncia-como-director-ejecutivo-de-la-coprecovid-breaking,"La renuncia de Asturias es a partir del 31 de diciembre. Edwin Asturias, quien durante estos meses ha dirigido la Comisión Presidencial de Atención a la Emergencia Covid-19 (Coprecovid, informó este m",08-12-2020 15:26,https://www.bing.com/th?id=OVFT.FxpKgbAtNIJn3mRiTdws7C,Guatemala,Guatevision
Coronavirus en Guatemala: ocupación en intensivos está cerca del límite de capacidad,https://www.prensalibre.com/guatemala/comunitario/coronavirus-en-guatemala-ocupacion-en-intensivos-esta-cerca-del-limite-de-capacidad/,"La ocupación en las salas de cuidados intensivos para pacientes con coronavirus ha aumentado en las últimas semanas, según la Coprecovid.",08-12-2020 16:29,https://www.bing.com/th?id=OVFT.mNDc65I6QP-_HVsJaCDmLC,Guatemala,Prensa Libre
Asturias: “Guatemala inicia escalamiento lento pero sostenido de casos de Covid-19”,https://emisorasunidas.com/2020/12/08/aumento-casos-covid-19-diciembre-2020/,"El director de la Coprecovid, Edwin Asturias, informó que Guatemala muestra un aumento de contagios de coronavirus que es ""lento"", pero genera preocupación.",08-12-2020 16:33,https://www.bing.com/th?id=OVFT.V7phq-gx5Kmci_CnBbG9aS,Guatemala,Emisoras Unidas
Iniciativa Ilumina el Mundo 2020 busca recaudar víveres y juguetes para familias guatemaltecas,https://www.guatemala.com/noticias/vida/iniciativa-ilumina-mundo-2020-busca-recaudar-viveres-juguetes-familias-guatemaltecas.html,Iniciativa Ilumina el Mundo 2020 busca recaudar víveres y juguetes para familias guatemaltecas de escasos recursos y compartir con ellas en navidad.,08-12-2020 17:51,https://www.bing.com/th?id=OVFT.lJhlfg9aoCuv3hH4HVyXrC,Guatemala,Guatemala
Coprecovid insta a seguir con las medidas de protección para evitar el covid-19,https://republica.gt/2020/12/08/coprecovid-insta-seguir-con-medidas-de-proteccion-para-evitar-el-covid-19/,"Para no llegar a medidas estrictas, como un nuevo confinamiento, el director de la Comisión Presidencial de Atención a la Emergencia",08-12-2020 19:59,https://www.bing.com/th?id=OVFT.6xHk8lTuO8eKk3zXoZZ3uC,Guatemala,Republica
Coprecovid finalizará su funcionamiento,https://www.chapintv.com/noticia/coprecovid-finalizara-su-funcionamiento/,"La mañana de este martes, el Gobierno de Guatemala anunció el término de la Comisión Presidencial contra el Covid-19 el próximo 31 de diciembre.",08-12-2020 20:33,https://www.bing.com/th?id=OVFT.0CwYEiy2a7hETwMKYdZHey,Guatemala,Chapin TV
Guatemala: Aumenta la ocupación hospitalaria para atender casos de COVID-19,https://crnnoticias.com/guatemala-aumenta-la-ocupacion-hospitalaria-para-atender-casos-de-covid-19/,La ocupación hospitalaria para atender casos de COVID-19 en Guatemala aumentó al 75 y 100 por ciento en las áreas de intensivos de los tres principales hospitales del país.,08-12-2020 22:41,https://www.bing.com/th?id=OVFT.oJ9AUfOk9yvjblHd5ftTZC,Guatemala,CRN Noticias
"Alimentos y salud, prioridades de hondureños que recibirán aguinaldo navideño",https://republica.gt/2020/12/08/alimentos-y-salud-prioridades-de-hondurenos-que-recibiran-aguinaldo-navideno/,"El pago del decimotercer mes de salario, conocido en Honduras como aguinaldo, muchos lo destinarán para atender necesidades",09-12-2020 03:13,https://www.bing.com/th?id=OVFT.gl1ZqkaxF0b-DvO5NyEZZC,Guatemala,Republica
"Edwin Asturias de COPRECOVID, advierte aumento peligroso en la curva de contagios en Xela",https://stereo100.com.gt/2020/edwin-asturias-de-coprecovid-advierte-aumento-peligroso-en-la-curva-de-contagios-en-xela/,"Con información de Prensa Libre. Guatemala. En una conferencia de prensa ofrecida este martes 08 de diciembre, el titular de la Comisión Presidencial de Atención a la Emergencia COVID-19",09-12-2020 05:57,https://www.bing.com/th?id=OVFT.MzF1YQHbd_0y5O6ej9W4iS,Guatemala,Stereo 100
Guatemala asume presidencia pro tempore de iniciativa a favor de refugiados,https://newsinamerica.com/pdcc/boletin/2020/guatemala-asume-presidencia-pro-tempore-de-iniciativa-a-favor-de-refugiados,"Guatemala. Guatemala fue elegida este martes para asumir la presidencia pro tempore del MIRSP (Marco Integral Regional para la Protección y Soluciones) para el 2021, una iniciativa en favor de persona",09-12-2020 12:56,https://www.bing.com/th?id=OVFT.cv2vxJfdv-AoSJR6HfAY4S,Guatemala,Periódico Digital Centroamericano y del Caribe
Coronavirus: 654 nuevos casos,https://radiotgw.gob.gt/coronavirus-654-nuevos-casos/,"TGW Digital – El Ministerio de Salud Pública y Asistencia Social (MSPAS) compartió el resumen estimado de la Situación COVID-19 en Guatemala. Para este 9 de diciembre, según confirmaciones",09-12-2020 15:04,https://www.bing.com/th?id=OVFT.Z69gkof0brEodwUaY1DOiC,Guatemala,TGW
Guatemala reporta 654 nuevos casos de COVID-19,https://stereo100.com.gt/2020/guatemala-reporta-654-nuevos-casos-de-covid-19/,"Por Luis Hernández | Este miércoles, el Ministerio de Salud Pública y Asistencia Social (MSPAS) reporta en las últimas 24 horas, en Guatemala, 654 nuevos casos de COVID-19 y 25 fallecidos. Los",09-12-2020 16:09,https://www.bing.com/th?id=OVFT.rXQzeVUDBSY2lgMQ_izw-C,Guatemala,Stereo 100
"Paso a desnivel ‘Bicentenario’, en el Occidente del País, será entregado en el 2021",https://radiotgw.gob.gt/paso-a-desnivel-bicentenario-en-el-occidente-del-pais-sera-entregado-en-el-2021/,"TGW Digital – Más de un millón de habitantes serán beneficiados con el paso a desnivel «Bicentenario», según estimaciones del Ministerio de Comunicaciones, Infraestructura y Vivienda (CIV).",09-12-2020 18:57,https://www.bing.com/th?id=OVFT.TDrWo3I-wQRFkXNFksuDri,Guatemala,TGW
Jefe de la Coprecovid: “Este mes es más preocupante”,https://emisorasunidas.com/2020/12/09/guatemala-coprecovid-diciembre-asturias/,"El jefe de la Coprecovid, Edwin Asturias, anunció su renuncia al cargo para el 31 de diciembre, debido a compromisos laborales en Estados Unidos.",09-12-2020 19:08,https://www.bing.com/th?id=OVFT.PmKjmuT0RZVaeZuXfit2Mi,Guatemala,Emisoras Unidas
Guatemala acumula más de 127 mil casos de Covid-19,https://www.chapintv.com/noticia/guatemala-acumula-mas-de-127-mil-casos-de-covid-19/,"Según cifras publicadas por el Ministerio de Salud Pública y Asistencia Social, Guatemala acumula un total de 127 mil 127 casos de infectados de Covid-19.",09-12-2020 19:56,https://www.bing.com/th?id=OVFT.ZG8ZCza6H_8hHppIDO8OoC,Guatemala,Chapin TV
Reportan corrupción en compras por la pandemia en el Triángulo Norte,https://elperiodico.com.gt/nacionales/2020/12/09/reportan-corrupcion-en-compras-por-la-pandemia-en-el-triangulo-norte/,"Organizaciones pro transparencia destacaron que Guatemala, Honduras y El Salvador tuvieron préstamos millonarios sin condiciones de rendición de cuentas y falta de apertura para la participación ciuda",09-12-2020 20:57,https://www.bing.com/th?id=OVFT.AciBRZrR6bV71OziCijG5C,Guatemala,El Periódico Guatemala
COPRECOVID: se necesitan Q1 mil millones para vacunar al 50 %,https://crnnoticias.com/coprecovid-se-necesitan-q1-mil-millones-para-vacunar-al-50/,"Edwin Asturias, jefe de la COPRECOVID dijo que se necesitan Q1 mil millones para vacunar a la mitad de guatemaltecos contra el coronavirus.",09-12-2020 20:58,https://www.bing.com/th?id=OVFT.1-aAmM3aLhy_ouuTjkutUi,Guatemala,CRN Noticias
Fallecen otras 25 personas por coronavirus en Guatemala y se reportan 654 contagios más,https://www.prensalibre.com/guatemala/comunitario/fallecen-otras-25-personas-por-coronavirus-en-guatemala-y-se-reportan-654-contagios-mas-breaking/,"El reporte de Salud detalla que en las últimas horas fallecieron por coronavirus otras 25 personas, lo que aumenta la cifra de fallecidos a 4 mil 311 a escala nacional. En las pruebas efectuadas se di",09-12-2020 21:15,https://www.bing.com/th?id=OVFT.na9ha3nRZb80xvJk6oWW0y,Guatemala,Prensa Libre
Guatemala: ¿tensiones sociales con horizonte de cambio?,https://publicogt.com/2020/12/09/guatemala-tensiones-sociales-con-horizonte-de-cambio/,La pandemia del Covid-19 y el paso de los huracanes Eta e Iota no detuvieron a la población guatemalteca en las denuncias y movilizaciones contra el Presupuesto 2021 aprobado por el Congreso. Esta dem,09-12-2020 21:33,https://www.bing.com/th?id=OVFT.bHMoJ56foraTfzTMadDKJS,Guatemala,Publico GT
Inauguran festival navideño en Escuintla sin mascarilla ni distanciamiento físico,https://www.deguate.com/artman/publish/noticias-guatemala/inauguran-festival-navideno-en-escuintla-sin-mascarilla-ni-distanciamiento-fisico.shtml,Los personas llegar a la inauguración sin cumplir las medidas sanitarias para evitar la propagación del coronavirus. No usaron mascarilla ni distanciamiento,09-12-2020 21:54,https://www.bing.com/th?id=OVFT.ScukGlP-i2SN44cg-1Yvei,Guatemala,De Guate
OPS advierte del alza de los contagios de covid-19 en Centroamérica y Brasil,https://newsinamerica.com/pdcc/boletin/2020/ops-advierte-del-alza-de-los-contagios-de-covid-19-en-centroamerica-y-brasil,"Centroamérica. Honduras y Guatemala, afectadas por los huracanes Iota y Eta, continúan reportando una alta incidencia de casos de la covid-19. La Organización Panamericana de la Salud (OPS) advirtió e",09-12-2020 21:58,https://www.bing.com/th?id=OVFT.4AgU8aMCN_yeF2gZ0K5hvy,Guatemala,Periódico Digital Centroamericano y del Caribe
Pandemia impactó en el comercio centroamericano en el segundo trimestre,https://elperiodico.com.gt/noticias/economia/2020/12/09/pandemia-impacto-en-el-comercio-centroamericano-en-el-segundo-trimestre/,"Las medidas de confinamiento por la pandemia de la COVID-19 provocaron una caída en el comercio de bienes de la región durante el segundo trimestre de este año, según el Monitor de Comercio de Centroa",09-12-2020 23:15,https://www.bing.com/th?id=OVFT.ikUy7scLgVyXXx9sYdLq9S,Guatemala,El Periódico Guatemala
