name,url,description,datePublished,imagen,pais,Fuente
"Pagos en línea, la manera efectiva y segura de realizar transacciones",https://newsinamerica.com/pdcc/economia/2020/pagos-en-linea-la-manera-efectiva-y-segura-de-realizar-transacciones,"El efectivo dejó de ser la forma confiable de realizar negocios, el consumidor actual desea hacer sus pagos utilizando un método de contacto reducido o nulo, que genere versatilidad y garantías. Guate",05-10-2020 21:20,https://www.bing.com/th?id=OVFT.RoxlPyYWrCxoRE6A1bLZZi,Guatemala,Periódico Digital Centroamericano y del Caribe
Cierran establecimiento educativo en zona 5 por crisis económica,https://www.deguate.com/artman/publish/noticias-guatemala/cierran-establecimiento-educativo-en-zona-5-por-crisis-economica.shtml,El centro educativo anunció su cierre definitivo después de 52 años de servicio en Guatemala. La Asociación de Señoras de la Caridad de San Vicente de Paúl emitió un comunicado al,05-10-2020 21:45,https://www.bing.com/th?id=OVFT.tMg_FtCJCEV5tl2L6Mn1Li,Guatemala,De Guate
Selección de Guatemala llega a Nicaragua sin novedades,https://elmetropolitano.com.gt/es/2020/10/05/seleccion-de-guatemala-llega-a-nicaragua-sin-novedades/,"Los integrantes de la Selección Nacional de Guatemala viajaron el lunes 5 de octubre a Nicaragua, donde el martes 6 jugarán ante el combinado nicaragüense como parte de su preparación de cara al año 2",05-10-2020 21:56,https://www.bing.com/th?id=OVFT.CQmG6iBLBbTU-aXbvnhETy,Guatemala,El Metropolitano
Asturias: cifra de muertes por COVID-19 depende del cumplimiento medidas,https://lahora.gt/asturias-cifra-de-muertes-por-covid-19-depende-del-cumplimiento-medidas/,"POR MARGARITA GIRÓN jgiron@lahora.com.gt Durante la conferencia de prensa ofrecida esta mañana por Edwin Asturias, director de la Comisión Presidencial de Atención al COVID-19 (Coprecovid), el epidemi",05-10-2020 22:21,https://www.bing.com/th?id=OVFT.fkkJT_h3p_03w0m8LBkPiS,Guatemala,La Hora
Gobierno anuncia plan para garantizar la seguridad laboral y de salud,https://republica.gt/2020/10/06/guatemala-anuncia-plan-para-garantizar-la-seguridad-laboral-y-de-salud-por-covid-19/,"Para garantizar la seguridad laboral y la salud en el trabajo, este martes fue presentado el Plan Estratégico de Trabajo",06-10-2020 00:00,https://www.bing.com/th?id=OVFT._EwUnHI7TKMhzzMC7VYZmi,Guatemala,Republica
Revisamos situación del COVID-19 en Guatemala,http://www.chapintv.com/actualidad/presidente-trump-saluda-a-seguidores-tras-contagio-de-covid-19-310675,"De acuerdo a las cifras del Ministerio de Salud Pública y Asistencia Social, nuestro país ha presentado mejorías en varios datos vinculados a la emergencia sanitaria del COVID-19.",06-10-2020 02:43,https://www.bing.com/th?id=OVFT.hOcHbfT79rQwsKW2gVbnWS,Guatemala,Chapin TV
Guatemala suma 688 nuevos contagios de COVID-19 en 24 horas,http://www.chapintv.com/actualidad/guatemala-suma-688-nuevos-contagios-de-covid-19-en-24-horas-310954,"Guatemala sumó este martes ocho muertes por la COVID-19 y 688 nuevos contagios tras realizar 3.982 pruebas en las últimas 24 horas, de acuerdo al Ministerio de Salud local. Usuarios de redes sociales",06-10-2020 05:00,https://www.bing.com/th?id=OVFT.vOhTnRr88Tm8nql5eAZVZi,Guatemala,Chapin TV
Prevén más de 5 mil muertes por COVID-19 para enero,https://elperiodico.com.gt/nacion/2020/10/06/preven-mas-de-5-mil-muertes-por-covid-19-para-enero/,"La Coprecovid reiteró la importancia del uso de mascarilla para evitar la propagación del virus. El director de la Comisión Presidencial de Atención a la Emergencia COVID-19 (Coprecovid), Edwin Asturi",06-10-2020 06:05,https://www.bing.com/th?id=OVFT.1o7OWe07vNzrBCcE4sLHGC,Guatemala,El Periódico Guatemala
Empresas españolas buscan hacer negocios con Guatemala,https://elperiodico.com.gt/inversion/2020/10/06/empresas-espanolas-buscan-hacer-negocios-con-guatemala/,Once empresas españolas del sector agroalimentario de Castilla-La Mancha participarán este martes y mañana en un encuentro virtual con importadores guatemaltecos. Esta misión comercial es organizada p,06-10-2020 07:10,https://www.bing.com/th?id=OVFT.wTdPCof-cOrR-J250Gn3oi,Guatemala,El Periódico Guatemala
Casos de coronavirus,https://emisorasunidas.com/2020/10/06/casos-coronavirus-guatemala-6-octubre-2020/,Las autoridades del Ministerio de Salud Pública brindaron la actualización de datos por casos de coronavirus correspondiente para el martes 6 de octubre.,06-10-2020 14:38,https://www.bing.com/th?id=OVFT.Vuu0Ej3FNBhpCJW8sErAYS,Guatemala,Emisoras Unidas
Coronavirus: Guatemala se acerca a los 95 mil casos de covid-19,https://www.guatevision.com/nacionales/coronavirus-guatemala-se-acerca-a-los-95-mil-casos-de-covid-19,Guatemala está por cumplir siete meses de luchar contra el coronavirus y se acerca a la cifra de 95 mil casos detectados.,06-10-2020 15:04,https://www.bing.com/th?id=OVFT.2ePoaEv3SslW4xPW3KZoAy,Guatemala,Guatevision
MSPAS reporta 688 nuevos casos de COVID-19 en Guatemala,https://stereo100.com.gt/2020/mspas-reporta-688-nuevos-casos-de-covid-19-en-guatemala/,"El MSPAS indicó que, en las últimas 24 horas en Guatemala, se registran 688 nuevos casos de COVID-19 y 8 pacientes fallecidos. Los resultados corresponden a las 3 mil 982 que se desarrollaron, el lune",06-10-2020 15:11,https://www.bing.com/th?id=OVFT.0cXwwB108raXoaIUEaZKCy,Guatemala,Stereo 100
Salud reporta otros 688 contagios de covid-19 y ocho decesos más en Guatemala,https://www.prensalibre.com/guatemala/comunitario/salud-reporta-otros-688-contagios-de-covid-19-y-ocho-decesos-mas-en-guatemala-breaking/,"También fallecieron otras ocho personas por la referida enfermedad y con esto Guatemala acumula 3 mil 310 decesos. Según Salud, los casos recuperados estimados son de 83 mil 480 y la cifra de contagio",06-10-2020 15:13,https://www.bing.com/th?id=OVFT.HJk4YzD8VXBnapkcFYAyfS,Guatemala,Prensa Libre
"Con 688 casos nuevos, Guatemala suma casi 95 mil contagios de COVID-19",https://lahora.gt/con-688-casos-nuevos-guatemala-suma-casi-95-mil-contagios-de-covid-19/,"Por Denis Aguilar daguilar@lahora.com.gt En las últimas 24 horas, el Ministerio de Salud Pública y Asistencia Social reportó 688 nuevos casos de COVID-19, con lo que ahora la suma total de contagios e",06-10-2020 16:00,https://www.bing.com/th?id=OVFT.2Aeqq1IJWGZW8D5bIPqn6i,Guatemala,La Hora
COPRECOVID proyecta más de 5 mil muertes en enero,https://crnnoticias.com/coprecovid-proyecta-mas-de-5-mil-muertes-en-enero/,La Comisión Presidencial de Atención a la Emergencia COVID-19 –COPRECOVID- proyecta 5 mil 660 fallecidos a causa de la pandemia de coronavirus para enero de 2021. Según el Ministerio de Salud Pública,06-10-2020 17:44,https://www.bing.com/th?id=OVFT.EPymbTGNZe3TETj8X504Gi,Guatemala,CRN Noticias
Guatemala registra ocho muertes por COVID-19 y 688 nuevos casos,https://crnnoticias.com/guatemala-registra-ocho-muertes-por-covid-19-y-688-nuevos-casos/,Guatemala sumó este martes ocho muertes por COVID-19 y 688 nuevos contagios tras realizar 3 mil 982 pruebas en las últimas 24 horas; esto de acuerdo al Ministerio de Salud local. El país contabiliza 3,06-10-2020 21:56,https://www.bing.com/th?id=OVFT.Wofc7Iq3b6eztSeRot72uC,Guatemala,CRN Noticias
"Giammattei convoca a Gabinete, analizan acciones para evitar rebrotes de covid-19",https://republica.gt/2020/10/06/gobierno-de-guatemala-pandemia-del-covid-19/,"Para evitar que se repitan los mismos problemas que en la primera etapa de la pandemia, el presidente Alejandro Giammattei",06-10-2020 22:12,https://www.bing.com/th?id=OVFT.FBhF4nkPgC6pxA4txz_tWC,Guatemala,Republica
Guatemala implementará clases híbridas en universidades el próximo año,https://www.prensalibre.com/guatemala/comunitario/guatemala-implementara-clases-hibridas-en-universidades-el-proximo-ano/,Las clases híbridas (presenciales y en línea) serán implementadas por universidades y centros de investigación en 2021 en Guatemala.,07-10-2020 02:20,https://www.bing.com/th?id=OVFT.t_7vcnem-1VAsr956sZleC,Guatemala,Prensa Libre
Giammattei mantiene disposiciones a pesar de la “irresponsabilidad de muchísima gente” ante el coronavirus,https://www.guatevision.com/nacionales/coronavirus-giammattei-irresponsabilidad-mucha-gente-mantiene-disposiciones-breaking,Giammattei indicó que han visto la irresponsabilidad de mucha gente en medio de la pandemia. El presidente Alejandro Giammattei criticó este 6 de octubre que “muchos guatemaltecos” están actuando de m,07-10-2020 04:29,https://www.bing.com/th?id=OVFT.NonC6UFPSfujkP8SVpTx_S,Guatemala,Guatevision
