name,url,description,datePublished,imagen,pais,Fuente
Salud reporta otros 258 casos de covid-19 y 24 decesos de fechas anteriores,https://www.guatevision.com/nacionales/salud-reporta-otros-258-casos-de-covid-19-y-24-decesos-de-fechas-anteriores-breaking,"Un mil 229 pruebas fueron practicadas en las últimas horas y se diagnosticaron 258 nuevos casos de covid-19 en Guatemala. En 10 meses de emergencia por la pandemia, el total es de 149 mil 146 casos ac",19-01-2021 02:02,https://www.bing.com/th?id=OVFT.jL_BsZYZp2G363ArYQEzIy,Guatemala,Guatevision
Kellogg´s está contigo en el inicio a clases,https://newsinamerica.com/pdcc/gerenciales/2021/kelloggs-esta-contigo-en-el-inicio-a-clases/,"Guatemala. Kellogg’s busca empoderar a las familias y a todos los niños guatemaltecos para que se levanten cada día con la mejor actitud, impulsando que el inicio de clases 2021 sea único y diferente,",19-01-2021 03:19,https://www.bing.com/th?id=OVFT.BPR-PB-0JvRv7FRpN4dsfi,Guatemala,Periódico Digital Centroamericano y del Caribe
Guatemala jugará solamente un partido contra Puerto Rico,https://emisorasunidas.com/2021/01/19/guatemala-jugara-solo-un-partido-contra-puerto-rico/,La última vez que ambas escuadras se enfrentaron fue el 16 de noviembre por la última jornada de la Nations League. Con abultado triunfo nacional.,19-01-2021 16:38,https://www.bing.com/th?id=OVFT.yzYE641Com5UqEb3WQSjLS,Guatemala,Emisoras Unidas
Ejército estima que 1 mil 500 migrantes hondureños siguen en el país,https://crnnoticias.com/ejercito-estima-que-1-mil-500-migrantes-hondurenos-siguen-en-el-pais/,El Ejército de Guatemala calculó este martes que unos 1 mil 500 migrantes hondureños aún permanecen en el territorio nacional.,19-01-2021 17:14,https://www.bing.com/th?id=OVFT.TB3avDV8Nc76usyPGgZ7ES,Guatemala,CRN Noticias
Guatemala supera los 150 mil casos de COVID-19,https://stereo100.com.gt/2021/guatemala-supera-los-150-mil-casos-de-covid-19/,"Por Luis Hernández | El Ministerio de Salud Pública y Asistencia Social (MSPAS) informa que Guatemala reporta 150 mil 277 casos de COVID-19, de los cuales se estima que siguen activos 9 mil 370. En re",19-01-2021 17:17,https://www.bing.com/th?id=OVFT.oibboO35MOgYNJ13POgSUS,Guatemala,Stereo 100
Actualización del Covid-19 en Guatemala,https://www.chapintv.com/noticia/actualizacion-del-covid-19-en-guatemala/,El ministerio de Salud registra hasta la fecha un total de 150 mil 277 casos en el país Las autoridades sanitarias informan que para las últimas horas hay 1 mil 131 nuevos casos confirmados lo que sum,19-01-2021 20:02,https://www.bing.com/th?id=OVFT.6-CONPLgd9e5afddab7tOC,Guatemala,Chapin TV
Gobierno analiza nuevas medidas sanitarias contra Covid-19,https://www.deguate.com/artman/publish/noticias-guatemala/Gobierno-analiza-nuevas-medidas-sanitarias-contra-Covid-19.shtml,"Como parte de las nuevas medidas para contrarrestar el avance de la pandemia del coronavirus en país, el presidente Alejandro Giammattei y autoridades del Ministerio de Salud Pública y Asistencia Soci",19-01-2021 20:38,https://www.bing.com/th?id=OVFT.SDkbn8MsaMgS2bBJ2mzrfC,Guatemala,De Guate
Reafirman respeto a la migración regular,https://www.deguate.com/artman/publish/noticias-guatemala/Reafirman-respeto-a-la-migracion-regular.shtml,"El Gobierno de Guatemala lamentó, por medio de un comunicado, que Honduras haya incumplido los acuerdos alcanzados en reuniones anteriores entre autoridades de ambos países, El Salvador, México y Esta",19-01-2021 21:01,https://www.bing.com/th?id=OVFT.NIVX7AWOwOme7MmrsbLgPi,Guatemala,De Guate
OPS garantiza la distribución de vacunas para el 20% de los guatemaltecos,https://republica.gt/2021/01/19/vacuna-ops-guatemala/,"El mecanismo Covax, de la Organización Panamericana de la Salud (OPS) confirmó la entrega de vacunas contra el covid-19",19-01-2021 21:09,https://www.bing.com/th?id=OVFT.umUj0jpugu-chCjiaT2h8i,Guatemala,Republica
Salud reporta 1 mil 131 casos más de covid-19 y la cifra de casos activos es de 9 mil 370,https://www.guatevision.com/nacionales/salud-reporta-1-mil-131-casos-mas-de-covid-19-y-la-cifra-de-casos-activos-es-de-9-mil-370-breaking,"En laboratorios públicos y privados en las últimas horas se efectuaron 6 mil 273 pruebas. En los resultados de las pruebas se diagnosticaron 1 mil 131 casos de covid-19. Con estas últimas cifras, Guat",19-01-2021 22:04,https://www.bing.com/th?id=OVFT.JCuHLi5hSDaGWl8zyB8paC,Guatemala,Guatevision
Salud reporta 1 mil 131 casos más de covid-19 en Guatemala y otros 35 decesos por esta enfermedad,https://www.prensalibre.com/guatemala/comunitario/salud-reporta-1-mil-131-casos-mas-de-covid-19-en-guatemala-y-otros-35-decesos-por-esta-enfermedad-breaking/,"En los resultados de las pruebas se diagnosticaron 1 mil 131 casos de covid-19. Con estas últimas cifras, Guatemala ya acumula los 150 mil 277 casos registrados de coronavirus. Los decesos continúan p",19-01-2021 22:04,https://www.bing.com/th?id=OVFT.fqlfsgzPghC_IDspv7mLlC,Guatemala,Prensa Libre
16 trabajadores del Organismo Judicial han fallecido por COVID-19,https://crnnoticias.com/16-trabajadores-del-organismo-judicial-han-fallecido-por-covid-19/,Actualmente en el Organismo Judicial hay 138 trabajadores suspendidos porque fueron detectados como positivos de COVID-19.,20-01-2021 01:13,https://www.bing.com/th?id=OVFT.7DZzuhX45zB56nnnAWqIcC,Guatemala,CRN Noticias
Primer lote de vacunas contra Covid 19 llegarían en febrero,https://www.chapintv.com/noticia/primer-lote-de-vacunas-contra-covid-19-llegarian-en-febrero/,"La fecha en la que podrá contar con la vacuna para combatir el Covid 19 en Guatemala se aproxima, pues las autoridades del Ministerio de Salud Pública y Asistencia Social han señalado que el primer lo",20-01-2021 04:26,https://www.bing.com/th?id=OVFT.smpv-kADvpws-X2CmuN51S,Guatemala,Chapin TV
Aspirantes a la PNC tendrán menos meses para capacitarse,https://elperiodico.com.gt/nacionales/2021/01/20/aspirantes-a-la-pnc-tendran-menos-meses-para-capacitarse/,"Debido a la pandemia de COVID-19, este año no ingresó la misma cantidad de aspirantes para nuevos agentes a la academia de la Policía Nacional Civil (PNC), tampoco tendrán el mismo tiempo de capacitac",20-01-2021 06:24,https://www.bing.com/th?id=OVFT.LBJS4eroTs1V3z8JGTXQOi,Guatemala,El Periódico Guatemala
Recuperado un “Salvator Mundi”,https://elperiodico.com.gt/cultura/artediseno/2021/01/20/recuperado-un-salvator-mundi/,"Un ‘Salvator Mundi’, cuadro del taller de Leonardo da Vinci que estaba expuesto en una iglesia de Nápoles y cuya desaparición pasó desapercibida debido a la pandemia de COVID-19, fue encontrado en el",20-01-2021 07:01,https://www.bing.com/th?id=OVFT.ozM4mlwV7aT68tCnjD9aeS,Guatemala,El Periódico Guatemala
Cinco departamentos de Guatemala con mayor movilidad en diciembre 2020,https://republica.gt/2021/01/17/cinco-departamentos-de-guatemala-con-mayor-movilidad-en-diciembre-2020/,La consultora CABI Data Analytics evidenció que la movilidad de diciembre 2020 hacia los supermercados y comercios tuvo un buen desempeño.,20-01-2021 07:18,https://www.bing.com/th?id=OVFT.5XJgN31vUjqheQee-ueCvy,Guatemala,Republica
Giammattei Announces That Measures Will Be Established to Contain Covid-19 Contagions,https://newsinamerica.com/en/breaking-news/2021/giammattei-announces-that-measures-will-be-established-to-contain-covid-19-contagions/,"In his speech at the opening of a school in Chimaltenango, President Alejandro Giammattei said some measures will be implemented against the Covid-19 in the coming days. Giammattei attended the opening of a school in Buena Vista village,",20-01-2021 07:23,https://www.bing.com/th?id=OVFT.1zfQTBSCV7e6rKzIVclb7y,Guatemala,Periódico Digital Centroamericano y del Caribe
Despido o continuidad: Directorio decidirá futuro del jefe de la SAT antes de que termine enero,https://www.prensalibre.com/economia/despido-o-continuidad-directorio-decidira-futuro-del-jefe-de-la-sat-antes-de-que-termine-enero/,"El superintendente Marco Livio Díaz Reyes fue evaluado en el cumplimiento de las metas de recaudación por el Directorio de la SAT, y será hasta la próxima semana cuando se conozca la decisión.",20-01-2021 11:00,https://www.bing.com/th?id=OVFT.ZWfseYGtGDHGfbM8Pf28xC,Guatemala,Prensa Libre
