name,url,description,datePublished,imagen,pais,Fuente
Salud reporta 238 casos nuevos de covid-19 en Guatemala y 4 fallecidos más,https://www.guatevision.com/nacionales/salud-reporta-238-casos-nuevos-de-covid-19-en-guatemala-y-4-fallecidos-mas-breaking,"En las últimas 24 horas se hicieron 1 mil 382 pruebas de coronavirus en todo el país, cifra baja debido a que es fin de semana.",12-04-2021 22:11,https://www.bing.com/th?id=OVFT.c5qa_ilWDufLBeIxccLNLi,Guatemala,Guatevision
"SIIMA, una solución en construcción, remodelación y decoración",https://newsinamerica.com/pdcc/gerenciales/2021/siima-una-solucion-en-construccion-remodelacion-y-decoracion/,"Amplia cobertura que brinda a nuestros lectores la información que necesitan para estar actualizados del acontecer centroamericano, caribeño y latinoamericano.",12-04-2021 22:17,https://www.bing.com/th?id=OVFT.sPmJkx6GNkLDozHZ-loMgi,Guatemala,Periódico Digital Centroamericano y del Caribe
Nuevas variantes de coronavirus en Centroamérica,https://republica.gt/2021/04/12/nuevas-variantes-de-coronavirus-en-centroamerica/,"Con la reapertura en Centroamérica, las nuevas variantes del coronavirus hacen ya de las suyas. El continente registra un incremento.",13-04-2021 01:55,https://www.bing.com/th?id=OVFT.FEenU0n39Oz2EwyKN0DSiS,Guatemala,Republica
Arranca el Mes del Comercio Electrónico en Guatemala,https://newsinamerica.com/pdcc/gerenciales/2021/arranca-el-mes-del-comercio-electronico-en-guatemala/,Este mes se realiza el mayor evento nacional para la difusión y adopción del comercio electrónico en Guatemala de la mano del Kolau y ... año pasado como consecuencia de la pandemia de la covid-19. Es en este contexto que el Plan de Digitalización ...,13-04-2021 01:58,https://www.bing.com/th?id=OVFT.sPmJkx6GNkLDozHZ-loMgi,Guatemala,Periódico Digital Centroamericano y del Caribe
Guatemala espera la llegada de un lote de vacunas Sputnik para finales de mes,https://crnnoticias.com/guatemala-espera-la-llegada-de-un-lote-de-vacunas-sputnik-para-finales-de-mes/,"El presidente Alejandro Giammattei, afirmó que esperan para finales de este mes la llegada de al menos un millón de vacunas Sputnik V.",13-04-2021 15:57,https://www.bing.com/th?id=OVFT.D1UvBnc28rhUfWr8ujSvKC,Guatemala,CRN Noticias
Salud Pública contratará más personal,https://www.deguate.com/artman/publish/noticias-guatemala/Salud-Publica-contratara-mas-personal.shtml,"Guatemala. Para fortalecer la atención hospitalaria, ante la tercera ola de contagios de Covid-19, el Ministerio de Salud Pública y Asistencia Social (MSPAS) iniciará la contratación de más personal con el fin de mitigar los efectos de la pandemia.",13-04-2021 16:03,https://www.bing.com/th?id=OVFT.IMVWtCARKPkGBoowWPja6y,Guatemala,De Guate
"Sin medidas de orden público, Gobierno deja atención al COVID-19 en autoridades locales",https://lahora.gt/sin-medidas-de-orden-publico-gobierno-deja-atencion-al-covid-19-en-autoridades-locales/,"Por María España mespana@lahora.com.gt Ante el incremento de casos positivos de Covid-19 en el territorio nacional y la confirmación de la variante “Californiana”, nuevamente el gobierno de Guatemala",13-04-2021 17:00,https://www.bing.com/th?id=OVFT.htSby2g8nbLpgAp_SWm7Jy,Guatemala,La Hora
Guatemala busca desde hoy boletos a Tokio 2020 en Preolímpico de Tenis de Mesa en Argentina,https://elmetropolitano.com.gt/es/2021/04/13/guatemala-busca-desde-hoy-boletos-a-tokio-2020-en-preolimpico-de-tenis-de-mesa-en-argentina/,"pero debido a la pandemia del coronavirus COVID-19, la edición fue postergada para celebrarse del 23 de julio al 8 de agosto de 2021. En esta oportunidad, serán los deportistas del tenis de mesa quienes participarán en el Preolímpico de Tenis de Mesa ...",13-04-2021 18:13,https://www.bing.com/th?id=OVFT.H10z7Gy59i95jG7E0gYSXi,Guatemala,El Metropolitano
"Quetzaltenango acumula 557 fallecidos por covid-19; ayer fueron siete víctimas, incluyendo un bebé de nueve meses",https://stereo100.com.gt/2021/quetzaltenango-acumula-557-fallecidos-por-covid-19-ayer-fueron-siete-victimas-incluyendo-un-bebe-de-nueve-meses/,"Por Raúl Juárez Francis Gómez, de Servicios ambientales del Centro de Atención Integral (CAP), aseguró que desde que inició la tercera ola de contagios, han reportado 557 personas fallecidas en todo d",13-04-2021 23:13,https://www.bing.com/th?id=OVFT.k6DRb_tAN8qsjAeVrZ3Q0S,Guatemala,Stereo 100
El Hogar de Ancianos de San Vicente de Paúl pide la ayuda de los guatemaltecos,https://www.guatemala.com/noticias/sociedad/hogar-ancianos-san-vicente-paul-pide-ayuda-guatemaltecos.html,Los guatemaltecos pueden aportar su granito de arena a los abuelitos del Hogar de Ancianos de San Vicente de Paúl está pidiendo ayuda.,14-04-2021 00:08,https://www.bing.com/th?id=OVFT.uo4WIZcbi3nvxdTTDgm8Ty,Guatemala,Guatemala
Guatemala registra 2 mil 13 nuevos casos de coronavirus y se reportan otras 37 muertes a causa de la enfermedad,https://www.guatevision.com/nacionales/guatemala-registra-2-mil-13-nuevos-casos-de-coronavirus-y-se-reportan-otras-37-muertes-a-causa-de-la-enfermedad-breaking,Guatemala llegó este martes a 7 mil 57 muertes a causa del covid-19 y las autoridades de Salud hicieron un llamado a la reflexión a la población a retomar las medidas preventivas debido al aumento de los casos de coronavirus en el país. El Ministerio ...,14-04-2021 02:46,https://www.bing.com/th?id=OVFT.02IWLD9l8e2ltG1a9rt2Xi,Guatemala,Guatevision
Guatemala supera los dos mil casos de coronavirus diarios y se reporta la muerte de otras 37 personas,https://www.prensalibre.com/guatemala/comunitario/guatemala-supera-los-dos-mil-casos-de-coronavirus-diarios-y-se-reporta-la-muerte-de-otras-37-personas-breaking/,Los casos de coronavirus van en aumento y autoridades llaman a reforzar las medias sanitarias para afrontar la tercera ola de contagios.,14-04-2021 02:45,https://www.bing.com/th?id=OVFT.mIDBFNFi1P1WZpgQ4ufpoC,Guatemala,Prensa Libre
MSPAS reporta 2.013 nuevos casos de Covid 19,https://www.chapintv.com/noticia/mspas-reporta-2-013-nuevos-casos-de-covid-19/,Guatemala llegó este martes a 13 meses de pandemia con 7.057 muertes a causa de la covid-19 y 205.322 casos positivos contabilizados de manera oficial. El Ministerio de Salud guatemalteco informó en s,14-04-2021 03:20,https://www.bing.com/th?id=OVFT.PvZ0HAwe28CX2hPooDq--y,Guatemala,Chapin TV
2.013 nuevos casos de Covid 19 en el país,https://www.chapintv.com/noticia/2-013-nuevos-casos-de-covid-19-en-el-pais/,Guatemala llegó este martes a 13 meses de pandemia con 7.057 muertes a causa de la covid-19 y 205.322 casos positivos contabilizados de manera oficial. El Ministerio de Salud guatemalteco informó en su actualización de datos sobre el SARS-CoV-2 que en ...,14-04-2021 05:18,https://www.bing.com/th?id=OVFT.dvbLkXTcd3Ht5c6L58pJKC,Guatemala,Chapin TV
El covid-19 mata a más guatemaltecos que la violencia homicida,https://www.prensalibre.com/guatemala/comunitario/el-covid-19-mata-a-mas-guatemaltecos-que-la-violencia-homicida/,"Un año atrás el país estaba confinado debido a la pandemia del covid-19, y eso llevó a una disminución de muertes por violencia homicida, ahora la población está de nuevo en las calles y los",14-04-2021 11:00,https://www.bing.com/th?id=OVFT.5k4aqVgigLwpN7eF3ViILS,Guatemala,Prensa Libre
Secretaría de Comunicación de la Presidencia da positivo a COVID-19,https://elperiodico.com.gt/nacionales/2021/04/14/secretaria-de-comunicacion-de-la-presidencia-da-positivo-a-covid-19/,"Patricia Letona, Secretaria de Comunicación de la Presidencia informó que este miércoles dio positivo a COVID-19. “Efectivamente anoche fui diagnosticada positiva a COVID-19. Los síntomas son leves y",14-04-2021 15:24,https://www.bing.com/th?id=OVFT.7LXgpu43U1yda8UR0B6-Ry,Guatemala,El Periódico Guatemala
"El sedentarismo aumenta el riesgo de morir por covid-19, según un estudio",https://elperiodico.com.gt/cultura/salud/2021/04/14/el-sedentarismo-aumenta-el-riesgo-de-morir-por-covid-19-segun-un-estudio/,"La falta de ejercicio se asocia con un mayor riesgo, en caso de covid-19, de desarrollar una forma más grave de la enfermedad y de morir como consecuencia de ella, según un estudio realizado con casi 50.000 pacientes que se publica este miércoles.",14-04-2021 16:03,https://www.bing.com/th?id=OVFT.aZ_DZDwfKuzu81MGWYRKyy,Guatemala,El Periódico Guatemala
Finanzas suma más de Q623 millones en desembolsos para vacunas contra el COVID-19,https://lahora.gt/finanzas-suma-mas-de-q623-millones-en-desembolsos-para-vacunas-contra-el-covid-19/,"POR HEDY QUINO hquino@lahora.com.gt El Ministerio de Finanzas Públicas informó que a la fecha han realizado tres desembolsos de más de Q600 millones al Ministerio de Salud Pública y Asistencia Social,",14-04-2021 16:43,https://www.bing.com/th?id=OVFT.VH6zIfUZ3PTst9Jyo_qxeS,Guatemala,La Hora
"Gobierno entrega títulos de propiedad, en Sipacate",https://www.deguate.com/artman/publish/noticias-guatemala/Gobierno-entrega-titulos-de-propiedad-en-Sipacate.shtml,Guatemala. “Hoy son 150 beneficiados ... se arrancará el programa de inmunización “en los 110 municipios que están en rojo” por el Covid-19. Dijo que se anunciará “la página web en la que la gente se va a poder inscribir anticipadamente ...,14-04-2021 16:58,https://www.bing.com/th?id=OVFT.I_e1LP5KAAt-We5Ay4UymC,Guatemala,De Guate
