name,url,description,datePublished,imagen,pais,Fuente
Quiche: Presidente inicia los trabajos para asfaltar un camino rural de Sacapulas,https://elmetropolitano.com.gt/es/2021/01/16/quiche-presidente-inicia-los-trabajos-para-asfaltar-un-camino-rural-de-sacapulas/,"El comienzo de los trabajos para asfaltar un camino rural en Sacapulas, Quiché, se han iniciado este sábado con la visita del presidente Alejandro Giammattei. El tramo carretero tendrá 6,7 kilómetros",16-01-2021 00:00,https://www.bing.com/th?id=OVFT.InB77HN9FyBgkjJChMDNbi,Guatemala,El Metropolitano
"“Somos el país que menos vamos a sufrir económicamente”, dice Giammattei",https://www.deguate.com/artman/publish/noticias-guatemala/somos-el-pais-que-menos-vamos-a-sufrir-economicamente-dice-giammattei.shtml,El presidente Alejandro Giammattei asegura que Guatemala será el país que menos sufrirá económicamente por la pandemia del,16-01-2021 00:24,https://www.bing.com/th?id=OVFT.ErYnKJcHi_teMNj-Tkrqky,Guatemala,De Guate
Cantidad de pruebas de covid-19 bajan en las últimas 24 horas en Guatemala y se reportan 621 casos nuevos,https://www.guatevision.com/nacionales/cantidad-de-pruebas-de-covid-19-bajan-en-las-ultimas-24-horas-en-guatemala-y-se-reportan-621-casos-nuevos-breaking,El reporte de Salud detalla que se hicieron 1 mil 175 exámenes para detectar covid-19 en todo el país y hubo 26 muertes de casos registrados en rechas anteriores.,16-01-2021 00:47,https://www.bing.com/th?id=OVFT.LqKgyLhn_77IaQf4Ni1_Yi,Guatemala,Guatevision
Guatemala tiene 621 nuevos casos de Covid 19,https://www.chapintv.com/noticia/guatemala-tiene-621-nuevos-casos-de-covid-19/,"El Ministerio de Salud reporta 621 nuevos casos de covid-19 detectados en las últimas 24 horas de 1 mil 175 pruebas procesadas. Además, hay 26 fallecidos de fechas anteriores. El total de infectados a",16-01-2021 04:10,https://www.bing.com/th?id=OVFT.RR75d56gjk3JLt32TXFCGi,Guatemala,Chapin TV
Monitorean evolución del flujo migratorio,https://radiotgw.gob.gt/monitorean-evolucion-del-flujo-migratorio/,A la visita también asistió la Representante en Guatemala de la Agencia de las Naciones Unidas ... de contagio y protección de nuestra población por la pandemia del COVID-19.,16-01-2021 13:53,https://www.bing.com/th?id=OVFT.Vs-ZJJ7N2jDnXPl4BGb1CC,Guatemala,TGW
Pandemia llega a los 148 mil 598 casos de Covid-19 en el país,https://emisorasunidas.com/2021/01/16/coronavirus-en-guatemala-16-enero-2021-covid/,"La pandemia del nuevo coronavirus ha provocado 5 mil 220  muertes en Guatemala desde que la enfermedad apareció en marzo del año pasado. Desde el comienzo de la pandemia, 148 mil 598 personas contraje",16-01-2021 17:39,https://www.bing.com/th?id=OVFT.YdRjkjUzjlmIWFTshNEFDC,Guatemala,Emisoras Unidas
Migración estima que hasta 8 mil personas integran caravana migrante,https://lahora.gt/migracion-estima-que-hasta-8-mil-personas-integran-caravana-migrante/,"Vídeo IGM Por Grecia Ortíz gortiz@lahora.com.gt Luego que ingresará al país un tercer grupo de migrantes, quienes conforman la nueva caravana que busca llegar a Estados Unidos, el Instituto Guatemalte",16-01-2021 20:46,https://www.bing.com/th?id=OVFT.Fkqdb7LlY4Nn6a9l8d956y,Guatemala,La Hora
Guatemala pide a Honduras contener las caravanas de migrantes,https://crnnoticias.com/guatemala-pide-a-honduras-contener-las-caravanas-de-migrantes/,"Este sábado, el Gobierno de Guatemala pidió a Honduras contener las caravanas ... los migrantes no cumplen con las medidas sanitarias como hacerse la prueba de COVID-19. “Como parte de las acciones de prevención y seguridad contempladas ante la ...",16-01-2021 20:50,https://www.bing.com/th?id=OVFT.PgsITmn4-iwByuJ7r5LCKy,Guatemala,CRN Noticias
Giammattei anuncia que en febrero se espera la llegada de las vacunas contra el covid-19,https://republica.gt/2021/01/16/giammattei-anuncia-que-en-febrero-se-espera-la-llegada-de-las-vacunas-contra-el-covid-19/,"Durante su visita a San Juan Ostuncalco, Quetzaltenango, para la inauguración de un tramo de carretera, el presidente Alejandro",16-01-2021 23:23,https://www.bing.com/th?id=OVFT.AplT9383q0RcJjALzhYkCS,Guatemala,Republica
Guatemala se pronuncia mientras hondureños avanzan por su territorio,https://stereo100.com.gt/2021/guatemala-se-pronuncia-mientras-hondurenos-avanzan-por-su-territorio/,Con información de Prensa Libre. Guatemala le pide a Honduras que detenga la salida masiva de su población. El Gobierno de Guatemala hizo un llamado este sábado 16 de enero a Honduras para “contener l,17-01-2021 01:26,https://www.bing.com/th?id=OVFT.8VIB3j8RfXsLCwy9bbvvti,Guatemala,Stereo 100
Honduras y países conectados con el mundo Maya acuerdan impulsar el turismo,https://newsinamerica.com/pdcc/turismo/2021/honduras-y-paises-conectados-con-el-mundo-maya-acuerdan-impulsar-el-turismo/,"Honduras y otros países como México, El Salvador, Guatemala y Belice acordaron impulsar el turismo durante la celebración de la Rueda de Negocios Virtual organizada por Mundo Maya. Durante la reunión,",17-01-2021 02:53,https://www.bing.com/th?id=OVFT.xzxITiVfEPBzY5UJtzXV4i,Guatemala,Periódico Digital Centroamericano y del Caribe
Presidente Giammattei presenta Informe General de la República 2020,https://radiotgw.gob.gt/presidente-giammattei-presenta-informe-general-de-la-republica-2020/,"TGW Digital – El presidente constitucional de la República, Doctor Alejandro Giammattei, presentó el Informe General de la República 2020; le acompañaron en la mesa principal Allan Rodríguez, titular del Congreso de Guatemala, y Silvia Patricia ...",17-01-2021 03:16,https://www.bing.com/th?id=OVFT.LLcaMLgl3MFUVf5ghAIaYC,Guatemala,TGW
El COVID-19 aumenta en silencio,https://elperiodico.com.gt/noticias/domingo/2021/01/17/el-covid-19-aumenta-en-silencio/,"El personal de salud empieza a ver cómo nuevamente las camas se llenan, los insumos se agotan y los medicamentos son insuficientes.",17-01-2021 06:28,https://www.bing.com/th?id=OVFT.EGyEP45Sv3Y8gU2C36ySWC,Guatemala,El Periódico Guatemala
Verificamos por usted: ¿La vacuna contra el coronavirus ya está a la venta en Guatemala?,https://www.prensalibre.com/guatemala/comunitario/verificamos-por-usted-la-vacuna-contra-el-coronavirus-ya-esta-a-la-venta-en-guatemala/,"Usuarios de redes sociales han alertado sobre un grupo de personas que están ofreciendo y vendiendo una supuesta vacuna contra el covid-19, pero el Ministerio de Salud ya confirmó que la misma es",17-01-2021 07:03,https://www.bing.com/th?id=OVFT.tGjbXV4t7M4ebu8gJtB-9i,Guatemala,Prensa Libre
Verificamos por usted: ¿La vacuna contra el covid-19 ya está a la venta en Guatemala?,https://www.guatevision.com/nacionales/verificamos-por-usted-la-vacuna-contra-el-covid-19-ya-esta-a-la-venta-en-guatemala,"Los primeros reportes de grupos de personas que intentan engañar a los guatemaltecos provienen de Zacapa y de la zona 6 de Mixco. Según varios testimonios, un grupo de personas vestidas con trajes",17-01-2021 07:03,https://www.bing.com/th?id=OVFT.pIBG1yddwEGXmKT9feuoRS,Guatemala,Guatevision
Migrantes no logran romper muralla y se genera enfrentamiento,https://lahora.gt/migrantes-no-logran-romper-muralla-y-se-genera-enfrentamiento/,"Video IGM Por Grecia Ortíz gortiz@lahora.com.gt Un vídeo compartido por el Instituto Guatemalteco de Migración (IGM), mostró el momento en el que el Ejército y migrantes, que se encuentran en el kilóm",17-01-2021 15:19,https://www.bing.com/th?id=OVFT.9IhTREDE_6-MebtkQmtFxi,Guatemala,La Hora
"Casos de Covid-19 en Guatemala, hoy 17 de enero de 2021",https://emisorasunidas.com/2021/01/17/casos-covid-19-guatemala-17-enero-2021/,Autoridades del Ministerio de Salud brindaron la actualización de datos por casos de coronavirus correspondiente al 17 de enero de 2021.,17-01-2021 15:59,https://www.bing.com/th?id=OVFT.ifxdZYVV3faFopc8a7VL7C,Guatemala,Emisoras Unidas
Autoridades de salud solicitan responsabilidad a jóvenes por casos de COVID-19,https://crnnoticias.com/autoridades-de-salud-solicitan-responsabilidad-a-jovenes-por-casos-de-covid-19/,"Las autoridades de salud de Quetzaltenango, solicitaron a los jóvenes responsabilidad ante el incremento de casos de COVID-19.",17-01-2021 16:19,https://www.bing.com/th?id=OVFT.b_D2lcRiz7wS67p4BaxOwi,Guatemala,CRN Noticias
Ministerio de Salud actualiza datos de COVID-19 en Guatemala,https://www.chapintv.com/noticia/ministerio-de-salud-actualiza-datos-de-covid-19-en-guatemala-22/,"Se registraron 290 nuevos casos de COVID-19 en Guatemala, y se hicieron 2,221 tamizados (pruebas). Según reporte del MSPAS, no se registraron fallecidos en las últimas 24 horas. De los 34 fallecidos reportados este 17 de enero, la mayor parte son ...",17-01-2021 18:30,https://www.bing.com/th?id=OVFT.kz8cR3cVjEpv8pEvLZMHXC,Guatemala,Chapin TV
"Guatemala otra vez reporta más de 1 mil casos de COVID-19, en 24 horas",https://stereo100.com.gt/2021/guatemala-otra-vez-reporta-mas-de-1-mil-casos-de-covid-19-en-24-horas/,"Guatemala. El Ministerio de Salud reportó 1,038 nuevos contagios de Coronavirus Covid-19 este sábado 16 de enero, tras efectuar 5 mil 670 hisopados. En las últimas tres semanas, la mayoría de días se han detectado más de 1,000 casos. Con esto ...",17-01-2021 18:48,https://www.bing.com/th?id=OVFT.aHJW71-4z1EmvEOqc61sgy,Guatemala,Stereo 100
Brasil aprueba uso de emergencia de primeras vacunas contra covid-19,https://elperiodico.com.gt/noticias/internacionales/2021/01/17/brasil-aprueba-uso-de-emergencia-de-primeras-vacunas-contra-covid-19/,"El regulador sanitario brasileño (Anvisa) aprobó el domingo el uso de emergencia de la vacuna china CoronaVac y la británica AstraZeneca/Oxford contra el covid-19, primeras en obtener luz verde en este país que ya acumula casi 210.000 muertes.",17-01-2021 18:49,https://www.bing.com/th?id=OVFT.IAQYL_ySg_w9spXulCgshi,Guatemala,El Periódico Guatemala
Crisis migratoria: ¿Qué provocó la nueva caravana de migrantes hondureños que ingresó a Guatemala?,https://www.prensalibre.com/guatemala/migrantes/crisis-migratoria-que-provoco-la-nueva-caravana-de-migrantes-hondurenos-que-ingreso-a-guatemala/,"Se trata de una crisis política que inició en 2009, una situación que se agravó por la pandemia del coronavirus ... se perdieron en 2020 por la covid-19 y las tormentas. Los migrantes aseguran que solo quieren pasar por Guatemala, pero no quedarse.",17-01-2021 20:52,https://www.bing.com/th?id=OVFT.h1uJEN-teZbE9B1x1K5Xny,Guatemala,Prensa Libre
Covid-19 | Experto explica qué pasaría si la segunda ola es mayor a la primera,https://republica.gt/2021/01/17/covid-19-experto-explica-que-pasaria-si-la-segunda-ola-es-mayor-a-la-primera/,"Son tres los posibles escenarios para Guatemala en esta nueva ola de contagios de covid-19, según el director de Diestra, Rodolfo Mendoza.",17-01-2021 23:13,https://www.bing.com/th?id=OVFT.RDKmySKrRuti9LCQglXrtS,Guatemala,Republica
