name,url,description,datePublished,imagen,pais,Fuente
"Lo que pasó, pasó",https://lahora.gt/lo-que-paso-paso/,"Estamos preparándonos para cerrar el almanaque de este aciago, en muchos sentidos, año 2020 que se esperó con muchas ilusiones aplastadas todas por la propagación del Covid-19 que destruyó todas las a",30-12-2020 13:45,https://www.bing.com/th?id=OVFT.rQBmPakEq_KWj36T_WuyQS,Guatemala,La Hora
"COVID-19: 879 nuevos contagios, el registro más alto en los últimos dos meses",https://lahora.gt/covid-19-879-nuevos-contagios-el-registro-mas-alto-en-los-ultimos-dos-meses/,"POR MANUEL GARCÍA mgarcia@lahora.com.gt El Ministerio de Salud Pública y Asistencia Social (MSPAS), actualizó el Tablero Covid-19, en el que se registra que el pasado 29 de diciembre se detectaron 879",30-12-2020 14:31,https://www.bing.com/th?id=OVFT.pNFewdNl2_re3E3Uh4ojfy,Guatemala,La Hora
Salud reporta más de 125 mil personas recuperadas de COVID-19,https://radiotgw.gob.gt/salud-reporta-mas-de-125-mil-personas-recuperadas-de-covid-19/,TGW Digital – El Ministerio de Salud Pública y Asistencia Social informó de los casos confirmados por laboratorio en el tablero Situación COVID-19 en Guatemala para este 30 de diciembre. El,30-12-2020 14:50,https://www.bing.com/th?id=OVFT.w0D5FSsMX9ejmAObns4lDi,Guatemala,TGW
Guatemala reporta 879 nuevos casos de COVID-19,https://stereo100.com.gt/2020/guatemala-reporta-879-nuevos-casos-de-covid-19/,"Por Luis Hernández | Este miércoles, el Ministerio de Salud Pública y Asistencia Social (MSPAS) reporta 879 nuevos casos de COVID-19 y 22 fallecidos. https://twitter.com/MinSaludGuate/status/134428684",30-12-2020 16:18,https://www.bing.com/th?id=OVFT.fLXbkEX4eP0yNQ_MqpXjuy,Guatemala,Stereo 100
Esto según las estadísticas que dio a conocer este martes el Ministerio de Salud Pública y Asistencia Social MSPAS.,https://crnnoticias.com/covid-19-capital-de-guatemala-es-el-foco-de-la-pandemia-en-el-pais/,"La capital de Guatemala, donde radican 3.5 millones de personas, es el principal foco de contagios y muertes por COVID-19 en el país",30-12-2020 19:40,https://www.bing.com/th?id=OVFT.lgsUiqU9dDIgsFb7wS_BbC,Guatemala,CRN Noticias
Estados Unidos envía el último vuelo con deportados a Guatemala del 2020,https://crnnoticias.com/estados-unidos-envia-el-ultimo-vuelo-de-deportados-a-guatemala-del-2020/,"Estados Unidos envió ayer el último vuelo con migrantes deportados a Guatemala de 2020. En el vuelo viajaron 97 personas, incluidos 4 menores.",30-12-2020 19:45,https://www.bing.com/th?id=OVFT.vuWO0zpf4gt0BDH8bZcAJi,Guatemala,CRN Noticias
Revisamos número de casos Covid-19 en Guatemala,https://www.chapintv.com/noticia/revisamos-numero-de-casos-covid-19-en-guatemala/,"De acuerdo a las cifras publicadas por el Ministerio de Salud Pública y Asistencia Social, Guatemala mantiene 6 mil 733 casos activos de contagiados de Covid-19.",30-12-2020 19:53,https://www.bing.com/th?id=OVFT.RR75d56gjk3JLt32TXFCGi,Guatemala,Chapin TV
Esto dice Coprecovid sobre la posible llegada de nueva cepa del covid-19 a Guatemala y advierte mayor ocupación hospitalaria,https://www.guatevision.com/nacionales/esto-dice-coprecovid-sobre-la-posible-llegada-de-nueva-cepa-del-covid-19-a-guatemala-y-advierte-mayor-ocupacion-hospitalaria,"Comienza aumento de casos de coronavirus en algunos departamentos. Edwin Asturias, jefe de la Comisión Presidencial contra el Coronavirus (Coprecovid), en conferencia de prensa este miércoles 30 de di",30-12-2020 21:01,https://www.bing.com/th?id=OVFT._IEVnKt_kkmseQI8U2Sz2y,Guatemala,Guatevision
Salud reporta 879 contagios nuevos de coronavirus en Guatemala y 22 fallecidos,https://www.prensalibre.com/guatemala/comunitario/salud-reporta-879-contagios-nuevos-de-coronavirus-en-guatemala-y-22-fallecidos-breaking/,"En las últimas 24 horas se realizaron 5 mil 403 pruebas para detectar covid-19 en el país, y la cifra total de contagios subió a 137 mil 166.",30-12-2020 21:21,https://www.bing.com/th?id=OVFT.C5jEtfyj9rkmlwVZubQwTS,Guatemala,Prensa Libre
Aeropuerto de Guatemala cambia disposiciones en protocolo anticovid,https://stereo100.com.gt/2020/aeropuerto-de-guatemala-cambia-disposiciones-en-protocolo-anticovid/,El Ministerio de Salud de Guatemala (MSPAS) informa que se actualizó el Lineamiento Nacional para la Prevención de COVID-19 para viajes internacionales hacia y desde Guatemala. Pasajeros nacionales y,30-12-2020 23:03,https://www.bing.com/th?id=OVFT.HG3m-sWlptmuWJJy3Ge5Dy,Guatemala,Stereo 100
Situación del COVID-19 en Guatemala,https://www.chapintv.com/noticia/situacion-del-covid-19-en-guatemala-4/,"Autoridades de salud, indicaron que a partir del 28 de octubre se registra un aumento en la ocupación de camas por el COVID-19, lo que refleja un efecto de la segunda ola de contagios.",31-12-2020 03:43,https://www.bing.com/th?id=OVFT.DIAzun-cZsclI_yjeVgyWC,Guatemala,Chapin TV
Luis Martínez registró la octava mejor marca del mundo en los 100 metros mariposa del 2020,https://www.guatemala.com/deportes/natacion/luis-martinez-registro-octava-mejor-marca-mundo-100-metros-mariposa-2020.html,El nadador guatemalteco Luis Martínez terminó con la octava mejor marca del mundo registrada en este 2020 en la prueba de los 100 metros mariposa.,31-12-2020 14:58,https://www.bing.com/th?id=OVFT.VwrhAltjA3SdJVp_KpuGxS,Guatemala,Guatemala
Biden anuncia un homenaje a víctimas de covid-19 previo a investidura,https://republica.gt/2020/12/31/biden-anuncia-un-homenaje-a-victimas-de-covid-19-previo-a-investidura/,"El comité que organiza la investidura del presidente electo, Joe Biden, anunció este jueves que previo a la toma de posesión",31-12-2020 18:33,https://www.bing.com/th?id=OVFT.qB7gNQ_u5_0BZqqRB87XKS,Guatemala,Republica
Cancelan Caravana del Zorro por el covid-19,https://republica.gt/2020/12/31/cancelan-caravana-del-zorro-por-el-covid-19/,"Por la aglomeración que implica la tradicional Caravana del Zorro, la dirigencia anunció este jueves la cancelación del peregrinaje en moto",31-12-2020 19:08,https://www.bing.com/th?id=OVFT.dD1dmZBLL471ManGhRfFLC,Guatemala,Republica
"El año 2020 deja al menos 5 mil muertos, desempleo y un Presidente desgastado",https://elperiodico.com.gt/nacionales/2020/12/31/el-ano-2020-deja-al-menos-5-mil-muertos-desempleo-y-un-presidente-desgastado/,"Después de más de nueve meses desde que se detectó el primer caso de COVID-19 en Guatemala, el tratamiento de la pandemia generó un desgaste al presidente Giammattei y las autoridades de Gobierno por",31-12-2020 21:10,https://www.bing.com/th?id=OVFT.TUR3pyTQGSSySkjLI8rnHC,Guatemala,El Periódico Guatemala
Autoridades de Salud confirman 846 nuevos casos de COVID-19,https://emisorasunidas.com/2020/12/31/guatemala-covid-salud-casos-2/,"El Ministerio de Salud Pública y Asistencia Social (MSPAS) estableció la cifra de fallecidos por COVID-19 en cerca de 5 mil, según el último reporte.",31-12-2020 22:03,https://www.bing.com/th?id=OVFT.IlrjGiNf_QWN5kZvcVOzNi,Guatemala,Emisoras Unidas
Personal médico del IGSS cantaron villancicos a hospitalizados por fin de año 2020,https://www.guatemala.com/noticias/sociedad/enfermeros-igss-cantaron-villancicos-hospitalizados-fin-ano-2020.html,"Personal médico del IGSS de la Zona 9 capitalina llevó un ameno momento a hospitalizados, ya que les cantaron villancicos por fiestas de fin de año.",01-01-2021 02:44,https://www.bing.com/th?id=OVFT.00Ado2nUjvugQR5wucFppi,Guatemala,Guatemala
Coronavirus en Guatemala se cobra la vida de otras 10 personas y se registran 846 casos nuevos,https://www.guatevision.com/nacionales/coronavirus-en-guatemala-se-cobra-la-vida-de-otras-10-personas-y-se-registran-846-casos-nuevos-breaking,La cifra total de contagios de covid-19 en Guatemala es de 138 mil 012 y 4 mil 813 fallecidos. El Ministerio de Salud actualizó el Tablero Covid-19 y reporta que en las últimas 24 horas se realizaron,01-01-2021 05:30,https://www.bing.com/th?id=OVFT.cHDwlGe11xOZW-T_UvxGwC,Guatemala,Guatevision
"Para abril, o para Mayo, la vacuna",https://elperiodico.com.gt/opinion/opiniones-de-hoy/2021/01/01/para-abril-o-para-mayo-la-vacuna/,"Hay una canción, vieja como la maña de pedir fiado, que dice: “Para abril, o para mayo veré, que me ofrezcas la primera, prueba de amor”; y de eso me acordé cuando leí que las primeras vacunas contra",01-01-2021 14:16,https://www.bing.com/th?id=OVFT.kCQSm0sYCQ0-ryT0Fe7_-S,Guatemala,El Periódico Guatemala
La pandemia y el efecto que ha tenido en el futbol guatemalteco,https://emisorasunidas.com/2021/01/01/la-pandemia-efecto-en-el-futbol-guatemalteco/,"El futbol fue uno de los deportes que se vio más afectado por la pandemia del COVID-19 en Guatemala. Cuando se detectó el primer caso en el país, viernes 13 de marzo, el Torneo Clausura 2020 iba a dis",01-01-2021 16:08,https://www.bing.com/th?id=OVFT.84cqMdgOIE9YbuH6gYzQTy,Guatemala,Emisoras Unidas
Guatemala cierra el 2020 con 138 mil 236 casos de covid-19 y 4 mil 820 muertos,https://www.prensalibre.com/guatemala/comunitario/guatemala-cierra-el-2020-con-138-mil-236-casos-de-covid-19-y-4-mil-820-muertos-breaking/,"El primer caso de covid-19 en Guatemala fue reportado por el gobierno el 13 de marzo 2020 y al 31 de diciembre el país acumuló 138 mil 236 contagios registrados. Perdieron la vida siete pacientes más,",01-01-2021 16:30,https://www.bing.com/th?id=OVFT.QsUZizv5b9PXz8_-YkTJry,Guatemala,Prensa Libre
