name,url,description,datePublished,imagen,pais,Fuente
Covid-19: CIEN realiza análisis sobre medidas adoptadas en Guatemala,https://www.publinews.gt/gt/noticias/2020/05/05/cien-medidas-adoptadas-covid-19.html,"El Centro de Investigaciones Económicas Nacionales (CIEN) presentó la segunda conferencia virtual, de una serie de tres, en las que realizan un análisis de las medidas adoptadas ante la pandemia del n",06-05-2020 18:35,https://www.bing.com/th?id=ON.09E402997B70597FD2457D28537A462E,Guatemala,Publinews
Sobre la inflación en época de covid-19: una instancia de fantología económica,https://plazapublica.com.gt/content/sobre-la-inflacion-en-epoca-de-covid-19-una-instancia-de-fantologia-economica,[1] Una prueba econométrica empleada para constatar la estacionariedad o no de una serie de tiempo es la desarrollada por Dickey y Fuller (1979). Para la serie de tiempo del multiplicador M1 mensual e,06-05-2020 21:47,https://www.bing.com/th?id=ON.C35E9F73481B82A220A98D862EF542CB,Guatemala,Plaza Publica
Desescalada de restricciones con motivo de la pandemia,https://elperiodico.com.gt/opinion/2020/05/07/desescalada-de-restricciones-con-motivo-de-la-pandemia/,"El martes pasado, la Organización Panamericana de la Salud (OPS), a través de su directora, doctora Carissa F. Etienne, pidió a los países del continente americano cautela a la hora de eliminar o suav",07-05-2020 06:16,https://www.bing.com/th?id=ON.70F07150C746231AED57ADCE960069B9,Guatemala,El Periódico Guatemala
Guatemala en riesgo de crisis alimentaria por COVID-19,https://elperiodico.com.gt/inversion/2020/05/07/guatemala-en-riesgo-de-crisis-alimentaria-por-covid-19/,"Guatemala se encuentra, junto con Haití y Venezuela, entre los países con un alto grado de impacto en el riesgo de reducción de la capacidad adquisitiva para acceder a alimentos. Según el informe Segu",07-05-2020 06:16,https://www.bing.com/th?id=ON.488F1140A058E5B4EAD87B2F372EFCAA,Guatemala,El Periódico Guatemala
"Agexport hace un repaso de la crisis COVID-19, exportaciones y nuevas alternativas",https://lahora.gt/agexport-hace-un-repaso-de-la-crisis-covid-19-exportaciones-y-nuevas-alternativas/,"Derivado de la pandemia del nuevo coronavirus COVID-19, que afecta actualmente no solo a Guatemala, sino a varios países del mundo, la Asociación Guatemalteca de Exportadores (Agexport), realizó una p",07-05-2020 15:32,https://www.bing.com/th?id=ON.2FE751DEE30941125733061BBE64F2E3,Guatemala,La Hora
"Menores deportados de México positivos a COVID-19, según AP",https://lahora.gt/menores-deportados-de-mexico-positivos-a-covid-19-segun-ap/,"Cuatro menores que fueron deportados desde México a Guatemala luego de intentar llegar a Estados Unidos dieron positivo al nuevo coronavirus, informó la Secretaría de Bienestar Social de Guatemala. An",07-05-2020 15:58,https://www.bing.com/th?id=ON.B1B206D5EFDEAF9825B8521EDB0FA499,Guatemala,La Hora
INGUAT prepara guías de prácticas sanitarias para reactivar sector turístico,https://newsinamerica.com/pdcc/turismo/2020/inguat-prepara-guias-de-practicas-sanitarias-para-reactivar-sector-turistico,"Los documentos serán compartidos con el sector, municipalidades y población en general como parte de las actividades económicas de la industria. Guatemala. Con el objetivo de brindar apoyo para la rea",07-05-2020 23:10,https://www.bing.com/th?id=ON.50166B99BF6BEEDE4421814D8590BACB,Guatemala,Periódico Digital Centroamericano y del Caribe
"Un caso positivo de coronavirus en Ixcanal, El Progreso; en 20 días causó brotes en Teculután y Gualán, en Zacapa",https://www.prensalibre.com/guatemala/comunitario/un-caso-positivo-de-coronavirus-en-ixcanal-el-progreso-en-20-dias-causo-brotes-en-teculutan-y-gualan-en-zacapa/,"El 18 de abril último se implementó un cordón sanitario en Ixcanal, San Agustín Acasaguastlán, El Progreso, debido a que se confirmó un caso local, una señora de 80 años que falleció por coronavirus.",08-05-2020 00:01,https://www.bing.com/th?id=ON.ADC20F62ECF4FFE5C6082064EFD57AD1,Guatemala,Prensa Libre
Cuatro menores guatemaltecos dan positivo de coronavirus tras ser deportados de México,https://www.prensalibre.com/guatemala/migrantes/cuatro-menores-guatemaltecos-dan-positivo-de-coronavirus-tras-ser-deportados-de-mexico/,"“Los adolescentes traían desde México un informe donde hacía referencia que se encontraban asintomáticos para el COVID-19”, afirmó Torres. Sin embargo, el Ministerio de Salud guatemalteco les hizo pru",08-05-2020 00:01,https://www.bing.com/th?id=ON.06E5C92EB4E558C2E5F4717A4EA665E9,Guatemala,Prensa Libre
VIDEO. Ministro de Salud confirma 34 nuevos casos de coronavirus; ascienden a 832,https://www.publinews.gt/gt/noticias/2020/05/07/casos-coronavirus-guatemala-hoy-7-mayo-2020.html,"El Gobierno de la República dio a conocer que el jueves, 7 de mayo, se confirman nuevos casos positivos de la pandemia Covid-19 (nuevo) coronavirus en el país. Hasta la noche del miércoles, 6 de mayo,",08-05-2020 01:06,https://www.bing.com/th?id=ON.19A825D36546EC55E3FF262C8EE9A6F0,Guatemala,Publinews
MNG y Springfield lanzan plataforma para compras en línea,https://newsinamerica.com/pdcc/gerenciales/2020/mng-y-springfield-lanzan-plataforma-para-compras-en-linea,"Guatemala. En momentos donde muchos comercios se ven afectados por el COVID-19, es indispensable crear nuevas alternativas que permitan satisfacer las necesidades de los clientes, sin que esto impliqu",08-05-2020 01:35,https://www.bing.com/th?id=ON.7BC246B885C1EE77957016A3BCA9591B,Guatemala,Periódico Digital Centroamericano y del Caribe
