name,url,description,datePublished,imagen,pais,Fuente
Coronavirus en Guatemala: Congreso publica ampliación del estado de Calamidad,https://www.guatevision.com/nacionales/coronavirus-en-guatemala-congreso-publica-ampliacion-del-estado-de-calamidad,El estado de Calamidad continúa vigente en Guatemala luego de cinco meses desde que se detectó el primer caso de coronavirus. El Congreso de la República publicó este sábado 15 de agosto en el Diario,15-08-2020 20:03,https://www.bing.com/th?id=ON.02FB2973CB6D5E35B20CF97510C36434,Guatemala,Guatevision
Guatemala abandonó el confinamiento y busca la recuperación,https://republica.gt/2020/08/16/guatemala-abandono-el-confinamiento-y-busca-la-recuperacion/,"Luego de activar el semáforo de alerta de covid-19, el lunes 27 de julio, Guatemala reactivó su actividad económica. Restaurantes, centros comerciales, iglesias y el transporte público abrieron sus pu",16-08-2020 00:00,https://www.bing.com/th?id=ON.0EE452E9A04C2D010031E257C6D7DC77,Guatemala,Republica
Guatemala supera los 62 mil 560 casos positivos de COVID-19,https://crnnoticias.com/guatemala-supera-los-62-mil-560-casos-positivos-de-covid-19/,"Guatemala alcanzó este domingo las 2 mil 379 muertes y los 62 mil 562 casos positivos confirmados acumulados de COVID-19, desde que el pasado 13 de marzo el Gobierno hiciera oficial el primer contagio",16-08-2020 08:00,https://www.bing.com/th?id=ON.BF53B31BF0FAC8F1F19BDAA29683B617,Guatemala,CRN Noticias
Centroamérica asolada tras cinco meses de cuarentenas y pandemia que no cede,https://newsinamerica.com/pdcc/boletin/2020/centroamerica-asolada-tras-cinco-meses-de-cuarentenas-y-pandemia-que-no-cede,"Centroamérica. Tras cinco meses de confinamiento e intentos de desescalada, Centroamérica sufre un recrudecimiento de la pandemia, con Panamá como el peor escenario, en medio de un creciente deterioro",16-08-2020 08:00,https://www.bing.com/th?id=ON.3DA8D1969C2442420B56A70F2B6F1747,Guatemala,Periódico Digital Centroamericano y del Caribe
Guatemala: Protestan en contra del Gobierno y en defensa de las cortes,https://crnnoticias.com/guatemala-protestan-en-contra-del-gobierno-y-en-defensa-de-las-cortes/,Cientos de guatemaltecos se manifestaron este sábado en contra del Gobierno que encabeza Alejandro Giammattei. En plena escalada de casos positivos de COVID-19 y bajo el llamado a defender al sistema,16-08-2020 00:00,https://www.bing.com/th?id=ON.B8423F4300430D1BDC0555319C1C50D0,Guatemala,CRN Noticias
COVID-19: Guatemala busca acceder a vacuna de Rusia,https://newsinamerica.com/pdcc/generales/2020/covid-19-guatemala-busca-acceder-a-vacuna-de-rusia,Guatemala. El Ministerio de Relaciones Exteriores (Minex) informó que Guatemala ha realizado gestiones para acceder a la vacuna contra el coronavirus (COVID-19) creada en Rusia así como a las que desa,16-08-2020 08:00,https://www.bing.com/th?id=ON.0A19E4DC63517E30350DA31E022D338D,Guatemala,Periódico Digital Centroamericano y del Caribe
Cien guatemaltecos retornan al país por vía terrestre desde México,https://www.publinews.gt/gt/noticias/2020/08/16/cien-guatemaltecos-retornan-al-pais-por-via-terrestre-desde-mexico.html,"Un grupo de 104 guatemaltecos que permanecían varados en Estados Unidos, retornaron al país el viernes 14 de agosto. El Ministerio de Relaciones Exteriores (Minex) lo informó de esa forma por medio de",16-08-2020 11:56,https://www.bing.com/th?id=ON.E67A2358CFBB6B4663EB1819BFF21E5A,Guatemala,Publinews
Juan Carlos Sagastume concluyó recorrido en honor a la carrera Hombres de Maíz 2020 en Petén,https://www.guatemala.com/deportes/actualidad/juan-carlos-sagastume-concluye-recorrido-honor-carrera-hombres-de-maiz-2020-peten.html,"Juan Carlos Sagastume hizo un recorrido en Petén, en honor a la carrera Hombres de Maíz, la cual este 2020 no se llevó a cabo en Tactic, Alta Verapaz. Sin duda la persistencia y el esfuerzo es algo qu",16-08-2020 13:51,https://www.bing.com/th?id=ON.ADC2FB732EDB49CA137029303E7C1217,Guatemala,Guatemala
Las Mipymes y su rol en la economía,https://elsiglo.com.gt/2020/08/16/las-mipymes-y-su-rol-en-la-economia/,"En Guatemala, el sector de las Mipymes se ha convertido en la columna vertebral de la economía del país, debido al impacto que tienen estas como fuente de desarrollo y generación de empleo a nivel nac",16-08-2020 21:18,https://www.bing.com/th?id=ON.B984DD8E0028296422948A6BC92167DB,Guatemala,Siglo Veintiuno
Guatemala registra 9 mil 491 casos activos de covid-19,https://republica.gt/2020/08/16/guatemala-registra-9-mil-491-casos-activos-de-covid-19/,El 12 de agosto el Ministerio de Salud lanzó la estrategia de rastreadores que se encargará de identificar los casos de covid-19. La estrategia cuenta con el apoyo de la Comisión Presidencial para la,16-08-2020 23:47,https://www.bing.com/th?id=ON.E817FE4E4A4C03D652C61D3DAB01D652,Guatemala,Republica
Presidente Alejandro Giammattei anuncia remodelación de más de 5 mil escuelas,https://elmetropolitano.com.gt/es/2020/08/17/presidente-alejandro-giammattei-anuncia-remodelacion-de-mas-de-5-mil-escuelas/,"El presidente de Guatemala, Alejandro Giammattei, anunció hoy el remozamiento de más de 5 mil escuelas en el territorio nacional. “Vamos a comenzar este año con 5 mil 400 remodelaciones de escuelas, (",17-08-2020 00:00,https://www.bing.com/th?id=ON.031D985A78DC077815A53794B352E946,Guatemala,El Metropolitano
Salud contabiliza 347 nuevos casos de COVID-19,https://elmetropolitano.com.gt/es/2020/08/17/salud-contabiliza-347-nuevos-casos-de-covid-19/,"El Ministerio de Salud Pública y Asistencia Social (MSPAS) confirmó hoy que se registraron 347 nuevos casos de coronavirus (COVID-19) en Guatemala, por lo que la cifra asciende a 62 mil 944. El MSPAS",17-08-2020 00:00,https://www.bing.com/th?id=ON.3D2690E34B2828F32900826A98D46A3B,Guatemala,El Metropolitano
Pilotos bloquean ruta al Atlántico,https://elperiodico.com.gt/nacion/2020/08/17/pilotos-bloquean-ruta-al-atlantico1/,"Un grupo de pilotos de taxis y de buses locales bloquearon este lunes el paso en el kilómetro 283 ruta al Atlántico en jurisdicción de Ríos, Puerto Barrios, Izabal. Los conductores aseguran que buscan",17-08-2020 14:14,https://www.bing.com/th?id=ON.EF8437ACC031C31BB3BE7CC240ECBB9C,Guatemala,El Periódico Guatemala
La Kombi Solidaria SBX entregó platos de comida en el área urbana de Xela,https://www.guatemala.com/noticias/sociedad/kombi-solidaria-entrego-platos-comida-area-urbana-xela.html,Proyecto de la Kombi Solidaria SBX busca apoyar a guatemaltecos en Xela y entregó platos de comida en el área urbana a personas de escasos recursos. Una gran iniciativa de ayuda y solidaridad por part,17-08-2020 18:18,https://www.bing.com/th?id=ON.8C9C29C8B85321DB95F00F32439D78FD,Guatemala,Guatemala
42 por ciento de las pruebas de coronavirus procesadas el domingo dieron positivo,https://www.guatevision.com/nacionales/42-por-ciento-de-las-pruebas-de-coronavirus-procesadas-el-domingo-dieron-positivo-breaking,"Los datos del tablero de contagios de coronavirus en Guatemala se actualizaron este lunes 17 de agosto a las 8.20 horas, con las cifras del 16 de agosto hasta las 23.59 horas. Según las cifras, los ca",17-08-2020 18:25,https://www.bing.com/th?id=ON.FC5E99FEE001DAD98062137902F85A96,Guatemala,Guatevision
Inguat lanza campaña de sensibilización para promover el turismo,https://elperiodico.com.gt/nacion/2020/08/17/inguat-lanza-campana-de-sensibilizacion-para-promover-el-turismo/,"El Instituto Guatemalteco de Turismo (Inguat) anunció por medio de una conferencia el lanzamiento de la Campaña de Sensibilización 2020, la cual busca promover el turismo responsable y amigable entre",17-08-2020 18:45,https://www.bing.com/th?id=ON.6E35933C91CD261C66CB7767068CBC88,Guatemala,El Periódico Guatemala
Inguat proyecta reactivar el turismo interno,https://stereo100.com.gt/2020/inguat-proyecta-reactivar-el-turismo-interno/,"Con el fin de reactivar la economía desde el sector turístico, las autoridades del Instituto Guatemalteco de Turismo (Inguat) lanzan una campaña de sensibilización con la que pretenden implementar pro",17-08-2020 21:34,https://www.bing.com/th?id=ON.E8A3E711A8A5CBD8020CC228A670A8E2,Guatemala,Stereo 100
Piden apoyo para llenar La Olla Comunitaria,https://stereo100.com.gt/2020/piden-apoyo-para-llenar-la-olla-comunitaria/,"El equipo de La Olla Comunitaria ha trabajado durante estos meses de pandemia del COVID-19 para entregar un plato de comida a las personas afectadas por la crisis sanitaria, pero requieren del apoyo d",17-08-2020 21:50,https://www.bing.com/th?id=ON.DB22EFFDC9E7CC5CC84099115C0EBF7E,Guatemala,Stereo 100
COVID-19: Municipalidad de Villa Nueva habilita Centro de Bienestar Respiratorio,https://lahora.gt/covid-19-municipalidad-de-villa-nueva-habilita-centro-de-bienestar-respiratorio/,La Municipalidad de Villa Nueva con el apoyo de la Municipalidad de Guatemala y el Programa de las Naciones Unidas para el Desarrollo (PNUD) habilitó un Centro de Bienestar Respiratorio en ese muncipi,17-08-2020 22:07,https://www.bing.com/th?id=ON.A41B83EDA9800DF6E7E12424E9F151DA,Guatemala,La Hora
Tablero de Salud reporta 62 mil 944 positivos acumulados y 10 fallecidos más,https://www.publinews.gt/gt/noticias/2020/08/17/casos-covid-19-17-agosto.html,"La semana pasada el viceministro de hospitales, Francisco Coma, indicó que no tienen una explicación específica de por qué hay menos casos tamizados durante los fines de semana. “No tenemos una explic",17-08-2020 23:26,https://www.bing.com/th?id=ON.6F76296D920EB157C0703D1C595AF77C,Guatemala,Publinews
Guatemala registra otros 347 casos de coronavirus y el total de contagios es de 62 mil 944,https://www.prensalibre.com/guatemala/comunitario/guatemala-registra-otros-347-casos-de-coronavirus-y-el-total-de-contagios-es-de-62-mil-944-breaking/,Los datos actualizados del Ministerio de Salud indican que Guatemala alcanzó los 62 mil 944 casos de coronavirus acumulados registrados. En las últimas horas se registraron 347 nuevos contagios. Perdi,18-08-2020 01:18,https://www.bing.com/th?id=ON.D819D634092D91248A07FB89A2E6147B,Guatemala,Prensa Libre
Guatemala registra mayor número de fallecidos por covid-19 en Centroamérica,https://www.prensalibre.com/guatemala/comunitario/guatemala-registra-mayor-numero-de-fallecidos-por-covid-19-en-centroamerica/,"Ante ello, algunos cementerios nacionales excavan fosas para tener más capacidad. En la capital de Guatemala existe un cementerio que fue designado para recibir a los fallecidos por covid-19 que no te",18-08-2020 01:18,https://www.bing.com/th?id=ON.0899F52C682D8CB8BCD9F269EBA47C27,Guatemala,Prensa Libre
COVID-19: Alianza oficialista buscará agilizar aprobación de leyes económicas,https://lahora.gt/covid-19-alianza-oficialista-buscara-agilizar-aprobacion-de-leyes-economicas/,"La Comisión Específica de Protección y Reactivación Económica del Congreso, presidida por el segundo vicepresidente, Luis Rosales, y el Gabinete Económico del Ejecutivo trabajan en un paquete de leyes",18-08-2020 02:06,https://www.bing.com/th?id=ON.BF87B4B19A92876AFE3B684209D8BDA5,Guatemala,La Hora
