name,url,description,datePublished,imagen,pais,Fuente
"DPI tendrá vigencia el resto del 2020, según Renap",https://www.guatemala.com/noticias/sociedad/dpi-tendra-vigencia-resto-2020-renap.html,"El DPI tendrá vigencia el resto del 2020, según Renap, conoce el Decreto Número 22-2020 que beneficiará a los guatemaltecos durante el COVID-19. ¡Buenas noticias! Se ha anunciado que el Documento Pers",11-06-2020 01:17,https://www.bing.com/th?id=ON.34BEADFEF357BF1B89622B663F5878A1,Guatemala,Guatemala
Guía de Inguat para empresas de transporte turístico en Guatemala ante el COVID-19,https://www.guatemala.com/noticias/entretenimiento/guia-inguat-empresas-transporte-turistico-guatemala-ante-covid-19.html,Te contamos cómo puedes descargar la guía de Inguat para empresas de transporte turístico en Guatemala ante el Coronavirus —COVID-19—. ¡Toma nota! La guía para empresas de transporte turístico en Guat,11-06-2020 01:17,https://www.bing.com/th?id=ON.4953CB0F3A117FD79117ECE993103A5D,Guatemala,Guatemala
Agilizan procesos para el pago de médicos en el Parque de la Industria,https://republica.gt/2020/06/10/agilizan-procesos-para-el-pago-de-medicos-en-el-parque-de-la-industria/,"Las unidades móviles de la Contraloría General de Cuentas, Banrural y la Superintendencia de Administración Tributaria (SAT) acudieron al Hospital del Parque de la Industria para agilizar el proceso d",11-06-2020 02:19,https://www.bing.com/th?id=ON.C9AC6A7EB97E3E7FC6C6FED6E906C3C7,Guatemala,Republica
"27 muertos por COVID-19 en Guatemala, la cifra más alta en un solo día",https://crnnoticias.com/27-muertos-por-covid-19-en-guatemala-la-cifra-mas-alta-en-un-solo-dia/,"Guatemala reportó este miércoles el deceso de 27 personas debido a la COVID-19, la mayor cantidad en 24 horas, por lo que suma 316 fallecidos en total a causa de la enfermedad. Nuestro país contabiliz",11-06-2020 02:42,https://www.bing.com/th?id=ON.2ADD5F4775127DC800F973BB4019A728,Guatemala,CRN Noticias
"Inclusión, Prevención y Comunicación Asertiva",https://newsinamerica.com/pdcc/gerenciales/2020/inclusion-prevencion-y-comunicacion-asertiva,"Guatemala. El uso obligatorio de la mascarilla protege y previene el contagio de Covid-19, sin embargo para las personas sordas o con hipoacusia, representa una barrera para la comunicación, ya que no",11-06-2020 04:02,https://www.bing.com/th?id=ON.0BF11FEDF70587CD1B62E0A9B02EF169,Guatemala,Periódico Digital Centroamericano y del Caribe
Pruebas de vacunas experimentales podrían realizarse pronto en EE. UU.,https://elperiodico.com.gt/mundo/2020/06/11/pruebas-de-vacunas-experimentales-podrian-realizarse-pronto-en-ee-uu/,"El gobierno federal de EE. UU. planea financiar y realizar los estudios decisivos de tres vacunas experimentales contra el COVID-19 a partir de este verano, según reveló un investigador de vacunas del",11-06-2020 06:47,https://www.bing.com/th?id=ON.2CA3841E4E536739A65D0988D768BBCB,Guatemala,El Periódico Guatemala
Ampliación de capacidad hospitalaria,https://elperiodico.com.gt/opinion/2020/06/11/ampliacion-de-capacidad-hospitalaria/,"Estamos llegando al esperado pico de la epidemia; diariamente se reportan entre 300 a 400 casos nuevos. Las medidas de prevención de la enfermedad incluyeron el confinamiento, el Toque de Queda, la su",11-06-2020 06:49,https://www.bing.com/th?id=ON.FEEB97B46649336D0907F1331CFDD1D1,Guatemala,El Periódico Guatemala
VIDEO. Confirman 355 casos positivos de coronavirus y 27 fallecidos,https://www.publinews.gt/gt/noticias/2020/06/10/casos-coronavirus-guatemala-10-junio-2020.html,"El ministro de Salud, Hugo Monroy, dio a conocer que hasta hoy ya se contabilizan 8 mil 221 casos de Covid-19 en el país. El Ministerio de Salud Pública y Asistencia Social (MSPAS) brindó la actualiza",11-06-2020 13:37,https://www.bing.com/th?id=ON.7D0FB51057EB3A38B3467237C11B69CD,Guatemala,Publinews
Perspectivas económicas de Guatemala para el segundo semestre del 2020,https://newsinamerica.com/pdcc/economia/2020/perspectivas-economicas-de-guatemala-para-el-segundo-semestre-del-2020,"Guatemala. La Cámara de Comercio Guatemalteco Americana (AmCham) presentó el panorama económico del país para el segundo semestre del 2020, en una conferencia que contó con la participación de Sergio",11-06-2020 14:20,https://www.bing.com/th?id=ON.207681AEEA675D45EBA62A01FC7923E0,Guatemala,Periódico Digital Centroamericano y del Caribe
Verificamos por usted: ¿Ya circulan los buses rojos pese a la prohibición?,https://www.guatevision.com/nacionales/coronavirus-en-guatemala-verificamos-por-usted-ya-estan-circulando-los-buses-rojos-en-la-capital-pese-a-la-prohibicion,En las últimas horas circularon en redes sociales imágenes de un bus rojo operando supuestamente con pasajeros en la ciudad de Guatemala. Verificamos la información y a continuación le compartimos lo,11-06-2020 14:27,https://www.bing.com/th?id=ON.01D1BB082BBB499A56CCE41890446B59,Guatemala,Guatevision
Ministro de Salud reporta 355 nuevos contagios y 27 decesos por coronavirus en Guatemala,https://www.guatevision.com/nacionales/ministro-de-salud-reportan-355-nuevos-contagios-y-27-decesos-por-coronavirus-en-guatemala-breaking,"Hugo Monroy, ministro de Salud, informó este miércoles que 355 nuevos casos de covid-19 fueron detectados y lamentó el fallecimiento de 27 pacientes en el país, la cifra más alta hasta ahora. En confe",11-06-2020 14:27,https://www.bing.com/th?id=ON.3D0EBDECC123B34DC79DB754C6BE5616,Guatemala,Guatevision
Coronavirus en Guatemala: reportan 355 nuevos casos y 27 personas fallecieron,https://www.prensalibre.com/guatemala/comunitario/coronavirus-en-guatemala-reportan-355-nuevos-casos-y-27-personas-fallecieron/,"Hugo Monroy, ministro de Salud, informó que este 10 de junio se registraron 355 nuevos casos y 27 personas fallecieron. En total hay 8 mil 221 casos, de los cuales están activos 6 mil 399 y recuperado",11-06-2020 14:45,https://www.bing.com/th?id=ON.F2919E27D25EC469E15AFC3C4D8D8774,Guatemala,Prensa Libre
Asturias pide apoyar a trabajadores de salud con ruido de cacerolas y pitos,https://republica.gt/2020/06/11/edwin-asturias-pide-apoyo-medicos-con-cacerolas-pitos/,"El jefe de la Comisión Presidencial contra el Covid-19 pidió a los guatemaltecos su apoyo al personal de salud que combate el coronavirus durante este emergencia sanitaria. Edwin Asturias, quien presi",11-06-2020 15:06,https://www.bing.com/th?id=ON.943A9CED356554B36BB31CA0461B5EFB,Guatemala,Republica
"E. Asturias: los miles de trabajadores informales y Guatemala, se unen para aplanar curva",https://lahora.gt/e-asturias-los-miles-de-trabajadores-informales-y-guatemala-se-unen-para-aplanar-curva/,"El Comisionado de la Comisión Presidencial de Atención al Covid-19 (Coprecovid), Edwin Asturias, indicó a través de Twitter que “por allí se escuchan voces que claman que solo la “economía formal” est",11-06-2020 15:10,https://www.bing.com/th?id=ON.95DEBCEC09A16EAC154D49BD7BE1AB73,Guatemala,La Hora
Las realidades de la “otra” Guatemala,https://lahora.gt/las-realidades-de-la-otra-guatemala/,"Cada vez que veo una Cadena Nacional referente a la pandemia COVID-19, veo que la información y las instrucciones de confinamiento están muy claramente diseñadas y dirigidas a una Guatemala urbana, de",11-06-2020 16:21,https://www.bing.com/th?id=ON.EF3AC42CC7E9CD42D1E3BFD7FF1D664F,Guatemala,La Hora
Tres de cada 10 guatemaltecos siguen escépticos al peligro del coronavirus,https://www.prensalibre.com/guatemala/comunitario/tres-de-cada-10-guatemaltecos-siguen-escepticos-al-peligro-del-coronavirus/,"Hace 90 días, los guatemaltecos recibieron la noticia del primer contagio de covid-19 en el país, a partir de esa fecha, la actitud de las personas pasó de una tibia percepción sobre el riesgo de la e",11-06-2020 16:47,https://www.bing.com/th?id=ON.146A30F0158C604587DBBB4AC3AC6D23,Guatemala,Prensa Libre
FMI aprueba préstamo de 594 millones de dólares para Guatemala por el coronavirus,https://www.publinews.gt/gt/noticias/2020/06/11/fmi-aprueba-prestamo-guatemala-coronavirus.html,"El directorio del Fondo Monetario Internacional (FMI) aprobó un préstamo de emergencia para Guatemala de 594 millones de dólares para que el país haga frente a ""necesidades urgentes de balanza de pago",11-06-2020 17:48,https://www.bing.com/th?id=ON.1A43E656587EAAFF518E0DB822999016,Guatemala,Publinews
