name,url,description,datePublished,imagen,pais,Fuente
Acuerdo Ministerial de apoyo a repatriación de cadáveres desde el extranjero,https://lahora.gt/acuerdo-ministerial-de-apoyo-a-repatriacion-de-cadaveres-desde-el-extranjero/,"El Acuerdo Ministerial No. 115 del Ministerio de Relaciones Exteriores aprueba el “Fondo de Asistencia a las Familias de Guatemaltecos Fallecidos en el Exterior por la pandemia Coronavirus COVID-19”,",06-06-2020 23:27,https://www.bing.com/th?id=ON.9F2F5423D474B50A46A2AFFB924789AB,Guatemala,La Hora
Se registra este domingo 263 casos de coronavirus y 128 recuperados,https://elmetropolitano.com.gt/es/2020/06/07/se-registra-este-domingo-263-casos-de-coronavirus-y-128-recuperados/,"El Gobierno de Guatemala informó hoy que se registraron 263 casos nuevos de coronavirus (COVID-19), por lo que la cifra de contagios asciende a 7 mil 55. El ministro de Salud Pública y Asistencia Soci",07-06-2020 00:00,https://www.bing.com/th?id=ON.6515DBAC55A4D373C5D2F5C867B5A122,Guatemala,El Metropolitano
Guatemala supera los 250 fallecidos por COVID-19. Fueron registrados 22 decesos este domingo,https://stereo100.com.gt/guatemala-supera-los-250-fallecidos-por-covid-19-fueron-registrados-22-decesos-este-domingo/,"Por Enrique Calvillo y Herberth Tax. El ministro de Salud de Guatemala, Dr. Hugo Monroy, confirma 263 nuevos casos de Coronavirus COVID-19 este domingo 07 de junio de 2020. Hoy se reportaron 22 person",07-06-2020 00:00,https://www.bing.com/th?id=ON.089C00F35A0D1B9E810042C9917990E5,Guatemala,Stereo 100
En Petén: Inicia a funcionar tercer hospital temporal para atender casos de coronavirus,https://elmetropolitano.com.gt/es/2020/06/07/en-peten-inicia-a-funcionar-tercer-hospital-temporal-para-atender-casos-de-coronavirus/,El Ministerio de Salud Pública y Asistencia Social informó que este sábado inició funciones el tercer hospital temporal para atender casos de coronavirus (COVID-19) en Guatemala. El hospital está ubic,07-06-2020 00:00,https://www.bing.com/th?id=ON.7ED4641223E74024C6A0BFBEA9439A4A,Guatemala,El Metropolitano
Guatemala Bajo la Lupa,https://elperiodico.com.gt/nacion/2020/06/07/guatemala-bajo-la-lupa-24-1/,El Club Rotario Guatemala de la Ermita denunció por medio de un comunicado que ayer uno de sus vehículos que contenía cajas de alimentos que serían entregadas a familias vulnerables debido a la emerge,07-06-2020 00:00,https://www.bing.com/th?id=ON.078D263D9EC06CFEEB8A6F0320BDD164,Guatemala,El Periódico Guatemala
Guatemala mantiene el Toque de Queda por el COVID-19. De 18:00 a 05:00 horas,https://stereo100.com.gt/guatemala-mantiene-el-toque-de-queda-por-el-covid-19-de-1800-a-0500-horas/,"Por Enrique Calvillo y Herberth Tax. En Cadena Nacional de Radio y Televisión, el presidente de la República de Guatemala, Alejandro Giammattei, informa que 18 personas que trabajan en Casa Presidenci",07-06-2020 00:00,https://www.bing.com/th?id=ON.46434F3EA3F736B2F89EE1236BD4A509,Guatemala,Stereo 100
Festival de Música Guate x Guate y Yo Me Uno en apoyo a personal de salud,https://newsinamerica.com/pdcc/gente/espectaculos/2020/festival-de-musica-guate-x-guate-y-yo-me-uno-en-apoyo-a-personal-de-salud,Los guatemaltecos nos caracterizamos por ser solidarios en casos de necesidad. Este es el momento de continuar dándonos la mano en la crisis que ha generado la Covid-19. BAC Credomatic da a conocer el,07-06-2020 00:58,https://www.bing.com/th?id=ON.DF75F82F3DEACA46C1032607E0E6CBD5,Guatemala,Periódico Digital Centroamericano y del Caribe
Ministra Claudia Ruíz destaca la atención a estudiantes durante la pandemia,https://radiotgw.gob.gt/ministra-claudia-ruiz-destaca-la-atencion-a-estudiantes-durante-la-pandemia/,"TGW Digital – La ministra de Educación, Claudia Ruíz de Estrada, destacó la integración de diferentes sectores, incluido el gremio magisterial, en la activación y seguimiento de los programas para la",07-06-2020 01:29,https://www.bing.com/th?id=ON.EE8EE7F0CF81D64CE2C7FDD795DE813C,Guatemala,TGW
Transmetro realizará ensayo para establecer protocolos y reestablecer operaciones,https://radiotgw.gob.gt/transmetro-realizara-ensayo-para-establecer-protocolos-y-reestablecer-operaciones/,"TGW Digital – Este fin de semana, la Municipalidad de Guatemala realizará un ensayo en cuatro líneas de Transmetro: 6, 7, 12 y 13, después de que el Gobierno de Guatemala autorizara las pruebas para e",07-06-2020 01:29,https://www.bing.com/th?id=ON.15EC529CCF6E08DBBC21984E347EDCF2,Guatemala,TGW
Reformas Constitucionales a la Administración de Justicia,https://elsiglo.com.gt/2020/06/07/reformas-constitucionales-a-la-administracion-de-justicia/,"La semana recién pasada el presidente Giammattei anunció su intención de plantear una serie de reformas constitucionales para la administración de la justicia, especialmente en lo que se refiere a la",07-06-2020 12:57,https://www.bing.com/th?id=ON.93615D6DE90F5FE3244C67216F944D47,Guatemala,Siglo Veintiuno
Los tres departamentos más afectados por el COVID-19 en Guatemala,https://www.publinews.gt/gt/noticias/2020/06/06/los-tres-departamentos-mas-afectados-covid-19-guatemala.html,Los casos de Covid-19 en Guatemala se han registrado mayoritariamente en el Departamento de Guatemala. El Gobierno indica que posee el 67.73% de los casos. El porcentaje se refleja en 4 mil 600 casos,07-06-2020 18:22,https://www.bing.com/th?id=ON.1A45D16CC25D0CFD4CC203215E9C4FA2,Guatemala,Publinews
Honduras participará en diálogo de jefes parlamentarios sobre temas de la post-pandemia,https://newsinamerica.com/pdcc/otrasnoticias/2020/honduras-participara-en-dialogo-de-jefes-parlamentarios-sobre-temas-de-la-post-pandemia,"Honduras. Una quincena de presidentes de Asambleas Nacionales de América Latina participarán mañana, lunes, en el primer diálogo virtual de jefes de poderes legislativos del continente para coordinar",07-06-2020 20:52,https://www.bing.com/th?id=ON.C4EDB0B5ECE5B2DD4DF3C5C46CA04546,Guatemala,Periódico Digital Centroamericano y del Caribe
Cifras de pacientes con coronavirus en Guatemala llegan a 7 mil 55 casos,https://www.guatevision.com/nacionales/aumenta-cifra-de-pacientes-con-coronavirus-en-guatemala-breaking,"Del total de nuevos casos postivos con covid-19 176 son hombres, mientras que 87 son mujeres, además el ministro anunció que 22 personas fallecieron a causa del virus y 128 se recuperaron. En las últi",08-06-2020 01:14,https://www.bing.com/th?id=ON.60037FDBF312C71D1546846A74D77125,Guatemala,Guatevision
Guatemala registra 263 casos de coronavirus y 128 recuperados,https://crnnoticias.com/guatemala-registra-263-casos-de-coronavirus-y-128-recuperados/,"El Gobierno de Guatemala informó hoy que se registraron 263 casos nuevos de coronavirus -COVID-19-, por lo que la cifra de contagios asciende a 7 mil 055. El ministro de Salud Pública y Asistencia Soc",08-06-2020 01:39,https://www.bing.com/th?id=ON.538E51FCE567020FF6AFCA50092F4218,Guatemala,CRN Noticias
Sólo hay cuatro camas disponibles para atender pacientes con coronavirus en el Hospital de Villa Nueva,https://www.guatevision.com/nacionales/solo-hay-cuatro-camas-disponibles-para-atender-pacientes-con-coronavirus-en-el-hospital-de-villa-nueva,"La Defensoría de la Salud de la PDH realizó una visita en el Hospital Nacional de Especialidades de Villa Nueva para verificar el abastecimiento de equipos de protección personal, medicamentos e insum",08-06-2020 02:45,https://www.bing.com/th?id=ON.67429B62FAAF7AF74ED99A43740AE3CD,Guatemala,Guatevision
Guatemala continúa su lucha contra el covid-19,https://www.prensalibre.com/opinion/columnasdiarias/guatemala-continua-su-lucha-contra-el-covid-19/,"Estamos llegando a la duodécima semana, desde que comenzaron las medidas de distanciamiento social como resultado del covid-19 en el país. Más de 400 mil personas han fallecido en el mundo a causa de",08-06-2020 06:13,https://www.bing.com/th?id=ON.3C6EA7C54754F9C98FD7093769E05D0F,Guatemala,Prensa Libre
No es el fin del mundo,https://elperiodico.com.gt/opinion/2020/06/08/no-es-el-fin-del-mundo/,"Las cifras de la pandemia siguen empeorando alrededor del mundo. Mientras que en Europa lo peor de la crisis ya parece haber quedado atrás, en los países en desarrollo –incluyendo Guatemala– el COVID-",08-06-2020 06:16,https://www.bing.com/th?id=ON.C5C1136850369B1433D711E1B0A4B938,Guatemala,El Periódico Guatemala
COVID-19: Defensora de la Salud dice que el Hospital Roosevelt llegó al límite,https://crnnoticias.com/defensora-de-la-salud-de-pdh-dice-que-el-hospital-roosevelt-llego-al-limite-por-covid-19/,"La defensora de la Salud de la Procuraduría de los Derechos Humanos -PDH- de Guatemala, Zulma Calderón, advirtió que el hospital Roosevelt, el más grande de Guatemala llegó a su límite por el COVID-19",08-06-2020 06:55,https://www.bing.com/th?id=ON.60C663F7B39BC7F20D62798EDA508200,Guatemala,CRN Noticias
Organismo Judicial informa que dos trabajadores fueron diagnosticados con Covid-19,https://www.publinews.gt/gt/noticias/2020/06/08/organismo-judicial-trabajadores-covid-19.html,El Organismo Judicial (OJ) activó el protocolo correspondiente tras confirmarse que dos trabajadores que prestan servicios en sedes de Mixco y Guatemala dieron positivo en la prueba de Covid-19. Por m,08-06-2020 13:07,https://www.bing.com/th?id=ON.6199E9382857C1BC4893A1A45B349EA5,Guatemala,Publinews
Tigo dona 44 respiradores a red hospitalaria que atiende la pandemia,https://republica.gt/2020/06/07/tigo-dona-44-respiradores-a-red-hospitalaria-que-atiende-la-pandemia/,Tigo continúa apoyando ante la pandemia del COVID-19 realizando la primera entrega de los 44 respiradores. (Foto República: Tigo) Tigo continúa apoyando a los guatemaltecos más vulnerables por el Covi,08-06-2020 13:34,https://www.bing.com/th?id=ON.C5066F816694718E3249898B640D4DFD,Guatemala,Republica
Guatemala supera los 7 mil casos de Covid-19,https://republica.gt/2020/06/07/guatemala-supera-los-7-mil-casos-de-covid-19/,"Guatemala es el departamento con el mayor número de casos nuevos de coronavirus. La cartera registra 263 casos nuevos este domingo 7 de junio, de los cuales 186 son de Guatemala. Las autoridades no qu",08-06-2020 13:34,https://www.bing.com/th?id=ON.2B36D495032259CEED97CF7B031E6185,Guatemala,Republica
Coronavirus en Guatemala: Cifra de contagios supera los 7 mil y se reportan 22 muertos este domingo,https://www.prensalibre.com/guatemala/politica/coronavirus-en-guatemala-cifra-de-contagios-supera-los-7-mil-y-se-reportan-22-muertos-este-domingo-breaking/,"Los números de guatemaltecos diagnosticados con el nuevo coronavirus continúan expandiéndose diariamente, este domingo se confirmó que hay 263 casos nuevos,176  son hombres y 87 mujeres. Hubo 128 paci",08-06-2020 13:36,https://www.bing.com/th?id=ON.5E20AD5671378F0837484B4BE7073A15,Guatemala,Prensa Libre
