name,url,description,datePublished,imagen,pais,Fuente
Universitarios ganaron mención honorífica en la competencia virtual Shell Eco Marathon 2020,https://www.guatemala.com/noticias/sociedad/universitarios-ganaron-mencion-honorifica-competencia-virtual-shell-eco-marathon-2020.html,Estudiantes de la Universidad del Valle de Guatemala —UVG— ganaron una mención honorífica en la competencia virtual Shell Eco Marathon 2020. Este año 2020 la competencia internacional Shell Eco Marath,22-05-2020 22:03,https://www.bing.com/th?id=ON.2D877679550E0EA2C3CB7BBC01129DD8,Guatemala,Guatemala
Coro Nacional de Guatemala destacó en programa de Telemundo por interpretación de Luna de Xelajú,https://www.guatemala.com/noticias/entretenimiento/coro-nacional-guatemala-destaco-programa-telemundo-interpretacion-luna-xelaju.html,"El Coro Nacional de Guatemala destacó en programa de Telemundo por su interpretación de Luna de Xelajú desde casa, ¡te compartimos el video! El Coro Nacional de Guatemala destacó en programa de Telemu",22-05-2020 23:22,https://www.bing.com/th?id=ON.6ABA6942A584C0FD11D0D1E9CB335ED1,Guatemala,Guatemala
Gobierno crea Comisión Nacional contra el Coronavirus,https://radiotgw.gob.gt/gobierno-crea-comision-nacional-contra-el-coronavirus/,TGW Digital – El Gobierno de Guatemala creará la Comisión Nacional contra el Coronavirus para implementar las acciones que combaten actualmente la pandemia del Coronavirus COVID-19 en el país. El Pres,23-05-2020 02:03,https://www.bing.com/th?id=ON.25D8D55DC927CA8AADE8F440E7700683,Guatemala,TGW
Ministerio de Salud reporta tres miembros del personal con Covid-19,https://republica.gt/2020/05/22/ministerio-de-salud-reporta-trabajadores-con-covid/,"El Ministerio de Salud Pública informó sobre tres empleados de la planta central infectados de la Covid-19. Según la información compartida esta noche, los empleados que laboraban en la sede central d",23-05-2020 02:14,https://www.bing.com/th?id=ON.13D6623F648E4D6883018FF43FADCC97,Guatemala,Republica
Revelan avances de vacuna contra el COVID-19,https://elperiodico.com.gt/mundo/2020/05/23/revelan-avances-de-vacuna-contra-el-covid-19/,"La primera vacuna contra el COVID-19 que ha llegado a la fase 1 del ensayo clínico es segura, bien tolerada y capaz de generar una respuesta inmunológica contra el SARS-CoV-2 en los humanos, según una",23-05-2020 06:53,https://www.bing.com/th?id=ON.98D56187D0C7E9BF7DC32DBEA786EB03,Guatemala,El Periódico Guatemala
Coronavirus: Guatemala suma 231 contagios nuevos y tres fallecidos,https://www.guatevision.com/nacionales/coronavirus-guatemala-suma-231-contagios-nuevos-y-tres-fallecidos-breaking,"Los casos de coronavirus en Guatemala llegaron a 2 mil 743 este 22 de mayo, con 51 fallecidos. El ministro de Salud, Hugo Monroy, informó en un mensaje a la nación sobre 231 casos nuevos, 94 mujeres y",23-05-2020 11:06,https://www.bing.com/th?id=ON.47EC4AA90AD56AA542B28437FB5A25E3,Guatemala,Guatevision
"“Ayudamos a Guatemala como a ningún otro país del mundo”, enfatiza EE.",https://newsinamerica.com/pdcc/otrasnoticias/2020/ayudamos-a-guatemala-como-a-ningun-otro-pais-del-mundo-enfatiza-ee-uu,"Guatemala. Asesor presidencial de Estados Unidos atribuye a problemas internos de comunicación el que el mandatario guatemalteco no conozca la ayuda que ese país ha dado a Guatemala, al mismo tiempo r",23-05-2020 14:10,https://www.bing.com/th?id=ON.447CC47A679BCDD442837BC865C024F2,Guatemala,Periódico Digital Centroamericano y del Caribe
Guatemala llega a 2 mil 743 casos de coronavirus y 51 fallecidos en total,https://newsinamerica.com/pdcc/otrasnoticias/2020/guatemala-llega-a-2-mil-743-casos-de-coronavirus-y-51-fallecidos-en-total,"Guatemala. Los casos de coronavirus en Guatemala continúan aumentando, mientras las disposiciones presidenciales para el fin de semana son permanecer en sus viviendas. El ministro de Salud, Hugo Monro",23-05-2020 14:10,https://www.bing.com/th?id=ON.BE251B6CE045750EA8A1F0AB79B8B51C,Guatemala,Periódico Digital Centroamericano y del Caribe
Guatemala practica menos pruebas per cápita que otros países de la región,https://elperiodico.com.gt/nacion/2020/05/23/guatemala-practica-menos-pruebas-per-capita-que-otros-paises-de-la-region-1/,"Después de 70 días desde que se detectó el primer de caso de COVID-19 en Guatemala, el Ministerio de Salud Pública y Asistencia Social (MSPAS) ha incrementado gradualmente el número de test que practi",23-05-2020 14:53,https://www.bing.com/th?id=ON.90F0E7E24DE811CA74DD8FD2A300ED6C,Guatemala,El Periódico Guatemala
"Gobierno de Guatemala confirma 2,743 casos de COVID-19 en el país",https://radiotgw.gob.gt/gobierno-de-guatemala-confirma-2743-casos-de-covid-19-en-el-pais/,"TGW Digital – El Ministerio de Salud Pública y Asistencia Social (MSPAS), esta noche ha dado a conocer la actualización de casos positivos de Coronavirus, COVID-19, en Guatemala, reportando para este",23-05-2020 15:35,https://www.bing.com/th?id=ON.F2A4D5DEF1DB4B85B31E7D6513A8D477,Guatemala,TGW
"VIDEO. Gobierno confirma 231 nuevos casos de Covid-19; total asciende a 2,743",https://www.publinews.gt/gt/noticias/2020/05/22/casos-coronavirus-guatemala-22-mayo-2020.html,"El ministro de Salud, Hugo Monroy, indicó que también se lamenta el fallecimiento de un auxiliar de enfermería que laboraba en el Hospital General de Malacatán, San Marcos. Por Esvin Lopez Viernes 22",23-05-2020 16:28,https://www.bing.com/th?id=ON.40821B176BFE325856061CE874BB496A,Guatemala,Publinews
Ministerio de Salud reporta su primer muerto por COVID-19 y tiene tres positivos,https://crnnoticias.com/ministerio-de-salud-reporta-su-primer-muerto-por-covid-19/,Las últimas horas han sido difíciles no solo para Guatemala sino también para las autoridades del Ministerio de Salud Pública y Asistencia Social -MSPAS- por la muerte de un colaborador y el contagio,23-05-2020 16:47,https://www.bing.com/th?id=ON.31BFBCEE96722BA318E6C580DB785DBA,Guatemala,CRN Noticias
Guatemala registra 231 nuevos casos de coronavirus,https://elmetropolitano.com.gt/es/2020/05/23/guatemala-registra-231-nuevos-casos-de-coronavirus/,"El ministro de Salud, Hugo Monroy, confirmó este viernes por la noche que Guatemala registró hoy 231 nuevos casos de coronavirus, que eleva la cifra de casos a dos mil 743. Según datos del Ministerio",23-05-2020 16:57,https://www.bing.com/th?id=ON.9DE9942F9E81A1B50A682FB2B7A9DD50,Guatemala,El Metropolitano
COVID-19: fallecen 3 personas; uno de ellos era un enfermero de San Marcos,https://lahora.gt/covid-19-fallecen-3-personas-uno-de-ellos-era-un-enfermero-de-san-marcos/,"El ministro de Salud, Hugo Monroy, informó que tres personas fallecieron este viernes debido a la COVID-19, entre ellos, un enfermero de Malacatán, San Marcos y anunció 231 nuevos contagios en el país",23-05-2020 17:00,https://www.bing.com/th?id=ON.CB3CF3B787F27C8F701A51E0A81EBAE3,Guatemala,La Hora
Duermen en el suelo y permanecen entre basura: Pacientes denuncian mala atención en hospital del IGSS,https://www.guatevision.com/nacionales/duermen-en-el-suelo-y-permanecen-entre-basura-pacientes-denuncian-mala-atencion-en-hospital-del-igss-breaking,Pacientes denunciaron tratos inhumanos e instalaciones inadecuadas del Instituto Guatemalteco de Seguridad Social (IGSS) para la atención del coronavirus en el hospital de enfermedades de la zona 9 ca,23-05-2020 17:32,https://www.bing.com/th?id=ON.09490968A274488FBF3FD6291AA0A98D,Guatemala,Guatevision
Vendedores del CENMA comparten con familias,https://lahora.gt/vendedores-del-cenma-comparten-con-familias/,"A unas horas de que empezara el toque de queda total en el país la tarde de este viernes, vendedores de la Central de Mayoreo (CENMA), donaron de sus productos para la elaboración de bolsas de ayuda p",23-05-2020 18:22,https://www.bing.com/th?id=ON.0B7029F403A7411E92E747AA793ABFC4,Guatemala,La Hora
Sector académico respalda decisiones a favor de la población tomadas por el Ejecutivo,https://elmetropolitano.com.gt/es/2020/05/23/sector-academico-respalda-decisiones-a-favor-de-la-poblacion-tomadas-por-el-ejecutivo/,"El sector académico respalda las decisiones a favor de la población tomadas por el Ejecutivo durante la emergencia del coronavirus (COVID-19). En este sentido, el rector de la Universidad de San Carlo",23-05-2020 19:47,https://www.bing.com/th?id=ON.7F4C432784AAA5FF9713EFB316A98B72,Guatemala,El Metropolitano
COVID-19: Se cumplen dos meses bajo toque de queda a la espera de lo peor,https://crnnoticias.com/toque-de-queda-guatemala-covid-19/,"Guatemala cumplió este viernes dos meses bajo toque de queda por el coronavirus COVID-19, a la espera de lo peor, tras batir el jueves su propio registro de casos en un solo día con 247 contagios de c",23-05-2020 20:31,https://www.bing.com/th?id=ON.1A772EBF0C6DD2BA617A7C98B8779313,Guatemala,CRN Noticias
Coronavirus: Trasladan a más pacientes con covid-19 a hospital de enfermedades infectocontagiosas,https://www.prensalibre.com/guatemala/coronavirus-trasladan-a-mas-pacientes-con-covid-19-a-hospital-de-enfermedades-infectocontagiosas-breaking/,"Ese hospital atiende a cerca de 90 pacientes por enfermedades respiratorias derivadas de VIH y cáncer pulmonar, tuberculosis aguda y crónica, así como fibrosis pulmonar; estos últimos necesitan oxígen",23-05-2020 20:32,https://www.bing.com/th?id=ON.52FBEDE54B67BDBD901F8D7C1EDBF373,Guatemala,Prensa Libre
Inacif confirma un caso positivo por Covid-19 y sospecha de otro en subsede de Chimaltenango,https://www.publinews.gt/gt/noticias/2020/05/23/inacif-caso-positivo-covid-19-chimaltenango.html,El Instituto Nacional de Ciencias Forenses de Guatemala (Inacif) dio a conocer que se obtuvo la confirmación de un caso positivo de Covid-19 y se sospecha de otro caso dentro del equipo de trabajo de,23-05-2020 20:34,https://www.bing.com/th?id=ON.B9644BEDBA91651CB4C40714E0453B23,Guatemala,Publinews
Retornan a Guatemala 22 niños migrantes detenidos por EE. UU.,https://republica.gt/2020/05/23/retornan-a-guatemala-ninos-migrantes/,Niños detenidos por la Patrulla fronteriza en EE. UU. (Foto: Reuters). El Gobierno de Guatemala recibió a un grupo de 22 menores de edad que fueron retornados desde Estados Unidos. Según el Instituto,23-05-2020 21:42,https://www.bing.com/th?id=ON.EA101AA1C709C91D06322382850500C3,Guatemala,Republica
Coronavirus: Nuevo comisionado recibe protocolo para asintomáticos,https://www.prensalibre.com/guatemala/coronavirus-nuevo-comisionado-recibe-protocolo-para-asintomaticos/,"Con los hospitales del país, tanto los del sistema público como los del Instituto Guatemalteco de Seguridad Social (IGSS), a tope en sus capacidades, por el número de pacientes de covid-19, la Asociac",23-05-2020 22:14,https://www.bing.com/th?id=ON.97756EA71A25AFDCB77B455D9C7C6F9C,Guatemala,Prensa Libre
