name,url,description,datePublished,imagen,pais,Fuente
Pandemia llega a los 154 mil 212 casos de Covid-19 en el país,https://emisorasunidas.com/2021/01/24/guatemala-casos-coronavirus-24-enero-2021/,"La pandemia del nuevo coronavirus (Covid-19) ha provocado 5 mil 465  muertes en Guatemala desde que la enfermedad apareció en marzo del año pasado. Desde el comienzo de la pandemia, 154 mil 212  perso",24-01-2021 17:19,https://www.bing.com/th?id=OVFT.3WAMM2iXQo6SOkOntsYADC,Guatemala,Emisoras Unidas
COVID-19: Guatemala reporta que casi el 90 % de contagiados se ha recuperado,https://stereo100.com.gt/2021/covid-19-guatemala-reporta-que-casi-el-90-de-contagiados-se-ha-recuperado/,"Con información de AGN. Después de la actualización de cifras de Coronavirus COVID-19 en Guatemala, de este domingo 24 de enero de 2021, por parte del Ministerio de Salud; la estadística refiere que e",24-01-2021 21:33,https://www.bing.com/th?id=OVFT.MXiJ60BWMezqIFeiTf-z3S,Guatemala,Stereo 100
Guatemala registra 320 casos nuevos de coronavirus y 9 muertos en las últimas horas,https://www.prensalibre.com/guatemala/comunitario/las-posibilidades-de-contagio-de-covid-19-en-lugares-al-aire-libre-se-reducen-en-gran-medida-pero-no-son-nulas-breaking/,"Contagios totales suman 154 mil 212 y se acumulan 5 mil 465 víctimas mortales de coronavirus desde que se inició la pandemia en Guatemala, el 13 de marzo del 2020.",24-01-2021 23:16,https://www.bing.com/th?id=OVFT.t_-rgx_OJX9M5h0VRj5OFC,Guatemala,Prensa Libre
Salud actualiza Tablero Covid-19 y reporta 320 casos nuevos y 9 fallecidos durante las últimas horas.,https://www.guatevision.com/nacionales/salud-actualiza-tablero-covid-19-y-reporta-320-casos-nuevos-y-9-fallecidos-durante-las-ultimas-horas-breaking,Las autoridades del Ministerio de Salud actualizaron este domingo 24 de enero el Tablero Covid-19 con los datos del 23 de enero en el que se reporta que en las últimas 24 horas se detectaron 320,24-01-2021 23:18,https://www.bing.com/th?id=OVFT.nDSmMi96y8BDTU0KoL9xwS,Guatemala,Guatevision
Biden intenta apurar inmunización contra el COVID-19 y restringirá viajes,https://elperiodico.com.gt/noticias/internacionales/2021/01/25/biden-intenta-apurar-inmunizacion-contra-el-covid-19-y-restringira-viajes/,"Estados Unidos sobrepasó ayer los 25 millones de casos confirmados de COVID-19, según el recuento independiente de la Universidad Johns Hopkins, cuando la Administración del presidente, Joe Biden, int",25-01-2021 06:26,https://www.bing.com/th?id=OVFT.KnMkx79LLebbMA3oIHr-Gi,Guatemala,El Periódico Guatemala
El efecto dominó del coronavirus en Guatemala,https://republica.gt/2021/01/24/el-efecto-domino-del-coronavirus-en-guatemala/,"El coronavirus, un enemigo invisible y letal, trajo una pandemia y también causó un fuerte impacto económico para Guatemala,",25-01-2021 06:46,https://www.bing.com/th?id=OVFT.Tc3VsSBFLXse3DGHe3O3oS,Guatemala,Republica
"Vacuna contra el covid-19 se retrasa, llegará al país a finales de febrero",https://www.prensalibre.com/guatemala/comunitario/vacuna-contra-el-covid-19-se-retrasa-llegara-al-pais-a-finales-de-febrero/,"Durante una entrevista con Noticiero Guatevisión, la ministra de Salud, Amelia Flores, mencionó que el primer lote ingresará al país en la última semana de febrero, y que los hospitales están al",25-01-2021 10:02,https://www.bing.com/th?id=OVFT.aU2MR88fuy0KD2oEVFWofC,Guatemala,Prensa Libre
"Centroamérica: ¡Mientras no existan empleos y salarios dignos, emigrar es un derecho!",https://publicogt.com/2021/01/25/centroamerica-mientras-no-existan-empleos-y-salarios-dignos-emigrar-es-un-derecho/,"Partido Socialista Centroamericano . El pasado 16 de enero, una caravana de migrantes procedentes de Honduras, compuesta por más de seis mil personas, cruzó la frontera de El Fl",25-01-2021 13:34,https://www.bing.com/th?id=OVFT.JPUOr3AB5oUYYWw3xeGgbi,Guatemala,Publico GT
El Semáforo,https://lahora.gt/el-semaforo/,"El pasado fin de semana se publicó el último semáforo, elaborado ya en plena escalada de los casos, y llama la atención cómo es que “milagrosamente” el municipio de Guatemala quedó en naranja al marca",25-01-2021 14:30,https://www.bing.com/th?id=OVFT.rQBmPakEq_KWj36T_WuyQS,Guatemala,La Hora
Publican ley para vacuna Covid-19 en Guatemala,https://www.chapintv.com/noticia/publican-ley-para-vacuna-covid-19-en-guatemala/,"Este viernes 22 de enero, el Presidente de la República, Alejandro Giammattei, sancionó la ley para el financiamiento y adquisición de vacunas contra el Covid-19.",25-01-2021 15:03,https://www.bing.com/th?id=OVFT.N7GICP3U4WbsZKOQOBHjKS,Guatemala,Chapin TV
"Vacuna contra el COVID-19 en Guatemala, el tema de hoy en Redes Ciudadanas",https://stereo100.com.gt/2021/vacuna-contra-el-covid-19-en-guatemala-el-tema-de-hoy-en-redes-ciudadanas/,Este lunes 25 de enero de 2021 en el programa Redes Ciudadanas de Stereo 100 se abordó el tema de la vacuna contra el Coronavirus COVID-19 en Guatemala. En principio participó el diputado miembro de l,25-01-2021 15:46,https://www.bing.com/th?id=OVFT.3ynmXDUSAR09ot8XuiwpJi,Guatemala,Stereo 100
El Reino Unido encabeza el ranking de países más alcoholizados del mundo,https://crnnoticias.com/el-reino-unido-encabeza-el-ranking-de-paises-mas-alcoholizados-del-mundo/,Reino Unido encabeza el ránking de países alcoholizados de todo el mundo; España o Colombia reflejan los porcentajes más bajos en la lista.,25-01-2021 16:21,https://www.bing.com/th?id=OVFT.rxBIzW4tFvyVHCbKYn4K8C,Guatemala,CRN Noticias
IGSS y Minfin explican avances en proceso para compra de vacunas contra Covid-19,https://emisorasunidas.com/2021/01/25/compra-vacunas-covid-19-guatemala-igss/,Autoridades del Ministerio de Finanzas y del IGSS explusieron los pasos a seguir tras la aprobación de la ley para adquisición de vacunas Covid-19.,25-01-2021 17:20,https://www.bing.com/th?id=OVFT.IiOtmji0QbhOT2os0yeVSC,Guatemala,Emisoras Unidas
Presidente de México trabaja en su despacho tras dar positivo a COVID-19,https://elperiodico.com.gt/noticias/internacionales/2021/01/25/presidente-de-mexico-trabaja-en-su-despacho-tras-dar-positivo-a-covid-19/,"Un equipo multidisciplinario de especialistas, liderado por el secretario de Salud, Jorge Alcocer, atiende al mandatario, añadió.",25-01-2021 18:49,https://www.bing.com/th?id=OVFT.n8VUWCFCucp6Bgrq3N210C,Guatemala,El Periódico Guatemala
Avance de las vacunas contra Covid-19,https://elsiglo.com.gt/2021/01/25/avance-de-las-vacunas-contra-covid-19/,"Tras la aprobación de la ley para el financiamiento y adquisición de vacunas contra el Covid-19, la atención se enfoca en cuándo llegarán las primeras dosis al país y cómo será el proceso para su dist",25-01-2021 19:01,https://www.bing.com/th?id=OVFT.0fhQWar0VQfxmKzUVQZe1i,Guatemala,Siglo Veintiuno
Guatemala supera los 154 mil casos de Covid-19,https://www.chapintv.com/noticia/guatemala-supera-los-154-mil-casos-de-covid-19/,"Según las cifras publicadas por el Ministerio de Salud Pública y Asistencia Social, Guatemala acumula un total de 154 mil 430 casos de contagiados de Covid-19.",25-01-2021 20:07,https://www.bing.com/th?id=OVFT.JvvfGrVFnLZnDhJELQDVcS,Guatemala,Chapin TV
Salud anuncia “ajustes” a restricciones para evitar el coronavirus,https://republica.gt/2021/01/25/salud-anuncia-ajustes-a-restricciones-para-evitar-el-coronavirus/,"Las autoridades del Ministerio de Salud informaron de ""ajustes"" a las medidas sanitarias publicadas el jueves 21 de enero por la segunda ola.",25-01-2021 20:13,https://www.bing.com/th?id=OVFT.gZ4kLVj09iIiT0ZvbZ5XDC,Guatemala,Republica
Preocupación en Guatemala por “significativo” aumento de casos de COVID-19,https://crnnoticias.com/covid-19-alarma-el-incremento-de-casos-en-guatemala/,"Autoridades del Ministerio de Salud, expresaron su preocupación por el aumento de casos de COVID-19 en el país durante las últimas semanas.",25-01-2021 23:03,https://www.bing.com/th?id=OVFT.PjcxM_LMFlSk3zgl875uNy,Guatemala,CRN Noticias
Perspectivas para los pagos digitales en 2021,https://newsinamerica.com/pdcc/economia/2021/perspectivas-para-los-pagos-digitales-en-2021/,"La pandemia Covid-19 ha transformado la forma en que se trabaja y estudia, los hábitos de entretenimiento y de vida en general. Asimismo, para la industria de pagos digitales no ha sido diferente. El",26-01-2021 02:19,https://www.bing.com/th?id=OVFT.Uy_yl3wh-b2dgw5BlzNaZS,Guatemala,Periódico Digital Centroamericano y del Caribe
Las clases 2021 no serán presenciales en alerta roja y naranja y padres deberán autorizar para que sus hijos vuelvan a las aulas,https://www.guatevision.com/nacionales/las-clases-2021-no-seran-presenciales-en-alerta-roja-y-naranja-y-padres-deberan-autorizar-para-que-sus-hijos-vuelvan-a-las-aulas-breaking,El Ministerio de Educación ya tiene los protocolos para el regreso a clases y la forma en la que se trabajará según la alerta del Tablero Covid-19 que esté vigente en cada municipio y serán los,26-01-2021 02:23,https://www.bing.com/th?id=OVFT.EUFmIXGoKqIR1ARZsHW0my,Guatemala,Guatevision
