name,url,description,datePublished,imagen,pais,Fuente
"Comisión de DD.HH. acciona en CC contra IGSS, Finanzas y Salud por vacunas Covid-19",https://lahora.gt/comision-de-dd-hh-acciona-en-cc-contra-igss-finanzas-y-salud-por-vacunas-covid-19/,"Finanzas y Salud velen porque las adquisiciones de la vacuna Covid-19 se realicen a costos accesibles, de buena calidad, con plazos de expiración optima y con las condiciones más favorables para el Estado de Guatemala. El presidente de la Comisión de DD.HH.",16-12-2020 21:02,https://www.bing.com/th?id=OVFT.XEg48wI7-eu3UpDkBd5kUS,Guatemala,La Hora
Prestadores de Servicios Turísticos de Sacatepéquez reciben el Sello de Bioseguridad,https://newsinamerica.com/pdcc/turismo/2020/prestadores-de-servicios-turisticos-de-sacatepequez-reciben-el-sello-de-bioseguridad,"Guatemala. El Instituto Guatemalteco de Turismo (INGUAT ... para la implementación de las Guías de Buenas Prácticas para la Prevención del COVID-19 y otras infecciones. El Director General del INGUAT, Mynor Cordón, expresó “Sabemos la importancia ...",16-12-2020 21:10,https://www.bing.com/th?id=OVFT.jQYrliBzc59kNzhxooaXSi,Guatemala,Periódico Digital Centroamericano y del Caribe
Accionan en CC para que se garantice presupuesto para vacunas Covid-19,https://emisorasunidas.com/2020/12/16/amparo-presupuesto-vacunas-covid-19/,Fue presentada una acción en la Corte de Constitucionalidad para que se garantice la asignación de fondos para adquirir de la vacuna contra el Covid-19.,16-12-2020 21:12,https://www.bing.com/th?id=OVFT.ZSETD2x8PCAtDqPyS3Sg5y,Guatemala,Emisoras Unidas
Presentan amparo para asegurar compra de vacuna contra el covid-19,https://republica.gt/2020/12/16/presentan-amparo-asegurar-compra-vacuna-contra-covid-19/,"El presidente de la Comisión de Derechos Humanos, Orlando Blanco, presentó un amparo para que garantizar la compra de vacuna contra covid-19.",16-12-2020 21:23,https://www.bing.com/th?id=OVFT.WWATvASxfRpiG_1Ov_Gspi,Guatemala,Republica
Otto pide volver a Mariscal Zavala por temor al Covid-19,https://www.deguate.com/artman/publish/noticias-guatemala/Otto-pide-volver-a-Mariscal-Zavala-por-temor-al-Covid-19.shtml,El expresidente Otto Pérez Molina ha solicitado ser trasladado del Centro Médico Militar hacia la cárcel Mariscal,16-12-2020 21:30,https://www.bing.com/th?id=OVFT.atqdZe_wwvdUUPOzMQkHUC,Guatemala,De Guate
Unity invita a tomar medidas de prevención durante las fiestas de fin de año,https://newsinamerica.com/pdcc/gerenciales/2020/unity-invita-a-tomar-medidas-de-prevencion-durante-las-fiestas-de-fin-de-ano,Guatemala. En visperas navideñas y de fin de año Unity Willis Towers Watson invita a cada persona a tomar las medidas de prevención en contra del virus “Covid-19” basados en el principal pilar de nues,17-12-2020 00:00,https://www.bing.com/th?id=OVFT.v7pNVCLomaB_wZ3pG0tz2y,Guatemala,Periódico Digital Centroamericano y del Caribe
Guatemalteco es de los primeros en recibir vacuna contra el covid-19 en Canadá,https://www.prensalibre.com/guatemala/migrantes/guatemalteco-es-de-los-primeros-en-recibir-vacuna-contra-el-covid-19-en-canada/,"Este miércoles 16 de diciembre, Edwin Quezada se convirtió en uno de los primeros guatemaltecos en recibir la vacuna contra el covid-19 en la ciudad de Toronto, Canadá.",17-12-2020 03:56,https://www.bing.com/th?id=OVFT.0hv-Fs1smFkEoZanVNinRS,Guatemala,Prensa Libre
Hospitales desbordados y nuevo récord de casos de covid-19 en Tokio,https://elperiodico.com.gt/noticias/internacionales/2020/12/17/hospitales-desbordados-y-nuevo-record-de-casos-de-covid-19-en-tokio/,Pero el número de infecciones diarias de covid-19 está en fuerte aumento desde noviembre. Los hospitales de Tokio tienen dificultades para garantizar cuidados debido a un aumento de casos de coronavir,17-12-2020 12:53,https://www.bing.com/th?id=OVFT.Qb1OCkSkfX17U2T1YdsS-S,Guatemala,El Periódico Guatemala
25 guatemaltecos viajan a Canadá para trabajar en el sector agrícola,https://republica.gt/2020/12/17/25-guatemaltecos-viajan-canada-para-trabajar-sector-agricola/,"Un grupo de 25 guatemaltecos viajaron esta semana a la provincia de Columbia Británica, en Canadá como parte del Programa de Trabajo Temporal",17-12-2020 15:25,https://www.bing.com/th?id=OVFT.fx3N12FtZDJSEMuVVpS6Ni,Guatemala,Republica
Guatemala forma parte del Food Taipei Mega Show 2020,https://radiotgw.gob.gt/guatemala-forma-parte-del-food-taipei-mega-show-2020/,"Guatemala estará presente con una variedad importante de ... internacionales no pueden asistir físicamente a esta exposición debido a la pandemia de COVID-19, Taiwantrade.com, el portal electrónico B2B operado por el Consejo de Desarrollo de Comercio ...",17-12-2020 15:46,https://www.bing.com/th?id=OVFT.6u-OrwMaagmuD6htaPAc6C,Guatemala,TGW
Salud pide a alcaldes cumplir protocolos,https://www.deguate.com/artman/publish/noticias-guatemala/Salud-pide-a-alcaldes-cumplir-protocolos.shtml,Guatemala. En ese sentido ... con los protocolos de prevención del coronavirus. Foto: dca.gob.gt “En muchos lugares hemos visto que no se están acatando todas las medidas y lineamientos en torno al Covid-19. Hay algunos municipios que han realizado ...,17-12-2020 16:30,https://www.bing.com/th?id=OVFT.lZo9Aj4ycQ7p0SZK7C4LpC,Guatemala,De Guate
Sistema de pago electrónico en el Transmetro iniciará a funcionar en 2021,https://emisorasunidas.com/2020/12/17/sistema-pago-electronico-transmetro-tarjeta-ciudadana/,La municipalidad de Guatemala anunció este jueves que a partir de 2021 será ... de pago sin contacto minimiza la posibilidad de contagio de enfermedades como el Covid-19. Medios de pago Las vías para pagos electrónicos que estarán a disposición ...,17-12-2020 16:41,https://www.bing.com/th?id=OVFT.kt7UUd0jk-h1c-HOC_91Ey,Guatemala,Emisoras Unidas
Salud reporta 41 decesos por coronavirus y nuevamente justifica que “no reflejan la situación actual de mortalidad”,https://www.guatevision.com/nacionales/salud-reporta-41-decesos-por-coronavirus-y-nuevamente-justifica-que-no-reflejan-la-situacion-actual-de-mortalidad,"El Ministerio de Salud reporta el deceso de otras 41 personas por covid-19 en Guatemala. En la última semana la cifra de fallecidos se ha mantenido entre los 18 y 34, mientras que Salud justifica que la mayoría son de meses anteriores por atraso en las ...",17-12-2020 16:55,https://www.bing.com/th?id=OVFT.Q8dWHKaHiHkmPhtBh0B51y,Guatemala,Guatevision
Coronavirus: 604 nuevos casos en Guatemala,https://radiotgw.gob.gt/coronavirus-604-nuevos-casos-en-guatemala/,"La mayor parte corresponden a meses anteriores, por lo que no reflejan las situación actual de mortalidad COVID-19 en el país.",17-12-2020 17:01,https://www.bing.com/th?id=OVFT.w0D5FSsMX9ejmAObns4lDi,Guatemala,TGW
Guatemala reporta 604 nuevos casos de COVID-19,https://stereo100.com.gt/2020/guatemala-reporta-604-nuevos-casos-de-covid-19/,"Por Luis Hernández | Este jueves, el Ministerio de Salud Pública y Asistencia Social (MSPAS) informa que en las últimas 24 horas, en Guatemala, se registran 604 nuevos casos de COVID-19 y 41",17-12-2020 17:31,https://www.bing.com/th?id=OVFT.rZB2FCPjzEDc2-tEJuU3TS,Guatemala,Stereo 100
José y Juan Borón reforzarán al Team Panes Tish en la Vuelta al Futuro 2020 en El Salvador,https://www.guatemala.com/deportes/ciclismo/jose-y-juan-boron-reforzaran-team-panes-tish-vuelta-futuro-2020-salvador.html,Los ciclistas guatemaltecos José y Juan Borón reforzarán al Team Panes Tish para disputar la Vuelta al Futuro 2020 que se celebrará en El Salvador.,17-12-2020 18:30,https://www.bing.com/th?id=OVFT.038UOv7lmFzPM2_47naKqy,Guatemala,Guatemala
Democracias latinoamericanas retrocedieron en derechos fundamentales en 2020,https://elperiodico.com.gt/nacionales/2020/12/17/democracias-latinoamericanas-retrocedieron-en-derechos-fundamentales-en-2020/,"Un reporte de IDEA Internacional advierte que en Brasil, El Salvador, Guatemala, Nicaragua y México los medios de comunicación han recibido ataques verbales de jefes de Estado por informar sobre la pa",17-12-2020 18:45,https://www.bing.com/th?id=OVFT.XTJYhkSAiBkWqNdTc_IQmy,Guatemala,El Periódico Guatemala
Guatemala acumula más de 131 mil casos de Covid-19,https://www.chapintv.com/noticia/guatemala-acumula-mas-de-131-mil-casos-de-covid-19/,"Según las cifras publicadas por el Ministerio de Salud Pública y Asistencia Social, Guatemala acumula un total de 131 mil 435 casos de infectados de Covid-19.",17-12-2020 19:14,https://www.bing.com/th?id=OVFT.cmiqNEGOnXvu7wwbqJo4aC,Guatemala,Chapin TV
Cancelan procesiones de Semana Santa 2021 en Guatemala y Sacatepéquez por la pandemia,https://www.prensalibre.com/guatemala/comunitario/cancelan-procesiones-de-semana-santa-2021-en-guatemala-y-sacatepequez-por-la-pandemia-breaking/,"El arzobispo metropolitano, Gonzalo de Villa, confirmó a Prensa Libre que este jueves 17 de diciembre se reunió con las hermandades de Pasión de la Arquidiócesis de Santiago de Guatemala y se acordó que por la situación de la pandemia del covid-19 no ...",17-12-2020 19:44,https://www.bing.com/th?id=OVFT._stfrhK4SZtN1WD3Pd_PRC,Guatemala,Prensa Libre
Arquidiócesis cancela procesiones de Semana Santa 2021 en Guatemala y Sacatepéquez por la pandemia,https://www.guatevision.com/nacionales/arquidiocesis-cancela-procesiones-de-semana-santa-2021-en-guatemala-y-sacatepequez-por-la-pandemia-breaking,"Dos departamentos no tendrán procesiones en el 2021 por la pandemia. El arzobispo metropolitano, Gonzalo de Villa, confirmó a Prensa Libre que este jueves 17 de diciembre se reunió con las hermandades",17-12-2020 19:45,https://www.bing.com/th?id=OVFT.IHvui7UqHUu9GGOUVfBNJS,Guatemala,Guatevision
Guatemala mantiene 7 mil 136 casos activos de Covid-19,https://www.chapintv.com/noticia/guatemala-mantiene-7-mil-136-casos-activos-de-covid-19/,"De acuerdo a las cifras publicadas por el Ministerio de Salud Pública y Asistencia Social, Guatemala acumula un total de 131 mil 435 casos de infectados de Covid-19.",17-12-2020 20:10,https://www.bing.com/th?id=OVFT.RR75d56gjk3JLt32TXFCGi,Guatemala,Chapin TV
Guatemala suma 41 decesos por COVID-19 y 604 nuevos contagios en 24 horas,https://crnnoticias.com/guatemala-suma-41-decesos-por-covid-19-y-604-nuevos-contagios-en-24-horas/,"Con los 41 nuevos decesos reportados, Guatemala suma un total de 106 muertes por coronavirus en los últimos tres días.",17-12-2020 22:01,https://www.bing.com/th?id=OVFT.XqZYYFz5vZ4gDF5eBBF4Hi,Guatemala,CRN Noticias
Documental sobre el asesinato de Gerardi genera diversas reacciones de los guatemaltecos,https://lahora.gt/documental-sobre-el-asesinato-de-gerardi-genera-diversas-reacciones-de-los-guatemaltecos/,"Guatemala vuelve a ser centro de atención al haberse estrenado ... LEA: Banco Mundial hace radiografía por COVID-19; primer tema, la lucha contra la pobreza extrema Cabe destacar que el asesinato ocurrió durante el gobierno de Álvaro Arzú Irigoyen ...",17-12-2020 23:02,https://www.bing.com/th?id=OVFT.ISZ1xIUaqHqajozrYVT60y,Guatemala,La Hora
Casa Ronald McDonald volverá a albergar a familias guatemaltecas a partir de enero,https://www.guatemala.com/noticias/sociedad/casa-ronald-mcdonald-volvera-albergar-familias-guatemaltecas-partir-enero.html,"Desde abril albergaron a médicos y personal de salud guatemalteco que combate el COVID-19 en nuestro país. ¡Qué chilero! Debido a la evolución de la pandemia en nuestro país, los hospitales y unidades médicas dejaron de referir familias para ...",17-12-2020 23:06,https://www.bing.com/th?id=OVFT.URzpF-OQYCp5NUvEFhTI1y,Guatemala,Guatemala
2021: Cancelan procesiones en Guatemala y Sacatepéquez por COVID-19,https://crnnoticias.com/2021-cancelan-procesiones-en-guatemala-y-sacatepequez-por-covid-19/,"El arzobispado metropolitano canceló las procesiones para los departamentos de Guatemala ... coronavirus. El arzobispo metropolitano, Gonzalo de Villa explicó que se reunió con las hermandades y se acordó que por la situación de la pandemia del covid ...",17-12-2020 23:19,https://www.bing.com/th?id=OVFT.8skoxmT_cXFowiCWcvM-EC,Guatemala,CRN Noticias
