name,url,description,datePublished,imagen,pais,Fuente
"BAC Credomatic lanza la primera tarjeta Puntos Fit en alianza con Fitness One, Dinamic Fitness y Tribo Training Tribe",https://elmetropolitano.com.gt/es/2021/04/16/bac-credomatic-lanza-la-primera-tarjeta-puntos-fit-en-alianza-con-fitness-one-dinamic-fitness-y-tribo-training-tribe/,"Con el objetivo de sumar y apoyar a las personas que tienen o están iniciando un estilo de vida más saludable y que buscan mantenerse en forma, BAC Credomatic, Fitness One, Dinamic Fitness y Tribo Tra",16-04-2021 00:00,https://www.bing.com/th?id=OVFT.pTOagJJJ7oKRBwmS2GMyAS,Guatemala,El Metropolitano
COVID-19: Salud hace más de 12 mil 562 pruebas y mil 973 fueron positivas,https://elmetropolitano.com.gt/es/2021/04/16/covid-19-salud-hace-mas-de-12-mil-562-pruebas-y-mil-973-fueron-positivas/,El Ministerio de Salud Pública y Asistencia Social (MSPAS) informó que durante este 15 de abril se hicieron 12 mil 562 pruebas para detectar el COVID-19. La cartera destacó que mil 973 personas result,16-04-2021 00:00,https://www.bing.com/th?id=OVFT.ZeCDnmRAI3ZaAu-SmuEZvi,Guatemala,El Metropolitano
Chiquimula: Entierran a víctimas de Covid-19 en el patio de su casa (VIDEO),https://www.chapintv.com/noticia/chiquimula-entierran-a-victimas-de-covid-19-en-el-patio-de-su-casa/,"Vecinos entierran a víctimas de Covid-19 de manera inmediata en el patio de su propia casa, esto por falta de lugares en cementerios.",16-04-2021 00:14,https://www.bing.com/th?id=OVFT.peI4yDIoFii2kDoWiVOIYS,Guatemala,Chapin TV
"Covid-19: Reportan 1,973 nuevos casos de Covid-19; más de 13mil activos",https://lahora.gt/covid-19-reportan-1973-nuevos-casos-de-covid-19-mas-de-13mil-activos/,"Por Karen Quintanilla kquintanilla@lahora.com.gt El Ministerio de Salud Pública y Asistencia Social (MSPAS) reportó 1,973 nuevos casos de Covid-19 en las últimas 24 horas, resultado de 12,562 pruebas",16-04-2021 21:54,https://www.bing.com/th?id=OVFT.FBdyKP0QIIhAsKDUMc_2PC,Guatemala,La Hora
Situación del COVID-19 en Guatemala,https://www.chapintv.com/noticia/situacion-del-covid-19-en-guatemala-8/,Le presentamos las estadísticas oficiales de la situación de la pandemia en las últimas 24 horas. Actualmente se contabilizan mil 973 casos confirmados.,17-04-2021 01:15,https://www.bing.com/th?id=OVFT.4ATwyUVHZwrvv7CuDOQYJS,Guatemala,Chapin TV
Covid-19: Medidas que estarán vigentes en Guatemala a partir de abril 2021,https://www.guatemala.com/noticias/sociedad/covid-19-medidas-estaran-vigentes-guatemala-partir-abril-2021.html,Conoce las medidas que habrá en Guatemala para la prevención del COVID-19 en el país a partir de abril de 2021 y compártela con tus contactos.,17-04-2021 02:35,https://www.bing.com/th?id=OVFT.3Ib858MjvB7_q4keH5gIbC,Guatemala,Guatemala
Giammattei decreta Estado de Prevención por aumento de casos de COVID-19,https://crnnoticias.com/giammattei-decreta-estado-de-prevencion-por-aumento-de-casos-de-covid-19/,El presidente Giammattei decretó Estado de Prevención por el un aumento de casos de COVID-19. Esta medida estará vigentes durante 15 días.,17-04-2021 02:43,https://www.bing.com/th?id=OVFT.c3LD29OwuAT5LHE5jxtDKi,Guatemala,CRN Noticias
Guatemala anuncia nuevas disposiciones ante repunte de casos de COVID-19,https://stereo100.com.gt/2021/guatemala-anuncia-nuevas-disposiciones-ante-repunte-de-casos-de-covid-19/,"Por Moisés Cottom y Herberth Tax. Guatemala. El presidente de la República, Alejandro Giammattei, anunció que el país entra a Estado de Prevención por 15 días, ante aumento exponencial de contagios po",17-04-2021 02:54,https://www.bing.com/th?id=OVFT.7OQcyQrUjCkAoMIuzT6wzy,Guatemala,Stereo 100
En las últimas horas Guatemala suma otros 1 mil 973 casos de covid-19 y Salud reporta otros 40 fallecidos,https://www.guatevision.com/nacionales/en-las-ultimas-horas-guatemala-suma-otros-1-mil-973-casos-de-covid-19-y-salud-reporta-otros-40-fallecidos-breaking,"En las últimas horas se practicaron 12 mil 562 pruebas y de estas 1 mil 973 resultaron positivas. Con estos nuevos casos, Guatemala suma 210 mil 667 casos acumulados de coronavirus. Según Salud, en la",17-04-2021 03:40,https://www.bing.com/th?id=OVFT.fqlfsgzPghC_IDspv7mLlC,Guatemala,Guatevision
Balneario Xesuj ubicado entre la naturaleza de Chimaltenango,https://www.guatemala.com/guias/aventura/balneario-xesuj-ubicado-entre-la-naturaleza-de-chimaltenango/,"Balneario Xesuj se encuentra ubicado en medio de las montañas de Chimaltenango, cuenta con senderos, vestidores, piscinas al aire libre y mucho más.",17-04-2021 04:09,https://www.bing.com/th?id=OVFT.7OC9joSAWj9_KKuCWwnT9S,Guatemala,Guatemala
Guatemala limita el ingreso de viajeros de tres países por el COVID-19,https://crnnoticias.com/guatemala-limita-el-ingreso-de-viajeros-de-tres-paises-por-el-covid-19/,"Guatemala limita el ingreso de viajeros de ""manera temporal"" y hará una ""actualización"" según las variantes de COVID-19.",17-04-2021 04:45,https://www.bing.com/th?id=OVFT.D06ikf9EAJX3Cf1f0IwAXi,Guatemala,CRN Noticias
"Gobierno prohíbe manifestaciones, fiestas y alcohol",https://elperiodico.com.gt/nacionales/2021/04/17/gobierno-prohibe-manifestaciones-fiestas-y-alcohol/,"El acuerdo establece que los supermercados, mercados y centros comerciales solo podrán vender comida para llevar.",17-04-2021 06:09,https://www.bing.com/th?id=OVFT.Ni4_uGUTKPKVAQ8BVrKtly,Guatemala,El Periódico Guatemala
Salud emite medidas sanitarias ante aumento de contagios de covid-19,https://republica.gt/2021/04/17/salud-emite-medidas-sanitarias-ante-aumento-de-contagios-de-covid-19/,"Autoridades del Ministerio de Salud emitieron tres acuerdos ante el aumento de casos de covid-19, los cuales fueron publicados este sábado",17-04-2021 14:29,https://www.bing.com/th?id=OVFT.Fwx0S5tV8Ghq4AocPRXLiS,Guatemala,Republica
Más de mil casos COVID-19 a diario; población joven predomina,https://lahora.gt/mas-de-mil-casos-covid-19-a-diario-poblacion-joven-predomina/,"Por María España mespana@lahora.com.gt Esta mañana, en el Diario Oficial han sido publicados el Decreto y Acuerdos Gubernativos que ponen en vigencia el Estado de Prevención y nuevas disposiciones san",17-04-2021 15:51,https://www.bing.com/th?id=OVFT.G_m3DhUnmkoQMtBacZspGS,Guatemala,La Hora
Salud reporta 1 mil 640 nuevos casos de covid-19,https://www.prensalibre.com/ahora/guatemala/comunitario/salud-reporta-1-mil-640-nuevos-casos-de-covid-19/,El Ministerio de Salud reporta que en las últimas horas se registraron otros 1 mil 640 casos de coronavirus. También reporta 28 muertos de fechas anteriores y dos de las últimas horas. Se,17-04-2021 16:23,https://www.bing.com/th?id=OVFT.iAVHWmy0vtRdZHIna2RFdC,Guatemala,Prensa Libre
Guillermo Castillo explica por qué votó en contra del Estado de prevención,https://elperiodico.com.gt/nacionales/2021/04/17/guillermo-castillo-explica-por-que-voto-en-contra-del-estado-de-prevencion/,Alejandro Giammattei viajó a una cumbre en España por lo que Guillermo Castillo funge como el Presidente en Funciones del país.,17-04-2021 16:42,https://www.bing.com/th?id=OVFT.9LX9dWj064ZdULCMm2_LcC,Guatemala,El Periódico Guatemala
