name,url,description,datePublished,imagen,pais,Fuente
Tablero covid-19 | Baja el número de municipios en alerta roja,https://republica.gt/2020/11/28/tablero-covid-19-baja-numero-municipios-alerta-roja/,"Las autoridades del Ministerio de Salud actualizaron el Tablero Covid-19 y registra 83 municipios en alerta roja, cinco menos que hace dos semanas.",28-11-2020 19:16,https://www.bing.com/th?id=OVFT.cOv8jvyy3jibGYzR0KoMMi,Guatemala,Republica
Guatemala suma 20 fallecidos y 665 contagios de COVID-19,https://crnnoticias.com/guatemala-suma-20-fallecidos-y-665-contagios-de-covid-19/,"Guatemala sumó en las últimas 24 horas 20 fallecidos y 665 contagios de COVID-19, por lo que acumuló 4 mil 161 decesos y 121 mil 798 contagios en total.",28-11-2020 21:23,https://www.bing.com/th?id=OVFT.D885ALN6l4m6yF8dDDepFS,Guatemala,CRN Noticias
Ruta Maya 2021 visitará Honduras en el bicentenario de la consumación de ...,https://newsinamerica.com/pdcc/turismo/2020/ruta-maya-2021-visitara-honduras-en-el-bicentenario-de-la-consumacion-de-independencia,"Honduras. La Ruta Maya 2021 buscará recorrer los sitios arqueológicos de 13 países, desde México hasta Bolivia y entre ellos Honduras, durante una expedición que se realizará de junio a septiembre del",28-11-2020 23:31,https://www.bing.com/th?id=OVFT.3vzJxBjk68KzrgHG4_P7Fi,Guatemala,Periódico Digital Centroamericano y del Caribe
Nueve municipios de Quetzaltenango reportan menos de 50 casos de COVID-19,https://elmetropolitano.com.gt/es/2020/11/30/nueve-municipios-de-quetzaltenango-reportan-menos-de-50-casos-de-covid-19/,"En el departamento de Quetzaltenango 9 municipios han registrado menos de 50 casos desde que la pandemia de coronavirus (COVID-19) llegó al país, según el Ministerio de Salud Pública y Asistencia Soci",30-11-2020 00:00,https://www.bing.com/th?id=OVFT.jbLFWp4UsoKm2wyicKKt7i,Guatemala,El Metropolitano
Guatemala supera los 122 mil casos acumulados de coronavirus,https://emisorasunidas.com/2020/11/30/casos-coronavirus-guatemala-30-noviembre-2020/,Las autoridades del Ministerio de Salud Pública brindaron la actualización de datos por casos de coronavirus correspondiente para el lunes 20 de noviembre.,30-11-2020 13:39,https://www.bing.com/th?id=OVFT.GrntnbNdZDYeHhUGTPNw7i,Guatemala,Emisoras Unidas
Cómo dañó el covid-19 a las industrias en Guatemala,https://republica.gt/2020/11/30/como-dano-el-covid-19-a-las-industrias-en-guatemala/,"Cabi Data Analitics señala que este año la economía de Guatemala no se encuentra en sus mejores cifras debido al covid-19, y ello afecta",30-11-2020 14:13,https://www.bing.com/th?id=OVFT.qdygLaCMhuldEhSq_j-gGS,Guatemala,Republica
Construir una Guatemala más allá de una finca o la patria del criollo.,https://publicogt.com/2020/11/30/construir-una-guatemala-mas-alla-de-una-finca-o-la-patria-del-criollo/,"Lorena Medina Patzan. El 21 de noviembre se encendió nuevamente el fervor y la indignación ciudadano en la plaza, por el descontento popular causado por la gran corrupción, ind",30-11-2020 15:12,https://www.bing.com/th?id=OVFT.ldCuymqpGr5giQ9OnJrhZy,Guatemala,Publico GT
Guatemala reporta 90 nuevos casos de COVID-19,https://stereo100.com.gt/2020/guatemala-reporta-90-nuevos-casos-de-covid-19/,"Por Luis Hernández | Este lunes, el Ministerio de Salud Pública y Asistencia Social (MSPAS) informó, en redes sociales, que en las últimas 24 horas se registran 90 nuevos casos de COVID-19 y 5",30-11-2020 17:16,https://www.bing.com/th?id=OVFT.-3VmTJ339427v9_8_59iZS,Guatemala,Stereo 100
Guatemala sobrepasa los 122 mil casos de Covid-19,https://www.chapintv.com/noticia/guatemala-sobrepasa-los-122-mil-casos-de-covid-19/,"Según cifras publicadas por el Ministerio de Salud Pública y Asistencia Social, Guatemala acumula un total de 122 mil 62 casos de infectados de Covid-19.",30-11-2020 19:59,https://www.bing.com/th?id=OVFT.kz8cR3cVjEpv8pEvLZMHXC,Guatemala,Chapin TV
Áreas afectadas por las tormentas reportan disminución en pruebas de COVID-19,https://elperiodico.com.gt/nacionales/2020/11/30/areas-afectadas-por-las-tormentas-reportan-disminucion-en-pruebas-de-covid-19/,"Los datos de las últimas 24 horas no registran tamizajes en Alta Verapaz, uno de los departamentos más afectados por el paso de Eta e Iota.",30-11-2020 21:39,https://www.bing.com/th?id=OVFT.BW_EE8e5Snr5NV1nbygrTC,Guatemala,El Periódico Guatemala
MP hace exhumaciones para encontrar a Cristina Siekavizza,https://crnnoticias.com/mp-hace-exhumaciones-para-encontrar-a-cristina-siekavizza/,"Este lunes, fiscales del Ministerio Público hicieron exhumaciones en Morazán, el Progreso para encontrar el cuerpo de Cristina Siekavizza.",30-11-2020 22:44,https://www.bing.com/th?id=OVFT.lBkl6ivyxng6eWno87kbWC,Guatemala,CRN Noticias
Alejandro Sanz ofrecerá concierto virtual para todo el mundo,https://emisorasunidas.com/2020/11/30/alejandro-sanz-ofrecera-concierto-virtual/,"Alejandro Sanz anunció una cita muy especial, el próximo 5 de diciembre regresa a los escenarios de forma virtual para despedir este 2020.",30-11-2020 23:07,https://www.bing.com/th?id=OVFT.ZX9iLih3nV6Lg538tu86Oy,Guatemala,Emisoras Unidas
Ligado a proceso por disturbios ocurridos el sábado pasado en la capital de Guatemala,https://stereo100.com.gt/2020/ligado-a-proceso-por-disturbios-ocurridos-el-sabado-pasado-en-la-capital-de-guatemala/,"Con información de @prensa_libre . Manifestaciones100 | Douglas Cuellar Quezada, de 24 años de edad, fue ligado a proceso este 30 de noviembre por los disturbios ocurridos el 28 de noviembre en la",01-12-2020 03:10,https://www.bing.com/th?id=OVFT.7zg_Nvauj7Lu-7_XHp2o9y,Guatemala,Stereo 100
Guatemala reporta 90 nuevos contagios de la Covid 19 en 24 horas,https://www.chapintv.com/noticia/guatemala-reporta-90-nuevos-contagios-de-la-covid-19-en-24-horas/,"Guatemala reportó este lunes la muerte de cinco personas por la covid-19 y 90 nuevos contagios en las últimas 24 horas, por lo que suma 4.171 decesos a causa de la enfermedad y 122.062 casos en total",01-12-2020 06:14,https://www.bing.com/th?id=OVFT.RR75d56gjk3JLt32TXFCGi,Guatemala,Chapin TV
La OMS alerta a Brasil y México por situación del COVID-19,https://elperiodico.com.gt/internacionales/2020/12/01/la-oms-alerta-a-brasil-y-mexico-por-situacion-del-covid-19/,"El director general de la Organización Mundial de la Salud (OMS) lanzó la voz de alarma ayer ante la rápida propagación del COVID-19 en Brasil y en México, exhortando a las autoridades de ambos países",01-12-2020 06:15,https://www.bing.com/th?id=OVFT.4ifKTJmi4DMWo38gD3WHcC,Guatemala,El Periódico Guatemala
VIH: La otra pandemia que avanza mientras los servicios de salud se enfocan en el covid-19,https://www.prensalibre.com/guatemala/comunitario/vih-la-otra-pandemia-que-avanza-mientras-los-servicios-de-salud-se-enfocan-en-el-covid-19/,"En Guatemala el covid-19 interrumpió los servicios de atención a pacientes con VIH, como también el diagnóstico de nuevos casos. Esta otra pandemia se extiende mientras el mundo está concentrado",01-12-2020 11:00,https://www.bing.com/th?id=OVFT.4ny40aUwNTNY3-5uoHqhjy,Guatemala,Prensa Libre
Cómo Guatemala marginó la atención al VIH por volcarse a la emergencia por el covid-19,https://www.guatevision.com/nacionales/como-guatemala-margino-la-atencion-al-vih-por-volcarse-a-la-emergencia-por-el-covid-19,En Guatemala el covid-19 interrumpió los servicios de atención a pacientes con VIH y el diagnóstico de nuevos casos. Esta otra pandemia se extiende mientras el mundo está concentrado en el nuevo coron,01-12-2020 11:00,https://www.bing.com/th?id=OVFT.DKoUjIIAqzgsrVDggW63ci,Guatemala,Guatevision
"Sor Isabel, la religiosa que alimentó a las personas en condición de calle durante la pandemia",https://www.guatemala.com/noticias/sociedad/sor-isabel-religiosa-alimento-personas-condicion-calle-durante-pandemia.html,"A sus 90 años de edad, Sor Isabel Reynoso está a cargo del comedor Sor Angélica en Antigua Guatemala y que alimenta a personas en condición de calle.",01-12-2020 15:47,https://www.bing.com/th?id=OVFT.GJ0RKio_-Ra673jhZmgvfi,Guatemala,Guatemala
En las últimas horas se registran 712 contagios de covid-19 y siete pacientes fallecidos en Guatemala,https://www.prensalibre.com/guatemala/comunitario/en-las-ultimas-horas-se-registran-712-contagios-de-covid-19-y-siete-pacientes-fallecidos-en-guatemala-breaking/,"En las últimas horas se superaron las 4 mil pruebas para detectar posibles contagios. Los casos de covid-19 continúan en Guatemala y según el último reporte, se diagnosticaron otros 712 contagios. El",01-12-2020 15:46,https://www.bing.com/th?id=OVFT.4raUjGeJst0dOBz8QdZ_dS,Guatemala,Prensa Libre
Salud registra 712 contagios más de coronavirus y siete pacientes fallecidos en Guatemala,https://www.guatevision.com/nacionales/salud-registra-712-contagios-mas-de-coronavirus-y-siete-pacientes-fallecidos-en-guatemala-breaking,"Guatemala alcanza los 122 mil 774 contagios acumulados de covid-19, según Salud. Los casos de covid-19 continúan en Guatemala y según el último reporte, se diagnosticaron otros 712 contagios. El 13 de",01-12-2020 15:55,https://www.bing.com/th?id=OVFT.32cA6_aBgQgNS40elcQ1Ji,Guatemala,Guatevision
