name,url,description,datePublished,imagen,pais,Fuente
Salud reporta más de 138 mil casos acumulados registrados de coronavirus,https://elmetropolitano.com.gt/es/2021/01/03/salud-reporta-mas-de-138-mil-casos-acumulados-registrados-de-coronavirus/,"Durante las 24 horas recientes, en Guatemala se registraron 159 nuevos casos positivos de coronavirus (COVID-19), después de haber procesado 656 pruebas. Estas cifras se detallan en el más reciente re",03-01-2021 21:06,https://www.bing.com/th?id=OVFT.BkcX9QKT7K9zHC-7nv9Rzy,Guatemala,El Metropolitano
"Conred ha atendido a 2,215 personas en albergues por época fría",https://lahora.gt/conred-ha-atendido-a-2215-personas-en-albergues-por-epoca-fria/,"Por Denis Aguilar daguilar@lahora.com.gt La Coordinadora Nacional para la Reducción de Desastres (Conred), informó hoy que hasta la fecha se han atendido a 2,215 personas en los distintos albergues qu",04-01-2021 05:00,https://www.bing.com/th?id=OVFT.RxQHBMNcT9CBTF2Ymd4w4i,Guatemala,La Hora
Vacuna contra covid-19: “El beneficio sobrepasa el riesgo”,https://www.prensalibre.com/pl-plus/guatemala/comunitario/vacuna-contra-covid-19-el-beneficio-sobrepasa-el-riesgo/,El médico guatemalteco Luis Fernando Escobar es consultor en Estados Unidos de la FDA y participa en la evaluación de las tecnologías aprobadas por el organismo estadounidense. El facultativo,04-01-2021 11:00,https://www.bing.com/th?id=OVFT.C4rJcb94IPtZyWblVP1iiC,Guatemala,Prensa Libre
Guatemala reporta 181 nuevos casos de COVID-19,https://stereo100.com.gt/2021/guatemala-reporta-181-nuevos-casos-de-covid-19/,"Por Luis Hernández | Este lunes, el Ministerio de Salud Pública y Asistencia Social (MSPAS) reporta en las últimas 24 horas, en Guatemala, 181 nuevos casos de COVID-19 y 2 fallecidos. https://twitter.",04-01-2021 16:19,https://www.bing.com/th?id=OVFT.zCMdKuymrlLBnzXWosa5vC,Guatemala,Stereo 100
Mario Escobar y Humberto Panjoj serán parte de los árbitros del Mundial de Clubes 2020,https://www.guatemala.com/deportes/futbol-guatemalteco/mario-escobar-y-humberto-panjoj-seran-parte-arbitros-mundial-clubes-2020.html,Los guatemaltecos Mario Escobar y Humberto Panjoj serán parte de los árbitros que participarán en el Mundial de Clubes de la FIFA de Qatar 2020.,04-01-2021 17:07,https://www.bing.com/th?id=OVFT.fK7W08b8hks9SidzMpcjsC,Guatemala,Guatemala
Covid-19: Ejecutivo presenta hoy iniciativa de ley para compra directa de vacunas,https://republica.gt/2021/01/04/covid-19-ejecutivo-presenta-hoy-iniciativa-de-ley-para-compra-directa-de-vacunas/,"La ministra de Finanzas, Amelia Flores informó que este lunes presentarán al Congreso, la iniciativa para realizar las compras por excepción",04-01-2021 17:58,https://www.bing.com/th?id=OVFT.mx1h2-vJIZyFoV1Sue5-YS,Guatemala,Republica
"Largas colas por falta de logística, predominan en elección del CANG",https://lahora.gt/largas-colas-por-falta-de-logistica-predominan-en-eleccion-del-cang/,"Por Denis Aguilar daguilar@lahora.com.gt Alianza por las Reformas denunció en redes sociales que, en la Asamblea del Colegio de Abogados y Notarios de Guatemala (CANG) para elegir al nuevo magistrado",04-01-2021 18:09,https://www.bing.com/th?id=OVFT.zmS1wsnoRwf498oHzJUyui,Guatemala,La Hora
Abogados elige a su magistrado ante la Corte de Constitucionalidad,https://crnnoticias.com/abogados-elige-a-su-magistrado-ante-la-corte-de-constitucionalidad/,El Colegio de Abogados y Notarios de Guatemala -CANG- elige a su representante titular ante la Corte de Constitucionalidad.,04-01-2021 19:43,https://www.bing.com/th?id=OVFT.2g5G1YN-Yv8b38zYZ3JZ-C,Guatemala,CRN Noticias
Abogados eligen a su magistrado ante la Corte de Constitucionalidad,https://crnnoticias.com/abogados-eligen-a-su-magistrado-ante-la-corte-de-constitucionalidad/,El Colegio de Abogados y Notarios de Guatemala -CANG- elige a su representante titular ante la Corte de Constitucionalidad.,04-01-2021 19:44,https://www.bing.com/th?id=OVFT.2g5G1YN-Yv8b38zYZ3JZ-C,Guatemala,CRN Noticias
Inguat promoverá destinos turísticos en el marco del bicentenario,https://elmetropolitano.com.gt/es/2021/01/04/inguat-promovera-destinos-turisticos-en-el-marco-del-bicentenario/,"Esta conmemoración es propicia para realizar una serie de actividades y promover los destinos turísticos del país a nivel internacional, según las autoridades. En ese marco, el director del Instituto",04-01-2021 21:11,https://www.bing.com/th?id=OVFT.yKZTMVgfJUlWnqcX592a5i,Guatemala,El Metropolitano
Guatemala tiene otros 181 casos de covid-19 y dos decesos más,https://www.guatevision.com/historico/guatemala-tiene-otros-181-casos-de-covid-19-y-dos-decesos-mas-breaking,En las últimas horas se efectuaron 531 pruebas y se diagnosticaron 181 nuevos contagios de covid-19. El total de casos acumulados registrados en Guatemala es de 138 mil 656 desde que se reportó el pri,04-01-2021 21:19,https://www.bing.com/th?id=OVFT.rxyNBHDl-jbO68klHnY-AS,Guatemala,Guatevision
Posibles fechas para semifinales. Aunque Comunicaciones propone cancelar torneo,https://stereo100.com.gt/2021/posibles-fechas-para-semifinales-aunque-comunicaciones-propone-cancelar-torneo/,"Con información de ESPN Guatemala. Presidente de Comunicaciones FC, Juan García, pide que se cancele el torneo Apertura 2020 en la Liga Mayor del Fútbol de Guatemala y que se declare desierto, cuando",05-01-2021 00:39,https://www.bing.com/th?id=OVFT.IVG8haRwdhmVUK4gbHuIHy,Guatemala,Stereo 100
Así avanza el proceso de compra y llegada de la vacuna contra el coronavirus a Guatemala,https://www.guatevision.com/nacionales/asi-avanza-el-proceso-de-compra-y-llegada-de-la-vacuna-contra-el-coronavirus-a-guatemala,Autoridades dan a conocer los avances sobre las negociaciones para la compra de vacunas contra el coronavirus.,05-01-2021 02:58,https://www.bing.com/th?id=OVFT.LQjzZPOvkmOdMCenUe4EfS,Guatemala,Guatevision
Guatemala tiene 181 nuevos casos de Covid 19,https://www.chapintv.com/noticia/guatemala-tiene-181-nuevos-casos-de-covid-19/,El Ministerio de Salud reporta 181 nuevos casos de covid-19 detectados en las últimas 24 horas y 2 fallecidos más. El total de casos acumulados asciende a 138 mil 656.,05-01-2021 04:21,https://www.bing.com/th?id=OVFT.RR75d56gjk3JLt32TXFCGi,Guatemala,Chapin TV
Covid-19: medidas urgentes,https://www.prensalibre.com/opinion/columnasdiarias/covid-19-medidas-urgentes/,El año 2020 estuvo marcado por la pandemia global del covid-19. No hubo ámbito en el que no se sintieran sus devastadores efectos. Los costos en términos de vidas humanas y de afectaciones en la salud,05-01-2021 06:01,https://www.bing.com/th?id=OVFT.VaHO1UVfuEpuAUexKErWky,Guatemala,Prensa Libre
Viralizan los planos para insertar chips con las vacunas de la Covid-19 que resultan ser de un pedal de guitarra,https://elperiodico.com.gt/entretenimiento/insolito/2021/01/05/viralizan-los-planos-para-insertar-chips-con-las-vacunas-de-la-covid-19-que-resultan-ser-de-un-pedal-de-guitarra/,"Una de las teorías de la conspiración que ha crecido con la pandemia son los supuestos planes de Bill Gates para insertar chips con las vacunas de la Covid-19 a las personas, a quienes así podrá contr",05-01-2021 14:11,https://www.bing.com/th?id=OVFT.f7VvU0UxLEaF2yywiPh9ry,Guatemala,El Periódico Guatemala
Buscan adquirir más dosis contra el Covid-19,https://www.deguate.com/artman/publish/noticias-guatemala/Buscan-adquirir-mas-dosis-contra-el-Covid-19.shtml,"MSPAS pedirá al Congreso hacer compra directa de 2.5 millones de vacunas, además de los 3.3 millones que ya fueron solicitadas.",05-01-2021 15:34,https://www.bing.com/th?id=OVFT.7QEoVi9Q5KfPMf8Y7nE2tS,Guatemala,De Guate
IGM emitió 240 mil 673 pasaportes durante la pandemia,https://www.deguate.com/artman/publish/noticias-actualidad/IGM-emitio-240-mil-673-pasaportes-durante-la-pandemia.shtml,"El Instituto Guatemalteco de Migración (IGM) emitió el año pasado, bajo estrictas medidas de bioseguridad para evitar el contagio del Covid-19, 240 mil 673 pasaportes ordinarios.",05-01-2021 15:56,https://www.bing.com/th?id=OVFT.WgZsekB-P6Q4OnSryoUU2C,Guatemala,De Guate
Calendario de eventos deportivos para Guatemala en el 2021,https://www.guatemala.com/deportes/actualidad/calendario-de-eventos-deportivos-para-guatemala-en-el-2021.html,"Este es el calendario de todos los eventos deportivos para Guatemala en el 2021, a nivel nacional e internacional.",05-01-2021 16:15,https://www.bing.com/th?id=OVFT.M_fYNY-gbAiU3Q11mxNSCS,Guatemala,Guatemala
"Un año después de su aparición, la OMS investigará en China el origen del COVID-19",https://elperiodico.com.gt/noticias/internacionales/2021/01/05/un-ano-despues-de-su-aparicion-la-oms-investigara-en-china-el-origen-del-covid-19/,"Más de un año después de la aparición del nuevo coronavirus, un equipo de la Organización Mundial de la Salud (OMS) debería llegar a China este mes para investigar el origen de la pandemia.",05-01-2021 16:33,https://www.bing.com/th?id=OVFT.vTg4BVxQEmLjHLykVJuobi,Guatemala,El Periódico Guatemala
Covid-19: México inicia la próxima semana reparto de vacunas a sus estados,https://republica.gt/2021/01/05/mexico-inicia-reparto-de-vacunas-covid-19/,El Gobierno mexicano iniciará la distribución de vacunas de la covid-19 a todos los 32 estados del país a partir de la próxima semana,05-01-2021 16:34,https://www.bing.com/th?id=OVFT.zQ244T5EbCvWA22TKJBk0i,Guatemala,Republica
