name,url,description,datePublished,imagen,pais,Fuente
Gerardo Hernández asume como director del Hospital General San Juan de Dios,https://lahora.gt/gerardo-hernandez-asume-como-director-del-hospital-general-san-juan-de-dios/,"Por María España mespana@lahora.com.gt Como parte de la reestructuración del Ministerio de Salud Pública y Asistencia Social (MSPAS), esta mañana fue nombrado el doctor Gerardo David Hernández como nu",04-01-2021 05:00,https://www.bing.com/th?id=OVFT.9BOgxe-_GP4BZafvAEfSjS,Guatemala,La Hora
Mas carga tributaria,https://elsiglo.com.gt/2021/02/27/mas-carga-tributaria/,"Algunos guatemaltecos estan sufriendo la consecuencia de la pandemia del covid-19, ademas algunos han sido despedidos de sus empleos, o les han modificado su salario, por el impacto economico que se s",27-02-2021 14:29,https://www.bing.com/th?id=OVFT.5MlEdWp0tXQXZupR616UDC,Guatemala,Siglo Veintiuno
Guatemala supera el millar de personas vacunadas contra la covid-19,https://republica.gt/2021/02/27/guatemala-supera-el-millar-de-personas-vacunadas-contra-la-covid-19/,"Guatemala superó el millar de personas vacunadas contra el covid-19, tras la donación de 2 mil 500 inmunizadores de la farmacéutica Moderna.",27-02-2021 14:40,https://www.bing.com/th?id=OVFT.ywsOdKu4satlOhPMXpFUVy,Guatemala,Republica
Nuevo lote de vacunas donadas por la India iniciará a aplicarse este miércoles,https://elmetropolitano.com.gt/es/2021/03/01/nuevo-lote-de-vacunas-donadas-por-la-india-iniciara-a-aplicarse-este-miercoles/,Guatemala recibirá esta semana un nuevo lote de vacuna donadas por la India contra el coronavirus (COVID-19). Son 200 mil dosis destinadas a 100 mil trabajadores en primera línea. “El (próximo) 3 de m,01-03-2021 00:00,https://www.bing.com/th?id=OVFT.qmrxRAzRfypjFmMtoKSFUC,Guatemala,El Metropolitano
"COVID-19: Guatemala registra el 92,6 por ciento de pacientes recuperados",https://elmetropolitano.com.gt/es/2021/03/01/covid-19-guatemala-registra-el-926-por-ciento-de-pacientes-recuperados/,"En Guatemala el 92,6 por ciento de las personas contagiadas por coronavirus (COVID-19) se han recuperado desde que se registró la pandemia, informó el Ministerio de Salud Pública y Asistencia Social (",01-03-2021 00:00,https://www.bing.com/th?id=OVFT.-9kR2rLW8Q6g0I2XRBEL7C,Guatemala,El Metropolitano
"Vacunación continúa para personal de salud, mañana llegan 200 mil dosis donadas por India",https://lahora.gt/vacunacion-continua-para-personal-de-salud-manana-llegan-200-mil-dosis-donadas-por-india/,"Puede leer: Guatemala recibirá vacunas de cuatro farmacéuticas distintas; estudios aseguran efectividad MÁS DE 2 MIL TRABAJADORES DE SALUD HAN RECIBIDO PRIMERA DOSIS Según el Tablero Covid-19, ha sido suministrada la primera dosis de Moderna a 2,224 ...",01-03-2021 22:10,https://www.bing.com/th?id=OVFT.tJVXRP4_WaVBEmDKXmonOy,Guatemala,La Hora
Presidente Alejandro Giammattei coordina primera reunión de Sinaprese,https://www.deguate.com/artman/publish/noticias-guatemala/Presidente-Alejandro-Giammattei-coordina-primera-reunion-de-Sinaprese.shtml,Guatemala. “Tuvimos una reunión con las instituciones que ... que el descanso más grande del año estará nuevamente marcado por la pandemia del Covid-19. Debido a ello se analizó cuál es la situación de los destinos turísticos con base al tablero ...,01-03-2021 22:28,https://www.bing.com/th?id=OVFT.co-Dzenh3jJ1ZfZ3O-KQlS,Guatemala,De Guate
Nueve decesos por covid-19 de fechas anteriores reporta Salud y 111 nuevos casos,https://www.prensalibre.com/guatemala/comunitario/nueve-decesos-por-covid-19-de-fechas-anteriores-reporta-salud-y-111-nuevos-casos-breaking/,El Ministerio de Salud informa que en las últimas horas se practicaron 828 pruebas y se diagnosticaron 111 nuevos casos de covid-19. Los fines de semana disminuye la cantidad de pruebas que se efectúa,02-03-2021 00:34,https://www.bing.com/th?id=OVFT.GbT_9N_8zFccc_jAGldKNS,Guatemala,Prensa Libre
Maestros se contagian de covid-19 en escuela y obligan a Chinautla a suspender las clases presenciales,https://www.prensalibre.com/ciudades/huehuetenango/coronavirus-en-guatemala-maestros-se-contagian-de-covid-19-en-chiantla/,"Autoridades de salud coordinaron la suspensión de actividades presenciales en Chiantla, por nueve contagios de docentes.",02-03-2021 02:19,https://www.bing.com/th?id=OVFT.RaKNM2UVaLuD8MAxmvL7rC,Guatemala,Prensa Libre
Guatemala es el país con más fallecidos por COVID-19 en Centroamérica,https://crnnoticias.com/guatemala-supera-6-mil-400-decesos-por-covid-19/,"Guatemala es el país de Centroamérica con más muertes por COVID-19, estos son los datos que reporta el Ministerio de Salud.",02-03-2021 02:24,https://www.bing.com/th?id=OVFT.3lsiQtEPKwG5CT5NjevW0i,Guatemala,CRN Noticias
Hablamos con primera vacunada contra el Covid-19 en Guatemala,https://www.chapintv.com/noticia/hablamos-con-primera-vacunada-contra-el-covid-19-en-guatemala/,Equipo de Telediario conversó con enfermera del Hospital del Parque de la Industria sobre su experiencia Magdalena Guevara fue la primera vacunada contra el Covid-19 en nuestro país. La enfermera del,02-03-2021 13:43,https://www.bing.com/th?id=OVFT.sfkg0ILrUWsOcScyelBA1y,Guatemala,Chapin TV
La doble pandemia que azota a España: la Covid-19 y el socialismo que nos argentiniza,https://republica.gt/2021/03/02/la-doble-pandemia-que-azota-a-espana-la-covid-19-y-el-socialismo-que-nos-argentiniza/,"España sufre dos pandemias: La Covid-19 y el socialismo más intervencionista y menos socialdemócrata, que está mutando a pasos acelerados",02-03-2021 14:09,https://www.bing.com/th?id=OVFT.hD4m8R677xOwudLp8lWtty,Guatemala,Republica
Centroamérica y la inseguridad ciudadana,https://publicogt.com/2021/03/02/centroamerica-y-la-inseguridad-ciudadana/,"Centroamérica constituye el área más pobre y olvidada del subcontinente latinoamericano. La gran mayoría de la población mundial asocia la región con “países bananeros”, y eso es todo el conocimiento",02-03-2021 14:50,https://www.bing.com/th?id=OVFT.4ysJBghjI1gddpI9LfUDXC,Guatemala,Publico GT
Spike Lee prepara serie documental para el 20º aniversario del 11/9,https://elperiodico.com.gt/entretenimiento/cinetv/2021/03/02/spike-lee-prepara-serie-documental-para-el-20o-aniversario-del-11-9/,"El programa que se transmitirá a través de HBO y HBO Max, abarcará además de la recuperación de la ciudad después de los atentados, cómo se ha enfrentado la pandemia de covid-19.",02-03-2021 16:10,https://www.bing.com/th?id=OVFT.caN7b1X2xIbqxKiXRAhFKS,Guatemala,El Periódico Guatemala
Guatemala recibirá otro lote de vacunas contra el COVID-19,https://www.chapintv.com/noticia/guatemala-recibira-otro-lote-de-vacunas-contra-el-covid-19/,"Esta noche ingresará en un vuelo privado, las vacunas donadas por India. El Ministerio de Salud las empezará a distribuir mañana.",02-03-2021 17:15,https://www.bing.com/th?id=OVFT.C-mVjwvM5lxnrk-vbIHijS,Guatemala,Chapin TV
"Qué se conoce sobre Covishield, la vacuna contra el COVID-19 que viene de India",https://elperiodico.com.gt/nacionales/2021/03/02/que-se-conoce-sobre-covishield-la-vacuna-contra-el-covid-19-que-viene-de-india/,Las vacunas Covishield donadas por la India ingresan este martes a Guatemala. Un cargamento con 100 mil vacunas “Covishield / ChAdOx1nCoV-19 Corona Virus Vaccine – Recombinant” que fueron donadas por,02-03-2021 18:23,https://www.bing.com/th?id=OVFT.uGqOudSoGDG3EcqhPLzYFC,Guatemala,El Periódico Guatemala
Así se dividirán las vacunas contra el coronavirus donadas por la India,https://www.guatevision.com/nacionales/asi-se-dividiran-las-vacunas-contra-el-coronavirus-donadas-por-la-india,"Luego de que la vacunación contra el coronavirus comenzara el pasado jueves en cinco hospitales del país para vacunar a 2 mil 500 personas, solo tres han concluido con la vacunación de las dosis",02-03-2021 23:59,https://www.bing.com/th?id=OVFT.jzLdZxYVMFF2nqF70GD3eC,Guatemala,Guatevision
