name,url,description,datePublished,imagen,pais,Fuente
Presentan alternativas para el desarrollo de la primera infancia durante el Covid-19,https://newsinamerica.com/pdcc/gerenciales/2020/presentan-alternativas-para-el-desarrollo-de-la-primera-infancia-durante-el-covid-19,"Guatemala. En gran escala la niñez que vive en condiciones de pobreza esta expuesta a que su desarrollo integral se vea interrumpido desde su primera infancia, debido a la pandemia covid-19. ChildFund",04-07-2020 08:00,https://www.bing.com/th?id=ON.F6974B2241A3FFDEC76EB0075F94B355,Guatemala,Periódico Digital Centroamericano y del Caribe
COVID-19: Salud reporta 1 mil 221 nuevos contagios,https://lahora.gt/covid-19-salud-reporta-1-mil-221-nuevos-contagios/,"El Ministerio de Salud Pública y Asistencia Social (MSPAS), registró el día con más casos de COVID-19 en Guatemala, luego de que ayer se dieran un total de 1 mil 221 contagios nuevos, con lo que la ci",04-07-2020 13:48,https://www.bing.com/th?id=ON.7738A79ACBBD3E9EAB1FEAB0FA6221A7,Guatemala,La Hora
Muere por Covid-19 un trabajador del Tribunal Supremo Electoral,https://www.publinews.gt/gt/noticias/2020/07/04/muere-por-covid-19-trabajador-del-tse.html,"Un trabajador del Tribunal Supremo Electoral (TSE) falleció a causa del coronavirus Covid-19 el viernes 3 de julio de 2020, confirmó el ente electoral. “Lamentamos el fallecimiento a causa del Covid-1",04-07-2020 15:09,https://www.bing.com/th?id=ON.17D88696374612EA82B2A73605BEF9CE,Guatemala,Publinews
Un bebé de 2 años está entre los fallecidos reportados este viernes por coronavirus en Guatemala,https://www.guatevision.com/nacionales/un-bebe-de-2-anos-esta-entre-los-fallecidos-reportados-este-viernes-por-coronavirus-en-guatemala,El Ministerio de Salud informó que el cuadro clínico del menor reportado como fallecido por covid-19 este viernes se había agravado porque padecía de hidrocefalia. De acuerdo con el último reporte de,04-07-2020 18:26,https://www.bing.com/th?id=ON.328873F6160F27DD814C0EEF7E3A48FA,Guatemala,Guatevision
COVID-19 y Diabetes: Lo que tienes que saber,https://newsinamerica.com/pdcc/boletin/2020/covid-19-y-diabetes-lo-que-tienes-que-saber,"Control glicémico y una buena nutrición son factores esenciales para apoyar a las personas que viven con diabetes El coronavirus, COVID-19, es una enfermedad en la cual estamos aprendiendo en la medid",04-07-2020 19:01,https://www.bing.com/th?id=ON.DD3254B96F296753BD656534E900CB0F,Guatemala,Periódico Digital Centroamericano y del Caribe
Coprecovid: Guatemala (departamento) en pico alto; uso de mascarilla resulta clave,https://lahora.gt/coprecovid-guatemala-departamento-en-pico-alto-uso-de-mascarilla-resulta-clave/,"Debido al alto número de casos COVID-19 registrados en el departamento de Guatemala, el director de la Comisión Presidencial de Atención a la Emergencia Covid-19 (Coprecovid), Edwin Asturias, explicó",04-07-2020 20:58,https://www.bing.com/th?id=ON.A04A4040A2783255183A84E2E350FE8A,Guatemala,La Hora
360° a vuelo de pájaro,https://elperiodico.com.gt/nacion/2020/07/05/360-a-vuelo-de-pajaro-47-1/,China describe la nueva ley de seguridad de Hong Kong como una “espada de Damocles” colgando sobre los cuellos de sus más críticos estridentes. Pero el camino está escrito: está legislación amenaza a,05-07-2020 00:00,https://www.bing.com/th?id=ON.CE04D9216C3B398F44CF657D08C755C8,Guatemala,El Periódico Guatemala
Guatemala y Escuintla siguen reportando más casos de coronavirus,https://republica.gt/2020/07/05/guatemala-y-escuintla-siguen-reportando-mas-casos-de-coronavirus/,Este domingo se registran 747 nuevos casos del nuevo coronavirus Covid-19 en Guatemala. La cifra total de contagios llega a 23 mil 248. Del total de los contagios 18 mil 917 están activos y solo 3 mil,05-07-2020 00:00,https://www.bing.com/th?id=ON.E2011A66F8CE390425DA39FB6113374E,Guatemala,Republica
Guatemala suma 1 mil 208 casos de COVID-19 y llega a 22 mil 501,https://crnnoticias.com/guatemala-suma-1-mil-208-casos-de-covid-19-y-llega-a-22-mil-501/,Guatemala sumó 1 mil 208 nuevos casos de COVID-19 en las últimas 24 horas; 13 menos que los registrados este viernes y que significaron la cuota más alta de contagios en un solo día. El Ministerio de,05-07-2020 00:40,https://www.bing.com/th?id=ON.E7B85A24A238BE4BCC2581D675B50673,Guatemala,CRN Noticias
Guatemala alcanza 22 mil 501 casos desde el inicio de la pandemia,https://elperiodico.com.gt/nacion/2020/07/05/guatemala-alcanza-22-mil-501-casos-desde-el-inicio-de-la-pandemia/,"El país acumula 22 mil 501 casos positivos de COVID-19, de los cuales 18 mil 249 están activos y 3 mil 330 se han recuperado. Hasta ayer se registró un total de 920 fallecidos. Según el reporte del Mi",05-07-2020 06:34,https://www.bing.com/th?id=ON.F36F49B5FF2C1DD20417EB4B986B01E3,Guatemala,El Periódico Guatemala
La ética necesaria en cualquier función pública,https://elsiglo.com.gt/2020/07/05/la-etica-necesaria-en-cualquier-funcion-publica/,"A nivel global, incluyendo a Guatemala tenemos una crisis sanitaria causada por el Covid-19, una crisis económica que se avecina y por si fuera poco, en el país estamos a punto de llegar a una crisis",05-07-2020 13:44,https://www.bing.com/th?id=ON.93615D6DE90F5FE3244C67216F944D47,Guatemala,Siglo Veintiuno
Todo lo que tienes que saber del Covid-19 y la diabetes,https://republica.gt/2020/07/05/todo-lo-que-tienes-que-saber-del-covid-19-y-la-diabetes/,"El coronavirus, Covid-19, es una enfermedad de la cual estamos aprendiendo en la medida que la conocemos. Los profesionales de la salud han avanzado rápidamente para poder brindar las mejores formas d",05-07-2020 16:12,https://www.bing.com/th?id=ON.7D5EA9F6AF9FFB38E07B02767D90F42B,Guatemala,Republica
Guatemaltecos kaqchikeles celebran al amor con pequeñas bodas por la pandemia,https://www.guatevision.com/nacionales/departamentos/guatemaltecos-kaqchikeles-celebran-al-amor-con-pequenas-bodas-por-la-pandemia,"Con las manos juntas sobre las rodillas, Byron Caná escucha al alcalde de San Juan Comalapa, un municipio indígena kaqchikel, a unos 80 kilómetros al oeste de Ciudad de Guatemala, mientras su novia, V",05-07-2020 18:17,https://www.bing.com/th?id=ON.E0B05709BB97A5FC145BE528A04EB52D,Guatemala,Guatevision
MSPAS confirma este domingo más de 700 casos de COVID-19,https://stereo100.com.gt/mspas-confirma-este-domingo-mas-de-700-casos-de-covid-19/,"Este domingo, mediante una publicación en sus cuentas en redes sociales, el Ministerio de Salud Pública y Asistencia Social (MSPAS) informó de 747 nuevos casos de COVID-19 y 27 pacientes fallecidos. D",05-07-2020 20:40,https://www.bing.com/th?id=ON.17B68A3CD0F03BA132DA4E95DAB89A3B,Guatemala,Stereo 100
Mañana instalan los retenes en los ingresos a Xela,https://stereo100.com.gt/manana-instalan-los-retenes-en-los-ingresos-a-xela/,"A partir de mañana, las autoridades instalarán retenes en los ingresos principales a la ciudad de Quetzaltenango, debido al aumento de casos de COVID-19. El jefe de la Policía Municipal de Tránsito de",05-07-2020 21:12,https://www.bing.com/th?id=ON.71FAF6C357ED83DDD71400446FF0AD12,Guatemala,Stereo 100
Coronavirus en Guatemala: Así son las bodas en San Juan Comalapa durante la pandemia del covid-19,https://www.prensalibre.com/ciudades/chimaltenango/coronavirus-en-guatemala-asi-son-las-bodas-en-san-juan-comalapa-durante-la-pandemia-del-covid-19/,"Con las manos juntas sobre las rodillas, Byron Caná escucha al alcalde de San Juan Comalapa, un municipio indígena kaqchikel, a unos 80 kilómetros al oeste de Ciudad de Guatemala, mientras su novia, V",05-07-2020 22:23,https://www.bing.com/th?id=ON.6175A3C16D6D15E7F2739AF9B2A59519,Guatemala,Prensa Libre
Medidas de restricción por el Covid-19 se mantendrán igual para esta semana,https://www.publinews.gt/gt/noticias/2020/07/05/presidente-giammattei-no-brindara-mensaje-cadena-nacional-5-julio-2020.html,"La Secretaría de Comunicación de la Presidencia informó que este domingo el presidente de la República, Alejandro Giammattei, no brindaría mensaje en Cadena Nacional, como lo había acostumbrado cada d",06-07-2020 01:21,https://www.bing.com/th?id=ON.5C285F6F8C093190B08EA63B693EC6FE,Guatemala,Publinews
Coronavirus en Guatemala: Reportan 747 nuevos casos en el país y 27 fallecidos,https://www.prensalibre.com/guatemala/comunitario/coronavirus-en-guatemala-reportan-747-nuevos-casos-en-el-pais-y-27-fallecidos-breaking/,"El Ministerio de Salud Pública y Asistencia Social (MSPAS) reportó. 747 casos de coronavirus en el país, 52 recuperados y 27 fallecidos. Las autoridades indicaron que realizaron 1 mil 985 pruebas. De",06-07-2020 01:30,https://www.bing.com/th?id=ON.87AB12BCCD58741590ED80E6A1D55E33,Guatemala,Prensa Libre
