name,url,description,datePublished,imagen,pais,Fuente
Pocos pasajeros en ensayo de buses de rutas cortas extraurbanas,https://republica.gt/2020/08/29/pocos-pasajeros-en-ensayo-de-buses-de-rutas-cortas-extraurbanas/,"Hasta las 6:45 horas de este sábado, circularán los buses de rutas cortas de Villa Nueva, Villa Canales, San Miguel Petapa y Amatitlán, que participan en el primer ensayo para verificar el cumplimient",29-08-2020 00:00,https://www.bing.com/th?id=ON.E93FB6E198B94FC7FC7987560BC07659,Guatemala,Republica
Inguat y Camtur comparten plan de recuperación del turismo,https://republica.gt/2020/08/29/inguat-y-camtur-comparten-plan-de-recuperacion-del-turismo/,"Autoridades del Inguat y de la Cámara de Turismo de Guatemala (Camtur), comentan las acciones para recuperar el sector después de cinco meses de confinamiento. “La cadena de valor del sector turístico",29-08-2020 00:00,https://www.bing.com/th?id=ON.4B8305BAF21F5B5E807004CA62F61C1E,Guatemala,Republica
La Brigada Médico Cubana lleva 22 años llegando a donde el Estado no llega,https://publicogt.com/2020/08/28/la-brigada-medico-cubana-lleva-22-anos-llegando-a-donde-el-estado-no-llega/,"El 25 de agosto el diputado Felipe Alejos, de la bancada Todos, pidió al canciller Pedro Brolo expulsar a los más de 400 médicos cubanos que prestan atención a comunidades de 16 departamentos del país",29-08-2020 01:13,https://www.bing.com/th?id=ON.1FB1E8AB5FEE7AC666D8D8F0E8ECDC0F,Guatemala,Publico GT
Covid-19: Con 73 mil 679 casos cierra último fin de semana de agosto,https://www.publinews.gt/gt/noticias/2020/08/29/total-casos-coronavirus-guatemala-29-agosto.html,"Los casos por el SARS-CoV-2 continúan en aumento. El total de casos positivos acumulados es de 73 mil 679 para este sábado 29 de agosto. De ese total, 61 mil 163 se han recuperado del nuevo coronaviru",29-08-2020 07:37,https://www.bing.com/th?id=ON.C4A8C5040153B8A19D0370D2DEE466C3,Guatemala,Publinews
Coronavirus en Guatemala: 757 nuevos contagios y 19 personas más fallecen en las últimas horas por covid-19,https://www.prensalibre.com/guatemala/comunitario/coronavirus-en-guatemala-personas-fallecen-en-las-ultimas-horas-por-covid-19-breaking/,"Según las autoridades de Salud, Guatemala tiene 73 mil 679 casos totales registrados desde el 13 de marzo último, de los cuales 757 se detectaron en las últimas 24 horas. Con 19 personas más fallecida",29-08-2020 07:50,https://www.bing.com/th?id=ON.E5C0F19DF5D51C9518A869D94E47857A,Guatemala,Prensa Libre
Coprecovid evalúa ensayo del transporte extraurbano de rutas cortas,https://lahora.gt/coprecovid-evalua-ensayo-del-transporte-extraurbano-de-rutas-cortas/,"La Comisión Presidencial de Atención a la Emergencia COVID-19 (Coprecovid), verificó el ensayo del servicio de transporte extraurbano de rutas cortas, con el fin de que se garanticen las medidas de pr",29-08-2020 14:07,https://www.bing.com/th?id=ON.3051022147F1AD6FF33E3FF09F263876,Guatemala,La Hora
Brigada Médica Cubana continuará prestando servicios en Guatemala,https://newsinamerica.com/pdcc/boletin/2020/brigada-medica-cubana-continuara-prestando-servicios-en-guatemala,"La Ministra de Salud Pública y Asistencia Social de Guatemala, Amelia Flores, ratificó en días pasados que la Brigada Médica Cubana continuará prestando servicios de salud en Guatemala y el convenio q",29-08-2020 19:27,https://www.bing.com/th?id=ON.24CA2CCF0AE78A53928179E71284805C,Guatemala,Periódico Digital Centroamericano y del Caribe
Salud reporta más de 61 mil recuperados por COVID-19,https://emisorasunidas.com/2020/08/29/guatemala-salud-recuperados-covid19/,El tablero electrónico del Ministerio de Salud Pública y Asistencia Social (MSAPAS) reportó para este sábado 29 de agosto más de 61 mil guatemaltecos que se recuperaron de los efectos del COVID-19. Lo,29-08-2020 20:02,https://www.bing.com/th?id=ON.9923600CA7A0DAC81016B121B7764CC7,Guatemala,Emisoras Unidas
Volaris aplicará su reforzado protocolo de bioseguridad a partir del reinicio de operaciones,https://newsinamerica.com/pdcc/lineasaereas/2020/volaris-aplicara-su-reforzado-protocolo-de-bioseguridad-a-partir-del-reinicio-de-operaciones,"Volaris, la aerolínea de ultra bajo costo que opera en Centroamérica, México y Estados Unidos, informa que, una vez que se reinicien las operaciones de vuelos comerciales en países de Centroamérica,–",29-08-2020 20:09,https://www.bing.com/th?id=ON.53397768B47C23289D72E758AD47E73E,Guatemala,Periódico Digital Centroamericano y del Caribe
Guatemala reporta 73 mil 679 casos de coronavirus y suma 61 mil recuperados,https://www.guatevision.com/nacionales/guatemala-reporta-73-mil-679-casos-de-coronavirus-y-suma-61-mil-recuperados-breaking,"Guatemala ya suma más de 73 mil 500 contagios de coronavirus y más de 2 mil 700 muertes, desde el 13 de marzo del 2020, que se registró el primer caso. El tablero Covid-19 del Ministerio de Salud se a",29-08-2020 20:34,https://www.bing.com/th?id=ON.8FF893AF2618B8AC163C8046352042C3,Guatemala,Guatevision
COPRECOVID analiza protocolos en buses de rutas cortas,https://crnnoticias.com/coprecovid-analiza-protocolos-en-buses-extraurbanos-de-rutas-cortas/,"Autoridades del Gobierno y municipalidades se reunieron para analizar los protocolos de higiene usados por los buses extraurbanos de rutas cortas. Este lunes, los autobuses de los municipios del sur c",29-08-2020 21:29,https://www.bing.com/th?id=ON.B3DAEBF1A33896413DD3430857972CDF,Guatemala,CRN Noticias
Guatemala reporta una de cada tres muertes por COVID-19 en la región,https://elperiodico.com.gt/nacion/2020/08/29/guatemala-reporta-una-de-cada-tres-muertes-por-covid-19-en-la-region1/,La pandemia llegó a Centroamérica en los primeros 15 días de marzo y desde esa fecha los seis países del Istmo reportaron un incremento en el número de contagios del virus SARS-CoV-2 que provoca la CO,29-08-2020 23:58,https://www.bing.com/th?id=ON.3D48DF63C21BC2867672A7AA8A096398,Guatemala,El Periódico Guatemala
Pocas pruebas y se registra 233 nuevos casos de coronavirus,https://elmetropolitano.com.gt/es/2020/08/30/pocas-pruebas-y-se-registra-233-nuevos-casos-de-coronavirus/,"El Ministerio de Salud Pública y Asistencia Social (MSPAS) informó que el pasado sábado en el país se registraron 233 nuevos casos de coronavirus (COVID-19). El MSPAS, a través del tablero situación d",30-08-2020 00:00,https://www.bing.com/th?id=ON.FC4D8B757619EBDF622DC8EFA906ACE2,Guatemala,El Metropolitano
Guatemala reporta 233 nuevos casos de COVID-19 y 12 fallecidos,https://stereo100.com.gt/2020/guatemala-reporta-233-nuevos-casos-de-covid-19-y-12-fallecidos/,"Este domingo, el Ministerio de Salud Pública y Asistencia Social (MSPAS) informa de 233 nuevos casos de COVID-19 y 12 pacientes fallecidos. #AlertaCovid19 ⚠️ | El @MinSaludGuate informa que en las últ",30-08-2020 00:00,https://www.bing.com/th?id=ON.0DC935038A14A271A9DC706261696543,Guatemala,Stereo 100
Guatemala Bajo la Lupa,https://elperiodico.com.gt/nacion/2020/08/30/guatemala-bajo-la-lupa-98/,Trabajadores denuncian daño en máquinas para recolectar desechos del río Motagua.Un grupo de 35 trabajadores que se encarga de colectar los desechos que provienen del río Motagua denunciaron que la bi,30-08-2020 00:00,https://www.bing.com/th?id=ON.418F5A86AA935F5A5B933E7F22E8B7E0,Guatemala,El Periódico Guatemala
Coronavirus en Guatemala: Salud reporta 233 casos nuevos de covid-19 y 12 fallecidos más,https://www.prensalibre.com/guatemala/comunitario/coronavirus-en-guatemala-salud-reporta-233-casos-nuevos-de-covid-19-y-12-fallecidos-mas-breaking/,"El tablero Covid-19 del Ministerio de Salud se actualizó a las 10.45 horas de este domingo 30 de agosto con los datos del 29 de agosto hasta las 23.59 horas. Según las cifras, en las últimas 24 horas",30-08-2020 11:02,https://www.bing.com/th?id=ON.B3250C73FB738D94C84619B61CE0A377,Guatemala,Prensa Libre
Fundación Mano Amiga Guatemala activa ante la emergencia del COVID-19,https://www.deguate.com/artman/publish/comunidad_serviciosocial/Fundacion-Mano-Amiga-Guatemala-activa-ante-la-emergencia-del-COVID-19.shtml,"Guatemala, Ciudad. La Fundación Mano Amiga Guatemala, preocupados por la actual crisis mundial, diseñó una estrategia que coadyuvará a contrarrestar los efectos causados por la crisis económica y sani",30-08-2020 15:33,https://www.bing.com/th?id=ON.A4A46030AD0D075CD0E4FE02563541D1,Guatemala,De Guate
Guatemala reporta otros 233 casos de coronavirus y 12 fallecidos más,https://www.guatevision.com/nacionales/guatemala-reporta-otros-233-casos-de-coronavirus-y-12-fallecidos-mas-breaking,"Guatemala ya suma 73 mil 912 contagios de coronavirus y de 2 mil 740 muertes, desde el 13 de marzo del 2020, que se registró el primer caso. El tablero Covid-19 del Ministerio de Salud se actualizó a",30-08-2020 20:17,https://www.bing.com/th?id=ON.D54CF2797ADE8A35FD8843EB48544B45,Guatemala,Guatevision
"Grupo de delfines fue captado en video en Puerto San José, Escuintla",https://www.guatemala.com/noticias/vida/grupo-delfines-fue-captado-video-puerto-san-jose-escuintla.html,"¡Momento único! Un grupo de delfines fue captado en video en Puerto San José, Escuintla, te compartimos la grabación de este increíble avistamiento. Una vez más, las aguas del océano Pacífico de Guate",30-08-2020 21:14,https://www.bing.com/th?id=ON.8D6227C11ADC880E7607AE5A657EFBA6,Guatemala,Guatemala
Covid-19: Casos acumulados en el país suman 73 mil 912,https://www.publinews.gt/gt/noticias/2020/08/30/casos-coronavirus-guatemala-30-agosto-2020.html,Las autoridades del Ministerio de Salud dieron a conocer que el número de casos acumulados de Covid-19 en el país asciende a. Esta cifra surgió durante la jornada correspondiente al sábado 28 de agost,30-08-2020 22:05,https://www.bing.com/th?id=ON.30329C978D99E7FED1641F4290C2D442,Guatemala,Publinews
Los casos de COVID-19 en Guatemala llegan a 73 mil 912,https://crnnoticias.com/los-casos-de-covid-19-en-guatemala-llegan-a-73-mil-912/,"Los casos de COVID-19 en Guatemala llegaron este domingo a 73 mil 912 y las muertes a 2 mil 740, según datos del Ministerio de Salud Pública. En las últimas 24 horas, la cartera sanitaria reportó 233",30-08-2020 22:24,https://www.bing.com/th?id=ON.3FBC8CCA4498B44FC2ECC509117921F6,Guatemala,CRN Noticias
Largas filas para entrar al Zoológico pese al Covid-19,https://www.deguate.com/artman/publish/noticias-guatemala/largas-filas-para-entrar-al-zoologico-pese-al-covid-19.shtml,"Largas colas se hicieron en el ingreso, lo cual causó indignación en las redes sociales, debido a la falta de distanciamiento social que se observó. Ana Lucía Vásquez, gerente de Mercadeo del Zoológic",31-08-2020 01:07,https://www.bing.com/th?id=ON.4DFDCF11DD3E1A1B003FD2FE5AD5C3CF,Guatemala,De Guate
"Guatemala: 1,429 han muerto violentamente; reportan 6,186 denuncias por extorsión",https://lahora.gt/guatemala-1429-han-muerto-violentamente-reportan-6186-denuncias-por-extorsion/,"En los primeros siete meses de este año, 1 mil 429 personas han muerto violentamente en Guatemala, mientras que en el primer semestre las autoridades han recibido 6 mil 186 denuncias por extorsión. La",31-08-2020 01:12,https://www.bing.com/th?id=ON.7BFDB53120413C6E73799E57C81CB93C,Guatemala,La Hora
Continúan pruebas de protocolos por Covid-19 en transporte en Villa Nueva,https://emisorasunidas.com/2020/08/30/pruebas-transporte-villa-nueva/,"Este domingo continúan los procesos de prueba de protocolos por Covid-19 para la reactivación del transporte en el municipio de Villa Nueva, Guatemala. La fecha probable para reanudar el servicio es e",31-08-2020 04:13,https://www.bing.com/th?id=ON.0CF11D126A461FC89CA01C792D324737,Guatemala,Emisoras Unidas
