name,url,description,datePublished,imagen,pais,Fuente
Salud reporta 215 nuevos casos de COVID-19 y 1 mil 351 pruebas,https://lahora.gt/salud-reporta-215-nuevos-casos-de-covid-19-y-1-mil-351-pruebas/,"POR MARGARITA GIRÓN jgiron@lahora.com.gt Este día, el Ministerio de Salud Pública y Asistencia Social (MSPAS), realizó la actualización diaria de casos de COVID-19 en Guatemala. Según el reporte, 215",04-10-2020 15:03,https://www.bing.com/th?id=OVFT.CzJwhdpu7tmyuIR1VWLFBy,Guatemala,La Hora
Guatemala contabiliza 93 mil 963 casos de COVID-19,https://elperiodico.com.gt/nacion/2020/10/04/guatemala-contabiliza-93-mil-963-casos-de-covid-19/,El Ministerio de Salud Pública y Asistencia Social (MSPAS) reporta que desde el 13 de marzo que se registró el primer caso de COVID-19 en el país hasta el 4 de octubre se han reportado 93 mil 963 pers,04-10-2020 16:26,https://www.bing.com/th?id=OVFT.N5ln3DBewW6QSKrdmUf64i,Guatemala,El Periódico Guatemala
Ministerio de Salud actualiza datos de COVID-19 en Guatemala,http://www.chapintv.com/actualidad/ministerio-de-salud-actualiza-datos-de-covid-19-en-guatemala-310528,"El Ministerio de Salud Pública y Asistencia Social, MSPAS, informó para este domingo 04 de octubre de 2020 sobre los nuevos casos de COVID-19 confirmados en el país. Se registraron 215 nuevos casos de",04-10-2020 18:21,https://www.bing.com/th?id=OVFT.nS91HTYrNktDRbsrFh8cCS,Guatemala,Chapin TV
Agricultura impulsan huertos familiares comunitarios en San Juan Sacatepéquez,https://elmetropolitano.com.gt/es/2020/10/04/agricultura-impulsan-huertos-familiares-comunitarios-en-san-juan-sacatepequez/,"Es por ello que se inauguró el primer huerto familiar comunitario, en el caserío Joya de Las Flores, aldea Cruz Blanca, San Juan Sacatepéquez. Plantas. Al Consejo Comunitario d",04-10-2020 19:00,https://www.bing.com/th?id=OVFT.12FwHhYJnN_T_mzd8dPEwS,Guatemala,El Metropolitano
Recorrido virtual de Leyendas de Guatemala,https://republica.gt/2020/10/04/recorrido-virtual-de-leyendas-de-guatemala/,"Debido a la pandemia del covid-19, este año el Recorrido de Leyendas de Guatemala será virtual. La actividad se realizará los",04-10-2020 19:43,https://www.bing.com/th?id=OVFT.Ei3upKYE1i6Do4Jc1rWcay,Guatemala,Republica
Honduras responde a Guatemala y lamentan “las infortunadas declaraciones”,https://lahora.gt/honduras-responde-a-guatemala-y-lamentan-las-infortunadas-declaraciones/,"Por Lourdes Arana lcarana@lahora.com.gt La Secretaría de Relaciones Exteriores y Cooperación Internacional de Honduras, por medio de un comunicado se pronunció este domingo con respecto al mensaje dif",04-10-2020 19:44,https://www.bing.com/th?id=OVFT.b3OZw3nEiso06ds19qeeHi,Guatemala,La Hora
Guatemala registra 8 muertes por COVID-19 y 215 nuevos casos,https://crnnoticias.com/guatemala-registra-8-muertes-por-covid-19-y-215-nuevos-casos/,El Gobierno de Guatemala informó este domingo que en las últimas 24 horas se registraron ocho muertes por COVID-19 y 215 nuevos contagios por el coronavirus SARS-CoV-2. El país acumula un total de 2 m,04-10-2020 23:25,https://www.bing.com/th?id=OVFT._uGry4Itt3RBME2_u-lp-S,Guatemala,CRN Noticias
Situación de la pandemia,https://emisorasunidas.com/2020/10/04/mensaje-presidente-alejandro-giammattei-4-octubre-covid-19/,El presidente Alejandro Giammattei brindó un mensaje este domingo 4 de octubre con relación al impacto de la pandemia del Covid-19 en el país.,05-10-2020 02:09,https://www.bing.com/th?id=OVFT.JGb05odwjLurU5Xe5F06SS,Guatemala,Emisoras Unidas
Guatemala reporta 219 casos nuevos de coronavirus y nueve fallecidos por la epidemia,https://www.guatevision.com/nacionales/guatemala-reporta-219-casos-nuevos-de-coronavirus-y-nueve-fallecidos-por-la-epidemia-breaking,El tablero de casos de coronavirus del Ministerio de Salud se actualizó este lunes  5 de octubre con las cifras del 4 de octubre hasta las 23.59 horas. En las últimas 24 horas hubo 219 casos nuevos de,05-10-2020 15:20,https://www.bing.com/th?id=OVFT.8bDR6yRE8Mk1UsI88lFeoy,Guatemala,Guatevision
Guatemala podría alcanzar 5 mil 600 muertes por Covid-19 en enero de 2021,https://emisorasunidas.com/2020/10/05/guatemala-proyeccion-muertes-covid-19-2021/,"Edwin Asturias, titular de la Coprecovid, se refirió a la situación de la pandemia y reiteró el llamado para mantener las medidas de prevención.",05-10-2020 16:01,https://www.bing.com/th?id=OVFT.9Xi0Yv8uDFVdhaqTFo2nMy,Guatemala,Emisoras Unidas
Guatemala supera los 94 mil casos de COVID-19,https://stereo100.com.gt/2020/guatemala-supera-los-94-mil-casos-de-covid-19/,"Este lunes, el Ministerio de Salud Pública y Asistencia Social (MSPAS) dio a conocer la actualización de casos de COVID-19 en Guatemala. Según el MSPAS, en las últimas 24 horas, se registran 219 nuevo",05-10-2020 16:14,https://www.bing.com/th?id=OVFT.rflK9zTTybVfQuXvbRyeOy,Guatemala,Stereo 100
Un guatemalteco que llegó de Estados Unidos es el tercer caso de coronavirus detectado en el Aeropuerto La Aurora,https://www.prensalibre.com/guatemala/comunitario/un-guatemalteco-que-viajo-de-estados-unidos-es-el-tercer-caso-de-coronavirus-detectado-en-el-aeropuerto-la-aurora/,"Edwin Asturias, director de la Comisión Presidencial de Atención a la Emergencia Covid-19 (Coprecovid), informó este lunes 5 de octubre que ya se detectó el tercer caso de coronavirus en el Aeropuerto",05-10-2020 17:24,https://www.bing.com/th?id=OVFT.Eez6FazTWZ7AxEJkoZS_PS,Guatemala,Prensa Libre
Guatemala podría superar las 5 mil muertes por COVID-19 en enero de 2021,https://elperiodico.com.gt/nacion/2020/10/05/guatemala-podria-superar-las-5-mil-muertes-por-covid-19-en-enero-de-2021/,"“Se espera que los fallecimientos no lleguen a los más de 5 mil 660 al primero de enero, depende de cómo los guatemaltecos sigamos atendiendo las medidas de prevención, sigamos atendiendo las recomend",05-10-2020 17:27,https://www.bing.com/th?id=OVFT.Ipeu1ZXr0gyrBHYf8r_Qgy,Guatemala,El Periódico Guatemala
Estados Unidos agradece a Guatemala por mitigación del coronavirus y de la migración irregular,https://newsinamerica.com/pdcc/boletin/2020/estados-unidos-agradece-a-guatemala-por-mitigacion-del-coronavirus-y-de-la-migracion-irregular,"Guatemala. Estados Unidos mostró su agradecimiento a Guatemala por haber contribuido a la detención de la propagación del coronavirus (COVID-19) y, a su vez, la migración irregular. Michael G. Kozak,",05-10-2020 17:54,https://www.bing.com/th?id=OVFT.bXIOtrWIXcHoPc3ksa_X4S,Guatemala,Periódico Digital Centroamericano y del Caribe
En estos lugares se concentra la pandemia y a fin de año se podrían superar los 5 mil decesos,https://www.prensalibre.com/guatemala/comunitario/en-estos-lugares-se-concentra-la-pandemia-y-a-fin-de-ano-se-podrian-superar-los-5-mil-decesos/,La Coprecovid pide seguir atendiendo las medidas de prevención y las regulaciones que el Ministerio de Salud ha establecido.,05-10-2020 18:07,https://www.bing.com/th?id=OVFT.Pl_GvqvtoVYbV-ZCaLCmDC,Guatemala,Prensa Libre
Giammattei presenta su prueba negativa de covid-19,https://republica.gt/2020/10/05/giammattei-presenta-su-prueba-negativa-de-covid-19/,El presidente Alejandro Giammattei presentó el resultado negativo de su prueba de antígeno de covid-19. La prueba,05-10-2020 18:25,https://www.bing.com/th?id=OVFT.FCpWgyMjP5Q_FKL9Hw2-qS,Guatemala,Republica
Coronavirus: según proyecciones para enero 2021 podría haber más de 5 mil decesos,https://www.guatevision.com/nacionales/coronavirus-segun-proyecciones-para-enero-2021-podria-haber-mas-de-5-mil-decesos,"Según un modelo que la Universidad de Washington maneja para el país, se pronostica un aumento lento de la necesidad de camas en las próximas semanas y meses.",05-10-2020 18:26,https://www.bing.com/th?id=OVFT.NPcgPvQhB_R5mrbOG94c-S,Guatemala,Guatevision
Países que piden prueba de COVID-19 para ingresar a los guatemaltecos,https://www.guatemala.com/noticias/sociedad/paises-piden-prueba-covid-para-ingresar-guatemaltecos.html,"Estos son los países que piden prueba de COVID-19 PCR y antígeno antes de viajar a los guatemaltecos y a los que, por el momento, se puede ingresar.",05-10-2020 18:43,https://www.bing.com/th?id=OVFT.jPCKG0W_uD0QI_BV-DMcbC,Guatemala,Guatemala
Giammattei aparece luego de superar el coronavirus,https://crnnoticias.com/giammattei-aparece-luego-de-superar-el-coronavirus/,El presidente Alejandro Giammattei apareció en una actividad pública luego de superar el coronavirus. El mandatario fue diagnosticado como portador del virus el pasado 18 de septiembre y había permane,05-10-2020 18:55,https://www.bing.com/th?id=OVFT.yquwh97wXp1i19zYu8pOFi,Guatemala,CRN Noticias
Honduras abrirá de nuevo las fronteras,https://www.deguate.com/artman/publish/noticias-internacionales/Honduras-abrira-de-nuevo-las-fronteras.shtml,"Honduras abrirá las fronteras terrestres con El Salvador, Guatemala y Nicaragua entre el 9 y 12 de octubre, con el fin de reactivar el turismo y la economía, informó ayer la titular del Instituto Naci",05-10-2020 18:59,https://www.bing.com/th?id=OVFT.tZGk_L9n6pWS0DVNrt1Gki,Guatemala,De Guate
