name,url,description,datePublished,imagen,pais,Fuente
Bukele pide a los latinos en EE.UU. no votar por la congresista Norma Torres,https://crnnoticias.com/bukele-pide-a-los-latinos-en-ee-uu-no-votar-por-la-congresista-norma-torres/,"Lee también: Guatemala enfrenta la tercera ola de COVID-19 y los casos y muertes siguen en aumento Agregó que, a su juicio, “no trabaja para ustedes, sino para mantener a nuestros países en el subdesarrollo”. Espero que todos mis hermanos ...",02-04-2021 19:05,https://www.bing.com/th?id=OVFT.qEdwsw0p_k0yh6q5B0dWaC,Guatemala,CRN Noticias
"Continúa primera fase de vacunación contra el COVID-19, no se deje engañar por falsas convocatorias",https://elmetropolitano.com.gt/es/2021/04/03/continua-primera-fase-de-vacunacion-contra-el-covid-19-no-se-deje-enganar-por-falsas-convocatorias/,El Ministerio de Salud Pública y Asistencia Social (MPSAS) continúa la primera fase de vacunación contra el coronavirus (COVID-19) y llamó a los adultos ... Hay que recordar que el problema que afronta Guatemala es que la producción de vacunas las ...,03-04-2021 00:00,https://www.bing.com/th?id=OVFT.60Vj02AJP201St5b8nYOfC,Guatemala,El Metropolitano
Los cinco kilómetros de dolor y penitencia para los católicos en Guatemala,https://republica.gt/2021/04/03/los-cinco-kilometros-de-dolor-y-penitencia-para-los-catolicos-en-guatemala/,"una ruta de aproximadamente cinco kilómetros para pedir perdón por sus pecados en un poblado al noroeste de Guatemala La tradición local de los gateadores, suspendida en 2020 por la covid-19, retomó su actividad como cada Viernes Santo en el municipio ...",03-04-2021 13:31,https://www.bing.com/th?id=OVFT.jn-BWa-8hQxr-gSzD0XMLS,Guatemala,Republica
"Con menos de 3 mil pruebas, Salud registra 203 casos nuevos de Covid-19 en Viernes Santo",https://lahora.gt/con-menos-de-3-mil-pruebas-salud-registra-203-casos-nuevos-de-covid-19-en-viernes-santo/,"Por María España mespana@lahora.com.gt El Ministerio de Salud Pública y Asistencia Social (MSPAS) registró 203 nuevos casos de Covid-19 en 2,483 pruebas en las últimas 24 horas. Con esta actualización",03-04-2021 23:10,https://www.bing.com/th?id=OVFT.tekhWTJAuCGXZqc0lbUmvi,Guatemala,La Hora
De nuevo adultos mayores buscan ser vacunados; Salud reitera que continúa Fase 1,https://lahora.gt/de-nuevo-adultos-mayores-buscan-ser-vacunados-salud-reitera-que-continua-fase-1/,"Por María España mespana@lahora.com.gt Desde tempranas horas de este sábado, cientos personas de la tercera edad acudieron al puesto de vacunación ubicado en el barrio Gerona, zona 1 de la Ciudad de G",03-04-2021 23:14,https://www.bing.com/th?id=OVFT.G5VM3nyWY9yaZSzFeoxR5S,Guatemala,La Hora
Semáforo de Alertas Covid-19: crece positividad y número de municipios en rojo aumenta a 110,https://www.guatevision.com/nacionales/semaforo-de-alertas-covid-19-crece-positividad-y-numero-de-municipios-en-rojo-aumenta-a-110-breaking,"El Ministerio de Salud actualizó este Sábado de Gloria el Semáforo de Alertas covid-19, donde se observa que el número de ... Respecto del departamento de Guatemala, la capital continúa en naranja, al igual que Santa Catarina Pinula, San José Pinula ...",04-04-2021 02:13,https://www.bing.com/th?id=OVFT.nqLLgZPlsH7_tskwXm0qlS,Guatemala,Guatevision
"Coronavirus en Guatemala: con otra baja en pruebas, se detectan 203 contagios nuevos",https://www.guatevision.com/nacionales/coronavirus-en-guatemala-con-otra-baja-en-pruebas-se-detectan-203-contagios-nuevos-breaking,"El Ministerio de Salud actualizó este Sábado de Gloria, 3 de abril, el tablero de casos covid-19 y reportó 203 contagios nuevos. También informó que nueve personas fallecieron en fechas anteriores y no se registró ninguna muerte en las últimas 24 horas.",04-04-2021 04:03,https://www.bing.com/th?id=OVFT._hzEFVQTGCZakun61HLNGC,Guatemala,Guatevision
Barricadas vecinales en Caracas para frenar al coronavirus,https://elperiodico.com.gt/noticias/internacionales/2021/04/04/barricadas-vecinales-en-caracas-para-frenar-al-coronavirus/,"Las personas de la comunidad que se encargan de dirigir los programas del Gobierno ponen en riesgo su salud, al igual que muchos médicos en esta pandemia.",04-04-2021 14:35,https://www.bing.com/th?id=OVFT.dUs9-BkJZNDQJemAP0-gOS,Guatemala,El Periódico Guatemala
