name,url,description,datePublished,imagen,pais,Fuente
Guatemala se acerca a los 100 mil casos de COVID-19,https://stereo100.com.gt/2020/guatemala-se-acerca-a-los-100-mil-casos-de-covid-19/,"Este jueves, el Ministerio de Salud Pública y Asistencia Social (MSPAS) dio a conocer la actualización de casos de COVID-19 en Guatemala. El MSPAS indicó que, en las últimas 24 horas, se registran 671",15-10-2020 15:11,https://www.bing.com/th?id=OVFT._hyVCm3OLEFcpxWmhYOO7C,Guatemala,Stereo 100
GT registra 671 casos nuevos de COVID-19; 7 mil 381 contagios siguen activos,https://lahora.gt/gt-registra-671-casos-nuevos-de-covid-19-7-mil-381-contagios-siguen-activos/,"Por Denis Aguilar daguilar@lahora.com.gt El Ministerio de Salud Pública y Asistencia Social (MSPAS) reportó este día 671 casos nuevos de COVID-19 en Guatemala, con lo que ahora la cifra de casos activ",15-10-2020 15:38,https://www.bing.com/th?id=OVFT.AVKFYXnrPXOS2M4hEDEXFy,Guatemala,La Hora
Coronavirus: Reportan 671 nuevos casos,https://radiotgw.gob.gt/coronavirus-reportan-671-nuevos-casos/,TGW Digital – El Ministerio de Salud Pública y Asistencia Social (MSPAS) informa este 15 de octubre que en las últimas 24 horas se han confirmado 671 nuevos casos de COVID-19. De acuerdo al,15-10-2020 17:06,https://www.bing.com/th?id=OVFT.WZ5rJHFVdo4j0Fnu9Lztby,Guatemala,TGW
Guatemala reporta 23 fallecidos por COVID-19,https://elperiodico.com.gt/nacionales/uncategorized/2020/10/15/guatemala-reporta-23-fallecidos-por-covid-19/,"El Ministerio de Salud Pública y Asistencia Social (MSPAS) actualizó el tablero de la situación del COVID-19 en el país, el cual registró en los datos de las últimas 24 horas un total de 23 personas f",15-10-2020 17:08,https://www.bing.com/th?id=OVFT.pG3Rb6RummU6xG7ltbXPbS,Guatemala,El Periódico Guatemala
Cursos de vacaciones de deportes 2020 en la Ciudad de Guatemala,https://www.guatemala.com/deportes/actualidad/cursos-de-vacaciones-deportes-2020-ciudad-guatemala.html,¡Se viene el fin de año! Disfruta de la mejor manera tu descanso e inscribe a tus hijos a los cursos de vacaciones de deportes que ofrecen para 2020.,15-10-2020 17:39,https://www.bing.com/th?id=OVFT.KH9xwr9JxAR0ZiN-p1PF-i,Guatemala,Guatemala
COVID-19: Autoridades de Salud revelan nuevos datos en el país,https://www.chapintv.com/2020/10/15/covid19-jueves-guatemala/,"Ministerio de Salud Pública y Asistencia Social entregó nuevos datos de casos de COVID-19 en Guatemala, siendo estos los siguientes números:",15-10-2020 20:49,https://www.bing.com/th?id=OVFT.JvvfGrVFnLZnDhJELQDVcS,Guatemala,Chapin TV
Avianca incrementa su oferta de vuelos desde y hacia Guatemala,https://newsinamerica.com/pdcc/boletin/2020/avianca-incrementa-su-oferta-de-vuelos-desde-y-hacia-guatemala,"En octubre la aerolínea cuenta con 13 operaciones directas semanales hacía Bogotá, El Salvador y Los Ángeles. Además, ofrece conexiones a varios destinos en Centroamérica y Estados Unidos, vía el hub",15-10-2020 20:50,https://www.bing.com/th?id=OVFT.o0GQuZE57duw6vk4OcI0ui,Guatemala,Periódico Digital Centroamericano y del Caribe
Centroamérica y República Dominicana avanzan hacia la recuperación del turismo post COVID-19,https://newsinamerica.com/pdcc/economia/2020/bcie-y-kfw-firman-contrato-de-prestamo-por-us100-0-millones-para-impulsar-la-reactivacion-economica-en-la-region-centroamericana,"Honduras. El Banco Centroamericano de Integración Económica (BCIE) y la Cooperación Financiera Alemana, a través del KfW, suscribieron un contrato de préstamo por US$100.0 millones de dólares para fin",15-10-2020 22:34,https://www.bing.com/th?id=OVFT.3JflmKVj5L2yXLSkeT-LHi,Guatemala,Periódico Digital Centroamericano y del Caribe
"Plan “Guatemala no se detiene”, la apuesta para reactivar la economía",https://republica.gt/2020/10/15/plan-guatemala-no-se-detiene-la-apuesta-para-reactivar-la-economia/,El plan “Guatemala no se detiene” es la apuesta del presidente Alejandro Giammattei para rescatar la economía del país,15-10-2020 22:45,https://www.bing.com/th?id=OVFT.LUu3z4tLA9cAcXRsc_XiBC,Guatemala,Republica
Anuncian horarios de misas presenciales en la Catedral Metropolitana,https://emisorasunidas.com/2020/10/15/horarios-misas-catedral-metropolitana-covid-19/,"La Catedral Metropolitana dio a conocer que a partir de este 18 de octubre se reanudarán las misas presenciales, bajo medidas de prevención por el Covid-19.",15-10-2020 23:43,https://www.bing.com/th?id=OVFT.Dkcj6ypDI4wSls1qZ2brqi,Guatemala,Emisoras Unidas
Giammattei dice que lo están atacando más que Jimmy Morales y con mentiras,https://www.deguate.com/artman/publish/noticias-guatemala/giammattei-dice-que-lo-estan-atacando-mas-que-jimmy-morales-y-con-mentiras.shtml,"Según Giammattei, ni su antecesor Jimmy Morales fue tan criticado como él y lo peor de todo es que con mentiras,",16-10-2020 00:25,https://www.bing.com/th?id=OVFT.I8xeUVaMXqigd2BQZ_C1cC,Guatemala,De Guate
Conoce el recorrido para la 60 Vuelta Ciclística a Guatemala 2020,https://republica.gt/2020/10/15/conoce-el-recorrido-para-la-60-vuelta-ciclistica-a-guatemala-2020/,La 60 edición de la Vuelta Ciclística a Guatemala arrancará el próximo 23 de octubre. Para este 2020 se recorrerán 16,16-10-2020 01:11,https://www.bing.com/th?id=OVFT.moTtKmPjtJlEPc4TTPHaHC,Guatemala,Republica
Guatemala celebrará vuelta ciclística bajo medidas sanitarias por coronavirus,https://www.guatevision.com/deportes/deporte-nacional/guatemala-celebrara-vuelta-ciclistica-bajo-medidas-sanitarias-por-covid-19,"La Federación de Ciclismo de Guatemala (FCG) realizará del 23 de octubre al 1 de noviembre próximos la 60 edición de la vuelta internacional al país, bajo estrictas medidas sanitarias por la",16-10-2020 04:13,https://www.bing.com/th?id=OVFT.52z7ejrUPieYx3L2C709EC,Guatemala,Guatevision
Rebrote de COVID-19 castiga a las Bolsas,https://elperiodico.com.gt/economia/2020/10/16/rebrote-de-covid-19-castiga-a-las-bolsas/,"En el ánimo de los inversores también han pesado los últimos tropezones en el desarrollo de vacunas y tratamientos contra el COVID-19, los malos datos de empleo en EE. UU. y la convicción, cada vez má",16-10-2020 07:15,https://www.bing.com/th?id=OVFT.X9vfYPFFfnIi_p1skub2dC,Guatemala,El Periódico Guatemala
Guatemala alcanza los 100 mil casos de coronavirus,https://emisorasunidas.com/2020/10/16/casos-coronavirus-guatemala-16-octubre-2020/,Las autoridades del Ministerio de Salud Pública brindaron la actualización de datos por casos de coronavirus correspondiente para el viernes 16 de octubre.,16-10-2020 14:05,https://www.bing.com/th?id=OVFT.QEMExGdap-LE8wInmPhUyS,Guatemala,Emisoras Unidas
Guatemala supera los 100 mil casos de COVID-19,https://stereo100.com.gt/2020/guatemala-supera-los-100-mil-casos-de-covid-19/,"Este viernes, el Ministerio de Salud Pública y Asistencia Social (MSPAS) informó, en sus cuentas en redes sociales, que Guatemala supera los 100 mil casos de COVID-19 y los 3 mil 400 pacientes falleci",16-10-2020 14:46,https://www.bing.com/th?id=OVFT.mWGdfLWPEzuIgTip0HtnbC,Guatemala,Stereo 100
Guatemala supera los 100 mil casos de coronavirus y se mantiene cifra de más de 20 muertos en 24 horas,https://www.guatevision.com/nacionales/guatemala-supera-los-100-mil-casos-de-coronavirus-y-se-mantiene-cifra-de-mas-de-20-muertos-en-24-horas-breaking,"El Tablero de la situación del coronavirus en Guatemala fue actualizado este viernes 16 de octubre del 2020, con los datos del 15 de octubre hasta las 23.59 horas. En las últimas 24 horas hubo 666 cas",16-10-2020 15:07,https://www.bing.com/th?id=OVFT.JCuHLi5hSDaGWl8zyB8paC,Guatemala,Guatevision
Guatemala alcanza los 100 mil casos totales de COVID-19,https://www.chapintv.com/noticia/guatemala-alcanza-los-100-mil-casos-totales-de-covid-19/,"De acuerdo a las cifras del Ministerio de Salud Pública y Asistencia Social, Guatemala acumula un total de 100 mil 431 casos de contagiados de COVID-19.",16-10-2020 15:14,https://www.bing.com/th?id=OVFT.KGgNdW2fx1r1VJhmVshQ2S,Guatemala,Chapin TV
"Tras 666 casos nuevos, Guatemala supera los 100 mil contagios de COVID-19",https://lahora.gt/tras-666-casos-nuevos-guatemala-supera-los-100-mil-contagios-de-covid-19/,"Por Denis Aguilar daguilar@lahora.com.gt El Ministerio de Salud Pública y Asistencia Social (MSPAS) informó que ayer se registraron 666 casos nuevos de COVID-19, con lo que cifra acumulada de contagio",16-10-2020 15:17,https://www.bing.com/th?id=OVFT.FNwotIny64QY31JJKMvcwC,Guatemala,La Hora
Salud supera las 5 mil pruebas de COVID-19 procesadas en un día,https://elmetropolitano.com.gt/es/2020/10/16/salud-supera-las-5-mil-pruebas-de-covid-19-procesadas-en-un-dia/,El Ministerio de Salud Pública y Asistencia Social (MSPAS) superó este miércoles las 5 mil pruebas de coronavirus (COVID-19) procesadas en todo el país. Según la actualizacin,16-10-2020 15:50,https://www.bing.com/th?id=OVFT.qYH1M7S9DdBZmFkD4DCeFS,Guatemala,El Metropolitano
Guatemala es el menos afectado en caída de la tasa del crecimiento económico,https://elmetropolitano.com.gt/es/2020/10/16/guatemala-es-el-menos-afectado-en-caida-de-la-tasa-del-crecimiento-economico/,El Banco de Guatemala (Banguat) aseguró que el país fue el menos afectado en la caída de la tasa del crecimiento económico durante la pandemia del coronavirus (COVID-19) en América Latina. “Vamos a se,16-10-2020 16:04,https://www.bing.com/th?id=OVFT.YJouuQyYWl09TpWAe6kGAS,Guatemala,El Metropolitano
MINTRAB realizó 104 denuncias de solicitudes irregulares de suspensión de contratos por motivo del Estado de Calamidad,https://radiotgw.gob.gt/mintrab-realizo-104-denuncias-de-solicitudes-irregulares-de-suspension-de-contratos-por-motivo-del-estado-de-calamidad/,"TGW Digital – Desde el 01 de julio del presente año, la actual administración del Ministerio de Trabajo y Previsión Social  ha realizado 104 denuncias ante el Ministerio Público contra igual",16-10-2020 16:26,https://www.bing.com/th?id=OVFT.BXLc9M0y5yeRp1Fx3qBIYC,Guatemala,TGW
