name,url,description,datePublished,imagen,pais,Fuente
Guatemala celebra sus 199 años de independencia,https://elmetropolitano.com.gt/es/2020/09/15/guatemala-celebra-sus-199-anos-de-independencia/,El Gobierno de Guatemala celebró este lunes el cumplimiento de los 199 años de la independencia de la Corona española con un acto en la Plaza de la Constitución.La plaza y el Palacio Nacional de la Cu,15-09-2020 22:32,https://www.bing.com/th?id=OVFT.XMsLq1K1k8SPpizX7KdcBy,Guatemala,El Metropolitano
Juez de Tribunal de Sentencia fallece por complicaciones de salud,https://www.prensalibre.com/guatemala/justicia/juez-de-tribunal-de-sentencia-fallece-por-complicaciones-de-salud/,El juez Juan Antonio Aceituno López del Tribunal de Sentencia Penal de Delitos de Extorsión murió por complicaciones de salud. El Organismo Judicial (OJ) informó en un tuit que lamentan el sensible fa,15-09-2020 23:41,https://www.bing.com/th?id=OVFT.Hmum6nA_IKqsxsk2Ii4Hiy,Guatemala,Prensa Libre
Exportaciones farmacéuticas crecen 10 por ciento en medio de la pandemia,https://elperiodico.com.gt/uncategorized/2020/09/16/exportaciones-farmaceuticas-crecen-10-por-ciento-en-medio-de-la-pandemia/,"Las exportaciones farmacéuticas de Guatemala crecieron un 10 por ciento en el primer semestre de este año en comparación con el mismo periodo del año pasado, empujado por vitaminas y productos para pr",16-09-2020 00:00,https://www.bing.com/th?id=OVFT.4_a7q9QEKDRpYOpkFK-IjC,Guatemala,El Periódico Guatemala
"BCIE, TaiwanICDF y la DFC suscriben carta de interés para promover el ...",https://newsinamerica.com/pdcc/economia/2020/bcie-taiwanicdf-y-la-dfc-suscriben-carta-de-interes-para-promover-el-crecimiento-economico-de-la-region-centroamericana,"Honduras. En el marco de un diálogo estratégico, el Banco Centroamericano de Integración Económica (BCIE), el Fondo de Cooperación y Desarrollo Internacional (TaiwanICDF) y la US Corporación Financier",16-09-2020 02:21,https://www.bing.com/th?id=OVFT.9yLDOmgXD_EBtedMtSeLfi,Guatemala,Periódico Digital Centroamericano y del Caribe
Etiqueta: 3 MIL MUERTES,https://lahora.gt/tag/3-mil-muertes/,"Por Denis Aguilar daguilar@lahora.com.gtLas cifras de COVID-19 en Guatemala indican que hasta la fecha se han registrado 2 mil 984 fallecidos, además de que",16-09-2020 06:22,https://www.bing.com/th?id=OVFT.rsM-0962rYieMY1tJF229C,Guatemala,La Hora
Quince guatemaltecos galardonados en República Dominicana,http://www.chapintv.com/actualidad/guatemala-reporta-512-casos-nuevos-de-covid-19-307612,Reconocimiento a su apoyo durante la pandemia. Quince guatemaltecos fueron galardonados en República Dominicana por apoyo durante pandemia del COVID-19. Conozca los detalles al respecto en el siguient,16-09-2020 09:15,https://www.bing.com/th?id=OVFT.rsGBPBJNX0pU_GByskf1ui,Guatemala,Chapin TV
En marcha repetidora de Radio Nacional TGW en Escuintla,https://radiotgw.gob.gt/en-marcha-repetidora-de-radio-nacional-tgw-en-escuintla/,"TGW Digital – El Director de Radiodifusión y Televisión Nacional, Licenciado Francisco Polanco, fue parte de la celebración de los 90 años de Radio Nacional TGW, ¡La Voz de Guatemala! Polanco conversó",16-09-2020 14:10,https://www.bing.com/th?id=OVFT.a-DH7-haXvDuvWxjEBbdlC,Guatemala,TGW
Casos totales de coronavirus en Guatemala suben a casi 83 mil y van más de 3 mil muertes,https://www.guatevision.com/nacionales/casos-totales-de-coronavirus-en-guatemala-suben-a-casi-83-mil-y-van-mas-de-3-mil-muertes-breaking,"Guatemala acumuló 82 mil 924 casos de coronavirus, desde el 13 de marzo cuando se dio a conocer sobre el primer contagio de covid-19 en el país. Este 16 de septiembre, el tablero de covid-19 se actual",16-09-2020 14:59,https://www.bing.com/th?id=OVFT.K4SJwy_PVZ80ucGq6iluLS,Guatemala,Guatevision
Conmemoran a víctimas del COVID-19 en atípica celebración de independencia,https://crnnoticias.com/conmemoran-a-victimas-del-covid-19-en-atipica-celebracion-de-independencia/,"En una atípica celebración de los 199 años de independencia de Guatemala, ayer en Quetzaltenango, se homenajeó a las víctimas del COVID-19. Las veladoras, un minuto de silencio, consternación, preocup",16-09-2020 15:08,https://www.bing.com/th?id=OVFT.xoG75G9Mp1vJUP5y77ZYvi,Guatemala,CRN Noticias
Las universidades y centros de capacitación serían los primeros en volver a clases presenciales,https://www.guatevision.com/nacionales/las-universidades-y-centros-de-capacitacion-serian-los-primeros-en-volver-a-clases-presenciales-breaking366482,"La Coprecovid asegura que trabajan en protocolos para reabrir estos centros de estudio y que en octubre se tendrían los del regreso seguro a clases de preprimaria, primaria y secundaria. Edwin Asturia",16-09-2020 16:38,https://www.bing.com/th?id=OVFT.zqr8Pa-2Qfs9ZhCoi3aJZS,Guatemala,Guatevision
MSPAS presenta actualización de datos de COVID-19 en el Guatemala,http://www.chapintv.com/actualidad/mspas-presenta-actualizacion-de-datos-de-covid-19-en-el-guatemala-307698,"Autoridades del Ministerio de Salud y Asistencia Social brindaron esta mañana una nueva actualización de datos, estos corresponden hasta el miercoles 15 de septiembre, reflejando los siguientes result",16-09-2020 16:42,https://www.bing.com/th?id=OVFT.5SUrroYYl1hvB_HTfWrhjS,Guatemala,Chapin TV
Guatemala supera las 3 mil muertes por COVID-19,https://crnnoticias.com/guatemala-supera-las-3-mil-muertes-por-covid-19/,"Guatemala superó este miércoles la cifra de los 3 mil fallecidos a consecuencia del COVID-19, luego de sumar otras 25 muertes; además de 240 nuevos contagios tras realizar 696 pruebas. Según la última",16-09-2020 16:57,https://www.bing.com/th?id=OVFT.4XZaAOXK66CUhyuff_Fe3y,Guatemala,CRN Noticias
Colombia autoriza la reapertura gradual de los vuelos internacionales,https://republica.gt/2020/09/16/colombia-autoriza-la-reapertura-gradual-de-los-vuelos-internacionales/,El Gobierno colombiano autorizó este martes la reapertura gradual de vuelos internacionales a partir del próximo 21 de septiembre desde cuatro ciudades tras una suspensión de casi seis meses debido a,16-09-2020 17:19,https://www.bing.com/th?id=OVFT.Aiv_KYtVELfRXq6K1Tbrsi,Guatemala,Republica
Mi Carrito Express: Ciclista Manolo Castro comenzó con emprendimiento de entrega a domicilio,https://www.guatemala.com/deportes/actualidad/mi-carrito-express-ciclista-manolo-castro-comenzo-emprendimiento-entrega-domicilio.html,"Conoce más detalles acerca de Mi Carrito Express, un emprendimiento de entrega a domicilio que lanzó el ciclista guatemalteco Manolo Castro. Con el objetivo de evitar aglomeraciones y adquirir de form",16-09-2020 17:21,https://www.bing.com/th?id=OVFT.0R17pzEgXgJYAz8wsBwLJy,Guatemala,Guatemala
Coprecovid pide cautela: Guatemala (Departamento) muestra un detenimiento en curva de casos,https://lahora.gt/coprecovid-pide-cautela-guatemala-departamento-muestra-un-detenimiento-en-curva-de-casos/,"El director de la Comisión Presidencial de Atención al COVID-19 (Coprecovid), Edwin Asturias, dijo este día a los medios de comunicación que, el departamento de Guatemala se encuentra en una meseta co",16-09-2020 18:32,https://www.bing.com/th?id=OVFT.XjDbQiuxkSq7O1TRoSr11C,Guatemala,La Hora
"Director General de Radiodifusión, Francisco Polanco, recibe a medios de comunicación en el 90 aniversario de TGW",https://radiotgw.gob.gt/director-general-de-radiodifusion-francisco-polanco-recibe-a-medios-de-comunicacion-en-el-90-aniversario-de-tgw/,"TGW Digital – Director General de Radiodifusión, Francisco Polanco, recibió a medios de comunicación en el 90 aniversario de TGW. En su despacho, Polanco habló con algunos periodistas con respecto al",16-09-2020 21:03,https://www.bing.com/th?id=OVFT.4IAE1EkQ-jCee7XXFkjSei,Guatemala,TGW
Colecta Nacional de Alimentos busca beneficiar a familias guatemaltecas con comida,https://www.guatemala.com/noticias/sociedad/colecta-nacional-de-alimentos-busca-beneficiar-familias-guatemaltecas-con-comida.html,"La Colecta Nacional de Alimentos 2020 busca beneficiar a familias guatemaltecas en condiciones de pobreza y afectadas por el Covid-19 con comida. La Colecta Nacional de Alimentos, es una iniciativa de",16-09-2020 21:29,https://www.bing.com/th?id=OVFT.5JsYWUcdegtm-9QoBhMdgS,Guatemala,Guatemala
Universidades y centros de capacitación serán los primeros en retomar actividades,https://republica.gt/2020/09/16/universidades-reabriran-en-guatemala-luego-de-pandemia-del-covid-19/,"Los estudiantes de las universidades deberán preparar su vuelta a las aulas. El director ejecutivo de la Comisión Presidencial de Atención a la Emergencia Covid (Coprecovid), Edwin Asturias, anunció e",16-09-2020 21:38,https://www.bing.com/th?id=OVFT.ZkF_yqYGh-PWd40DL-23Ni,Guatemala,Republica
Exportaciones farmacéuticas de Guatemala crecen un 10% en medio pandemia,https://emisorasunidas.com/2020/09/16/exportaciones-farmaceuticas-guatemala-pandemia/,"Las exportaciones farmacéuticas de Guatemala crecieron un 10% en el primer semestre de este año en comparación con el mismo periodo del año pasado, empujado por vitaminas y productos para proteger el",16-09-2020 22:21,https://www.bing.com/th?id=OVFT.gePBWieiJWxnvPOpYlqqfC,Guatemala,Emisoras Unidas
Guatemala principal proveedor de productos farmacéuticos en Centroamérica,https://newsinamerica.com/pdcc/economia/2020/guatemala-principal-proveedor-de-productos-farmaceuticos-en-centroamerica,La industria farmacéutica de Guatemala se ha posicionado como el principal exportador y proveedor de productos farmacéuticos en la región por su competitividad y liderazgo. En 2020 se conformó el subs,16-09-2020 23:09,https://www.bing.com/th?id=OVFT.nuQ9MhQREP63KuwwmsMhKS,Guatemala,Periódico Digital Centroamericano y del Caribe
Exportaciones farmacéuticas de Guatemala crecen un 10 por ciento en medio pandemia,https://elperiodico.com.gt/nacion/2020/09/16/exportaciones-farmaceuticas-de-guatemala-crecen-un-10-por-ciento-en-medio-pandemia/,"Las exportaciones farmacéuticas de Guatemala crecieron un 10% en el primer semestre de este año en comparación con el mismo periodo del año pasado, empujado por vitaminas y productos para proteger el",16-09-2020 23:14,https://www.bing.com/th?id=OVFT.XrICcL-O2f7_jG6iDi03xi,Guatemala,El Periódico Guatemala
Giammattei afirma que no habrá cierre total en Guatemala el 18 de septiembre,https://www.prensalibre.com/guatemala/politica/giammattei-afirma-que-no-habra-habra-cierre-total-en-guatemala-el-18-de-septiembre/,A través de un mensaje en Twitter el gobernante expresó que la información se divulga desde los canales oficiales. Guatemala mantiene la reapertura económica y social de forma gradual desde finales de,17-09-2020 00:56,https://www.bing.com/th?id=OVFT.kcIz0m35xRXCLC0Wk6JjaC,Guatemala,Prensa Libre
