name,url,description,datePublished,imagen,pais,Fuente
EntreCultura 154: La Cuaresma y Semana Santa en pandemia,https://crnnoticias.com/entrecultura-154-la-cuaresma-y-semana-santa-en-pandemia/,"#EntreCultura La Semana Santa es una época especial, hasta para quedarte en casa; y aprovechar los días de descanso para realizar tareas pendientes.",16-03-2021 17:13,https://www.bing.com/th?id=OVFT.kwQnUt0PJnE0GZjUQ6dBVy,Guatemala,CRN Noticias
Guatemala registra otras 21 muertes y 971 casos positivos de la COVID-19,https://elperiodico.com.gt/nacionales/2021/03/16/guatemala-registra-otras-21-muertes-y-971-casos-positivos-de-la-covid-19/,"Guatemala acumula en un año de pandemia 183 mil 985 casos positivos de coronavirus, de los cuales 8 mil 237 están aún activos.",16-03-2021 19:48,https://www.bing.com/th?id=OVFT.fUP_38x6Uy2JUD02xAoF8i,Guatemala,El Periódico Guatemala
Mineduc: Hay 113 casos de covid-19 en escuelas y colegios,https://republica.gt/2021/03/16/mineduc-113-casos-positivos-covid19-escuelas-colegios-guatemala/,"El Ministerio de Educación contabiliza 113 casos positivos de covid-19 en las escuelas y colegios del país. Así como, 11 casos sospechosos.",16-03-2021 20:11,https://www.bing.com/th?id=OVFT.QrwaQveKR0LpijnSCq96uy,Guatemala,Republica
"Drástica disminución del precio de mascarillas, ¿A qué se debe?",https://stereo100.com.gt/2021/drastica-disminucion-del-precio-de-mascarillas-a-que-se-debe/,"Por Carlos González | En abril de 2020, cuando el Gobierno de Guatemala decretó el uso obligatorio de la mascarilla para prevenir contagios de COVID-19, los costos se incrementaron por la alta demanda",16-03-2021 21:02,https://www.bing.com/th?id=OVFT.uMOC9_wUW6nKVAn0PlZd0i,Guatemala,Stereo 100
Vacunan contra el COVID-19 a personal de hospitales privado,https://crnnoticias.com/vacunan-contra-el-covid-19-a-personal-de-hospitales-privado/,"El Ministerio de Salud vacunó contra el COVID-19 al personal del IGSS de la sede de Pamplona, así como de centros privados.",16-03-2021 21:15,https://www.bing.com/th?id=OVFT.mU9aPink7mmNRYmZB-kfLS,Guatemala,CRN Noticias
Guatemala reporta 971 nuevos casos de COVID-19,https://stereo100.com.gt/2021/guatemala-reporta-971-nuevos-casos-de-covid-19/,"Por Luis Hernández | Este martes, el Ministerio de Salud Pública y Asistencia Social (MSPAS) reporta en las útimas 24 horas, en Guatemala, 971 nuevos casos de COVID-19. En el informe publicado en rede",16-03-2021 21:27,https://www.bing.com/th?id=OVFT.H_9ssmth6dcSyFGvuWOfwy,Guatemala,Stereo 100
Vacunas contra el covid-19: lo que se sabe sobre la supuesta normativa de Salud para la importación privada,https://www.prensalibre.com/guatemala/comunitario/vacunas-contra-el-covid-19-lo-que-se-sabe-sobre-la-supuesta-normativa-de-salud-para-la-importacion-privada/,"inmunizar a todo el personal de primera línea contra el covid-19 -118 mil 972-, y avanzar hacia la segunda fase -24 mil 328 personas-. Pero en ese contexto han surgido contingencias asociadas a la vacuna de AstraZeneca -de las cuales Guatemala ha recibido ...",16-03-2021 23:26,https://www.bing.com/th?id=OVFT.6u56pIBYxwqph_v7ec3TNS,Guatemala,Prensa Libre
Coronavirus: Qué se sabe sobre la supuesta normativa para la importación privada de vacunas,https://www.guatevision.com/nacionales/coronavirus-que-se-sabe-sobre-la-supuesta-normativa-para-la-importacion-privada-de-vacunas,"inmunizar a todo el personal de primera línea contra el covid-19 -118 mil 972-, y avanzar hacia la segunda fase -24 mil 328 personas-. Pero en ese contexto han surgido contingencias asociadas a la vacuna de AstraZeneca -de las cuales Guatemala ha recibido ...",17-03-2021 05:32,https://www.bing.com/th?id=OVFT.8Hj9iK1F8mJZs6C3ydACZS,Guatemala,Guatevision
Espejo italiano,https://lahora.gt/espejo-italiano/,"Algunos directores de hospitales nacionales expresaron ayer su preocupación por lo que ven como el aumento de casos de Covid-19 en Guatemala, situación que atribuyen a un relajamiento de las medidas d",17-03-2021 14:36,https://www.bing.com/th?id=OVFT.rQBmPakEq_KWj36T_WuyQS,Guatemala,La Hora
Salud protege a comadronas de todo el país,https://www.deguate.com/artman/publish/salud_breves/Salud-protege-a-comadronas-de-todo-el-pais.shtml,"Las comadronas han jugado un papel fundamental en la atención pre y posnatal, y actualmente su labor se extiende en la prevención, control y erradicación del coronavirus en las áreas rurales.",17-03-2021 16:17,https://www.bing.com/th?id=OVFT.X69FZj9oJsyADklOT6lq4y,Guatemala,De Guate
Gabriela Molina ganó segundo lugar en la carrera The Coastal Challenge 2021 en Costa Rica,https://www.guatemala.com/deportes/atletismo/gabriela-molina-gano-segundo-lugar-carrera-the-coastal-challenge-2021-costa-rica.html,La atleta guatemalteca Gabriela Molina ganó el segundo lugar de la carrera de expedición The Coastal Challenge 2021 que se celebró en Costa Rica.,17-03-2021 16:39,https://www.bing.com/th?id=OVFT.BzSkAJSDPkvYM4s8arRKRS,Guatemala,Guatemala
"Fecha y hora del partido Islas Vírgenes Británicas vs. Guatemala, Eliminatorias a Qatar 2022",https://www.guatemala.com/deportes/futbol-guatemalteco/fecha-hora-partido-islas-virgenes-britanicas-vs-guatemala-eliminatorias-qatar-2022.html,"Eliminatorias a Qatar 2022: Conoce la fecha y hora en que se estará disputando el partido Islas Vírgenes Británicas vs. Guatemala, en Curazao.",17-03-2021 19:09,https://www.bing.com/th?id=OVFT.mCxvCmizAP0Bg8mDDaKiTy,Guatemala,Guatemala
Tablero de Salud reporta otros 949 casos de covid-19 y 20 fallecidos de fechas anteriores,https://www.prensalibre.com/guatemala/comunitario/tablero-de-salud-reporta-otros-949-casos-de-covid-19-y-20-fallecidos-de-fechas-anteriores-breaking/,"La cifra total de casos acumulados registrados es de 184 mil 934, según los datos de Salud. Según los datos, en las últimas horas no se registró ningún deceso por la enfermedad, aunque de fechas anter",17-03-2021 19:52,https://www.bing.com/th?id=OVFT.Abw3Pj77zCvAOLMFOkvZlC,Guatemala,Prensa Libre
En las últimas horas Guatemala registra 949 casos más de covid-19 y 20 decesos de fechas anteriores,https://www.guatevision.com/nacionales/en-las-ultimas-horas-guatemala-registra-949-casos-mas-de-covid-19-y-20-decesos-de-fechas-anteriores-breaking,"De 5 mil 932 pruebas efectuadas en laboratorios públicos y privados, se detectaron 949 nuevos casos de covid-19. La cifra total de casos acumulados ... aunque de fechas anteriores se reportaron 20 fallecidos. Guatemala en un año de emergencia por la ...",17-03-2021 19:52,https://www.bing.com/th?id=OVFT.6AvUEhJyGaAlecWvu2ZNFy,Guatemala,Guatevision
Facultad de derecho de la USAC realiza actividades huelgueras en plena pandemia,https://elperiodico.com.gt/nacionales/2021/03/17/facultad-de-derecho-de-la-usac-realiza-actividades-huelgueras-en-plena-pandemia/,Las actividades de la Huelga de Dolores fueron suspendidas en marzo de 2020 por la emergencia sanitaria. El Comité de Huelga de la facultad de Derecho de la Universidad de San Carlos de Guatemala (USA,17-03-2021 20:03,https://www.bing.com/th?id=OVFT.CO2TDMVm1XU8WgeKGWqbCy,Guatemala,El Periódico Guatemala
Guatemala ha vacunado a 55 mil personas contra el covid-19,https://republica.gt/2021/03/17/guatemala-ha-vacunado-a-55-mil-personas-contra-el-covid-19/,"Guatemala, hasta ayer, había vacunado a 55 mil personas contra el covid-19, según informó la ministra de Salud, Amelia Flores.",17-03-2021 20:27,https://www.bing.com/th?id=OVFT.FUIYlCD2Fur0C1re1RbWZC,Guatemala,Republica
"COVID-19: En 5,932 pruebas, Salud confirma 949 casos nuevos",https://lahora.gt/covid-19-en-5932-pruebas-salud-confirma-949-casos-nuevos/,"POR MARÍA ESPAÑA mespana@lahora.com.gt El Ministerio de Salud Pública y Asistencia Social (MSPAS) registró en las últimas 24 horas, 949 casos nuevos de Covid-19 en 5,932 pruebas, sumando un total de 1",17-03-2021 20:45,https://www.bing.com/th?id=OVFT.uOsIPb35qjssGA_pFKlTfS,Guatemala,La Hora
