name,url,description,datePublished,imagen,pais,Fuente
Salud: “Concentración de muertes por de Covid-19 es en el departamento de Guatemala”,https://crnnoticias.com/salud-concenracion-de-muertes-por-covid-19-es-en-guatemala/,La vacunación contra el COVID-19 continúa dirigida a la Fase 1 del #PlanVacunaCOVID19. En el Puesto de Vacunación de Gerona #Guatemala se vacunó al personal de rescate de @CRGuatemalteca. pic.twitter.com/fhHyIDFnAK — Ministerio de Salud Pública ...,19-03-2021 14:00,https://www.bing.com/th?id=OVFT.otJm3nk31SKiexTh_ctQGy,Guatemala,CRN Noticias
Definen seis mesas de desarrollo,https://www.deguate.com/artman/publish/noticias-guatemala/Definen-seis-mesas-de-desarrollo.shtml,"“Los jefes ediles han venido para darle seguimiento a sus proyectos y preguntarle a los ministros y a sus equipos cómo van. Además, tratar de apostarle a proyectos de salud, e",19-03-2021 15:36,https://www.bing.com/th?id=OVFT.Vc7MWTAUwTo8mt9N6lsshC,Guatemala,De Guate
Se reportan 908 nuevos casos de Covid-19 en Guatemala,https://www.chapintv.com/noticia/se-reportan-908-nuevos-casos-de-covid-19-en-guatemala/,"Las autoridades del Ministerio de Salud Pública dieron a conocer que se han reportado 908 nuevos contagiados con coronavirus, mientras que 24 personas han fallecido en las últimas 24 horas.",19-03-2021 16:58,https://www.bing.com/th?id=OVFT.dp-qwdApelX11EZOIk3a0S,Guatemala,Chapin TV
Salud confirma 908 casos más de COVID-19,https://elperiodico.com.gt/nacionales/2021/03/19/salud-confirma-908-casos-mas-de-covid-19/,"Foto: Jesús Alfonso /elPeriódico. El Ministerio de Salud y Asistencia Social (MSPAS) informó que ayer 18 de marzo se diagnosticaron 908 casos nuevos de COVID-19, se ejecutaron",19-03-2021 17:27,https://www.bing.com/th?id=OVFT.yOBhNImS-vZkSjZvck6qiy,Guatemala,El Periódico Guatemala
MSPAS registra 908 nuevos casos de COVID-19 en Guatemala,https://stereo100.com.gt/2021/mspas-registra-908-nuevos-casos-de-covid-19-en-guatemala/,"Por Luis Hernández | Este viernes, mediante una publicación en redes sociales, el Ministerio de Salud Pública y Asistencia Social (MSPAS) informó que en las últimas 24 horas, en Guatemala, se registra",19-03-2021 17:41,https://www.bing.com/th?id=OVFT.QM4UDsHQeGJIgCfFdXYi4i,Guatemala,Stereo 100
México aplica plan de restricción fronteriza con Guatemala,https://www.chapintv.com/noticia/mexico-aplica-plan-de-restriccion-fronteriza-con-guatemala/,"Las autoridades de la Secretaría de Relaciones Exteriores de México determinaron restringir el paso de ciudadanas y ciudadanos guatemaltecos, debido a la emergencia sanitaria por el Covid-19.",19-03-2021 19:11,https://www.bing.com/th?id=OVFT.ouaziHjMk1vRa-vV9uTp_i,Guatemala,Chapin TV
Próxima semana llegan 2.7 millones de vacunas prestadas por EU: Ebrard,https://newsinamerica.com/pdcc/generales/2021/proxima-semana-llegan-2-7-millones-de-vacunas-prestadas-por-eu-ebrard/,"Amplia cobertura que brinda a nuestros lectores la información que necesitan para estar actualizados del acontecer centroamericano, caribeño y latinoamericano.",19-03-2021 21:26,https://www.bing.com/th?id=OVFT.b3yR7xflyyZNyOHu4K-4xi,Guatemala,Periódico Digital Centroamericano y del Caribe
Semáforo de alertas covid-19 se actualiza con repunte de municipios en rojo,https://www.prensalibre.com/guatemala/comunitario/semaforo-de-alertas-covid-19-se-actualiza-con-repunte-de-municipios-en-rojo/,Ministerio de Salud actualiza el semáforo de alerta de covid-19 y este refleja un incremento en el número de municipios en rojo.,20-03-2021 04:24,https://www.bing.com/th?id=OVFT.id9jaTqVR8LRY_KlnbJtsy,Guatemala,Prensa Libre
Semáforo COVID-19: Aumentan municipios y departamentos en alerta roja,https://lahora.gt/semaforo-covid-19-aumentan-municipios-y-departamentos-en-alerta-roja/,Por María Jossé España mespan@alahora.com.gt El incremento de casos Covid-19 ha sido evidenciado en la última actualización del Sistema de Alertas Sanitarias del Ministerio de Salud Pública y Asistenc,20-03-2021 13:51,https://www.bing.com/th?id=OVFT.ojABsCbkEcj9FtkQaOklUy,Guatemala,La Hora
Guatemala supera el millón de pruebas realizadas de covid-19,https://republica.gt/2021/03/20/guatemala-pruebas-covid-19-realizadas-supera-millon/,"Guatemala superó el millón de pruebas de covid-19 desde que se registró el primer caso el 13 de marzo de 2020. Tanto en el sector púbico como en el privado, el total es de 1 millón 002 mil 099 hisopados a nivel nacional. De acuerdo con las ...",20-03-2021 14:41,https://www.bing.com/th?id=OVFT.cD6k8ohXcHMTyZhPoIKhVi,Guatemala,Republica
Galería: Guatemaltecos visitan las playas antes de Semana Santa,https://elperiodico.com.gt/nacionales/2021/03/21/galeria-guatemaltecos-visitan-las-playas-antes-de-semana-santa/,"En pleno aumento de casos positivos de COVID-19, las playas del Pacífico, entre ellas el puerto de San José, se llenaron de visitantes este fin de semana, previo a la celebración de Semana Santa. Ayer",21-03-2021 22:46,https://www.bing.com/th?id=OVFT.imQQVo8rl_WfR1vq4Cd2oC,Guatemala,El Periódico Guatemala
En las últimas horas se diagnosticaron 252 casos de covid-19 y el total de fallecidos es de 6 mil 700,https://www.prensalibre.com/guatemala/comunitario/en-las-ultimas-horas-se-diagnosticaron-252-casos-de-covid-19-y-el-total-de-fallecidos-es-de-6-mil-700-breaking/,"Es común que los fines de semana disminuya la cantidad de pruebas para detectar covid-19, pues en las últimas horas se practicaron 1 mil 640, cuando en un día hábil se superan las 5 mil o 6 mil. El ta",21-03-2021 23:04,https://www.bing.com/th?id=OVFT.psFntQiNz4gejjw0y9WUkC,Guatemala,Prensa Libre
Guatemala tiene otros 252 casos de coronavirus y Salud reporta 15 fallecidos de días anteriores,https://www.guatevision.com/nacionales/guatemala-tiene-otros-252-casos-de-coronavirus-y-salud-reporta-15-fallecidos-de-dias-anteriores-breaking,"La cifra de casos recuperados estimados es de 171 mil 405, según Salud. Es común que los fines de semana disminuya la cantidad de pruebas para detectar covid-19, pues en las últimas horas se practicar",21-03-2021 23:05,https://www.bing.com/th?id=OVFT._pjK8j4F5Bvpbs_GYjkB2S,Guatemala,Guatevision
Alarma: Quinto días consecutivos con más de 900 casos positivos de Covid -19,https://elmetropolitano.com.gt/es/2021/03/21/alarma-quinto-dias-consecutivos-con-mas-de-900-casos-positivos-de-covid-19/,"En el tablero situación de COVID-19 en Guatemala se compartieron los datos. Se trata de las pruebas practicadas el pasado 19 de marzo. En el territorio nacional se procesaron 5 mil 754 pruebas de coronavirus, de las cuales 919 resultaron positivas.",21-03-2021 23:50,https://www.bing.com/th?id=OVFT.wJJr_OmQS8UV1RHfeARJVC,Guatemala,El Metropolitano
Guatemala contabiliza 15 decesos por COVID-19 y 252 contagios en 24 horas,https://crnnoticias.com/guatemala-contabiliza-15-decesos-por-covid-19-y-252-contagios-en-24-horas/,Guatemala sumó 15 muertes por COVID-19 y 252 nuevos casos en las últimas 24 horas; por lo tanto el país suma 7 mil decesos a causa del virus.,22-03-2021 01:02,https://www.bing.com/th?id=OVFT.bo99gsNDElTbebnWBkV4mS,Guatemala,CRN Noticias
Iglesia Católica demanda equidad en vacuna contra el covid-19 y pide se trabaje por los derechos de los migrantes,https://www.guatevision.com/nacionales/iglesia-catolica-demanda-equidad-en-vacuna-contra-el-covid-19-y-pide-se-trabaje-por-los-derechos-de-los-migrantes,"Iglesia señala que es urgente que la humanidad tome conciencia de su responsabilidad para luchar por una sociedad más justa y solidaria. La Conferencia Episcopal de Guatemala (CEG) emitió un comunicado para arzobispos, obispos, sacerdotes ...",22-03-2021 04:12,https://www.bing.com/th?id=OVFT.CqKbQEMREeCnZCRalpEpYy,Guatemala,Guatevision
