name,url,description,datePublished,imagen,pais,Fuente
"Jocotenango en casa, conozca cómo adquirir los tradicionales platillos de la Feria",https://lahora.gt/jocotenango-en-casa-conozca-como-adquirir-los-tradicionales-platillos-de-la-feria/,"Cada 15 de agosto, así como los días previos, siempre han sido espacios para que los capitalinos acudan a la tradicional Feria de Jocotena ngo en zona 2, sin embargo, este año por la emergencia del Co",14-08-2020 02:00,https://www.bing.com/th?id=ON.623843EA5D2335CC7CFA5B38448C9EA1,Guatemala,La Hora
"COVID-19: casos activos siguen en aumento (9,638); GT alcanza los 60 mil infectados",https://lahora.gt/covid-19-casos-activos-siguen-en-aumento-9638-gt-alcanza-los-60-mil-infectados/,"Según los datos del Ministerio de Salud Pública y Asistencia Social (MSPAS), publicados en el tablero de situación del COVID-19 en Guatemala, el país ha superado los 60 mil casos confirmados a cinco m",14-08-2020 03:45,https://www.bing.com/th?id=ON.04DC4C1FA431980A30E822D851D099D5,Guatemala,La Hora
Giammattei: “Garantizar la salud de los guatemaltecos es una prioridad”,https://www.publinews.gt/gt/noticias/2020/08/14/guatemala-giammattei-salud-vacuna.html,"El presidente, Alejandro Giammattei, afirmó que el país gestiona con cuatro naciones la obtención de una vacuna contra el COVID-19. Dichas naciones realizan investigaciones para determinar el medicame",14-08-2020 04:50,https://www.bing.com/th?id=ON.A82C6F2F0DB4AFAE2AFC54A6A80595E9,Guatemala,Publinews
Guatemala amanece con 1 mil 144 casos nuevos por Covid-19,https://www.publinews.gt/gt/noticias/2020/08/14/guatemala-casos-coronavirus-14-agosto-2020.html,"El personal de salud que esta semana se instaló en el Congreso de la República ha realizado más de mil hisopados a diputados y trabajadores. Se desconoce el número de casos positivos. Sin embargo, el",14-08-2020 07:42,https://www.bing.com/th?id=ON.B6F95C539D265255599292C0A3BE587D,Guatemala,Publinews
Vendedores del mercado La Terminal de Chimaltenango regalaron verduras para los necesitados,https://www.guatemala.com/noticias/sociedad/vendedores-mercado-terminal-chimaltenango-regalaron-verduras-para-necesitados.html,Varios vendedores del mercado La Terminal de Chimaltenango regalaron verduras a guatemaltecos que más lo necesitan ante la emergencia del COVID-19. ¡Por más actos de solidaridad como estos! Vendedores,14-08-2020 14:07,https://www.bing.com/th?id=ON.1A21336915DD348A846978988F3CBB3B,Guatemala,Guatemala
Colomba cuenta con Centro de Atención Permanente de Salud,https://elmetropolitano.com.gt/es/2020/08/14/colomba-cuenta-con-centro-de-atencion-permanente-de-salud/,"El presidente de Guatemala, Alejandro Giammattei, entregó hoy el Centro de Atención Permanente (CAP) para la atención de la población de Colomba, Quetzaltenango. “Este no es un centro temporal que des",14-08-2020 16:16,https://www.bing.com/th?id=ON.5B4D337300E87DE2E7ED46124258683C,Guatemala,El Metropolitano
Se reporta mil 195 casos nuevos de COVID-19,https://elmetropolitano.com.gt/es/2020/08/14/se-reporta-mil-195-casos-nuevos-de-covid-19/,"El Ministerio de Salud Pública y Asistencia Social (MSPAS) registró el miércoles 12 de agosto mil 195 casos nuevos de coronavirus (COVID-19) en el país. Desde las cero a las 23:59 horas de ayer, en el",14-08-2020 16:16,https://www.bing.com/th?id=ON.DE1ADEE4E21F3722E3760DD5A2B34FA6,Guatemala,El Metropolitano
Guatemala reporta 1 mil 144 nuevos casos de COVID-19 y 45 fallecidos,https://stereo100.com.gt/2020/guatemala-reporta-1-mil-144-nuevos-casos-de-covid-19-y-45-fallecidos/,"Este viernes, el Ministerio de Salud Pública y Asistencia Social (MSPAS) informa que en el país, en las últimas 24 horas, se registran 1 mil 144 nuevos casos de COVID-19 y 45 fallecidos. #AlertaCovid1",14-08-2020 16:50,https://www.bing.com/th?id=ON.0DC6716F4F071CFA95035390237C518F,Guatemala,Stereo 100
Guatemala reporta 1 mil 144 casos nuevos de coronavirus y 45 fallecidos,https://www.guatevision.com/nacionales/guatemala-reporta-1-mil-144-casos-nuevos-de-coronavirus-y-45-fallecidos-breaking,"Los datos de los nuevos contagios de coronavirus en Guatemala revelan que se registraron 1 mil 144 casos nuevos, 45 personas fallecieron por covid-19 y se realizaron 3 mil 923 pruebas en todo el país.",14-08-2020 17:50,https://www.bing.com/th?id=ON.6196BC62347197D10EF59EA302DCCB2F,Guatemala,Guatevision
Coronavirus: Hay percepción de que lo peor ocurre ahora,https://www.prensalibre.com/guatemala/comunitario/coronavirus-hay-percepcion-de-que-lo-peor-ocurre-ahora/,"Guatemala ya superó la barrera de los 60 mil contagios por covid-19, lo que hace pensar a cinco de cada diez guatemaltecos que lo peor está por venir, según el estudio elaborado por ProDatos. En julio",14-08-2020 21:49,https://www.bing.com/th?id=ON.73F3CD16DF1B8562333287316C124702,Guatemala,Prensa Libre
Empleados públicos de la ciudad de Guatemala no trabajarán el lunes 17 de agosto,https://republica.gt/2020/08/14/empleados-publicos-de-la-ciudad-de-guatemala-no-trabajaran-el-lunes-17-de-agosto/,"Los empleados públicos que trabajan en la ciudad de Guatemala, no laborarán el lunes 17 de agosto por disposición del presidente de la República, Alejandro Giammattei. Debido a que el feriado del 15 d",14-08-2020 21:55,https://www.bing.com/th?id=ON.529A7BA02BFB9747DA35A917A761A288,Guatemala,Republica
Giammattei dice que Guatemala no participará para probar vacunas,https://stereo100.com.gt/2020/giammattei-dice-que-guatemala-no-participara-para-probar-vacunas/,"En la actualidad, varios países con mayor desarrollo en tecnología y ciencia se han dedicado a trabajar en la vacuna contra la COVID-19. Rusia ha sido el único país que dijo haber registrado la primer",14-08-2020 22:16,https://www.bing.com/th?id=ON.667158851E8BF0540EB54748D0845FFD,Guatemala,Stereo 100
Movimiento Sé Feliz Guatemala construyó casa a pareja de abuelitos en Alotenango,https://www.guatemala.com/noticias/vida/movimiento-se-feliz-guatemala-construyo-casa-pareja-abuelitos-alotenango.html,Pareja de abuelitos en Alotenango ahora tienen una casa gracias a la contribución de guatemaltecos y voluntarios del Movimiento Sé Feliz Guatemala. El Movimiento Sé Feliz Guatemala se unió una vez más,14-08-2020 22:19,https://www.bing.com/th?id=ON.11ADE959482A68277D2AB0FE7466116F,Guatemala,Guatemala
Guatemala suma 61 mil 428 contagios y 49 mil 355 recuperados,https://republica.gt/2020/08/14/guatemala-suma-61-mil-428-contagios-y-49-mil-355-recuperados/,"Guatemala reporta 1 mil 144 nuevos casos de covid-19, la cifra total alcanza los 61 mil 428 contagios hasta el 13 de agosto, según el Ministerio de Salud. Del total de contagios, 9 mil 732 son casos a",14-08-2020 22:45,https://www.bing.com/th?id=ON.C75CAA078DCDC1FF9ACBF0E1B743E182,Guatemala,Republica
Giammattei cambia postura sobre responsabilidad en el combate al COVID-19,https://elperiodico.com.gt/nacion/2020/08/15/giammattei-cambia-postura-sobre-responsabilidad-en-el-combate-al-covid-19/,"El Fondo de Desarrollo Social tenía en sus bodegas 60 mil escritorios que había adquirido en 2019, de los cuales 16 mil escritorios fueron donados ayer al Ministerio de Educación para que sean ubicado",15-08-2020 06:10,https://www.bing.com/th?id=ON.19C3785B4551147C98D9F67F410B9F15,Guatemala,El Periódico Guatemala
Centroamérica: 21 mil 569 casos de COVID-19 en niñez y adolescencia,https://elperiodico.com.gt/nacion/2020/08/15/centroamerica-21-mil-569-casos-de-covid-19-en-ninez-y-adolescencia/,"En Guatemala se registran hasta ahora 4 mil 64 casos de niños, niñas y adolescentes contagiados de COVID-19. Por: Rony Ríos rrios@elperiodico.com.gt Los datos reportados por los sistemas de salud de G",15-08-2020 09:21,https://www.bing.com/th?id=ON.034597464027C098F6C7EDE1C7870B9F,Guatemala,El Periódico Guatemala
Coronavirus en Guatemala: Congreso publica ampliación del estado de Calamidad,https://www.guatevision.com/nacionales/coronavirus-en-guatemala-congreso-publica-ampliacion-del-estado-de-calamidad,El estado de Calamidad continúa vigente en Guatemala luego de cinco meses desde que se detectó el primer caso de coronavirus. El Congreso de la República publicó este sábado 15 de agosto en el Diario,15-08-2020 14:12,https://www.bing.com/th?id=ON.02FB2973CB6D5E35B20CF97510C36434,Guatemala,Guatevision
"En la pandemia del coronavirus así se vive la fiesta de la Virgen de la Asunción: procesión, conciertos y más",https://www.prensalibre.com/guatemala/comunitario/en-la-pandemia-del-coronavirus-asi-se-vive-la-fiesta-de-la-virgen-de-la-asuncion-procesion-conciertos-y-mas/,"Este 15 de agosto se celebra en Guatemala el día de la Virgen de la Asunción.  Una fiesta tradicional que se caracteriza por una feria concurrida en la zona 2, así como con diferentes actividades en h",15-08-2020 17:42,https://www.bing.com/th?id=ON.0AA6460C84753453F0250F17A5FEA438,Guatemala,Prensa Libre
Coronavirus: Guatemala supera los 50 mil recuperados,https://crnnoticias.com/coronavirus-guatemala-supera-los-50-mil-pacientes-recuperados/,"El país superó los 50 mil pacientes recuperados de coronavirus el viernes 14 de agosto, de acuerdo a los datos que dio a conocer el sábado 15 las autoridades del Ministerio de Salud Pública y Asistenc",15-08-2020 18:18,https://www.bing.com/th?id=ON.4D17F94B98D11C9EE0B0FAC2DFD1E3A2,Guatemala,CRN Noticias
