name,url,description,datePublished,imagen,pais,Fuente
Sólo podrán ingresar a Guatemala con pruebas Covid 19 negativas,http://www.chapintv.com/actualidad/solo-podran-ingresar-a-guatemala-con-pruebas-covid-19-negativas-308027,"Las autoridades del Ministerio de Salud explicaron que desde este viernes 18 de septiembre, sólo se podrá ingresar a Guatemala presentando las pruebas de Covid 19 PCR negativas, como parte de los prot",18-09-2020 04:57,https://www.bing.com/th?id=OVFT.1gLFJ7KvX6P0xiauv8zfty,Guatemala,Chapin TV
Realizan Foro Virtual Dinámicas Económicas y el Impacto Tributario en la Reactivación,https://newsinamerica.com/pdcc/economia/2020/realizan-foro-virtual-dinamicas-economicas-y-el-impacto-tributario-en-la-reactivacion,"Guatemala. ATREVIA Centroamérica, una consultora de comunicación y posicionamiento estratégico, reunió en un foro virtual a distinguidas personalidades en representación de los sectores tributario, ec",18-09-2020 05:44,https://www.bing.com/th?id=OVFT.THoMQfGzjEETK7b_ncIYBy,Guatemala,Periódico Digital Centroamericano y del Caribe
Convocan a foro de sector energético,https://elperiodico.com.gt/uncategorized/2020/09/18/convocan-a-foro-de-sector-energetico/,"La próxima semana se desarrollará el Tercer Foro de Transporte de Energía Eléctrica, resiliencia de la industria de transporte de energía: evolucionado hacia una nueva realidad. La empresa Transportad",18-09-2020 07:05,https://www.bing.com/th?id=OVFT.dqptY2_g3DZnIZ6c8xHwDC,Guatemala,El Periódico Guatemala
Para ingresar al país: Presentar prueba PCR por Covid-19 y llenar Pase de Salud,https://emisorasunidas.com/2020/09/17/pase-salud-aeropuerto-guatemala/,"Por su parte, el titular de la Dirección General de Aeronáutica Civil (DGAC), Francis Argueta Aguirre, indicó que mañana se espera el ingreso de tres aerolíneas comerciales de pasajeros y cuatro vuelo",18-09-2020 14:23,https://www.bing.com/th?id=OVFT.4iFt2ltuu1S3TdstrvGF6i,Guatemala,Emisoras Unidas
Guatemala supera los 84 mil casos de coronavirus,https://emisorasunidas.com/2020/09/18/casos-de-coronavirus-en-guatemala-18-septiembre/,"El tablero digital del Ministerio de Salud Pública y Asistencia Social (MSPAS) publicó los datos de coronavirus que se reportaron en las últimas 24 horas en el país. Para este viernes, 18 de septiembr",18-09-2020 14:29,https://www.bing.com/th?id=OVFT.gWiD53KKD0DAlAw_05sgLi,Guatemala,Emisoras Unidas
Guatemala reporta 680 nuevos casos de COVID-19 y 40 fallecidos,https://stereo100.com.gt/2020/guatemala-reporta-680-nuevos-casos-de-covid-19-y-40-fallecidos/,"Este viernes, el Ministerio de Salud Pública y Asistencia Social (MSPAS) reporta en las últimas 24 horas, en Guatemala, 680 nuevos casos de COVID-19 y 40 fallecidos. https://twitter.com/MinSaludGuate/",18-09-2020 15:09,https://www.bing.com/th?id=OVFT.CbZ1H98ATegIt-Uwi12fNi,Guatemala,Stereo 100
Guatemala y El Salvador reabren sus fronteras tras 6 meses de inactividad,https://newsinamerica.com/pdcc/boletin/2020/guatemala-y-el-salvador-reabren-sus-fronteras-tras-6-meses-de-inactividad,"Guatemala y El Salvador reabren este fin de semana sus fronteras, tras seis meses de inactividad por los pasos terrestres, aéreos y marítimos de pasajeros, debido a las restricciones que tomaron como",18-09-2020 15:49,https://www.bing.com/th?id=OVFT.OFIVHUjdQno7_BbqC9p6gS,Guatemala,Periódico Digital Centroamericano y del Caribe
"Actualización COVID-19: 40 fallecidos ayer, la cifra más alta de muertes en semanas",https://lahora.gt/actualizacion-covid-19-40-fallecidos-ayer-la-cifra-mas-alta-de-muertes-en-semanas/,"Durante las últimas 24 horas, el Ministerio de Salud Pública y Asistencia Social (MSPAS) registró un total de 680 casos nuevos, así como 40 fallecidos, siendo esta la cifra de decesos más alta de las",18-09-2020 15:51,https://www.bing.com/th?id=OVFT.r8FvsUhmkx52iDRiZxfH4S,Guatemala,La Hora
Presidente Alejandro Giammattei da positivo al coronavirus,https://www.guatevision.com/nacionales/presidente-alejandro-giammattei-da-positivo-al-coronavirus-breaking,"El mandatario se había sometido a varias pruebas anteriormente y había dado negativo, pero este viernes confirmó que está contagiado de covid-19. La vocera presidencial, Francis Masek, confirmó a Guat",18-09-2020 15:52,https://www.bing.com/th?id=OVFT.oaeNO7_Bp7P-OXm6dUNmtC,Guatemala,Guatevision
Usac suspende servicios relacionados con la atención a COVID-19 por toma de edificio,https://crnnoticias.com/usac-suspende-servicios-relacionados-con-la-atencion-a-covid-19-por-toma-de-edificio/,"La Universidad de San Carlos de Guatemala -USAC- suspendió el servicio de telesalud así como el de prestar tanques de oxígeno a estudiantes, docentes y trabajadores afectados por COVID-19.  Esto por l",18-09-2020 15:57,https://www.bing.com/th?id=OVFT.QzpoQIgaBXRgcW-yWbi4-C,Guatemala,CRN Noticias
Presidente Alejandro Giammattei da positivo a la prueba de COVID-19,https://stereo100.com.gt/2020/presidente-alejandro-giammattei-da-positivo-a-la-prueba-de-covid-19/,"Este viernes, el presidente de Guatemala, Alejandro Giammattei, confirmó que dio positivo a la prueba de COVID-19. #Urgente | El presidente de #Guatemala, Alejandro Giammattei, confirma que dio positi",18-09-2020 16:00,https://www.bing.com/th?id=OVFT.RE7KHKMje_2T3iuDR9D-SC,Guatemala,Stereo 100
Juan Maegli quedó en el top 10 del Kieler Woche 2020 en Alemania,https://www.guatemala.com/deportes/vela/juan-maegli-quedo-en-el-top-10-del-kieler-woche-2020-en-alemania.html,"El guatemalteco Juan Maegli quedó en el top 10 del Kieler Woche 2020 que se disputó del 5 al 13 de septiembre en Schleswig-Holstein, Alemania. En su primera competencia internacional de la temporada,",18-09-2020 17:45,https://www.bing.com/th?id=OVFT.ED3kCO8m9efXZF_B_YoOqy,Guatemala,Guatemala
Coronavirus en América Latina: a qué países se puede volar y cómo,https://www.prensalibre.com/internacional/bbc-news-mundo-internacional/coronavirus-en-america-latina-a-que-paises-se-puede-volar-y-como/,Colombia se abre de nuevo. Este 19 de septiembre vuelven a operar vuelos internacionales en el país después de seis meses sin hacerlo debido a la pandemia del coronavirus. Como ocurrió en otros países,18-09-2020 17:47,https://www.bing.com/th?id=OVFT.kQc4Z1Dekrign_XhOuvgIy,Guatemala,Prensa Libre
"“Mamá, ahora la llamo”, el último mensaje de la guatemalteca que encontraron sin vida en España",https://www.guatevision.com/nacionales/mama-ahora-la-llamo-el-ultimo-mensaje-de-la-guatemalteca-que-encontraron-sin-vida-en-espana,"Nancy Paola Reyes García vivía en España desde julio de 2018. El 19 de agosto fue la última comunicación que su familia en Guatemala tuvo con ella. La detención de su conviviente y el reporte, un mes",18-09-2020 18:23,https://www.bing.com/th?id=OVFT.cC2JnwdcdyVlbQOjhWBfJS,Guatemala,Guatevision
Miguel Martínez el más cercano a Giammattei da resultado negativo por Covid-19,https://www.deguate.com/artman/publish/noticias-guatemala/miguel-martinez-el-mas-cercano-a-giammattei-da-resultado-negativo-por-covid-19.shtml,"Guatemala. Martínez dijo que su prueba resultó negativa, ya que se tomó la decisión de hacerla luego de las actividades para celebrar los 199 años de independencia del país. “Ya nos hicimos la prueba,",18-09-2020 18:44,https://www.bing.com/th?id=OVFT.f_0_ZVqi033KZxaz6lrjZi,Guatemala,De Guate
Gobierno efectúa reapertura de fronteras en Guatemala,http://www.chapintv.com/actualidad/gobierno-efectua-reapertura-de-fronteras-en-guatemala-308143,"En el transcurso de la mañana de este viernes, el Gobierno de Guatemala inició el reinicio de las fronteras terrestres y aéreas, tras seis meses cerradas por la pandemia del COVID-19.",18-09-2020 19:09,https://www.bing.com/th?id=OVFT.ss-VgWy8JnR2Z8TxfxfTZi,Guatemala,Chapin TV
Giammattei pide eleven sus oraciones para que pueda recuperarse de COVID-19,https://www.deguate.com/artman/publish/noticias-guatemala/giammattei-pide-eleven-sus-oraciones-para-que-pueda-recuperarse-de-covid-19.shtml,"Ciudad, Guatemala. El presidente Alejandro Giammattei afirmó que, pese a dar positivo para Covid-19, no guardará reposo y que dirigirá el país de manera aislada. De acuerdo a las declaraciones de Giam",18-09-2020 19:12,https://www.bing.com/th?id=OVFT.1qkbbs-grEcvbfGjTHi4Ey,Guatemala,De Guate
Presidente Giammattei asegura que sus síntomas de COVID-19 son leves,https://crnnoticias.com/presidente-giammattei-asegura-que-sus-sintomas-de-covid-19-son-leves/,El presidente Alejandro Giammattei aseguró que sus síntomas son leves luego de ser diagnosticado como positivo de COVID-19. Al mandatario se le hizo la prueba en la noche del jueves y los resultados l,18-09-2020 19:21,https://www.bing.com/th?id=OVFT.EmjAjFDFg_BmR-wDqUvhYS,Guatemala,CRN Noticias
Giammattei pidió al gabinete someterse a la prueba de covid-19,https://republica.gt/2020/09/18/giammattei-gabinete-prueba-covid-19/,El presidente Alejandro Giammattei pidió a su gabinete someterse a la prueba de covid-19 luego que diera positivo el jueves 17 de septiembre. “Estoy pidiéndole a todo el gabinete que estuvo reunido co,18-09-2020 20:48,https://www.bing.com/th?id=OVFT.lyQLat-RegHT_cvBBIJKby,Guatemala,Republica
Ministro de Cultura Felipe Aguilar da positivo a covid-19,https://republica.gt/2020/09/18/ministro-de-cultura-de-guatemala-felipe-aguilar-da-positivo-a-covid-19/,"El recién nombrado ministro de Cultura y Deportes, Felipe Amado Aguilar Marroquín, dio positivo a la prueba de coronavirus covid-19, de acuerdo con esa entidad. El funcionario por el momento se encuen",18-09-2020 20:48,https://www.bing.com/th?id=OVFT.LzDtRTI-eE7DmIfVRqgTNy,Guatemala,Republica
LA HORA EN POCOS MINUTOS,https://lahora.gt/la-hora-en-pocos-minutos-113/,"Luego de confirmar que dio positivo a COVID-19, el presidente Alejandro Giammattei, a través de un mensaje a la nación, explicó su cuadro clínico y detalló que se encuentra dentro de la categoría de p",18-09-2020 22:41,https://www.bing.com/th?id=OVFT.3r5IOGvjvX_C6u1zz67nKy,Guatemala,La Hora
