name,url,description,datePublished,imagen,pais,Fuente
Suman 70 mil 714 casos positivos de Coronavirus en el país,https://www.publinews.gt/gt/noticias/2020/08/26/guatemala-casos-positivos-coronavirus-26-agosto-2020.html,"Guatemala llegó a los 70 mil 714 casos positivos acumulados por el SARS-CoV-2 este miércoles 26 de agosto de 2020. Asimismo, el Ministerio de Salud Pública y Asistencia Social (MSPAS) informó sobre la",26-08-2020 20:22,https://www.bing.com/th?id=ON.3465964D2A0D09E5F665766EACD47870,Guatemala,Publinews
Covid-19 | ¿Qué falta para que el municipio de Guatemala pase de rojo a anaranjado?,https://republica.gt/2020/08/26/covid-19-que-falta-para-que-el-municipio-de-guatemala-pase-de-rojo-a-anaranjado/,"El municipio de Guatemala es uno de los 16 del departamento de Guatemala que está en rojo, es decir, alerta máxima, según el tablero covid-19. Chuarrancho es el único que está en color anaranjado. Par",26-08-2020 22:12,https://www.bing.com/th?id=ON.53FE6B28DFAAC357AA7A593545EBF64A,Guatemala,Republica
Coronavirus: Médicos del IGSS podrían quedarse sin alojamiento,https://www.prensalibre.com/guatemala/comunitario/coronavirus-medicos-del-igss-podrian-quedarse-sin-alojamiento/,Médicos que atienden a pacientes con covid-19 afiliados al Instituto Guatemalteco de Seguridad Social (IGSS) podrían quedarse sin alojamiento debido al pronto vencimiento del contrato de la institució,26-08-2020 23:04,https://www.bing.com/th?id=ON.69CA026075D6B2488A8BC9DED9C88B88,Guatemala,Prensa Libre
Uno de cada 10 mercados mayoristas de 15 países registraron caída en ventas por el Covid-19,https://emisorasunidas.com/2020/08/26/mercados-caida-ventas-covid-19/,Uno de cada 10 mercados mayoristas de 15 países de la región registró una caída en el 50% de sus ventas debido a la pandemia Covid-19. Esto fue revelado mediante una encuesta realizada a 71 mercados m,27-08-2020 04:12,https://www.bing.com/th?id=ON.B0A929CF4EE12A3808C7806A1AC90B6E,Guatemala,Emisoras Unidas
El covid-19 se convirtió en el gran acelerador del comercio en línea,https://elperiodico.com.gt/uncategorized/2020/08/27/el-covid-19-se-convirtio-en-el-gran-acelerador-del-comercio-en-linea/,"Las tiendas despiden empleados y las empresas del sector digital presentan resultados extraordinarios. El covid-19 y el confinamiento aceleraron la consolidación del comercio en línea, dentro de un mo",27-08-2020 14:05,https://www.bing.com/th?id=ON.1729CB47C45B2D69648A9206A7188969,Guatemala,El Periódico Guatemala
Salud define quiénes serían los primeros en Guatemala en recibir la vacuna contra el covid-19,https://www.guatevision.com/nacionales/salud-define-quienes-serian-los-primeros-en-guatemala-en-recibir-la-vacuna-contra-el-covid-19,"El Ministerio de Salud ya definió qué personas serán las primeras en ser vacunadas contra el covid-19, y para lo cual Guatemala ya ha hecho adelantos monetarios. Amelia Flores, ministra de Salud, dijo",27-08-2020 14:06,https://www.bing.com/th?id=ON.BF0BFD464F18C272E954D150F82CAC8B,Guatemala,Guatevision
Rusia tendrá lista en septiembre su segunda vacuna contra el COVID-19,https://elperiodico.com.gt/insolito/2020/08/27/rusia-tendra-lista-en-septiembre-su-segunda-vacuna-contra-el-covid-19/,"El presidente de Rusia, Vladímir Putin, declaró que Moscú tendrá lista en septiembre su segunda vacuna contra el COVID-19. “En septiembre tendremos una segunda vacuna (…) Estoy seguro que los investig",27-08-2020 15:16,https://www.bing.com/th?id=ON.DE1FEBD0DF6C9F5A95E6F1A19EA0362A,Guatemala,El Periódico Guatemala
COVID-19: Reportan 1 mil 138 contagios nuevos; casos activos aumentan a 9 mil 530,https://lahora.gt/covid-19-reportan-1-mil-138-contagios-nuevos-casos-activos-aumentan-a-9-mil-530/,"La información del Ministerio de Salud Pública y Asistencia Social (MSPAS), detalla que en las últimas 24 horas se han registrado 1 mil 138 casos de COVID-19 en el país, con lo que la cifra de casos a",27-08-2020 15:19,https://www.bing.com/th?id=ON.CC2E08BD02D2530E4131F4C92E3F5DC7,Guatemala,La Hora
Estos grupos serán los primeros en Guatemala en recibir la vacuna contra el covid-19,https://www.prensalibre.com/guatemala/comunitario/estos-grupos-seran-los-primeros-en-guatemala-en-recibir-la-vacuna-contra-el-covid-19-breaking/,"El Ministerio de Salud ya definió qué personas serán las primeras en ser vacunadas contra el covid-19, y para lo cual Guatemala ya ha hecho adelantos monetarios. Amelia Flores, ministra de Salud, dijo",27-08-2020 15:19,https://www.bing.com/th?id=ON.53642FA585AEB922A7C6D81628C8416B,Guatemala,Prensa Libre
Guatemala exigirá prueba de Covid-19 a viajeros para ingresar al país,https://emisorasunidas.com/2020/08/27/aeropuerto-pasajeros-prueba-covid-19/,"Aunque todavía no se tiene una fecha definida para que las operaciones en el Aeropuerto Internacional La Aurora puedan reanudarse, las autoridades avanzan en la implementación de los protocolos corres",27-08-2020 16:47,https://www.bing.com/th?id=ON.9CC2B22F0042A206F4A4E109DD2F4197,Guatemala,Emisoras Unidas
Guatemala registra 1 mil 138 nuevos casos de COVID-19 y 23 fallecidos,https://stereo100.com.gt/2020/guatemala-registra-1-mil-138-nuevos-casos-de-covid-19-y-23-fallecidos/,"Este jueves, el Ministerio de Salud Pública y Asistencia Social (MSPAS) informa que en las últimas 24 horas se registran 1 mil 138 nuevos casos de COVID-19 y 23 pacientes fallecidos. #Actualización| #",27-08-2020 17:45,https://www.bing.com/th?id=ON.49950DC27C5639B7567D7AF6050ACE2C,Guatemala,Stereo 100
"Arriba vuelo humanitario, procedente de Madrid, con 184 guatemaltecos varados en Europa",https://radiotgw.gob.gt/arriba-vuelo-humanitario-procedente-de-madrid-con-184-guatemaltecos-varados-en-europa/,"TGW Digital – Un vuelo humanitario procedente de Madrid arribó la noche del lunes a Guatemala con 184 guatemaltecos que, con el apoyo del Ministerio de Relaciones Exteriores y las gestiones de la emba",27-08-2020 17:55,https://www.bing.com/th?id=ON.069500E448898BA4C5CCB9A6815933B6,Guatemala,TGW
Diputado Felipe Alejos exige la salida de médicos cubanos de Guatemala lo antes posible,https://www.deguate.com/artman/publish/noticias-guatemala/diputado-felipe-alejos-exige-la-salida-de-medicos-cubanos-de-guatemala-lo-antes-posible.shtml,"Ciudad, Guatemala. El diputado Felipe Alejos culpó al Gobierno de Guatemala de “financiar al régimen cubano” debido a que el Ministerio de Salud le paga a 444 médicos de ese país por los servicios que",27-08-2020 19:32,https://www.bing.com/th?id=ON.DFDE9BA2D16843F375F81AF6EA1D7D96,Guatemala,De Guate
COVID-19: Personal médico ha salvado a 58 mil 783 personas,https://lahora.gt/covid-19-personal-medico-ha-salvado-a-58-mil-783-personas/,"De acuerdo con la última actualización del tablero de casos del Ministerio de Salud Pública y Asistencia Social (MSPAS), este día, la cifra de contagios en Guatemala sumó 70 mil 714 casos, desde que s",27-08-2020 19:45,https://www.bing.com/th?id=ON.EEDF310242F7B220393C00B7EC5523CC,Guatemala,La Hora
Inician gestiones para que Guatemala acceda a la vacuna y medicamentos contra el COVID-19,https://radiotgw.gob.gt/inician-gestiones-para-que-guatemala-acceda-a-la-vacuna-y-medicamentos-contra-el-covid-19/,TGW Digital – El Ministerio de Relaciones Exteriores mantiene acercamientos con los países que trabajan en procesos de fabricación de una vacuna contra el COVID-19 para optar a una disponibilidad inme,27-08-2020 19:47,https://www.bing.com/th?id=ON.AFB305D0D340233B69BE95F508D5945E,Guatemala,TGW
Casos nuevos de coronavirus en Guatemala suman 1 mil 138 y se reportan 23 fallecidos,https://www.guatevision.com/nacionales/casos-nuevos-de-coronavirus-en-guatemala-suman-1-mil-138-y-se-reportan-23-fallecidos-breaking,"El tablero Covid-19 del Ministerio de Salud se actualizó a las 8.10 horas de este jueves 27 de agosto de 2020, con las cifras del 26 de agosto hasta las 23.59 horas. Los datos revelan que en las últim",27-08-2020 20:27,https://www.bing.com/th?id=ON.B9D6BFFE5F9065CC3A8A719D05525609,Guatemala,Guatevision
Guatemala exigirá a viajeros prueba negativa de Covid-19,https://www.publinews.gt/gt/noticias/2020/08/27/guatemala-pedira-prueba-covid-19-a-viajeros.html,Las autoridades de la Dirección General de Aeronáutica Civil (DGAC) están en la última fase de la implementación de protocolos de bioseguridad en el Aeropuerto Internacional La Aurora. Se espera que e,27-08-2020 20:50,https://www.bing.com/th?id=ON.44D7BC71EC4A957A8F1FB266C9647DF2,Guatemala,Publinews
Se registra mil 138 casos nuevos de coronavirus,https://elmetropolitano.com.gt/es/2020/08/27/se-registra-mil-138-casos-nuevos-de-coronavirus/,El Ministerio de Salud Pública y Asistencia Social (MSPAS) informó que el pasado miércoles se registraron mil 138 casos nuevos de coronavirus (COVID-19) en el territorio nacional.En el tablero situaci,27-08-2020 20:52,https://www.bing.com/th?id=ON.168541BAD19A8B4E1A1E4D3D1D5D95A0,Guatemala,El Metropolitano
Remesas a Guatemala en julio con cifra histórica récord,https://crnnoticias.com/remesas-a-guatemala-en-julio-con-cifra-historica-record/,"El envío de remesas familiares a Guatemala registró en julio la mayor cifra de su historia con 1 mil 78 millones de dólares remitidos desde el extranjero, equivalentes además a un aumento del 13,7 % e",27-08-2020 21:16,https://www.bing.com/th?id=ON.48B30CD8DA06C21C62D33C2D30D79817,Guatemala,CRN Noticias
Guatemala busca vacunas contra COVID-19 a través de fondo rotativo de la OPS,https://crnnoticias.com/guatemala-busca-vacunas-contra-covid-19-a-traves-de-fondo-rotativo-de-la-ops/,"El ministro de Relaciones Exteriores informó que se buscan los mecanismos para obtener la vacuna en cuanto esté lista para su distribución y, ya con todas las certificaciones de la Organización Mundia",27-08-2020 21:16,https://www.bing.com/th?id=ON.1665B296544E531AF7A1130A411D2040,Guatemala,CRN Noticias
Cancillería apresura adquisición rápida de la vacuna contra el covid-19,https://republica.gt/2020/08/27/cancilleria-apresura-adquisicion-rapida-de-la-vacuna-contra-el-covid-19/,"Brasil, Japón, Italia, México, Argentina e Israel, además de Rusia, y los mecanismos de la Organización Mundial de la Salud (OMS), son las rutas que Guatemala busca asegurar para el suministro de la v",27-08-2020 23:02,https://www.bing.com/th?id=ON.768EB474D9846074F070B46089171C57,Guatemala,Republica
Antorchas y desfiles de Independencia quedan suspendidos por COVID-19,https://www.deguate.com/artman/publish/noticias-guatemala/antorchas-y-desfiles-de-independencia-quedan-suspendidos-por-covid-19.shtml,"Ciudad, Guatemala. Debido a la crisis por el Coronavirus (COVID-19), la Gobernación Departamental de Guatemala confirmó que este 2020 no habrá desfiles estudiantiles ni las tradicionales caravanas con",27-08-2020 23:02,https://www.bing.com/th?id=ON.1DE2492A677B950425CFE442D25C3B91,Guatemala,De Guate
"Uber presenta campaña informativa ante el COVID-19: Lavar, Usar, Ventilar",https://newsinamerica.com/pdcc/gerenciales/2020/uber-presenta-campana-informativa-ante-el-covid-19-lavar-usar-ventilar,"Guatemala. ​A tono con la nueva normalidad, ​Uber presentó su nueva campaña informativa “Lavar, Usar, Ventilar” que tiene como propósito recordar a su comunidad tres simples acciones para mantenerse m",27-08-2020 23:37,https://www.bing.com/th?id=ON.A2EA49EC17C04040C86B59E9CD2BC53D,Guatemala,Periódico Digital Centroamericano y del Caribe
BCIE habilita US$12.0 millones para la MIPYME guatemalteca y su reactivación productiva,https://newsinamerica.com/pdcc/economia/2020/bcie-habilita-us12-0-millones-para-la-mipyme-guatemalteca-y-su-reactivacion-productiva,Estos recursos son parte del Programa de Emergencia de Apoyo y Preparación ante el COVID-19 y de Reactivación Económica aprobado por el Banco para los países del Sistema de la Integración Centroameric,27-08-2020 23:37,https://www.bing.com/th?id=ON.A7BC1B3E9D06717E81017FD16922E71B,Guatemala,Periódico Digital Centroamericano y del Caribe
