name,url,description,datePublished,imagen,pais,Fuente
Coronavirus: Más de 37 mil recuperados y 1 mil 959 fallecidos,https://republica.gt/2020/08/01/coronavirus-mas-de-37-mil-recuperados-y-1-mil-959-fallecidos/,"Casi cinco meses después de confirmarse el primer caso de coronavirus en Guatemala más de 37 mil personas se han recuperado. Sin embargo, 1 mil 959 personas fallecieron por complicaciones del covid-19",01-08-2020 00:00,https://www.bing.com/th?id=ON.1E754AE92B223005FDBDCFE1D7A5B02D,Guatemala,Republica
Colaboradores de G&T Continental recaudan víveres para 1000 familias afectadas,https://newsinamerica.com/pdcc/gerenciales/2020/colaboradores-de-gt-continental-recaudan-viveres-para-1000-familias-afectadas,"Guatemala. Como parte de su programa de Responsabilidad Social Empresarial durante esta coyuntura, empresa y colaboradores de G&T Continental entregaron hoy un donativo en alimentos al proyecto Raíces",01-08-2020 01:08,https://www.bing.com/th?id=ON.6F34F1BE173B1538B5A849535DFCC52C,Guatemala,Periódico Digital Centroamericano y del Caribe
Dr. Asturias asegura que epidemia de Covid-19 en Guatemala seguirá en 2021,https://www.publinews.gt/gt/noticias/2020/08/01/dr-asturias-contagios-de-covid-19.html,"El director de la Comisión Presidencial contra el Covid-19 (Coprecovid), Edwin Asturias, aseguró que la epidemia del coronavirus seguirá afectando a Guatemala el próximo año. De acuerdo con el titular",01-08-2020 09:51,https://www.bing.com/th?id=ON.B444E21365783D9B027C227B4941AC99,Guatemala,Publinews
Fiesta del trono de su majestad el rey Mohammed VI,https://www.prensalibre.com/opinion/columnasdiarias/fiesta-del-trono-de-su-majestad-el-rey-mohammed-vi/,"En medio de la pandemia se han celebrado virtualmente cumpleaños, aniversarios, nacimientos y hasta casamientos en privacidad y silencio. Cumpliendo con las disposiciones del gobierno de Guatemala par",02-08-2020 00:00,https://www.bing.com/th?id=ON.3C6EA7C54754F9C98FD7093769E05D0F,Guatemala,Prensa Libre
"Según tablero del MSPAS, Guatemala supera los 51 mil casos de coronavirus",https://www.publinews.gt/gt/noticias/2020/08/02/casos-coronavirus-guatemala-2-agosto-2020.html,"La víspera, el director de la Comisión Presidencial contra el Covid-19 (Coprecovid), Edwin Asturias, aseguró que la epidemia de coronavirus seguirá afectando a Guatemala hasta el próximo año. De acuer",03-08-2020 01:35,https://www.bing.com/th?id=ON.190EE72EA4A784938AF940FA83A38B0B,Guatemala,Publinews
"Vacuna rusa genera inmunidad contra covid-19, según Ministerio de Defensa",https://elperiodico.com.gt/mundo/2020/08/03/vacuna-rusa-genera-inmunidad-contra-covid-19-segun-ministerio-de-defensa7/,"El grupo de militares voluntarios que recibió la vacuna del laboratorio ruso Gamaleya desarrolló inmunidad contra el coronavirus, informó este lunes el Ministerio de Defensa del país. “Los resultados",03-08-2020 14:31,https://www.bing.com/th?id=ON.F36228694B527EADDF099B77E4B05759,Guatemala,El Periódico Guatemala
