name,url,description,datePublished,imagen,pais,Fuente
Covid-19: El autocuidado puede ayudar a reducir el estrés,https://www.publinews.gt/gt/noticias/2020/07/12/reducir-estres-covid-19.html,"El coronavirus tipo 2 o SARS-CoV-2 no solamente puede resultar con complicaciones en la salud de los pacientes, sino que también puede resultar estresante para las personas. La ansiedad y el temor con",12-07-2020 22:58,https://www.bing.com/th?id=ON.C063E504D1D7E341D55CDD0B373A6EBB,Guatemala,Publinews
Dr. Luna: “Todo síntoma respiratorio y no respiratorio es Covid hasta que se demuestre lo contrario”,https://www.publinews.gt/gt/noticias/coronavirus-covid-19/2020/07/12/medico-neumologo-sintomas-covid-19.html,"El médico Juan Manuel Luna se pronunció sobre la necesidad de darle importancia a los síntomas que las personas puedan presentar, pues podría tratarse de Covid-19. El profesional es uno de los 33 neum",12-07-2020 23:32,https://www.bing.com/th?id=ON.D7ABBE0AB64BAA9D39E0C29AAD9F0ED0,Guatemala,Publinews
"Departamento de Guatemala, cerca de superar los 20 mil casos de COVID-19",https://lahora.gt/departamento-de-guatemala-cerca-de-superar-los-20-mil-casos-de-covid-19/,"Mañana se cumplen 4 meses desde que se confirmó el primer caso de COVID-19 en el país y hasta las 23:59 horas del mes del 10 de julio, se han confirmado 28 mil 598 contagios en todo el país. Sin embar",13-07-2020 04:33,https://www.bing.com/th?id=ON.4C9DAB771E5B8D0B567917641E76DE34,Guatemala,La Hora
Disposiciones presidenciales continuarán hasta el 27 de julio,https://crnnoticias.com/disposiciones-presidenciales-continuaran-hasta-el-27-de-julio/,"El Gobierno de Guatemala mantendrá por 15 días más las disposiciones presidenciales emitidas por Alejandro Giammattei, que afectan la movilidad de vehículos y personas como medida de prevención del co",13-07-2020 05:07,https://www.bing.com/th?id=ON.B0AB81BFB06CB6F19DECB5FD4559C6B6,Guatemala,CRN Noticias
Guatemala: el país de los lamentos,https://elperiodico.com.gt/opinion/2020/07/13/guatemala-el-pais-de-los-lamentos/,"Mientras la pandemia de la COVID-19 arrasa Guatemala a la vista ciega de las autoridades -concretamente del ejecutivo- el país está convirtiéndose, una vez más, en una letanía de lamentos. Este pareciera ser un ciclo macabro de duelo. Con cada ...",13-07-2020 06:53,https://www.bing.com/th?id=ON.53034AEF4B46F1580541BBE9D38F7593,Guatemala,El Periódico Guatemala
"Coronavirus: Joram Gil, expresidente del Colegio de Ingenieros, fallece a causa del Covid-19",https://www.prensalibre.com/guatemala/comunitario/coronavirus-joram-gil-expresidente-del-colegio-de-ingenieros-fallece-a-causa-del-covid-19/,"El expresidente del Colegio de Ingenieros de Guatemala, Joram Matías Gil Laroj, murió el sábado último a consecuencia del coronavirus, se informó este domingo 12 de julio. La Universidad de San Carlos",13-07-2020 11:21,https://www.bing.com/th?id=ON.0DD4E356F7D927AB83EFD700403F0B80,Guatemala,Prensa Libre
Guatemala usará un sistema de alertas para la COVID-19 a partir del 27 de julio,https://newsinamerica.com/pdcc/boletin/2020/guatemala-usara-un-sistema-de-alertas-para-la-covid-19-a-partir-del-27-de-julio,"“No quiero hablar de apertura, sino de recuperación”, dijo el mandatario en una cadena nacional al indicar que ahora los poblados con menos de cinco casos por cada 100.000 habitantes pueden iniciar un",13-07-2020 13:54,https://www.bing.com/th?id=ON.FEF3A3844BA8844FA62332D225899D54,Guatemala,Periódico Digital Centroamericano y del Caribe
Director de Coprecovid informa sobre tablero de alertas por COVID-19,https://stereo100.com.gt/director-de-coprecovid-informa-sobre-tablero-de-alertas-por-covid-19/,"Este lunes, en una entrevista en el canal del Gobierno de Guatemala, el director de la Comisión Presidencial de Atención de la Emergencia Covid-19 (Coprecovid), Edwin Asturias, informó sobre el tabler",13-07-2020 14:45,https://www.bing.com/th?id=ON.DE6C928D6112A8F91C2D415B2E9B2D3D,Guatemala,Stereo 100
Coronavirus: Guatemala está por llegar a los 30 mil casos y sobrepasa los mil 200 decesos,https://www.guatevision.com/nacionales/coronavirus-guatemala-esta-por-llegar-a-los-30-mil-casos-y-sobrepasa-los-1200-decesos,"El Ministerio de Salud informó este domingo que se registraron 757 contagios nuevos de coronavirus, en tanto que 47 pacientes más fallecieron. La cartera de Salud informó que 757 resultaron contagiada",13-07-2020 15:24,https://www.bing.com/th?id=ON.E4F33B745165DAA703CFE7B24C20BA18,Guatemala,Guatevision
DA Studio Fotográfico toma fotografías gratis a emprendedores en julio y agosto 2020,https://www.guatemala.com/noticias/sociedad/da-studio-fotografico-toma-fotografias-gratis-emprendedores-julio-agosto-2020.html,"DA Studio Fotográfico toma fotografías gratis, a domicilio, a los productos de emprendedores guatemaltecos que necesiten apoyo ante el COVID-19. Debido a la emergencia del Coronavirus —COVID-19— el eq",13-07-2020 15:48,https://www.bing.com/th?id=ON.C6127B575B82C67F7F9F8D924FA322A4,Guatemala,Guatemala
"Guatemalteco, recuperado de COVID-19, donó camas a hospital de Antigua Guatemala en julio 2020",https://www.guatemala.com/noticias/sociedad/guatemalteco-recuperado-covid-19-dono-camas-a-hospital-antigua-guatemala-julio-2020.html,"Guatemalteco, recuperado de Coronavirus —COVID-19—, donó siete camas a Hospital Nacional Pedro De Bethancourt en Antigua Guatemala, Sacatepéquez. Como agradecimiento por la atención recibida, un paciente que se recuperó de Coronavirus —COVID-19 ...",13-07-2020 17:59,https://www.bing.com/th?id=ON.0FF3EA5C8BC423C16A34307C1CC18E12,Guatemala,Guatemala
Exsecretaria cuestiona estrategia de Guatemala para enfrentar al covid-19,https://elperiodico.com.gt/nacion/2020/07/13/exsecretaria-cuestiona-estrategia-de-guatemala-para-enfrentar-al-covid-192/,"La estrategia recién anunciada por el Gobierno de Guatemala para contener la propagación del COVID-19 fue cuestionada este lunes por la exsecretaria de Planificación y Programación de la Presidencia Karin Slowing, por permitir que la población se ...",13-07-2020 19:59,https://www.bing.com/th?id=ON.102F865F0841FD7B92371F3621C189DD,Guatemala,El Periódico Guatemala
"Edwin Asturias, Guatemala se encuentra en alerta roja por Covid-19",https://republica.gt/2020/07/13/edwin-asturias-guatemala-se-encuentra-en-alerta-roja-por-covid-19/,"El epidemiólogo que dirige la Comisión Presidencial de Atención a la Emergencia de Covid-19, Edwin Asturias, dio más detalles del sistema de alertas. Medida que comenzará a funcionar el próximo 27 de",13-07-2020 21:45,https://www.bing.com/th?id=ON.C5640CEA90336881A38997BF6C0B5846,Guatemala,Republica
"Estados Unidos deportó a indocumentados con coronavirus a Guatemala, según investigación",https://crnnoticias.com/estados-unidos-deporto-indocumentados-con-coronavirus-a-guatemala/,"Al menos, cuatro deportados entrevistados por el medio dieron positivo por COVID-19 poco después de regresar a sus países en Guatemala, El Salvador, Haití y la India. The New York Times investigó más de 750 vuelos nacionales a cargo del ICE ...",13-07-2020 21:59,https://www.bing.com/th?id=ON.7CD4AA1E1283BA5E941FD75DDBC01CB4,Guatemala,CRN Noticias
Guatemala espera que el Avifavir pase a su Fase III de su estudio,https://lahora.gt/guatemala-espera-que-el-avifavir-pase-a-su-fase-iii-de-su-estudio/,"... en Guatemala emitió ayer un comunicado de prensa en el que indican que Guatemala no rechazó el uso del medicamento ruso Avifavir para tratar a pacientes con COVID-19. En tal sentido, rechazaron lo que se ha publicado en algunos medios de ...",13-07-2020 22:31,https://www.bing.com/th?id=ON.F980972D93B1431709C0A816BDD954B4,Guatemala,La Hora
Guatemala registra 387 contagios nuevos y 25 fallecidos por coronavirus,https://www.guatevision.com/nacionales/guatemala-registra-387-contagios-nuevos-y-25-fallecidos-por-coronavirus-breaking,"En las últimas 24 horas se reportaron 387 casos nuevos de coronavirus y 25 pacientes más murieron, de acuerdo con la actualización de datos de Salud. El Ministerio de Salud informó este lunes que fuer",13-07-2020 22:55,https://www.bing.com/th?id=ON.CEC6D11B5DF01A37C3D6B3A9EEEE1DA7,Guatemala,Guatevision
Presupuesto Abierto 2021: Reactivación económica se enfocará en la inversión social,https://newsinamerica.com/pdcc/boletin/2020/presupuesto-abierto-2021-reactivacion-economica-se-enfocara-en-la-inversion-social,"Guatemala. La secretaria de Planificación y Planificación ... muy importante para superar los efectos de la pandemia del coronavirus (COVID-19). Para el próximo año, el Minfin proyecta, preliminarmente, un presupuesto de 96 mil millones de quetzales.",13-07-2020 23:01,https://www.bing.com/th?id=ON.832C464A375E64E043FDFF3422FE5618,Guatemala,Periódico Digital Centroamericano y del Caribe
Guatemala paga las consecuencias de histórica poca inversión en salud,https://www.prensalibre.com/pl-plus/guatemala/comunitario/guatemala-paga-las-consecuencias-de-historica-poca-inversion-en-salud/,"El poco interés histórico de las autoridades en contar con un sistema de salud acorde con las necesidades del país está pasando la factura durante esta pandemia del nuevo coronavirus, con solo dos hos",13-07-2020 23:11,https://www.bing.com/th?id=ON.6BD8B4B3EAF7E692AB831791569D86A7,Guatemala,Prensa Libre
Guatemala registra mil 244 fallecidos por Covid-19,https://republica.gt/2020/07/13/guatemala-registra-mil-244-fallecidos-por-covid-19/,Guatemala llegó este lunes 13 de julio a cuatro meses de convivir con el Covid-19 y la cifra de fallecidos continúa en aumento. A la fecha según el reporte del Ministerio de Salud Pública y Asistencia,13-07-2020 23:47,https://www.bing.com/th?id=ON.79C1630BEB8538FBEA2A0DBC00D6F2DB,Guatemala,Republica
