name,url,description,datePublished,imagen,pais,Fuente
"Pruebas antígeno, PCR y anticuerpos: usos y diferencias",https://newsinamerica.com/pdcc/gente/health/2021/pruebas-antigeno-pcr-y-anticuerpos-usos-y-diferencias/,"Amplia cobertura que brinda a nuestros lectores la información que necesitan para estar actualizados del acontecer centroamericano, caribeño y latinoamericano.",08-04-2021 05:01,https://www.bing.com/th?id=OVFT.kk4jYzNREW-plT61Cpu0hC,Guatemala,Periódico Digital Centroamericano y del Caribe
La pandemia y la economía,https://elsiglo.com.gt/2021/04/08/la-pandemia-y-la-economia/,"En algunos países el sector minería estará incrementando sus exportaciones, y los precios agrícolas podrían mejorar de cara al año 2021.",08-04-2021 13:30,https://www.bing.com/th?id=OVFT.nqnfPXME8Fqbk5ENrd7eWi,Guatemala,Siglo Veintiuno
Resaltan labor de médicos en Día Mundial de la Salud,https://www.deguate.com/artman/publish/noticias-guatemala/Resaltan-labor-de-medicos-en-Dia-Mundial-de-la-Salud.shtml,"«Nacimos para servir a nuestros semejantes, y cuando emprendimos la profesión juramos defender la vida de los pacientes”. Con este mensaje, médicos guatemaltecos se expresaron en el marco de la conmem",08-04-2021 15:10,https://www.bing.com/th?id=OVFT.PLuBlL_en1tzIzE3D2iqmy,Guatemala,De Guate
Laboratorio Móvil en zona 11 capitalina continuará realizando pruebas contra COVID-19 durante todo abril,https://radiotgw.gob.gt/laboratorio-movil-en-zona-11-capitalina-continuara-realizando-pruebas-contra-covid-19-durante-todo-abril/,"TGW Digital – Según informó el Ministerio de Salud Pública y Asistencia Social (MSPAS) wl laboratorio móvil ubicado en el mercado El Guarda, zona 11 de la ciudad de Guatemala, continuará",08-04-2021 15:29,https://www.bing.com/th?id=OVFT.FRzJjXeSjE49JVRNaZF7yi,Guatemala,TGW
Cacif : Objetivos de Desarrollo Sostenible avanzan en medio de la pandemia del covid-19,https://republica.gt/2021/04/08/cacif-objetivos-de-desarrollo-sostenible-avanzan-en-medio-del-covid-19/,En el marco de los Objetivos de Desarrollo Sostenible (ODS) el sector privado ha realizado 204 acciones durante las distintas fases del covid-19.,08-04-2021 16:11,https://www.bing.com/th?id=OVFT.IU4Qux1kGp4j5gIy-bF_2S,Guatemala,Republica
Apagua y Amepao solicitan restitución de requisito de compra de arroz nacional con cáscara,https://lahora.gt/apagua-y-amepao-solicitan-restitucion-de-requisito-de-compra-de-arroz-nacional-con-cascara/,"Por María España mespana@lahora.com.gt Por la eliminación del requisito de compra de cosecha nacional de arroz con cáscara, la cual estuvo vigente por más de 20 años beneficiando la producción agrícol",08-04-2021 17:13,https://www.bing.com/th?id=OVFT.xwyGWG5nZ6bamh9YnGBlHi,Guatemala,La Hora
Rusia entregará a Guatemala el plan de vacunas Sputnik V el próximo lunes,https://republica.gt/2021/04/08/rusia-entregara-plan-de-vacunas-sputnik-v-el-lunes/,Guatemala cuenta los días para la llegada de la vacuna rusa Sputnik V. Se confirmó el pago de la mitad de 16 millones de dosis solicitadas.,08-04-2021 17:38,https://www.bing.com/th?id=OVFT.TLsM0lx6d3vw5md_KW4M2C,Guatemala,Republica
Covid-19: Salud afirma que casos incrementarían aún más por “desorden” en Semana Santa,https://lahora.gt/covid-19-salud-afirma-que-casos-incrementarian-aun-mas-por-desorden-en-semana-santa/,"POR HEDY QUINO hquino@lahora.com.gt En los últimos días el Ministerio de Salud Pública y Asistencia Social ha registrado un incremento de nuevos casos de Covid-19, en tan solo 24 horas han informado d",08-04-2021 20:19,https://www.bing.com/th?id=OVFT.ojABsCbkEcj9FtkQaOklUy,Guatemala,La Hora
Preocupación por tercera ola de contagios en Guatemala,https://www.chapintv.com/noticia/preocupacion-por-tercera-ola-de-contagios-en-guatemala/,"En el transcurso de los últimos días, se reportó un incremento del número de contagios de Covid-19 en nuestro país. Socorristas reportaron más de 20 traslados de pacientes con coronavirus esta semana.",08-04-2021 20:20,https://www.bing.com/th?id=OVFT.IRkBfvApwbepdCb6XfA1UC,Guatemala,Chapin TV
Guatemala reporta 1 mil 590 nuevos casos de COVID-19 y está a un paso de los 200 mil contagios,https://stereo100.com.gt/2021/guatemala-reporta-1-mil-590-nuevos-casos-de-covid-19-y-esta-a-un-paso-de-los-200-mil-contagios/,"Por Luis Hernández | Este jueves, el Ministerio de Salud Pública y Asistencia Social (MSPAS) reporta en las últimas 24 horas, en Guatemala, 1 mil 590 nuevos casos de COVID-19 y 26 fallecidos registrad",08-04-2021 21:19,https://www.bing.com/th?id=OVFT.NyAZHM00DsypDwqcj5US-y,Guatemala,Stereo 100
Hospital de Occidente habilitará intensivo para Covid-19,https://www.deguate.com/artman/publish/noticias-guatemala/Hospital-de-Occidente-habilitaa-intensivo-para-Covid-19.shtml,"Ante el incremento de casos de coronavirus, el Hospital Regional de Occidente avanza en la habilitación del Intensivo (sala de aislamiento), para brindar atención a pacientes con Covid-19. La nueva ár",08-04-2021 23:16,https://www.bing.com/th?id=OVFT.XeooRdGJvFkC9Qi7tS-KzC,Guatemala,De Guate
Guatemala registra la cuarta peor vacunación contra la COVID-19 en América,https://elperiodico.com.gt/nacionales/2021/04/08/guatemala-registra-la-cuarta-peor-vacunacion-contra-la-covid-19-en-america/,"Apenas el pasado martes, 42 días después de iniciar la vacunación fue publicado el primer listado preliminar de personas vacunadas, tras presiones de diversos sectores al Ministerio de Salud.",08-04-2021 23:18,https://www.bing.com/th?id=OVFT.v15MOs-5DT0WzXmr5dPvsy,Guatemala,El Periódico Guatemala
"Guatemala, uno de los países que peor vacuna en América, en medio de desorden y falta de transparencia",https://stereo100.com.gt/2021/guatemala-uno-de-los-paises-que-peor-vacunan-en-america-en-medio-de-desorden-y-falta-de-transparencia/,"***Guatemala, uno de los países que peor vacuna en América, en medio de desorden y falta de transparencia *** Así fue el rescate de un hombre atrapado en una máquina trituradora de piedra en una bloquera de la zona 6 de Xela *** Hallazgos ...",09-04-2021 02:04,https://www.bing.com/th?id=OVFT.hNL91zYCEd8RR085Ap2PcS,Guatemala,Stereo 100
Charles Fernández peleará por una medalla en la Copa Mundial de pentatlón en Bulgaria,https://crnnoticias.com/charles-fernandez-peleara-por-medalla-en-la-copa-mundial-en-bulgaria/,Además rememoró: “Hace una semana y media terminé número 10 del mundo en Budapest y ahora entramos otra vez en la pelea para poner a Guatemala entre los mejores ... luego de superar el covid-19. “Empezamos la temporada con buenas sensaciones ...,09-04-2021 02:14,https://www.bing.com/th?id=OVFT.GxtcMSrhq40v76Ile4vkxi,Guatemala,CRN Noticias
Guatemala registra mil 590 nuevos contagios de coronavirus y 27 fallecidos a causa de la enfermedad,https://www.guatevision.com/nacionales/guatemala-registra-mil-590-nuevos-contagios-de-coronavirus-y-27-fallecidos-a-causa-de-la-enfermedad,"Con mil 590 nuevos contagios, Guatemala acumula 199 mil 964 casos de coronavirus. Las autoridades sanitarias de Guatemala informaron este jueves 8 de abril la muerte de 27 personas por covid-19 -26 en",09-04-2021 02:19,https://www.bing.com/th?id=OVFT.9RwxtmmlklbuY9tNYuUZCS,Guatemala,Guatevision
Reprobados en vacunación: Guatemala es el cuarto peor país en inmunización contra el covid-19 de América,https://www.prensalibre.com/guatemala/comunitario/reprobados-en-vacunacion-guatemala-es-el-cuarto-peor-pais-en-inmunizacion-contra-el-covid-19-de-america-breaking/,"El proceso de vacunación avanza con lentitud en Guatemala, donde se prevé una tercera ola de contagios de coronavirus. (Foto Prensa Libre: AFP) Durante la Semana Santa, cuando el país descansaba y hay menos personal trabajando, miles de adultos mayores ...",09-04-2021 05:27,https://www.bing.com/th?id=OVFT.cZVjnThO7A39njTl0EO4Ji,Guatemala,Prensa Libre
Salud confirma que empresas quieren comercializar vacunas contra el COVID-19,https://elperiodico.com.gt/nacionales/2021/04/09/salud-confirma-que-empresas-quieren-comercializar-vacunas-contra-el-covid-19/,La Gremial de Productos Farmacéuticos niega que solicitaran a Salud que se autorice la comercialización privada.,09-04-2021 06:24,https://www.bing.com/th?id=OVFT.zH-02BwRAmgKCxRpW-9uxC,Guatemala,El Periódico Guatemala
La pandemia no da tregua a los niños: 99 menores han muerto de coronavirus en Guatemala,https://www.guatevision.com/nacionales/la-pandemia-no-da-tregua-a-los-ninos-99-menores-han-muerto-de-coronavirus-en-guatemala,"Guatemala, donde 6 millones 646 mil de sus habitantes son menores de entre 0 y 17 años, registra un total de 6 mil 955 fallecimientos a causa del coronavirus, de los cuales 99 son menores, según el tablero covid-19 del Ministerio de Salud Pública.",09-04-2021 06:37,https://www.bing.com/th?id=OVFT.GWfCfiMSrQRWQcfum_bn5i,Guatemala,Guatevision
El Covid-19 continúa avanzado en Guatemala,https://www.chapintv.com/noticia/el-covid-19-continua-avanzado-en-guatemala/,"La joven enfermera fue identificada como Emilia Fabiola Pineda Ramírez, quien laboraba en el centro de salud de Santo Tomas de Castilla, Puerto Barrios, Izabal.",09-04-2021 13:13,https://www.bing.com/th?id=OVFT.PeI4OXdfsdWp0h5kLSlUay,Guatemala,Chapin TV
Segunda fase de inmunización contra COVID-19 priorizará municipios con más contagios,https://radiotgw.gob.gt/segunda-fase-de-inmunizacion-contra-covid-19-priorizara-municipios-con-mas-contagios/,"TGW Digital – Guatemala se prepara para recibir el lote de 16 millones de vacunas contra COVID-19 provenientes de Rusia, después de que el pasado 5 de abril iniciara el proceso de pago para",09-04-2021 14:13,https://www.bing.com/th?id=OVFT.2EtIz0BjEMDH2qR6d2ZiXi,Guatemala,TGW
