name,url,description,datePublished,imagen,pais,Fuente
MP investiga compra de vacunas Sputnik V; Salud lo ve positivo,https://crnnoticias.com/mp-investiga-compra-de-vacunas-sputnik-v-salud-lo-ve-positivo/,La ministra de Salud catalogó como positiva la investigación de la Fiscalía Contra la Corrupción por la compra de las vacunas Sputnik V.,07-05-2021 21:04,https://www.bing.com/th?id=OVFT.otJm3nk31SKiexTh_ctQGy,Guatemala,CRN Noticias
Guatemala reporta en las últimas 24 horas 1 mil 257 nuevos casos de COVID-19,https://stereo100.com.gt/2021/guatemala-reporta-en-las-ultimas-24-horas-1-mil-257-nuevos-casos-de-covid-19/,"Por Luis Hernández | Este viernes, el Ministerio de Salud Pública y Asistencia Social (MSPAS) reporta en las últimas 24 horas, en Guatemala, 1 mil 257 nuevos casos de COVID-19 y 18 fallecidos registra",07-05-2021 21:39,https://www.bing.com/th?id=OVFT.dPSNRG7hks1apF7mFWHr5C,Guatemala,Stereo 100
Realizan operativos para prevenir accidentes y verificar protocolos de bioseguridad,https://www.deguate.com/artman/publish/noticias-guatemala/Realizan-operativos-para-prevenir-accidentes-y-verificar-protocolos-de-bioseguridad.shtml,"Para prevenir accidentes y verificar que los pilotos del transporte público  cumplan con las medidas de bioseguridad establecidas para evitar contagios de Covid-19, personal de la Dirección General de",07-05-2021 22:02,https://www.bing.com/th?id=OVFT.4nSgGL39Q-ornSdU9hzbvi,Guatemala,De Guate
Henkel presenta un fuerte comienzo del año 2021,https://newsinamerica.com/pdcc/economia/2021/henkel-presenta-un-fuerte-comienzo-del-ano-2021/,"Amplia cobertura que brinda a nuestros lectores la información que necesitan para estar actualizados del acontecer centroamericano, caribeño y latinoamericano.",08-05-2021 04:24,https://www.bing.com/th?id=OVFT.yHWb3pgyQUMr_fskolmhoS,Guatemala,Periódico Digital Centroamericano y del Caribe
CUM apoyará como centro de vacunación contra Covid 19 por 4 meses,https://www.chapintv.com/noticia/cum-apoyara-como-centro-de-vacunacion-contra-covid-19-por-4-meses/,"El Ministerio de Salud Pública y Asistencia Social y las autoridades de la Universidad de San Carlos de Guatemala, inauguraron el centro de vacunación instalado en el Centro Universitario Metropolitan",08-05-2021 04:49,https://www.bing.com/th?id=OVFT.XM-biymFZWrkFhKCcZvQbS,Guatemala,Chapin TV
Guatemala jugará en Lituania su quinto mundial de futsal y busca el título del Premundial,https://stereo100.com.gt/2021/guatemala-jugara-en-lituania-su-quinto-mundial-de-futsal-y-busca-el-titulo-del-premundial/,"Por Herberth Tax. La Selección Nacional de Futsal de Guatemala consiguió está noche clasificar por quinta ocasión a un mundial. A partir del 12 de septiembre, Guatemala será parte de los 24 países que",08-05-2021 04:53,https://www.bing.com/th?id=OVFT.VafLBTq-mmz8_jZrgRTGKC,Guatemala,Stereo 100
"Coronavirus: “Pruebas solo si tuvo contacto con positivo”, dice la ministra de Salud",https://www.guatevision.com/nacionales/coronavirus-pruebas-solo-si-tuvo-contacto-con-positivo-dice-la-ministra-de-salud,"La ministra Flores recomendó que se busquen pruebas para detectar el coronavirus solo si las personas tienen síntomas, estuvieron en contacto con un positivo o si no usaron mascarilla.",08-05-2021 08:02,https://www.bing.com/th?id=OVFT.m42uuyjaeCbjgKawr2Iwky,Guatemala,Guatevision
Estudiantes y colectivos manifiestan en el Obelisco,https://crnnoticias.com/estudiantes-y-colectivos-manifiestan-en-el-obelisco/,Los estudiantes convocaron para mostrar el rechazo al presidente Alejandro Giammattei por el manejo de la pandemia del COVID-19.,08-05-2021 18:53,https://www.bing.com/th?id=OVFT.x0ji9V-dO0X9kVbN3_BvMS,Guatemala,CRN Noticias
Guatemala peleará por el tercer lugar del Campeonato de Concacaf de Futsal 2021,https://www.guatemala.com/deportes/futsala/guatemala-peleara-por-el-tercer-lugar-del-campeonato-de-concacaf-de-futsal-2021.html,"Guatemala peleará por el tercer lugar del Campeonato de Concacaf de Futsal 2021, luego de un reñido encuentro con la selección de Estados Unidos.",09-05-2021 03:46,https://www.bing.com/th?id=OVFT.aCDZX8sevczPo8V20Mqyzy,Guatemala,Guatemala
Guatemala tiene 215 casos nuevos de coronavirus y 16 fallecidos más,https://www.prensalibre.com/ahora/guatemala/comunitario/guatemala-tiene-215-casos-nuevos-de-coronavirus-y-16-fallecidos-mas/,"El Ministerio de Salud reporta 1 mil 947 pruebas para detectar covid-19 procesadas en las últimas 24 horas, de las que resultaron positivas 215 personas. Además, hay 16 fallecidos de fechas",09-05-2021 23:18,https://www.bing.com/th?id=OVFT.sbT6ymPTFUfdVBX7hLTwgC,Guatemala,Prensa Libre
Vacunación en Guatemala está casi al mismo nivel que el de Afganistán y Venezuela,https://elperiodico.com.gt/nacionales/2021/05/09/vacunacion-en-guatemala-esta-casi-al-mismo-nivel-que-el-de-afganistan-y-venezuela/,El Ministerio de Salud Pública y Asistencia Social (MSPAS) decidió suspender durante el fin de semana las jornadas de inmunización contra el COVID-19.,10-05-2021 03:02,https://www.bing.com/th?id=OVFT.96KxCy8RqYBsCLbsKhnrSy,Guatemala,El Periódico Guatemala
Adulto Mayor residente de asilo de SOSEP muere a causa del Covid-19,https://lahora.gt/adulto-mayor-residente-de-asilo-de-sosep-muere-a-causa-del-covid-19/,POR REDACCIÓN LA HORA lahora@lahora.com.gt La Secretaría de Obras Sociales de la Esposa del Presidente (SOSEP) informó del fallecimiento de un adulto mayor residente del Centro de Atención Permanente,10-05-2021 13:01,https://www.bing.com/th?id=OVFT.E3eOJVbSrWhewpSHK-WbOS,Guatemala,La Hora
"UNICEF, con apoyo de Japón, entrega cuatro sistemas de agua en Campur",https://radiotgw.gob.gt/unicef-con-apoyo-de-japon-entrega-cuatro-sistemas-de-agua-en-campur/,"TGW Digital – Campur, Alta Verapaz,una de las áreas más afectadas por el paso de los huracanes Eta e Iota, recibió del Fondo de las Naciones Unidas para la Infancia (UNICEF), junto a su",10-05-2021 15:17,https://www.bing.com/th?id=OVFT.afMwyI_uygr51OK9ZDYXxS,Guatemala,TGW
Adultos mayores de 70 años podrán ir a vacunarse contra el covid-19 sin haberse registrado o sin tener cita confirmada,https://www.prensalibre.com/guatemala/comunitario/adultos-mayores-de-70-anos-podran-ir-a-vacunarse-contra-el-covid-19-sin-haberse-registrado-o-sin-tener-cita-confirmada-breaking/,"Según el Ministerio de Salud, los adultos mayores de 70 años que no se han registrado pueden hacerlo en los centros de vacunación y recibir su dosis de una vez.",10-05-2021 16:41,https://www.bing.com/th?id=OVFT.h1Q5YduX7XiEqphRQ3foGi,Guatemala,Prensa Libre
Continúa la vacunación móvil y peatonal contra el Covid-19,https://www.chapintv.com/noticia/continua-la-vacunacion-movil-y-peatonal-contra-el-covid-19/,"En la capital continúa el proceso de vacunación en los diversos centros habilitados, como el ubicado en la Universidad San Carlos de Guatemala, donde puede ser inoculado a bordo de su vehículo.",10-05-2021 16:57,https://www.bing.com/th?id=OVFT.nz3hJb6lRr2Kvz8pnuxpMS,Guatemala,Chapin TV
Centro de vacunación en Explanada Cayalá prevé atender mil personas diarias,https://lahora.gt/centro-de-vacunacion-en-explanada-cayala-preve-atender-mil-personas-diarias/,"Con el propósito de agilizar la vacunación contra el Covid-19, el Ministerio de Salud Pública y Asistencia Social (MSPAS) ha habilitado puestos de inmunización en diversos sectores de Ciudad de Guatemala, algunos de ellos con apoyo de la iniciativa ...",10-05-2021 17:00,https://www.bing.com/th?id=OVFT.JslrfmBn3xp3Io5Pg9uMJC,Guatemala,La Hora
La OMS clasifica la variante descubierta en India como “preocupante”,https://elperiodico.com.gt/noticias/internacionales/2021/05/10/la-oms-clasifica-la-variante-descubierta-en-india-como-preocupante/,Responsable de la OMS declaró que informes indican que la B.1.617 es más contagiosa y que existen indicios de que tiene un grado de resistencia a las vacunas.,10-05-2021 18:11,https://www.bing.com/th?id=OVFT.Sv3foZLRFZ-7Mas7j_yEPS,Guatemala,El Periódico Guatemala
