name,url,description,datePublished,imagen,pais,Fuente
Guatemaltecos varados en EE. UU. retornaron al país,https://newsinamerica.com/pdcc/otrasnoticias/2020/guatemaltecos-varados-en-ee-uu-retornaron-al-pais,Guatemala. El Ministerio de Relaciones Exteriores (MINEX) informa que ayer por la noche retornaron al país 170 guatemaltecos que habían quedado varados en Estados Unidos tras el cierre de las comunica,02-07-2020 01:51,https://www.bing.com/th?id=ON.6A5C8FD1C0E1ABAC00CA5DA524EA0EF9,Guatemala,Periódico Digital Centroamericano y del Caribe
Volaris realiza vuelo humanitario de rescate de guatemaltecos varados en Estados Unidos,https://newsinamerica.com/pdcc/boletin/2020/volaris-realiza-vuelo-humanitario-de-rescate-de-guatemaltecos-varados-en-estados-unidos,"Volaris Costa Rica, la aerolínea de ultra bajo costo que opera en Centroamérica, México y Estados Unidos, en coordinación con el Gobierno de Guatemala, realizó ayer por la tarde un vuelo humanitario d",02-07-2020 01:51,https://www.bing.com/th?id=ON.226720FE5B4311583685C53D290F579E,Guatemala,Periódico Digital Centroamericano y del Caribe
Sube cifra de contagios de coronavirus en Guatemala a 915 nuevos casos y se reporta una bebé entre los 44 fallecidos,https://www.guatevision.com/nacionales/sube-cifra-de-contagios-de-coronavirus-en-guatemala-a-915-nuevos-casos-y-se-reporta-una-bebe-entre-los-44-fallecidos,"Después de varios días con una tendencia de menos casos de coronavirus, las autoridades de Salud reportaron un incremento de contagios. El reporte diario de casos de coronavirus registra 915 nuevos co",02-07-2020 05:05,https://www.bing.com/th?id=ON.DB7912773A7CF68E7256FF31717DBCA1,Guatemala,Guatevision
COVID-19 avanza en EE. UU. y Brasil,https://elperiodico.com.gt/mundo/2020/07/02/covid-19-avanza-en-ee-uu-y-brasil/,"La Organización Mundial de la Salud (OMS) advirtió ayer que la pandemia de coronavirus sigue acelerándose, con una nueva ola de infecciones en Estados Unidos y su avance en Brasil, donde se superó la",02-07-2020 07:09,https://www.bing.com/th?id=ON.5322E8A67E9FE7D4AFADF375721A1FBE,Guatemala,El Periódico Guatemala
Casos de COVID-19 llegan a 19 mil tras reportarse 915 nuevos contagios,https://lahora.gt/casos-de-covid-19-llegan-a-19-mil-tras-reportarse-915-nuevos-contagios/,"El Ministerio de Salud Pública y Asistencia Social (MSPAS) informó hoy que los casos de COVID-19 llegaron a 19 mil 011, luego de que ayer se registraron un total de 915 nuevos casos positivos de la en",02-07-2020 14:58,https://www.bing.com/th?id=ON.0EB7B068B3A57780C32CF378AE1D28FF,Guatemala,La Hora
Estos son los municipios que cuentan con más casos positivos de coronavirus,https://crnnoticias.com/covid-19-piden-cordones-sanitarios-municipios-con-mas-contagios/,"Los departamentos de Guatemala y Escuintla tienen a cinco municipios con la mayor cantidad de contagios de COVID-19, de acuerdo a los datos que el Ministerio de Salud Pública y Asistencia Social -MSPA",02-07-2020 16:32,https://www.bing.com/th?id=ON.F0CDF3DA93DD7F7812CFEA0E6CF4A70D,Guatemala,CRN Noticias
Coronavirus: autoridades de Salud advierten de que las muertes podrían sumar más de 12 mil en septiembre si se levantan medidas,https://www.guatevision.com/nacionales/coronavirus-autoridades-de-salud-advierten-de-que-las-muertes-podrian-sumar-mas-de-12-mil-en-septiembre-si-se-levantan-medidas-breaking,"En conferencia de prensa, autoridades de Salud dijeron este miércoles que si se levantan las restricciones para frenar el covid-19 las víctimas mortales podrían llegar a 12 mil en septiembre. “Si quit",02-07-2020 18:26,https://www.bing.com/th?id=ON.02047EB5AC24850F90CC1E3FD4465B65,Guatemala,Guatevision
Retornan 170 guatemaltecos desde Estados Unidos,https://radiotgw.gob.gt/retornan-170-guatemaltecos-desde-estados-unidos/,TGW Digital – El Ministerio de Relaciones Exteriores (MINEX) informa que ayer por la noche retornaron al país 170 guatemaltecos que habían quedado varados en Estados Unidos tras el cierre de las comun,02-07-2020 18:53,https://www.bing.com/th?id=ON.9647D56365C7A285C9BA3D5BBD5E029D,Guatemala,TGW
Gobierno de Guatemala entrega al sector Agro medidas temporales para la prevención y control del COVID-19,https://radiotgw.gob.gt/gobierno-de-guatemala-entrega-al-sector-agro-medidas-temporales-para-la-prevencion-y-control-del-covid-19/,"TGW Digital – El Gobierno de Guatemala entrega este día, al sector Agro, las disposiciones de las medidas temporales para la prevención y control del COVID-19 en el sector agropecuario. El protocolo s",02-07-2020 20:48,https://www.bing.com/th?id=ON.137590592A17798CBDC94CC3674F25E5,Guatemala,TGW
"Italika donó motoneta, cajuelas, cascos y servicio mecánico a Chicas a Bordo",https://www.guatemala.com/noticias/sociedad/italika-dono-motoneta-cajuelas-cascos-servicio-mecanico-chicas-a-bordo.html,"Italika donó una motoneta, 4 cajuelas, 4 cascos y el servicio mecánico al emprendimiento Chicas a Bordo de la Antigua Guatemala. ¡Qué buena acción! Ante la emergencia del Coronavirus —COVID-19— un gru",02-07-2020 21:21,https://www.bing.com/th?id=ON.3C3F1A3282EF61C501348B68BAF75E83,Guatemala,Guatemala
"Guayaquil, un ejemplo de cómo vencer al coronavirus",https://republica.gt/2020/07/02/guayaquil-un-ejemplo-de-como-vencer-al-coronavirus/,"Guayaquil, en Ecuador, estuvo sometido durante más de un mes a un brote de coronavirus Covid-19 como no se vio en otra ciudad. Las imágenes de personas fallecidas, abandonadas en las calles, le dieron",02-07-2020 22:51,https://www.bing.com/th?id=ON.7E0C2AB5C1FE0B44ED267C6674D21EF2,Guatemala,Republica
Guatemala supera los 20 mil casos del nuevo coronavirus con 843 muertos,https://elperiodico.com.gt/nacion/2020/07/02/guatemala-supera-los-20-mil-casos-del-nuevo-coronavirus-con-843-muertos/,"Guatemala superó este jueves los 20.000 casos de coronavirus, tras registrar un millar de contagios en 24 horas, en tanto el número de muertos supera los 800 desde el inicio de la pandemia, informó el",02-07-2020 23:09,https://www.bing.com/th?id=ON.C23AF1F643598B246A3B6E4F71F5929F,Guatemala,El Periódico Guatemala
Qué son las escafandras y cómo ayudan a recuperar pacientes con Covid,https://republica.gt/2020/07/02/escafandras-ayudan-a-recuperar-pacientes-con-covid/,"En Guatemala se está poniendo en práctica el uso de escafandras para pacientes con Covid-19 que requieren oxígeno pero, qué son y cómo ayudan a la recuperación. Una escafandra es la parte superior de",02-07-2020 23:13,https://www.bing.com/th?id=ON.619856DF438B4F51483AA0C2C05FF947,Guatemala,Republica
Verificamos por usted: ¿Deberían agregarse pruebas olfativas para diagnosticar la covid-19?,https://www.prensalibre.com/pl-plus/guatemala/comunitario/verificamos-por-usted-deberian-agregarse-pruebas-olfativas-para-diagnosticar-la-covid-19/,"Algunos de los síntomas de una persona infectada son tos, fiebre y la pérdida de olfato y gusto, por lo que surgieron dudas de si también debería agregarse una prueba olfativa, como oler café o un alg",02-07-2020 23:18,https://www.bing.com/th?id=ON.C5DE8C111058F7B837226CAA29C1EDB4,Guatemala,Prensa Libre
Histórico café en Xela cierra sus puertas por la crisis generada por el COVID-19,https://stereo100.com.gt/historico-cafe-en-xela-cierra-sus-puertas-por-la-crisis-generada-por-el-covid-19/,"La empresa quetzalteca Baviera Café informó, en sus cuentas en redes sociales, que luego de 14 años de servicio cierran la sucursal Café Baviera Jardín, ubicada en la 22 avenida, zona 3 de Xela. El ci",02-07-2020 23:49,https://www.bing.com/th?id=ON.76B30DEBB788C94EA2D61B3174556627,Guatemala,Stereo 100
Guatemala registra en un día más de mil casos de COVID-19,https://stereo100.com.gt/guatemala-registra-en-un-dia-mas-de-mil-casos-de-covid-19/,"Este jueves, el Ministerio de Salud Pública y Asistencia Social (MSPAS) reportó 1 mil 061 casos positivos del nuevo coronavirus COVID-19, 26 fallecidos y 48 recuperados. De acuerdo a la estadística pu",02-07-2020 23:49,https://www.bing.com/th?id=ON.17B68A3CD0F03BA132DA4E95DAB89A3B,Guatemala,Stereo 100
Campaña “Pequeños Gigantes” promueve las compras en las tiendas de barrio,https://elmetropolitano.com.gt/es/2020/07/02/campana-pequenos-gigantes-promueve-las-compras-en-las-tiendas-de-barrio/,"Con el fin de promover que los guatemaltecos se queden en sus casas y eviten lugares que concentren aglomeración de personas, las tiendas de barrio, las abarroterías y los minisúper, se convierten en",02-07-2020 23:57,https://www.bing.com/th?id=ON.8C74006A03EE2B36A3C2939179A77886,Guatemala,El Metropolitano
"Guatemala supera los 20 mil casos de COVID-19, 1061 se reportaron ayer",https://lahora.gt/guatemala-supera-los-20-mil-casos-de-covid-19-1061-se-reportaron-ayer/,"El Ministerio de Salud Pública y Asistencia Social (MSPAS), confirmó esta tarde que al miércoles 1 de julio a las 23:59 horas, se registraron 1 mil 061 casos nuevos de COVID-19, en el país. Con esa ci",02-07-2020 23:59,https://www.bing.com/th?id=ON.7EF881FD82CE22FBCE9CE8FCFD71EC86,Guatemala,La Hora
Google abre convocatoria para guatemaltecos en los Premios de Investigación para América Latina,https://www.guatemala.com/noticias/sociedad/google-convocatoria-guatemaltecos-premios-investigacion-america-latina.html,Google abre convocatoria para que guatemaltecos puedan inscribirse con proyectos o investigaciones en la octava edición de los premios LARA. Debido al panorama actual y con el objetivo de ofrecer más,03-07-2020 00:21,https://www.bing.com/th?id=ON.F61DB57CD0CB6E8E75F57F72013DB5FE,Guatemala,Guatemala
"Pacientes sin coronavirus se contagian al llegar al hospital, señalan médicos del Roosevelt",https://www.prensalibre.com/guatemala/comunitario/pacientes-sin-coronavirus-se-contagian-al-llegar-al-hospital-senalan-medicos-del-roosevelt/,"Los médicos de ese centro hospitalario dieron una conferencia de prensa para pedir a las autoridades ampliar los lugares destinados para casos de coronavirus, como el Parque de la Industria. “Quisiera",03-07-2020 03:16,https://www.bing.com/th?id=ON.295023021174F2DF61E31B881EC68F88,Guatemala,Prensa Libre
